,src,trg
435,honestly motivational do not move me,boikutlo ka botshepehi ha bo ntsamaisa
436,i need some of those motivational from today today is just one of those why am i even here day is,ke hloka ho ba le tšusumetso e itseng ho tloha kajeno kajeno ke e 'ngoe ea tseo ka hona ke leng kateng le mona kajeno ke kajeno
437,be real confuse the out of me when u post like multiple of the same fit or thin person with something motivational and it s not u,eba le 'nete ho tsoa ho' na ha u romellana joalo ka bongata bo lekanang kapa motho ea tšesaane ea ho etsa hore ho be le tšusumetso le ho se joalo
438,it is motivational happy if the people you admire the most continue to put you down because of you going after your dream career just use their negativity to fuel yourself to succeed at that dream prove'em wrong  is u take care,hoa khothatsa haeba batho bao u ba ratang ba tsoele pele ho u beha fatše ka mor'a hore u tsebe ho ipeha kotsing ea hore o fositse
439,the girl i ever knew the daily short motivational life of hope change and renewal are brought to you by don macrae is new and folk on lead available don,ngoanana eo ke kileng oa tseba bophelo bo bobe ba letsatsi le letsatsi ea tšepo ea tšepo ea ho fetola le ho nchafatsoa ho u tlisoa
440,those the way you beg him to communicate during a difficult time sending him cute motivational he all that and he that he how you feel about him but he is always going to put himself first and push you away,ka tsela eo a mo rapelang ka tsela ea hore a bue ka nako e thata ho mo lebisa tšusumetsong eo e leng tšusumetso e ntle le ea hore u ikutloe u le ka pele 'me u u sutumelletsa pele
441,half way through it everyone to make the team work,halofo ea eona ho e mong le e mong ho etsa mosebetsi oa sehlopha
442,change is never easy but it s always worth it when we make the decision to change for the better we open up a world of,phetoho ha ho bonolo hore e lule e le bonolo empa e lula e le bohlokoa ha re etsa qeto ea ho fetola moo re ileng ra bula lefatše la
443,motivational join us in a few for some good family catch up,matlafatso o kopane le rona ho ba 'maloa bakeng sa ba bang ba lelapa le letle
444,when you keep it will make easier and if you continue to quit you will become a professional quitter,ha u boloka e tla ba bonolo 'me haeba u tsoela pele ho tlohela u tla ba ea ho sitisoa ke ngaka
445,have a look at this beneficial saying,ho sheba polelo ena e molemo
446,countless lots of caffeine questionable office motivational t shirt and that s a wrap for our new,moruo o se nang palo ea caffeine e nang le sepheo sa ho tseba hore o na le paro
447,is this not the motivational speaker girl who was like different of,na see ha se ngoanana ea khothatsang ea neng a le joalo ka phapang
448,spence high performance motivational speaker a leader and authority in the field of personal development and high performance,specor concence perfent profertivational sebui le bolaoli lebaleng la nts'etsopele ea motho le ts'ebetso e phahameng
449,then switch as a motivational coach not a defender,ebe u chencha e le mokoetlisi ea susumetsang eseng mosireletsi
450,if you want to grow you need to get over any fear you have of making c maxwell,haeba u batla ho hola u hloka ho fumana tšabo efe kapa efe eo u nang le eona ea ho etsa c maxwell
451,very inspirational very motivational,khothatso e khothalletsang haholo
452,motivational speaker don drop 'coat' na to wear am remain,sebui se khothatsang don drow 'na ho roala mpa
453,moral of the story never give up happy motivational visit,boitšoaro ba pale ha bo felle etela leeto le thabisang
454,i d say light on motivational talk on real talk and on information,ke lle ho bua puo e khothatsang ka puo ea 'nete le tlhaiso-leseling
455,yesterday today tomorrow digital wall art printable art home studio office motivational wall print,maobane kajeno art prolivi's archinable artivality office office ofction
456,day motivational today you are you that is truer than true there is no one alive who is than you,letsatsi leo u susumetsang kajeno u lona ke 'nete ho feta kamoo ho seng motho ea phelang ho feta uena
457,nothing is motivational than s song at workout,ha ho na letho le susumetsang ho feta pina ea ho ikoetlisa
458,my main superpower is my when i was down and thinking what have i done he always came to tell me the reason i mixed in with a sprinkle of laughter my second power would have to be my motivational daily calendar don t worry you got this,ke ne ke lula ke nahana hore ke eng le ho nahana hore ke ne ke etsa joang hore ke be le litšeho tsa ka tsa bobeli tsa letsatsi le letsatsi.
459,great kick in the ass for this beautiful,great dick ho esele bakeng sa sena se setle
460,this is what when think they are motivational truth and civil they can t fix their own screwed up so they try to tell everyone else how to fix their once these get a gun it s berserk,sena ke sa sena ha se nahana hore ke 'nete e tsotehang' me sechaba se ka lokisetsa motho e mong le e mong hore na ba ka lokisa joang ha ba fumana sethunya
461,i get a motivational quote sent to me every single morning good to know somebody that i need a little motivation sometimes too,ke fumana mantsoe a susumetsang a romelletsoeng ho nna hoseng ho hong le ho hong ho monate ho tseba motho eo ke hlokang tšusumetso e nyane ka linako tse ling hape
462,i my phone to type a motivational message while my dog run around and he came back with a football i t buy him a football and we don t have,ke fono ea ka ho thaepa molaetsa o susumetsang ha ntja ea ka e ntse e tsamaea le bolo ea maoto ke ile ka khutla
463,check out motivational let is grind out some more dubs on the island days,hlahloba hore ho ke ke ha e-ba le lisulu tse ling tse ling matsatsing a sehlekehleke
464,_aquino mark done a great work some of the written are really very good you can connect with it a big time but the subtle art was the best motivational book i that more than this,_aquino mareka a etsa mosebetsi o moholo o mong oa se ngotsoeng o hantle o ka hoo o ka hokahanang le eona nako e kholo empa e ne e le buka e bohlale ho feta ena
465,when you are passionate about something it in your work you are willing to go the extra mile and put in the extra because you love what you are doing stay determined to do what you truly want,ha o rata ho hong ka ho ntho e 'ngoe eo u ikemiselitseng ho e etsa' me u behelle ka ho eketsehileng hobane u rata seo u se batlang ho etsa seo u se batlang
466,for this motivational we to show our ram fam appreciation and say thank you what an amazing season we are so far call or click today for your free on your next project s ram pa,bakeng sa tšusumetso ena re tla bonts'a kananelo ea bophelo ba rona mme re re kea leboha hore na ke nako e makatsang hakae bakeng sa morero oa hau o latelang
467,when you have a dream you got to grab it and never let go,ha u na le toro eo u lokelang ho e etsa 'me u se ke ua tlohela
468,is the best motivational presentation via,ke tlhahiso e ntle ka ho fetisisa e ka ho fetisisa ka
469,you don t always win but every time you lose you get better,u lula u hlola ka linako tsohle ha u lahleheloa ke ho phela hantle
470,the bad news is time the good news is you re the pilot,litaba tse mpe ke nako ea litaba tse monate ke hore u mofofisi
471,might be the platform i have ever tried to use after posting a motivational post instead of murder or human like happily do,e kanna eaba sethala seo ke kileng ka leka ho se sebelisa kamora ho beha poso e khothatsang sebakeng sa polao kapa motho joalo ka thabo
472,happy motivational one soccer be quick on your and register for summer soccer camp,boithati bo monate ba boloi bo le bong bo potlaka ho ba hau le ho ingolisa kampong ea bolo ea maoto ea lehlabula
473,today at from now we will be airing our motivational loop hope you can join us only on radio,kajeno ho tloha joale re tla be re le moea oa ho boloka sepheo sa rona o na le tšepo ea hore o ka ikopanya le rona feela seea-le-moea
474,there is always room at the top webster former u s secretary of state via,kamehla ho na le sebaka ka kamoreng e holimo ea webster ea pele u na le mongoli oa naha ka
475,motivational no need to worry endlessly there is a plan in place,khothatso ha ho hlokahale hore ho tšoenyehe ka ho sa feleng ho na le leano sebakeng
476,our business in the spotlight is shelly l of walking in purpose author motivational speaker her special offer is a free copy of her e book the fragile heart with code you can visit her at,khoebo ea rona sebakeng seo ke shelly l oa ho tsamaea ka lebaka la sebui se ikhethang sa morero ke kopi ea hae ea mahala e nang le khopolo eo u ka mo etelang
477,if you are in right then every of hit you like motivational speech,haeba u le ka nako eo u leng ka nako eohle ea u otlang joalo ka puo e khothatsang
478,the more discipline the more action the more what of your life could use more discipline,tse bohlokoa haholo ketso e khabane le ho feta ea bophelo ba hau e ka sebelisa taeo e ngata
479,do not settle for average bring your best to the moment then whether it or at least you know you gave all you had,se ke oa lula bakeng sa kakaretso ho tlisa se molemohali ho fihlela motsotso joale hore na ho na le bonyane kapa bonyane u tseba hore u kile oa ba le sohle seo u nang le sona
480,individual me super cute me goes individual can you speak at x conference as our keynote motivational speaker me you had my yes with just the,o ka 'na oa' na oa 'na o ka bua ka motho ka mong le ea mong ka ho x seboka sa rona sa hore sebui sa rona sa sehlooho seo u se entseng hore ke ee
481,financial will not just make you sad but also poor,lichelete li ke ke tsa u utloisa bohloko feela empa li futsanehile hape
482,is known for her luminously colored and of natural she is an artist and a popular motivational speaker listen to her here,o tsejoa ka 'mala oa hae o bonolo le oa tlhaho ke sebini le sebui se tsebahalang se tummeng mona
483,_inks all day everyday back when i was living in an abusive situation their music gave me the power to overcome my suicidal and thanks to them i am alive you want motivational music,_inks letsatsi lohle ke morao ha ke ne ke lula boemong bo hlekefetsang 'mino oa bona o ile oa mpha matla a ho ipolaea ka bona ke phela' mino o lerato
484,please join us for our event evidence based motivational mi for front line direct taking place august from am we look forward to hosting you,ka kopo ikopanye le rona bakeng sa bopaki ba boemo ba rona bo thehiloeng tšusumetsong m bakeng sa mohala o ka pele ho ho amohela
485,what is your favorite motivational quote,motheo oa hau o ratoang ke eng
486,beautiful,e ntle
487,let is hear it for motivational,a e utloe ke ho susumetsoa
488,motivational starting and sticking with is a difficult task but not impossible what new habit will you start today and what will you use to make sure it,mothati o hohola le ho khomarela ka mosebetsi o boima empa o sa khonehe seo u tla se sebelisa kajeno le u tla sebelisa eng ho etsa bonnete ba hore
489,share your and with your penis fortune,abelana le uena le ka li-penis tsa hau tsa botone
490,respect the consistency motivational,hlompha motheo oa consistecy
491,motivational go outside take a walk for no no music look at the sky,khothatso e ea kantle ho ho tsamaea ka maoto ha ho na 'mino oa' mino leholimong
492,motivational at the revelation collective check out the revelation collective at artist unknown follow to learn how you can positively influence culture through creativity,motivational ho tshenolo boxit hlahloba kutlokono e kopaneng ea setsebi se sa tsebeng ho ithuta hore na u ka susumetsa joang moetlo ka boqapi
493,worked with clarion for and their customer service is greatly h thank you for another star review what a motivational way to start a new week happy,o sebelitse le ho hlasimolla le ts'ebeletso ea bona ea bareki e bohlokoa haholo hore ke hlahlojoe tsela eo e lokelang ho qala beke e ncha
494,there must be a special place in for all people who have in this government to repent however clean and motivational they come themselves in the public eye have all to this junta,e tlameha ebe ho na le sebaka se khethehileng ho batho bohle ba nang le 'musong ona o hloekileng le ba khothatsang ba tla senyeha ka mahlo ana kaofela
495,we hope everyone is a positive and productive we just to remind you that you are a lot closer to your than you think,re tšepa hore bohle ba ba le pono e nepahetseng le e behang re tla u hopotsa hore o haufi haholo ho feta kamoo u nahanang
496,much motivation,khothatso e meholo
497,floor is always open ur motivational,fatše e lula e bula botle ba ur
498,plantain boy don hustle get money him wan turn motivational speaker against him former,planain bon don roust
499,if you like no hustle dey follow motivational speaker,haeba u rata ho hlorisa litšila tsa moea o latelang sebui
500,nothing is a test instead of coming up with a motivational post myself i decided to share a take away i got from a book yesterday the story in the book with a man looking to become a samurai warrior so he goes to study the craft from,ha ho na thuso ho e-na le ho qala ka poso eo ke ileng ka etsa qeto ea ho ba le mohlaleng maobane o batla ho ba mohlahlami oa samura ea tsoang ho
501,book your first session today at libra fitness club contact number,book karolo ea hau ea pele kajeno ho the fitness club club club club
502,motivational s the difference maker harry harry the the difference maker in how we should be doing _,moferefere oa phapang harry harry harry moferefere oa liphapang mabapi le hore na re lokela ho etsa _
503,taking this thing a whole new direction and all my social to focus on a new venture around minute motivational here is the first video please like and share your,ho nka ntho ena tataiso e ncha le boikemisetso bohle ba ka ho tsepamisa mohopolo o mocha ho potoloha ka motsotso ona ke video ea pele ka kopo
504,and the control are the you live by actual and religious cultural morals for a very importantly the of the if you carry motivational on your or non,le taolo ke uena ea phelang ka melao ea sebele le ea bolumeli bakeng sa ho ba teng haeba u tsamaisana le tšusumetso ho uena kapa ho se be teng
505,but if you have a propeller without a control you will crash every passenger to their demise the engine is like from whoever or whatever or even yourself but let is just say motivational,empa haeba o na le phaello ntle le taolo eo o tla o roba mopalami oa bona
506,i love he is so thoughtful he a lot he always his best to greet us and give motivational message,kea rata o nahanela haholo ke eena kamehla o lula a re lumelisa le ho fana ka molaetsa o susumetsang
507,motivational our now,ba ithapha bophelo hona joale
508,we love when motivational math in built into like this,rea rata ha boithati ba math a hahiloe joalo ka sena
509,happy motivational i can do it just watch me never give up on your keep working at it and make them happen,monyaka o monate ke ka e etsa feela ke shebelle feela hore ke se ke ka inehela ho eona hore e lule e sebetsa ho eona ebe e etsa hore li etsahale
510,true power of love s a book of poetic about the by that were beyond the reach of human action and natural an inspirational and motivational read,'nete ea lerato la ho rata thothokiso mabapi le seo se neng se ke ke sa khona ho fumana ketso le ho baloa le ho baloa le khothatso e khothatsang le e khothatsang
511,epic motivational on repeat subscribe for more,epivational epivational mabapi le ngolisa bakeng sa tse ling
512,this granny who s college baseball coach put the red deep into my gene pool needs with them to kick their give a motivational speech,thaba ena ea kholo ea s cole ea baseball e beha sekhukhu bo bofubelu ho letamo la ka la morabe le litlhoko tsa bona ho raha puo e khothatsang
513,motivational some,ba bang
514,when she s on this level the group chat usually the old school type motivational now i m,"ha a bua ka boemo bona, puisano ea sehlopha hangata ea mofuta oa sekolo sa khale sa sekolo hona joale ke m"
515,you have got to get up every morning with determination if you are going to go to bed with satisfaction,u tlameha ho tsoha hoseng ho hong le ho hong ka boikemisetso haeba u ka robala ka khotso
516,fairy tales are more than true not because they tell us that exist but because they tell us that can be beaten,li-tale tse ntle ha li na 'nete eseng hobane li re bolella seo empa hobane li re bolella se ka otloa
517,taking inspiration from motivational beef and is himself first self most video bare me tha love you for this,ho itšusumelletsa ho tsoa nama ea nama ea khomo e susumetsang 'me ke ka boeena video ea ka ntle ho moo ke e ratang bakeng sa sena
518,i normally despise the motivational with text however this one a certain ne is this what inspiration like,ke tloaetse ho nyatsa ho susumetsoa ke mongolo leha ho le joalo enoa ke ena e reng
519,can we talk about young people is addiction to motivational,a na re ka bua ka bacha ba lemalilla maikutlo
520,learn to learn and life will be joyful and wow that a bit motivational sorry about that must be the heat,ithute ho ithuta le ho phela ka thabo le ho o hlaba hore o masoabi ka seo e tla ba mocheso
521,good morning happy motivational if today you find yourself in slump or a case of the i want to find the key to unlock your inner strength use it and unleash that strength to get you through the day stay calm washed,hoseng hantle ho monate
522,happy motivational success is the sum of small repeated day in and day out,katleho e thabisang e thabisang ke kakaretso ea letsatsi le lenyane le phetoang ka nako le letsatsi kantle
523,it was an honor to introduce state representative at the stonewall caucus during thank you rep for your motivational speech,e ne e le tlotla ea ho hlahisa moemeli oa naha ka caucus ea stonewall nakong ea kea leboha ka puo ea hau e khothatsang
524,being strong when everyone else is weak is a must got to hold it all together,ho ba matla ha motho e mong le e mong a fokola ke a tlameha ho e tšoara kaofela
525,i want to be like those that post and include motivational that no sense or have any relation to their example when you say yes nobody can say no,ke batla ho tšoana le ba fanang ka poso le ho kenyelletsa tšusumetso ha ho na kelello kapa ho ba le kamano ea bona ha u re e teng
526,happy motivational if you want to be make a statement and mary,setlama se thabileng haeba u batla ho bua le maria
527,hao i was to be motivational speaker so zo your time will come be patient,hao ke ne ke lokela ho ba sebui sa maiketsetso hore se tla tla nako ea hau ea ho ba le mamello
528,go turn to motivational speaker wen money enter hand,e-ea fetohe ho sebui sa sebui sa maikutlo seb
529,nelson the need of out your particular to do anything and setting your aim to happen someday the phrase someday should be instead designate a date and time for yourself to complete a task and receive your,nelson hloka tlhoko ea hau ea ho etsa eng kapa eng ho etsa letho ka letsatsi le letsatsi polelo le nako ea ho phethela mosebetsi le ho amohela
530,who is this guy first his power of observation is so dope and throw in his accent and skill for wordplay and he is lit i have an idea forming here let is see he should be and his voice and used as a motivational program for,monna enoa ke mang pele matla a hae a ho hlokoa ke a e-na le ho ba le molumo oa hae le tsebo ea hae
531,when did bat turn motivational speaker see how election as humble ha i think the god of south west politics is all in all you have not seen anything yet the mother of all version is loading fast then you,bamber ba ile ba fetola sebui se susumetsang hore na ho ikokobelletsa ha ho ikokobelletsa ha ho na thuso
532,took took cheering and motivational squad to are cheered and on the while are on their own without any motivation on site so who very sad,ho chents'itsoe le ho khothatsoa ke sehlopha sa ho chesoa ke ho hlasimolohile le ha se le teng se le seng se le sieo ntle le tšusumetso ea sebaka seo e leng sona se utloisang bohloko haholo
533,leave your comfort zone leave your comfort zone motivational speaker don kill fish,siea sebaka sa hau sa matšeliso se tlohella sebui sa hau sa matšeliso se khothatsang sa sebaka seo u se ngotseng
534,__ this is one of my past times now insane motivational lean into the curve buddy,__ ena ke e 'ngoe ea linako tse fetileng hona joale tse nang le monko o monate ho tsoa ho buddy ea curve
535,fire one of the best motivational for to come out to,mollo o motenya o motle ka ho fetisisa oa ho tsoa
536,i listen to motivational all day everyday,ke mamela tšusumetso letsatsi lohle letsatsi le letsatsi
537,get more motivational and inspirational here,fumana tšusumetso e ngata ebile e khothatsa mona
538,need some motivation everyday decorate personalize water or stick this removable kiss cut vinyl stickers anywhere you like it is waterproof,hloka sepheo sa hau sa ho khathatsa letsatsi le leng le le leng
539,nothing could possibly ever me up as much as jay and his aggressively motivational like they are so,ha ho na letho le ka ntefilang haholo joaloka jay le matla a hae a mahlahahlaha joalo ka ha ba joalo
540,at all especially on he can not even post a motivational quote without getting dragged,ho hang haholo ne a ke ke a beha mantsoe a qotsitsoeng hantle ntle le ho huloa
541,motivational do not rate us at all,monyaka ha o re felle hohle
542,no motivational quote for us lot still going poor from you,ha ho qotsulo e khothatsang bakeng sa lota e ntse e tsoela pele ho tsoa ho uena
543,these motivation can not help anyone to find one time meal these motivational speaker already rich who do not support the under develop person to overcome the obstacle of the life just are not effective,khopolo ena e ke ke ea thusa mang kapa mang hore a fumane nako e le 'ngoe sebui sena sa maiketsetso se seng se ntse se ruile ba sa tšehetsang litšitiso tsa bophelo feela
544,a playful and short name that big of pleasure peace tranquility bliss to create a seamless alignment with your brand voice relevant for real estate and many more,lebitso le bapalang le le khuts'oanyane le leholo le leholo la khotso ka ho etsa chelete e telele le ho amana le lentsoe la hau la marang-rang le tse ling tse ling
545,smith motivational speaker and educator a fantastic keynote for engage,smith motivarial sebui le educator e ntle haholo ea ho ikoetlisa
546,you can not be messy and motivational at the same time,u ke ke ua ba le bohlanya le khothatso ka nako e le 'ngoe
547,the campus its last student achievement assembly for the academic year the motivational speaker for the day was the college of cape town alumni and magazine editor,kame ea ho qetela ea ho qetela ea baithuti ea ho qetela ea baithuti bakeng sa selemo se khothatsang bakeng sa letsatsi leo e ne e le koleche ea cape town alumni le ea makasine
548,that is why i do this motivational and often sometimes our simple can ignite their fire of passion inside and can help them push more further than to give up,ke ka hona ke etsang tšusumetso ena 'me ka linako tse ling re bonolo ho fumana mollo oa bona ka hare ebile o ka ba thusa ho feta ho inehela
549,motivational stuff,stuff stuff
550,had an episode last yr when a motivational speaker me for for just making a reaction video that too at a time when i quit a job that had kept me financially abundant for almost i have empathy for anyone going through such times it can be highly toxic,o ne a e-na le ketsahalo ea ho qetela yr e nkhothatsang hore ke etse video e itseng ka nako eo ke neng ke khaotsa motho ka lichelete ho ka ba le chefo e ngata haholo
551,_staffer what a motivational comment,_staffer ke maikutlo a susumetsang
552,some motivational for a,ba bang ba susumetsang
553,a happy motivational to you wishing you a wonderful week take care have fun and stay inspired,khothatso e thabileng ho u ke u ke u ke u ke u rata beng ketsahalo
554,yea this suppose to be winter temp in some saying that you will never fail as a motivational speaker looking at your profile have a go at that and you made us feel better now,"ee, sena se nka hore ho na le temp ea mariha ka ho bua hore ha u sa tla hlola u e-na le sebui se susumetsang hore u tsamaee"
555,motivational quote if you would persuade appeal to interest and not to reason benjamin franklin,quotivational quote haeba u ne u tla susumetsa ho ipiletsa ho thahasello mme se se ke oa beha ho besa benjamin franklin
556,thread of hot for ur motivational needs,khoele ea ho chesa litlhoko tsa ur
557,why do people act like working out is the most inspiring and motivational thing a person can do,hobaneng ha batho ba etsa joalo ka ho sebetsa ke ntho e khothatsang haholo le e susumetsang hore motho a ka etsa
558,music it is motivational and just you relax,'mino oa khothatsana ebile o phomola feela
559,your non motivational tweet for today pa,tweet ea hau e sa susumetsang bakeng sa kajeno pa
560,half gallon water bottle with straw and time marker free large motivational water limited time offer,halofo ea metsi ea metsi a halofo e nang le joang
561,off use code half gallon water bottle with straw and time marker free large motivational water,tlosa khoutu ea metsi a halofo ea metsi a halofo ea metsi le fensetere le nako ea nako ea nako e sa sebetseng hantle
562,you don t have any motivational push for me to keep going,ha u na le ho sutumetsa ho na le maikutlo bakeng sa hore ke tsoelepele
563,i need motivational speaker wey go dey dey whine me i do not mind,ke hloka sebui se khothatsang sa sebui sa boikhathollo se bitsoang desy dey o ile a nkopa ha ke na taba
564,information is better for workshop than keynote are often not set up for to take i want real talk but ending with some motivational or point,tlhahisoleseling e molemo bakeng sa mosebetsi ho feta keketso hangata ha e sa tla e nka ke batla puo ea 'nete empa e qetella e le tšusumetso kapa ntlha e itseng
