,src,trg
274,there was no time for a proper farewell everything had to happen very quickly and spontaneously i said 'guys thank you very much everything will be today' we made history together i will never forget it,"ho ne ho se na nako ea hore lintho tsohle li tlameha ho etsahala kapele le ka boithaopo ke itse ""bashanyana ba tla leboha haholo kajeno 'ha ke sa tla lebala"
275,farewell pang rest in the arms of now it is time for to shine to his mummy,phomolo ea pangwell pang
276,is there a d notice on the wedding sorry farewell party,na ho na le tsebiso ea d ho ea lechafatso la lenyalo la lenyalo
277,i am sorry you had gotten so unlucky this time around how i am wishing you a better farewell in the next life,ke masoabi hore ebe o se ke oa tsoaloa joalo ka nako ena a potang hore ke u lakaletsa bophelo bo botle bophelong bo latelang
278,will hand the baton to the new chairman on august his last day in office,e ka fa baton ho fantisi e ncha ka lato la hae la ho qetela ka ofising
279,no forgiveness just farewell,ha ho tšoarelo feela e sa tsoa hlokahala
280,farewell on s final morning after,farewell ho ea hoseng ho qetela kamora
281,farewell service for vicar,ts'ebeletso ea farewell bakeng sa kaholimo
282,chairman m of all of house to ensure good monsoon session of parliament this would be their farewell gift to him,modulasetulo m oa ntlo eohle ho netefatsa seboka sa mofuta o motle oa pansoon sena sa polokelo ena e tla ba mpho ea bona ea ho feta
283,we made history together there was no time for a proper farewell fixed it,re entse nalane hammoho ha ho na nako ea ho se be le nako e nepahetseng
284,i also said i would return to for a proper farewell after the barcelona trip to the united,hape ke itse ke tla khutlela molemong oa leeto le letle ka mor'a leeto la barcelona ho ea united
285,i also said that i would return to for a real farewell after barcelona is trip to the united which will last until,hape ke ile ka re ke tla khutlela ho motho ea etsoang ke barcelona ho ea united states ho tla tšoarella ho fihlela
286,s farewell address in is still one of the most important ever given in us history he explicitly about two specific dangerous and excessive political power military industrial complex scientific technological elite,aterese ea shrewell e ntse e le e 'ngoe ea tse bohlokoa ka ho fetisisa e kileng ea fanoa historing ea amerika e sa hlakang histori ea mahlale a boima le ho feta a lipolotiki.
287,i can see one of the right now brother won when he was on the farewell tour,ke khona ho bona e 'ngoe ea moena joale o ile a hlola ha a le leetong la bowewe
288,chairman m of all of house to ensure good monsoon session of parliament this would be their farewell gift to him,modulasetulo m oa ntlo eohle ho netefatsa seboka sa mofuta o motle oa pansoon sena sa polokelo ena e tla ba mpho ea bona ea ho feta
289,we leave this quiet meeting place and bid farewell,re siea sebaka sena sa liboka se khutsitseng sa kopano mme ra ba
290,to ten million i am weird 'cause i hate i got misty as they said farewell,ho limilione tse leshome ke makatsa hobane ke hloile hore ke hloile phoso ha ba ntse ba bua hantle
291,well he can t the of the way the regime are being laid bare pay as you go government no thanks _starmer and bring it on i bet was at the big farewell party last night maybe he even chipped in,"hantle, o ka khona ho lefa tefo e sa sebetseng hantle ha u ntse u e-ba teng"
292,is the only player in history to score in a single season score away score a five goal haul in under nine become the top scorer in five consecutive farewell,ke sebapali feela historing ho fumana lintlha ka nako e le 'ngoe ea nako ea ho fana ka lintlha tse hlano tse ka tlase ho tse hlano tse latellanang
293,it is a privilege and an honor to me to be by the junior for the upcoming farewell meeting in our college,ke tlotla 'me ke tlotla hore ke be setsing sa seboka se tlang kolecheng ea rona ea kolecheng ea rona
294,no farewell message would be enough to let the know how i felt at the same time no farewell message was to make myself understood see you again it was a wish rather than a promise,ha ho na molaetsa oa ho tseba hore na ho na le molaetsa o tšoanang ho tseba hore na molaetsa o le mong o ne o lokela ho etsa joalo ho e-na le takatso e itseng ho fapana le tšepiso
295,i also said i would return to for a proper farewell after the trip to the united,hape ke itse ke tla khutlela molemong oa leeto le letle ka mor'a leeto la ho ea united
296,there was no time for a proper farewell everything had to happen very quickly and spontaneously i said 'guys thank you very much everything will be today' we made history together i will never forget it,"ho ne ho se na nako ea hore lintho tsohle li tlameha ho etsahala kapele le ka boithaopo ke itse ""bashanyana ba tla leboha haholo kajeno 'ha ke sa tla lebala"
297,farewell and take care,rata le ho itlhokomela
298,i also said i would return to for a proper farewell after the barcelona trip to the united,hape ke itse ke tla khutlela molemong oa leeto le letle ka mor'a leeto la barcelona ho ea united
299,there was no time for a proper farewell everything had to happen very quickly and spontaneously i said 'guys thank you very much everything will be today' we made history together i will never forget it,"ho ne ho se na nako ea hore lintho tsohle li tlameha ho etsahala kapele le ka boithaopo ke itse ""bashanyana ba tla leboha haholo kajeno 'ha ke sa tla lebala"
300,i just to see in las for his final farewell,ke mpa ke le ho bona ho las bakeng sa pholiso ea hae ea ho qetela
301,farewell it was a wonderful weekend,farewell e ne e le beke e monate
302,i know the blue skinned will be to disappearing as part of this selection stage of climate change farewell,kea tseba hore letlalo le leputsoa le tla ba ho nyamela e le karolo ea mohato ona oa boemo ba leholimo
303,i agree they are cool though but damn just like that huh farewell generational wealth,kea lumela hore ba pholile leha ekaba feela joalo ka letlotlo la huh farewell le hlahisang leloko la lihlahisoa
304,o'brien is farewell message to via,o'brien ke molaetsa oa khale
305,another one who that a chat about the most common thing in summer is a national emergency yes i would think his farewell party is a lot more important than it if the media said stick ya head in the fire i bet ya would no hope for some people,"e 'ngoe eo ho buuoang ka eona ntho e tloaelehileng ea lehlabula ho na le tšohanyetso ea naha, ke ne ke tla nahana hore ha ho na tšepo ea hore na ke tla ba le tšepo bakeng sa batho ba bang"
306,oh thank god i haven t finished the farewell chapter,oh leboha molimo ke fiht thy khaolo ea boea
307,leaves as one of the club is most prolific his impact was seismic then why does this farewell lack the emotional punch for a man of such monumental leaves behind rather little love,makhasi e le a mang a khōlo e le 'ngoe e le' ngoe e ne e le tšitiso ea hae e ne e le tšibollo ea hae e ne e le tšitiso ea hae ka nako eo.
308,i to tell you i finally learned my lost surname it t matter because you always knew i green just like the ancient mine s gone but her spirit within gleaming a gift to a friend a farewell to a lover gem for the heart,ke tla u joetsa hore ke ithutile taba ea ka e lahlehileng hobane u ne u lula ke le tala hobane feela moea oa hae o tepella o moputsoa oa hae.
309,harness' former team have to his farewell after switch,sehlopha sa pele sa harner se na le mokhoa oa hae oa ho fetisa ka mor'a ho fetola
310,farewell to a raider thanks for the and once a raider always a raider,farewell ho ea raider ea raider bakeng sa 'muso o mong le o mong o lula o raider
311,missionary ended his farewell talk by de la by name not he s the singer of rage against the machine saying it to start somewhere it to start sometime what better place than here what better time than now all hell can not stop us now,morongwa o ile a potlakela ho bua ka de ka lebitso la hae ka lebitso la khalefo ho feta mona lihele tsohle li ke ke tsa re thibela hona joale
312,adieu a foreign feminist s farewell letter to via,adisu adieu adieu
313,i am sure this is incredible but it is still too painful to think about it is also why i never watched peyton is farewell speech,ke na le bonnete ba hore sena sea makatsa empa se ntse se utloile bohloko haholo ho nahana ka hona le hore na ha ho mohla nkileng ka shebella peyton ke puo e sa rarolloang
314,again but this time without you around farewell,hape empa nako ena ntle le uena e le haufi
315,my coffee is at the perfect temperature i am back geo news' transmission with morricone is farewell to in the background oh i am enjoy this one,kofi ea ka e mocheso o phethahetseng ke khutlisetse phetiso ea geo news 'morricone e le haufi le ka morao ho oh ke thabela ena
316,do they ever really have a farewell tour,na ba hlile ba na le leeto la boea
317,farewell old hello new,hello hello
318,farewell for right way,farewell bakeng sa tsela e nepahetseng
319,this is like last farewell and crooked put together g dragon can not help falling in love via _canthelpfallinginlove,sena se tšoana le mokhoa oa ho qetela oa ho phomola le ho khopamisitsoe hammoho le dragon a ke ke a thusa ho oela leratong ka _canthelpalilinoling
320,whether it is you or the colleague leaving the job here is how to say farewell to a,hore na ke uena kapa ba sebetsangletseng ba tlohang mosebetsi mona ke mokhoa oa ho bua
321,i just to see in las for his final farewell,ke mpa ke le ho bona ho las bakeng sa pholiso ea hae ea ho qetela
322,i am work on some end of life stuff specifically i want to leave my some simple to publish some stuff for my a farewell message and some i want i also want to go over the other legal stuff but for today my is the focus,ke sebetsa ka nako e itseng ea bophelo ka kotloloho ke batla ho tlohela lintho tse ling tsa ka tsa ho fetisa lintho tse ling tsa molao empa ke tsa pele.
323,your tweet was in an article by essentially sports,tweet ea hau e ne e le sengoloa sa lipapali ka tsela e seng ea lipapali
324,hope everyone their for the farewell midnight walk this weekend,kea ts'epa hore bohle bakeng sa bo-bong bo boholo bo boholo bo fetang beke ena
325,trialist farewell to former club,teko ea teko ho isa ho sehlopha sa pele
326,farewell to for ending a good tenure as chairman of the all opposition will miss his wit good,farewell ho ea qetellang le molulasetulo oa khanyetso eohle e tla hloloheloa ea hae
327,this be my go to sleep farewell before the day like every night,ena e be e le ho robala ka ho robala pele letsatsi le leng le le leng bosiu
328,you will soon be able to watch a recording of our parish for at this service music from our choir a sermon on the purpose of love within education and a farewell to the head of st mary is school after of service there,haufinyane u tla khona ho shebella rekota ea parishe ea para ea tšebeletso ea 'mino oa' mino oa 'mino oa ho rata thutong ea lerato ka sepheo sa st mary ha e le sekolo
329,there will be a proper farewell i also want to get for my the coaching staff and the,ho tla ba le mokhoa o nepahetseng oa ho fumana le ho fumana basebetsi ba ka le
330,of the last german empress and queen of farewell to red cross,ea emong ea ho qetela ea jeremane le mofumahali oa farewell ho ea sefapano se sefubelu
331,i also said that i would come back to for a proper farewell after barcelona is trip to the which until,"ke boetse ke re, ke tla khutlela bakeng sa mokhoa o nepahetseng oa hore barcelona e ea ho eona ho fihlela"
332,on his farewell there was no time for a proper farewell everything had to happen very quickly and spontaneously i said 'guys thank you very much everything will be today ' we made history together i will never forget that,ha a le takatso ea hae ea bohlokoa ho ne ho se na nako ea hore lintho tsohle li tlameha ho etsahala kapele le ka boithatelo ke re 'batho ba tla ba le nalane hammoho ha ke sa tla lebala seo
333,t that be a lovely farewell moment,t than e ratehang
334,chairman productive monsoon session as farewell gift from,seboka sa chairman se hlahisang tšebetso ea monoon
335,the b s past love shack and rock lobster when i did summer of i was my life for the better i wish this t a farewell i really do but i can t wait to dance this mess around at beacon theater in,"b s ea bos e fetisang le ea lock ""ha ke ne ke le hlabula ke ne ke rata ho taka bothata bona empa ke khona ho tantša ho potoloha"
336,a farewell to arms,ho rata libetsa
337,farewell comrade,farewell commade
338,trialist farewell,teko ea teko
339,farewell awesome hello,farewell hello hello
340,farewell it get it is not a choice they are,farewell e fumana hore ke khetho eo ba leng eona
341,this with my head the only home i know is my bed too lazy for a suicide i just watch the days pass to die so sick and tired of being alone so long farewell i am on my own i am sorry i have got to go i dug this grave i call my home,sena se na le hlooho ea ka feela eo ke mo tsebang haholo lebitla lena ke bitsa ntlo ea ka
342,farewell spectacular as ever so glad i could introduce my to a city i love so much,ho hlonephaha ka ho fetesisa ka nako eo ke thabile haholo hore ebe ke ne ke tla tsebisa hore ke rata toropo eo ke e ratang haholo
343,maybe a farewell,mohlomong mokhoa oa ho phela
344,pandemic made me get it back in blood but that s all over with now lived it it farewell beautiful game,sebaka se ile sa etsa hore ke e khutlisetse mali empa se hohle joale se phetseng hantle hona joale ho phela papali e ntle
345,underneath an open man over an untrue ritual a farewell beneath an uncanny thing,ka tlasa monna ea bulehileng ka lebaka la tloaelo e sa tloaelehang e ka tlas'a ntho e sa bonoeng
346,__ for dude that scored or league even messi is farewell video from barcelona no reach that,__ bakeng sa dude e ngotsoeng ka seng kapa e se e le teng
347,flying on a rare dash de canada farewell via,ho fofa ho rare dash de canada farewell ka
348,to all on the auspicious occasion of _e_ghadeer ah in which the while from farewell pilgrimage reiterated the of his successor a s,ho bohle ka ketsahalo e makatsang ea _e_ghadeer ah mohlahlabani oa hau o tsoang ho mopalami oa hae a emeng ho s
349,just had a tearful farewell on the phone to a good mate in there and here in tomorrow we suspect we never survive or speak to each other again are we being a bit melodramatic,ke bile le mokhoa o sa tsotelleng ho molekane oa hantle mono le mona hosane re belaela hore ho na le melodramatic
350,the clark show with tonight live on join to say farewell to the week with some of the best music from across and android launch lexicon radio live,clark show le bosiung bona ba phela ho kenya letsoho ho re ka mokhoa o mong le o mong oa 'mino o mongata o tsoang ho phosa le oxicon
351,_vk farewell,_vk farewell
352,will be giving a farewell performance on at see this final performance along with all your other at all the at,e tla ba le ts'ebetso e ntle ea ho ba le ts'ebetsong ea ho bona ts'ebetso ena ea ho qetela hammoho le e mong oa hau ho tsohle ho
353,congregation will bid farewell to rabbi his wife and family on,phutheho e tla pateloa ke mosali oa hae le lelapa la hae ho
354,farewell the electric labyrinth may,farewell the electrith labyrinth may
355,was the perfect time for me to wave farewell to northern as she curtain down on cap career,e ne e le nako e nepahetseng ea hore ke tsoelepele ka leboea ha a le makhathela a molao
356,dint had presentation ceremony at camp as he was part of la also did not had farewell,dint o ne a e-na le moetlo oa ne o na le mokelikeli kampong ha a ntse a le karolo ea la le a sa kang a ratana
357,how can people still believe write farewell on their own a whole team is writing that,batho ba ntse ba sa lumelloa joang hore ba e'o ngola ka mokhoa oa bona oa sehlopha kaofela ba ngola seo
358,i miss you luna for making my time on here extra fun and entertaining farewell,ke u hlolohetsoe luna bakeng sa ho etsa nako ea ka mona ho monate le ho khahlisa
359,you are a riot really oh farewell now and good luck,u morethey oh oh oh oh oh warewell joale le mahlohonolo
360,he officially retirement after this year with no out of town appreciation farewell tour i assumed he t,o ile a tlohela ka molao ka mor'a selemo sena ntle le ho ba le tumello ea kananelo ea tokelo ea tokelo ea atlanta ea lekunutu
361,railway to bid farewell to steam locomotive tomorrow,railway ea ho etsa padwell ho steam locomomotive hosane
362,farewell to server h and the semi annual channel,farewell ho seva h le setei sa selemo sa selemo se le seng
363,ka farewell hoga,ka farell hoga
364,your commitment i said that is farewell it evil it is i and we _,boitlamo ba hau boo ke bo boletseng bo ke bo sarewall ke mobe ke 'na' me re _
365,_katiex did something happen you do not need to say anything if you do not want to if you are set on i bid you farewell,_katiex a etsa hore o se ke oa hloka ho bua eng kapa eng ha o sa batle hore o romelle ho fumana chelete
366,i am not sure if it is the wine or her compliment at party last night i woke up today morning still smiling,ha ke na bonnete ba hore ke veine kapa teboho ea hae moketeng oa ho qetela bosiu ke tsohile kajeno hoseng ho ntse ho bososela
367,my farewell tour,leeto la ka farewell
368,my farewell tour,leeto la ka farewell
369,the farewell me,ea nkhalefisang
370,since we are paying for it when are you going to publish the guest list for today is farewell party and total cost or confirm the name of the tory donor paying for it,kaha re e lefella neng hore na u tla phatlalatsa lenane la baeti kajeno le litšenyehelo tse felletseng
371,a farewell party at while you re on air absolutely unbelievable no shame is trying to kill any credibility his might build call this out collectively demand he go now,mokhahlelo oa bo-ntate ha o ntse o tsoela pele ka moea o sa lumele o sa lumele lihlong o leka ho bolaea motho ea ka 'nang oa e-ba teng hona joale
372,trialist farewell to former club,teko ea teko ho isa ho sehlopha sa pele
373,my are the thank you for the farewell card,ke leboha haholo ka karete ea hau ea mohloa
374,see you next time friend,ke tla u bona motsoalle oa nako e tlang
375,trialist farewell to former club the citizen,teko ea teko ho ea pele ho crourven
376,if you can not understand the difference in not only definition but level of bigotry you are a lost cause farewell,haeba u sa utloisise phapang ea tlhaloso feela empa boemo ba khethollo ke uena ea lahlehileng
377,so long farewell after of service to nation,e telele ka nako e telele kamora ho sebeletsa sechaba
378,farewell four ago i at your neatly concourse a little broken a little shaken a little but today i depart a different man whole hale and fully self so thank you and see you next time,farewell e 'ngoe e fetileng ke roetsa hanyane ka hanyane empa kajeno ke tloha haholo empa kea u leboha le ho u bona nakong e tlang
379,i had a dream that he with the and you had to make a farewell post,ke ne ke tobane le toro eo a nang le eona 'me u tlameha ho etsa poso e sa reng letho
380,_dreadful just as a farewell party he should be out on his arse tomorrow morning time to step up,_dread joalo ka mokete oa bo-rawwell o lokela ho ba ka ntle ho esele ea hae hosane nako ea ho hlaha
381,farewell love,lerato la hau
382,farewell tour,leeto la farewell
383,farewell and rest in powerful to the strong fearless motherly yours is done and we will forever be indebted to,o robala le ho phomola ho matla a bo-mme ba bo-mme ba se nang tšabo a entsoe ka boea mme re tla behelana ka mora
384,this do not miss they are a body of water with nerver and flooding at farewell other area this week include sir crow and more full calendar,sena ha se hlotsoe ke 'mele oa metsi ka nerver le likhohola tse ling tsa ho fetisa sebaka se seng bekeng ena
385,you have done very well for yourself my boy may your journey continue to be blessed we will miss you we will meet again at the dugout our dressing room farewell brother,"u entse hantle haholo hore o ka tsoela pele ho hlohonolofatsoa re tla u hloloheloa, re tla kopana hape re tla kopana hape le moen'ae ea apereng"
386,even t a fan it s like a farewell tour,esita le th ken i like
387,i just to see in las for his final farewell,ke mpa ke le ho bona ho las bakeng sa pholiso ea hae ea ho qetela
388,disappointment the eager eighteen year old to bid farewell to the social dynamics of the high school cafeteria,ho soetseha ho ba lilemo li leshome le metso e robeli tsa selemo ho isa ho tse leshome le metso e robeli tsa ho amohela li-dynamics tsa bophelo ba sekolo se phahameng
389,the fact that and did not post farewell post after last episode ever is,taba ea hore mme ha ea ka ea romella poso ka mor'a karolo ea ho qetela ea episode
390,chairman productive monsoon session as farewell gift from,seboka sa chairman se hlahisang tšebetso ea monoon
391,pti is narrative against n is based on  wouldynastic politics' and they themselves have bid farewell to it today with the victory of,pti e phetoa ka mokhoa o fetohang n e ipapisitse le lipolotiki tsa tokiso 'mme ka bobona ha li na thuso ho eona kajeno ka tlhōlo ea
392,too lazy a photo to get ready for his wedding party farewell do no one him there,le botsoa haholo ho itokisetsa ho itokisetsa mokete oa hae oa lenyalo ho se ke oa etsa a le mong
393,farewell my i eagerly await a future born of your courage and the ancients' wish,o batla ka cheseho ka cheseho ka bokamoso ba sebete sa hau le seo u se batlang
394,wa i am sorry i have to save you from cringe please forgive me there was too much cringe until we meet again farewell,ke masoabi hore ke tlameha ho u boloka ho tsoa ho cringe ka kopo ntšoarele ho fihlela re kopana hape
395,a farewell to arms,ho rata libetsa
396,farewell what an incredible i had the amazing opportunity to work with so many awesome people to build for millions of around the world and on to the next adventure,fepall ke bile le monyetla o makatsang oa ho sebetsa le batho ba bangata ba makatsang ba makatsang ho aha limilione tsa lefatše le ho ea pele
397,rush farewell to tour,rush farewell ho etela
398,a party which is apparently a farewell party not a wedding party did our get an invite for her dogged loyalty or is it a and family affair,mokha o ts'oanang le mokete oa setsebi eseng mokete oa lenyalo oo re o etsang ho tšepahala ha hae kapa ho na le takatso ea lelapa
399,chairman productive monsoon session as farewell gift from,seboka sa chairman se hlahisang tšebetso ea monoon
400,farewell to you my beloved the one who i and who me,re rata hore ke uena ea ratoang eo ke mo ratang
401,i think h min is a long enough for my farewell party,ke nahana hore h min e lekane bakeng sa mokete oa ka oa hau
402,chairman productive monsoon session as farewell gift from read story,seboka sa chairman se fanang ka ts'ebetso ea monsoon
403,i just to see in las for his final farewell,ke mpa ke le ho bona ho las bakeng sa pholiso ea hae ea ho qetela
404,farewell,farewell
405,a touching farewell,mokhoa o monate oa ho ama
406,farewell beloved straight,farewell e monate
407,something is still wrong at this club even left like he is nobody not even a proper farewell on the other hand alba pique and are like while they literally are the who needs to off at all cost tax is real,ho na le ho hong ho ntseng ho se phoso ka holong ena le ho tloha joaloka ha ho motho ea se nang pherekano e le 'ngoe ea lekhetho le hlokahalang
408,and crime scene in and a vehicle with no insurance in said farewell to who s moving to team,lehoata la botlokotsebe ka koloi le koloi e se nang inshorense ho re ho fetisetsa ho ea sehlopheng sa ho ea sehlopheng
409,because it is a mass demoralization that been artificially into the populace under the guise of minority exactly as by manning johnson is farewell address over ago,hobane ke bo-ralimohamiso e matla bo qalileng ka tlase ho batho ba neng ba le tlas'a eona ka ho fetisisa ka sethaleng sa bonyenyane joalo ka manning johnson
410,_cool no it was not the verse is pertaining to the of the farewell,_cool no ho ne ho se na temana eo ho amanang le ea ho ramahane
411,farewell,farewell
412,as a week ago this is it i bid my farewell to this account will no longer tweet related i will still login from time to time tho but feel free to good luck it is been fun thank you,ha ke ntse ke le ka nako e fetileng ke fetisetsa boits'oaro ba ka ho akhaonto ena e ke ke ea reka nako le nako ho fihlela nako e 'ngoe ea mahlohonolo e ntse e le monate kea leboha
413,really excited to play celeste is farewell but i am also,e thabetse haholo ho bapala celeste ke mokhoa o motle empa hape ke
414,mark my he will get in his farewell match,tšoaea hore o tla fumana papali ea hae
415,_mania will guy shaw as opener or can try pant samson too as experiment should be given as farewell match for his service,_mania e tla etsa joalo ka opener kapa a ka leka pont samson le teko e lokela ho fanoa joalo ka ha ho bapisoa le tšebeletso ea hae
416,husband tribute to time gold as she farewell,monna ea tribute ho ea nako ea khauta joalo ka ha a batla
417,on the day of farewell pilgrimage and they accepted it too _completionofislam,ka letsatsi la moemeli oa farewell papiso 'me ba e amohela le ho feta - letsong
418,farewell so long,e batla e le nako e telele
419,lost farewell,e se e le bonolo
420,farewell,farewell
421,farewell on bbc is final morning after well that will save an hour every when it laura will be the host so it will be  nothe laura show',farewell ho bbc ke hoseng ho qetela hoseng ho tla boloka hora e 'ngoe le e' ngoe ha laura e tla ba moatle hore e tla ba moaho oa
422,another wonderful missionary farewell talk today,ho bua ka mokhoa o tsotellang oa boromuoa kajeno
423,meeting or farewell to the faithful which do you go to,ho kopana kapa ho fetisetsa ho ba tšepahalang hore o ea ho
