,src,trg
0,why are cloudy and stormy days and motivational kind of enjoying today,hobaneng ha matsatsi a nang le maru le a sefefo le mofuta oa tšusumetso oa ho natefeloa kajeno
1,the life you re living now do you like it if you don t like it quit no motivational quote today,bophelo boo u bo ratang joale boa rata haeba o sa rate ho tlohela mantsoe a qotsitsoeng kajeno
2,_ i struggle with i do not know but i find his style soft and more like a motivational speaker or something so i hardly listen to him i am into with apostle being the preacher i listen to the most,_ ke loana le ha ke tsebe empa ke fumana setaele sa hae joalo ka sebui kapa ho hong ka ho sa tsotelehe moapostola eo ke mo sebeletsang ka ho fetisisa
3,_pr i go follow motivational pretend as if nothing is there and move forward,_prive ke ea ho latela hore na ha ho letho le teng le ho ea pele
4,reel motivational sound bite this poem is for the days when you find it hard to breathe me so everyday,reel motivanight molumo oa thothokiso ena ke oa matsatsi ao u fumanang ho le thata ho nkhutmale joalo ka mehla
5,why is it that people don t look for motivational before they do something stupid after them don spoil show go dey look for motivational quote way go back up their st,hobaneng ha batho ba sa tšeloe pele ba etsa ho hong ho ba hlokang booatla kamora bona li-diala li bonts'a mokhoa oa ho qotsa st
6,these are a very good against many of moral motivational i e the idea that moral motivate because if mi is true either all these people would not really judge abortion to be wrong or they do would somehow 'hide' their motivation,tsena ke tse ntle haholo mabapi le lisosa tse ngata tsa boitšoaro ke mohopolo oa hore na ke 'nete hore ha ho na bonnete ba hore batho bana kaofela ba ke ke ba' pata 'tataiso ea bona' linthong tsa bona
7,_ _ _ he well and a motivational speaker i also bought a book from him and another from the wife i no longer listen to the people i with as a young believer mostly the of jakes they have an audience i am local nowadays,_ _ _ o phetse le sebui se khothatsang hape le se seng le mosali ha ke sa mamela batho bao ke nang le bamameli ba lehae
8,_in_nyc this is the most motivational thing you could said life saved,_in_nyc sena ke ntho e susumetsang ka ho fetisisa eo u ka e buang bophelo e bolokiloe
9,why motivational turned into a villain we were his in our days back anyway stranger are new natural after pandemic,lebaka leo le letsoho le fetotsoeng ho ea naheng eo re neng re le hae le mehleng ea rona ka mor'a nako re sakamele ho hloka tlhaho
10,yahoo and their motivational,yahoo le tšusumetso ea bona
11,happy in today is article here are the of your,ke thabile kajeno ke sengoloa mona ke ea hau
12,i don dey visualize am since i still dey wear i dey motivational no dey move me again,ha ke e-sola
13,i send motivational to of relevant personal information it and know there is a human behind the screen that too,ke romella ho susumetsa tlhahisoleseling ea hau ea bohlokoa 'me ke tseba hore ho na le motho ea ka morao ho skrini
14,motivational quote no feel help me again mi,qotsutso ea tšusumetso ha ho na maikutlo hape mi
15,does anyone see those motivational and think 'ooh you know what i am enough' or am i just too for them to work on me,na ho na le motho ea bonang tšusumetso le ho nahana hore 'ooh oa tseba hore na ke na le eng' kapa ke mpa ke batla hore ba sebetse ho nna
16,the secret of getting ahead is getting mark twain,lekunutu la ho ikhula ke ho fumana cwain twin
17,you re supposed to live your motivational motivation video,u lokela ho phelisa video ea hau ea tšusumetso
18,do not trust to the cheering for those would shout as much if you and i were going to be,se ke oa tšepa ho cheseha bakeng sa ba ne ba tla hooa haholo haeba le uena re ne re tla ba
19,let them talk stay motivational speech jakes,e re ba bue ho lula ba khothalelitse ho bua.
20,ma motivational ye,mamellanor ye
21,i just had a epic moment i to delay the enemy from capping our last point while motivational music and a very funny medic me,ke sa tsoa ba le nako ea bohlokoahali eo ke e thibelang sera sa ho hlaba ntlha ea rona ea ho qetela ha ke le 'mino o susumetsang le o qabolang haholo
22,the economy turn even to motivational,moruo o fetoha le ho susumetsa
23,have different motivational needs we need encouragement need applause a small win and need the freedom to figure out what we enjoy but not too much too soon it will bludgeon the interest,ba le litlhoko tse fapaneng tsa tšusumetso re hloka khothatso eo re hlokang ho ela hloko e nyane mme o hloka tokoloho ea ho bona hore na re tla phatloha ka seo re se thabang haholo empa haufinyane.
24,yes mum i am a mentally stable independent person who is spending her hard money wisely on a tapestry with a motivational quote as my roommate and i want to decorate our dorm room when we move back for the next academic year,ee 'mele ke motho ea ikemetseng ea nang le kelello ea nang le kelello e thata
25,my type is trustworthy motivational organized thoughtful and observant,mofuta oa ka ke o khothatsang o hlophisehileng le ho hlokomela motho ea tsotellang
26,motivational quote for today you can do it put your back in to it ice cube,quativational quote ea kajeno u ka e etsa ka mokokotlo oa hau ho ice cube
27,i need like motivational make i just stay in the middle make then dey me dey go _republic,ke hloka joalo ka tšusumetso e etsa hore ke lule e le bohareng ba ho etsa diny ke e-ja lijo
28,hustle make motivational speaker no deceive you,hustle o etsa hore sebui se khothatsana ha se thetse
29,fact is when you state what you want you attain clarity you focus on only what you want and your subconscious mind it to pass it is a rule of nature not motivational talk,'nete ke hore na u bolela eng seo u batlang hore u se ke ua shebella ho hlaka hore na u batla kelello feela ke molao oa tlhaho
30,motivational speaker time dey go,boikarabello bo botle ba segitive dey go
31,use your own mind do you believe in and stand your ground stop listening to all these turn motivational speaker,sebelisa mohopolo oa hau na u lumela hore 'me u eme masimo a hau hore a emise ho mamela sebui sena se susumetsang se susumetsang sebui sena se susumetsang
32,this is my times tu motivational speaker,ena ke linako tsa ka tsa thuto ea tumetso
33,motivational generating by ginger,mothati o hlahisang ka ginger
34,learn how to analyze with our course get to know the expressive that reflect and start august st more at,ithute ho sekaseka le thupelo ea rona ho tseba poleloana e bonts'ang le ho qala phato st haholoanyane ho
35,is this a motivational,na ke tšusumetso
36,follow for more tax and motivation become a member today at,latela lekhetho le matla le ho ba le setho kajeno
37,motivational in apparel design with a minor in entrepreneurship she is currently an associate designer at aerie on the and team we are,khothatso ho aparel e entsoe ka bo-ralitshwane ho rarapreurshipping hajoale ke moqapi oa botsoalle ho arie ka hare ho sehlopha re
38,hello twitter your daily inspirational and motivational sports quote of the day is most people never run far enough on their first wind to find out they got a second,lumela twitter
39,do not happen you create them,se ke oa etsa hore u li botse
40,motivational quote of the week be patient remember that big are not all at once they are day by day and week by week keep grinding y all,khothatso ea beke e be le mamello e se nang mamello e hopotsang hore e kholo ha e na letsatsi le leng le le leng letsatsi le beke
41,success is liking yourself liking what you do and liking how you do it maya,katleho e inka e rata seo u se etsang le ho se rata hore na u phela joang
42,mum with just p in the bank now property entrepreneur,'mè o na le p ho bankeng joale thepa ea thepa ea thepa
43,we cant afford to pay you more via u,ha re na chelete ea ho u lefa u be le uena ka uena
44,ascendant group senior partner recently gave a motivational speech at the pyramid club and the importance of go of your to achieve bigger greater in your life should risk it all for their,molekane ea phahameng oa sehlopha sa khale sa baichaba ba sa tsoa fana ka puo e khothatsang ea pyramid le bohlokoa ba hau ho fihlela bophelo bo boholo bophelong ba hau
45,a quote from bob burg what you focus on is what you get what is your favorite motivational quote find more motivational at,qotsulo e tsoang ho bob burg
46,day of challenge  nothings do not happen are made to happen ' f simple but motivational quote do not wait for opportunity to appear randomly it might take an eternity so you need to create by yourself,"letsatsi la phephetso ha ho etsahale ho etsahale ""f bonolo empa ho qotsa ha maikutlo a bonolo"
47,this anime ass motivational speech,puo ena ea ass e khothatsang
48,if you do not program your life life will program you very motivational video listen carefully pay attention learn and change,haeba u sa fetole bophelo ba hau bophelo ba hau bo tla u joetsa video e khothatsang haholo ho mamela ho ela hloko ka hloko tlhokomelo e hlokomelang ka hloko le ho fetoha
49,i told my form class that they better win sports day and i will not accept anything less they went and smoked the other like they did last year it must be their motivational form tutor,ke ile ka bolella sehlopha sa ka sa mofuta oa hore ho na le ho hapa letsatsi la lipapali tsa lipapali 'me nke ke ka amohela ntho e ka tlase ebe ke tsuba e' ngoe eo ba e entseng selemong se fetileng e lokela ho ba morupeli oa bona oa tšusumetso
50,_ lux motivational,_ se susumetsang
51,saw a generic motivational shirt that just had the word commit and it as a best reminder time to leave,ke bone hempe ea ba susumetsang e nang le lentsoe le nang le lentsoe le nang le lentsoe le hore na ke nako e ntle haholo ea ho tsamaea
52,may god punish all motivational,molimo a ka nkopa ka tšusumetso eohle
53,a job and being successful does not give you the authority to give me motivational daily go be a pastor or an imam,mosebetsi le ho atleha ha ho u fe matla a ho mpha tšusumetso letsatsi le leng le le leng e tla ba moruti kapa imam
54,do you feel like you don t have a plan sometimes me do i now have her no i mean like with life me eh now do i have this fool is looking for who to give motivational talk today and mo si,na u ikutloa eka ha u na moralo ka linako tse ling ha ke na ho ba le eena hona joale
55,you will be never good enough for a wrong person your value does not reside in the or of other you are inherently worthy,ha ho mohla u ka bang ka ho lekana bakeng sa motho ea fosahetseng boleng ba hau ha a lule ho eona kapa a mang a mang u tšoaneleha
56,__appiah _khalifah _bel _aeesha _ we never knew even a motivational speaker a motivational speaker,__apph _khal _ _ _ _ _ _ _ _ rayeas
57,let s go sis miraculous motivational we are not no more,"e re sve siis moresivanization, ha re sa le sieo"
58,it is motivational let is get this party,ke tšusumetso ho etsa hore mokete ona
59,happy motivational comment below your favorite quote,maikutlo a monate a thabo ka tlase ho qotsulo eo u e ratang haholo
60,a motivational video via,video e susumetsang ka via
61,cause a lot of the are pushing back for the hybrid model and some people are shooting them in the foot with all of that it s good for motivational but still think there s a fine line,etsa hore tse ngata tse ngata li ka ba le sebaka sa ho itlosa bolutu haholo mme batho ba bang ba ba thunya ka leoto le tsena tsohle bo botle bakeng sa ho ba le mola o motle
62,all my n sister motivational bra cant wait to see my future is bright,bohle ba 'na ba khaitseli ea hae ea hore ke bateletse ho bona bokamoso ba ka bo khanya
63,motivational money making great rising and thank you father god for the breath of life to see another beautiful day and meet our new who have the youth escape,chelete e khothatsang e ntseng e eketseha 'me u re leboha ntate molimo ka ho phefumoloha letsatsi le leng le letle hore na mocha o pholohile
64,motivational edit _m_,mothati odit _m_
65,baby who is your latest plug i want to be a motivational speaker like you,ngoana ea lulang le ngoana oa hau oa morao-rao ke batla ho ba sebui se khothatsang joaloka uena
66,babar is motivational for,babar e susumetsoa ke
67,taking one of my motivational progress but look at the ridiculous difference in colour between my arm and my body,ho nka e 'ngoe ea tsoelo-pele ea ka e khothatsang empa sheba phapang e kholo ea' mala pakeng tsa letsoho la ka le mmele oa ka
68,even if you want to post a it must be professional with a motivational caption,le ha o batla ho e beha e lokela ho ba setsebi se nang le mohopolo o susumetsang
69,who is that motivational speaker,ke mang eo e leng sebui seo se susumetsang se susumetsang
70,why are you giving me motivational like i am here for the and be sad i am not here to be,"hobaneng ha o mpha khothatso joalo ka ha ke mona bakeng sa mme ke hloname, ha ke mona ho ba teng"
71,i do not have any major of which i am aware but i would not mind on retainer a psychologist a longevity specialist a motivational guru an trading mentor a workout coach and a wife,ha ke na kholo eo ke e tsebang feela empa ke hana ho boloka setsebi sa kelello se sephara se nang le mokhoa o khothatsang
72,poor people overly depend on for their success virtuous for a motivational,batho ba futsanehileng ba itšetleha haholo ka katleho ea bona e matla bakeng sa tšusumetso
73,the entrepreneur constantly for change to it and it as an opportunity for booking please visit,moureho o ne a lula a fetoha le eona le eona e le monyetla oa ho lisa ka kopo etela
74,have y'all seen that really weird ring ad that is just a black guy with trying to make a motivational speech was thinking with this it is just so off key,na o bone seo e leng selikalikoe se makatsang seo ke moshemane ea motšo feela ea sa lekang ho etsa hore puo e khothatsang e be le senotlolo sa sena
75,i have your motivational over month now more wisdom from god upon you now and forever,"ke na le tšusumetso ea hau ho feta khoeli hona joale, bohlale bo eketsehileng ho molimo hona joale le ka ho sa feleng"
76,join us on leadership radio the from the  is  is and  is personal and professional leadership development from some of the best leadership motivational and,eba le rona ho radio ea boetapele ho tloha le ho tsoa ho
77,to those who always write motivational tweet can you please stop you make the suffering worse keep those beautiful to yourself is tiring the suffering can end if one take charge of their life not those rubbish of yours,ho ba lulang ba ngola ka mokhoa o tsitsitseng ba ka u emisa ho etsa hore ho be le mahlomola ho uena ho ka ba teng haeba motho a sa khone ho itahlela hoa bophelo ba bona
78,autumn got me crying with these loving motivational ass text,hoetla e nkile ke lla ka temana ena e lerato ea ass e lerato
79,at best you are these in nonstandard ways use naturalism in a way compatible with objectivity and in a way compatible with motivational i recommend do actual research in peer,ho molemo ka ho fetisisa ka mekhoa ea ho se sebetse hantle ka tsela e lumellanang le sepheo le ka tsela e lumellanang le tšusumetso e ka sehloohong ho lithaka tsa bona.
80,i can not be mat be a motivational speaker,ha ke khone ho ba sebui se khothatsang
81,we are not getting motivational after,ha re fumane tšusumetso kamora
82,the most effective way to do is to do it amelia,mokhoa o sebetsang ka ho fetisisa oa ho etsa ke ho o etsa amelia
83,follow us for a motivational message on a,re latele bakeng sa molaetsa o susumetsang ka
84,up the basement to try to pick up heavy and play on the treadmill yesterday got a little workout in before the he me down with some motivational on my last set of at,ka mokatong o ka tlase ho leka ho khetha o boima le ho bapala ka seqhetsoana sa maobane maobane ho tsoa pele ho sepheo sa ka sa ho qetela ho
85,a friend of mine took an admission into everyone of his batch mate had their profile on with some motivational post but have not said a single word in their group i can not stop laughing amazing people,motsoalle oa ka o ile a amoheloa ho motho e mong le e mong oa babal'ae ho na le profil ea bona ka poso e itseng empa ha a khone ho khaotsa ho tšeha mantsoe a makatsang
86,very nicely peace team,sehlopha sa khotso haholo
87,my brother and stupid not so motivational talk anyways he is still learning under _jewel that one na with a touch of comedy,abuti oa ka le booatla ha ba na taba ea ho bua ka tsela efe kapa efe o ntse o ithuta ka tlase ho _jewel hore e mong a koale
88,on loop it s like a passive aggressive motivational speech for my,ho loop ho joalo ka puo e khothatsang e susumetsang
89,whoever the is please extend his contract i know he will come and tweet a prematch motivational video man is but he form,mang kapa mang ea khahlisang konteraka ea hae kea tseba hore o tla tla le ho thothomela video e susumetsang
90,do you believe half stepping is a motivational strategy can you craft a witty argument for the drop ride we are looking for hot in our a case for series our are open to interested in the thread,na u lumela hore halofo ea ho putlama ke leano le susumetsang hore le tsebe ho chesa haholo ho rona hore re thabele khoele
91,i don t like being boy but if were to pop up with some inspirational or motivational like this with an boy i t complain,ha ke rate ho ba moshanyana empa haeba ho ne ho e-na le ho hlaha ka tšusumetso kapa e susumetsang joalo ka moshanyana eo ke e tletleba
92,and that s on setting and nothing less than what you deserve we love a motivational queen,le st ke ipents le ha ho letho le ka tlase ho seo u se hlokang re le mofumahali oa mathata
93,in this powerful book share the and she used which her path and made easier her journey to becoming the person she knew she could be,buka ena e matla e arolelana le eona mme o ile a sebelisa hore na tsela eo a neng a e etsetse ho ba motho ea tsebang hore e ka ba motho eo
94,know your target and keep your on it please and follow for more inspirational and motivational contents,tseba sepheo sa hau mme o bolokehe ho eona mme o latele litaba tse ling tse khothatsang le tse khothatsang
95,thanks for the motivational quote,ke leboha ka mantsoe a qotsitsoeng
96,a back fall can bring you infinite opportunity it is on you how you perceive your situation do not compare with,ho oa ka morao ho ka u tlisetsa monyetla o ka tlase ho uena hore na u bona boemo ba hau joang ha u tšoane le
97,you are wasted as a fire control commander when you are a natural motivational speaker perhaps lots of,o senyehile e le molaoli oa thibelo ea mollo ha u le sebui sa tlhaho se susumetsang sa tlhaho mohlomong
98,a motivational speaker is dangerous creature,sebui se susumetsang ke seboko se kotsi
99,thanks for your wonderful motivational our no blue fan and boss may continue to bless u,rea leboha ka boikemisetso ba hau bo botle boo re bo khothalletsang le mookameli a ka tsoela pele ho u hlohonolofatsa
100,portable don dey post motivational,py dey dey dey comevational
101,what a fantastic day mock interview day was the were amazing as were the lots of enthusiastic praise for in s storytelling and we finished the day with super energetic motivational speaker junior saunders,ke letsatsi le letle la ho soma tlhahlobo ea lipotso
102,motivational in every classroom and every school there is the possibility for rich sustained reading and writing that and up the potential to be both academic and creative kittle how will you set these,ho susumetsa ka tlelaseng e 'ngoe le e' ngoe le sekolo se seng le se seng ho na le monyetla oa ho bala le ho ngola hore na o ka ba o ka ba o nang thuto joang
103,when you win say nothing when you lose say less brown,ha u hapa letho ha u lahleheloa ke ho bua hanyane
104,photo book via,buka ea litšoantšo ka via
105,_cedrick motivational speaking is not for u tam,_cedrick ho bua leshano ha se bakeng sa hau
106,ill now my motivational,kula hona joale se susumetsang
107,motivational therapy,phephetso ea boithaoli
108,i don t understand me this motivational message oh,ha ke nkutloisisa molaetsa ona o khothatsang o oh
109,just watch this motivational video,shebella feela video ena e khothatsang
110,it awesome i would say the font for the motivational reminder could be better but then again it is the message that,ho makatsang ke ka re fonte bakeng sa khopotso e susumetsang e ka ba betere empa hape ke molaetsa oo
111,its motivational mindful today we want to encourage you to get outside have a picnic put your in the sand and breathe in some fresh air we can not wait to welcome you back to campus very soon click the link in our to stay up to date on dining,"kajeno, e se e na kelello e senang maikutlo kajeno, re batla ho u khothatsa ho fumana ka ntle ho lehlabatheng le ho hema moeeng o mocha ha rea ​​khone ho lula ho fihlela joale"
112,remainder today is pain is tomorrow is power _no_time _no_time,bofete ke bohloko ke hosane ke botsela _no_ time_no_me
113,special offer motivation mojo via,tlhahiso e khethehileng ea boitšoaro mojo ka
114,step go through a self help bot account s feed copy every motivational quote paste it on your feed and schedule it to go out every weekend,mohato o tsoela pele ka ho itlama ho ithut ona
115,one day i will beat you these motivational,ka letsatsi le leng ke tla u otla ka tšusumetso ena
116,imagine your book being a record which song can you hear,nahana buka ea hau e le rekoto eo u ka e utloang
117,word of the day you do not have to be alone the world never loneliness upon us that is something we choose or reject by ourselves shan,lentsoe la letsatsi leo u sa lokelang ho ba lona + lefatše le hoelehetsa ho rona seo re se khethang kapa seo re se khethang kapa ho hana re le lihlong
118,i dont know either how is that motivational at all,ha ke tsebe hore na seo se susumetsa joang ho hang
119,finally he of wisdom to all of us new college on our new journey i had the pleasure of listening to his motivational not once but twice during my college although now hold regret that i t think to record them,"qetellong, ka bohlale ba boholo ba rona leetong la rona le lecha leetong la rona le lecha ke bile le thabo ea ho mamela setumo sa hae sa kolecheng ha joale ke nahana hore ke tla ba rekota"
120,this is a random selection of motivational,ena ke khetho e sa reroang ea tšusumetso
121,this is a motivational tweet,ena ke terata e susumetsang
122,not me an emotional breakdown pa na y mi full un motivational talk and pa workout,eseng 'na ea khelohang ka maikutlo a ratoang.
123,follow and listen to motivational point on investment mentality,latela le ho mamela lintlha tse susumetsang mabapi le mohopolo oa matsete
124,are you happy,na u thabile
125,motivational will tell you that everything is possible,motivational o tla u joetsa hore tsohle li ka khonahala
126,a positive self image the path forward the daily short motivational life of hope and renewal are brought to you by don macrae is new and on lead for recording don,setšoantšo se nepahetseng ka ho ithuta tsela e eang pele bophelong bo bocha ba letsatsi le letsatsi ea tšepo le nchafatso li tlisoa ho uena ka don macrae o mocha ebile o etella pele ho rekota don
127,me in deep depression listening to motivational,nna ka maikutlo a tebileng a maikutlo a mametse tšusumetso
128,meant to have this as a reply but i have instead become a motivational speaker,e ne e bolela hore ena e le karabo empa ke e-na le sebui se susumetsang
129,getting these motivational text from my father just me stay,ho fumana temana ena e khothatsang ho ntate le ntate oa ka feela
130,if anyone you recent hike just share this motivational video sir,haeba mang kapa mang eo u mo ratang oa morao-rao o arolelana le video ena ea khothatsang
131,_pinakee people tend to add spice to their motivational if you have ever sir speaking you will know,batho ba _pinakee ba tloaetse ho eketsa lejoe la maikutlo a bona haeba u kile oa nahana hore u tla tseba
132,how is this motivational u r crazy crazy,mohlaseli enoa o tsitsitse joang
133,this is nothing just watch this motivational video every morning,sena ha se letho le shebelle video ena ea tšusumetso hoseng ho hong le ho hong
134,set motivational,beha se susumetsang
135,a goal without a plan is just a wish,sepheo ntle le moralo ke takatso feela
136,motivational after giving the talk,khothatso kamora ho fana ka puo
137,subscribe to one of growing channel educational motivational technological subscribe now to make your future success full,ingolise ho e 'ngoe ea seterata se ntseng se tsoela pele thuto ea mahlale sa mahlaseli a mahlale a mahlaseli a masene hona joale ho etsa katleho ea hau ea bokamoso e felletseng
138,you sure t give a couple motivational before the game,o na le bonnete ba hore o itlhomme pele ka papali pele papali
139,ho you have murder if you claim the speaking specifically to motivational,ho u na le bolaoli haeba u batla hore ho be le tšusumetso e ikhethileng ho ba susumetsang
140,social media made your life better how,mecha ea litaba ea sechaba e entse hore bophelo ba hau bo be betere
141,no problem all is well all is well just telecast this motivational video,"ha ho na bothata bohle bo botle kaofela bo hantle, e lula e le video ena e khothatsang"
142,have arnold is motivational video times each time i hear it new,na arnold ke makhetlo a bohlokoa a video nako le nako ha ke e utloa e ncha
143,motivational and are like by the time you wake up its all gone and all you need is a reason or a goal to fight for no matter what day it is or what mood you are in you just have to do it there is no choice,khothatso ebile e tšoana le nako eo u e tsohang kaofela e felile ke lebaka kapa sepheo sa ho loantšana le uena kapa seo u leng ho sona ho uena feela
