,src,trg
0,many thanks for holding this farewell at the star much,re leboha haholo ka ho ts'oara motho enoa ho na le linaleli haholo
1,and so when the night of the new moon came with the setting sun bid farewell to the only person who ever for him before he took his first out of the castle was running away,kahoo bosiung ba khoeli e ncha e fihla le ho beoa ha letsatsi le chaba ho motho a le mong feela ea kileng a mo bona pele a sa tsoa ea fihla
2,beyond help now farewell my friend,ntle le thuso hona joale e fana ka motsoalle oa ka
3,on the teacher training from across the county to say a sad farewell thanks to mark outlined how much across have to thank them for theirs vision in the early s,koetliso ea matichere ho tloha sebakeng sa seterateng ho bua ka mokhoa o soabisang ho tsoa ho mareka e ka ba leboha haholo
4,still i at them as if i was bidding them farewell and then i,ke ntse ke e-ba joalo ka ha ke ntse ke ba rata le
5,_lcfc it is a system in where you have to pay a certain amount of money every month to the class' treasurer the money will be used to class' needs supply or maybe if there is a plan or the class to out together on graduation is farewell party,_lcfc ke sistimi moo u tlamehang ho lefa chelete e 'ngoe le e' ngoe ea chelete ea sehlopha sa sehlopha mokete
6,a very very sad moment the final farewell,motsotso o bohloko haholo oa ho qetela
7,they should have who went to his farewell party at,ba lokela ho ba le ba ileng ba ea moketjaneng oa hae oa ho rata
8,be unfollowing any anime tiddy o farewell you have me well,e-ba ho sa nahane hore o na le anime tudyime o se o na le 'na
9,farewell,farewell
10,farewell beautiful,farewell e ntle
11,i need to get off my phone so i be for the rest of the day until the evening farewell for now,ke hloka ho theoha mohala oa ka hore ke be bakeng sa letsatsi lohle ho fihlela joale ho fihlela joale
12,farewell,farewell
13,bring back to for a farewell tour,khutlela ho toeto ea farewell
14,farewell good magician i will try to go home,farewell hantle feela ke tla leka ho ea hae
15,tiger woods' emotional farewell to the old course rory mciiroy is amazing hole out eagle bunker shot young is superb second place finish in his open debut smith becoming the champion golfer of the year with a score of the home of golf yet again,tiger woods 'woods
16,i also said i would return to for a proper farewell after the barcelona trip to the united,hape ke itse ke tla khutlela molemong oa leeto le letle ka mor'a leeto la barcelona ho ea united
17,there was no time for a proper farewell everything had to happen very quickly and spontaneously i said 'guys thank you very much everything will be today' we made history together i will never forget it,"ho ne ho se na nako ea hore lintho tsohle li tlameha ho etsahala kapele le ka boithaopo ke itse ""bashanyana ba tla leboha haholo kajeno 'ha ke sa tla lebala"
18,have you to the farewell to episode of soul music it is on,na u lokela ho ramahalletsoa ke karolo ea 'mino oa moea o ntse o tsoela pele
19,the b s we never set out to change people is but it that way via,b s ha ho mohla re kileng ra ikemisetsa ho fetola batho hore na ho joalo ka hona
20,tonight at over at we continue our s with mary kay place and bid a farewell to look around you and the show of course we have got the usual smattering of saunders the day today it is time to get brit,"bosiung bona ha re ntse re tsoela pele ka mary kay, 'me re patiloe ho sheba ka boea ba hae ka bo-ramahlale ba letsatsi kajeno ke nako ea ho fumana bohloeki"
21,oh dear guess you did not an invite then and just get your right as the wedding party was due end of but the party last night was a farewell party nothing to do with his wedding,oh moratuoa oa hau o ne a sa na memo ka nako eo le ho fumana tokelo ea hau ea ho ba teng empa mokete o fetileng ha ho na mokete oa hae oa ho etsa le lechato la hae
22,_blankie no they are farewell alive,_blannie no hore ba ratane
23,farewell to st but still very much part of _trust,farewell ho st empa e ntse e le karolo e ngata haholo ea _rtrist
24,the b s we never set out to change people is but it that way news,b s ha ho mohla re kileng ra ikemisetsa ho fetola batho hore na litaba ka tsela eo
25,rave up rave up and dance dance as a farewell i m howling so hey answer me are you there,rala rave up le dance dances e le mots'eare o le ho ho ho ho ho ho ho ho ho ho ho ho ho ho hoo
26,the met a salt and pepper haired boy in who is name was after spending a brief time together bid farewell she was still not ready to settle like her father,ba ile ba kopana ka letsoai le pepere e qaqileng eo lebitso le neng le le ka mor'a nakoana e neng e sebelisoa ka nako e khuts'oane hammoho ha a ne a ntse a sa itokisetsa ho lula joaloka ntate oa hae
27,farewell despite a spot of bad health there it was a blast more than i thought it would be and it definitely gave me confidence to try tabling again in the future,papali ea bophelo bo bobe moo e neng e le lerootho ho feta kamoo ke neng ke nahana hore ho tla leka ho teneha hape nakong e tlang
28,regarding cobra meeting however did not attend as he for a farewell party to mark the end of his premiership is this true is such a dick,"mabapi le seboka sa cobra leha ho le joalo, ha ho na motho ea tšoaeang mokhelo ho tšoaea pheletso ea sephutheloana sa hae ke 'nete"
29,in quagmire attire it is a farewell party to,ho quagmire ho otlila ke mokete oa bo-rawwell ho
30,he reportedly said this at a meeting of of all in the on evening which was by and the highest ever,o ile a tlaleha a bua sena kopanong ea bohle mantsiboea a neng a e-na le a phahameng ka ho fetisisa
31,amen and another also said lord i will follow thee but let me first go bid them farewell which are at home at my house and said unto him no man put his hand to the plough and looking back is fit for the kingdom of god luke,"amen e 'ngoe e boetse e re ke tla e latela empa e re ke romelle letsoho ntlong ea ka,' me ka sheba morao ka morao e loketse 'muso oa molimo luka"
32,in a romantic reverie i like the fluff of the simal tree morning with all its grace while i was in her embrace and she in some other world without a trace leaving me behind without a word of farewell kind in my silent space,moqomong oa lerato ke rata fluff ea sefate sa sim hoseng ka mosa kaofela ha ke ne ke le moiketeng oa ho lula u le mong sebakeng sa ka se khutsitseng
33,what is your piece of music it was nice to see because i like 'farewell to ' is that it,'mino oa hau ke ofe o neng o le monate ho bona hobane ke rata' ho rata 'ke hore
34,bin made a personal farewell to president bin at airport he t there for,bin o ile a etsa mofani oa mopresidente ho mopresidente bin at in in airport a teng
35,i feel like is on his th farewell tour,ke ikutloa eka ke leetong la hae la th
36,farewell,farewell
37,contact in the last between and for de the distance in price is getting smaller and the farewell of the dutch is getting closer and closer,ikopanye le ea ho qetela pakeng tsa le de sebaka sa theko e ntse e eketseha le mokhoa oa madutch o ntse o atametsoa haufi le haufi
38,saying farewell to a track field legend is officially retired,ho re ho fetisetsa ho papatso ea poleloana ea tšimo ho tlohela mosebetsi ka molao
39,rolling stone and farewell,rolling e rolling and farewell
40,_maguire who s going to his farewell party virtually every one of them the corrupt crook out,_magure ea ho ea moketeng oa hae oa hau o batla o le mong oa bona e mong le e mong oa bona
41,day farewell madden tour weekend,letsatsi la day farewell maden tour
42,why were we told it was a farewell party on second do not bother to ask,hobaneng re ne re e boleletse hore e ne e le mokete oa ho hloka mothating oa bobeli ha o tšoenyehe ho botsa
43,who to see in las for his final farewell we do burrito,ke mang ea tla mo bona ho las bakeng sa mokhoa oa hae oa ho qetela oo re o etsang burrito
44,my name is shadow i am the world is ultimate life form there is no time for farewell,lebitso la ka ke moriti ke 'na lefatše ke boemo ba bophelo bo phahameng ha ho na nako ea ho batla
45,taps i my farewell,li-li-li-iqane tsa ka
46,lovely of martin is farewell mass a few ago at for his move to _europe,ho rateha martin ho na le boima ba 'maloa tse fetileng bakeng sa ho fallela ho _europe
47,happy last day of everyone will something be revealed today we will wait and see i will stream in a bit and i hope to see you all at the farewell party,"letsatsi le monate la ho qetela la motho e mong le e mong o tla senoloa kajeno, 'me re tla ema' me ke tla tla ho tla u bona kaofela ha motho a le mokheng oa bo-rateng"
48,farewell smile hello evil,"farewell, pososelo hello hello"
49,petition to take farewell transmission off this list,kopo ea ho nka phetiso ea ho fetisoa lenaneng lena
50,actually he s already stated that he s going to give a proper farewell soon he just t have time because he to join barcelona on their preseason tour before it was too late,ha e le hantle o se a ntse a re
51,farewell,farewell
52,a guide without a valley from an evil hull a farewell following an unsettling thing,tataiso ntle le phuleng ho tsoa bohareng bohle ba bohloko bo haufi le ntho e sa feleng
53,had his jersey on before the player got injured in the th minute and the coach had to use his last sub like he should have got min maybe a farewell minute,o ne a e-na le jersey pele sebapali se tsoa motsotso o le mong mme mokoetlisi o ne a tlameha ho sebelisa sa hae sa ho qetela joalo ka ha a ne a ka ba le metsotso e sa sebetseng
54,vice president 'farewell gift' in form of  ameaningful and productive',"mofetoleli oa mofesisi oa mopresidente ""ka mokhoa oa ho amana le ho beha"""
55,must have been significant enough to want to warn the people of to come during his farewell speech,e tlameha ebe e ne e le bohlokoa haholo ho batla ho lemosa batho ba ho tla nakong ea puo ea hae
56,farewell to and _sfv_asf from the both have themselves well with two very passionate of you are always welcome back to to see either or thank you for coming over,farewell ho isa ho _sfv_asf
57,before this merry farewell also was emotional,pele ho nako ena e monate le eona e ne e le maikutlo
58,i just to see in las for his final farewell,ke mpa ke le ho bona ho las bakeng sa pholiso ea hae ea ho qetela
59,trialist farewell to former club the citizen,teko ea teko ho ea pele ho crourven
60,to park for the very last time with their farewell show jungle party book your and be ready to come wearing your wild animal costume big people too and get ready to party book,ho paka lekhetlo la ho qetela ka mokhoa oa bona oa ho etsa jungle sa mofuta oa hau oa bo-rakōpo tsa jungle
61,i would rather have pure forest or in the place of every large city of this world might be too late for me to say might be too late to watch this sick old city die go on the road yeah i am going to try to say sick city so long farewell and die,nka mpa ka ba le moru o hloekileng kapa sebakeng sa toropo e 'ngoe le e' ngoe e kholo ea lefatše lena e ka ba ho senyeha ha ke e-na le ho shebella toropo ee ke tla leka ho bua ka tsela ee ke tla leka ho bua e batla e telele ebile e shoa
62,this week we say farewell to while strengthening a base a very fun but bittersweet episode to say the least tech talk state of decay part,bekeng ena re re ha u le haufi le ha re matlafatsa setsi se monate haholo empa se-thotho sa boea ho bua boemo ba puo ea bonyenyane haholo
63,vice a farewell gift as monsoon session in,motsotsi ke mpho e sa reng letho e le seboka sa monssoon ho
64,_cfr this is the problem you were multiverse level for a farewell movie,_cfr ena ke bothata boo u neng u le maemong a mangata bakeng sa filimi e sa tloaelehang
65,beat _game is farewell in and a massive improvement to and k very of my progress,beat _game ke mokhoa o moholo oa ho etsa ntlafatso e kholo ho isa ho k bakeng sa tsoelo-pele ea ka
66,then farewell take care of yourself pure vanilla,ebe o rata ho itlhokomela ho sa feleng ho feta vanilla
67,i am a massive fan so i totally get it saw him on his farewell tour in park in,ke fan fan e kholo kahoo ke mo bona ka ho tla mo bona leetong la hae la ho paka
68,enjoy the beauty of a sunset and enjoy nature s farewell kiss for the night,thabela botle ba letsatsi le monate la tlhaho la tlhaho bakeng sa bosiu
69,off the final leg of his north farewell tour night at bank park it was his concert in the city of brotherly love,leoto la ho qetela la teropo ea hae ea north farewell ho banka e ne e le konsarete ea hae toropong ea bara ba motho
70,_kingkaizer_ he got into a battle had stomach cancer which took him out after the battle was also there gave him a farewell with naming him he was in cat,_ekaizer_ a kena ntoeng e ne e na le mofetše o ne o mo tlosa mofets'e oa ka mor'a hore ntoa e mo tlohele le ea mo atametsa.
71,i am the child of after all and it is unnatural for the of the sea to live on the surface t it if i am causing trouble if i am nothing but a burden we must bid farewell yes,ke ngoana oa ka mor'a tsohle mme ha ho na tlhaho ea leoatle ho phela ka holimo ho eona haeba ke se na mathata haeba ke tlameha ho etsa joalo
72,farewell my friend,farewell motsoalle oa ka
73,what about danger so what what about risk let is climb the mountain before we cross that bridge cause i am restless i am restless i am restless for whatever comes next how wonderful to see a smile on your face it farewell for a welcome home parade,ho thoe'ng ka kotsi e le hore na ke eng ka lebaka la likotsi pele re sa phutholoha hore ke phomole ka ho fetisisa
74,farewell forever why did i do that why did i do that why did i do that,"o ile a rata ka ho sa feleng, hobaneng ke entse joalo hore na ke hobane'ng ha ke entse joalo hore na ke hobane'ng ha ke entse joalo"
75,_online exactly i am completely fine with hacking away at a difficult stage multiple times just do not make me waste time in the middle so much that i can not iterate quickly celeste with this well generally but i spent a whole month on the last part of farewell,_online ka botlalo ha ke na ho senya sethaleng se thata haholo ha ke sa nke eka ke nako e telele haholo empa ke ne ke sa khone ho qeta khoeli e le ngoe ea ho qetela
76,us for wedding party is but he and his wife hold a farewell party for the same who would have gone to the wedding party on the same day,rona bakeng sa mokete oa lenyalo ke hore eena le mosali oa hae ba na le mokete oa bo-ntate bakeng sa ba ka be ba ile moketeng o le mong ka letsatsi le le leng
77,i just to see in las for his final farewell,ke mpa ke le ho bona ho las bakeng sa pholiso ea hae ea ho qetela
78,farewell,farewell
79,me i will go now i have a to rule over farewell,ke tla ea joale ke tlameha ho busa ka mokhoa o fetelletseng
80,you will be glad you read it the sun also farewell to arms are favorite,u tla thabela hore u e bale letsatsi le ntse le lumellana ka matsoho
81,about to start to these white men then farewell fam,hoo e ka bang ho qala ho banna bana ba basoeu joale farewell fares
82,ben t lost a game for yet immense player farewell,ben t o ile a lahleheloa ke papali bakeng sa sebapali sa 'mele se seholo
83,i just to see in las for his final farewell,ke mpa ke le ho bona ho las bakeng sa pholiso ea hae ea ho qetela
84,off well with the farewell to then it s gone downhill training kit is an abomination we re being like a league team no away no in the middle of is the hold up don t they want our money,e felile hantle ka mokhoa oa ho ts'oaroa ka nako ea koetliso ea ho koetlisa.
85,farewell to them we will remember them fondly,re lokela ho ba rata ka lerato
86,hey yeah it s farewell from season of the splicer i love this thing i wish i had a better roll on it now that full auto is a you can use,"hey, ke ho fetisa nako e telele ho tloha nakong ea setlankane seo ke lakatsang hore ke be le taba e ntle hona joale hore auto o ka sebelisa"
87,how some people still tried to defend his farewell message he s been this for and you t have prepared anything he just t care,batho ba bang ba ntse ba leka ho emela molaetsa oa hae oa mokhoa oa hae oa mokhoa oa hae oa mokhoa oa hae oa hore o lokisitse eng kapa eng eo a sa e tsotelleng
88,that he farewell in such a friendly fashion just before getting like he is aware of what is about to happen,eo a neng a lula ka mokhoa o mosa joalo pele a khahloa ke hore o tla tseba hore na o haufi le ho etsahala
89,farewell,farewell
90,no hardship to sign a shirt for a supporter who backed him for sterling probably million from his time at city why after leaving a class farewell message do such a crass thing,ha ho na mathata ho saena motjeko oa motšehetsi ea ileng a mo tšehetsa ho tloha ho limilione ho tloha ho nako eo molaetsa o fanang ka eona
91,_willowraven probably you up but the best one to watch is farewell to the flesh the one in new the best one i think,_willodraven mohlomong u oa holimo empa e ntle ka ho fetisisa ea ho shebella e batla e le ntho e ncha eo ke e nahanang e ncha
92,done with sport too cruel farewell beautiful game,e entsoe ka papali e ntle haholo ea lipapali
93,faithless is he that farewell when the road j r r in towel,na o na le tumelo ke hore na tsela j r r lowel
94,there is no farewell between us i still hope,ha ho na motho ea u ratang pakeng tsa rona ke ntse ke ts'epa
95,the clark show with tonight live on join to say farewell to the week with some of the best music from across and android launch lexicon radio live,clark show le bosiung bona ba phela ho kenya letsoho ho re ka mokhoa o mong le o mong oa 'mino o mongata o tsoang ho phosa le oxicon
96,farewell to as he barcelona for m,farewell ho tloha joalo ka barcelona bakeng sa m
97,san there is not a year that goes by that i do not regret bidding you farewell i hope we can meet again soon so i can make amends for leaving you by yourself message mi i am guessing only the most prominent of us are still around then,san ha ho lefe ha ke ikoahlaee hore ebe ke ts'epa hore re ka kopana le uena ka ho fetisisa
98,read a farewell to arms next if you have not prob my favorite book,bala mokhoa oa matsoho o latelang ha o sa khone ho bona buka ea ka eo ke e ratang ka ho fetisisa
99,the farewell flower,palesa ea farewell
100,daily record what channel is warsaw live stream and kick off for farewell friendly the polish side will welcome postecoglou is side as part of the for fan,kemiso efe ea letsatsi le letsatsi e nang le chankaneng ea warsaw e lula e le botsoalle le ho rala ka lehlakoreng la polish.
101,there was no time for a proper farewell everything had to happen very quickly and spontaneously i said 'guys thank you very much everything will be today' we made history together i will never forget it,"ho ne ho se na nako ea hore lintho tsohle li tlameha ho etsahala kapele le ka boithaopo ke itse ""bashanyana ba tla leboha haholo kajeno 'ha ke sa tla lebala"
102,farewell sweet little princess,o ile a natefeloa ke khosatsana e nyane
103,before i slit your throat i will give you a kiss said softly you will find out exactly how much better i am at giving farewell then you can go off to heaven,pele ke thellela 'metso oa hau ke tla u fa kakofa ho thoe u tla fumana hore na o tla fumana joang hore o na le chelete e ngata haholo
104,job interview time everyone wish me a farewell so they want to give me money so i can survive and eat lots of,nako ea ho khutlisa mosebetsi o motle ka hona ba batla ho mpha chelete e le hore nka phela le ho ja tse ngata
105,i just to see in las for his final farewell,ke mpa ke le ho bona ho las bakeng sa pholiso ea hae ea ho qetela
106,buffy is mum as well as in the raw after piper the farewell show for lee with his da is boots in the ring,buffy ke 'mele hammoho le ho piper ka mor'a ho etsa joalo ka lee ka da du ke lirifi
107,i to show you my elegant grown self and have you at ease that is what the repayment festival is for i really to do that properly saying farewell really lonesome but throwing a tantrum will not get us anywhere,ke tla u bontša 'nete ea ka ea ho iponela
108,a swift outfit change upon hearing his farewell tour is now going to include a last minute visit to,phetoho e potlakileng ea ho utloa ha ho utloa hore o tla ba le ho etela motsotso oa ho qetela ho
109,if a farewell party at dose not kill the do not know what will,haeba mokete oa bokhelohi ka lebaka la ho se bolaee ha ho tsebe hore na ho tla etsahala'ng
110,farewell,farewell
111,contact in the last between and for de both are close to agreeing on a fee and the farewell of the dutch is getting closer and closer welcome to united malacia bat and,ikopanye le ho qetela pakeng tsa ho qetela 'me ka bobeli ba haufi le ho lumellana ka tefiso le mokhoa oa madutch ho atametse ho ba ratoang ho malacia bat
112,i should have said farewell to you when everyone else did and not hold on to it for a long time,"ke ne ke lokela hore ebe ke ile ka u joetsa hore na bohle ba neng ba e-na le bona, 'me ha baa ka ba e nka nako e telele"
113,is a farewell do presumably at expense at the p m s country residence of think his belated wedding celebration to another debate am warming to penny getting hotter being,ke mokhoa o motle ka ho fetisisa ka litšenyehelo ho bolulo ba naha ea ho nahana hore mokete oa lenyalo o benyang ho pente e 'ngoe o futhumatsang penny o ntse o chesa
114,i want to wear a to my farewell so bad everyone is going to wear one,ke batla ho roala bophelo ba ka bo bobe le bo bong bo tla apara e le 'ngoe
115,was nonpartisan independent and still no president read or to his farewell address and written by st secretary as building is next to the,e ne e se e ikemetse ebile ha ho na mopresidente ho bala kapa aterese ea hae e ngotsoeng le ho ngoloa ke mongoli joalo ka moaho o haufi le
116,contact in the last between and for de both are close to agreeing on a fee and the farewell of the dutch is getting closer and closer,ikopanye le ea ho qetela pakeng tsa ba bang ka bobeli ba haufi le ho lumellana ka tefo le takatso ea madutch e ntse e atamela le haufi
117,nobody for when he was out of form nobody for when he deserved a proper farewell when i see so much by media for their poster boy it like he become something superior than and cricket,ha ho motho ea neng a sa tšoanelehe ha a sa tšoane le motho e mong ea ka ha ke bona batho ba phahameng ka har'a media ho bona hore e be ntho e phahameng ho feta le cricket
118,i decided to record all the on sky and then watch it after about a year or watch the leading up to the farewell,ke nkile qeto ea ho ngolla leholimo le leholimo ebe ke e shebella ka mor'a selemo kapa ho shebella e lebisang ho moferefere
119,don t forget to register for so you backstage to the farewell tour,u se ke oa lebala ho ingolisa bakeng sa uckstage ho isa terakeng ea hau
120,farewell party for after reaching,mokete oa hau oa ho fihlela
121,tiger bade farewell to st with a tearful on,tiger boade farewell ho ea morusu ho
122,elephant garlic is an interesting vegetable like a huge ordinary garlic but being mild enough to eat just as a side vegetable,garlic ke meroho e khahlisang joalo ka konofolo e kholo e tloaelehileng empa e le bonolo e lekaneng ho ja feela joalo ka meroho e ka lehlakoreng
123,vice president m productive monsoon session as a 'farewell gift' from opposition who will complete his term as vice president and ex of the upper house on august by,seboka sa mopresidente sa monsoon monsoon monsoon
124,top tune me and a mate went to his farewell gig he did at arena in there were and us two left way before the end it was full of,top ea holimo le molekane o ile a ea grawere ea hae e sa tsoa fihla arena a e-ba teng le rona ka tsela e setseng ea pele e ne e tletse
125,i am sorry to see him go such a good guy he a nice party and a good farewell,ke masoabi ho mo bona a ea moshemane ea hantle joalo ka mokete o motle ebile o motle
126,i just to see in las for his final farewell,ke mpa ke le ho bona ho las bakeng sa pholiso ea hae ea ho qetela
127,_ farewell mate hope you had a great time,_ mantay
128,good night may we have pleasant or if it s dawn then may your journey be safe farewell for today,bosiu bo monate bo ka ba le monate kapa haeba ho hlokahala hore u be le leeto la hau le bolokehileng kajeno
129,chairman m of all of house to ensure good monsoon session of parliament this would be their farewell gift to him,modulasetulo m oa ntlo eohle ho netefatsa seboka sa mofuta o motle oa pansoon sena sa polokelo ena e tla ba mpho ea bona ea ho feta
130,what did do at the farewell do yesterday that they have to bring out the big news about not showing a photo of that bloke formerly known as prince,se etsahetseng maobane se entse maobane hoo ba tlamehang ho hlahisa litaba tse kholo mabapi le ho se bone setšoantšo sa shasake eo pele e neng e tsejoa e le khosana pele
131,me and say by just going farewell it that voice sometimes,'me' me u re ka ho tsamaea ka mokhoa o hlakileng ho eona ka linako tse ling
132,_apac in the photo of the government document of forced mobilization after before to i took a commemorative photo with my behind them is written farewell party with best friend,_apac foto ea tokomane ea mmuso ea ho ba le menyako e qobelloang kamora hore ke tle ke nkile setšoantšo sa ka se ngotsoeng ke motsoalle oa hlooho ea khomo
133,i am charging myself up that is what farewell to the old me the new me will survive and persevere with everyone,ke iphumanela hore ke eng eo ke neng ke lula ho eona e tla phela le ho tiisetsa le motho e mong le e mong
134,farewell tour,leeto la farewell
135,not farewell i am now awake,eseng mokhoa oa ho lula o tsohile
136,i am a dance for tomorrow we have the farewell for the batch before us,ke motjeko oa hosane re na le mokhoa oa ho rata batch ka pel'a rona
137,chairman good monsoon session in as farewell gift read the news from by visiting the link,seboka se setle sa monssoon se fumanehang joalo ka mpho e kholo ea bosoaso ba bala litaba tse tsoang ka ho etela sehokelo
