,src,trg
535,_potato both can be flimsy pretext to justify a justice s favored outcome i don t find either persuasive in i never found a justice who applied textualism entirely consistently fairly it s a fool s errand they invariably give in to bias modernity or common sense,_potato ka bobeli e ka ba ka lebaka la ho lokafatsa sephetho sa toka hore ke se ke ka fumana toka
536,persuasive and learned that we gain perfect knowledge of _,susumetsa ebile o ithutile hore re fumana tsebo e phethahetseng ea _
537,here let me help you grow up and learn false analogy a type of informal fallacy or a persuasive technique in which the fact that two are alike in one respect to the invalid conclusion that they must be alike in some other respect,mona e re ke u thuse ho hola le ho ithuta papiso ea maikutlo a sa reroang kapa mokhoa o thibelang pele ho fihlela qeto e fapaneng ea hore li tlamehile ka tlhompho e itseng
538,any have any data on the long term efficacy of for change persuasive empathy or educational particularly about the environment looking for any,"leha ho le joalo, ho na le data e ngoe le e ngoe e atlehileng ea ho fetola kutloelo-bohloko ho ferekanya kutloelo-bohloko kapa ho fana ka maikutlo mabapi le tikoloho o batla eng kapa eng"
539,i wonder why every now and then when i write a series of persuasive twitter to alter their filing or chronological algorithm so my appear out of sequence am i alone on this,kea ipotsa hore na hobaneng ha ke ngola letoto la twitter ea ho ferekana kapa ho hlahella ka tatellano ea ka.
540,_d if you want to win someone s vote and yet insist on calling them a term they don t use how is that persuasive or anything other than insulting persuaded a bunch of people to vote for trump in which we re doing something wrong,_d haeba o batla ho hapa vote ea motho e mong mme leha ho le joalo e tsitlella ho ba letsetsa hore ba se ke ba etsa hore batho ba etse hore batho ba etse hore re etse ho hong ho phoso
541,reflection paper reaction paper literature book analysis movie analysis argumentative essay sop background persuasive essay quiz translation mil philosophy economics,tlhahisoleseling ea pampiri ea tlhahlobo ea lipampiri tsa litaba tsa lipapatso tsa ts'ebetso ea tlhahlobo ea lifilimi
542,he is not persuasive at all he could not crack to a,ha a susumetse ho hang ha a khone ho senya a
543,_tempered_ all your are hanging from a thread of reality then built on hyperbolic propaganda talking there are humane and statistically persuasive to be had but i understand why you would be irrationally fearful,_erped
544,if a person whole brain death or even sufficient death to permanently snuff out their consciousness i do not think they are a person you might but saying though human is not persuasive,haeba motho a le bokoang ke lefu kapa lefu le lekaneng hore ke se ke ha u tsebisa ka ho sa feleng.
545,_latenightlogic __petal _rider _old_guy _arts _shanobi that would be interesting as the base core are white historical don t lie unless corrupt persuasive rhetorical its self again again again,_latenlog
546,for if persuasive discourse the of a certain vile persuasion drug and city state and by,hobane haeba haeba ho na le puo e susumetsang ea karolo e itseng ea pherekano e nang le tšusumetso ea lithethefatsi le naha ea toropo le ka
547,persuasive official video via,video e susumetsang ka semmuso ka
548,differentiate informative or persuasive speech,phapang puo e loketseng kapa e susumetsang
549,nanny both sad and more persuasive manner most often people _,nanny ka bobeli ba na le maikutlo a mabenyane a ho susumetsa haholo batho ba bangata hangata.
550,exactly the dead don t care about the semantics of the argument and if the argument solely on semantics than it s not very persuasive,hantle-ntle ba shoeleng ba sa tsotelleng ba limmanics tsa khang ea ngangisano le haeba khang e ne e le li-semanty ho feta ha li susumetse haholo
551,one of the most persuasive tactics known to man,e 'ngoe ea maqheka a susumetsang ka ho fetisisa a tsejoang monna
552,i was with you in weakness in fear and in much trembling and my speech and my preaching were not with persuasive of b human wisdom but in demonstration of the spirit and of power that your faith should not be in the wisdom of men but in the power of god,ke ne ke na le bofokoling ka tšabo le ho thothomela haholo 'me puo ea ka le boqapi ba ka e ne e sa lokela ho ba bohlaleng ba batho empa ka matla ho molimo
553,association fallacy chronological snobbery naturalistic fallacy dixit suppressed base rate fallacy fallacy motte and bailey persuasive definition if by whiskey false authority definitional retreat moving,mokhatlo oa faulocy snobecal snobber snobber
554,yeah i thought it would be good for us he as he over to the door and it i may have the owner to close the bar just for us the flash great persuasive,"ee ke ne ke nahana hore ho tla ba molemo ho rona joalo ka ha a ea monyako, 'me ke kanna ka ba le mong'a ntlo bakeng sa rona e khanyang"
555,let s talk in private and find out my dear is this persuasive enough,tlohella ho bua ka sephiri 'me u fumane moratuoa oa ka ke ho susumetsa ka ho lekaneng
556,i do not really have the to make the most cogent version of the case but i find the argument that the history of the st century church more sense if there is a historical to be fairly persuasive,ha ke na taba ea ho etsa mofuta o potlakileng haholo oa hore ke fumane khang ea hore na nalane ea kereke ea cenkholo
557,there should be a limit on the number of to be in congress the house and they are the system with bias political persuasive discernment more are without and pushing conspiracy,ho lokela ho ba le moeli ho palo ea ho ba khopolo ea ntlo 'me ke tsamaiso ea khethollo ea lipolotiki tse sa lumellaneng le ho theola morero
558,many talent asset emphasize the significance of a persuasive prospect experience substantial familiarity with the candidate journey is the foundation,letlotlo le leng le mangata le hatisa bohlokoa ba tebello e susumetsang ba na le tloaelo e kholo ka leeto la mokhethoa ke motheo
559,maybe origin t be the be all and end all to how persuasive wane is,"mohlomong tšimoloho t eka ke bohle bohle, 'me u qete kaofela ho isa pheletsong e susumetsang"
560,it s giving persuasive i had so much fun this number on the stage in front of of people who came out to the festival today,ho fana ka ho susumetsa hore ke ne ke natefeloa haholo ke palo ena mohatong ka pel'a batho ba tlileng moketeng kajeno
561,i was going to comment around on the ground high is not a very persuasive protest,ke ne ke tla fana ka maikutlo ho potoloha le fatše ha se boipelaetso bo susumetsang haholo
562,holy mackerel batman that s got to be people out of and so persuasive it s a slam dunk,holy mackerel batman ea ho ba batho ba tsoang le ho ba susumetsa
563,only comment with something other than the above if you can back it up with a persuasive argument ie,fana ka maikutlo feela ka ho hong ntle le tse ntle ka holimo haeba u ka e khutlisa ka ngangisano e susumetsang ke hore
564,counterpoint read any article from major media they are text book persuasive essay style key the to an opinion on the data revert time ask because the major are,sekaseka sengoloa se seng sa media sa media ke senotlolo sa mongolo oa moqoqo oa moqoqo ka lebaka la nako ea data ea data e botsa hobane e le ea bohlokoa
565,why is the us the only country with our stupid medical system we pay twice as much per for worse rich people from all over the world come to the us for medical care if everyone was rich that might be persuasive too bad most people are not rich,hobaneng re le naha feela ka tsamaiso ea rona ea bongaka e hlokang kelello e mebe le ho feta lefats'eng lohle e tla re susumetsa haholo batho ba bangata ha ba ruile haholo.
566,being persuasive is better than it s not as mentally and it how mature you are,ho susumetsa ho molemo ho feta ha ho joalo ka kelellong le hore na o holile joang
567,i don t care why they re doing it glad they re protecting themselves and and providing good role and of n p mask wearing insurance demanding should be persuasive argument itself there s enough risk they don t want them unmasked,ha ke tsotelle hore na hobaneng ba u eletsa
568,the video you are so of that that fractional vote was from a system it then that system is no longer in use and not been for very persuasive,video eo u e voung eo u e voung e neng e tsoa tsamaisong eo ke sisteme eo e seng e sa sebelisoe ebile e sa susumetse haholo
569,this we hopefully not by persuasive it s _,sena re se ts'epa hore ha re u susumetse s _
570,_zaza _a_buzzi love the persuasive still try,_zazaza _a_za_ o rata ho susumetsa
571,are not passive they are persuasive in the savior s way elder l,ha li na taba.
572,he is so persuasive,o susumetsa haholo
573,__maramara giving very much yea this where it s at persuasive ass,__maramara e fana haholo e fana haholo mona hore e be esele e susumetsang
574,_potato there is also the matter of your fellow i am guessing the most persuasive writing the opportunity to become the majority opinion if enough people sign on to it,_potato ho boetse ho na le taba ea 'na ke nahana ka ho ngola monyetla ka ho fetisisa monyetla oa ho ba maikutlo a mangata haeba batho ba lekaneng ba e saena
575,the next three will only how important actual are the climate itself will be really politically persuasive no amount of will cover for opening new fossil fuel production people will be paying attention and their vote on it,tse tharo tse latelang li tla susumetsoa ke ntho ea bohlokoa feela moo motho ka boeona a tla susumetsoa ka mokhoa o hlakileng ha e le hantle ha ho na palo ea lihlahisoa tse ncha tsa moea o mocha oa ho bula le uena
576,mighty persuasive to coin a phrase,ho susumetsa ka matla ho coin polelo
577,i find box office interesting because it is an experiment over and over of some of the most well funded persuasive people trying and sometimes failing to attract enough attention from the to meet their profit,ke fumana ofisi ea lebokose e khahla hobane ke teko ea hore na batho ba bang ba nang le tšusumetso e matla haholo ba lekang 'me ka linako tse ling ba hloleha ho hohela phaello e lekaneng ho fihlela phaello e lekanang
578,agree with that i haven t always written out to but i doing it recently for significant and i find it very helpful not that i ever answer them verbatim of course but it me to think about the most persuasive way to answer,"lumellana le hore ha ke sa tla lula ke ngoletsoe empa ke e etsa haufinyane haholo, 'me ke e fumane haholo ha ke nahana ka tsela e susumetsang ka ho fetisisa ea ho araba"
579,_fitz so a supernatural explanation for the universe is more persuasive than a scientific explanation,_fitz e le tlhaloso ea tlhaho ea bokahohle e susumetsa haholoanyane ho feta kamoo ba hlalosang saense
580,_anne _onfire _only _ _ ____roar____ _kobylarz _hrc why do not ever roll out that line of argument it would be a hell of a lot more persuasive than their usual,_anne _onfire _only _ _ ____roar____ _kobylarz _hrc why do not ever roll out that line of argument it would be a hell of a lot more persuasive than their usual
581,_ i mean been very persuasive in proving this,_ ke bolela hore e susumetsoa haholo ho paka sena
582,it s very difficult to be sincere on twitter or else some people just struggle with it perhaps all of us we get real time feedback on our social media performance and so the authentic can no longer exist because it gains a persuasive awareness of itself human all too human,ho thata haholo ho tsoa ho twitter kapa ho na le batho ba bang ba loanang le bona ka tsela ea sebele eo re e fumanang ea ho fumana molaetsa oa litaba tsa sechaba le 'nete motho
583,_nalder you are clearly unequipped if you find persuasive,_nalder o sa khetholloe ka ho hlaka haeba o fumana ho susumetsa
584,you is limited beyond your ineptitude your data is missing many data and is and borderline persuasive content that may be politically it should be if you support russia you support,u haelloa ke ho hloka toka ha hao data ea hau e haelloa ke data e ngata ebile e le meeli e susumetsang e ka ba haeba u ts'ehetsa russia
585,when the people find out how you sweet and persuasive and charismatic you been being with the unbaptized not even your ocean blue will save you,ha batho ba fumana hore na u monate hakae le ho susumetsa le ho fana ka maikutlo ha u sa khone le
586,persuasive speech revision and speech script,phetolelo e amanang le puo le sengoloa
587,when i see encouraging everyone to wear i fail to see this most basic and necessary part of the equation like this don t conform to the of persuasive communication and are thus less effective than the average s commercial,ha ke bona ho khothatsa motho e mong le e mong ho roala karolo ena ea mantlha le e hlokahalang ea equation joalo ka puisano e amanang le sthaneteng ho feta khoebo e tloaelehileng
588,very persuasive interesting choice imagery it is lost on you of course,litšoantšo tse khothalletsang tse khothalletsang tse khothalletsang li lahlehile ho uena
589,my speech and my preaching were not with persuasive of human wisdom human wisdom is quite mediocre,puo ea ka le boboleli ba ka e ne e se ka ho susumetsa bohlale ba botho bo bohlale ba batho ke mediocre
590,_barbie persuasive now what is your personality like,_basarbie e susumetsa joale botho ba hau bo joalo
591,not all are equal he obviously won enough of his case that he s back on twitter now indestructible that s significant the line that he lost most of his t very persuasive,ha se bohle ba lekanang ka ho hlakile hore o hapile taba ea hae e sa sebetseng hantle hore ke ntho ea bohlokoa haholo ho feta ea hae
592,that is angry for you very persuasive,eu halefisang haholo
593,it does not always have to be zero but i do not find it persuasive,ha ho hlokahale hore e be zero empa ha ke e fumane
594,urgently tackle the need for creative and persuasive community health put on it task with the job and every would understand aerosol transmission infection and risk identification mitigation by next,e rarollotsoe ka potlako tlhoko ea bophelo bo botle le sepheo se khothatsang
595,what a brilliant and persuasive argument i would like to subscribe to your newsletter,ke phehisano e kholo le e susumetsang ke ka rata ho ipehela lethathamong la hau la litaba
596,thanks need to go read the whole filing now and yes that it s imperative that you need to review data is not going to be persuasive to a de chancery judge a merger agreement on a complaint for specific performance,thanks e hloka ho bala ho fifala kaofela hona joale 'me ehlile ke eona e hlokang hore u hlahlobe tumellano ea ho lekola tumellano ea ts'ebetso ea ts'ebetso
597,_potato less of a messy compromise but more treacherously open to politically expedient outcome driven abuse i found and _vladeck persuasive here,_potato e nyane ea sets'oants'o se sa tsitsang empa se pepenene ho hlekefetsoa ka lipolotiki
598,people believe these there are multiple here because of marketing repetition repetition repetition it is now an myth and as once said the great enemy of the truth is the myth persistent persuasive and unrealistic,batho ba lumela sena ba bangata mona ka lebaka la ho pheta pheta phetetso hona joale ke tšōmo 'me ka nako e kile ea susumetsa sera se sa pheleng se khothatsang le se sa utloahaleng
599,wow he is very impressive that like obama'a speech at convention in of power and persuasive style,wow o khahlisa haholo tse kang puo ea obama'a kopanong e amanang le matla a matla le setaele
600,i think that pretty persuasive soaking the rich is hugely popular and should be an engine for wealth via transformative but a shrinking but still influential group of just love the rich and will not tax them,ke nahana hore ho susumetsoa hamonate e ntle haholo
601,it is silly a group would create a enormous fraud staging false persuasive and use goon tactics and terror only to see historical sanitation and false applied after the fact,ke sehlopha sa boea se tla etsa hore boloi bo boholo bo tsamaisang maqiti a tebileng le ho sebelisa maqiti le tšabo feela ho bona 'nete ea histori le ho bona.
602,have not to it but i do not doubt that is it is persuasive and i do not doubt that lots of are brilliant at people stuff i know some of them just do not think it is a compelling,ha ke so ka e bona empa ha ke belaele 'me ha ke belaele hore lintho tse ngata li se ke tsa nahana hore ke tšusumetso
603,it must be a priority for national cabinet to urgently tackle the need for creative and persuasive community health on social and media to lift voluntary compliance with public health anything less would be absurd and a dereliction of duty,e lokela ho ba ntho ea pele ea khabinete ea naha ho sebetsana ka katleho tlhoko ea sechaba se nang le botsitso sechabeng le meemo ho ka se utloang le ho se sebetse ha mosebetsi
604,not reading that persuasive essay,eseng ho bala moqoqo o susumetsang
605,this history will not be kind rhetoric is not as scary and persuasive as you think the country needs strong leadership from the like this and telling people to go vote t do it,nalane ena e ke ke ea ba mosa ka mosa ha e tšohe ebile e susumetsoa ke hore u nahane hore naha e hloka boetapele bo matla ho tsoa ho sena le ho bolella batho ho ea vote o e etsa
606,there s so much potential but it actually running on it in a persuasive way,ho na le menyetla e mengata empa e hlile e sebetsa ka tsela e susumetsang ka tsela e susumetsang
607,_furiouser _willness yeah i do not find that argument that persuasive,_filer _willness yeah ha ke fumane khang eo e susumetsang
608,the is only a medium for and revenue no different than any other communication advancement in human history you still need to have a very good product or service and a persuasive reason why people should buy it otherwise nothing,ke motho ea mahareng feela bakeng sa ho beoa feela ha ho na molao o mong le o mong oa puisano pele u ntse u e reka le mabaka a susumetsang
609,the emotional persuasive vantage is all you can muster where is the ethical appeal could it be due to a lack of trust coupled with absent veracity,boitšoaro bo amanang le maikutlo ke sohle se o ka se khonang
610,_jamieson the whole chapter structured around the three that push us to read as revealing is such a strong piece of work a joy for the already persuaded but perhaps even more importantly it may prove persuasive to the not quite convinced yet,_jamienson khaolo e hlophisitsoeng ho potoloha tse tharo tse re fokotsang hore re bale ka lebaka la ho senola empa mohlomong ho ka ba joalo
611,one of the midwest is top marketing on brand is this in i will be leading an afternoon session on persuasive marketing stop by my session not registered there is still time,e 'ngoe ea bohareng ba ho bapatsa ka botlalo
612,this generation of will come into power in or less a slick talking hyper persuasive activist who made their money from these social will promise them the change they seek at the expense of humanity,moloko ona oa ho tla ka matla kapa o sa thekese sebui se kopanang le lihlong tse entseng hore chelete ea bona e be se nang le setjhaba sena se tla ba ts'episa phetoho eo ba e batlang ka litšenyehelo tsa botho
613,just mayor speak on s pod today he s such a persuasive eloquent speaker i love his he made me want to vote for him and i don t even live in that state,mayor a bua ka s s pod kajeno
614,how i got attached to the name about a decade ago up the meaning for it and found and industrious looking it up now and finding other such as wily persuasive to strive or excel rival and of all emulate,kamoo ke khomaretsoeng lebitsong ka leshome moo ke buang ka eona 'me ke fumane moelelo oa eona' me ke le mahlahahlaha ho loanela ho ikemisetsa ho khomarela kapa ho bona.
615,_stardust excellent response very persuasive you must be a lawyer,_partardufs karabelo e ntle haholo e susumetsang u tlameha ho ba ramolao
616,the whole tribe thing is really tiresome yes the phenomenon you are to but to posit that all your are constantly by it we point out the with your framing is not persuasive nor interestingly insightful,ntho eohle ea morabe e hlile e khathatseha e le ntho e kholo.
617,you must be very persuasive,o tlameha ho susumetsa haholo
618,i do not know enough to agree disagree with that assessment but either way at least try to make the lack of assistance a persuasive argument never mention new scary tech to a judge without explaining what precisely you mean by the jargon and why the jargon,ha ke tsebe ho lekaneng ho lumellana le tlhahlobo eo empa bonyane leka ho etsa hore ho se khone ho etsa kopo e sa amaneng le ho hlalosa hore na ke hobane'ng ha jargon
619,hah i m sure you re much more persuasive than you give yourself credit for,hah ke na le bonnete ba hore o ntse o susumetsa le ho feta hore o inehele
620,great by on how to be more persuasive with or of influence _mgmt,e ntle haholo ea hore na u ka susumetsa le ho feta
621,_ where in the have you got that from that t even been your point all along anyways first time you said that anything to look coherent and persuasive i guess,_ moo u nang le eona
622,of to guide to persuasive by nancy,ho tataisa ho susumetsa ka nancy
623,got me,nketse
624,the white paper was supposed to have been convincing and persuasive and now not a shred of that document been you can t be convincing about a massive leap into the unknown and that s why independence will never happen,letlapa le lesoeu le ne le lokela ho kholisa le ho susumetsa mme joale ke hobaneng ha o ka ba o khomaretse ka se sa tsebeng letho
625,the peach more persuasive manner most often people have just discovered our dear colleague _,peach e susumetsang haholo hangata batho ba sa tsoa fumana mohoebi oa rona ea ratehang _
626,ad to betray frustration with inability to construct a coherent persuasive argument the fact that you limited this,papatso ho pepesa pherekano ka ho sitoa ho haha ​​mabaka a kopaneng 'nete ea hore u fokola tjena
627,can you please help us elect a proper prime minister what do you think about this persuasion canada usually does not see this persuasive,"ka kopo, na u ka re thusa ho khetha tona-kholo e nepahetseng eo u nahanang ka eona mabapi le tšusumetso e teng hangata ha e bone e susumetsang"
628,you are persuasive and a clown,o susumetsa le clown
629,little for a lunch and the kosher an extra i mean whatever the market is a bit less persuasive when the market is only you,hanyane bakeng sa lijo tsa mots'eare le kosher e eketsehileng ke bolela eng kapa eng eo ke e susumetsang ha mmaraka o ntse o le teng feela
630,sure thing i m definitely going to heed your advice what with your persuasive and objectivity i should definitely spend more time concerned with and and attack someone who got into law with a congress,ntho ea sebele ke tla ela hloko keletso ea hau ka tšusumetso ea hau le sepheo sa hau se amehileng ka molao le motho ea kenelletseng ka molao
631,my giddy aunt i am trying to find write a persuasive white paper,ke kopa ho nka lengolo la ho ngola pampiri e tšoeu e susumetsang
632,and if persuasive discourse the injustice of the past and deed one must assign blame and make mercy abound,'me haeba ho na le puo e susumetsang ho hloka toka ea nakong e fetileng le ka nakoana e lokelang ho abela molato le ho u hauhela
633,so much of the coup was out in the open will republican or even a small fraction of republican response to the tiny of smoking gun testimony by the committee or the will anything be persuasive,boholo ba cop e ne e le bulehileng e tla ba rukoloha e le rurehaneng kapa esita le karoloana ea karabelo ea republican kapa ea komello e nyane ea komiti kapa eng kapa eng e tla susumetsa
634,_joemanchin the deep state can be very persuasive in threatening these people and their it,_jemanchin naha e tebileng e ka susumetsa haholo ho sokela batho bana le sona
635,_fuston i m a very evil who sent a draft back in that ended at that moment for help between two after reading and at me for a while she wrote a long and persuasive essay with for possible and,_fuston i m
636,it is that you believe this is a persuasive argument,ke hore o lumela hore ena ke phehisano e susumetsang
637,as someone unbiased in the entire contest although i felt gilbert is speech was persuasive and somehow more influential than that of cuba is on being the st runner up and for winning,kaha ke motho ea sa hlokeng letho
638,i prefer to give and the press wide latitude under but s here are persuasive,ke rata ho fana le ho tobetsa ka bongata ka tlase empa ke mona ho susumetsoa
639,i have to say though the other guy is campaign slogan is pretty persuasive,ke tlameha ho re le hoja motho e mong a le lets'oao le letšolo la molao o susumetsoa hantle
640,i know you are persuasive,kea tseba hore o susumetsa
641,_v nting_page one might be more persuasive if one chose not to fill one is example with you the second person plural and singular pronoun,_v nting_p
642,you are talkative and persuasive,o bua le ho susumetsa
643,_bc it would be considered persuasive,_bc e ne e tla nkuoa e le tšusumetso
644,today have been schooled in the art of persuasive great generation of on the horizon,kajeno li kene tsebong ea moloko o matla o matla oa ho fapana
645,can highly recommend my very lovely persuasive in partner one of those people who when you say you have got a problem an issue a thing to do is always the first to say 'what can i do how can i help ' lovely to see this cat,re ka khothaletsa ho susumetsa ka mokhoa o motle haholo ho motho eo u reng u na le bothata ke hore na ke mang ea pele ea ho re 'ho monate ho bona katse ena
646,me trying to tell my grandma let the go,ke leka ho bolela nkhono oa ka tlohella ho ea
647,persuasive crazy live from the bet via,bokhoni bo susumetsang ba phela ho tsoa ho bet beke ka
