,src,trg
609,you re probably right about that i m it s his farewell tour following in his father s,mohlomong u tlameha ho etsa joalo ka ho temela leeto la hae le latelang ho ntate oa hae s
610,tough one for some what s your favorite farewell live recording leave for why _carl,e thata bakeng sa ba bang ba hau ba ho rekota ho robala ka mokhoa o ratoang haholo
611,farewell to you as well may the light of the keep you and if you ever wish to reconvene you know where to find me,e le hantle le uena e ka u boloka u le teng
612,one of your an article in the neighbor section read their story on patch the expressed in this post are the author s own,e 'ngoe ea sengoloa sa moahisani ea moahelani ea moaparo o ile a bala pale ea bona ho patch e hlahisitsoeng ka poso ena ke ea mongoli
613,i just wrote the best farewell text of my life,ke sa tsoa ngola mongolo o motle oa bophelo ba ka
614,sorry i know this t the farewell party you were for,ts'oarelo ke tseba mofuta ona oa hau o ne o le bakeng sa
615,is back at for what could be the tennis icon s farewell to the sport s most iconic championship is back could it be her farewell,"e khutletse bakeng sa mofuta oa tennis e ka bang """
616,its but it is a great farewell to original original transformation and it is a and something new all at once very and,e ea pele empa e batla ho fetoloa ho feto-fetoha ha eona ea mantlha le eona ke le ho hong ho honyenyane bohle ka nako e le ngoe haholo
617,outgoing health boss will be up for tonight at his farewell in wellington grant to attend when a few ago about his first song of choice said i am in love by,mohiri oa bophelo bo botle o tla tsoha bosiung bona ha a le hantle ha a le wheilwan grant ho ea teng ha e le 'maloa ka pina ea hae ea pele ea khetho e reng ke leratong ka
618,wearing a and running to school with toast in my mouth i am and today is my last day of school i fought and eldritch but now i face my ultimate challenge yet my farewell speech,"ho roala le ho kena sekolo ka molomo ka melomong ea ka, 'me kajeno ke letsatsi la ka la ho qetela la sekolo ke le phephetso ea ka ea bohlokoa empa ke tobane le bothata ba ka ba ho qetela"
619,this when i had a particularly difficult year six class there were two insidious ring one male one female a girl gave me a farewell card at the end for the dreadful behaviour of the class quite uplifting,sena ha ke ne ke e-na le selemo se thata haholo sa sehlopha sa botšelela ho ne ho e-na le mohala o mong oa mosali e mong oa mosali ea nang le karete ea mofuta o tšosang ea sehlopha se phahamisang
620,farewell fight,fatewell
621,it is easy to get teary eyed about the demise of print media but when did we pick up a newspaper or magazine and generally read it sometimes we just need to bid farewell to the of digital plus it is better for the environment,ho bonolo ho fumana eyed ka mokhoa o hlakileng oa mecha ea litaba empa re nkile koranta kapa makasine ka linako tse ling re hloka ho rala ea dijithale le ho feta.
622,page by page that was your farewell speech,leqephe ka leqephe leo e neng e le puo ea hau
623,i want him to retire a cavalier so badly watching retire as a laker would make me sick to my stomach downtown is going to be lit during his farewell tour,ke batla hore a tlohele mosebetsi o motle haholo oa ho shebella ha motho ea tsukutloa a e-na le ho kula ka mpeng a tlamelle nakong ea ha hae
624,so long farewell,e telele haholo
625,farewell global liberal cannibalistic conspiracy i hereby resign because sorry it s unclear that the baby eating is getting us any closer to that new world order via,leqhubu la libese tsa global global calibalist contiractick confirator
626,ratio rate apa,tekanyetso ea karolelano apa
627,heaven an angel yesterday was my death anniversary and i was literally sobbing during the event i am due to loosing someone i love but sometimes u can not live forever farewell grandma,"leholimo la maobane, 'me ke ne ke le sehopotso sa ka sa lefuba' me ke ne ke le sebata ka ketsahalo eo ke tlamehang ho lokolla motho eo ke mo ratang ka ho sa feleng"
628,nobody year old me ugh a farewell is at least in the top i am going to have at my funeral what about you,ha ho na motho ea kileng a nkhahlanyetsa haholo
629,meanwhile wade was brought back to for a farewell tour had a farewell tour dirk dame likely will those farewell tour are only possible if most of a career was spent in one place,ho sa le joalo wade e ile ea khutlisetsoa bakeng sa leeto la bo-ramoadland e ne e ka ba teng.
630,no disrespect to or jay but that s not exactly a marquee farewell,ha ho na ho hloka tlhompho ea ho hlokahalla kapa ho ba bonolo empa ha se feela sekheo sa maeruwe
631,write you want to move on from on a piece of paper then you write so happy grateful now i let go the sad and delete all the i have no regret no resentment towards everything then tear it up piece by piece make a farewell,ngola u batla ho tloha sekhechaneng sa pampiri ebe u ngola thabo e monate
632,farewell transmission on converge radio,phetisetso ea ho fetisoa le radio ea converge
633,and say farewell to pal after a swanky lunch in keeping it real with the never afraid to splash the cash and let us know all about it even in these difficult times quite out of touch and vulgar,'me re re ho phela ka mor'a lijo tsa motšeare tsa swanky ka ho le boloka ka ho se tšabe chelete le linakong tsena tse thata haholo
634,the end of an era link for s emotional farewell,qetellong ea khokahano ea nako ea ooa bakeng sa maikutlo a maikutlo
635,the most bittersweet moment of our is saying farewell to our thank you for making our summer so special we learned so much from you and can t wait to see you again and thank you for your support,"motsotso oa rantterweet ka ho fetisisa oa rona o re o re leboha ka ho etsa hore lehlabula la rona, re emetse ho u bona hape, 'me re tla leboha ka tšehetso ea hau"
636,foolish night at the crossroads farewell to arms gentleman the lusty men my life to live,bosiu bo booatla ho ea ho crossroads o batla ho ea le monna oa matsoho bophelo ba ka ba ho phela
637,collins in the air tonight first farewell tour,likhomo tsa moea bosiu bosiung bona ba pele
638,it is also probably the most fascist would be trump made the the laughing stock of the world done the same for the with his complete up of and this lot want to carry on where he is left off and farewell to our,hape ke eona e nang le bo-ntate-motheo e ne e tla ba koloi e tšehali ea lefatše e etsoang ka mokhoa o tšoanang le ea hae e felletseng ea hore na o tloheloa kae
639,farewell,farewell
640,_staniforth a farewell to arms by off my love of reading for about,_saniforth o rata ho tsoa matsohong a ka hore ke se rate ho bala
641,farewell s,farewell s
642,family farewell to man who in boat crash in,lelapa le batla ho tsoaloa ke motho ea robetseng ka sekepe
643,farewell,farewell
644,farewell,farewell
645,my toxic trait is i let someone break me over over again until the dust that is no longer buildable upon to reassure myself that the farewell is eternal,tšobotsi ea ka e nang le chefo ke hore ke tlohelle motho e mong hape ho fihlela lerōle le se le sa khonehe ho iphelisa hore ho ba le bohato bo sa feleng
646,yeah man this farewell substitution in the th minute on hit hard,ee monna enoa ea sarewell ka motsotsoana o tsoang ka thata
647,those are about to experience hefty farewell,tse haufi le ho ba le mofufutso oa hefty
648,another day another wee farewell party in ward thanks you have been so great we look forward to seeing you back in a couple of in your blues just like our,"letsatsi le leng la mokete o mong le o mong oa wee o na le teboho kea leboha, o labalabela ho u bona ka makhetlo a 'maloa joalo ka rona"
649,flair is on his umpteenth final match it is the equivalent to kiss doing a farewell tour and a year later doing a reunion tour lather rinse repeat,flair e holim'a papali ea hae ea ump ea ho qetela e lekana le ho aka ka lebaka la ho akana le ho akheha ho etsa mosebetsi oa koluoa
650,farewell good may you find your worth in the waking world,"farewell hantle, na u ka fumana bohlokoa ba hau lefatšeng la ho tsoha"
651,compulsive liar crook falsely he  wouldelivered every promise' in  havengeful' farewell speech mirror,search e ratoang ea leshano e ne e le seipone se seng le se seng sa puo ea ho robala hantle
652,_designs i thought it was this honestly but i sat across from someone who had covid at my farewell lunch so was worth getting tested to be sure,_dedegns ke ne ke nahana hore ke ena ka botšepehi empa ke ile ka lula ho motho ea behileng lijong tsa ka tsa mots'eare ho batloa ho ba le bonnete
653,farewell today s perfect celebration of your life was truly wonderful your adorable your and joe your wife and your many spoke about you with emotion with humour and with so much love rip we love you x,mokhoa oa hau o phethahetseng oa bophelo ba hau o ne o khahlisa haholo oa hau 'me jose mosali oa hau le batho ba bangata ba ne ba bua ka uena ka maikutlo le lerato leo re le ratang ka lona x
654,today the news broke that made to resign the good doctor will be fondly for his glossy magazine cover photo and daily and of course for occasionally lying under oath to congress my elegy,kajeno litaba li ile tsa putlama tse entsoeng ho tlohela ngaka e ntle e tla ba lerato la hae le letsatsi le letsatsi le letsatsi le letsatsi le letsatsi ka nako le nako
655,even if you to externally compose yourself the residue of fear in the pit of your stomach step on a and you ought to bid your farewell to your life his presence only abysmal fortune for you,le ha o ka ipolella ho ipolella ka sekoting sa ho tšoha ka sekoting sa 'mele oa hau ho ea' me u lokela ho fumana mokhoa oa hau oa bophelo ho uena
656,all rounder ben farewell to cricket,ben rounder ben farewell ke cricket
657,a farewell tour for someone who only made it out of the first round x in his career and the straight with the really good player for sure but on a farewell tour,leeto la bohato la motho ea le mong bakeng sa motho ea e fumaneng ka lekhetlo la pele x mosebetsing oa hae le ho otloloha ha sebapali se setle haholo
658,i pray your prediction about dying of natural does not come to be right i hope there is some desperate true patriot a fitting farewell for the orange monster,ke rapela ponelopele ea hau mabapi le ho shoa ha tlhaho ha ho na bonnete ba hore ke tšepa hore ho na le ba bang ba 'nete ba patisisa bakeng sa monster ea orange
659,_barco farewell king see you in the show,_barco farewell king ke tla u bona pontšo
660,they do not even show the crime and farewell my turnabout is such an important case too c,ha ba bontše tlolo ea molao 'me ha ba phehelle ka lebaka la ho feto-fetoha ha hae ke nyeoe ea bohlokoa hakana c
661,too many farewell y'all,e ngata haholo
662,for you and and farewell boo,bakeng sa hau le ho rata ho reka
663,farewell transmission on converge radio,phetisetso ea ho fetisoa le radio ea converge
664,today will retire its iconic that been a recognizable staple of the brand since growing up with throughout my life i have considered it to be a symbol of my childhood so here is a tribute i put together as a farewell to the,kajeno e tla boloka mokokotlo oa eona e neng e le staple ea eona e nang le tsebo ea hae ho tloha bophelong bohle ba ka ke e nkile e le sesupo sa bongoaneng ka hona mona ke sebōpeho-leseling ho
665,farewell r and r st after r is on the mast to prepare for r is in shed for work to be done,farewell r le r has
666,spotted at johnson is farewell as he with 'contempt' what arrogant obsequious tory arses,o bone ho johnson e le hantle ha a na le 'ho nyelisa' se antšōmo ea ho nyahama ho soabisang
667,i m looking for it the omen of farewell in our conversation i still don t know,ke e batla e le omen ea ho fetisa moqoqong oa rona ha ke tsebe
668,life is a fickle i remember when my on last year few days after her birthday one of our to ask for the burial after he and we are nothing but in this world farewell in your journey to eternity,bophelo ke phoso eo ke e hopolang ha selemong sa ka sa matsatsi a seng makae ka mor'a letsatsi la rona la ho kopa leetong la hau ho ea ka bosafeleng
669,so far it s still farewell to the flesh,ho fihlela joale e sa rare nama
670,farewell ma you brought so much light to and may your light continue to shine bright on your journey beyond we will miss you,papatso ea hau u tlisitse leseli haholo 'me leseli la hau le ka tsoela pele ho khanya leetong la hau ho feta ha re tla u hloloheloa
671,family farewell to man who in boat crash in news weather sports,lelapa le batla ho ratana le motho ea robetseng ka sekepe ho ea lipapali tsa litaba tsa litaba
672,three the pair woke up just after sunrise and up their in silence they left with a quick farewell to the innkeeper who was sweeping when they out neither knew where they were headed next just that they to leave being on the run was kind of,ba bararo ba ile ba tsoha feela ka mor'a ho khutsisa ha letsatsi le chankana ba ile ba tloha ka potlako ha ba ne ba se ba fihla ba ntse ba le tseleng
673,if his farewell tour would stick,haeba leeto la hae la boithabing le ne le tla khomarela
674,lived it it farewell,e phethile eona
675,farewell my good and faithful servant,fana ka mohlanka oa ka ea lokileng le ea tšepahalang
676,farewell dash,farewell dash
677,i just to see in las for his final farewell,ke mpa ke le ho bona ho las bakeng sa pholiso ea hae ea ho qetela
678,me saying farewell to my bed before i go on vacation on,ke re o robala betheng ea ka pele ke ea phomolong
679,farewell global liberal cannibalistic conspiracy via,farewell libery cannibalistics
680,the book store is the very famous and the final book he wrote was the dangerous summer not one of his best i m told if you haven t read the sun also or farewell to arms get on it,lebenkele la libuka ke lona le tummeng le ikhethileng leo a le ngotseng ke lehlabula le kotsi ha se e mong oa hae oa hlooho ea khomo eo u neng u e tseba
681,ran down into the cabin to speak another farewell word there,o theohela ka kamoreng ea ho bua ka lentsoe le leng le le leng moo
682,back in after a spectacular match with the young private party received a not so hog farewell from who both however to the shock of all in attendance making the save,morao ka mor'a papali e ntle le mosebeletsi oa boimana a ikemetseng o ile a fumana hore na ka bobeli ke mang ka bobeli ho ba bang ho ba teng
683,to you still beautiful even after death i say my farewell,ho uena u ntse u le motle leha lefu leo ​​ke le etsang hore ke tsebe
684,even the treasurer s report was alarming why does the portfolio have so much do we control the economy or not farewell global liberal cannibalistic conspiracy via,le tlaleho ea treasurer e ne e le tšobotsi hore na sethala seo re se etsang ha re laola moruo kapa hona ho se khone ho laola thepa ea lefatše ka bongata ba lefatše ka cannibalist cannibalictiff
685,on the ticker blue state insanity liberal city lawlessness farewell genuine question how can anyone regardless of their political believe this is a legitimate news organization thankfully it s on mute w o closed at this place,sebakeng sa tekete ea triker blue insuran inkhor inwashing city ho na le motho ea buang ka lipolotiki.
686,the band is saving that interview for their farewell and thanks for all the fish tour,sehlopha se boloka lipotso tseo bakeng sa polelo ea bona ea mosali le teboho bakeng sa leeto lohle la lihlapi
687,farewell global liberal cannibalistic conspiracy via,farewell libery cannibalistics
688,farewell to the legendary i am for an art that is political erotical mystical that does something other than sit on its ass in a museum i am for manifesto image in piccadilly circus tate collection,farewell ho pastendary i e le tsebo ea lipolotiki e etsang ntho e 'ngoe ea lipolotiki e etsang ho hong ntle le ho lula sebakeng sa pokello ea pokello ea lipontšo tsa pokello ea libuka.
689,rave up rave up and dance dance as a farewell i m howling so hey answer me are you there,rala rave up le dance dances e le mots'eare o le ho ho ho ho ho ho ho ho ho ho ho ho ho ho hoo
690,how was your flight today what did the crew do best farewell,sefofane sa hau se ne se le joang kajeno se ile sa etsa hore se-crew se tsamaee hantle
691,the time come again i fear but if the smile upon us we will soon meet again farewell dear friend farewell dear friend,nako e tla hape kea tšoha empa haeba ho re bososela ho rera re tla kopana hape motsoalle oa hae oa ho rata motsoalle oa hau ea ratehang
692,i just to see in las for his final farewell,ke mpa ke le ho bona ho las bakeng sa pholiso ea hae ea ho qetela
693,_conductor __london i would like to go on the farewell but if there is a chance of like that being on there i will give it a miss,_conductor __olondon ke kopa ho ea ka mokhoa o motle empa haeba ho na le monyetla oa ho ba teng moo ke tla e fa phoso
694,in a lifetime the farewell tour at see,bophelong ba bophelo bo botle ba bona
695,but it t what it s cracked up to be,empa ke ho etsa hore ho be le
696,the end of an era link for s emotional farewell,qetellong ea khokahano ea nako ea ooa bakeng sa maikutlo a maikutlo
697,spotted at johnson is farewell as he with 'contempt',"e bonoetse johnson e hatetse pele ka ""nyeliso '"
698,get your to see the o jay s farewell tour the st at the crown join us pay tribute to the radio hall of on sale now,etsa hore u bone hore na u rata ho etela leraba la hlooho
699,farewell transmission on converge radio,phetisetso ea ho fetisoa le radio ea converge
700,event wish farewell of drop rate for childe hydro stock up on and in the event wish to make your party in combat event wish duration after update,ketsahalo ea kelello ea drop ea drop ea hydro ea hydro ea hydro e ka u thusang ho etsa mokete oa hau oa ho loants'a
701,you have a vivid imagination farewell,o na le mohopolo o hlakileng
702,a farewell ceremony,mokete oa mofuta oa tlhaho
703,on cam smith is rise tiger is farewell to st the future of the tour,ka cam smith ke tiger tiger e le phepelo ho loantseng bokamoso
704,though life is merely a journey to the grave it must not be without hope only then will a traveler is story live on by those who bid him farewell,le hoja bophelo bo le leetong la ho ea lebitleng leo ho tla lokela ho ba ntle le tšepo feela ke hore na motho ea tsamaeang ka nako eo o tla phela ke ba mo etellang pele
705,i will be listening to run u at and just to say because i know i never listen again once run u remix is out farewell run u,ke tla u mamela u le ho re ka lebaka la ho re hobane ke tsebe hore nke ke ka mamela hape
706,today was bittersweet i said farewell to the best interpreter and to my awesome new principal,kajeno e ne e le bonyenyane ke ne ke re o na le chelete e ntle ka ho fetisisa ho ea ho mosuoe-hlooho ea khomo ea ka e ncha
707,_m for yeah he s chasing history i probably run a young guy to win with big props and maybe even sprinkle in on his farewell,_m e le hore o tsoala nalane ea hae ke matha moshemane e monyane hore a hlole le litlatsetso tse kholo mme mohlomong o bile a fafatsa ka mokhoa o moholo
708,farewell,farewell
709,farewell to the goalie super ally and brown lead,farewell ho enelie super ally le lead
710,i m of who i become in i m definitely not pleasant to be around with that s why i bid farewell to all the toman you get it right i don t want you all to be involved with me,ke 'na eo ke bileng ho' na ha ho monate ho ba haufi le seo
711,it is time to bid farewell find out the top money learned while hosting we talk for a crash course on the money that her transform her personal listen now,ke nako ea ho fumana chelete e ntle e ithute chelete e kaholimo e ithutoang ha re ntse re bua bakeng sa thupelo ea lefu lena ka chelete ea hae ea ho mamela hona joale
712,the end of an era link for s emotional farewell,qetellong ea khokahano ea nako ea ooa bakeng sa maikutlo a maikutlo
713,_umarulhasan welfare can only happen after we bid farewell to these and,_marulhasasan.
714,agora na farewell de the,agora na farewell de
715,farewell pat king,farewell pat king
716,their setting u up to fail u just do not see it remember when u got the phone call to say a farewell and the subsequent party gate fine who set that up that was the step executed by carrie is little if u take up the poison chalice fool,u tla u beha ha u e-na le ho hloleha
717,farewell global liberal cannibalistic conspiracy via,farewell libery cannibalistics
718,farewell stream tonight pst it s been a great but some must come to an end for the and good come chill with me and the unstoppable crew tonight for one last stream hope to see you all there,e sa rarolloe bosiu.
719,on the weekend i had the pleasure of hosting a farewell dinner for my friend and colleague ambassador of kaha thank you for your contribution to the un and you all the best in your future,ka beke ke bile le thabo ea ho amohela lijo tsa mantsiboea tsa ka le motho eo u sebetsang le eena ea ka sehloohong bakeng sa monehelo oa hau u le mong
720,smith a farewell from a basement on the hill,smith
721,i will give you a minute let you have peace i will say farewell to what i can not tell i bet that you will do just the same,ke tla u fa motsotsoana hore o na le khotso eo ke tla e bua ka seo nka se buang ka sona ke tla se etsa hore u tla etsa joalo
722,_r i dont think we like at all but i hope you re doing well and if you re not i hope that you end up doing better d farewell i suppose,-
723,the to turnabout big top and the to farewell my turnabout rival each other as the worst in the whole trilogy in my mind,ho ea holimo le ho fetisa phetisetso ea ka e kholo ea ho fetolela boemo ba ka ba turnabout e mong le e mong ka ho fetisisa e le tse mpe ka ho fetisisa tsebong eohle ea ka
724,it is so lukewarm it is driving me crazy farewell to the and you know like this for life that,ke uena ea nang le moea o mo hlanya ka mokhoa o hlanyang haholo 'me o tseba sena bakeng sa bophelo boo
725,after almost three with you my cute little buddy comes now the day to bid you farewell we had a great time together and i hope we see each other after life again you the best hamster ever i be missing you my little rip,kamora hoo e ka bang ba bararo le uena motsoalle oa ka ea motle o tla hona joale letsatsi la ho ba le nako e ntle re bile le nako e monate
726,continuando el farewell tour con evil within es,connubangnda el farewell tour conbent con hellas
727,definitely not for definite hall of but not a fan of the farewell tour guy been on it for about now he is becoming the reason why so many softball think they can play in the,ehlile ha e na lerato le hlakileng
728,faithless is he that farewell when the road,na o na le tumelo ha tsela
729,farewell sweet cruelty,o ile a fana ka sehlōhō tse ntle
730,farewell global liberal cannibalistic conspiracy,farewell ganeral libery cannibalistics
731,big news of the departure of key the club is saying farewell to the totally fabulous _corbin juggling star highly promising _chloeessam very talented good luck to all of them,litaba tse kholo tsa ho tsamaea ka mokhoa oa sehlooho
732,near the settlement of al on the path to where the caravan of from the farewell pilgrimage,haufi le bolulo ba al tseleng e tsoang moo k'haraveneng ea ho tsoa ho moetsi oa farewell
733,farewell my princess i shall never forget our days together at the palace few though they were,o tla lebala khosatsana ea ka ha ke sa tla lebala matsatsi a rona ka ntlong ea borena e 'maloa ha e ne e le
734,w h a t,eng
735,superintendent board in her farewell to district,boto ea supermententrant botle ho ea setereke
736,farewell,farewell
737,__ farewell,__ farewell
738,trying not to cry while watching a modern farewell,ho leka ho se lle ha o ntse o shebelletse ka mokhoa oa sejoale-joale
739,farewell the floor up and me into the ceiling,e batla e le fatše le nna ka siling
740,buddy i m still here i stop by during your shift to say farewell one last time,buddy ke ntse ke le teng mona ke ema ka nako ea hau ea ho re: ho bua nako e le 'ngoe ea ho qetela
741,farewell to police on,rata mapolesa ho
742,_ my most recent article about the farewell to ritual,_ sengoloa sa ka sa morao-rao se mabapi le mokhoa oa ho etsa moetlo
743,i said it in the discord and i say it here said some weird about the derby afterwards as if he s not that interested and now he s in a boost on to get past round with do you really take out on a farewell your call,ke e boletse ka tsela eo ke neng ke e bua mona ho boletse tse ling tse makatsang mabapi le derby ka ha e le hantle le uena u batla mohala oa hau
744,tomorrow is the day i say farewell to primary for the second time in my life ago was the first and i would never though that then that i would ever be back as a teacher if you would have my teacher then they would have said the same thing,kamoso ke letsatsi leo ke reng ke le mateane bakeng sa lekhetlo la bobeli bophelong ba ka bo fetileng mme ke ne nke ke ka khutla.
745,i smash what i am to know and bid farewell to tomorrow,ke roba seo ke lokelang ho se tseba le ho seballa ho ea hosane
746,well let is go on ahead and win the this year that would be a good farewell,ha e tsoelepele pele 'me e hlola selemong sena e ka ba moputso o motle
747,_n_moths farewell,_n_moths farewell
748,me in tuesday is,ka labobeli ke
749,farewell hello twitter,farewell hello twitter
750,dummy run for _starmer is farewell speech after the next on the bounce general election for,dummy tsamaisoa bakeng sa _starmer e batla ho bua ka mor'a ho latela likhetho tse akaretsang bakeng sa
751,your wall was torn off the promise was with a kiss of an eternal farewell,lerako la hau le ile la tšeloa tšepiso e neng e na le ho aka ka mokhoa o sa feleng
752,__ d way farewell n condolence bin on all social media platform d so if a tiny of such n care was shown her i dont tink we be condolence her day let n d world how u feel about some wen dey r alive,__ d mokhoa oa ho tsoaloa n
753,my baseball farewell caption was longer than that,caned ea ka ea li-baseball farewell e ne e le telele ho feta moo
