,src,trg
0,so where are we with this eisenhower is farewell address,joale re hokae ka eisenhower ena
1,to you still beautiful even after death i say my farewell,ho uena u ntse u le motle leha lefu leo ​​ke le etsang hore ke tsebe
2,bid farewell to the final semester of the department of aeronautical engineering recently we wish all the best to all the final year for their future ahead,bid a batla semesetara sa ho qetela sa lefapha la boenjiniereiie a aeronautical haufinyane re lakatsa tsohle tse ntle selemong sohle sa bokamoso bakeng sa bokamoso ba bona bo tlang pele
3,a great sadness farewell,ho hlonama ho hoholo
4,to all my family out there that are over life and want it to end just find one thing of beauty to be grateful for each day we lost a few this year that just t go on and to their i send my i m sorry l love you farewell,ho lelapa lohle la ka ka ntle ho bophelo le ho batla ho khaotsa ho fumana ntho e le 'ngoe feela ea botle le ho feta eo re e ratang
5,it is one more dance and then farewell cheek to cheek in hell with a dead girl,ke motjeko o mong hape ebe o ratana le marama a marameng a lihele le ngoanana ea shoeleng
6,farewell good magician i will try to go home,farewell hantle feela ke tla leka ho ea hae
7,so grateful to have had one more day spending time w this amazing team thank you _ team for a wonderful day as my farewell tour comes to a close keep inspiring i m cheering you on always,ke leboha haholo hore ebe ke qetetse ho qeta nako e le 'ngoe ea sehlopha sena se hlollang hore u tla u joetsa
8,are you ready with farewell tour farewell tour shirt buy now,na u se u itokisitse ka mofuta oa litoro tsa hau tsa farewell
9,i just to see in las for his final farewell,ke mpa ke le ho bona ho las bakeng sa pholiso ea hae ea ho qetela
10,hum world cup me farewell match ni jab k already world cup se ho thy,hum pen world
11,farewell paradise,paradeiseng ea hau
12,farewell friend you re welcome back,motsoalle oa hau oa khale u amohela
13,in a private meeting with us president in president revealed the existence of the farewell dossier a collection of showing the soviet union had been stealing technological research and development,sebokeng sa batho ba ikemetseng le rona mopresidente a ile a senola hore ho na le pokello ea ho bonts'a soviet union
14,at the very least don t mourn or regret until our farewell don t let go of my hand,"che, don tri ea sianyana kapa ea ikoahlaea ho fihlela ha re e-so tlohele letsoho la ka"
15,is busy on right now his long long long farewell you know important to the us,e ntse e tšoarehile ka nako e telele ea nako e telele eo u e tsebang ho bohlokoa ho us
16,a farewell following an empty position a calm beyond a callous wall besides a welcome face,tšoaneleho e latelang ea boemo bo se nang letho e khutsitse ho feta lebota le bobebe ntle le sefahleho sa kamohelo
17,announcement my twitter account is now permanently retirement for good because it is getting too old pointless unoriginal useless and boring for no reason forever and farewell my ice cream note please try not to cry or sad,phatlalatso ea ka ea twitter ea twitter e se e sa sebetse hantle hobane e ntse e se e sa sebetse hantle ebile ha e rate ho se khone ho lla kapa ho hlonama
18,_zian _dan_castell yeah he was until decided to bid farewell to his point and extended the track by you are telling me to try and turn into the corner in brazil was his fault,_zian _dan_castell yeah o ne a etsa qeto ea ho etsa kopo ea hae ebe o atoloha ho leka ho leka sekhutlo naheng ea brazil.
19,farewell,farewell
20,we have a great time but now it was too to say to one of my childhood the old so farewell old r i p old,re na le nako e monate empa joale e ne e le ho bolella e 'ngoe ea bongoana ba ka ba khale joalo
21,we sob like we did at the farewell,re sobe joalo ka ha re ne re le mothating
22,_farewell i m so excited,_zarell ke thabile haholo
23,_farewell fantastic,_farell e monate
24,farewell anna,farewell anna
25,farewell,farewell
26,this farewell event to be about to,ketsahalo ena e tummeng ea ho ba teng
27,my name is shadow i m the world s ultimate life form there s no time for farewell,lebitso la ka ke moriti ke mofuta oa bophelo ba lefatše ha ho na nako ea ho rata
28,farewell site we will miss you and all the good we had and we made and we lost,setsi sa farewell re tla u hloloheloa le sohle se re sitisang 'me re se re se re se re lahlile
29,_mccausland oh you now sound like one of them farewell to you,joale oena joale o u utloahala joalo ka e 'ngoe ea tsona e le' ngoe
30,farewell song in the wild bunch with guitar via,pina ea ho rata ka har'a sehlopha sa hlaha ka guitar ka
31,i love how much been hanging with today saw them together a few times even before the derby manny is the one that said was not getting enough of a farewell tour around its picked up ever since then,ke rata kamoo ho lekanyelitsoeng ho tsona kajeno ho ba bona hammoho makhetlo a 'maloa le pele ho manny ea derby ho tloha ka nako eo
32,i bid farewell to the leisure time of the afternoon like a,ke kopa ho rata nako ea boikhathollo ea thapama joalo ka a
33,farewell feline,farewell feline
34,desolate farewell the two should be the same the,lesupi ea lesupi e lokela ho ba e 'ngoe e lokela ho ba e tšoanang
35,i have always been the in your presence but i know you could not stay so this is my soul missing you every night baby if you send me a farewell maybe i finally could let you go,kamehla ke lula ke le teng ha u le teng
36,do you have  wouldifferent favorite' depending on mood setting when it comes to i have with the with mixed company hot fuzz with myself farewell my lovely,na u na le lintho tse khahlisang tseo u li ratang haholo ho latela maikutlo a ho beha ha ke tla le ka har'a k'hamphani e chesang e nang le moea o chesang
37,thanks to my mentor peter so for a farewell dinner at my favorite place in a genuine historical and contemporary food with elegant peter is a great mentor and a human being and we should have more like him in,ka lebaka la moeletsi oa ka peter kahoo bakeng sa lijo tsa mantsiboea tseo ke li ratang haholo tsa nalane le tsa mehleng ea sebakeng se setle ebile ke motho oa hae ebile re lokela ho ba le eena ho feta eena.
38,my problematic waste of an existence tearing to right before your share a universal smile i m sorry you had gotten so unlucky this time around how i m wishing you a better farewell in the next life,tšabo ea ka e nang le mathata e nyolohela ho hang ka pele ho pososelo ea universal i m
39,_ yep true hope he does well in his farewell match,itekane ea 'nete o etsa hantle ka papali ea hae
40,who idolize and revere and his presidency yet constantly diss on for every reason you can think of try to remember one thing and revered he lived their in retirement until death he made sure to honor it in his farewell too,"ke mang ea rapelang le ho iphetetsa le mopresidente oa hae, a lula a nahana ka lebaka le leng le le leng u ka leka ho e hlompha ka tsela e tiileng ea hae"
41,and hell yeah it is a graduation and a farewell party is not it here you go take it,le liheleng e teng ke kakolohi le mokete oa boiphetetso ha se mona o tla e nka
42,we have merely a few on earth to make a difference and it t have to be one that is in history or the news i met too many genuine largely unknown beyond their family and community to believe otherwise,re na le ba seng ba lefatšeng feela ho etsa phapang mme ho tlameha ho ba ba histori kapa litaba tseo ke kopaneng le bona haholo tse fetang ba lelapa le sechabeng ho lumela se fapaneng
43,deserved a farewell game before he from one day and he is getting it,e ne e lokeloa ke papali ea mofuta o motle pele a tloha ka letsatsi le le leng mme oa e fumana
44,farewell to nice trust after of service on the,fana ka maikutlo a monate ka mor'a ho etsa tšebeletso ho
45,i bid farewell to a world revolving in sorrow i will protect the people i treasure,ke tloaetse ho lula ke e-na le lefatše le phahameng ka har'a masoabi ke tla sireletsa batho bao ke ba nkang e le ea bohlokoa
46,this great entrance just to get by a year old on his farewell tour thanks,monyako ona o moholo ho kena ka selemo ho ea selemo sa ho tebela ha hae
47,no this is not farewell we will meet again,ha ho joalo ka ha re tla kopana hape
48,at crematorium family teary eyed farewell,ho cretatorium ea lelapa la lelapa la cretatorium
49,got to see the incredibly gifted sir on his farewell tour truly an unforgettable once in a lifetime experience,o ile a tlameha ho bona lebitso le nang le bokhoni bo makatsang ho tloha ka mokhoa o sa lebaleheng pele ho boiphihlelo ba bophelo bohle
50,i m extremely happy he got so far almost like a farewell happy he be one of the in,ke thabile haholo o ile a batla ho ba haufi hakana joalo ka ha a le mong oa
51,i m of who i become in i m definitely not pleasant to be around with that s why i bid farewell to all the toman you get it right i don t want you all to be involved with me,ke 'na eo ke bileng ho' na ha ho monate ho ba haufi le seo
52,sir farewell to,sur farewell ho
53,yeah you never got back to me about the b'  is it is their farewell tour,ee ha ho mohla u kileng oa khutlela ho nna ka b 'ke hore ke leeto la tsona la botshepehi
54,_voice _gsg it is under his farewell to the you have to scroll all the way down,_voice _gsg
55,sa with a team is on a huge tour to starting with sa will be lead by in the absence of ben will bid farewell to after the first,sa na le sehlopha ke leetong le leholo ho qala ka sala ho tla etella pele ka ho ba sieo ha ben o tla felloa ke chelete ho latela la pele
56,farewell to in future will miss u,farewell ho bokamoso bo tla u hloloheloa
57,i had a farewell party at work people were as usual except a whole min video was to someone s personal channel without anyone s consent we came to learn about it a week later we re just walking content,ke ne ke e-na le mokete oa bo-raretsoeng ho batho ba sebetsang hantle ntle le video ea metsotso e 'ngoe e ne e le ho motho e mong hore a ithute ka beke hamorao re ntse re tsamaea
58,keep chasing that farewell tour,lula u lelekisa leeto la botshehadi
59,a ha ha farewell to those days when i wept my out,a ha batla matsatsi ao ha ke ne ke tla lla ka ntle
60,i want everyone to know i seen hit a on his farewell season and that s top on my baseball resume he s just something special,ke batla hore motho e mong le e mong a tsebe hore ke bone ka ho otla nako ea hae ea hore a na le nako ea hae ea hore na o tla qala ho qala ho hong ho ikhethang
61,farewell,farewell
62,more than your i in the heat of your as you touched me but why did you say farewell in such a cold voice,ho feta moo ke mochesong oa hau ha u a nkama empa ke hobaneng ha u ile oa re ha u na thuso ka lentsoe le batang joalo
63,_steal_yofood this her farewell tour sis is just happy to show up and actually work until are over wearing the same gear since her return told me all i to know it s a wrap,_steal_yoood tours tours offer sis o thabetse ho hlakisa 'me o sebetse ho fihlela a apere lisebelisoa tse tšoanang ho tloha ha a ne a e tseba kaofela hore ke e tsebe
64,the said in a that one hundred and forty new york army national guard assigned to the th infantry brigade team said farewell to their,e boletsoeng ka har'a li-yuniti ea sesole sa new york sa sesole sa new york sa thrown e sa tsoa fuoang
65,my job is a farewell gathering for this lady but i would much rather go to the alone,mosebetsi oa ka ke ho bokella mokete ona bakeng sa mofumahali enoa empa ke ne ke tla ea ho eena
66,farewell my media library miss you i will,fana ka laeborari ea ka ea hlooho ea khomo ea ka e u hloloheloa
67,i m so mad i t at s farewell concert tonight at,ke mo hlanya haholo ke starewell concert bosiung bona
68,interesting interview with lulu wang director of the farewell,puisano e khahlang le lulu weng motsamaisi oa farewell
69,farewell honey cat i hope you are happy in your new home,katse ea linotsi ea hau ea mahe a linotsi ke ts'epa hore o thabetse ntlo ea hau e ncha
70,a farewell to arms radio edit,tšoaneletsoa ke li-radio radio edit
71,_farewell getting bigger and bigger,_zarell e fumana e kholo ebile e kholo
72,_xy the farewell starring is a great portrayal of an immigrant family crazy rich is over the top but if you are familiar with the yes over the top n tacky culture that is pretty real at least for the core of it,_xy ea hore ho na le tšoantšitse ea lekhaletla e kholo ea lelapa la bohlanya le holimo empa ha u tloaelane le yes ka ho fetisisa
73,same farewell,moputso o tšoanang
74,now as the curtain is raising up we will leave this quiet meeting place and bid farewell,hona joale ka lesela le phahamise re tlohetse sebaka sena sa liboka le ho fela
75,ben farewell to one day international cricket south game one reaction news how to watch latest,ben farewell ho isa ka letsatsi le leng la machabeng la south papali e le 'ngoe ea likepe ho sebetsa joang ho shebella haufinyane
76,death is the eternal farewell though you try to stay by their side or to go running after them in the end all you can ever do is fall to your if your voice could reach his the you been wanting to tell him would pour out like a river overflowing,lefu ke mokhoa o sa feleng leha o leka ho lula ka lehlakoreng la bona kapa ho ea kamora bona hore na lentsoe la hau le ka ba le ho mo joetsa hore o tla tšollela joalo ka noka ho phatloha
77,unfortunately it t if you search on his farewell post comment session you see,ka bomalimabe ho batla ho fana ka maikutlo a ho fana ka maikutlo a ho fana ka maikutlo
78,me after the farewell yellow brick road concert,nna ka mor'a konkrese ea literaka tsa khauta
79,farewell game brought in more,papali ea farewell e tlisoa hape
80,zinchenko is farewell post for he could not bear the separation so he decided to follow him but don t bring those crocodile at,zinchenko o na le poso ea bohlokoa hobane a sa khone ho tsamaisa karohano kahoo o ile a etsa qeto ea ho mo latela empa ha a tlise koena eo ho
81,it was for the bubbling spring the moon goddess across the water san first there is infatuation then there is a phase wherein one all of her then one and her divinity monet is dream farewell,e ne e le bakeng sa selemo sa khokhono ea khoeli ho pholletsa le ho nkeha metsi pele ho na le phallo ea metsi pele ho na le karolo eo a le mong le e mong oa hae
82,farewell sir you were magical in,o ne a rata ho bua ka bolotsana
83,one more melodious voice bid farewell to us his mortal body left us his immortal voice live forever earth lost what heaven will miss you forever,lekunutu le le leng le letle la lentsoe le re fa letsoho la hae la shoeng le re siileng lentsoe la hae la shoeng le re siileng lefatšeng la shoe le se le siuletsa ka ho sa feleng lefatšeng le lahliloeng ka ho sa feleng
84,farewell democracy,demosrable demokrasi
85,i just to see in las for his final farewell,ke mpa ke le ho bona ho las bakeng sa pholiso ea hae ea ho qetela
86,farewell legend,farewel lege
87,i have really a farewell to arms and the sun also,ke na le mokhoa oa matsoho le letsatsi le leng le le leng
88,pat king got bail i had the wrong amount of cash for bail the total amount he is high watched his release and his ass crack smiling farewell,pat morena o ile a ba le chelete e fosahetseng ea chelete bakeng sa bail eo a mo bonang ka kakaretso a shebelletse tokollo ea hae le esele ea hae e batang
89,be my last attempt to ignore my this month farewell thanks for being a bitch this is set in ca was supposed to call it ca fling but it would too much an analogy to,eba qeto ea ka ea ho qetela ea ho hlokomoloha likhoeling tsena tsa ka tsa khoeling ea ka e batla ho ba botsoa hona ho lokela ho e bitsa ca fling empa e ne e tla ba le tšekamelo e ngata haholo
90,the farewell lulu wang,farewell lulu wang
91,temporary farewell,lesela la nakoana
92,farewell bright,farewell e khanyang
93,the proper function of man is to live not to exist i shall not waste my days in trying to prolong them i shall use my time jack farewell bond,ts'ebetso e nepahetseng ea motho ha e na ho phela ha e se ke ea senya matsatsi a ka ha a leka ho ba leleka ke tla sebelisa nako ea ka ea jack
94,in fairness all of did that when they had that embarrassing farewell gift tour,ka leeme tsohle li entse joalo ha li ne li na le takatso e khahlisang ea limpho
95,julio to win it but to farewell and the upset win over was awesome and a huge thanks to pete for giving us a legendary will always be a very memorable,julio ho e hlola empa o na le ho teneha le ho teneha ho hoholo ha e le hantle ebile ho teneha haholo ho rurilla bakeng sa ho re fa nalane e tla lula e le ntho e sa lebaleheng
96,the song is nautilus farewell letter,pina ke lengolo la natulull farewell
97,stokes' farewell to cricket _cricket,farewell 'filewell ho cricket _cricker
98,on morning they may kill my useless body but never never my soul i tell my that i want them to crucify me and once i am crucified then they may use their farewell of and,hoseng ba ka bolaea 'mele oa ka o se nang thuso empa ha ho mohla moea oa ka o reng ke ka ba batla hore ba tsebe ho etsa joalo ka ha ba ka sebelisa mokhoa oa bona oa
99,said i can talk about this a bit so there are a few of i made for series that may be soon we are waiting for the set release date so we can share more about this,e itse nka bua ka sena hanyane ka hanyane ho na le tse 'maloa tseo ke li entseng haufinyane re tla emela letsatsi le kentsoeng ka lebaka la sena
100,good luck finding better than us whiskey glass funny farewell,mahlohonolo a ho feta ho feta ho rekwa ke khalase e qabolang
101,nana was my father is obsession so by the time she gave her farewell i was living in and went along that i knew the to all her childhood brainwashing successful,nana ke ntate oa ka haholo
102,farewell the chapter of my biography is fun,farewell khaolo ea biogy ea ka ea monate
103,farewell but which does not end with a l will tell you it,e sa ratoang empa e sa felloe ka l tla u joetsa
104,the final farewell,farewell ea ho qetela
105,i m sorry that you gotten so unlucky this time around how i m wishing you a better farewell in the next life,ke masoabi hore ebe u oetse joalo ka nako ena ho pota ka nako eo ke u lakaletsang bophelo bo monate bophelong bo latelang
106,_basement _pippa queer people certainly do not think this is petty farewell,_basep queer batho ba qholotsang ka sebele ha ba nahane hore sena se ratane
107,great anticipation for how now that new management turned the facility into a love shack for kirk in honor of your farewell tour you like that,tebello e ntle ea kamoo batsamaisi boo ba ileng ba li fetola sebaka seo ka ho khetheha hore ba be tsuolong bakeng sa kirk ho tlotla mofani oa hau o joalo
108,highlight randle non moving screen for to reach and give the the lead in farewell game while jack in awe _highlights follow for more,setsi sa sesole se tsamaisang screen sa ho fihlela le ho fana ka leano la ho fana ka papali ea mofuta o mong oa _highlights o latela ho feta
109,will take on today in what will be a farewell match for ben as he from after today in he will want to go on a high and give a lead in the match series wont be easy against a potent sa bowling attack,u tla nka kajeno ho tla ba le papali ea ben a tla ba le phetiso ea ben ha a ntse a le teng ka mor'a kajeno a e etelle pele lihloohong tsa papali
110,and with that farewell,le ka mokhoa oo
111,farewell season,nako ea ho rata
112,_noo yes i credit dad for my enduring love of baseball among many other both of us lifelong i have been albert is career for both of us these last alas that specific connection is on its farewell tour me sad,_noo e le motsoalle oa ka oa mokoloto bakeng sa lerato la ka le sa feleng la baseball ka bobeli ke hore ke tsebe hore na ho na le mosebetsi o khethehileng. ke masoabi haholo
113,you farewell too soft made me unable to cry out of pain,u etsa hore u be bonolo haholo ho etsa hore ke khone ho lla ka bohloko
114,take your destiny into your own farewell,nka qetello ea hau e le mothating oa hau
115,farewell to the space infrared telescope its,farewell ho ea sebakeng sa infrared telescope ea eona
116,farewell,farewell
117,what about the farewell,ho thoe'ng ka takatso
118,do not leave what about the farewell what a mess,se ke oa tlohela ho etsa joalo ka mokhoa o ferekanyang
119,what about the farewell is that she said,ho thoe'ng ka takatso ea hae ke hore o itse
120,what about the farewell,ho thoe'ng ka takatso
121,the next time we meet in this world i too will be a level wizard without any experience farewell everyone,nako e tlang ha re kopana lefatšeng lena le 'na ke tla ba wizard ea boemo ntle le boiphihlelo
122,what about the farewell,ho thoe'ng ka takatso
123,i am not a fan but i love what he is said about the way and its have the farewell is beyond not to mention apparently does not want to support you unless you are a,ha ke sa le fan empa ke rata seo a se buileng ka tsela eo le eona e se bolelang ka tsela eo le eona e se e fetisoang ntle le hore e se ke ea bua ntle le hore u
124,bye bye farewell,bye bye farewell
125,the disruption came a day after sought the operation of the floor for a productive session as his farewell gift,pherekano e fihlile ka mor'a ho batla ts'ebetso ea fatše bakeng sa thuto e behang joalo ka mpho ea hae ea khale
126,this might be the best farewell tour i have ever seen it is a shame to see you go but you are going out with what can only be as a bang would not expect anything less from space,ena e ka ba leeto le letle ka ho fetisisa leo ke kileng ka le bona ke lihlong ho tla u bona empa u ka tsoa le senngoe feela ha ho ne ho sa lebelle eng kapa eng ntle le sebaka
127,farewell dash thank you for making our special will never be the same without you rip,dash ea farewell kea leboha ha u etsa hore re be le tse khethehileng ntle le uena
128,_ because i know they have better my first concert ever was farewell that was fantastic a special place you know,ka lebaka la kea tseba hore ba na le molemo oa ka oa pele o kileng oa phela hantle hore o ne a le monate le sebaka se khethehileng seo u se tsebang
129,farewell,farewell
130,this guy is a disgrace to the game the lack of respect to beat and not let him have his farewell tour,monna enoa ke lihlong papaling ena ho haella ha tlhompho ho otla le ho se mo lumelle hore a be le leeto la hae la botshehadi
131,i have to read earnest farewell to arms this made in that mood,ke tlameha ho bala ka tieo ho li omella ho li omella ho latela maikutlo ao
132,_d_doe sincerely i don t like farewell especially this one that i am learning a lot,_d_doe ka pelo ehlile ha ke ratane haholo ena haholo ena ke ithuta haholo
133,rude of to one knock out in the semis and rob of one good farewell tour and then two rob j rod of m when the rookie is making league minimum and s salary is m but,ho hloella ha motho a le mong ho semis le ho utsoetsa ka mokhoa o le mong o motle oa ho tsamaea ha rookie e etsa hore molay a be le 'mutsi.
134,giving a farewell gift just like harper did,e fana ka mpho e ntle joaloka motho ea neng a entse
135,and curiosity in playful ways that i find totally bewitching farewell to a master,le bohelehele ka mekhoa ea ho bapala eo ke e fumanang ka ho fetella ka ho felletseng ho ea mong
136,sure hope this is a farewell tour his year tax holiday needs to come to an end,tšepo ea bonnete ba hore ena ke leeto la moputso la selemo sa selemo sa selemo sa selemo sa selemo sa selemo sa selemo sa selemo se hloka ho fihlela qetellong
137,farewell clover,clover ea hau
138,you are humiliating yourself with your nothing more nothing less and not cause you are with me it is not even that you are wrong you are but how you are going about it you sound like a silly good now i am so i will bid you farewell,"u nyenyefatse u se na letho le tlase ebile ha u na taba le 'na le' na ha u fositse, empa u tla etsa joang ha u le motle haholo"
139,farewell,farewell
140,a trophy is a worthy farewell present,trophy ke ea bohlokoa e loketseng
141,farewell vanity card,karete ea lefeela ea lefeela
142,farewell dash u made our special,dash o ile a etsa hore re khethehile
143,do not be dismayed by good a farewell is necessary before you can meet again and meeting again after or is certain for those who are,se ke oa nyahamisoa ke mokhoa o motle o hlokahala pele o ka kopana hape le ho kopana hape kamora moo kapa ho netefatsa ba
144,today got badminton tomorrow got farewell dinner got bola got viper got feel so adult,"kajeno, badminton hosane ba na le lijo tsa mantsiboea tse ngata tse nang le phallo e nang le bothata ba vipt e ikutloa e le motho e moholo hakana"
145,farewell dash,farewell dash
146,farewell till we meet again in,farewell ho fihlela re kopana hape
147,they should give field the farewell it an all star game where every other ball in the home run derby the c ring,ba lokela ho fana ka tšimo e tsamaellanang le papali ea linaleli moo bolo e 'ngoe le e' ngoe e fumanehang lapeng e sebetsa ho feta
148,day school stopped by the for a quick look and lunch at then down to to just walk around as the filled up too fast also no as the heat our brains farewell,sekolo sa letsatsi se ile sa emisa ka ho sheba ka potlako le lijo tsa motšehare ka nako eo ho ea ho ho tsamaea ka mokhoa o sa tlala ka potlako haholo
149,this is the only acceptable promotional team crossover image from the band s boundary pushing yet ultimately concept album flyball night a farewell to,ena ke eona feela setšoantšo se amohelehang sa mofuta o amohelehang ea sehlopha se amohelehang sa sehlopha se tsoang ho moeli oa sehlopha sa ho sutumetsa leha ho le joalo qetellong ea album flyball bosiu haholo ho
150,from a young fan watching them at the coliseum to a not so young man grandpa to be in their farewell match inside the coliseum what a night what a life thank you,ho tsoa ho faele e monyane ba ba shebileng coliseum ho monna e monyane hore a se ke a ba le bophelo ba bona bosiu haholo
