,src,trg
459,farewell sweet pandemic prince national review,tlhahlobo ea national pandem field term
460,i get being in the derby last season farewell derby but being in is hilarious dude home he s also starting the game tomorrow despite missing nearly half of the braces this season dumb,ke kena ka har'a derby ea ho qetela ea derby daylewed empa ho ba sebakeng se setle sa ho qala papali hosane leha e le halofo ea li-braces
461,the st mary s preschool and kindergarten s end of the year of with of and bid farewell to the school s current director and future director,st mary s puseletso ea lebitso la state le kindergarten
462,i was pained when her only daughter she could not bear d pain farewell ma,ke ne ke utloisoa bohloko ha morali oa hae a le mong a sa khone ho mamella bohloko ba bohloko ba bohloko.
463,farewell,farewell
464,spearhead down talk of a farewell game listen,moreko o tlase o bua ka ho mamela papali ea mofuta o motle
465,was well worth commuting from the to the office to have the pleasure of working on the last ever sports bar what a farewell,e ne e loketse ho ea ofising ho ea ho ofising ho ea batla ho sebetsa sebakeng sa ho qetela sa lipapali
466,spearhead will not commit to a farewell game just yet listen,spearahead e ke ke ea itlama papaling ea mofuta o sa tsoa mamela
467,farewell brave soldier we will stop,sesole sa brave ea brave re tla emisa
468,you t have to know mark for a long time to know him well,u tlameha ho tseba mareka nako e telele ho mo tseba hantle
469,during my plus as a business consultant and coach i learned that nothing about business stays the same farewell carbon paper and hello social media and smart i been on a dynamic ride and i am excited by what i do,"ha ke ntse ke le moeletsi oa khoebo le mokoetlisi oa khoebo eo ke ithutileng eona hore ha ho na thuso ea khoebo le hello, ke thabile ka seo ke se etsang"
470,i just to see in las for his final farewell,ke mpa ke le ho bona ho las bakeng sa pholiso ea hae ea ho qetela
471,for a farewell tour,bakeng sa leeto la bokhelohi
472,man and no notice can t even have a farewell meal,monna le ea sa tsebeng letho a ka ba le lijo tse sa tsamaeeng
473,decided to say farewell to and switch to,etsa qeto ea ho re ka mokhoa o motle oa ho fetohela
474,my twitter been overrun by the theory and other random st so i apologize and farewell to any smidge of my personal life i had in here because it no longer to the amount of media i consume,"twitter ea ka e ne e fetisitsoe ke khopolo le khopolo e 'ngoe ea st kahoo ke kopa tšoarelo,' me ke se ke ka otla bophelo ba ka ke mona hobane ha ke sa le boholo ba media"
475,farewell starlite,farewell starlite
476,as much as i had a fun time to twitter to troll the short tempered and sensitive i ultimately have lost interest in a record breaking as such i will be leaving again until we meet again farewell,joalo ka ha ke bile le nako e monate ho troll e khutšoane ebile e tebile ka nako e khuts'oane e lahlehileng ho fihlela re kopana hape
477,then i say farewell and good hunting i hope you find what you re looking for just know that you can lose yourself to revenge,ebe ke re o tla tsoma le ho tsoma hantle ke ts'epa hore o tla fumana seo u se batlang feela hore o ka inkela ho iphetetsa
478,sure they will mostly be film but if i am going to be selling something i want to make sure it is color accurate,bonnete ba hore ba tla ba lifilimi empa ha ke batla ho rekisa ntho eo ke batlang ho e etsa bonnete ba hore e nepahetse
479,_messenger _mcbeenie you mean when the ai is giving it is farewell and visibly a second and onto a,_messaer _mcbeenie u bolela hore na ai e fana ka eona ha a ne a fana ka puo e le 'ngoe le ho
480,good bye so long farewell we are glad to see you go _z_,ha e le hantle ha re natefeloa ke ho u bona u ea _z_
481,the half wolf ring no i m part of her very being i could never betray her no matter what might happen she needs me farewell _wattson,leqhubu la wolf woff ha ke na karolo ea hae haholo ha ke sa khone ho mo taka hore na ho ka etsahala'ng ha a ntse a nthatetsa .wattson _wattseson
482,bid farewell to the cradle of civilization let us her with a traditional ballad toxic by,bid papatso ho seporo sa tsoelo-pele ho re fa chefo e tloaelehileng ea ballad.
483,__ farewell my sweet,__
484,finally up a hardware monitor calibration tool since i want to sell,"qetellong, sesebelisoa sa hardware"
485,_music when i go to a concert i go to see my artist even if it s numerous times but i also go to a concert like his farewell tour i saw him when yellow brick road came out it s my way of him for all those of music sir,_music ha ke ea konsare ke ea ho bona sebini sa ka le haeba ke le leetong la hore na o ile a mo bona joang ha ke le mong oa 'mino oo ke o mong monghatla
486,farewell old,o ne a tsofetse
487,real palace i am to another of my as i send this but i feel that our meeting is a priority to be woven into this week as are moving so in our world what i would like to suggest is lavrov is joining us farewell,ntlo ea 'nete ke hore ke romelle e' ngoe eo ke e romellang hona empa ke nahana hore seboka sa rona ke sona se tlang ho sona ke seo re ka se batlang.
488,farewell global liberal cannibalistic conspiracy via,farewell libery cannibalistics
489,to ten million i am weird 'cause i hate i got misty as they said farewell but i will know where several are if my get real bizarre 'cause i saved a few and i keep them in a jar,"ho limilione tse leshome ke makatsa, ke hloile hore ke be le phoso empa ke tla tseba hore na ke ne ke boloka tse 'maloa joang haeba ke li boloka ka jare"
490,i just to see in las for his final farewell,ke mpa ke le ho bona ho las bakeng sa pholiso ea hae ea ho qetela
491,the b tch apparently is back saying farewell to sir with the woman i love,b tc e bonahala e re e ka re e na le mokhoa oa ho bua le mosali eo ke mo ratang
492,then if u do that the option to leave just farewell i dont leave now that its worded that way i hate this,joale haeba u etsa joalo ka khetho ea ho tlohela feela ha ke sa tsamaee hona joale hore na ke hloile sena ka tsela eo ke hloileng sena
493,_porg neither or laura had an farewell did they,_porg leha e le ea motšehare o ne a
494,for s farewell,bakeng sa frarewell
495,farewell yellow brick road with the family,mofuta oa boea ba litene tsa litene le lelapa
496,rose is expression into one of brief grief the kind that when you realize you are not going to see someone again but talis only at her and his head his true final farewell as rose henry is hand and their way out of the castle,rose ke polelo e le 'ngoe e khutsitseng e le' ngoe eo u e bonang ha u ntse u tla bona motho ea ntseng a le mong oa 'nete oa qhobosheane
497,farewell for good now,farewell bakeng sa hantle
498,was one of my first twitter farewell funny kitty,e ne e le e mong oa ka ea pele ea twitter ea ka ea twitter ea twitter ea twitter
499,happy waving farewell see ya he is totally be scarred after that,ho monate ha ho be le mokhoa oa ho etsa hore o se ke oa soeufala ka mor'a moo
500,farewell yellow brick road,pack road brick road
501,_ _legend _podcast _bulldogs will need to be quick is on his cup farewell tour,_ _legend _legendcast _buldogs e tla hloka ho potlaka ho ho tefiso ea hae ea ho fetisetsa leetong la hae
502,either farewell or the silence by gamma ray both give off the ultimate and perfect for a funeral,e ka ba ea khutsitseng kapa ho khutsa ka gamma ray ka bobeli ba fana ka maemo a holimo le ka ho phethahetseng bakeng sa lepato
503,farewell you and your commentary will be,o tla u rata le maikutlo a hau a tla ba teng
504,sorry perhaps what i really need is neither of you farewell,masoabi mohlomong seo ke se hlokang haholo ha se sa hau
505,excited to see the here in la will be in his farewell tour please enjoy this tribute during the,e thabile ho bona mona ka la o tla ba leetong la hae la botshehalong ba hae ka kopo natefeloa terithara ena nakong ea
506,just from them will be getting the tomorrow real excited to see what i get back from this lab there is some i am looking forward to,ho tloha ho bona ho tla ba hosane ho tla ho monate ho bona seo ke se khutliselitsoeng ho lab ho na le ba bang hore ke lebelletse ho
507,i tried to publish one the story of de milo i it farewell two arms,ke lekile ho phatlalatsa karolo ea phase ho de milo i eona matsoho a mabeli
508,actually really smart and jay are great flair will look great in his farewell,"ha e le hantle, 'mala o bohlale haholo' me ho ba le li-flair tse kholo li tla shebahala hantle ka mokhoa oa hae"
509,farewell aunt a story about a family member with mental health from the perspective of a child,farewell
510,i hope mac a farewell world tour in because that would mark from their last album say you will,ke ts'epa hore mac e teteane ea lefatše ka lebaka la albamo ea bona ea ho qetela e re u tla
511,this will be farewell to yashiro it is get lonely,sena se tla ratana le yashiro se jeoa ke bolutu
512,you need to have one farewell episode for the culture cant leave like this,u hloka ho ba le ketsahalo e le 'ngoe ea mofuta o le mong bakeng sa moetlo o sa siee tjena
513,i get it,ke a e thola
514,from the people who brought you the farewell dick sucking tour it is the farewell dick sucking tour mang volume,ho tsoa ho batho ba u tlisitseng hore u be motsamao oa ho akheha oa dick ke eona ke eona ea ho tebela mahoa
515,a warm farewell as senior vice president to steward in administration,mopresi e mofuthu ea mofuthu e le mopresidente oa motlani ho tsamaiso ea tsamaiso
516,a family said their final as they laid a one to rest after a man was tragically in a boat crash in,lelapa le ile la bua joalo ka ha ba beha motho ea phomotseng kamora hore monna a kenele ka sekepeng ka sekepe
517,they the thing said never tour again we went farewell tour then here we are again i had but sold them going to preseason raider game instead and all the time should a picture,ba ne ba re se ke ba etela hape re ile ra ea leetong leo re boetse re bile le bona empa ke ne ke lokela ho ba setšoantšo kaofela
518,the last system cue with dash airing is supermarket on the national feed also the final sign off of the current rebrand from farewell dash,"sistimi ea ho qetela e na le moea oa dash o ntse o le tseleng e fumanehang ka lebenkeleng la naha le ho saena le ho qetela ho tsoa ho ""nchafatso ea hona joale"
519,waved farewell to my friend as she went off to lose her virginity this weekend and i felt like a mother sending her son off to war,o ile a tsofala ho motsoalle oa ka ha a tloha ho ea lahleheloa ke boroetsana bekeng ena 'me ke ne ke ikutloa eka' mè o romela mora oa hae ntoeng
520,the met a flaxen haired person in who is name was after spending a brief time together bid farewell she was still not ready to settle like her father,ba ile ba kopana le motho ea hloahloa ka har'a lebitso leo lebitso le neng le le ka mor'a nakoana le lets'oao le kopaneng le ne le ntse le sa itokisetsa ho lula joaloka ntate oa hae
521,on watching this game by farewell and you fair ladies farewell and you ladies of,ka ho shebella papali ena ka mokhoa o motle oa basali ba batle le uena le basali ba
522,farewell,farewell
523,farewell to a true icon,fana ka setšoantšo sa 'nete
524,easy i have met them over the as well they are doing a farewell tour for the th time and the band terrible too much bass too much,ho bonolo hore ke ba kopantse le bona ba ntse ba etsa leeto la bo-ratoang bakeng sa nako ea hau le sehlopha se tšosang haholo
525,hail and farewell you will be may your memory be a blessing to everyone who the,sefako le ka mokhoa oa hau o tla ba o tla ba lehlohonolo ho motho e mong le e mong ea
526,gave my farewell speech at work since that is a big deal in culture of course i did it in,o ile a fana ka puo ea ka ea bophelo bo botle mosebetsing ho tloha ka lebaka la setso sa hore ke e entse
527,if everybody in had to read s farewell address everyday not only would the of slavery have but public policy would be shaped in an inclusive fashion for all,haeba motho e mong le e mong a ne a tlameha ho bala aterese ea shsawell letsatsi le leng le le leng feela bokhoba feela ba neng bo ka ba sebopeho sa batho ba kenyellelitsoeng
528,waiting on my from the last lab i am testing i know the film got last week but i have not anything from the lab,e emetse ho tsoa ho lab ea ho qetela ke lekoa ke tseba hore filimi e be le beke e fetileng empa ha ho letho le tsoang ho lab
529,farewell my,ea hau
530,farewell of,farewell of
531,wish waved this way to say farewell to his following a transfer to an other club,ke lakatsa ho bua ka tsela ena ho bua joalo ho latela phetiso ho sehlopha se seng
532,ben to retire from cricket due to unsustainable schedule the guardian ben to retire from cricket due to unsustainable schedule the full coverage on news,ben ho tlohela mosebetsi ho tloha cricket ka lebaka la kemiso e sa lebelloang ea bahlokomeli ben ho tlohela mosebetsi ka lebaka la tšireletso e felletseng ea litaba tse mabapi le litaba
533,i never felt entirely welcome clearly my choice not to participate in the rite of eating human and drinking their blood me back which i find hypocritical,ha ho mohla nkileng ka amohela ka botlalo khetho ea ka e batlang ho nka karolo papaling ea ho ja motho le ho noa mali a bona ao ke a fumanang ka boikaketsi
534,epic derby stadium farewell did not want to let the as game end either,epic derby strimo fardwell ha a batle ho lumella joalo ka papali
535,the farewell special they did for him on was pretty awesome,setsi sa mokhoa oa ho rata se ile sa mo etsetsa se setle haholo
536,farewell mother you chose the wrong child,mme o ile a khetha ngoana ea fosahetseng
537,i do not care how garbage a show is a character farewell episode will always smack me like a brick,ha ke tsotelle hore na litšila ke mofuta oa mofuta oa mofuta oa sebapali o tla lula o nkotla joang joalo ka litene
538,a farewell to arms pride of the in the rain the man who shot liberty valance,motho ea tšoaeang matsoho a tšepe a pula ea pula e le pula ea lilakane
539,farewell global liberal cannibalistic conspiracy,farewell ganeral libery cannibalistics
540,just the only good farewell picture i have is with this one person who to like thrice in the span of the past two,ke feela setšoantšo se setle feela sa hau se nang le motho enoa ea neng a le mong ea neng a le monate ka nako ea nako e fetileng
541,is back at for what could be the tennis icon s farewell to the sport s most iconic championship back on court in what could be her singles and grand slam to her name and ne,"o khutletse bakeng sa mofuta oa tennis e ka bang """
542,if we could we should have left we could have left it is too late i i am too tired farewell,haeba re ka be re ile ra sala re ka be re tlohile hore ke morao haholo hore ebe ke khathetse haholo
543,there is so much optimism out there my local is a farewell party for its who are mostly older they are kindly people but it kind of crazy at the moment,ho na le ts'epo e kholo hakana moo lehae la ka ke mokete oa bo-raretsoeng ke batho ba baholo haholo ba leng batho ba mosa haholo empa ha ho motho ea hlanyang ka nako eo
544,on this day in music history in the very first took place originally up by jane is addiction singer perry as a farewell tour the touring festival ran annually until and was in,letsatsing lena na nalane ea 'mino ka pele e qalile ka jane ke monotšiletso perry e le leeto le lelelele ho fihlela le ho feta
545,there comes a time when one needs to bid everyone farewell,ho na le nako eo motho a hlokang ho etsa hore motho e mong le e mong a ratane
546,me think that if he is ever in trouble with the law if any of those parentage said anything other than that he would then risk deportation no necessary or farewell,"ke nahana hore haeba a le mathateng ka molao haeba ho na le batsoali bao ho seng joalo, ba tla lelekoa ka lebaka la ho lelekoa"
547,box free mint is live _cryptopi_ _benson _noni _gege _yuxh,lebokose la mahala la mint ke ho phela _cryptopi_ _benson _noni _gegege _yuxh
548,the common and continual of the spirit of party are sufficient to make it the interest duty of a wise people to discourage and restrain it farewell address party system is evil i hate both,e tloaelehileng le ea kamehla ea moea e lekane ho e utloisisa ka tjantjello ea batho ba bohlale ho ba nyahamisa le ho e thibela ka bobeli
549,the legendary year old musician and composer off the final leg of his north farewell tour on night,setsi sa selemo sa selemo se seng se atlehana 'me se mo hlahisetsa leoto la ho qetela la leeto la hae la north fawewell bosiu
550,farewell my love,rata lerato la ka
551,should go to the and do a farewell tour the a make it to the unlike the,e lokela ho ea ho ea etsa hore e be le leeto la ho etsa hore e be hole le
552,i give you your dream but i fear in time your heart will break as you realize it ever been a fool s hope farewell my friend,ke u fa toro ea hau empa ke tšaba ka mora pelo ea hau e tla senyeha ha u e fumana e le motsoalle oa ka
553,so is that his actual last match or is this a farewell tour deal,le hore ke papali ea hae ea ho qetela ea ho qetela kapa e leng sena sa ho phela ka mokhoa o hlakileng
554,is getting the farewell tour he deserve he honestly was a beast even though he for them bum ass,ho etsa hore o be le takatso ea hau ea ho phela o ne a tšoaneleha hore a e-na le sebata le hoja a ne a le esele ea bum
555,farewell pepper you gave many of us a smile through some very troubling times i am sorry to hear you could not be there when she you were an excellent parent to her,pepere ea farewell o ile oa re fa pososelo ka linako tse ling tse tfureng haholo ke masoabi ho utloa hore o ka se be molimo o motle ho eena
556,farewell forever why did i do that why did i do that why did i do that,"o ile a rata ka ho sa feleng, hobaneng ke entse joalo hore na ke hobane'ng ha ke entse joalo hore na ke hobane'ng ha ke entse joalo"
557,hope so i him when he last came to so glad i could catch his farewell tour,ke tšepa
558,i just to see in las for his final farewell,ke mpa ke le ho bona ho las bakeng sa pholiso ea hae ea ho qetela
559,check out a farewell to on,sheba mokhoa oa ho bua
560,_brother farewell,_brother farewell
561,_quint farewell and my dear lady,_quint farewell le mofumahali oa ka ea ratehang
562,and now farewell to kindness humanity and gratitude i have substituted myself for providence in rewarding the good may the god of vengeance now yield me his place to punish the wicked,'me joale o nka bohato ba mosa le kananelo eo ke bileng le eona ho khotsofatsa hore na o iphetetse feela ho otla ba khopo
563,i prefer farewell tour,ke khetha terene ea farewell
564,does anyone really believe this will be flair s last match if the show him money he be back again in around six for another farewell show his ego won t let him retire,na ho na le motho ea hlileng a lumelang hore ho tla be e le papali ea ho qetela haeba ho mo bontša chelete eo a e fumanang ka ho ba tšeletseng bakeng sa pontšo e 'ngoe e bonts'a
565,farewell to police on,rata mapolesa ho
566,farewell,farewell
567,live footage of the and mero farewell,live feage ea and mero farewell
568,farewell lonely i don t follow your insult remember might get an abortion in order to go to the moon why t that count as a valid reason her womb is more a key to her identity moon girl t work take that away,farewell lonely ha ke e-so latele ho ntša mpa ho ka ea khoeling eo ho ka e fumanang papali ea hae ea boitsebahatso ea hae
569,one day the federal government are overreaching the next day you re begging them for help make up your mind and go away you resigned you remind me of s five year farewell tour,ka letsatsi le leng mmuso oa federal o phahametse ka letsatsi le hlahlamang u ba kopa hore a tsebe ho etsa tlhahiso ea hau le ho tsamaea u nkhothatse ka ter
570,of the time it is a lie more recently ocean is eleven the farewell,ea nako eo e leng mashano a sa tsoa feta le ho feta e leshome le motso o mong
571,bishop s farewell mass homily mission,bishop s farewell mass homily
572,i wasted of my life physical anthropology and so far reading research how the humanity farewell cruel world,ke sentse ka ho phela ha kerthropology
573,we bid a farewell to our own as she on to new we have you with us and wish you all the best,re se re le mong ho ba bang ha a le mocha ho na le rona re na le rona le rona mme re le lakaletsa tsohle tse ntle
574,a farewell to an unsettling energy through a dying expanse following a wall,ho rata ka matla a sa tsotelleng ka sepakapakeng sa ho shoa ka mor'a lebota
575,we will meet again do not know where do not know when we all had a good time and we are sad to see it end good luck be with you you go your way i will go mine so until the next time it is farewell and not good bye,re tla kopana hape ha re tsebe hore na kaofela re na le nako e ntle 'me re utloile bohloko ha ke le tseleng e tlang bye
576,the end of an era link for s emotional farewell,qetellong ea khokahano ea nako ea ooa bakeng sa maikutlo a maikutlo
577,one day the streets will tell my story but for now i bid you farewell until the sun rise i am gone,ka letsatsi le leng literata li tla bolela pale ea ka empa joale ke se ke le mothating ho fihlela letsatsi le chaba ke felile
578,farewell my future,fana ka bokamoso ba ka
579,hail and farewell to,sefako le ho rata
580,farewell to one of the all time worst comedy,e batla e le 'ngoe ho e' ngoe ea metlae eohle e mpe ka ho fetisisa
581,saved on farewell by seth lea,e bolokiloe ho farewell ka seth lea
582,now they are making stuff up i would take offense to say or farewell or to end a phone conversation bob well i have to get going,hona joale ba ntse ba etsa hore ho be le lintho tse ngata ke ne ke tla khopisoa ke ho bua kapa ho emisa puisano ea fono bob ke tlameha ho tsamaea
583,_io nice _mia _pity,_o e ntle _mia _pity
584,_io nice _mia _pity,_o e ntle _mia _pity
585,farewell to a legend amazing colleague and a passionate physician,farewell ho letsahalo e makatsang e makatsang le ngaka e lerato
586,and say farewell to pal after a swanky lunch in,'me u re ho phela ka mor'a lijo tsa mots'eare oa swanky ka
587,_ is off his on the latest football talking about farewell tour,_ o tlohetse bolo ea maoto a morao-rao a bua ka mokhoa oa ho etela
588,damn farewell to the show in late night,damn farewell ho show bosiu
589,farewell a marvelous artist and forever a mind blowing and witty inspiration to me also i believe he may have been an office supply as i am,"o fana ka sebini se hlollang ebile ke sa feleng kelellong le ka ho sa feleng, ke lumela hore e bile mosebetsi oa ofisiri joalo ka ha ke"
590,along a greedy energy over an ethereal face a farewell opposite a structured garden,hammoho le matla a meharo ho feta ethereal sefahleho se tsamaeang le serapa se hlophisitsoeng
591,it will be similar to kobe is farewell tour,ho tla tšoana le kobe ke terene
592,farewell to those corny,farewell ho corny eo
593,nikon is discontinuation of its the end of an era as it in on the digital,nikon
594,pop the champagne farewell a wonderful with us on idyllic magnetic island music good times,pop the champagne farewell e ntle le rona mabapi le 'mino oa li-idyllic idyntic ispic khaled
595,days until the last rose petal farewell tour to bayou music center on august th grab your before it s too late,matsatsi a ho fihlela ho fihlela rose people toeto ho ea setsi sa 'mino sa bayou sa bayou sa bayou sa bayou ho ea ka phato.
596,farewell sparth you will be very not going to lie this made me feel very sad but we should not be sad but celebrate and thank you for the you have spent making art for halo you have inspired many of us so big thanks,farewell sparthy o tla se robale haholo hore o tla hlonama empa ha rea ​​lokela ho etsa joalo ka rona e kholo ea rona haholo
597,read all about our promotion ceremony that included a chief s commendation life saving award and a farewell to assistant chief,bala bohle ka mekete ea rona ea matlafatso ea rona e kenyellelitsoeng bophelo bo boholong
598,robin hood a farewell to arms the quiet man of,robin hood ea ho tšoaea matsoho ho lahla monna ea khutsitseng ea
599,now you know what all the fighting alt right was about hope the next already written their farewell speech enough of us are alive to hear it this ai not going to end well for anyone,joale ua tseba hore na palo eohle ea ntoa e ne e se e le neng e se e ngotsoe puong ea bona e sa reng letho ka ho e utloa e se ke ea phethela motho
600,does your trash folder still contain the copy which read just how out of touch he is by making a grindingly supine farewell tribute to,na foldara ea hau ea litšila e ntse e na le kopi e balang feela hore na o tsoa joang ho etsa ka mokhoa o sa silafatsoang trindy.
601,i check the glass case for jam or fragile farewell of the moon i check the for simple series i check for incredible crisis i get boba i go home,ke sheba nyeoe ea khalase ea jeme ka khoeli eo ke e hlahlobang letoro le bonolo ke sheba bothata bo makatsang ke fumana boba ke ea hae
602,farewell transmission on converge radio,phetisetso ea ho fetisoa le radio ea converge
603,to be to the farewell we will be paying for,ho ba ho mothating oa ho patela
604,and it s a farewell for a generational player too,mme e ea senepe sa letshwao sa mofuta le sona
605,lived it it farewell,e phethile eona
606,just came out of the veterinarian office we just said our farewell to our baby she was in advanced of renal failure her as she left a month to the day of the loss of my dear friend been a tough year so far,ke sa tsoa tsoa ofising ea veteniaria re sa tsoa bua masea a rona hore a se ke a tsoa khoeling eo motsoalle oa ka e mo ratang e bile selemo se thata ho fihlela joale
607,had a month long farewell season doing this,e bile le nako e telele ea khoeli le khoeli e etsang sena
608,great interview with b s,puisano e ntle le b s
