,src,trg
285,we need more people like you in motivational twitter,re hloka batho ba bangata ba tšoanang le uena ka tšusumetso ea twitter
286,ruth privilege oppression equality classic t shirt here,ruthe o behile moea o boima oa tv ena
287,starting your day or needing a pick me up can come from a single spark of motivational now get motivation to you with daily quote on your today,ho qala letsatsi la hau kapa ho hloka 'na ka nkuka e ka tsoa tlhaselong e le' ngoe ea tšusumetso joale fumana tšusumetso ho uena ka qotsulo ea letsatsi le letsatsi kajeno
288,never make some one when all you are to them is an option motivational,le ka mohla u se ke ua etsa e 'ngoe ha u le ho bona kaofela ke khetho e susumetsang
289,your weekly motivation tune into today s motivational conversation terry our to inspire us to pursue our as you will see from her story it is never too late to accomplish your,khothatso ea hau ea beke le beke ea beke le beke e khothatsang ea ho re khothatsa hore re re busetse ka pale ea hae ha ho mohla u tla lieha ho e fihlela
290,why do have to send out these motivational word every,hobaneng u tlameha ho romella lentsoe lena le khothatsang le leng le le leng
291,only thing stopping you is you and i do not mean that in a negative way more motivational,ntho feela ea emang ke uena 'me ha ke bolele hore ka tsela e fosahetseng haholoanyane
292,get it motivational money making,e fumane chelete e susumetsang
293,all the best and be motivational as always,tsohle tse ntle ka ho fetisisa le ho ba le tšusumetso joalo ka mehla
294,motivational do not get by people who are not on track starve your and feed your focus,boithabiso ha bo na batho ba seng tseleng ea tlala ea hau le ho fepa
295,thank you so much for this motivational tweet i will share it to many of my who are to follow your,ke leboha haholo bakeng sa tweet ena e khothatsang ke tla e arolelana ho ba bangata ba ka ba ho latela ea hau
296,inside a commune i remember when living in a van down by the river was a motivational phrase to avoid being a homeless bum now it s a way for the media to tell people to make the most of poverty,ka har'a komporo eo ke e hopolang ha u lula ka koloing e ne e le polelo e susumetsang ho qoba ho ba le bohlanya ba ho etsa hore batho ba etse batho ba fulang haholo
297,who the pseudo motivational drivel for you nobody in this fictitious we you need to di what you have been to do comply with your oath of office and act in behalf of all the people if sa or shut up and sit down,ke mang eo pseudo motivivanical eu fetotseng ha ho na motho eo u hlokang ho o etsa seo u bileng le sona ho latela batho bohle haeba u ka lula fatše
298,motivational coach three of motivation,motlatsi oa khotso ea khotso ea khothatso
299,i locked myself in the bathroom my mum shouting at me and she is giving me a motivational speech so i will get out its not working tho,ke notlelletse ka kamoreng ea ho hlapela ka kamoreng ea ka ea hoeletsang 'me o mpha puo e khothatsang kahoo ke tla tsoa ha e sebetse ho eona
300,nope it is humanly impossible and do not give me this it i am possible motivational,nope ha e khonehe ebile ha e khone ho mpha sena ke se na khothatso
301,great motivational message beth,molaetsa o moholo oa mohlohleha bethe
302,photo of motivational by,foto ea setivational ke
303,happy motivational from separation get in the right frame of mind set some and have a great week,ho ba le boiketlo ba ho arohana ho kena ka mokhoa o nepahetseng oa kelello ho beha tse ling 'me u be le beke e ntle
304,time fast make sure you achieve all you want to succeed,nako ea ho potlakisa ho etsa bonnete ba hore u tla fihlela sohle se o batlang ho atleha
305,motivational graduated with a major in event management and hospitality management she is currently a dual property event manager for indy place in downtown we are,motivarial a fumana mosebetsi o moholo oa taolo ea tlhaho le taolo ea baeti eo a nang le thepa ea ho ba le thepa ea thepa ea ho akheha bakeng sa sebaka sa boikhathollo se haufi
306,welcome to the here you can see daily motivational inspirational wall and for transformation of your space be with us,rea u amohela mona u ka bona lebota la letsatsi le letsatsi le khothatso le bakeng sa phetoho ea sebaka sa hau e le rona
307,motivational wake up on and start your day with a lot of awesomeness and you will get happiness back,mothati o tsoha o tsoha le ho qala letsatsi la hau ka bomalimabe bo bongata mme o tla khutla
308,motivational the pain you feel today is the strength you feel tomorrow author get natural in delicious lemonade tropical available now at your local,morero o utloa bohloko bohloko kajeno ke matla ao u a utloang ho lotho ho ba tlhaho ho lenyade tropical e fumaneha joale sebakeng sa heno
309,motivational if people around you are telling you can not do it do not listen to them if the voice in your head you are not good enough ignore that thought the only way to overcome your and achieve your is to go for it,khothatso haeba batho ba haufi le uena ba u joetsa hore o se ke oa ba mamela haeba lentsoe le le bonolo la ho hlola le ho qetela
310,motivational bet on yourself grab your jerky now at,ho becha ho uena ho inkela mofuta oa hau joale ho
311,embracing death death comes in my said when i was seven and a half old my brother jimmy shortly thereafter my mom is uncle who would be next read more,ho fihlela lefu la lefu le tla ha ke le lilemo li supileng ha ke le lilemo li supileng haufinyane ka mor'a moo 'mè ke malome ea tla balla haholoanyane
312,i love seeing these they feel motivational,ke rata ho bona tsena li ikutloa li susumetsa
313,it is motivational and we found a quote to inspire you today never give up expect only the best from life and take action to get it,ke tšusumetso 'me re fumane qotsulo ho e khothatsa kajeno le ka mohla u se ke oa tela feela bophelong le ho nka bohato ho e fumana
314,again rest assured that your identity were safe with us once the receiver 'who that message ' do not worry that would not be or any motivational message s would also be,re tiisetsoa hape hore boitsebiso ba hau bo bolokehile le rona hang ha moamoheli 'eo molaetsa oa ho se tšoanelang o ne o tla ba teng
315,_gomina u self don dey drop motivational since u don get money,_goomina u se u nyenyefalletsa ho sisinyeha ho sisinyeha ha u se ke ua fumana chelete
316,it is a motivational video and actually it was will smith who said it in his segment,ke video e khothatsang mme ha e le hantle e ne e tla ba smith ea e buileng karolong ea hae
317,oh my god the best motivational speech,oh molimo oa ka ea khothatsang ho fetisisa
318,is famous famous for being the ever not to mention a fraudulent,e tsebahala ka ho ba ho se be le bolotsana
319,take responsibility a powerful motivational video via,nka boikarabello hore na u na le video e matla ea susumetsang ka nepo
320,this is the lead single to my debut album the track is ay caramba it is fast paced dark motivational and emotional let me know what you think,ena ke e le 'ngoe ho isa ho ea ka morao ho alb ea ka ea morao-rao ea pina eo ho thoeng e potlakileng le ea maikutlo e ntumelle hore na u nahana eng
321,do all people that go into real estate become finance motivational,etsa batho bohle ba kenang meatleng ea meaho e fetoha tšusumetso ea lichelete
322,go look at the following decent quotation,e-ea sheba tse latelang tse ntle tse ntle
323,_ name of that motivational speaker or even just a hint,_ lebitso la sebui seo se susumetsang kapa esita le ho hlaka feela
324,most motivational on the,se susumetsang haholo ho
325,_keglockkk imagine if people used proper grammar in their motivational,ak'u nahane ha batho ba sebelisa sebōpeho-puo se nepahetseng ka tšusumetso ea bona
326,_h i think it is both as with many in life will achieve more with a motivational teacher s and that encourage and support over simplification i am sure my mum was a teacher and then head of an infant school in a hugely area in,_h ke nahana hore ka bobeli ba ka ba teng bophelong bo tla fihlela haholoanyane ka mosuoe le ho ts'ehetsa ho nolofalletsa 'm'e oa ka ba neng ba le masene sebakeng se seholo ho
327,i m not just waiting for to motivational,ha ke emetse ho susumetsa
328,the growth of people and their really such a motivational boost the were fire with great and i have homework to do,kholo ea batho le ho ba le tšusumetso e joalo e matlafalitsoeng e ne e le mollo o moholo ebile ke na le mosebetsi oa sekolo o lokelang ho etsoa
329,motivational you have faith,mothata o na le tumelo
330,it s motivational here s a thought for today,ho khothaletsa mona ho nahana ka mohopolo kajeno
331,sold last week the struggle to serve motivational stock production music via,e rekisitsoe bekeng e fetileng ntoa ea ho sebeletsa 'mino oa tlhahiso ea tšusumetso ea stock ka
332,when the decision taken by you the of many people then your decision should be selfless and benevolent,ha qeto e nkiloeng ke batho ba bangata ba bangata joale qeto ea hau e lokela ho ba boithati le ho ithabisa
333,another great motivational tip of the day really appreciate you coach,keletso e 'ngoe e matla ea motšehare ea letsatsi e hlile kea u leboha
334,feeling motivational speaker,ho ikutloa sebui se susumetsang
335,happy motivational to all my amazing web fam hope you all have a blessed and beautiful day today check out my hit song spiritual times a day on da blaze _,ba khothatse ho motho oa ka eohle e makatsang ea hore o na le letsatsi le letle le letle kajeno o sheba pina ea ka ea moea ka letsatsi ho da blaze day
336,hi hope you and your team are well i want to ask that after more than since i only have and i am explaining the motivational can i or more content how to viral,"lumela, uena le sehlopha sa hau se na le hantle"
337,the begin with living your the dreamland collection first drop,ho qala ka ho phela ka ho bokella toro ho ea pele
338,_nft the begin with living your the dreamland collection first drop,_nft qala ka ho phela ka ho bokella toreand
339,motivational speaking but make it breaking bad,ho bua empa ho etsa hore e be mpe
340,its you motivational from i didnt know an,ke tšusumetso ea eona ho tsoa ha ke tsebe
341,he ai not depressed but spend his time dropping motivational speech coz he that he up,ha a sithabetse maikutlo empa a qete nako ea hae a lahlela koetliso ea puisano ea coz ea ap
342,motivational s are back th to register visit we look forward to seeing everyone again,motivarial s li khutlile ho etela re lebelletse ho bona motho e mong le e mong hape
343,i was just listening to a motivational speech yesterday that said this exact same thing hit me in the heart,ke ne ke mametse feela puo e khothatsang maobane e reng ntho ena e tšoanang e ntlileng e nkotle pelong
344,posting motivational in the,ho romella se matla ho
345,i need like motivational with make them just dey motivate me i go pay later,ke hloka joalo ka ho khothala le ba etsa hore ba etse feela hore ke etse hore ke tsebe ho lefa hamorao
346,nice and u r motivational good how it is possible,e ntle ebile o na le maikutlo hantle hore na ho ka etsahala joang
347,happy today is motivational quote is from personal finance consultant radio show host and author insured by,"ho thaba kajeno, mantsoe a susumetsang a tsoang seea-le-moea se nang le lichelete tsa lichelete se nang le seea-le-moea se seea"
348,i will tell you what is up you are back from my in the no false fake motivational tweet about who you will change that trash  is,ke tla u joetsa hore na u khutlile joang ho tsoa ho 'nete e senang moea o se nang kelello ka hore na u tla fetola litšila joang
349,for the motivational support,bakeng sa tšehetso e susumetsang
350,i used to want to be a motivational speaker full time and i kind of gave up on it because the field is over saturated then someone booked me to speak during their growth grace seminar can t wait to share my heart this weekend god is good,"ke ne ke batla ho ba sebui se khothalletsang nako eohle mme ke mofuta oa ho tela hobane tšimo e na le ho tlama ka nako eo, molimo o ka ema ho arolelana pelo ea ka"
351,poetry twitter twitter twitter sly twitter judgment twitter motivational twitter religion twitter twitter secret viral twitter twitter so many,thothokiso twitter twitter twitter sly twitter twitter twitter twitter twitter twitter twitter twitter twitter twitter twitter twitter sol
352,if you really want to know what the client about the service they have received from you and your team you have to take the time to ask them do you have a process,haeba u hlile u batla ho tseba hore na ke moreki joang hore o fumane tšebeletso eo ba e fumaneng ho uena le sehlopha sa hau u tlameha ho ipha nako ea ho ba botsa hore na u na le ts'ebetso
353,quotation of the day,qotsulo ea letsatsi
354,good morning family hope everyone had a great weekend for today is i thought henry is motivational video would be a nice change to help us get going hope everyone a great day,lelapa le letle la tšepa hore motho e mong le e mong o ne a e-na le beke e monate kajeno.
355,_magixx shut up and sing better song see wan turn motivational speaker wey em never drop any better hit,_magagexx shut up mme u bine pina e betere ho bona
356,the motivational on the status,se susumetsang boemo
357,is this misery supposed to be motivational for me,na masisa-pelo ana a lokela ho ba a susumetsang
358,motivational let s go work like there is someone working twenty four a day to take it all away from you,motivarial let s go work creats joalokaha ho na le motho ea sa sebetseng ka letsatsi le mashome a mabeli a metso e mene ho e nka hohle ho uena
359,the bear is a really motivational show,bere ke pontšo e khothatsang haholo
360,motivational water only on regularly,metsi a susumetsang khafetsa
361,i like real motivational talk with a good amount of if and only if the is not in a boring way,ke rata puo e matla ea 'nete e nang le chelete e ngata haeba feela ha e se ka tsela e tenang
362,same depression your about and you all are under her tweet dropping motivational quote to those you can deceive and here happy another person is well i don t know him personally but news flash he t depressed,ho sithabela maikutlo le uena ka tlase le uena ka tlasa senoelo sa hae se sisinyehe ho bao u ka ba thetsang ka boeena empa ke litaba tse sithabetsang
363,motivational speech but ',puo e khothatsang empa '
364,you and the are extremely encouraging and motivational to all of this,uena le ba ho khothatsang haholo le ba khothatsang ho sena sohle
365,these motivational of now days the message,khothatso ena ea joale molaetsa
366,i m in the motivational lock screen wallpaper stage of my career journey,ke mothating oa skrineng sa ho robala ka maoto
367,free advice do not trust motivational in,keletso ea mahala ha e tšepe sethaleng ho
368,we become what we think all are mental we live in a mental universe if you change your way of thinking you change your and you change your life,re ba seo re nahanang hore sohle se na le kelello ke ho phela ka bokahohleng ba kelello haeba u fetola tsela ea hau ea ho nahana hore u fetola bophelo ba hau 'me u fetola bophelo ba hau
369,what if i ditch my career path and choose to be a motivational speaker instead,nka etsa joang haeba ke theola tsela ea ka ea mosebetsi ebe ke khetha ho ba sebui se khothatsang ho fapana le moo
370,platter of so motivational video positive thinking motivation,setlama sa video se khothatsang haholoanyane
371,really start reading motivational that this negative side of mine might eventually turn to be positive one day but i would rather watch when i have free time even free time pun nak bye,qala ho bala motheo hore lehlakore lena le lecha la ka le ka qetella le le ntle le ho ba le nako ea mahala esita le nako ea mahala le se nang nako ea mahala
372,motivational stuff b its time,stuff stuff b ka nako ea eona
373,motivational speech anna c babu yen,puo ea boithabi a anna c babu yen
374,see motivational speaker cause,bona sebui se se se bakang
375,_ nope i am just of  amotivational quotes',_ nope ke mpa ke le mantsoe a amanang
376,bent into the unknown,inamela tse sa tsejoeng
377,how can i say such as motivational but cannot apply to myself weird,nka bua joalo ka khothatso empa u sa khone ho itlama ho nna re makatsa
378,sa motivational will not ever let them go to waste,boikutlo ba sa bo ke ke ba ba tlohella hore ba e'o senya
379,_blood motivational speaker,_blood sebui se susumetsang
380,when your and are worth more than your welcome to the club,ha oa hau mme o bohlokoa ho feta kamohelo ea hau ho ea club
381,at least some would calm me down my is free for motivational or,bonyane ba bang ba ne ba tla kokobetsa hore ke theole le ka ba lokolohileng bakeng sa tšusumetso kapa
382,some type of manager that another manager motivational on the wall to get my team shirt day every ping pong table next to a soda fountain machine you give me budget for that i will take your company to the moon,motsamaisi e mong oa hore na mananeo a mang a susumetsoa ka lerako le leng le lerakeng ho etsa hore mochine oa ka oa lisepa o be le taelo ea soda.
383,_z well we were looking for something decent to eat very motivational,_z hantle re ne re batla ntho e ntle ea ho ja tšusumetso e matla haholo
384,nothing person no go hear from motivational,ha ho na motho ea sa utloang ho tsoa ho tšusumetso
385,everyone talk about the motivational speech but i think this the crown,motho e mong le e mong o bua ka puo e susumetsang empa ke nahana hore hona moqhaka
386,the motivational angle for is that there are depending on them winning or more in,tsela e khothatsang ea hore ho na le ho latela hore ba hapile kapa ho feta ho
387,life is what to you and how you react to it r are you in reaction mode or living life by design,bophelo ke eng ho uena le hore na u ikutloa joang ka eona u etsa hore u mode kapa bophelo ba ho phela ka moralo
388,our team is recruiting for two administrative leadership for those who are interested in health equity work join the high spirited motivational and team at find the easy to apply application at,sehlopha sa rona se hira boetapele bo 'meli ba tsamaiso bakeng sa ba thahasellang mosebetsi oa tekano le sehlopha se phahameng sa ho etsa kopo ea ho sebelisa kopo ho
389,here is a great quote from henry ford to start your week off brought to you by,mona ke quote e ntle ho tloha henry ford ho qala beke ea hau e tlisitsoe ke
390,_joona si motivational speaker wale se conversation ko continue bare mein pata plus u r not even percent interested in me tou,setsebi sa sebui sa _joonia sa wale se me mein
391,you know most of motivational are not from realistically point of view,u tseba boholo ba tšusumetso ha e tsoe ka lintlha tsa nnete tsa pono
392,fantastic speech had no idea he was such a good speaker informed heartfelt motivational inspiring,puo e monate e ne e sa tsebe hore ke sebui se hantle se khothalelitseng tšusumetso e tebileng ea tšusumetso
393,i think it s time the found a new motivational angle because nobody in us is simply not true any more,ke nahana hore ke nako ea ho fumana semelo se secha sa maikutlo hobane ha ho motho eo eseng ea 'nete
394,good afternoon ladies and it s motivational and the start of a new week so go out there and earn your weekend,marotholi a monate a mots'eare le a ho khothala le ho qala beke e ncha kahoo ho ea kantle le ho fumana beke ea hau
395,_arcade so motivational this is exactly what i,"_arcade haholo, ho susumetsa sena ke sona seo ke leng sona"
396,_nifex_ that is you turn yourself to be motivational speaker,_nifex_ hore o itebela ho ba sebui se khothatsang
397,the thing i love about anime is that plus ultra go beyond motivational energy,ntho eo ke e ratang ka anime ke hore le uena u potlakela ho feta matla a thata
398,sylvester,syllvester
399,we have two and the second when we realize we only have one,re na le tse peli le tsa bobeli ha re hlokomela hore re na le e le 'ngoe feela
400,a short true story with a message that the power to open your heart even more via,pale e khuts'oane ea 'nete e nang le molaetsa o reng matla a ho bula pelo le ho feta ka
401,just the motivational show to listen up,ho khothala feela ho mamela
402,happy motivational s here s to a great start to the week everyone,ho monate ho ba hantle s mona s ho ea pele ho fihlela beke e mong le e mong
403,motivational to get you through turn to these motivational on to help you feel inspired at work via,motivational ho tla u thusa hore u fetole tšusumetso ena ho u thusa ho ikutloa u bululetsoe mosebetsing ka
404,apparently was the first motivational speaker i will ascend and we wonder why it do not work,"kamoo ho bonahalang kateng e ne e le sebui sa pele se susumetsang, ke tla nyoloha mme re ntse re ipotsa hore na ke hobaneng ha ho se sebetse"
405,yeah i understand that but always think that i believe in you motivational,ee ke utloisisa seo empa empa o lula ke nahana hore ke lumela ho u susumetsang
406,joshi new video on junction this is the link of a beautiful motivational story watch latest video like comment share subscribe channel thanks,joshing video e ncha ea josuni leqepheng la pale e ntle ea sepheo se setle sa ho shebella video e joalo ka maikutlo
407,are the last people you should be sending motivational from the abroad send them let them their time,ke batho ba ho qetela bao u lokelang ho ba ho romella tšusumetso ho ea kantle ho naha ba ba romella nako ea bona
408,where s ur daily motivational,moo ho na le morero oa letsatsi le letsatsi
409,how r u ur beautiful smile motivational running,u na le pososelo e ntle ea pososelo
410,_ i need this on a motivational poster,_ ke hloka sena ka poster e khothatsang
411,our weekly schedule is now live happy motivational every day is a chance to be better comment below your favorite motivational quote,kemiso ea rona ea beke le beke e lula e le lehlohonolo letsatsi le leng le le leng ke monyetla oa ho ba bonolo maikutlo a betere ka tlase ho qotsulo eo u e ratang haholo e susumetsang
412,do not worry about the,se ke oa tšoenyeha ka
413,do not let man is wisdom cloud your thinking and deny you the glorious life in go for god is word leave vain motivational,se ke oa lumella motho hore a nahane ka tsela eo u nahanang ka eona le ho u amoha bophelo bo khanyang ho molimo ke lentsoe la siame ka tšusumetso e susumetsang.
414,thanks motivational speaker,ke leboha sebui sa sebui
415,she is set up a little training area for herself with of the ashen demon pinned to all the motivational,o thehile sebaka se fokolang sa koetliso bakeng sa modemona oa ashen o ile oa qaptjoa ho tšusumetso eohle e susumetsang
416,motivational story a problem well stated is a problem half how to deal with in life,pale e susumetsang hore bothata bo boletsoeng hantle ke bothata ba ho sebetsana le bophelo
417,_lay motivational speaker,_lay sebuishene sa sebui
418,some might put a motivational quote or text here but all i have to say is that no other container coca cola is sold in the taste from the liter glass,ba bang ba ka beha mantsoe a susumetsang kapa a ngotsoeng mona empa sohle seo ke se buang ke hore ha ho na lisebelisoa tse ling tsa coca cola ho tatso e tsoang ka har'a li-tali
419,o from jam alley and also she the best motivational and every morning on at am she s live,o tsoa jam alley le eena o na le tšusumetso e ntlehali le hoseng ho hong le ho hong ho am o phela
420,too many especially those in the pulpit would rather be inspirational and motivational rather than too much time trying to build instead of making,ba bangata haholo ba ntseng ba le sefaleng ba ka khetha ho khothatsa le tšusumetso ho fapana le ho nka nako e ngata ba leka ho aha sebakeng sa ho etsa
421,bring back with her motivational,khutlisa ka tšusumetso ea hae
422,amazing motivational speaker man,monna oa sebui se hlollang
423,i need motivational to be telling me this every morning portable the,ke hloka tšusumetso ea ho mpolella sena hoseng ho hong le ho hong hoo e ka bang
424,price error venture pal motivational water bottle with time marker removable strainer historical minimum only instead of,phoso ea theko e ikemetseng ea metsi e susumetsang ea pal e nang le nako ea nako ea nako e tlisoang ke nako ea nako ea nako ea nako feela ho fapana le
425,keep it up queen motivational,e boloke e phahamisa mohloli
426,their twitter is full of motivational my goodness,twitter ea bona e tletse ka molemo o motle
427,beautiful motivational canvas an inspirational safety quote or specific company safety value demonstrate that safety at the top,sesebelisoa se setle sa ho susumetsa setulong se khothatsang sa polokeho ea boiketsetso
428,he is so motivational,o na le tšusumetso haholo
429,loyalty nothing unless it at its heart the absolute principle of self sacrifice,ho tšepahala ha ho na letho ntle le haeba ho le ka pelong ea eona molao-motheo o phethahetseng oa boitelo
430,motivational blood sweat respect the first to you give last one you earn,mofutsana oa mali o susumetsang tlhompho ea pele ho uena ho fana ka ea ho qetela eo u e fumanang
431,thank you for your motivational wish you too the best of luck,kea leboha ka tšusumetso ea hau eu nahana ka lehlohonolo
432,_ that one na motivational speaker this one get doings na,_ hore sebui sa motho ea se nang moferefere sena se fumana li-doeling na
433,i keeping your in mind and with an assumption that money is the motivational factor offbeat you would know better but knowing your flair for satire poetry you could look at non vulgar stand up satirist or a in the same genre,ke lula ke nahana ka uena le monahano oa hore chelete e ka ba khothatsang u ka tseba ho feta empa ho tseba hore na o na le lithothokiso tsa satire kapa ho ba le mofuta o le mong
434,commissioner helping client _xoxo program course year development communication yr task motivational letter for exchange student deadline budget fixed strictly no drop po si,khomishenera ea thuso ea moreki сxoxo lenaneo la khokahano ea khokahano ea khotso ea khokahano ea khokahano ea khotso ea khoebo
