,src,trg
1070,indeed this is the balancing act the decision and that i think i basically agree with on the policy issue at stake but i am not sure resort to  nothe common good' is a persuasive one in a concurrence that a violation,ka sebele ena ke qeto ea ho leka-hlakisa qeto le hore ke nahana hore ke lumellana le makasineng oa pholisi 'ke tšusumetso e kopaneng ea tlolo ea molao
1071,wpa is curriculum on relevant learning that better the next generation to excel in their chosen field will develop a deep understanding of collaborative reasoning persuasive computational thinking,wpa ke thuto ea thuto e loketseng ho feta moloko o latelang ho ipabola ho ea ka kutloisiso e tebileng ea monahano o amanang le likhomphutha oa ho susumetsa
1072,lost in a blizzard s dairy queen loss the failure of the billionaire s ice cream chain in its 'blizzard' dispute the critical role of persuasive evidence,o lahlehile ka lebaka la botlokoli ba mofumahali ea blizzard s dairyuire ho ho hloleha ha ketane ea ice cream ea li-bilione ho ea 'blizzard' e nang le karolo ea bohlokoa ea bopaki bo susumetsang ba bopaki bo susumetsang ba bopaki bo susumetsang ba bopaki bo matla
1073,are the artistic persuasive use of to enhance create conducive for client retention by to your you can generate more close more it is that easy,na tšebeliso ea bonono ea bonono ea ho ntlafatsa e theha e tsamaisang bakeng sa bolokolohi ba moreki ka uena u ka etsa hore ho be bonolo haholoanyane
1074,to be a great content creator in your niche you have to be a great content consumer embark on extensive research become a voracious reader and a persuasive writer because great input great output _arson,ho ba 'mopi oa litaba tse ntle oa litaba niche o tlameha ho ba o ile oa qala ho ba' mali a mangata le mongoli ea susumetsang hore o kenye letsoho haholo ka lebaka la tlhahiso e ntle.
1075,_re detailed on pipeline detailed on demos detailed on property physical rentable construction persuasive relative value type our deal is better than because detailed summary of historical spent,_more ka pompoline e hlakisitsoe ho demos e nang le lintlha tsa boleng ba thepa ea thekiso ea matlo
1076,because you are a sweet sensitive person with amazing creative talent with an keen mind that is with plus from my with you a very persuasive individual,hobane u motho ea ratehang ea nang le kelello e monate ka talenta e makatsang ea polenta e nang le kelello e nang le kelello e haufi le ke le mong le o mong le o mong
1077,remember that the revolve around forcing you to do that they want it is always coercive and never persuasive,hopola hore bofetoheli bo u suthisang ho etsa joalo ba batla hore ho be le maemo kamehla le ho se be le mamello
1078,yes he was trying to say he could hit a shot from there and he was not persuasive enough,ee o ne a leka ho re o ka otla thunya ho tloha moo mme o ne a sa susumetse ho lekana
1079,_ _adam you are have to work on being helpful inspiring and most importantly persuasive this ai not it,_ _ _dam o tlameha ho sebetsa ho ba bonolo ho ba le tšusumetso e matla le ho susumetsa ka ho fetisisa ka ho fetisisa hore e se joalo
1080,contrary to it is everyday meaning the word rhetoric actually to a millennia old art of persuasion it a way to understand politics as a strategic competition for hearts and through persuasive discourse and it is a lost art for modern,ho fapana le eona ke moelelo oa mantsoe ao ho a latang la bana ba baholo ka lebaka la ho utloisisa lipolotiki le puo e susumetsang 'me ke art e lahlehileng ea sejoale-joale
1081,love the in dragon age inquisition war table where you get to take care of and the of the mission are some guy being like yo inquisitor i apologize for being too hasty your was quite persuasive,rata ho dragon age tafole ea ntoa ea dragon ea dragon
1082,perhaps the very first piece of persuasive writing i ever did was a third grade essay for to have his nice to see even if he is no longer the household name that he once was,mohlomong sekhechana sa pele se ngotsoeng pele se kileng sa etsa semelo sa sehlopha sa boraro hore se tsebe ho bona le haeba e se e le lebitso la ntlo leo a neng a le ka lona
1083,a hint now always often falsely claim adverse is hoax or conspiracy if that they hand wave about missing context without providing any relevant persuasive context that actually a given piece of evidence innocuous,mohlophisi kamehla o lula a e-na le 'mampoli oa leshano
1084,in the documentary who we are a brilliant historical analysis of racism in he exclusively on us history and a powerful and most persuasive argument that we all need to take a closer look at our heritage and ourselves,ha re le khoebong eo re leng tlhahlobo e ntle ea nalane ea khethollo ea morabe ho rona feela le ngangisano e matla le e matla haholo eo bohle re e hlokang hore re hlahlobe lefa la rona le rona
1085,three every venture capital firm in a new hire resilient reflective persuasive if you have all three send and a,maramo a mararo le a 'ngoe e kholo ka ho fetisisa khopolo e ncha ea ho hira e khothatsang haeba u na le tse tharo tsa ho romella tse tharo le a
1086,_ _adam that was not necessary helpful inspiring and most importantly persuasive how are you supporting at your local and state level that is crucial,_ _madam e neng e sa hloke ho susumetsa le ho susumetsa ka ho fetisisa hore u ts'ehetsa ho fihlela boemo ba hau ba lehae le mmuso o bohlokoa
1087,what me to this particular hilltop is an attempt to understand how yesterday s history is to justify today s empty physical are not the only for reality themselves also serve a purpose as persuasive as dong,"seo ke leng ho sona leralleng sena ke teko ea ho utloisisa hore na nalane ea maobane ke ho lokafatsa 'mele oa kajeno, ha se eona feela ea lokelang ho sebeletsa e le dong"
1088,i cannot fathom how anyone can defend this who met an yr old who their vulnerability trust physical persuasive power vile inhuman are not i usually find comfortable but make an exception for who deny their to protect,ha ke khone ho soasoa hore mang kapa mang a ka e sireletsa ba bang ba kopanelang yra ba bang ba nang le matla a ho tšepa 'mele o sa phutholoha empa ba mokhelo bakeng sa ba sa tsebeng ho sireletsa
1089,mad persuasive i watch it,hlatsa ke e shebelletse
1090,_rides it like propaganda is more persuasive than reality,"e _, joalo ka mashano a susumetsang haholoanyane ho feta 'nete"
1091,your illustration of status quo bias to be more persuasive is killer turn the bias around,papiso ea hau ea maemo
1092,_ maybe you re correct here but this attitude is persuasive in every single thing they do and their passivity inaction is becoming more dangerous by the second constantly telling us how bad the r s are and then refusing to use any of their power to defeat them it s exhausting,_ mohlomong u lokisa mona empa maikutlo ana a susumetsang nthong e 'ngoe le e' ngoe a etsang le ho nka khato e ntseng e re: ho khathatsa
1093,from the ad based on a person s employer are so persuasive especially for someone that works for the democratic party and the new york times beyond parody,ho tsoa ho papatso ho latela mohiri oa hae ho susumetsang haholo motho ea sebetsang bakeng sa motho ea etsang demokrasi le new york times
1094,actually i have hard time two conflicting worth exploring we hear persuasive why un who fed are cabal but with are supposed to get monitory control back from evil,ha e le hantle ke na le nako ea bobeli e hanyetsanang re utloa eka re ka u susumetsa hore na ke mang ea e fepa ka thipa ho tloha bobe
1095,to someone less is usually more stick to your strong _sivanathan because your do not add up in the of the receiver they out read,ho motho e mong hangata a khomarela haholo ho feta a hauhlivanathan hobane ea hau e sa eketse ho moamoheli ea tsoang
1096,learn a framework for writing persuasive copy that in today s saturated climate,ithute moralo oa ho ngola kopi e susumetsang eo e leng maemong a leholimo a leholimo a tletseng
1097,not undeniable to the radical right persuasive to anyone who still empathy people who are literally cannot process information that with their world view their brains will literally tune it out or make up about it it is fake news,ha e ke ke ea susumetsoa ke mang kapa mang ea ntseng a susumetsoa ke mang kapa mang ea nang le kutloelo-bohloko ea nang le lefatše leo ka lona le bonang kapa le leng ka lona ke litaba tsa leshano
1098,this one cannot attack and still want more from democratic leadership telling people to shut up and get in line is not going to work for your progressive rather you insult condescend with not persuasive or thought out,sena se ke ke sa hlasela le ho feta ho tsoa ho boetapele ba demokrasi ho bolella batho hore ba koale 'me ha u se ke ua buisana kapa u nahanne
1099,a simple formula you can use for writing persuasive by,foromo e bonolo eo u ka e sebelisang bakeng sa ho ngola ka letsoho
1100,you people wow did you ever consider that i might be a person and i think for myself if you can bring a persuasive argument showing safety and efficacy of these i am ready to listen and open to my perspective are you,le uena batho ba kile ba nka hore nka ba motho mme ke ipolella haeba le uena o ikemiselitse ho mamela le ho bulela pono ea ka
1101,i agree just remember elder andersen is talk given at the same general conference we do not shrink before those who disparage us are not passive they are persuasive in the savior s way,"ke lumela hore ho mo hopola le ho hopola feela hore ho buuoa ka taba e tšoanang ka kakaretso, ha re senyehe ka pel'a ba sa hlapollang ba susumetsang ka tsela ea mopholosi"
1102,i m not sure the will find that persuasive,ha ke na bonnete ba hore ke tla fumana tšusumetso e susumetsang
1103,say it with us all you need to know about how these see you it is patronizing and they think you need to be forced into belief there is no effort to make a persuasive argument because they think you are stupid projection at its,e bue le rona sohle seo u hlokang ho se tseba hore na ke boikarabelo ba ho beha tumelo joang hobane ba nahana hore o na le thuto e hlokang kelello ho eona
1104,local transit is imperative for a strong transportation network the tax collection rate for ben franklin transit will not be cut all but two found a presentation by staff persuasive and to take a proposal off the agenda,transiti ea lehae e bohlokoa bakeng sa marang-rang a ho tsamaisa thepa bakeng sa papatso ea ben franklin ho ke ke ha khaoloa tsohle
1105,fun fact about the song my for my speech class in college i the topic of why my is the song of all time for my persuasive speech and my professor it for being sexual in nature so he s a virgin like,taba ea monate ka pina eo ke e fumanang thuto ea ka kolecheng ke taba ea hore na pina ea ka e na le e 'ngoe ke moroetsana joalo ka moroetsana joalo
1106,yet they will do it tone police even when it being persuasive harder,leha ho le joalo ba tla e etsa mapolesa esita leha a ne a susumetsa ka matla
1107,regrettably i can make the exact opposite argument that incompetence was responsible for the crash and are blameless for inflation but that logical inconsistency is as persuasive to you as your fallacy is to me i win you lose,ka masoabi nka etsa hore taba e fapaneng e be boikarabelo ba ho oa le likotsi tsa ho intša le ho se lumellane ho hoholo ha u e-na le uena
1108,mick lynch of and mick have all been hugely impressive and persuasive because they are and telling the truth no wonder it so foreign to us,mick lynch ea 'me e se e le ntho e khahlang ebile e susumetsa hobane e bua' nete ha e ea kantle ho naha
1109,i also wonder if lack of a strong response by the majority to the concurrence is criticism of the somewhat dubious as noted was by a desire to keep all seven on board but i digress overall persuasive if narrow by majority,hape ke ipotsa hore na ho na le karabelo e matla ke ho feta ho ho eketsehileng ho nyatsa ka tsela e itseng e le hore ke be le takatso ea ho ba le tšusumetso ea matla ha e le empoli
1110,national medical and legal have a report condemning health plan to block coverage for gender dysphoria saying the move any persuasive scientific or medical justification,molemisi oa naha oa molao o akarelletsa khotso ea bophelo ba bophelo ba bophelo ba taolo ea bohlale ba bong dyphoria ba re ho ntša leeme le leng le susumetsang la bongaka kapa la bongaka
1111,i m not sure how you would gather rigorous evidence on this topic if seem less persuasive and more out of touch even with the same issue as less woke that clearly them but,ke ne ke sena bonnete ba hore na u ne u ka bokella bopaki bo boima ka taba ena haeba bo bonahala bo susumetsa le ho feta ka lebaka le tlase joalo ka ho tseka ka ho hlaka.
1112,interact with a diverse set of to develop fluency set to learn about probability manage risk and reward craft weekly trade for persuasive writing and speaking make waiver as an introduction to game theory,kopana le maemo a fapaneng a ho ithuta ka mokhoa o phollatsi oa ho ithuta ka mokhoa oa beke le beke le ho bua joalo ka kenyelletso ea khopolo ea papali
1113,they are basically just self they are not persuasive analytical on why honda is the best character of all time or why is thematically complex and deep and the best fiction ever but just an ordinary reflection from ordinary me,"ha e le hantle, ha se taba e susumetsang ka lebaka la hore na ke hobane'ng ha ho tokiso e ntle ka ho fetisisa kapa hobaneng e le ntho e makatsang"
1114,_phillipson we saw how important these were when stopped taking advice and making stuff up on the hoof yet the in may are not in precisely the same way as legal they are persuasive but not conclusive,_phillinon
1115,i appreciate the out of a client who on hearing we will write a very persuasive letter will you be writing that because yes i will be i am persuasive as the only i am certain of about my university education are,ke leboha ka ho tsoa ho moreki ea utloang re tla ngola lengolo le susumetsang haholo
1116,the net be not by persuasive it s _,net e se ke ea e susumetsa s _
1117,_farm it you are this sea lion thing as a person with a failure to accept unsubstantiated without evidence a k a the antonym of gullible not however persuasive,_farm ke eona ntho ee ea leoatle la leoatle e le motho ea sa atleheng ntle le bopaki ba ho se be le bopaki ba k) leha ho le joalo
1118,if you go out tonight i m going out cause i know you re persuasive,haeba u tsoa bosiung bona
1119,the huge persuasive power of money,matla a maholo a ho qotsa
1120,_wiki of those who read your tweet will not understand it it would be helpful make your point persuasive to explain your point,_wiki ea ba balang tweet ea hau e ke ke ea e utloisisa e ka ba molemo ho etsa hore ntlha ea hau e hlalose ntlha ea hau
1121,our division is seeking a who will give its a compelling and persuasive edge in highly competitive,karolo ea rona e batla ea tla fana ka pheletso ea eona e susumetsang le e susumetsang ka tlholisano e kholo haholo
1122,tend to be eye catching prove your and are persuasive and extremely shareable they are a great tool to help you increase your and reach,ka tloaelo ho tšoasa mahlo a tšoaeang ea hau 'me u susumelletsa le kananelo ebile ke sesebelisoa se seholo ho u thusa ho eketsa le ho fihlela
1123,i see you can come back when you have a more persuasive argument,kea bona u ka khutla ha u na le ngangisano e susumetsang haholoanyane
1124,i accept your point about the pandemic being a global issue so then you must also not be blaming anyone for the global inflation gas that are the entire world right now either that would be logically consistent make your argument more persuasive,ke amohela ntlha ea hau ka seoa sa lefatše hore le se ke la beha mang kapa mang lefatše
1125,the most persuasive who ever this country s thinking martin on labour politician and writer who a communist in the s as food minister and war secretary in the post war labour,se susumetsang ka ho fetisisa ke mang ea kileng a nahana ka martin ho moqapi oa basebetsi le mongoli ea nang le bokomonisi ho mosebeletsi oa lijo le mongoli oa ntoa
1126,persuasion is part art and part science let me tell you why,persuasion ke karolo ea bonono le karolo ea mahlale e re ke u joetse lebaka
1127,hand especially can highlight by attention to of the speech stream they can be superimposed on any other type of gesture especially like to do that to be persuasive,hand especially can highlight by attention to of the speech stream they can be superimposed on any other type of gesture especially like to do that to be persuasive
1128,sam _dumitriu economic growth should be priority and amongst other full capital for should be us did this in i find on this persuasive land value business,sam _dumitriu kholo e lokela ho pele le e 'ngoe e kholo ea chelete e felletseng bakeng sa khoebo ena e susumetsang
1129,conventional wisdom that science and religion are at odds versus faith these two however make a persuasive case for the relational unity between powerful of human thought,bohlale bo tloaelehileng boo saense le bolumeli bo se nang bohlokwang bo eketsehileng ba bona ba babeli ba etsa hore bonngoe bo amanang le bona bo pakeng tsa mohopolo o boima pakeng tsa mohopolo oa motho
1130,i think that is the 'cultural apologetic' of your is very persuasive but what a miserable place would we be in if in order to function we would have to believe a noble lie been convinced that it is good can we be convinced that it is also true,ke nahana hore 'setsomisetso' ea hau e susumetsang haholo empa re ka ba sebaka se setle haholo haeba re ka tlameha ho lumela hore le uena re ka kholiseha hore le uena re ka kholiseha hore le uena re ka kholiseha hore le eona re ka kholiseha hore le eona re ka kholiseha hore le eona re ka kholoa 'nete
1131,the critique of car dependency is persuasive but do not the against car dependency mistake the critique for the solution why would anyone vote for the punitive you,ho hlokahala hore motho a buelle koloi ea koloi a susumetsoa empa a se ke a etsa hore ho be le karabelo ea tharollo hobaneng ha motho a ka khetha tharollo ea hau
1132,__gaurav psychological to be more persuasive by,__garav psychological ea ho susumetsa ka ho fetisisa ka
1133,thanks to thanish is expert persuasive i am buy em,ke leboha haholo ke setsebi se nang le tšusumetso ke reka em
1134,how to overcome change management as a professional communication is key in this video i share my secret weapon for ai to write persuasive and more,mokhoa oa ho hlola tsamaiso ea liphetoho joalo ka puisano e bohlale ke senotlolo video ena eo ke buang ka eona ea lekunutu ke arolelana sebetsa sa ka sa lekunutu sa ai ho ngola tse susumetsang le tse ling
1135,your sons must be sure that you can beat their in the following hand to hand combat chess s action movie knowledge making gun shooting persuasive writing human figure drawing blues guitar battle anything else,bara ba hau ba tlameha ho ba le bonnete ba hore u ka hlola ba u loantšana le sebapali sa gess s action
1136,you are one of a rapidly shrinking group of insane formerly know as one thing i have about insane it that they have no conscious awareness of their insanity it s what them so dangerous and persuasive like a charming serial killer,u se seng sa sehlopha se ntseng se songoa ka potlako sa ka potlako seo ke nang le sona
1137,essay research midyear thesis concept paper analysis reflection assignment homework persuasive,motsoako oa lipatlisiso tsa midsear thesis conceptis inporestical in katishe ka mosebetsi oa lapeng o ntse o susumetsa mosebetsi oa lapeng
1138,why bail it to be apart _bear for revealing if the same matter pending you may plead and request the judge to consider the same in persuasive manner the court have,hobaneng ho ba teng e le karolo ea bonyane _bear bakeng sa ho senola hore na taba e ts'oanang haeba taba e le hore u ka bua le uena ka mokhoa o susumetsang ka tšusumetso e amang lekhotla le amang maikutlo a susumetsang
1139,persuasive do not say i sell rather say enjoy music anywhere rich sound without the hassle of sell the desired state,tšusumetso ha e re ke rekisa
1140,hello i am write for more feel free to message me commissioner client essay argumentative persuasive reflective position paper essay activity assignment write,hello ke ngoletse ho feta ho ikutloe u lokolohile ho romella molaetsa oa commisory
1141,misery company,khampani ea mispess
1142,then he t fit to lead if he to lie to win because he cannot be persuasive someone else who can tell the truth and persuade should do the job i m afraid i don t think labour are better than tory just the all lie mantra,ebe o tla hotella pele haeba a ka bua leshano ho hapa hobane a ke ke a susumetsa motho e mong ea ka nahanang ho feta a le metlae ea mantra
1143,i have never so much kremlin grot for a long time perchance blade honestly his speech to be overwhelmingly persuasive on those who are naive enough to have a benevolent attitude towards communist sa is in big trouble with this alliance,ha ke e-so ka ke e-ba le kremlin ea kremlin e telele haholo ka mokhoa o phethahetseng puo ea hae e susumetsang ho ba nang le tsebo ea bokomonisi ka ho ba mathateng ana
1144,you on my post not the other way round if you think you can make your point by all go for it you only owe in the sense that you this not me as yet i do not find anything you have said informative or persuasive,uena ka poso ea ka eseng tsela e 'ngoe haeba u nahana hore u ka etsa hore u tsebe ho e-na le seo u se buileng kapa u susumetseha
1145,my thesis feedback from was one sentence had multiple of a well and persuasive but more like a political policy document than a sociological investigation i think it s really important to remember sometimes your marker is just a,maikutlo a ka a morao ho polelo e le 'ngoe e ne e le tse ngata haholo ebile e le tšusumetso empa lipatlisiso tsa pholisi ke nahana hore ke tsona tsa bohlokoa haholo ho hopola ka linako tse ling lets'oao la hau.
1146,nope you got it right you re mistake is not realizing that from the rational to the persuasive mode constantly then it was the other when you call him out for it,nope o u file phoso
1147,war war is innovative serial conflict the critical vulnerability is where sustain significant in effect their inevitable demise the human factor in this paradox victory hath already been persuasive fail j,ntoa ea ntoa ke seoelo se seng sa sebalefa se seng se seng se nang le sehlōhō ke moo ho tla ba matla ho sa feleng ho etsa hore motho a se ke a qobella ho hloleha ho hloleha.
1148,people who have very strong may sometimes struggle in where they need other is help or support if you find yourself in this quandy get in the habit of the six found in the check rule,batho ba matla haholo ba ka ba teng ka linako tse ling ba u hlokang
1149,the anarchy is the disturbing story of how a certain rapacious type of capitalism can swallow whole in a powerful and persuasive narrative fabulous new review of the edition of the anarchy by,moruti ke pale e sithabetsang ea hore na mofuta o itseng oa botaki o ka nooa ka botlalo le partuative e ncha ea khatiso ea moferefere ka
1150,great content all of these are awesome one thing i would add is the importance of narrative storytelling in being persuasive it is kind of the arc that each of these individual but a really strong story that can incorporate these is so powerful,likahare tse ntle kaofela ke ntho e ntle eo ke neng ke tla e eketsa ke bohlokoa ba papatso ea papatso e phetelang ho ba susumetsa ke mofuta o mong le o mong oa arc e matla haholo
1151,a calm persuasive case from in that every should read in advance of voting yes would be a a vote of confidence in the people of to work together rather than usurp that responsibility,"ketsahalo e susumetsang e tsoang botebong ba pelo ho tloha moo e ka bang ea lokela ho bala, e ka ba polelo ea ho itšepa ho batho ba ho sebetsa 'moho ho fapana le ho inkela boikarabello boo"
1152,home invasion was persuasive from to i know it is vacant ya,tlhaselo ea lapeng e ne e susumetsa ho tloha ho 'na kea e tseba hore e sa le motho ea sa sebetseng
1153,have a power of persuasion than that of or will the persuasive power of an odor cannot be off it into us like breath into our it us up there is no remedy for it,ho ba le matla a ho susumetsa ho feta a ho susumetsa matla a thothomelang a ka se ke a re kenya ka ho hema ka holimo ha ho na pheko
1154,i personally do not give a if a framed picture of in every room in his house just so long as he is on making persuasive anti capitalist,ha ke fane ka setšoantšo se hlophisitsoeng sa ka phapusing e 'ngoe le e' ngoe ka tlung ea hae haufinyane ha o ntse o etsa capicetist e thibelang
1155,seeing the world through god is is the most transparent thing we can do we appreciate our purpose in this eternal culture and look at it in a holistic way to remember how to appeal to god effectively we imaginatively experience the delicate skillfulness of persuasive,ho bona lefatše ka molimo ke ntho e hlakileng ka ho fetisisa eo re ka e fumanang ka tlisoa ke molimo ka katleho e le hore re tsebe ho susumetsa molimo ka katleho.
1156,price may also be persuasive the price of the is to be about lower than its reference product,theko e kanna ea susumetsa theko ea the ea ho ba ka tlase ho sehlahisoa sa eona
1157,our ai personality of the week is she is a computer science professor a canada research chair in persuasive technology the director of the persuasive lab she won over from both national international,motsamaisi oa rona oa ai ke moprofesa oa mahlale a komporo ea komporo ea molao theknoloji ea molaoli ea susumetsang
1158,super well done to all year this week for amazing persuasive poem writing i am so of you all and the work you have produced you,e ne e le hantle ho feta selemo sena kaofela bekeng ena bakeng sa ho ngola ka mokhoa o hlollang oa thothokiso e susumetsang ke ho ngola ke le uena kaofela le mosebetsi oo u o hlahisitseng
