,src,trg
565,don t hope to get lucky in this life go out and do it what do you think of this,u se ke oa tšepa hore ho tla ba le lehlohonolo bophelong bona ho tsoa 'me u e etse u nahana eng ka sena
566,if you was rich what would you put on your number plate what do you think of this follow my,haeba u ne u le morui u ka beha eng ho poleiti ea hau eo u nahanang ka eona u nahana hore ena e latela ea ka
567,motivational are you thinking of selling your home when showing your home these quick and easy statement worthy can help separate your home from on the market send me a message to learn more about home selling,motivational na u nahana ho rekisa lehae la hau ha u bontša ntlo ea hau kapele le ea setatemeleng sa hau ka potlako ho ka thusa ho arola ntlo ea hau 'marakeng ho ka nthomella molaetsa ho ithuta haholoanyane ka ho rekisa hae
568,i need motivational speaker wey go dey dey whine me i do not mind e remain,ke hloka sebui se khothatsang sa sebui sa boikhathollo se se nang din se monyang ka ha ke sa tsotelle
569,happy motivational everyone what you to get you through the day,se nang le tšusumetso e monate motho e mong le e mong eo o tla u fa eona letsatsing
570,women is tank find your happy place stay there inspirational tank top workout athletic motivational,basali ke tanka fumana sebaka sa hau se thabileng sa lula moo ho buuoang ka tanko ho ea holimo ea tank
571,me looking at motivational,ke shebile sethaleng
572,_tade _jud for every luxury vehicle the importer tax for the government so if she on driving in she to get million birr so i recommend going to a good surgeon than a motivational speaker he will extract your safely,_tade _jud ka koloi e 'ngoe le e' ngoe e mabothobotho bakeng sa mmuso joalo ka ha a khanna a e-na le karolo e ntle ho feta sebui sa hau se susumetsang
573,_lay i do not know this is a motivational speech or but keep i love it,_lay ha ke tsebe sena ke puo e susumetsang kapa empa u boloke hore kea e rata
574,i have just that people engage more in sexual than the motivational but that is not good for your mental health,ke na le toka feela hore batho ba ho etsa thobalano ho feta tšusumetso empa seo ha se hantle bakeng sa bophelo ba hau ba kelello
575,experience is largely non transferable,boiphihlelo ha bo fetohe
576,motivational be like laugh in the you have cried and am like bitch bathroom jake k se,motivational e be joalo ka ts'ehetsong eo u e llang le e joaloka ho hlapela jake k se
577,since when did u become motivational,ho tloha neng u bile le tšusumetso
578,make gratitude a part of every day,etsa hore ho be le teboho karolo ea letsatsi le letsatsi
579,will be posting one of her motivational soon,e tla bea e 'ngoe ea tšusumetso ea eona haufinyane
580,i still cant understand how can someone still like as a person not a motivational speaker but a person after he she completely prakhar is video,ke ntse ke batla ho utloisisa hore na motho o ka nna le motho ea susumetsang maikutlo joang empa motho ka mor'a hore a phahame ka botlalo ke video
581,_ highly motivational and inspiring well done,_ e susumetsang le ho khothatsa hantle
582,alone did like different motivational about how everyone is amazing in their own right and should always love themselves no matter what and how the love each person there regardless of a,a le mong a bile le tšusumetso e fapaneng mabapi le hore na e mong le e mong ea makatsang ka ho le letona 'me o lokela ho lula re le taba le hore na lerato le leng le le leng joang le hore na lerato le leng le se na eng
583,_ i that in many motivational speaker walkout,_ ke etsa joalo ka sebui se nang le tšusumetso e matla
584,motivational this week is motivational quote comes from sophomore guard,boithati bekeng ena ke mantsoe a susumetsang a tla ho tsoa ho sophomore
585,voice in the flame motivation for success powerful motivational by billy,lentsoe ka lebaka la tšusumetso ea katleho ea katleho e susumetsang ka tšusumetso e matla ka billy
586,just the as a motivational speaker thing,feela ke le ntho e susumetsang
587,go for it,etsa joalo
588,it s the emissary for me your emissary came and even gave me motivational speech to do more,ke nissisary bakeng sa ka mme o bile a mpha puo e tsitsitseng ea ho etsa ho eketsehileng
589,_zakir motivational,_zakir khothatso
590,motivational money,chelete e susumetsang
591,motivational greatness sacrifice,setšehetso e matlafatsang
592,he t really coach he s like a motivational speaker for the our should be better than last year not too worried,o na le kobo o joalo ka sebui se susumetsang bakeng sa rona se lokela ho ba betere ho feta selemong se fetileng se sa tšoenyehe haholo
593,great motivational pic for those who have not gone for yet,pic e kholo ea tšusumetso bakeng sa ba sa tsamaeng
594,motivational quote just do it,quativational quote e se etsa feela
595,as a i had many w and wrote many about her life as a coach role model motivational speaker i m excited to see her being,joalokaha ke ne ke le bangata ho na le tse ngata ka bophelo ba hae e le sebui sa mokhanni oa moetsi oa moqapi oa moetapele eo ke mo thabelang ho mo bona
596,_eey it is motivational not motivation,_eey ke tšusumetso eseng tšusumetso
597,good morning fam it s motivational so here s a little quote to start off the day life is like riding a bicycle to keep your balance you must keep moving hope everyone the week off on a positive note,ho natefeloa ke li-khothatso tse ntle haholo
598,never think you will never make it just know you can as that motivational speech from that was turned into a nothing is impossible,le ka mohla u se ke oa nahana hore u ke ke ua tseba feela hore u tla tseba hore u ka se khone ho bua ka mokhoa oo o sa khoneheng ho tloha ha ho khonehe
599,he dey give soldier motivational speech,o amohela puo e khothatsang
600,do you still have that motivational video you posted like a year or two ago or should i just watch on,na u ntse u na le video eo e nang le tšusumetso joaloka selemo kapa tse peli tse fetileng kapa ke lokela ho shebella feela
601,are usually as the most unwelcomed day of the week but for me they are the foundation to start new dress smartly pose boldly and smile widely,hangata e le letsatsi le sa nyaloang ka ho fetisisa la beke empa ke lona ke motheo oa ho qala moaparo o mocha ka bohlale le ho bososela haholo
602,the motivational coach that needs,mokoetlisi oa tšusumetso o hlokang
603,is a motivational speaker and in stem advocate through her work of to have a shift when it comes to money math and the power of,ke sebui se khothatsang le sehahla se buellang mosebetsi oa hae oa ho ba le phetoho ha ho tluoa ho lipalo tsa chelete le matla a
604,failure backwards is which is not even a word did you expect some motivational,ho hloleha ba morao ke hore na o na le lentsoe le leng le le leng le lebelletseng maikutlo
605,basically some motivational speech between black folk and just sitting here,ha e le puo e 'ngoe e khothatsang pakeng tsa batho ba batšo ebile ba lutse mona
606,at some point e dey do me like if i see anybody wey drop motivational again i fit slap am no dey tire,ka nako e 'ngoe e dey e mpolella joalo haeba ke bona motho ea e-na le bothata ba' nete
607,motivational message true freedom is not freedom from but freedom from the slavery of our own mind international trainer coach,molaetsa oa 'nete tokoloho ea' nete ha se tokoloho ea hae empa ke tokoloho ea bokhoba ba kelello ea rona ea lichelete tsa machabeng
608,_am_the_ict need more motivational,_am_to_cort li hloka ho ba le tšusumetso e eketsehileng
609,common person is the highest motivational song u can play for a common person to feel alive,motho ea tloaelehileng ke pina e phahameng ka ho fetisisa eo u ka e bapalang bakeng sa motho ea tloaelehileng ho ikutloa a phela
610,all are becoming motivational thy tell us our problem are solvable but they solve nothing,bohle ba khothalletsoa hore ba u re bolelle bothata ba rona ba rarollotsoe empa ba rarolla letho
611,let is start this week right with a motivational work may be stressful but you are strong and capable and will overcome,e ke e qale bekeng ena ka mosebetsi o khothatsang e kanna ea sithabetsa empa o matla ebile o tla hlola ebile o tla hlola
612,it is does not matter to give a motivational quote to motivate yourself whatever you try here it is just a piece of showcase,ha ho na taba ho fana ka maikutlo a khothatsang ho khothaletsa eng kapa eng eo u e lekang mona ke sengoathoana feela
613,keep pushing motivational,lula u sutumetsa sepheo
614,keep finding motivational on my errand run,tsoela pele ho fumana boithabiso ho errand run
615,eric to be one of the best motivational out here,eric ho ba e 'ngoe ea tšusumetso e ntle ka ho fetisisa mona
616,hello it is not the days in your life but the life in your days that,hello ha se matsatsi a bophelong ba hau empa bophelo bo matsatsing a hau ao
617,motivational self care,tlhokomelo ea boithabiso
618,super excited to be part of the hybrid team here we go the power of teamwork teamwork motivational video via,haholo-holo e bile le karolo ea sehlopha sa hybrid mona re ea matla a ho sebelisana 'moho ea' na oa ho etsa video e matla
619,my son like motivational,mora oa ka o kang a susumetsang
620,was just fore is perspective and nothing else had been a real motivational speaker or guru as people perceive him to be he would have never for his life in the pursuit of complacency can go to any extent,e ne e le hantle feela ke ntho e 'ngoe le e' ngoe e neng e le sebui sa 'nete kapa guru ha batho ba ntse ba mo lemoha hore a ke ke a ba le letsoalo la hae ho ka ea kotsing
621,all those of motivational only to lose your calm in the most of you lost a subscriber epic video,bohle ba susumetsang hore ba lahleheloe ke khutso ho ba bangata ba hau ba lahliloeng ke video e ngolisitsoeng
622,fake motivational,boithabiso ba leshano
623,motivational by kingdom of been on love quote of the day,khothatso ke 'muso oa ho ba nthong ea lerato ea letsatsi
624,warrior it is a state of mind motivational video via,mohlabani ke boemo ba ho ba le boemo bo matla ba kelello ka
625,after some point in life you do not need any motivational or or you just get used to and they will make u move involuntarily,kamora nako e itseng bophelong ha u hloke tšusumetso kapa u tloaetse ho tloaelana le ba tla etsa hore u sisinyehe ka boithatelo
626,welcome to where motivational cry a lot about hunger,rea u amohela moo ho lla haholo ka tlala
627,them motivational from my teacher be everything she don t miss a my girl,ba susumetsang tichere ea ka e be ntho e 'ngoe le e' ngoe eo a sa e hlokeng ngoanana oa ka
628,_pr get quote pass motivational speaker,_pl fumana sebui sa morao-rao sebui
629,why release when you can just keep out and motivational millions have been made stolen just doing that,hobaneng o lokoloha ha o ka thibela batho ba limilione feela le ba susumetsoang ho etsa hore ba etse joalo
630,i m a greater believer in luck and i find the harder i work the more i have of it,ke mo nahana ka moea o moholo ka lehlohonolo 'me ke fumana matla le ho feta ke sebetsa le ho feta
631,motivational gallon water bottle with time marker for save with code f,boikutlo bo susumetsang la garlon bo nang le mokhoa oa ho boloka chelete f
632,motivational speech is like a sugar rush which out with time you need to be to become successful,puo e khothatsang e tšoana le tsoekere e tsoang ka nako eo u hlokang ho ba atleha
633,sports is not a universal problem or solution this post was by badly motivational quote original in the comment,lipapali ha se bothata ba bokahohle kapa tharollo ea poso ena e ne e le ka qotsulo e fosahetseng ea mantlha
634,although his content was mediocre and indifferent from other so motivational he was successful in building a image of a noble man by earning no ad revenue from his n,leha litaba tsa hae e ne e le mediocre 'me e sa tepelletse ho susumetsa setšoantšo sa monna ea inameng ka ho fumana chelete e tsoang ho eena
635,the shorter guy is motivational speaker is good,mohlankana ea khuts'oane ke sebui se khothatsang se hantle
636,the are the gateway to seeing but also to so much else visit for your eye care needs,a na le heke ea ho bona empa hape le ho etela ho hongata haholo bakeng sa tlhoko ea hau ea tlhokomelo ea mahlo
637,have a first rate week visit for more information on our follow like share us on and twitter,ho ba le leeto la sekhahla sa beke bakeng sa tlhaiso-leseling e ngata joalo ka ho arolelana le ho arolelana le twitter
638,it is your time now powerful motivational video eric,ke nako ea hau e le eric video e matla e matla
639,everything will be fine,tsohle di tla loka
640,my husband took me to psychiatrist will do everything and anything to me happy me i should charge my husband k for my motivational speech to him,monna oa ka o ile a nkisa psychiatrist ho tla etsa ntho e ngoe le e ngoe mme eng kapa eng eo ke ratang ka hore ke qosolosa monna oa ka k bakeng sa puo ea ka e khothatsang ho eena
641,its opportunity in the chaos,monyetla oa eona merung
642,___baker i don t know if these motivational are a bit but i do love them,___baker ha ke tsebe hore na tšusumetso ena e nyane empa ke ba rata
643,happy motivational,setumelo tse thabisang
644,if you are often less than about cleaning we adore this little motivational tip from apartment therapy,haeba hangata u le ka tlase ho ho hloekisa re khalemela ntlheng ee e nyane ea ho ikhatholla ka phekolo ea folete
645, noto motivational quote,quotivaric quote
646,the only real mistake is the one from which we learn nothing henry ford,phoso ea 'nete ke eona e tsoang ho eona eo re se ke keng ea ithuta letho la henry ford
647,there s this guy who me a motivational every morning and sometimes that really,ho na le moshanyana enoa ea khothalletsang hoseng ho hong le ho hong mme ka linako tse ling seo e hlile
648,click on to get more motivational,tlanya ho fumana tšusumetso e eketsehileng
649,when we help we help ourselves,ha re re thusa ho ithusa
650,motivational sometimes the part is just getting you have got this,tšusumetso ka linako tse ling karolo e ntse e fumana e fumane sena
651,daily horoscope motivational energy the air as intellectual which could lead to some the moon then into passionate pushing our to new see your si,moralo oa letsatsi oa letsatsi horoscope matla a matla a matla joaloka tlhatlhobo e ka lebisang khoeling eo ka nako eo re ka e batlang e le ncha hore re bone!
652,leakproof motivational sports water bottle with straw time marker flip top durable free non toxic frosted bottle perfect for office school gym and workout via,little of lifesproof
653,seeing my me moving motivational quote is just like earth but our and what they had done for us is like whole universe and beyond that,ha a bona hore na ho sisinya maikutlo a ka a susumetsang ho tšoana le lefatše feela empa re re etselitse sona le bokahohle ho feta bokahohle ka ho fetisisang eo
654,we rise by lifting what is something you are going to do for someone else this week,re tsoha ka ho phahamisa ntho eo u tla e etsa bakeng sa motho e mong bekeng ena
655,if you are not moving closer to what you want in or in life you probably t doing enough jack author via,haeba u sa tsamaee haufi le seo u se batlang kapa seo u se batlang kapa u se se etsa sengoli sa jack ka nako e lekaneng
656,_pr motivational yeah,_pro khale
657,happy another another fresh start anyone have any big for the week,ke thabile e 'ngoe e ncha ea ho qala mang kapa mang ea nang le kholo bakeng sa beke
658,happy motivational everyone this is a reminder that you can overcome any obstacle that this week may throw at you if you have the right,motlapa o monate bohle ke khopotso ea hore o ka hlola tšitiso efe kapa efe hore bekeng ena e ka u lahla haeba u na le tokelo
659,be mindful don t battle with your,itebeleng ha e loane le ea hau
660,continue on your path do not be afraid to make along the way but most importantly keep going,tsoela pele tseleng ea hau ha e tšabe ho e etsa tseleng empa ho lula u le ho feta
661,bought two new motivational to read this month,rekile khothatso e ncha e ncha ho bala khoeling ena
662,one secret motivational quote that me working hard and trying to improve every day that you can think about as a write without fear edit without mercy,quota ea lekunutu la hore ke sebetsa ka thata le ho leka ho ntlafatsa letsatsi le leng le le leng leo u ka nahanang ka lona le sa tšabe
663,motivational of via,khothatso ea ka
664,inspirational motivational for the budding defence industry,khothatso e khothatsang bakeng sa indasteri ea ts'ireletso ea buddeng
665,after a successful football event with pipe we are it to the absolutely love it of football related skill motivational and we film we want to work with are you interested to find out more,kamora ketsahalo e atlehileng ea bolo e nang le phala eo re e ratang ka botlalo
666,happy motivational have a wonderful week,motivativational o bile le beke e monate
667,i have seen many motivational in past but none of them really me now i find them waste of time you really do not want at times from the people who sound or are,ke bone maikutlo a mangata nakong e fetileng empa ha ho le ea 'nete ea' nete ke ba fumanang ka linako tse ling ho tsoa ho batho ba molumo kapa ba
668,follow me for more motivational,ntsetse ka ho ba le tšusumetso e eketsehileng
669,week learning team assignment company motivational profile paper,beke ea ho ithuta ho ithuta sehlopha sa company
670,the most motivational person alive,motho ea nang le tšusumetso ka ho fetisisa a phela
671,always the best motivational for us you help me remind myself that i am good enough,kamehla ba susumetsang ka ho fetisisa ho rona u nthusa ho nkhopotsa hore ke hantle
672,bitter disappointment with can coexist with hugely motivational and absolute terror at the prospect of authoritarian rule but apparently that is too much nuance for our political media,ho nyahama ho bohloko le ho ba moferefere o moholo le tšabo e felletseng tekong ea puso ea bobeli empa ho bonahala e le ntho e ngata haholo bakeng sa mecha ea rona ea lipolotiki
673,everyone what to be motivational speaker,motho e mong le e mong seo a ka bang sebui se susumetsang se susumetsang
674,start where you are use what you have do what you can,qala moo u sebelisang seo u se etsang seo u se etsang seo u ka se etsang
675,d motivational speaker welcome to my twitter twitter,d motlatsi oa stivational momoelli oa twitter ea twitter
676,motivational wake up kick butt repeat taking each day as it comes are the start of a new week a new day a new life don t let it pass you by,mothati o tsoma o rere o pheta hape ka letsatsi le leng le le leng ha e qala beke e ncha bophelo bo bocha
677,yeah that is why i never relate to motivational like failure is normal or people got their own timing because i never tried it is just my fault i have to accept it without comforting myself because i deserve it,ee ke ka lebaka leo ke sa kang ka amana le ho se khone ho se atlehe kapa ho ba le nako ea bona ke hore ke e amohele ntle le ho itšepa hobane ke e lokele
678,it is which it is time for motivational we want to help you contact us,ke nako ea hore na ke nako ea ho susumetsa le ho u thusa ho ikopanya le rona
679,why is training so difficult in the seal now surviving seal team veteran and host of surviving is here to tell you s are for motivation here on stream our most motivational every at,hobaneng ha koetliso e le thata hakana tiisong ea ho boloka sehlopha sa sefuba sa bohlokoa
680,good morning i see you are being motivational but i still don t want to go to work,lumela hoseng ke bona u ba khothatse empa ha ke sa batla ho ea mosebetsing
681,not motivational guru nor trading not but some good that you can recommend can see tall tower in ur office,se sa khothaletsoa guru kapa ho rekisa eseng empa tse ling tse ntle tseo u ka li khothalletsang li ka bona toro e telele ea ofisi ea ur
682,trading expert turned food critic now to conquer the motivational speech market here he is trying out with his friend,setsebi sa khoebo sa thekiso se ile sa hlokofatsoa hona joale ho hlola 'maraka o khothalletsang oa puo e khothatsang mona o leka le motsoalle oa hae
683,one good thing about music when it you you feel no pain the sung by saint ram based on reality of today is people is very motivational song and give a right message to society,"ntho e 'ngoe e ntle ka' mino ha o se na bohloko bo bitsitsoeng ke saint ram ho latela 'nete ea kajeno,' me ha batho ba na le molaetsa o nepahetseng sechabeng"
684,best motivational video,video e ntle ka ho fetisisa
685,this is not like a super motivational thing it is just how work,sena ha se tšoane le ntho e ikhethang e susumetsang ke hore na mosebetsi o joang
686,ability is what you re capable of doing motivation what you do attitude how well you do it,bokhoni ke seo u se khonang ho etsa lintho tse susumetsang hore na u etsa joang hore u li etse
687,i to drop one or two motivational but something me back,ke tlohella motho a le mong kapa e 'ngoe hape empa ho na le ntho e khutlang
688,make i use this motivational quote hold myself,etsa hore ke sebelise mantsoe ana a susumetsang
689,_oneus motivational king,_oneus setivarialid king
690,motivational wall with code,marako le khothatso le khoutu
691,motivational speaker it is all about mentality if you have the right mentality you will never feel hungry,sebui se khothatsang se mabapi le kelello haeba u na le kelello e nepahetseng eo u ke keng ua e hlatsoa
692,why you dey drop motivational for afternoon na morning we been need am fresh man sha,hobaneng ha o jarolla ho theola mokhoa oa thapama na hoseng ho na le monna ea mocha
693,motivational strive not to be a success but rather to be of value,motivarial loanela hore e se ke ea atleha empa ho e-na le ho ba ea bohlokoa
694,people underestimate the motivational power of hearing about tina is latest conquest who turned out to be her intern or that might have slept her way to the top but she is girl bossing like she it anyway like i will finish this project so i can stay up to date,batho ba nyenyefatsa matla a khothatsang a ho utloa ka tsietsi ea morao-rao ba ileng ba robala ka holimo empa o tla qeta morero ona hore ke tla lula letsatsi
695,a great motivational influential inspirational speaker a divine force,sebui se seholo se khothatsang se nang le tšusumetso e matlafatsang ea bomolimo e matla
696,you dey drop motivational quote we no see unit buy which light wan take see staircase,u qetela puseletso rona ha re bona ha re bona unt ya unto e fihletse le shofe
697,motivational speaker the growing scam and business of modern era,sebui se susumetsang scam le khoebo ea mehla ea kajeno
698,video conference with _deodhar our state secretary anna and all state thanks to both for given motivational guidance us to achieve our three _k,seboka sa video le cove anna anna le state state ka lebaka la bobeli bakeng sa bobeli bakeng sa sepheo sa ho fumana tse tharo _k
699,people on twitter suddenly become motivational when they see a random word see how people are depression to give motivational,batho ba twitter ka tšohanyetso ba fetoha.
700,featured art of the day yes you can motivational art buy it at,bonono ba letsatsi leo u ka bo sebelisang ho li reka
701,i am motivational breakfast i love god raising money with and healing broken tomorrow at am in join us,ke lijo tsa hoseng tsa ho khothatsana ke rata ho holisa chelete le ho folisa ho robehile hosane ho ea ho rona
702,motivational don finish if you wan give up just give up,boithatisi ha u qete haeba u batla ho inehela
703,happy from bully motivational magazine remember y all it s money making you can t have a phenomenal weekend with an explosive,"ke thabile ka limakasine tsa bo-bo-'muellity, hopola hore u ka etsa chelete eohle e etsang hore u ka ba le beke ea liketsahalo ka ho phatloha"
704,i only wake up to r b or motivational,ke tsoha feela ho r b kapa khothatso
705,moon day motivational mood,moon day day motivation maikutlo a khoeli
706,follow my link motivational please help me get follow ayaangaba_,latela sehokela sa ka se khothatsang ka kopo nthuse ho latela ayaangaba_
707,quote,quote
708,i m going to get some heat for this but i think weight loss surgery cosmetic surgery being used as a motivational before after are problematic how is it to take charge of their health if you went got surgery to to lose the weight,ke tla fumana mocheso bakeng sa sena empa ke nahana hore ho buuoa ka matla a ho putlama ho sebelisoa e le tšusumetso pele ho nako ho na le ho buuoa haeba u ka khona ho fokotsa boima ba 'mele
709,the urge to reply to motivational,takatso ea ho araba ka tšusumetso
710,my aunt sent me a motivational video on how to get over heartbreak from someone you were madly deeply in love with first of all who told her i was single,'mangoane oa ka o ile a nkamohela video e susumetsang mabapi le hore na u ka fumana bohloko bo tebileng ho motho eo u mo joetsang ka ho teba ho bohle ba mo boleletseng pele ke sa nyaloa
711,happy motivational knowledge will bring you the opportunity to make a difference,tsebo e monate e monate e tla u tlisetsa monyetla oa ho etsa phapang
712,motivational speech just full everywhere this be like this particular sapa dey do good job,puo e khothatsang e tletse hohle ho eona sena se tšoana le say dey a etsa mosebetsi o motle
713,people who accuse orthodoxy of being man centered have never to look at the log in their own eye of their own tradition the band on a stage and motivational charismatic speaker are of secular entertainment unsuccessfully by evangelicalism,batho ba qosang orthodoxy ea ho tsoaloa ha motho ba hatelletsoeng ho kena ka mahlakore a bona le sebui sa bona se tsamaeang le sethala le sa boitlamo bo sa atleheng ke moevangeli
714,i am at a stage i do not give to motivational they useless to me,ke sethaleng ha ke fane ka tšusumetso ha ba na thuso ho nna
