,src,trg
0,in a sports bar watching the football and six just stood up and in with the national anthem it very much like a hen party though than them out for the game,ka bareng ea lipapali ba shebelletse bolo ea maoto le ba tšeletseng feela ba ile ba ema 'me ba na le pina ea naha e joalo ka moketjana oa khoho
1,why it s time for the city to trade whit by,hobaneng ha nako ea toropo ho rekisa ka letsopa ka
2,veteran sports administrator resigned from his as the president of the association and the international hockey federation as well as the post of member of the international committee,motsamaisi oa lipapali tsa veteran sports o ile a iphumane a tsoa ho eena e le mopresidente oa mokhatlo le the international federation leckey le poso ea komiti ea machabeng
3,_blue_shoes so you don t think any male who they are should be in female do you think we deserve sex specific care sports,_blue_shoes kahoo ha u nahane hore e mong ea lokelang ho ba mosali eo u nahanang hore re tšoanela lipapali tse ikhethang tsa ho ba le tlhokomelo ea thobalano
4,check out our recent sports article about the mlb is steroid era,sheba sengoloa sa rona sa morato sa haufinyane se mabapi le mlb ke era ea steroid
5,deal portable neck fan speed neck cooler quality comfortable lightweight personal neck fan for and men modern design great cooling fan for travel outdoors and sports only off,sebetsa molala oa molala o nka o pholile o na le molala oa boleng bo holimo bakeng sa molala o motle oa ho fallela kantle ho naha le lipapali feela
6,auto shipped insured _connect _sell,auto e romelloa e inshorense _connect _sell
7,_gaveck it is definitely from the game you were in last night,_garck ke ho tsoa papaling eo u neng u le makhetheng bosiung bo fetileng
8,is ass same with politics sports i don t give my energy to people i don t like let alone write whole about em,aspos e ts'oana le li-ralipolotiki tsa lipolotiki ha ke hlahise matla a ka ho batho bao ke sa mo ratang hore ba se ke ba hlola ba ngola ka em
9,hello big and fox sports are you what s going on in right now tech is the th media market in the country,hello hello hello
10,_toffolo thought he was mate that s what sky sports said anyway,_toffolo o ile a nahana hore ke eena ea bitsoang s
11,_jam connect sa popularity sports the reason why no one would invest in these sports because they are not entertaining enough to generate income basketball of income internationally dont matter how much u support it if the public wont,п
12,_dawg _coverage wow people with can t play sports regardless high school sports are not even remotely relatable to professional and nice job all my simply because i have a cat in my picture,_dawg _dawg _caf syaw?
13,fan fight out at stadium during home run derby,fan o loants'a lebaleng la lipapali nakong ea lapeng ho matha
14,forward leaves to join city,ho ea pele makhasi ho ikopanya le toropo
15,__goomba yeah this year had some too i mean i always a sequel to fire emblem that place in the three world but i t think it would actually happen also i don t think anyone switch sports at this point of the switch s,"__poomba selemo sena le eona e ne e le ntho e 'ngoe le e' ngoe ke bolela hore ke lula ke le setšoantšo se seng le se seng, ke se ke sa nahana hore ho na le motho ea fang lipapali mothating oa s"
16,football to other sports is like male to female,bolo ea maoto ho lipapali tse ling e tšoana le e tona ho basali
17,leaf metal draft blue rainbow _connect _sell,leqheka la metal draft blue rainbow _connect _sell
18,sports sale with group amid watchdog order,lipapali tsa thekiso ea lipapali le sehlopha sa commuso
19,_sports everyone in the missing the fact that this post is being just for the pun,_spons e mong le e mong ka lebaka la hore poso ena e ntse e le bakeng sa pun
20,we have a few till we are back in the swing of we will be our summer sale coming to an end we have varsity for and we will be doing any sub varsity for,re na le tse 'maloa ho fihlela re khutla ho swing of re tla be re le thekiso ea rona ea lehlabula e tla fela re na le varsity ea
21,his cousin also saw in same he was his new dance for cock allegedly sterling drove up but for petrol fair k a week a with sports trim or not allegedly,motsoala oa hae le eena o bone ka mokhoa o ts'oanang eo e neng e le motjeko oa hae o mocha oa mokoko o tsoang pele ho pete e halikiloeng empa e le lerootho k ka beke
22,i am learning how to drive a sports car but you would not know much about that because you are a woman,ke ithuta ho khanna koloi ea lipapali empa o ne o ke ke oa tseba ho hongata ka seo hobane u mosali
23,it s not really a benefit though as all in higher taxed would be able to go over the cap it really just the field,"ha se hantle, ha e le hantle, ka ha feela sethaleng se phahameng se ne se tla khona ho feta bakeng sa cap. ke feela lebaleng feela"
24,_skottington ur a sports fan they are the worst sports city in the us no team won anything in forever,_skotton ur fan ea lipapali ke toropo e mpe ka ho fetisisa ea lipapali us ha ho na sehlopha sa amerika
25,if not then more likely to be in ea sports the season after,haeba ho se bonolo ho ba le ho ba lipapaling tsa nako ea selemo kamora
26,weight was something i never really thought about even when i was sports and even just eating one day it just in my head and i i am very much disgusting and ugly,"boima bo ne bo le ntho e 'ngoe eo ke neng ke qala ho nahana le eo ke neng ke le lipapali le ho ja feela ka letsatsi le le leng,' me ke manyala haholo ebile ke mobe haholo"
27,listening to him over the describe his love and passion for his city everyday life is bigger than sports like is thrown to the side when when other thrive from support on a lighter note be ready for a,ho mo mamela ka lebaka la ho hlalosa lerato la hae le ho feta bophelo ba hae ba letsatsi le letsatsi
28,_venom _ i doubt it but i expect to be an candidate again,_onem _ e belaela empa ke lebelletse ho ba mokhethoa hape
29,college sports are forever it s going to be the reason the top won t be in the in less than a decade is to become mid and d and d,lipale tsa koleche li tla ba ka ho sa feleng li tla ba lona lebaka la ho qetela
30,_sports my ultimate concern here is the alarming and growing impulse of people on both of our political spectrum to subject other people to criminal prosecution and possibly incarceration for saying that hurt or are otherwise politically disagreeable,_sport ho tšoenyeha ka ho fetisisa mona ke tšusumetso e tšosang ea batho ka bosholu ba rona ba lipolotiki ebile ba sa lumellane ka tsela e sa lumellaneng le lipolotiking
31,chrome platinum aqua wave _connect _sell,chorom platinamu aqua wave _connect _sell
32,_connect _sell follow,_connect _sell latela
33,judge administration from men to compete in s sports,tsamaiso ea moahloli e tsoang ho banna ho qothisana lehlokoa le sports
34,come work with us apply here,tloo u sebetse le rona re sebetsa mona
35,the other lesson should not invest themselves in millionaire sports most are athletic usually going to the highest bidder,thuto e 'ngoe ha ea lokela ho ipata ho milione ea milione haholo ke lipapali tse phahameng ka ho fetisisa
36,was included on the entry list for the on as was even though his refusal to be will bar him from entering the country,e ne e kenyellelitsoe lenaneng la ho kena bakeng sa joalo ka ha a hana ho ba mo sitisang hore a kene naheng
37,wrestling observer live is on the air review dynamite tonight flair more listen live and free sports audio live twitch video join us live video,"wrestver one o phela ka har'a li-air ""dynamite"""
38,i was very happy with the you gave when you were on for like with a young population sports play a significant role in peace health and development please we need you mamo,ke ne ke thabile haholo ha u ne u le mong ha u ne u ka ba joalo ka lipapali tse nyane tsa lipapali li bapala karolo ea bohlokoa ho khotsong ea khotso le nts'etsopele ka kopo.
39,sky sports man still want to make,sports sports e ntse e batla ho li etsa
40,i hope the boom in attention for football and honestly our female across all sports have been really off for a while now will open some more discourse about how women is sports and in general are and how it is high time to change it up,ke ts'epa hore boom e shebiloe ke bolo ea maoto le ka tieo
41,it is not just a football the sport here problem it is also sports except volleyball is not taken as seriously and it is weird and when people kind of refuse to acknowledge that part because you have to acknowledge it first before you address it,ha se papali feela ea papali mona e le lipapali ntle le lipapali tsa volleyball e sa nwa ka botebo mme e tlameha ho e amohela pele u e amohela pele u e amohela
42,yow i love people getting into the sport but yeah am i if you are being a creep or a misogynistic with self awareness to live life as a female fan the you see and put up with when it comes to the general sports culture here,yow ke rata batho ba kenang papaling empa ee ke ntse ke le mothating oa ho phela le ho tsebana le bona ka moetlo oa lipapali oa gene
43,usher is daughter sovereign a favorite song of his it is absolutely adorable,usher ke morali oa morali lebitso leo re mo ratang haholo oa hore ea rateha haholo
44,_sports by,_sports ka
45,our amazing sports coach was nominated by some year who said they to be just like him when they grew up his sessions are amazing and so much fun he is kind and the best role model to have,koetwana ea rona e hlollang ea lipapali e ile ea khethoa ke selemo se boletsoeng hore ba tšoane le eena ha ba hola lithuto tsa hae ha ba hlolla ebile ke mohlala o motlehali oo a lokelang ho ba mosa
46,_zwerling _hoodie low hanging fruit easy to say poverty franchise to one of the historically worst ran in sports that s the old tho back ant,_zarling _zangdie e tlase habonolo ho bua bofutsana ho e 'ngoe ea sebaka sa nalane ea nalane e ne e le lipapali tse sa tsoheng ka ho fetisisa
47,bowman chrome sapphire aqua refractor auto shipped insured _connect _sell,bowman chrome sapphire aqua restoractor auto shidped insured _connect _sell _sell _sell _sell _sell _sell
48,_sell _ there s a silver on at right now with days left,_sell _ ho na le silevera ka hona joale ka matsatsi a setseng
49,your tweet was in an article by sports,tweet ea hau e ne e le sengoloa sa lipapali
50,could cam have been a tremendous h back te for the or not what offensive they might have had,na cam e ka ba le ho ba mokhubu oa ho ba mocheng oa ho ba le eng kapa ho se na lintho tse khopisang tse ka bang le tsona
51,not even when i say that this is a waste of money mainly because why would you buy a sports game on switch that is not,esita le ha ke re ena ke tšenyo ea chelete hobane hobaneng ha u ka reka papali ea lipapali ho switch e sa fetoheng
52,_sell is that bronze optic still for sale,_sell ke hore bronze optitic e ntse e rekisoa
53,who saw this new flavor of powder coming thank and the a for this one,"ea boneng tatso ea tatso ena e ncha ea phofo e tlang, kea leboha"
54,from to social media to television sports an opportunity for debate or montana or or if the question who is the best closer in baseball history however there t any debate to be had mark,ho tloha mecheng ea litaba ea sechaba ho ea thelevisheneng lipapali monyetla oa ho ngangisana ka hare ho nalane ea baseball leha ho le joalo ha ho na le letšoao
55,i haven t slept in days i m furious with the in madden i absolutely destroy those at ea sports at,ke robala ka matsatsi ao ke mo ratang haholo ka madden
56,_davis your tweet was in an article by,_davis tweet tweet e ne e le sengoloa ka
57,check out this listing i just added to my closet true vintage  is flip up aviator sports w gradient smoke lens,sheba lenane lena ke ile ka eketsoa feela ka kobo ea 'nete ea vintage e flip up smoke smoil lense ea sisinya
58,sports news on free transfer,litaba tsa lipapali tse mabapi le phetiso ea mahala
59,commissioner phillips' uninspired vision at risk sports,khomishist phillips phillips 'e sa ratoang setšoantšong se behang lipapaling tse kotsing
60,it would be nice to see and good again in the sports that matter i still enjoy watching make that pass in the orange bowl leaving and their national title never old or the in stealing a title from,ho ka ba monate ho bona le ho feta lipapaling tseo ke nang le taba ke ntse ke thabela ho shebella ho tloha ka sekotlolo sa marang-rang se sa tsoheng kapa ho utsoa sehlooho se tsoang ho
61,national trio silver shipped insured _connect _sell,e romelloa ho silevera ea naha ea truo sileved insured _connect _sell
62,the news bay area news sports business entertainment and commentary,litaba tsa new area list rication boithabiso le litlhaloso
63,most side a bally sports southeast,boholo ba lipalesa tsa bally ka boroa-bochabela
64,it is even more to debate as though it is a matter of opinion is an establish part of human psychology and not really up for debate that is the bottom line debate screening age security and sports instead that is a problem,"ho sa tsotelleng le ho feta joalokaha eka ke taba ea hore na ho theha karolo ea kelello ea kelello ea batho ba mofuta ofe, 'me ha e hlile ha e tsoele pele."
65,in a matter of i have sports the new york post the michigan football program s dad but yeah it s a myth that t in ann arbor from day the lying is wild,ka taba ea hore na new york post lenaneo la bolo ea maoto la michigan
66,jordan lot en a print line please _connect _sell _rouler _,jordan lot ot mohala oa khatiso ka kopo _sell _sell_roureler _
67,most martial and or sports stuff,lintho tsa mapolanka kapa tsa lipapali
68,what i learned since being in i suck at sports gambling,seo ke ithutileng sona ho tloha ha ke le ka hare ho nka papali ea lipapali
69,schedule but not the focus beach sports center am court,rama empa eseng setsi sa lipapali tsa potlako sa li-am
70,the left hearing an opinion not in lock step with theirs i support coach not only the freedom to speak but also also what he said and this coming from an state fan michigan is outrage over pro life,ha ke leqeleng u utloa maikutlo a se nang meeli ea ho koata ke ts'ehetsa mokoetlisi eseng feela mokopu oa 'muso oa mmuso
71,_loyalson_ _sports big list though,_lyals_ _sport lethathamo le leholo la lenane
72,_sports i say that to say this any person could be under the voter intimidation statute whether they are in a polling place talking to a person face to face or sitting on a toilet into the void,_sports ke re motho o ka ba ka tlasa taelo ea batho ba phahameng hore ebe ba sebakeng sa ho chechisa kapa ba lutse ka ho ba le ntloaneng
73,i can still win the tour de to keep stage victory,ke ntse ke khona ho hapa leeto la ho boloka katleho
74,trade rumor and more,khoebo ea khoebo le eketsehileng
75,while i understand they are the big draw all it is is the on it why don t they go watch sky sports n watch over non stop,ha ke ntse ke utloisisa hore ba tla taka tsohle ho na le eona feela ke ho eona hore na ke eng ho eona hore na ke eng ha u e shebelle
76,needs to go the evil they done to do is enough i have a friend the guy is fuming he s at the show of total disrespect shown to by taboo in today,e hloka ho etsa bobe boo ba li entseng ho lekane hore ke na le motsoalle oa moshemane eo a e-na le ho se hloke ho bontšana le ho hloka tlhompho ka botlalo kajeno
77,its not a sustainable model because its sports washing you,ha se mohlala o tsitsitseng hobane lipapali tsa eona li u hlapanya
78,_connect _sell earl,_connect _sell earl
79,relegation t pivotal to entertainment plenty of sports don t have relegation and are entertaining,pategation t pivotal ho isa boithabisong bo bongata ba boithabiso ha li na ho phetoa 'me lia thabisa
80,apple with new live sports storage bug fix and more apple with safari and apple with bug and performance,apple e nang le live tsa lipapali tsa live tsa live tsa live tsa live tsa live tsa live
81,sports day all the had a fabulous time and did a fantastic job the year five were impressive too _are_cas,letsatsi la lipapali tsohle tse neng li na le nako e ntle 'me li ile tsa etsa mosebetsi o motle ka selemo tse hlano li ne li khahla haholo
82,your drama club or sports program needs money to stay active time for a stay organized on trend with cheap for get with our printable or go with a order form,club ea hau ea drama kapa lenaneo la lipapali le hloka chelete ea ho lula nako e mafolofolo bakeng sa ho lula le theko e tlase kapa ho tsamaea ka foromo ea odara
83,mi y will be this at el social sports and entertainment bar come on out and let the music take over,mi y e tla ba sena ho el
84,this sports journalist lost his sleep due to the gun situation in,setsi sena sa lipapali sa lipapali se ile sa lahleheloa ke boroko ba hae ka lebaka la boemo ba sethunya ho
85,the is not a sports was that a serious response,ha se lipapali e ne e le karabelo e tebileng
86,without _sps_sports and the grant i t have been able to participate in this summer with _pd and so thankful,ntle le _sps_sport
87,_sports twitter is wild through under the tag looking for and see a picture that i m pretty sure is from a game i in last night with a couple i follow on here for news,_sports twitter e hlaha ka tlasa tag e batla 'me ke bone setšoantšo seo ke leng sona bosiung bona le banyalani bao ke le latelang mona bakeng sa litaba
88,_ _rapaport for a decade been trying this for because he s a greedy piece of he finally found someone with enough cash to burn that to sports wash bad enough to pay up,_ _rapaport bakeng sa lilemo tse leshome tse neng li leka sena hobane sengoathoana sa toropo se fumane motho ea nang le chelete e lekaneng ho lefa
89,the day of the year was the perfect day deliver a first aid and fire safety awareness course with a great group at the lighthouse sports and social hub another fantastic local business that our support,letsatsi la selemo e ne e le letsatsi le phethahetseng fana ka thuto ea tlhokomeliso ea pele le sehlopha se seholo lipapaling tsa lebone le khoebo e 'ngoe ea sechaba e monate.
90,we are gearing up for sports day make sure you come in ready to have fun compete and work together come in your p e kit or in the of the country you are,re ikemiselitse ho etsa bonnete ba hore u ikemiselitse ho fumana tlholisano ea ho qothisana le ho sebetsa hammoho ho tla ho tla tla ka p e
91,but none of the top across sports do and they re some of the most successful,empa ha ho le e 'ngoe ea tse holimo ho lipapali li etsa' me li re tse ling tse atlehileng haholo
92,show me how to live by,mponts'e hore na u lokela ho phela joang
93,_sports you had the better baseball team funny i don t remember seeing you in the college world series,_sports u bile le sehlopha sa baseball se betere ha ke ho u hopola ho u bona litsing tsa koleche tsa lefats'e tsa koleche
94,stick to not writing about sports or politics please we don t respect your on either,"khomarela ho se ngole ka lipapali kapa lipolotiking ka kopo, ha re hloile"
95,_doctor honestly no should sit on the fence going forward do not say 'i have everywhere' dey,_doctor
96,and play in the worst arena is it does not help north biggest sports district a long with arena then two best star have for the better forever thank you,'me u bapalle setereke se mpe ka ho fetesisa ha se thuse setereke sa lipapali tse kholo ka ho fetisisa se nang le arena joale le linaleli tse peli tse ntle ka ho sa feleng kea leboha
97,_sports almost forgot jordan and the guard,_sporports hoo e ka bang e lebetse jordane le balebeli
98,sports day not sure who had the most fun,letsatsi la lipapali ha le na bonnete ba hore na ke mang ea monate haholo
99,this sports drought is really opening my to the of tennis,komello ena ea lipapali e qala ho bula ea manonyeletso
100,i do not find boston very mostly people who visit want to learn about the history of the us see a sports game especially the green monster at or go like the and the museum of science and i guess have good as well,"ha ke fumane batho ba boston batho ba neng ba etela bana ba tseba ka nalane ea us bona papali ea lipapali, 'me ke nahana hore e be e ntle haholo"
101,small hand towards by by stationary and sports to this small belonging from the thanks to for this requirement,letsoho le lenyenyane le le leng ke lateri le lipapali ho sena se nyane ho tloha ka lebaka la tlhoko ea sena
102,miss it cant wait to have a and have them in sports,ke hlolohetsoe ho ba le ho ba le ho ba le ba bang le ho ba le bona lipapaling
103,_edge _sports i bet you re a conservative anti guy and it s not reality it s happening all over the world i don t really care about hockey in backwards i just know life is pretty good in t o despite the ford t,_edge _spor
104,what a fantastic sports day we have had today everyone worked together in their family and each other during the a big well done to the yellow who won the overall family group,ke letsatsi la lipapali le monate ruri leo re kileng ra sebetsa le lona basebeletsi ba bona le e mong le e mong nakong ea 'mala o moholo ho feta sehlopha sa lelapa ka kakaretso
105,_sports reddish that the one i will offer,_sports e khubelu hore ke tla fana ka
106,you are barking up the wrong tree partner i think all of that along with football and team sports in general should be from the education system completely,u ntse u potoloha molekane ea fosahetseng ea sefate eo ke nahanang hore kaofela le lifoto tsa bolo ea maoto le lipapali tsa sehlopha ka kakaretso li lokela ho tsoa tsamaisong ea thuto ka botlalo
107,crazy deal don t miss out sports bra by on sale for shop now before we sell out,disfon don t for sports brag ka ho rekisa lebenkele joale pele re rekisa
108,_crosse if unlimited can consistently get on the can too also more because consistently times where they just do not put any sports on and play old for instead in the summer,_crosse haeba e sa lekanyetsoang e ka tsoelapele
109,_sports shut up last time i read the word i fell off my dinosaur,_sports e koala nako ea ho qetela ke bala lentsoe ke oetse dinosaur ea ka
110,apple new of and the verge,apole e ncha ea 'me ea verge
111,today we join ma past director of for the to discuss the distinct equality and facing professional sports the good boy network s pervasiveness and how to create more inclusive in the athletic arena,kajeno re kenella motsamaisi oa batho ba fetileng ba ho buisana ka tekano ea ho lekana le ho boloka lipapali tse ntle tsa bo-rakhoebo ba contice syvasiteness ea boyletic
112,what a sports day the have been fantastic today and should be immensely of their the overall house competition went down to the final were badger hart,ke letsatsi lefe la lipapali le kileng la ba le letsatsi la lipapali kajeno 'me le lokela ho ba tlholisano ea bona haholo ka tlung ea ntlo ka kakaretso e ile ea theohela ho hart
113,unless you are a sports person or doing fitness i would not recommend not working a you will get really lazy fat and you do not have the same energy as someone who up a h and is still in the club at h the next day,ntle leha u motho oa lipapali kapa u etsa boikoetliso
114,i would not believe nothing that account post to twitter,ke ne nke ke ka lumela ho se na letho la ak'haonte ea ak'haonte ho twitter
115,who s ready for another pro tune in to and sports network this weekend to see who the sixth round of automatic to the pro championship,ea se nang mosebetsi o mong oa li-toune e 'ngoe ho le tsa lipapali mafelo-tsoibila a beke ena ho bona hore na ke mang ea ka morao ho' nete ea profil
116,pete in the of a lean fit hazard may have only in recent days but the player himself sensed something was last march,pete ka har'a kotsi ea 'nete e ka ba teng matsatsing a morao tjena empa sebapali se ne se utloa ntho e' ngoe e ne e le ho qetela
117,watch we dare you not to cry watching this touching moment between pitcher and native and a young year old fan whose dream was to meet the nine time all star on behalf of his late grandfather,shebella re lokela ho lla ha u lle ho shebella motsotso ona o neng o le mocha oa eona o neng o tla kopana le nako ea selemo se secha bakeng sa ntate-moholo oa hae
118,this is my interview from today with,ena ke tlhahlobo ea ka ho tloha kajeno le
119,division in all of sports,karohano lipapaling tsohle
120,nil is college sports whether we like it or not need to adapt and overcome,nil ke lipapali tsa koleche hore na re e rata kapa re sa hloke ho feto-fetoha le ho feto-fetoha
121,hello your daily inspirational and motivational sports quote of the day is when you re riding only the race in which you re riding is important bill shoemaker,lumela mantsoe a hau a ho khothatsana a letsatsi
122,a quality car field at speedway the heat is status as one of the country is top late model,tšimo ea foromo ea boleng ba kopo e potlaka mocheso ke boemo bo le bong bo le bong ba naha ke mohlala oa morao-rao oa morao
123,_boxed mid you like the dude and i told you bub we can t speak sports you gave me some wild before and you watch hockey,"_bobote vide u rata ho etsa joalo, 'me ke u joetse bub re ka bua ka lipapali tseo u mphileng tsona pele u shebella hockey"
124,_sports was giving heavy min to he did not know what he,_sports e ne e fana ka 'mete ho ne ho sa tsebe hore na eena
125,the impact sponsor of justly s event on a panel with and who s at opal,motlatsi oa boemo ba ketsahalo ka toka ho panel le mang ea opal
126,just saw myself on sports again,ikhethe ka ho kena lipapaling hape
127,yeah but your argument t negate what smart said smart t say had go in every major sports draft this past season,ee empa khang ea hau e ne e se e-so notlele seo se boleloang se boleloang se boleloang se boleloang se boleloang joang se neng se e-ea lethathamong le leng le le leng la lipapali tsa lipapali tse kholo nakong e fetileng
128,_connect _sell _ _ who do you want left this today,_connect _sell _ _ o batla hore o siee ke mang kajeno
