,src,trg
424,thank you very much i just it i have never been so happy thank you for your support and farewell i hope to see viewless soon,ke leboha haholo ke hore na ha ke so ka ke thabela ho leboha ka tšehetso ea hau le ho fana ka tšepo ea ho bona ho se tsotelle ho se tsotelle
425,yes you are right derision born out of desperation that their candidate is to lose badly at least they could have given a decent and farewell,"ee, o hlahile ka mokhoa o hlakileng hore o hlolohetsoe haholo hoo ba amohelang mokhethoa ke ho lahleheloa ke hampe bonyane ba ka be ba ile ba fana ka sehlōhō le ho se be monate"
426,_astro _rees_mogg so long farewell and do not come back,_stro _rees_mogg e telele haholo ebile ha e khutle
427,we will wave but it is not an eternal farewell we will meet again,re tla tsoha empa ha se mokhoa oa ho sa feleng re tla kopana hape
428,i thought exactly same when my bid a noisy farewell to visiting at am this morning and woke me lovely couple am sure not intentionally inconsiderate just thoughtless,ke ne ke nahana hore o tšoana hantle ha papatso ea ka e lerata ea ho etela hoseng hona mme ke mo hlasimoloha haholo
429,employee farewell day,letsatsi la farewell day
430,you re initial comment on him not being able to sing is what i was to what do you care it s a farewell tour money grab so he can live in his rainbow paradise,u fana ka maikutlo a pele ho eena u se ke oa khona ho bina ke seo ke neng ke le ho sona ke eng seo u se tsotellang hore u se ke oa phela paradeiseng ea hae ea ho teba
431,chairman and vice president m while seeking of all of the house during the monsoon session beginning tomorrow sought a farewell gift in the form of a meaningful and productive session at the all party meeting today,"modulasetulo le mopresidente oa motlatsi oa motlatsi m ha o ntse o batla ntlo eohle nakong ea seboka sa monsoon ""kopanong ea mokete kajeno"
432,latest chairman and m farewell gift' at the all party meeting ahead of the monsoon session of parliament a meeting of floor at vice president m naidu is residence in,modulaho oa morao-rao oa molulasetulo o motle 'me u kopane le seboka sa mokete pele sebopo sa polokelo ea thepa ea mopresidente m naidu ke bolulo ho
433,we get to see play for our how lucky are we we know it s just a matter of time before we have to say farewell cause he is just brilliant enjoy the and family we will be cheering for you from,"re tla bona ho bapala ka lehlohonolo leo re le batlang hore ke taba ea nako pele re batla ho u thabisa haholo, re tla u thabisa haholo."
434,an amazing journey yet we say a good bye to our roster a lots of to these and may god shower them with all their we are to had them and will to give a farewell,"leeto le makatsang leha ho le joalo, re re ho se sebetse hantle ho bona ho bana le ho ba le ho ba roba ka bona, 'me re tla fana ka mokhoa oa bona ebile re tla ba le takatso e itseng"
435,saying is to painful but smiling before finally out is an easy way to say farewell,ho re ke ho utloisa bohloko empa ho bososela pele ho nako ea ho se be bonolo ho bua hantle
436,are real you know farewell and take care,ke tsa 'nete u tseba ho felloa ke tšepo' me u hlokomele
437,do not be dismayed by good a farewell is necessary before you can meet again and meeting again after or is certain for those who are,se ke oa nyahamisoa ke mokhoa o motle o hlokahala pele o ka kopana hape le ho kopana hape kamora moo kapa ho netefatsa ba
438,holding farewell party at grace and country estate this weekend seriously the folk at sky think he should attend a cobra meeting because the sun is out we had the sun out in from may to it,ho tšoara mokete oa hau oa ho tšoara
439,my first ever performance in front of a whole crowd had to do it for my queen had to do it in my home town this t just a funeral it was the biggest farewell,mosebetsi oa ka oa pele o le ka pele ho letšoele lohle le ile la tlameha ho e etsa bakeng sa mofumahali oa ka o ile a tlameha ho e etsa ka har'a toropo ea ka e ne e le mokhelo o moholohali.
440,farewell,farewell
441,farewell to face the sun era the most special and memorable era for me,farewell ea ho tobana le nako ea letsatsi e le nako e ikhethang le e sa lebaleheng bakeng sa ka
442,in her dry yes farewell,moqomong oa hae oa ho omella
443,farewell mother,'m'e oa farewell
444,here i was about to send you off with my usual farewell,mona ke ne ke le haufi le ho u romella ka mokhoa o tloaelehileng
445,farewell quick sketch to respect her memory,seretse sa hau se potlakileng ho hlompha mohopolo oa hae
446,en on your anniversary and good bye cute necromancer have fun in your new path and good luck you are truly an angel and a warrior farewell,st ho ea ka nyakallo ea hau le ho feta ha u natefeloa tseleng ea hau e ncha le mahlohonolo u le lengeloi
447,a farewell blonde hair post wait,post ea moriri o moputsoa oa moriri o emetse
448,following three days of fantastic maritime the tall bid farewell to its second port stop today in the city to an impressive parade of sail to thank them for a warm welcome,ho latela matsatsi a mararo a maritime e ntle haholo ea pad e molelele ho ea sebakeng sa eona sa bobeli sa sekepe ho ea ba lebohe ka mofuthu
449,farewell made under permission of,farewell e entsoeng tlasa tumello ea
450,was it a wedding or a farewell party or simply a party,e ne e le lenyalo kapa mokete oa bo-ntate kapa mokete feela
451,farewell see you soon,farewell o tla u bona haufinyane
452,_yates_maths no is he at boris is farewell party,_yates_maths no ekare boris ke mokete oa hau
453,hope the to succeed rogue each get their opinion of his 'farewell party' at and him truant from meeting,kea ts'epa hore o ile a atleha ho amohela maikutlo a bona ka mokete oa hae oa ho fana ka 'mokhoa oa hae oa ho bua
454,i wrote some about johnson is time as,ke ngotse tse ling tse mabapi le johnson ke nako joalo
455,farewell love,lerato la hau
456,farewell is coming _,farewell e tla ho tla _
457,came to to play his music on the piano,o ile a tla ho bapala 'mino oa hae piano
458,i know this old news but those who are angry about disneyland is going away i have been to farewell nights of main street electrical since it is not going anywhere,ke tseba litaba tsena tsa khale empa tse bohale ke tsamaea ka ho tloha ha ke ntse ke le masiu a mateaneng a seterateng ea seterateng ho feta ha e sa ea kae kapa kae
459,if not the student and dont like any teacher then should i to my farewell,haeba ho se na seithuti mme ha se na mosuoe efe kapa efe eo ke lokelang ho e fumana
460,shame on and farewell,shame on le ho farewell
461,i just to see in las for his final farewell,ke mpa ke le ho bona ho las bakeng sa pholiso ea hae ea ho qetela
462,and i say farewell to was not the best con for me but that is for outside of the hotel get home safe everyone and start your recovery phase,'me ke re ho tla ba le ho se kopane ka ho fetesisa
463,we will miss you banner multicolor good luck banner triangle banner party colorful good luck for retirement graduation going away farewell leaving party,re tla u hloloheloa haholo banner celticolor
464,t realize it was the farewell tour until an hour before they got on stage p funk l tho,e elelloe e bile leeto la boea ho fihlela hora pele ba fihla setulong sa po fun lo
465,same how many farewell he had what turned me off completely to him was his statement during an interview several ago i have so much money no i have more money than my grand grand can spend he never got another dime from me,"e tšoanang, o ne a e-na le polelo e kae ka botlalo ho eena e ne e le polelo ea hae nakong e fetileng ha ke na chelete e ngata ho nna"
466,at the moment the favorite track is but beware of which with the farewell of can reopen in for less than what the player and above all he does not play the but in any case pay attention also to the yellow and red team,ka nako eo pina eo e ratoang haholo e ka 'na ea e-ba le takatso e ka tlase ho seo sebapali sa sebapali sa sona se se keng sa bapala.
467,look away so that it will not be reflected laugh so that it will not already saying farewell to this place,sheba e le hore e se ke ea bonts'a litšeho e le hore e se ke ea bua ka mokhoa o sa reng letho
468,not my me when is my farewell she meant graduation bless her heart,eseng 'na ea ka ea ka ea ka e ne e bolela ka kopo ea hae ho tsoa pelong ea hae
469,_spexperts this is farewell for today then,_ssspelexperts sena se monate kajeno
470,heavy that are hard to go through as far as i understand as far as i remember now when i was doing and constantly up in my these were x deckerstar is farewell by the way i forgot to mention that this is only the first part,ho thata hore ho be thata ho feta moo ke hopolang ho fihlela joale ha ke ne ke etsa 'me ka linako tsohle ke ho etsa hore ke bue ka eona feela
471,it is one more dance and then farewell cheek to cheek in hell with a dead girl,ke motjeko o mong hape ebe o ratana le marama a marameng a lihele le ngoanana ea shoeleng
472,up til now how many times i have tried to tell you please take care of yourself then with tear i sadly say as i wave and wish you farewell,"ho fihlela joale ke lekile ho u joetsa ka kopo, ka kopo itlhokomele ka mokhoa o utloisang bohloko ka mokhoa o soabisang"
473,i regret that silence us after the were breathing us it me that this story without consolation or farewell or a word or one word i am afraid of that happen without a sign or a warning,ke masoabi hore ebe ke ile ka re khutsisa ka mor'a hore re re shoele ka hore na pale e se na tšebelisano kapa lentsoe le le leng ke tšaba hore na ho na le temoso kapa temoso
474,farewell to a lovely person dan who was s goal keeping coach to train the goal you have been so kind to me and everything you did for me while you was at i will miss you very much,farewell ho motho ea ratehang dan who o ne a ntse a boloka mokolokoti
475,_ a farewell kiss to a,_ a e aka
476,farewell united feat v,farewell ha u make floame
477,enter to win to see in las for his final farewell,kena ho hapa ho bona ho las bakeng sa hau ea ho qetela
478,so that is it after farewell and good luck i do not recall saying good luck,e le hore ke ka mor'a ho phela le mahlohonolo ha ke hopola hore ke se ke oa hopola lehlohonolo
479,me back to at cold of campus bidding gentle giant farewell,ke khutletse ho batang ea khamphaseng e kopantsoeng le giant e bonolo
480,i just to see in las for his final farewell,ke mpa ke le ho bona ho las bakeng sa pholiso ea hae ea ho qetela
481,the second half of farewell steadfast effort the rest to time,halofo ea bobeli ea boiteko bo matla ba ho phomola nako le nako
482,i just to see in las for his final farewell,ke mpa ke le ho bona ho las bakeng sa pholiso ea hae ea ho qetela
483,_arii _tw you don t care about being ignorant and simply wrong so farewell,_arii _tw u tsotella ho se tsebe ebile ha ho bonolo ho senyeha
484,_bryce need a farewell if you do,_bryce o hloka mokhoa oa hau haeba o etsa joalo
485,pity your open farewell could not be royal in,phokotso ea hau e bulehileng e ne e sa khone ho ba borena
486,_rees_mogg hi you will be glad to know that bully boy highly of you were you able to attend his farewell party everyone had a great time,_rees_mogg hi o tla thabela ho tseba hore bo-rakhotla ba bo-rakhotla ba hau bo botle ba hau ba ne ba khona ho ea moketjaneng oa hae o motle
487,first service with my new corps in in we meet outdoors in the city park a good place where heaven earth in god is kingdom on earth as in heaven third time i am a soldier in this corps as retired i do not expect farewell,tšebeletso ea pele le li-carps tsa ka tse ncha ho rona park e le lefatšeng ka nako ea bo-'mè
488,_sarthak and farewell,_starthak le mokhoa o motle
489,apparently the farewell to athletics tribute was area restricted so that is what the search was yesterday,ho bonahala eka o na le mokhoa oa ho rata lipapali tsa athles
490,live report th routine hi today is theme of routine is farewell party let is test your courage together for our fifteenth routine this time and this is the last routine see you on the next period club,live repperi long t starsion
491,please schedule a series or wi for a farewell series for and,ka kopo hlophisa letoto kapa wi bakeng sa letoto la ho fetisa le
492,enter to see in las for his final farewell,kena ho bona ho las bakeng sa hau ea ho qetela
493,for a little while i m bidding farewell to these idol like but please trust me when i say i will be back i definitely return to that place where i can be most like myself,bakeng sa nakoana ke sa bitse setšoantšo sena sa thollo joalo empa ke tla ntšepe ha ke re ke khutlele sebakeng seo ka ho fetisisa
494,on march ce dhu al ah in prophet the caravan of from the farewell pilgrimage and said he whose i am is his امیرالمومنین_فقط_حیدر e completion of,ka hlakubele ce dhu al ah ho mopo moprofeta crachlanti ea farewell panding 'me a re hello e ea etsoang ke
495,people you re back on what they don t know is yet another hiatus farewell post,batho bao u khutletseng seo ba se tsebang ke sebaka se seng se seng sa hithos farewell
496,farewell would be in great bottom of the list,farewell e ne e ka ba ka tlase haholo lenaneng
497,farewell see you in,farewell o tla u bona
498,a farewell to herd immunity as research that covid infected roughly half of the population the emergence of an even more contagious version of the virus some people may be in for another round,bo-raligina ea ho itšireletsa arm e le lipatlisiso tse nang le bo-'mōtoana ba palo e kholo ea mofuta o tšoaelitsoeng ke vaerase batho ba bang ba ka ba teng bakeng sa potoloho e 'ngoe
499,_schama it a party not me he said it was a farewell party maybe it s just a coincidence that he was going to have his wedding party there but then it to a farewell party following public and outcry,_schama
500,farewell to a legend the last blast,fana ka seretse ho seretse se seholo sa ho qetela
501,chairman vice president while seeking of all of the house during the beginning tomorrow sought a farewell gift in the form of a productive session at the all party meeting today to ani,mopresidente oa chairman vice ha a ntse a batla ntlo eohle nakong ea tšimolohong hosane e bakile mpho ea ho tsoaloa sebokeng se hlahisang kajeno ho ani
502,no gin wait the boss on killing you you t go back gin suddenly i know she i with him to sacrifice my life to spare yours that s the only way you can survive farewell gin dashed off stop gin wait,ha ho na mohiri oa ho u bolaea u tla khutla
503,someone needs to do the ken treatment with this letter and put it to farewell,motho e mong o hloka ho etsa kalafo ea en ka lengolo lena 'me u e etelletsi
504,based from but from my translator here said farewell my friend through my translator i guess thought it as farewell my best friend,ho ipapisitsoe le mofetoleli oa ka mona ho boletse motsoalle oa ka oa mofetoleli oa ka ke nahana hore e be motsoalle oa ka oa hlooho ea khomo
505,chairman vice president m while seeking of all of the house during the monsoon session beginning tomorrow sought a farewell gift in the form of a meaningful productive session at the all party meeting today,moqolotsi ba molulasetulo mopresidente m ha o ntse o batla ntlo eohle nakong ea seboka sa moenthekeng ho latela seboka se nang le moelelo kajeno
506,when your current life situation made you realize that the sports you love the most is not also for you it i don t know if the path i am walking on since is truly for me tonight i think it is farewell to my beloved,ha boemo ba hau ba bophelo ba hajoale boa etsa hore u hlokomele hore lipapali tseo u li ratang haholo
507,farewell sale valued at more than you access and for just,halo ea thekiso ea theko e boima ho feta eo u e fumanang le ea feela
508,the b s bid farewell,b s bid farewell
509,emotional farewell to s firm top leader watch,maikutlo a maikutlo a maikutlo ho st prit puseletso
510,i guess i have to bid a farewell to,ke nahana hore ke tlameha ho etsa hore ho be le mokhoa oa ho
511,he don t care about ur tiny club ur literally the club he s for why should he give like to do a farewell for la galaxy,ha a tsotelle ka sehlopha sa ur seretse sa ho ur ure
512,last farewell,farewell ea ho qetela
513,i know all the on i know he is young i know he stadium like a glove but he would absolutely empty the farm system and leave absolutely no room for any other trade plus a possible farewell to judge,kea tseba hore ke tseba hore o monyane ke thabile kea tseba hore o na le sebaka sa polasi mme a tloha ka mokhoa o hlakileng khoebong ea ho ahlola
514,farewell and that damn device the phone game was i am sick in the head with i am empty i have no soul,farewell le sesebelisoa se seholo sa fono se ne se kula hloohong ka ha ke na moea
515,music legend off the final leg of his north farewell tour night at philly is bank park and yes he felt the love that night as his long yellow brick road its journey to an end,'mino o thellela legend ea ho qetela ea tour ea hae ea north farewell
516,and that is how us five my lifetime brethren should be i really did love you all and that is not a lie however as sad as it is it is time for a brief oh of mine oh the beautiful days of my youth farewell until we meet again,ke kateng eo ka eona rona batho ba bahlano ba ka ratang ke lokela ho u rata kaofela 'me seo ha se leshano ka lebaka la nako ea khale.
517,yesterday my came and had a farewell party this morning when leaving target i see someone in a nation t shirt and,maobane ke ile ka ba le mokete oa bophelo hoseng ha o tlohela sepheo sa ho bona motho ea sebakeng sa naha ea naha le
518,i just to see in las for his final farewell,ke mpa ke le ho bona ho las bakeng sa pholiso ea hae ea ho qetela
519,farewell hope to see you again,fana ka tšepo ea ho u bona hape
520,farewell to chat at next to railway station fellow ex team other ex will be there from the star inn street all welcome,farewell ho qoqa ho haufi le seteishene sa setereke sa teilway ex se tla ba teng ho tloha star inn street
521,it is safe skies archer because this was the part of the farewell letter that give to his lover hiro who is that attend school in,ke masapo a bolokehileng hobane ena e ne e le karolo ea lengolo la mokhoa o fanang ka moratuoa oa hae hiro ke mang ea eang sekolong
522,farewell speech de th trend of,farewell puo de offer of
523,farewell arc,farewell arc
524,farewell i am going on a journey and leaving you behind but in order not to forget the we have made i shall carry on with this pain in my heart,farewell ke ea leetong 'me ke u tlohella ka morao empa e le hore re se ke ra lebala hore na re tla tsoela pele ka bohloko bona ka pelong ena
525,the sun finally come put of and wait oh no i think i am dying somebody call the yes i am definitely taking my last on this planet this is my last will and testament i leave all my worldly to and my farewell,letsatsi le chaba le chaba la ho ema
526,how do you even say i just disappear most of the time i don t know how to bid farewell the proper way,u ntse u re ke nyamela hakae ka nako eo ke sa tsebeng ho fana ka mokhoa o nepahetseng
527,_bi your school gave farewell,_bi bakeng sa sekolo sa hau se file
528,in my school farewell they gave us that were leftover from independence day,ke ile ka ubatsa sekolo seo ba re fileng sona se neng se le bolotsana letsatsing le ikemetseng
529,about how he on the hilltop farewell scene even though is holding something bug like to his face ai yah yah yah was it was it was it i am you super handsome,mabapi le hore na o joang pele a tšoere ntho e 'ngoe e mo tjeka ka sefahleho ai yah a ekare o ne a le motle haholo
530,farewell pilot,mokhanni oa farewell
531,made me famous and i can not thank this country enough told the audience at the final leg of his north farewell tour thank you for the loyalty the love the kindness you me,o ile a tseba hore ke tumme hape 'me ha ke khone ho leboha bamameli ka molao oa hae oa ho qetela oa leeto la hae la north from le mosabo le uena
532,farewell it is been a great and mixed journey for the both of you now i do not want to let go but i have to maybe ill nourish na the i learned and pinned to my mostly the most crucial for all my ill be making in the future,nako e monate e bile leeto le leholo le le lecha la bobeli ha ke batle ho tlohela nourish leha e le hore ke atlehe ka ho fetisisa nakong e tlang
533,farewell to my troupe the pregnant year,farewell ho troupe ea ka ea selemo sa moimana
534,emotional farewell to s firm top leader watch,maikutlo a maikutlo a maikutlo ho st prit puseletso
535,if today i promise i will sing farewell and post here,haeba kajeno ke ts'episa hore ke tla bina u rata 'me u romelle mona
536,this is farewell sherlock you idiot,sena ke sarewell sherlock u idiot
537,farewell brunch at region ale home of the,byunch brich ho lebaleng la lehae la
538,i give you your dream but i fear in time your heart will break as you realize it ever been a fool s hope farewell my friend,ke u fa toro ea hau empa ke tšaba ka mora pelo ea hau e tla senyeha ha u e fumana e le motsoalle oa ka
539,famous for doing something great i want to make a mark in this world before my farewell u,e tsebahalang ka ho etsa ntho e kholo e le hore ke batla ho etsa letšoao lefatšeng lena pele ke u rata
540,i just to see in las for his final farewell,ke mpa ke le ho bona ho las bakeng sa pholiso ea hae ea ho qetela
541,to you still beautiful even after death i say my farewell,ho uena u ntse u le motle leha lefu leo ​​ke le etsang hore ke tsebe
542,_ni farewell and adieu to you fare ladies,_ni farewell le adieu ho uena mafumahali oa hau
543,farewell game for both and,papali ea bohlokoa bakeng sa bobeli le
544,big news farewell hello simply we always been about sparking joy through creativity today we re taking a major step forward our mission and people together through even more creative,"litaba tse big thar where u lula re le thabo ea ho tsosa popo kajeno, re ntse re isa bohato bo boholo ba mosebetsi oa rona le batho ba kopane le ho feta"
545,'hosts farewell party instead of working on emergency','mathataba le mokete oa bophelo ho fapana le ho sebetsa maemong a tšohanyetso'
546,farewell game hopefully,papali ea farewell ka ts'epo
547,farewell and leaving the phone game was kyle kyle kyle please help me with the devil come,ho farewell le ho siea papali ea mohala e ne e le kyle kyle kyle will with
548,to a quiet farewell again yesterday how great of an album it is i also have take me to your leader on vinyl easy choice for me all other are great too,ho ea pele ho feta maobane ho na le albamo e ntle haholo ea albamo ea hau ho ba bang
549,finally our batch is getting farewell tomorrow,qetellong sehlopha sa rona se ntse se fumana bophelo bo monate hosane
550,just got a whale on i fear i have to bid you all farewell and go live my life in the ocean since apparently i m an aquatic mammalian species now,ke sa tsoa tšaba hore ke tšaba hore ke tlameha ho u romella
551,farewell to,farewell ho
552,i d also be interested to know whether the guest list of the farewell party is or identical with that of the wedding bash and whether the latter is not now taking place,ke boetse ke thahasella ho tseba hore na lenane la baeti ke kapa le tšoana le laba la lenyalo le hore na ea morao-rao ha a e-ba teng hona joale
553,'holding farewell party at chequers' as cobra meeting,'ho tšoere mokete oa bokhelohi ho checker' joalo ka seboka sa cobra
554,emotional farewell to s firm top leader watch,maikutlo a maikutlo a maikutlo ho st prit puseletso
555,emotional farewell to s firm top leader watch,maikutlo a maikutlo a maikutlo ho st prit puseletso
556,this month we say a sad farewell to our board secretary initially min in june as then secretary on the board of in thank you for all of your hard work we wish you all the best for the future,khoeling ena re re ke mongoli oa rona oa board ka latotlong ka latolong eo ka nako eo u e ratang ka ho fetisisa bakeng sa bokamoso
557,but you do not mind your hard on his farewell frolic at,empa ha o na taba ka thata ka bokhabane ba hae ba ho sotha
558,i just to see in las for his final farewell,ke mpa ke le ho bona ho las bakeng sa pholiso ea hae ea ho qetela
559,another teary photo showing how the of are suffering especially when they need to bid farewell to their or,litšoantšo tse ling tsa mofuta o mong o bonts'a kamoo li hlokometsoeng haholo ha li hloka ho ratoa haholo ho bona kapa
560,_txt farewell my archaic lord by impact video game via i also added it to my bookmark,_txt e tsamaellana le morena oa ka oa bongaka ka ho ba le papali ea video ka tsela ea video ka nako eo le eona ke e ekelelitse leknolokeng
561,he easily the big brown behind the circular opaque of the mask maybe like they were when they said farewell and departed from his bachelor pad that night maybe still affectionate and warm like the melted chocolate that d been on the other is,ha bonolo a sootho ka mora opaque ea maske a chitja mohlomong joalo ka ha ba ne ba re mo rata ebile ba futhumala joalo ka chokolete e qhibilihileng eo d e leng ho e 'ngoe
562,calling all we want to send you to for his final farewell concert enter here for your chance to win,ho letsetsa bohle re batla ho u romella bakeng sa konsarete ea hae ea ho qetela e kenang mona bakeng sa monyetla oa ho hapa
563,enter to see in las for his final farewell,kena ho bona ho las bakeng sa hau ea ho qetela
564,farewell god when we will see him on screen again host off,o tlohetse molimo ha re tla mo bona skrineng hape
565,enter to win to john is farewell yellow brick road tour,kena ho hapa john ke mokhoa o sa tloaelehang oa literene
566,now prelude farewell,hona joale o hloekile haholo
567,the met an ash brown haired mage in who is name was after spending a brief time together bid farewell she was still not ready to settle like her father,ba kopane le mohloa o moputsoa o ile oa soeufatsa hore na lebitso e ne e le joang ka mor'a ho sebelisa nakoana e le 'ngoe e kopaneng o ne a ntse a sa itokisetsa ho lula joaloka ntate oa hae
