,src,trg
568,_hq no the fact that remain is no longer an option is what you have to get used to there is a clear pattern here of me but of you failing to correspondingly concede what i point out about actual election farewell and enjoy when they arrive,_hq ha ho na taba ea hore ho se be le khetho ho na le khetho ea ho e sebelisa ho na le mokhoa o hlakileng oa hore o se ke oa supa.
569,so he lied again his wedding party to a farewell party for which we no doubt are paying well have your party and as it s a do bugger off now that you said your rest of you this should be be bloody ashamed,kahoo o ile a bua leshano hape mokete oa hae oa lechato oo ka oona re o belaelang hore o se ke oa etsa sohle se matleng a hao
570,recently confirmed her departure from,e sa tsoa tiisa ho tloha
571,she behind baba and as they left the palace singing a sad farewell,o sebetsa baba 'me ha ba tloha ntlong ea ntlo e bina boea bo soabisang
572,_txt that might be farewell my archaic lord by really good i recommend it,_txt e ka 'nang ea ba le morena oa ka oa khale ke ntho e ntle haholo
573,discovered the b s in high school have them ever since but i do not love them enough to pay for to their farewell show at the beacon,"ba fumane b s ka sekolong se phahameng ho tloha ka nako eohle, ke sa ba rate ka ho lekana ho lefella lenaneo la bona la ho lefella"
574,emotional farewell to s firm top leader watch,maikutlo a maikutlo a maikutlo ho st prit puseletso
575,i bid u farewell,ke kopa u tsamaee
576,emotional farewell to anc is firm top leader watch the deputy secretary general is laid to rest at cemetery as emotional remember her for her firmness,maikutlo a maikutlo a maikutlo a moetapele ke moetapele ea kaholimo oa mongoli oa mokhatlo oa molisa o baisitse a phomotse ka metsing ka lebaka la ho tiea ha maikutlo
577,farewell but i m going to miss them,farewell empa ke tla ba hloloheloa
578,we love you and i think its time we bid farewell to he done his part for cricket,rea u rata 'me ke nahana hore nako ea eona re e-na le mokhoa oa ho etsa hore a etse hore o etse karolo ea hae bakeng sa cricket
579,a farewell to,ho rata ho
580,we will miss you _wlos if you lauren is final farewell during morning is broadcast you can catch that and more great at the link here,re tla u hloloheloa _wlos haeba u lauren
581,you can peacefully now but leave out of this he bid farewell to the of you the malicious vermin who have relentlessly spread by saying he is a deep fake i have never such evil stupidity in my life before is back,"u ka tsoa khotsong, joale, o tla tsoa ho uena mapolanka a mabe a phatlalalitsoeng ka ho re o se ke oa ba le bohlasoa bo bobe hakana bophelong ba ka."
582,love u bam farewell,love u bam farewell
583,when bill i sang a farewell chant at his burial my is still going on strong and getting gifted,ha bill ke ne ke bina chante ea hae e le 'ngoe ea hae e ntse e tsoela pele le ho fumana chelete
584,saying my last farewell to the most lovable promotion ever _this_way must come to an end but the must live on forever just the way our album it should be in our memento box,ho bua ka mokhoa oa ho qetela oa ho patalla ka ho fetesisa ho feta ho qetela
585,farewell',farewell '
586,farewell dear please calm your from this day forth i am a wanderer once more,rarewall moratuoa ka kopo o khubetsa ho tloha ka letsatsi lena ke letsela le leng le le leng
587,the b s we never set out to change people s but it that way,b s ha ho mohla re kileng ra qala ho fetola batho s empa ea joalo
588,as they say farewell,ha ba ntse ba re bo-furwell
589,now rick farewell by the market world trade news,hona joale rick danewell ke lefatše la khoebo khoebong
590,school cried in farewell ceremony after  is,sekolo se omisitsoeng ka moetlo oa hau oa bophelo ka mor'a
591,nice article on sir elton is farewell tour,sengoloa se setle ho sir elton ke magewell tour
592,_merchant we are a farewell video today aswell,_mechant re na le video ea boea kajeno aswell
593,let s just call it a farewell party the plebs won t notice,e re se ke oa e bitsa mokete oa bo-ramoheli
594,and with that farewell,le ka mokhoa oo
595,if i score once on on the weekend i m calling off and a cookout for my farewell i will go overseas n hoop,haeba ke na le lintlha ka beke eo ke e bitsang ka ho tlola le ho cook bakeng sa mokhoa oa hau oa ho rata ho feta mose ho maoatle ke tla ea mose ho maoatle
596,farewell i am grateful for the innovation cultural exploration opportunity and look forward to taking action to ensure out have access to an educational travel experience,farewell ke leboha monyetla oa setso oa semelo mme o lebelletse ho nka bohato ho netefatsa hore ho na le boiphihlelo ba ho nka nako
597,farewell to god pa nota by on buy song,farewell ho molimo pata ha u reka pina ea ho reka
598,farewell ace park,park ea farewell ace
599,farewell kiss by,farewell aka ka
600,farewell youth,bacha ba macha
601,farewell my first friend my enemy,fana ka motsoalle oa ka oa pele sera sa ka
602,legal tender so many great that segment need to catch the farewell tour,molomo oa molao o moholo o moholo hore o na le karolo e kholo ea ho ts'oara par
603,_ i knew he was gone when he was circling the stadium blowing farewell to our at the alamo bowl it was pretty damn obvious trying to justify later is a joke t this,_ ke ne a tseba hore o ile a potoloha lebala la lipapali la lipapali leo le neng le le ntle le le letle le totobetseng le bona feela hamorao ke joke t sena
604,farewell see you again,farewell o tla u bona hape
605,underneath farewell it evil it is i and we want to be _,ka tlas'a kharebe e mobe ke mobe ke 'na' me re batla ho ba _
606,no farewell henny,ha ho na farewell henny
607,i feel like there to be a farewell tour they have been doing it for too long and have too many loyal to not have a farewell tour,ke utloa eka ho na le tokelo ea mofuta o moholo oo ba neng ba o etsa nako e telele haholo 'me ba bile ba ts'epahalang haholo ho se be le takatso ea ho ba le mokhoa o mongata
608,farewell henry,farewell henry
609,i just to see in las for his final farewell,ke mpa ke le ho bona ho las bakeng sa pholiso ea hae ea ho qetela
610,we bid farewell to a selfless faithful loyal member of the a leader who the people of sa with humility passion a straight talker that one would never second guess on any issue may her soul rest in peace,re tloaetse ho ba le setho se tšepahalang sa moetapele eo batho ba nang le boikokobetso ba nang le thuso e otlolohileng hoo moea oa hae o ka phomolang ka khotso
611,farewell always been the even u do not close with the person,farewell e ne e lula e le sieo le uena le motho eo
612,open mark farewell but does not think it is tiger is time 'he will be back',bula mareka ha e nahane hore ke tiger ke nako 'o tla khutla'
613,i am watching morning the story about the b s and crying as they talk about dying of,ke shebelletse hoseng pale e mabapi le b s le ho lla ha ba ntse ba bua ka ho shoa ha
614,the b s we never set out to change people is but it that way,b s ha ho mohla re kileng ra qala ho fetola batho hore na ho joalo ka tsela eo
615,said he look for a after the trade and i agree about the long run too the only way this would make sense is if a year league min gig at this stage of his career i could see wanting to do his farewell tour here and insulating w him,a re o batlana le khoebo mme ke lumela ka nako e telele le hore na ho na le motho ea ka bonang ka nako ena ea mosebetsi oa hae.
616,farewell,farewell
617,can not wait to do farewell,ha e khone ho emela ho etsa mekhoa
618,farewell,farewell
619,farewell the void is calling do not fear for and they are fleeting retreating it is i promise,"farewell ""vout ha e tšabe 'me li hohola li khutlela morao ke eona kea tšepisa"
620,disguised as a farewell leaving party,e pata e le mokete oa ho tlohela
621,is at the wedding farewell do of his friend at,e ka mokhoa oa lenyalo o etsa motsoalle oa hae ho
622,the video surrounding singh and crying inconsolably him not to leave saying mat sir watch here,video e ponahatsa sing mme o lla a sa tlohele ho re mose ho e shebelle mona
623,the b s we never set out to change people is but it that way,b s ha ho mohla re kileng ra qala ho fetola batho hore na ho joalo ka tsela eo
624,_saitomasatsugu thank you for this,_satitamasu kea leboha ka sena
625,on the train to sad but super happy with the whole visit last outing this morning and a lovely farewell lunch by alan s wife my heart is full,ka tereneng ho hlonama empa ho na le thabo e kholo ka ketelo eohle le lijo tse monate tsa lijo tsa mots'eare le tsa mots'eare o motle ka hore o na le mosali oa ka o tletse
626,if we could we should have left we could have left it is too late i i am too tired farewell,haeba re ka be re ile ra sala re ka be re tlohile hore ke morao haholo hore ebe ke khathetse haholo
627,what a good gesture of unity by our how i wish it could be real and for good jessie is farewell is symbol of unifier the devil the liar is not happy to see what we see in the pic good one,ke ketso e ntle ea bonngoe ka seo ke lakatsang hore se be sa nnete le sa jessie e ntle ke letswalo la leshano la leshano
628,me and my so are our farewell farewell is kind of sad event so i to play by swift and the conversation is like that me you can play swift is them we do not want to listen anything about,nna le nna ke ka 'na ke hore re ka bua ka ketsahalo e mpe kahoo ke bapala ka lebelo le moqoqo o ka bapala hape ka bona
629,he for us for was saying in his farewell how city turned him into a man then,o ne a re o ne a re ha a sa mo fetohela ho monna ka nako eo
630,dear work on myself not feeling the connection explore need to feel free this is not working yours i tried we just can not make it you are one strong lady wish you the very best farewell,mosebetsi oa ratehang o sa utloe hore khokahano e hlomphuoe e hloka ho lokoloha sena ke sa khone ho etsa hore u se ke ra u lakaletsa moputso o moholo haholo
631,but it s not really a farewell party is it it s their wedding party that was to be elsewhere but as usual we were lied to,empa ha ho hlile ha se mokete oa hau oa ho rata
632,_bells _agnes she could see the b s on the farewell tour but is they will be to us,_bell _agnes o ne a khona ho bona b ha a ka ba leetong la boea empa e tla ba ho rona
633,we were not there to raise the red flag in time farewell you,re ne re sa be teng ho phahamisa folakha e khubelu ka nako eo u e ratang
634,alas we have a farewell gift from you sir you try for this one,"alass re na le mpho e ntle ho uena e tsoang ho uena, u leka sena"
635,it is sad to see these go it is good to see people participate in the farewell tour it will forever be and live in our hearts it been a lovely ride and it brought back the end of an era of the coach will never roar again,"ho masoabi ho bona tsena ho hotle ho bona batho ba nka karolo ho ba rona, e bile ho palama ka tsela e ratehang e ke ke ea putlama hape"
636,love this photo an emotional day so far more to come as we continue to say farewell to,rata foto ena letsatsi la maikutlo ho feta kamoo re ntseng re tsoela pele ho re farewell ho
637,i m looking for it the omen of farewell in our conversation i still don t know all day all day all day all day,ke e batla e le 'ona ha ke le mothating oa puisano ha ke ntse ke tseba letsatsi lohle letsatsi lohle letsatsi lohle
638,johnson is farewell party is yet more evidence of his slippery he to hold the people of this country in complete contempt,johnson
639,and schneider talk about how their hobby music together exploded into a career and how the death of almost ended the b s for good,le schneder e bua ka hore na 'mino oa bona oa ho itlosa bolutu ke eng o phatloha mosebetsing le hore na lefu la ba le lilemo li ka le feela ka lona le letle
640,overdose suicide attempt on other side note my housemate was rushed to emergency this afternoon she overdose on her and wrote what like a farewell letter in her journal,ho feta tekano ea ho ipolaea ka lehlakoreng le leng oa ntlo ea ntlo ea ka ea ileng a potlakisoa ka tšohanyetso o ile a feta ho eena 'me a ngola hore na ke eng e tšoanang le koranta ea hae
641,player you said you have a dream that dream make it come true wonderful and give you the power to change the world if anyone can it is you player well then farewell,player eo u itseng u e-na le toro eo toro e e thabelang 'me u e fe matla a ho fetola lefatše haeba ho na le motho ea ka mo bapalang
642,his priority was answer phoenix try not to let me connive save farewell for when it could empty a good portion of the yard and wrath at least one creature i felt in every situation when if are posted i link you to his list if you d like,bohato ba hae bo ne bo le monate
643,i say farewell you continue to rant and think i am child behold a of you the last few days,ke re ho tla tsoela pele u ntse u tsoela pele ho rala le ho nahana hore ke bona hore ke bona ka matsatsi a 'maloa a ho qetela
644,turned to his dad and simply said 'farewell father' and returned to his seat to abide the decision of the trial the crown their against henry joy as later revealed by jemmy hope to mary ann over a distinguishing mark on henry is,"a batla ho ntate oa hae mme a re, 'feela ho re,' feela ho tsoa setsing sa hae sa henry"
645,oh stubborn and reckless hero you let me have a small taste of true friendship farewell,oh banyane le mohale ea se nang botsoa o ntuetse hore ke be le tatso e nyane ea setsoalle sa 'nete
646,masha and we were in the to bud farewell to the today may grant him the highest of heavens,masha re ne re le ka mokhoa oa ho buloa kajeno ho kajeno ha ho mo fe maholimo a phahameng ka ho fetisisa
647,unmasked at last farewell to all covid,e sa sebetsoa qetellong ea ho qetela ho tsohle tse ntle
648,love theme from ' a farewell to arms' via,letsahalong la lerato
649,_zola _press not one office she was she ever given a farewell more like a good riddance,_zola _press ha e le ofisi e le 'ngoe eo a kileng a fuoa mokhoa o motle joalo ka ho ba le moferefere o motle
650,k ming chang poetry short long fiction of a crocodile by farewell my concubine by li pi walker s the color purple poetry s poetry the f their between by larry,k masing chang potry nako e khuts'oanyane ea crocodile ka farewell
651,too over the top we hope so thanks to all the we this cycle looking forward to the next we bid farewell to and welcome our new inspiration for the next cycle too,haholo ka holimo re ts'epa hore ka lebaka la tsohle re lebelletse tse latelang tseo re li amohelang khothatso ea rona e ncha bakeng sa potoloho e latelang
652,farewell,farewell
653,to my father thank you to my mother farewell and to the,"ho ntate oa ka, ke leboha monna oa ka hore le e-na le"
654,sorry i am insane and farewell,ts'oarelo ke hlanya le ho rata
655,bidding a hurried farewell and in another moment we were off for york,ho thothomela ka potlako le ka nako e 'ngoe eo re neng re e tsoa ho york
656,bidding a hurried farewell and in another moment we were off for york,ho thothomela ka potlako le ka nako e 'ngoe eo re neng re e tsoa ho york
657,took down my page over k good people they about the testimony i would share there i m fighting what is as yet an unexplained decision no chance for farewell let know,o ile a busetsa leqephe la ka ho feta ka bopaki boo ke neng ke ba le bopaki boo ke bo arolelanang ke le qeto e sa hlalosoang ha ho na monyetla oa ho tsebisa
658,barcelona i will return to for proper farewell he will return to for a proper farewell after his move to barcelona was on,barcelona ke tla khutlela molemong o motle o tla khutlela molemong o motle ka mor'a ho fallela barcelona ho ne ho le ka
659,the good people of bid farewell to bad government and i hope we all stand tall in the presidential election,batho ba lokileng ba papatso ea bid ba rata 'muso o mobe' me ke ts'epa hore kaofela re eme hantle likhethong tsa mopresidente
660,never shall we meet again farewell,ha ho mohla re tla kopana hape
661,farewell match of,papali ea hau ea
662,p his farewell match for please support him today,p ha a bapisoa le ka kopo ea mo tšehetsa kajeno
663,sorry perhaps what i really need is neither of you farewell,masoabi mohlomong seo ke se hlokang haholo ha se sa hau
664,a ha ha farewell to those days when i wept my out,a ha batla matsatsi ao ha ke ne ke tla lla ka ntle
665,farewell o lovely bard and farewell o lovely dragon would that we had met in a different time and place to meet to song and dance together,farewell o love e ntle le ho fetisa drakone e ntle e ka ba teng ka nako e fapaneng le ho ea kopana le pina le ho tants'a
666,this contract extension video more heart than farewell,khohlano ena ea tlhahlobo ea konteraka e ngata ho feta ho farewell
667,leaving heaven darkness those nights farewell in too deep you gon' learn no premonition unaccommodating little engine lock it up marsh yah yah i will,"ho tloha leholimong lefifi lena, thepa eo e batla e tebile haholo hore ebe ha u na tataiso ea ente ea enjene e sa sebetseng ea enjene ea enjene e sa sebetseng"
668,love this jazzy video to our that have become good,rata video ena ea jazezy ho rona e se e le hantle
669,the non meaning of a man less than the sum of his via _news farewell then to a man who people climate science and reproductive but whose ultimate agenda was his own ego,moelelo oa monna ea ka tlase ho kakaretso ea hae ka nako ea hau ea via _news e le monna eo batho ba nang le boiphihlelo ba hae e leng ba bang
670,farewell are usually after someone,tloaelo e ka mor'a motho
671,_zuri i think that is for the farewell gift to there was a donation drive for him and i believe he for the extension of the cancer in,_zri
672,to my almost cap farewell to u my friend,ho hoo e batlang e batla e le motsoalle oa ka
673,a farewell with in,sets'oants'o se nang le
674,farewell song no'ng high school,pina ea farewell song n'ng school
675,may nothing get may nothing get infected like a clockwork orthodoxy greeting farewell,e kanna ea se ke ea fumana letho ha ho na letho le tšoaelitsoeng joaloka capkowing ea clockwork orthodoxy tumeliso ea litumeliso
676,physician biden is cognitive state 'not ethically wrong' the non meaning of a man less than the sum of his via _news,byien biden e sa lemohe 'ha e phoso' e se nang moelelo 'moelelo oa monna e ka tlase ho kakaretso ea hae ka _news
677,to want both ways he is as prime minister but does not want to do the job and he is holding farewell at surely farewell are when you have resigned,ho batla mekhoa eo a leng tona ka eona eo a leng tona ka eona empa ha a batle ho etsa mosebetsi mme o sa ts'oaretse ka ho phethola ka nako e joalo o tsoetse pele
678,saying farewell to father riley as he after more than thirty as parish priest for st paul is grove park in,ho re ha a rata ho tsoa ho ntate riley joalo ka tse mashome a mararo a metso e robeli hakae e le mashome a mararo a metso e mengata e le mashome a mararo a motso o mong oa paradi bakeng sa st paul ke grove park in
679,big fire on top of the hill a worthless gesture and last farewell from your mother from the of her soul look at your father see his blood run cold like the wind you are free just a whisper i hear you so talk to me plant,mollo o moholo ka holim'a leralla ka mokhoa o se nang thuso le ho qetela ho tsoa ho mme oa hae ho tsoa ho ntate oa hae ho hoeshetsa
680,it was a simple prayer from the start after all admiration gradually disappearing now as the curtain s raising up we leave this quiet meeting place and bid farewell,e ne e le thapelo e bonolo ho tloha qalong ka mor'a hore ho be le takatso eohle ea ho nyamela hona joale ha re siea sebaka sena sa liboka le ho mo fele
681,farewell to lovely city,farewell ho isa toropong e ntle
682,the political brunch,branch ea lipolotiki
683,man city did not recognize him as a legend he did not receive a farewell as they did to,monna oa monna ha a ka a mo tseba e le nalane eo a sa kang a e fumana ha ba ntse ba etsa
684,to party a lot while people struggle with cost of living,ho isa moketjaneng haholo ha batho ba ntse ba loana le litšenyehelo tsa ho phela
685,the political brunch,branch ea lipolotiki
686,which player got the best farewell in the history,ke sebapali sefe se nang le mokhoa o motle oa nalane historing
687,can not wait to bid farewell to this,ha e khone ho emela ho fana ka chelete ho sena
688,an ancient spell that can only be by in the cave of i leave the rest to you all to figure out for i am so far away all you need can be found in the cave i big you farewell as i have faith in you all long live,molomo oa khale o ka ba teng ka lehaheng feela leo ke tlamehang ho se fumana hore ke hole haholo le uena ke batla ho phela le uena nako eohle e telele
689,my old man is moving to a different and in a farewell tribute his boss sent an around how much he is dad is unique leave over the unlike a normal person dad will not just say sick personal here are just a few i,monna-moholo oa ka o ea ho a fapaneng le ka mokhoa o mongata oa mohiri oa hae o tsamaile hakae ka hore na ntate o ne a ke ke a re'ng ho motho ea tloaelehileng.
690,it can mean either 'farewell' or 'fuck well',"e ka bolela ho ""farewell"" kapa 'fuck hantle'"
691,farewell,farewell
692,farewell you will truly be last week was taken by team and all the way up to zoo where he is going to be truly spoilt and well after we can t wait to hear on how he s getting on,o tla ba le beke e tla ba teng bekeng e fetileng e nkuoe ke sehlopha le ka tsela eohle e tlamehang ho fihlela e sa sebelisoe hantle 'me ka mor'a hore re eme moo a ntseng a e utloa.
693,day of week at it was fun while it got to spend the last time with the green cast farewell for now i had an amazing time,letsatsi la beke ho e ne e le monate ha le tlameha ho qeta nako ea ho qetela le botala ba ho qetela
694,farewell brother,moena oa bonna
695,say that out of the country will not have data no it is worse it that teenage do not gain the to resolve complex conceptual be creative or have emotional intelligence,e re naheng eo e ke ke ea ba le data ha e na taba ea hore ngoana ha a fumane mocha oa ho rarolla bothata bo rarahaneng kapa a na le bohlale ba maikutlo
696,harness taken to social media to pen a farewell message to,ha ho beiloe mecha ea litaba ea sechaba ho ngola molaetsa oa boea ho
697,i just to see in las for his final farewell,ke mpa ke le ho bona ho las bakeng sa pholiso ea hae ea ho qetela
698,typically lazy irresponsible despite he stay on at no till a new is he promptly out does all except bitch and snipe and a farewell party for himself he does not and never given a flying f about this country,ka tloaelo e botsoa hampe leha a sa lule ho eona ho fihlela a le ncha.
699,we leave this quiet meeting place and bid farewell,re siea sebaka sena sa liboka se khutsitseng sa kopano mme ra ba
700,what a bunch of nasty people have in this country it was not a wedding party it was a farewell party for all people who have him throughout his time in office all and they he was not a cobra meeting because of weather,seotsoa se seholo se nang le sona naheng ena e ne e se mokha oa lenyalo e ne e le mokete oa lenyalo bakeng sa batho bohle ba e-na le mokete oa hae ka bomong ka lebaka la boemo ba leholimo
701,and with one more look we said to the squirrel with warm thanks to the ambulance farewell furry friend,mme ka sheba e le 'ngoe re ile ra re ho squirrel e nang le lebitso le mofuthu ho ea motsoalle oa ambulense
702,i want to ensure comrade as we bid farewell to her our first of community safety that we shall overcome crime,ke batla ho netefatsa
703,do not be dismayed by good a farewell is necessary before you can meet again and meeting again after or is certain for those who are,se ke oa nyahamisoa ke mokhoa o motle o hlokahala pele o ka kopana hape le ho kopana hape kamora moo kapa ho netefatsa ba
704,i think we should all his farewell party and hand him the directly,ke nahana hore re lokela ho etsa mokete oohle oa hae oa mofuta o mong le o mo fang ka kotloloho
705,a small clip from our folk is happening gig yesterday farewell to,sekhechana se seng se tsoang ho folk ea rona se etsahala maobane maobane maobane maobane
706,farewell dinner,lijo tsa mantsiboea tsa mosa
707,he then his luggage s handle and his phone before making his way to his room s door to go outside when he downstairs he his farewell to the two and smiling and nodding at their good luck,"eaba eena oa rokella, 'me mohala oa hae pele a ea ka kamoreng ea hae a le ka ntle ha a etsa hore a tsamaee ka mahlohonolo a bona"
708,rocket man take me to the pilot saved my life tonight bank park th farewell yellow brick road the final world tour final show,rocket monna o nkisa mokhanni oa ka oa ho pholosa bophelo ba ka bosiung ba sekolo sa bank park fit road brick road
709,in the th year ah before prophet away he upon to perform the with him as it will be his farewell according to over the with their prophet knowing it will be his last,selemong sa ah ah pele a moposa pele a moponatša le eena a tla ba le moprofeta oa bona ho latela moprofeta oa bona ho tla ba la ho qetela
710,wrapping up a plus year career with a farewell tour the pianist and vocalist some of the most memorable and enduring music in the history of pop rock,ho fofa mosebetsi oa selemo le selemo ka ho etela piano se fanang ka puo le mookameli e meng ea 'mino o sa lebaleheng le ea tšoarellang historing ea pop
711,do not be posting some hollow farewell when you are slipping out to mug,se ke oa romella ho se na thuso ha u thellisa ho tsoa mug
712,set for some prop and seek tomorrow with _sen _vy and _vt come join us as we all give our farewell to who is graduating by hunting her down waiting room,e etse hore re bue le ho batla hosane
713,ga took about to finally finish this anime if you are searching for comedy even it better cool guy doing cool wasnt cool for me last tho at least it was good farewell but didnt really save the show for me,ke ho nka nako ho qetela qetellong ea anime ena haeba u batla mohloaare hore o tsebe ho pholile haholo
