,src,trg
531,you re basically saying the prize money t what it should be when it s still high the just have so much that any prize money to theirs is going to reflect badly same with any sport that the have targeted for sports washing,u ntse u bua joalo ka chelete e tla ba teng ha e le hantle ha e phahame feela ka chelete e ngata ea ho hlatsoa lipapali
532,judge s guidance that in sports and bathroom access report,tataiso ea moahloli eo ka har'a buka ea lipapali tsa lipapali
533,_sell _ yours if you want to wait i also have this foil board two are ending within a day otherwise there are no,_sell _sell
534,yea the game is pretty fun i m addicted to sports so that s another reason,ee papali e monate haholo ke tlotsitsoe ha ke lemala lipapali e le 'ngoe
535,if you want to cover the state or be the sports editor in beach we have at the democrat times union and the news journal message me or go to s job site,haeba u batla ho koahela mmuso kapa e-ba mohlophisi oa lipapali
536,_donkey how does pay its what it does when its not even on the list of major sports,_dkeyy u lefa hore na e etsang seo e se etsang ha e se le lenane la lipapali tse kholo
537,_in_wi maybe sports i see the 'at' crying justice i follow people supporting people human no matter who you are or love or where your from and all that just regular decent people the is so crazy and mean we need to follow each other,_in_wi mohlomong lipapaling ke bona toka ea 'ho' hotsa toka eo ke e etsang le lerato la hau
538,south basketball star aliyah boston for not inviting her to espy,na basketball star star aliyah boston ea ho se memetse ho espy
539,can we go back to when stayed away from sports,a na re ka khutlela ha re lula hole le lipapali
540,we re to announce that anchor person and senior sports journalist as media,re ntse re phatlalatsa motho eo ea ankora motho eo ea phahameng le oa litaba tse phahameng tsa moqolotsi oa litaba
541,_sports they should do it then trade randle whatever to for contract b end of season,"_sports ba lokela ho e etsa ka nako eo, ho rekisa mondbe eng kapa eng ea ho qeta nako ea nako ea selemo"
542,a m s smith on pot,m s smith ka pitseng
543,say because of covid,e re ka lebaka la corvid
544,the sports i kept were strategic,lipapali tseo ke li bolokang e ne e le maano
545,they were by will who works as cranmer is research assistant through the h sports science institute as a graduate student fellow will put in so much work on the project that he made his way up to first author,ba ne ba tla etsa hore ba sebetse joalo ka cranamit
546,will always be or whether it s sports or history itself censorship t mean it won t be found,e tla lula e le hantle
547,people hate to add important context to when they talk about sports,batho ba hloile ho eketsa maemo a bohlokoa ho fihlela ba bua ka lipapali
548,_sports with of in with beer above we really can t have nice here,_sports e nang le biri ka holimo le rona re ka ba monate mona
549,rookie lot shipped _sell,rookie lota e romelletsoe _sell
550,just like in sports act like you been there before,joalo ka ha u le papaling ea lipapali joalo ka ha u bile teng pele
551,looking to join a sports anything out there,ho batla ho kenella lipapaling tsohle moo
552,i don t disagree just turned down almost half a billion no one in the is that especially considering the damage in both sports i m sure a fighter would love to be a player my argument always been about the product don t last forever,ha ke hanane feela ho theosa le halofo ea bilione ha ho na motho ea nahanang ho ba sebapali seo ke neng ke se etsa phehisano eo ka ho sa feleng
553,outside the us that is fine but never in the us no,"kantle ho rona e hantle, empa le ka mohla ha ho joalo ka us che"
554,_sports the place where the speech is is not an element of the crime under the statute,_sports moo puo e seng karolo ea botlokotsebe tlasa molao
555,total b s is sports washing with blood money the respect of the golf world bone and trump both are disgusting,kakaretso b ke lipapali tse hlatsoang ka chelete ea mali tlhompho e hlomphehang ea lesapo la lefatše la golf le trump ka bobeli li manyala
556,like he needs a safe space quick find the nearest pants belted above the navel dress code sports bar so he can be surrounded by other outdated so he does not get all of his hurt about a world that about,joalo ka ha a hloka sebaka se sireletsehileng sa ho khutlisa borikhoe bo haufi le koetliso ea moaparo oa mokhubu
557,_flies _eau talk about acting oppressed i will repeat as it are not they are so do not belong in women is or sports are not here to validate who want another identity are male do not supersede women is,_feau e bua ka ho etsa lintho ka mokhoa o haptjoang ke tla iphumanela hore na basali ke bo-mang hore ba etse boitsebahatso ba 'ngoe
558,sports club v sports club,sports club v sports club
559,moors sports club v cricket and athletic club,moors sports club v cricket le ea atlelete club
560,more on the new partnership with ea sports from _sandy,ho feta ho ts'ebelisano e ncha le sports ho tloha _sandy
561,_boston was one of several women is sports nominated for who were not to the ceremony said in a statement to that were limited due to both covid and a new venue with much less seating capacity than previous,_boston e ne e le e 'ngoe ea basali ba' maloa ke lipapali tse sa thathamisitsoeng moketeng oa ho ba teng ka lebaka la setulo se seng se le seng se le seng
562,sports club v police sports club,lipapali tsa lipapali tsa lipapali tsa lipapali tsa mapolesa
563,cricket club v sri air force sports club,cricket club v sri air force sports club
564,multinational corporation renew million contract with,mokhatlo oa basebetsi ba bangata ba nchafatsa konteraka ea limilione tse fetileng
565,what did you think of the,u ne u nahana'ng ka
566,_college michigan won one national title in the last the continued veneration of that tier program is one of the most confounding in sports media,_college michigan o hapile sehlooho se le seng sa naha ho ea ho qetela se boletsoeng ke lenaneo la tier.
567,blues should try for to to make perfect sense,blues e lokela ho leka ho etsa kelello e phethahetseng
568,now you can watch now and catch us every am or the replay at talking in and watch us talk click here to watch live now to see the great content to offer,joale o ka shebella hona joale mme o re ts'oarelle motho e mong le e mong
569,not guilty in felony domestic violence case in,ha ho na molato ka lebaka la pefo ea lapeng la felony.
570,and _facci spoke to point guard on their latest episode of they covered a bunch of with the budding star s pursuit of it would have been beneficial,le _facci o ile a bua le ho lebelana lethathamong la bona la morao la bona ba koahetse sehlopha sa struding naleli ea studing st e ka be e le molemo
571,i don t get all the trade on here it s like sports,ha ke fumane khoebo eohle e teng mona s like lipapali
572,former wide receiver dead at,banna ba mehleng ba ne ba shoele ho
573,baseball is not the only issue title would dictate additional women is sports be added according to it is also the funds for the perhaps women is sports that would have to be added but is smart why can not they figure it out,baseball ha se feela sehlooho feela se ka eketsang basali ba eketsehileng ke lipapali bakeng sa bona ke lipapali tseo ba ke keng ba li fumana
574,stay but not the name becomes becomes leaving j k behind,lula empa ha se lebitso e ba ho tloha j k kamora
575,poster in sports direct today girls'football no pink no typography,poster ho lipapali tsa lipapali kajeno ho feta banana ba banana haholo ha ho na chypography
576,cancel practice after six more test positive for covid,hlakola tloaelo ea ho hlahloba liteko tse ling tse tšeletseng bakeng sa covid
577,average gay sports fan,karolelano ea fay sports facebook
578,our ranger had a blast at camp getting ready to play school sports we can not wait,ranger ea rona e ile ea phatloha kampong e itokisetsa ho bapala lipapali tsa sekolo tseo re ke keng ra ema
579,yeah your right they have have a amount of base content to them it just like was like this will work for other sports nobody about or golf or switch sports,ee ka nepo ea hau e na le li-semelo sa motheo
580,what is even good for except sports,se setle le se setle ntle le lipapali
581,how barefoot mindfulness made an all star again,maikutlo a sarangot o ile a etsa linaleli tsohle hape
582,we still have one final week of camp it is at united wholesale mortgage sports complex register now at basketball,re ntse re e-na le beke e le 'ngoe ea kampo ea kampo eo e leng ho ramahane tsa lipapali tsa mehala ea united states
583,_sports pretty easy i just your question why t you mine,_sports e bonolo ha ke na taba ea hau feela
584,this is the sports writer who told the hall of fame committee just what he thought of them a few ago that tweet could compete with the late s tantrum,ena ke mongoli oa lipapali ea bolellang holo ea komiti ea fame seo a neng a se nahana ka bona ba 'maloa ka nako eo e neng e ka qothisana lehlokoa le tentrum ea morao
585,easier to get an ar than a driver is license bud you make an a out of yourself once a show stick to sports instead of the floatation device carrier infect your mind with,ho bonolo ho fumana ho feta mokhanni oa laesense ke oa laesense eo u ka e etsang hang ha ho na le lethathamo la lipapali ho fapana le kelello ea hau
586,_sell _connect shipped,_sell _connect e romelletsoe
587,_carrabis no one had more division they are in the mix every single year you hate the best franchise in all of sports must be tough,- _carbaris ha ho na motho ea neng a e-na le karolo e ngata selemo se seng le se seng se le seng le se seng se le seng le se seng u hloile li-franchise tse ntle ka ho fetisisa lipapaling tsohle li tlameha ho ba thata
588,talent t mean in sports everyone that it s about building a team that and with heart and disciple i could give a if you re better if you don t play,talenta
589,x introduce a cross sport collaboration that in every moment of celebration sports and culture together it s time to claim your with the x basketball get it here,x kenya tšebelisano ea lipapali ea cross eo ka nako e 'ngoe le e' ngoe ea lipapali le setso sa ho tsoa hammoho
590,sports five in none the via,lipapali tse hlano ho e 'ngoe ea via
591,despite well financial barcelona somehow were able to sign striker from on blinded by sports _collin and i react to this more premier league and more,le hoja ho ne ho na le barcelona ka tsela e itseng barcelona ka tsela e itseng ba ile ba khona ho saena motho ea hlomphoang ke lipapali tsa lipapali tsa premier le tse ling
592,is about the only school in that position and both are facing or a successful program thanks to uncle but cut down to a total of varsity sports cal,"e mabapi le sekolo feela mme ka bobeli ba shebile kapa lenaneo le atlehileng la ho leboha, empa le fokotsa ho fihlela kakaretso ea papali ea vaarsity cal"
593,_connect _sell prestige travis rookie card day football the top for both plus shipping,_connect _connect _sell fortige travis rookie card room
594,_doctor if they can turn a peaceful protest into a massacre tell me to what length would not they get to bunch of,- haeba li ka fetola boipelaetso ba khotso ka bongata hore ke 'na hore ke be bolelele ba
595,my sports leader me,moeti oa ka oa lipapali
596,at the all star break _cubs _sports,sebakeng sohle sa linaleli _ _burts _sports
597,there so much not being about the end of that lobo game what s the point of a beat writer that t ask a joke already do you think michigan st a beat reporter that went to michigan college sports are about it s crazy,ha ho na ho ba ngata haholo ho ba le papali ea lobo what
598,fleer e x shipped _connect _sell,fleer e x e romelloa _connect _sell
599,as here are all of the from our sports night thanks to bent grandparent of school for providing these once again a very enjoyable and special evening,joalo ka tsena tsohle li tsoa ho tsa lipapali tsa rona tsa lipapali tsa lipapali tsa boithabiso kea leboha ho ba ntate-moholo oa sekolo bakeng sa mantsiboea a monate haholo
600,heading to a sports bar in to watch,ho ea sebakeng sa lipapali ho shebella
601,it is remarkable how much power the activist community to scare so many people into silence about what is clearly an infringement upon women is in sports,ho hlokolosi hore na sechaba sa anti ea sebuti se joang hore se tšose batho ba bangata hore ba khutse ka hore na ho hlakile hore ke eng e le lipapaling
602,_sports when we mock trump we do not do it at a polling place feel like that is major distinction,_sports ha re soma
603,the falcon right next to the station love the asparagus up falcon not the one next to the station and one of my in the flag a proper boozer with pool darts jukebox and sports bit of stroll well hidden away but best pub in,falcon le haufi le seteishene sa lerato le se seng sa faltaragus ho fihlela e haufi le seteisheneng le lipapali tsa matangoana.
604,my s high school now you to choose a hybrid health science course and also anyone who in sports or which band equestrian team credit so thankfully she only had real x week for freshman yr is done,sekolo se phahameng joale u tla khetha thupelo ea saense ea healbrid le mang kapa mang ea lipapaling ea sehlopha sa polokelo ea maoto
605,senior wide receiver beni to play football at state as part of the cyclones' recruiting class sports,moeli o phahameng o phathahana haholo ho bapala bolo ea maoto a mmuso a le karolo ea lipapali tsa cyclones the cyclones
606,i can understand the bally sports mention they play a bunch of but that also likely i have no life if i need to watch every game,ke utloisisa lipapali tsa bally ho bolela hore ba bapala sehlopha sa empa seo mohlomong ha ke na bophelo haeba ke hloka ho shebella papali e ngoe le e ngoe
607,the only two sports i m good at,lipapali tse peli feela tseo ke li ratang
608,shame that none of the picked this up there is always interest in in so sad that none of premier sports or took it,lihlong tsa hore ha ho na ea khethollang sena ho ba teng kamehla ho khahlisang hoo ho seng ea lipapali tsa pele kapa ho e nka
609,thank you i take solid,kea leboha kea leboha
610,_paris _sports i run be,_paris _sports ke mathela
611,far from the worst far far from it,hole le tse mpe haholo ho eona
612,baby baby by sports,lesea la lesea ke lipapali
613,_sports_cards not everyone family alive to do that,_sports_cards ha se lelapa le lulang le phela ho etsa joalo
614,_sports i wish i could make broad without knowing anything too,_sports ke lakatsa eka nka ba ea pharalletseng ntle le ho tseba eng kapa eng
615,clip dump recognize greatness round fun ass series _sports,clip dump
616,thank you for my column on sports dot,kea leboha ka kholomo ea ka ho lipapali tsa lipapali
617,i m not for gay down our nor am i for men in s sports or s and i m a but what you say t make sense if you are born stuck to your brother or without your arms or mentally retarded are you saying you are it,ha ke se ke ha u nyenyefatsa
618,_luchador your little do not represent the total number of watching sports that number is decreasing rapidly,_luchador e nyane ha e emetse palo eohle ea ho shebella lipapali tseo palo e fokotsehileng ka potlako
619,_guru and you re trading a lot of the you need to actually trade as well,_guru 'me u rekisa haholo-holo eo u hlokang ho e hlophisa hape
620,i have not done sports in forever in my imagination it is something like get starter team your way to a better team you can earn but forever meanwhile there is at least some sort of play between the i e not unity,ha ke so etse lipapali ka ho sa feleng monahanong oa ka ke ho hong ho kang ho qala ho kena sehlopheng se betere ho feta mofuta o mong oa papali
621,i have like i said it is hard it skill not athleticism you can perform at a high level in your s at golf it does not happen in other sports,ke joalo ka ha ke boletse hore ho be thata hore ho be le tsebo ea mashano ao u ka etsang ka nako e telele u ka etsa papaling e 'ngoe ea kolofo ha ho etsahale lipapaling tse ling
622,how are you all spending your no sports day,u ntse u sebelisa letsatsi la hau la lipapali joang
623,young,e monyane
624,my first voice over work for television sports commentary here we come,lentsoe la ka la pele bakeng sa mosebetsi bakeng sa phaello ea lipapali tsa thelevishene mona re tla
625,_ervin i am not suggesting that i am cool with it because i am not i am just saying that it is not like sports are hurting for cash and demanding a cut if sold would not reflect well on them either,п
626,durant clear vision rookie revision green jersey pop shipped _connect _sell,durant polelo e hlakileng rookie revision green jeersey pop e romelletsoe _connect _sell
627,lovely bit of media ecology in the this week place space voice mobility piece it all,bonyane bo monate ba tikoloho ea media spapment bekeng ena ho beha leqephe la ho mo beha sebaka se lebisang ho eona kaofela
628,sports bettor marketing list of gambling,lipapali tsa lipapali tsa lipapali tsa lipapali tsa lipapali tsa papali ea chelete
629,a profound word it does not only apply to the professional sports community it also to the music community and hanger ons with an increasing level of urgency,lentswe le tebileng ha le sebellelletsa sechaba sa lipapali le sona sa setsebi le sehlekehleke sa setsebi le boemo ba hae ba setsebi ka mokhoa o ntseng o eketseha oa ho potlaka
630,_ her age and sex does not matter what is the fact that she is much smaller and lighter than him theres a reason they separate combat sports by weight him beating is like your year old male cousin you and you as a grown man beat the out of him,_ lilemo tsa hae eena
631,this guy was one of boston is most powerful and well known sports radio for i to him every day growing up he eventually got fired forced to resign because he about politics more than sports again he was a sports host not a political host,monna enoa e ne e le e mong oa boston ke seea-le-moea se matla sa lipapali bakeng sa hae letsatsi le leng le le leng ho ne ho e-na le motho ea rekisang lipapali
632,this is what s tough about sports you come to grow and love then like to be cute and tear everything down no loyalty to the or the this current ownership and president it s and are all enough is enough already,sena ke se thata mabapi le lipapali tseo u li tšosang le tsa lerato ka nako eo u ka li thabela le tsohle tse se nang thuso ho ba teng
633,_collie sure it is no coincidence that apart from a relatively small sponsorship with the ice hockey team all his sports seem to involve money being sent outside the us,_collie le bonnete ba hore ha ho na mokhoa oa ho ikamahanya le motšehare o monyane le sehlopha sa hockey sa ice hockey se bonahala se ntse se romeloa kantle ho us
634,new from chronicle is better than ever no on leading sports,e ncha ho tloha ho chronicle e hantle ho feta ha ho na lipapali tse etellang pele
635,hockey canada over fund to settle sexual misconduct,hockey canada ka letlole la ho boloka boitšoaro bo bobe ba thobalano
636,_sports it s been too long but at least i can admit it now you can answer my,_sports e na le nako e telele haholo empa bonyane ke khona ho e amohela joale o ka araba
637,it is the time of year where get ready for fall sports and that comes with the risk of heat related illness,ke nako ea selemo moo u itokiselitseng lipapali tsa ho oa le ho tla ka kotsi ea bokuli bo amanang le mocheso
638,if we re being honest he t even belong in that photo in the first place the only team that he s ever for is sports agency which is the only team that he s ever been loyal to other than to himself,haeba re ntse re tšepahala a le teng
639,_ horrible thank god u are not a sports anchor,"_ horrib rea leboha, ha o ankora ea lipapali"
640,in store ticket raffle store sports address w broadway unit b ca united shoe available slide onyx,seteishene sa litekete raffle store laebral aterese ea b b b broadway unit b ca ca c blae clide onyx
641,really an opportunity today to put on a show for the listener this was like a reunion for a bunch of i would have sports super boring this station is for us not for you more like o,na ehlile ke monyetla oa kajeno ho beha lenaneong la momameli ho ne ho tšoana le kopano ea sehlopha sa ka ho boloka lipapali joalo ka rona
642,gymnastics needs to be more on the big like the comment section of the all sports culture post gymnastics as the sport to be good at is filled with saying gym is not a sport,gymnastics e hloka ho ba kholo haholo joalo ka karolo ea maikutlo ea libapali tsa lipapali tsa lipapali tsa lipapali tsa lipapali ha se papali ea boikoetliso
643,attention whore,tlhokomelo ea tlhokomelo
644,outlast the enchantment in,ho kenyelletsa enchanente ho
645,on with,ho
646,_connect _sell wish i did baseball don t really know who that is,_connect _sell
647,_doctor the one that covered,_doctor e koahetsoeng
648,watch with about being a woman in sports media catch 'bernie in the morning' am full video coming soon to,shebella le ka ho ba mosali ea media oa media o tšoasa 'bernie ka video e felletseng e fihla haufinyane
649,just posted a photo entertainment sports arena,kenya feela setšoantšo sa boithabiso tsa boithabiso tsa boithabiso
650,now sport inspired by harry potter series will be 'quad ball' to distance itself from author over her via,hona joale papali e bululetsoeng ke harry poster e tla ba 'bohali ba li-quad' ho tloha hole le mongoli ka
651,blue dazzle pop shipped _connect _sell,blue dazzle pop shipped _connect _sell
652,watch rise exclusively on the religion of sports channel,shebella tsoha feela ka tumelo ea selemo sa lipapali
653,_sports love the guy but,_sports e rata monna empa
654,live from to discuss the update what is happening on the third day of the event and more,phela ho bua ka tlhaiso-leseling e etsahalang ka letsatsi la boraro la ketsahalo le tse ling
655,ben is another way to bring in a little more plot i m not saying he should get a redemption arc he t but sometimes horrible are and it s not like is defenseless against him we saw what at sports day i d love to see a scene,ben ke tsela e 'ngoe ea ho tlisa morero o mong hape o sa re o lokela ho fumana topollo ea arc he empa a sa rate ho bona hore na ke eng
656,_ i was the biggest spectator at school went all away sports football cricket netball track field always at stadium on the last day of met all the now famous i had fun no need put on outfit or compete,_ ke ne ke se mokhelo ka ho fetisisa sekolong se tsamaileng lebala la lipapali tsa bolo ea maoto tsa nestball sa netball
657,ultimately rooted in fear ultimately rooted in grotesque inequality but i get your point toxic competitiveness never been a fan of sports,qetellong ke ile ka tšoha qetellong ea ho se lekane ka ho se lekane empa ke fumana taba ea hau ea tlholisano e sa lefelloeng
658,baseball catcher selected by in draft,baseball letsopa baseball tse khethiloeng ke rakhelohi
659,away from page because na either keep politics out of sports blah blah or ni ym fan or some,hole le leqephe hobane na mohlomong na mohlomong na lipolotiki li tsoa lipapaling tsa lipapali tsa blah blah kapa ni ym fan kapa tse ling
660,'bent over backwards' to audition for wicked movie role that went to,'khutlile ka morao' ho hlahloba mosebetsi o khopo o eang
661,playbook sports,lipapali tsa papali ea papali
662,flair getting involved backstage during his last match,flair e kenya letsoho ka morao nakong ea papali ea hae ea ho qetela
663,former red closer out over the network is new on the captain,e ne e le bofubelu bo botle bo haufi le marang-rang li le ncha ho motsamaisi
664,no live sports t helping,ha ho na lipapali tsa lipapali tse ka u thusang
665,rank on beta_sports_nfts,boemong ba beta_sports_nfts
666,woof worst sports day of the year,woofo very selemo sa selemo sa selemo
667,any replay of a game from this year still not sports,ntho efe kapa efe ea papali e tsoang selemong sena e se na lipapali
668,smith certified rookie fresh pop shipped _connect _sell,smith certid room rookie pop pup e romelloang _connect _sell
669,i d love to land and if the have the best package you probably have to do it however there would be nothing wrong with bell and and keeping your farm in tact does need to improve the offense anyway you look at it,ke rata ho lula fatše le haeba ho na le sephutheloana se setle ka ho fetisisa sa ho se etsa leha ho se na phoso ka tšepe le ho boloka polasi eo u e shebang
670,_angel_ yes it will not stop them from being used so what is the point of passing the law my whole family and s of other family s compete in gun every week the ar semi auto pistol shotgun are equipment we use for sports we also hog hunt with the ar,_angel_ ho se ke oa ba thibela ho sebelisoa e le thepa ea ka ea sehlopha sa a hemi ar
671,_doctor this is a slap to community,_doctor ena ke ho otla sechaba
672,_connect _sell is yours,_connect _sell ke ea hau
673,_elton _locc _kratos_rage_ _ _zee most male soccer are outstanding in they respective then get for national tho they d us at the but they pull more to watch the if were in they sports in of ticket money t be an,_elton _kelocc _kratos_ _ _ _zee beer
674,fair argument i did not consider the speech element of it i should have probably added a tag to that but you are not wrong,ho ngangisana hantle ha ke nahane ka ntho ea sehlooho ea eona nka be ke ile ka eketsa tag ho seo empa ha u phoso
675,tech men is sports recap via,men ea mahlale ke lipapali tse recap ka
676,_sports i m missing the problem i do most of those if left up to me,_sports ke lahleheloa ke bothata boo ke bo etsang boholo ba bona haeba ho na le
677,yes i find this thing so funny with sports people wing allegiance is more meaningful,"ho joalo, ke fumana ntho ena e qabolang e qabolang ka lipapali tsa batho ba nang le lipapali ba na le morero haholoanyane"
