,src,trg
0,our democracy is deliberative and pluralistic it must allow every reason to be subject to argument and every decision to be amenable or persuasive the door of democracy does not have one key,demokrasi ea rona ea demokrasi e lokela ho lumella lebaka le leng le le leng mabapi le ngangisano le qeto e 'ngoe le e' ngoe ea ho tseba hore na ke senotlolo se le seng
1,and i softly can be quite the persuasive lady as i am told,'me ka bonolo ka ba mofumahali ea susumetsang joalo ka ha ke bolelloa
2,well they are not the so that is pretty persuasive,hantle ha ba joalo hore e susumetsang hantle
3,pradesh is took a leading part in india is freedom struggle his forceful persuasive writing great patriotic fervor among the to join the nation is freedom struggle,pradesh o nkile karolo e etellang pele india ke tokoloho ea hae e loantšana le ho ngola ho ngolla motho e moholo ho feta ba ho khetha sechaba ho loana le sechaba.
4,what should an essay be many people would say persuasive that is what a lot of us were taught should be but i think we can aim for something more ambitious that an essay should be useful,moelelo e lokela ho re batho ba bangata ba ka re re lokela ho ba teng empa ke nahana hore re ka ikemisetsa ho tseba hore na moqoqo o lokela ho ba molemo
5,history politics argumentative paper summative writing homework art creative writing persuasive speech poetry evaluation social notion sonnet annotation monologue narrative,nalane lipolotiki tsa tlhatlhobo ea lipolotiki tse ngangisano ea patlisiso ea airter show
6,whether they would buy your product or not your will not throw away a huge sum of money just like that you need to prepare a solid copy to include all the above and it should be persuasive,hore na ba ka reka sehlahisoa sa hau kapa ha se na ho lahla chelete e ngata joalo ka hore o hloka ho lokisa kopi e tiileng ho kenyelletsa tse ntle tse kaholimo mme e lokela ho susumetsa
7,i find the diagnosis the least persuasive of the two but she at least the criteria and on top of that but no not solely there is more than enough video evidence that her wanting to be the center of attention you could even argue that her,ke fumana hore bokuli bo susumetsa hanyane ho tse peli empa o na le litekanyetso le ka holim'a bona empa o sa batle ho phela ka har'a bona
8,is known as one of the foremost capable and persuasive in a modern and high class grandson and granddaughter of don ten diverse people five diverse all rotating around family,e tsejoa e le e 'ngoe ea tse qaqileng le tse susumetsang ho sejoale-joale se seng sa sejoale-joale le sepalapapele sa bona se fapaneng le batho ba leshome kaofela ba potolohang lelapa
9,s persuasive,ho susumetsa
10,research that when we appear receptive to listening to and respecting opposing they find our to be more persuasive indeed mutual respect is often the result of dual way,patlisiso eo ha re bonahala re lelekisa ho mamela le ho hlompha ha re batla ho susumetsa haholo ka lebaka la tlhompho e menjeko
11,to claim that t seem ultimately persuasive,ho batla hore ho bonahala e le tšusumetso e matla
12,your argument is fairly persuasive for those of us former yet listening to the leadership it is clear that their are far removed from your aspiration so i am likely to remain politically homeless until there is an upheaval,khang ea hau e susumetsa ka nepo hore re kile ra mamela boeta-pele ho hlakile hore ba ne ba e-na le takatso ea hau ea lipolotiki ho fihlela ho e-na le thuto
13,fancy a change come and join our energetic team as development manager if you are persuasive and a dab hand at research and writing we need you close on,falcysing teang e tla le botsoalle ba bang ba sebelisang e le motsoalle oa motso o mong ha u lebella le ho fihlela dab ha u u lokelang
14,right now it is not about level bull market although days at these level would be persuasive days not price everything is green right now and its normal high elasticity this morning is stocks oil gold all up,hona joale ha se 'maraka oa poho ea poho le kajeno
15,drew wrong the not making up a report because they did not see any evidence of you do not have to believe every bit of evidence at face value but you as an authority should know that it should still be considered evidence even if you decide it is not persuasive,draw fore ha a thetse tlaleho hobane ha a bona bopaki bo bong le bo bong ba ho tseba hore le haeba o nka qeto susumetsa
16,are you looking to make your legal writing engaging informative but most of all convincing check out our on how to make your legal writing even more persuasive,na u batla ho sebelisa mongolo oa hau oa molao oa molao empa boholo ba litaba bo khokhothehileng ho bona hore na ho ngolisoa ka molao joang
17,will you convince to join the fight for join tonight is workshop at on persuasive about pay to ensure the voice of nursing is loud and clear all welcome,o tla kholisa hore o tla kenella ho ea le ho kenella bosiung bona ke sebono se mabapi le tefo ho netefatsa hore lentsoe la booki le se ke la amohela
18,we are searching for of persuasive writing this morning _ashton,re batla mongolo o susumetsang hoseng hona! _ashton
19,the budget at once its author is absolute mastery over and the persuasive force of his expository gift,moralo o seng o le sieo ha sebui sa eona se ka holim'a le matla a susumetsang a mpho ea hae ea ho pepeseha
20,we must be very persuasive on these supporting,re tlameha ho susumetsa haholo ho ts'ehetsa tsena
21,but we now have hindsight i could just about stomach the on disclosure i fundamentally disagree but i can see how persuasive they would have been if you t have a grasp of just how bad re litigation is particularly in a,empa joale re se re na le tšitiso ea kame feela
22,it is a fertile ground for me to therefore i am most certain use persuasive that this is the course i would want to enter,ke sebaka se nonneng bakeng sa ka ke hore ke na le tšusumetso e itseng haholo hore ena ke thupelo eo nka batlang ho e kenya
23,well now you are only fifteen you look good i will take you under my wing somebody should they have persuasive ways you will believe what they say it is just a question of time and it is running out for you it will not be long until you will do exactly what they want u to,"joale u se u le lilemo li leshome le metso e mehlano feela u shebahala hantle ke tla u isa ho motho ea amanang le eona, 'me u u qetetse ka tsela e nepahetseng etsa hantle seo ba se batlang"
24,well persuasive argument,khang e susumetsang hantle
25,persuasive but political do raise domestic energy and can encourage domestic oil production _matters price cap on oil would be futile west should opt for tariff instead russia,ho susumetsa empa lipolotiki tsa lipolotiki li phahamisa matla a ho lema li-last _matters _matters _matters ho ka ba tsa bokamoso bo lokela ho khetha tefo ho tloha russia
26,fabulous interview this man is speech was impressive and persuasive trump is the only man who can save this country,puisano le monna enoa ke puo ena ke puo e tsotehang le ea trump e susumetsang ke eona feela motho ea ka bolokang naha ena
27,helen is eye taking pleasure in speech one must honor with the good that if persuasive discourse was able,helen oa nka mahlo
28,we have to thank for his persuasive in convincing the beast to channel his antisocial in a more positive direction,re tlameha ho leboha ka tšusumetso ea hae ea ho kholisa sebata ho hlahisa mohopolo oa hae oa katleho ka tataiso e ntle haholoanyane
29,everyone aggressive salespeople but it is not because they are persuasive it is because they are not persuasive enough so how can one become persuasive,"motho e mong le e mong ea mabifi, empa ha a bolele hore o tiisetse hobane a ka fetoha joang"
30,that will make you more persuasive than of open this thread,seo se tla u susumetsa haholoanyane ho feta ho bula thapo ena
31,making a career out of building persuasive,ho etsa mosebetsi o tsoang ho moaho o susumetsang
32,this is a persuasive argument,ena ke phehisano e susumetsang
33,they have been profoundly affected by the media mass psychosis i the am a grad school strategic specialist worked with top spin spotted the persuasive campaign a mile off could have written the plan myself,ba anngoe haholo ke kelello ea media hore e setsebi sa thuto ea grad ea glod e sebelitse le letšoele la ho qetela le ne le ka ngola leano le susumetsang
34,i know how go but you know the are not binding but persuasive what are these people doing since one month to stop it is my question,ke tseba ho joang empa o tseba hore ha o tlama empa o susumetsa batho bao ho tloha khoeling e le 'ngoe ho emisa ke potso ea ka
35,so please do more homework for foreign media it will be more persuasive to figure out all ethnic in china and recreate,"ka hona, ka kopo etsa mosebetsi oa sekolo sa marang-rang bakeng sa mecha ea litaba ho tla ba le tšusumetso e matla ho fumana morabe oohle oa china le ho imahanya"
36,was not able to cater for the past two days due to net all is fixed na architecture art appreciation movie book review essay analysis speech reflection paper persuasive narrative slogan client,e ne e sa khone ho hlokomela nako e fetileng matsatsi a mabeli a fetileng ka lebaka la net whis e tsitsitseng
37,comfort and security and persuasive risk and the fear of the unknown are potent the real fear is your time for a job that you miserable and a majority stake in your attention,matšeliso le polokeho le polokeho le tšireletseho e susumetsang le tšabo ea tse sa tsejoeng ke nako ea sebele ke nako ea hau ea hore u be le mosebetsi oo u o ratang le o moholo oa tlhokomelo ea hau
38,_rowntree _co is being very persuasive one of those,_centree _co e ntse e susumetsa e mong oa ba
39,the household budget analogy for public is as rhetorically persuasive as it is macro economically illiterate any politician it is either woefully ignorant or willfully deceptive,lithuto tsa morao-rao tsa lichelete tsa lelapa bakeng sa sechaba li tšoana le ka mokhoa o susumetsang ka thata joalo ka ha li sa tsebe ho bala ha mang kapa mang ea sa tsebeng letho kapa o thetsa ka boomo
40,i bought for i bought for start different drug also once my ens just them and keep to my collection unless i get persuasive,ke rekile ke rekile bakeng sa ho qala hape lithethefatsi tse fapaneng hape e le 'ngoe feela ke le tsona' me ke tsamaise pokellong ea ka ntle le hore ke atlehe
41,i want a competition on best factual comedic persuasive jingle of police or tram singing dancing the message,ke batla tlholisano mabapi le 'nete ea' nete ea 'nete ea mapolesa kapa ho bina ho tantša molaetsa
42,for a via _schools,bakeng sa _schools
43,to help you skyrocket your game be persuasive less jargon less use call to action friendly be transparent use attention headline be specific have these at the back of your mind while writing,ho u thusa ho etsa papali ea hau ea ho sebelisa chelete e nyane ea ho sebelisa ketso e ntle ea tšebeliso ea sehlooho se hlakileng
44,fun that led a very persuasive terror campaign against the before which them for and the war of independence,boithati bo ileng ba lebisa letšolo la tšabo khahlanong le hore na ba ea pele hakae le ntoa ea boitalo
45,hysteria is not persuasive i did an analysis of four can and found no homicide decrease following passage major gun control over a century gun go down other go up you ever into before and after homicide,hys
46,opposite at am pst opposite mental intensity mind passive aggressive argument persuasive speech craftiness strategy paranoia,khahlano le ke na le kelello e fapaneng ea kelello kelello e makatsang ea kelello e nyonyehang ea kelello e susumetsang puo ea maqheka
47,might have been more persuasive without the 'ffs' unless of course that was irony,mohlomong o ne a susumetsa haholoanyane ntle le 'ffs' ntle le hore e be e boreleli
48,well that definitely very persuasive think i need this to finish before i could even contemplate such a hot session,"hantle, ho hlakile hore ho nahana hore ke hloka sena ho qeta ke qala ho nahana ka seboka se chesang joalo"
49,_holly_fox_ you raise a persuasive argument holly counterpoint,_hholly_fx_ u phahamisa mabaka a susumetsang holyinpoint
50,at him for long with a look he hoped would be persuasive enough upon realizing would not change his mind what a stubborn man he decided to use a different method,ha nako e ntse e ea ka setšoantšo seo se ne se ka tiiseha ka ho lekaneng hore se se ke sa fetola maikutlo a hae hore na ke motho ea manganga joang
51,his brother admired for his hunting and especially as a charismatic orator with eloquence and persuasive power rose rapidly among his tribe as a and arrogant warrior and chief,mor'abo rōna o ile a khahloa ke ho tsoma le ho tsoma ka potlako le matla a susumetsang ka potlako le mohale oa hae oa boikhathollo le hlooho ea hae ea boikhohomoso
52,hall of not by persuasive it s _,holo ea eseng ka ho e susumetsa s _
53,your profession is morally neutral what you do within that profession can be beneficial or harmful but when your character and your it is those not the profession itself that have persuasive weight,mosebetsi oa hau o sa nke lehlakore ka boitšoaro bo botle seo u se etsang ka hare ho mosebetsi oo o ka ba molemo kapa o le kotsi empa ha semelo sa hau le bona e le se nang le bokhoni bo susumetsang
54,speak softly and carry a big stick claim to have the ability to work with yet he s not persuasive enough to deal with and,bua ka bonolo 'me u tsamaise boipolelo bo boholo ho ba le bokhoni ba ho sebetsa le ho feta ha a kholoe ho lekana le
55,_tv do you think state media is a reliable and persuasive source,_tv u nahana hore mecha ea litaba ea ho bolela ke mohloli o tšepahalang le o susumetsang
56,neither of those are persuasive the obvious remains,ha ho le ea mong oa ba susumetsang batšeliana e totobetseng
57,_donnelly valid argument very persuasive thought provoking and full of fact u must do this professionally,_ of_le _donel ka mokhoa o nepahetseng mohopolo o susumetsang maikutlo le 'nete o tlameha ho etsa sena ka botsebi
58,persuasive via,susumetsa ka via
59,another tweet by fang fang s lover that had absolutely no thought or persuasive argument you would think he would do better,tweet e 'ngoe ka fang fang fang fang fang fang fang fang
60,are not exclusive to one sex in some produce both are even more messy and cool assertion really persuasive especially following the display of your biological ignorance,ha ba ikhethile ka thobalano e le 'ngoe ho tse ling
61,and i think that if there is an ideal good faith who s just mislead by their local church in their isolated small southern town then hearing people who have persuasive that support us they would use their desire for community building for our cause instead,"'me ke nahana hore haeba ho na le tumelo e ntle e ntle ea khelohileng kereke ea bona, toropong ea bona e nyane e tiileng e tla re thusa hore ba sebelise morero oa bona oa sechaba bakeng sa lebaka la rona."
62,tank for persuasive manner most often people have got to insist that _,tanka bakeng sa mekhoa e susumetsang hangata batho ba tlameha ho tsitlella hore _
63,i never thought i see the day i m drinking almond milk these ladies are mad persuasive,ha ke so nahane ke bona letsatsi leo ke noang lebese la lammond la basali bana ba hlanyetsang
64,me of my naive youth admittedly a long time ago when it was widely assumed that men to be persuasive to talk into sex,ke na le mocha oa ka oa mocha ke 'na nako e telele khale ha e ne e nahana hore banna ba susumetsa ho bua ka thobalano
65,open nursing position paper critique paper poster brochure essay writing reflection paper movie review book review persuasive essay,bula motho ea busang muponisisa cities ea pampiri ea pampiri ea sehlooho
66,i still can not really understand who the audience for this stuff is is it meant to be persuasive is it to propaganda higher is toxic nationalism the actual goal i can not tell,ke ntse ke sa utloisise hore na ha bamameli ba etsa lintho tsena ke bo susumetsang hore na ke bo-ralitaba ke bofetoheli
67,the bigger challenge and one that inexplicably been of the urgency it been tackling complacency if nothing else it must be a priority for national cabinet to urgently tackle the need for creative and persuasive community health on social,phephetso e kholo le e 'ngoe e neng e se e le boima ba ho se potlake ha ho na letho leo e tlamehang ho ba le ho qetela bakeng sa bophelo bo botle ba sechaba
68,you are definitely going to come out on top in a particular situation but this you being more persuasive more passive and less orthodox people or will definitely keep trying you but so long as you keep your cool there will be no,"ka sebele o tla tsoa ka holimo maemong a itseng empa o ntse o tsoela pele le batho ba orthodox ba fetang le ho feta, kapa ka sebele o tla lula a u leka empa o lula o le teng"
69,hyper aware of her mouth would take the digit out eventually hesitatingly you re very persuasive he under his breath willing enough to be patient for her and take in the moment then his neck enough for her to settle in,hyper e hlokometseng molomong oa hae o ne o tla etsa hore u be le mamello haholo hore o ka mo mamela 'me oa nka mokuli ka nako eo molala oa hae o lekaneng hore a lule ho eona
70,a theocracy is a government or heavily by religious the five are actively ruling in ways that increase in the power and or persuasive effect of religion and by extension religious in government theocratic,tonakholo ke 'muso kapa haholo ke bolumeli ba bahlano ba busa ka mafolofolo ka mekhoa e ntseng e eketseha le ka lebaka la bolumeli pusong ea puso ea molimo
71,you are and persuasive,o na le tšusumetso
72,i always been a very persuasive girl,ke ne ke lula ke le ngoanana ea susumetsang haholo
73,i had the interesting experience of doing and in both and then a year later in in there was a lot of textual thematic analysis and of for writing persuasive,ke bile le boiphihlelo bo khahlisang ba ho etsa le ka bobeli le selemo hamorao ho ne ho e-na le tlhahlobo e ngata ea mongolo le ea bakeng sa ho ngola ho susumetsa
74,some are hard to make and some people might never be persuaded but you have magic transcendent truth on your side you more confident feeling you re right but does nothing to make your argument more persuasive,tse ling li thata ho se etsa 'me batho ba bang ba ka be ba sa tiisehe empa u na le' nete e kholo ka lehlakoreng la hau u ntse u e-so ka u phela empa u sa etse letho ho etsa hore khang ea hau e be tšusumetso haholoanyane
75,persuasive remix album,albasive remix albamo
76,this look interesting very persuasive to watch i will be looking it up on my house to text fam peace and love best to your form,sena se shebahala se le ntho e khomarelang haholo ho shebella ke tla e sheba ka ntlong ea ka ea ho ngola khotso le lerato ka ho fetisisa ho foromo ea hau
77,declared 'basically we are a similar formula ultimately persuasive,re phatlalalitsoe 'ke mofuta o tšoanang oa mofuta oa qetellong o khothalletsoa
78,given your attempt to frame my argument for me your argument is not unexpected not persuasive but not unexpected,fuoa boiteko ba hau ba ho sebelisa khang ea ka bakeng sa ka ngangisano ea hau ha e sa lebelloa eseng e susumetsang empa e sa lebella
79,anyone ever told you that you are incredibly persuasive,ho na le motho ea kileng au joetsa hore o susumetsa ka mokhoa o makatsang
80,from the sensory are primary and lead to cognitive camp there s whose book a persuasive case in that direction,"ho tloha sensory ho ka khona ebile o lebisa ho ka mpeng ea kelello ho moo, buka e susumetsang ka lehlakoreng leo"
81,so i m guessing you t watch or check the in the video more re for graphic i link below,kahoo ke nahana hore o tla shebella kapa u hlahlobe video e eketsehileng hape ho kopanya graphic ke hokahanya ka tlase
82,projecting a persuasive image of a desirable and practical future is extremely important to high morale to dynamism to consensus and in general to help the of society turn smoothly the next a scenario for and the world,ho fana ka setšoantšo se susumetsang sa bokamoso bo lakatsehang ebile bo le matla ho feta ho lumellana le setjhaba se latelang le lefatše
83,that s it that s his big politically persuasive vote me speech he ridiculous like the are too heavy for him gee whiz that sure shaking in his boots,s ka bong ba hae bo fosa boitšoaro boipolofatsa boipolofatsa boikathaphang boo a bo apereng joalo ka ha ba boima ba hae
84,_econs i do not recall this piece at this very moment but his general case is the politics of it is too hard assuming i am correct that is not a very persuasive argument,_econs ha ke hopotse sekhechana sena ka nako ena feela empa maiketsetso a hae a akaretsang ke lipolotiki tsa tsona li nka hantle hore ke ngangisana ka mokhoa o susumetsang haholo
85,is the process of writing persuasive marketing and promotional these three will help you create better content,ke mokhoa oa ho ngola lipapatso tse susumetsang le ho netefatsa tse tharo ho tla u thusa ho etsa litaba tse ntle
86,civil disobedience with moral relativism is a very dangerous path i also doubt the efficacy of calling someone a bootlicker when making a persuasive argument it is really just a use as a cudgel to trigger conformity,ho se mamele khafetsa ka boitšoaro bo kotsi haholo ke le hore ho na le tsela e kotsi haholo ha e etsa hore motho e be le eona.
87,the in my head get more and more persuasive everyday,hloohong ea ka e fumana ka mokhoa o nepahetseng le o susumetsang ka mehla
88,_pearls yea nobody this is not a persuasive argument so use what works this works,_pearls ee noa ha ho motho eo e seng khang e susumetsang haholo ho sebelisa se sebetsang
89,yea they do not care none of this is persuasive so just give them this,ee ha ba hlokomeloe hore ha ho le ea mong enoa oa susumetsa hore e ba fe sena
90,nobody it is not persuasive so use this instead,ha ho na motho ea sa khoroang kahoo sebelisa sena
91,sorry for the client commissioner academic commission server essay module research thesis tula book review movie story written persuasive concept reaction paper speech performance task,ts'oarelo ka khomphutha ea khomishene ea mobutso oa bareki
92,yea but it is not a persuasive retort as everyone my own does not stink ism now the fact that is the power grid and green energy problem they do care about,"ee, empa ha se mokhoa o susumetsang re le motho e mong le e mong ea se ke oa tsukutla ism joale ke hore ke bothata ba boea ba grid le botala boo ba li tsotellang"
93,open pa po client essay reflection paper science math algebra basic calculus statistics presentation reaction critique analysis position persuasive research probability,bula mohopolo oa tlhahlobo ea puso ea po p card
94,clearly not true nor centered i say this so that no one will deceive you with persuasive therefore as you received the lord so walk in him been firmly rooted and now being built up in him and established in you,ho hlakile hore ha se 'nete kapa ha ho na motho ea reng ke motho ea tla u thetsa ka tieo.
95,this article is a very lucid read any one who the straightforward and honestly persuasive that needs to examine their deep time for us to hold the accountable,sengoliloeng sena ke seli se setumo se sa bala se hlakileng le se susumetsang se hlokang ho hlahloba nako ea bona e tebileng ea hore re tšoare ikarabella
96,the fact that you think that is persuasive just an idiot problem on some level you know it,taba ea hore u nahana hore e susumetsa bothata ba idiot feela maemong a itseng ao u a tsebang
97,you are being very persuasive,o ntse o susumetsa haholo
98,there are so many different ways of transferring knowledge but none have same the emotional feeling or persuasive as a book,ho na le mekhoa e mengata e fapaneng ea ho fetisetsa tsebo empa ha ho na eona e tšoanang le ea maikutlo kapa e susumetsang joalo ka buka
99,just about everything there is to know about speaking with confidence and she us on the to share some of the to persuasive happy listening,hoo e ka bang ntho e 'ngoe le e' ngoe e teng ka ho bua ka kholiseho re ka arolelana tse ling tsa ho mamela tse ling tsa ho mamela
100,i love it when who think they are right are just bold face wrong walk the walk of shame i love that scenario the best too man take so much time to explain something research no wow really persuasive then there is a bold faced wrong sell u have bus too,kea e rata ha ba nahana hore ba na le sefahleho se fosahetseng haholo le eona
101,so much more annoying than just their politics better t possible is legitimately more persuasive than the bad are actually good,ho itšehla thapolo ea bona ho feta feela hore ho khoneha ho susumetsoa ke molao ho feta bobe bo botle
102,is so persuasive at bunny but could not enough money though look at their begging to did not give a f ck' n if he got major police line do not cross at tia is home,e susumetsa haholo
103,my public speaking professor is going to regret giving us creative freedom i m over here writing a persuasive speech about one piece,moprofesa oa ka oa ho ithuta oa ka oa ho bua oa ikoahlaela ho ikoahlaela ho re fa tokoloho ea ho ngola ka mona ho ngola puo e susumetsang mabapi le sekhechana se le seng
104,_papic your bear argument on gas is fairly persuasive if they turn back on does that pull the rug out from under thermal coal logically it would no,_papic?
105,is fun i just hate persuasive writing and stuff like that,ho monate ke hloile ho ngola hape ho fana ka maikutlo le lintho tse joalo
106,_ please text you this week,_ ka kopo ngolla bekeng ena
107,you did not lay out any persuasive argument you just threw out a bunch of as the left does when they have no argument fortunately most do not care about your we can see for ourselves,ha ua ka ua beha khang efe kapa efe e susumetsang eo u sa tsoa e arola sehlopha sa ho le letšehali
108,can we please have another beach day,na re ka fumana letsatsi le leng la leoatle
