,src,trg
960,appear woke for at the expense of female do they really think they have much political with the snapping back that people will forgive the violence against or erosion of their sports,o bonahala a tsofetse bakeng sa ho senya basali ka boea ba nahana hore ba na le lipolotiki le ho hula pefo kapa khororong ea lipapali tsa bona
961,report 'bracing' for to receive game suspension,tlaleha 'ho qhekella' bakeng sa ho amohela ho emisoa ha lipapali
962,roster no s,molamu ha ho s
963,buffalo training camp everything you need to know,buffalo koetliso ea kampong ntho e ngoe le e ngoe eo u hlokang ho e tseba
964,i have significant a potential problem area,ke na le bohlokoa bo boholo ba bothata bo ka bang teng
965,i my brain and i can t think of literally any other time when a professional sports team marketing to the opposing fan base that s rock bottom for a sports franchise would the ever market to or vice f no,ke kelello ea ka 'me ke khona ho nahana ka nako e' ngoe ha sehlopha sa lipapali sa lipapali se ka tlase bakeng sa 'maraka oa lipapali ho tla ba teng.
966,who am i follow for a fun way to learn test your knowledge reveal tomorrow,ke mang eo ke mo latelang ka tsela e monate ea ho ithuta lengolo la tsebo ea hau e senola hosane
967,mainly about the lack of truly new re and how they charge for something that could be an update typical yearly sports franchise for the most part i think the late announcement as a result of no e may have raised too,haholo-holo mabapi le ho haella ha se seng hape se-re le hore na ba lefella ntho e 'ngoe ea lipapali tsa selemo le selemo ke nahana hore ha ho joalo.
968,what s the point of following sports is there an end goal besides bragging,ntlha ea ho latela stow e kae e na le sepheo sa pheletso ntle le ho ithorisa
969,and that is why he is on national and the top sports commentator in and you are not there is no but he is very good and the best league wide,ke ka lebaka leo a leng ho bangoli ba naha le ba holimo ho naha le uena ha o na eona empa o motle haholo ebile o motle haholo
970,football vista peak is big war a few aurora to get some shine and taste competition with season just around the corner,ntoa ea foull vista pather ke ntoa e kholo aurora e 'maloa ho fumana li-herhition tse khabisitsoeng le sekhutlo feela ho potoloha sekhutlo
971,instead of us basketball why do not we support other sports that we are actually winning at,sebakeng sa us basketball hore na ha re ts'eheletse lipapali tse ling tseo re li hopolang
972,just posted a photo jasper source for sports,"e sa tsoa beha mohloli oa jasper ""bakeng sa lipapali"
973,_sell i will i take the south and west,_sell ke tla nka boroa le bophirima
974,i hate sports,ke hloile lipapali
975,they are used to being the most important people in the room and suddenly they are in a sports environment where no one who they are and they have the same status as beach volleyball,li sebelisoa ho ba batho ba bohlokoa ka ho fetisisa ka phapusing mme ka tšohanyetso ba se na lipapali moo ho seng motho ea nang le boemo bo tšoanang ba leoatle
976,we are excited to launch the first sports prediction market now live on the get early access to preseason to have a chance at winning from a k prize pool place your first now,re thabela ho tsebisa pokello ea pele ea lipapali tsa lipapali tsa pele joale ho fumana monyetla oa ho ba le monyetla oa ho ba le monyetla oa ho fumana monyetla oa ho hapa.
977,_justrj _pf u got wilt dominated every sport he in both in college and in professional sports high jump broad jump track basketball do some research before you start spouting off,_justrj _pf o ile oa beha papali e 'ngoe le e' ngoe ka bobeli kolecheng le lipapaling tsa lipapali tse phahameng tse pharaletseng pele u qala ho ba teng
978,it s based loosely on vet and heat for sports and child welfare i work with foster teens i think it s a pretty good metric,ke thehile ka mokhoa o iketlileng ka vet
979,meet rob the gig harbor resident who a popular fishing radio show and a charter service in southeast,kopanela rob the gig hazbor moahi oa radio ea seholoanyane ea ho tšoasa litlhapi tsa ho tšoasa litlhapi tsa tlhaho le ntoa ea charter ka boroa-bochabela
980,launch date and trailer with sam,letsatsi la ho qala le trailer le sam
981,stripped of captaincy as rift is set to become the latest player by the riches being by the golf series,ho hlonepha ha motho e mong ha ho behiloe ho ba sebapali sa morao-rao ka maruo a haufi le letoto la kolofo
982,the great sports bar that s us buffalo wild we re turning game time into worth telling and we want you to be part of it join the team,lipapali tse kholo tsa lipapali tsa s us buffalo naheng ea ho rekisa papali li lokela ho bolella nako eo re e fumanang ho ba karolo ea eona
983,is it me or does it seem that a lot of the sport s governing are just corrupt from the list perhaps it s a good time for a systematically over view of all the sports governing in their country,na ke 'na kapa na ho bonahala eka ho na le puso e ngata ea papali ea lipapali e bolileng lethathamong e ka ba le nako e nepahetseng e feteletseng
984,there is criticism about that is warranted he on to the ball too long he is not the most personable teammate his press are cringe his is cringe the meter is at a thousand by,ho na le ho nyatsuoa ka seo ho le bohlokoa hore o ee phomolong e telele haholo
985,it s sports it s either miss postseason st exit,ke sprint it spos missseceake stop
986,_wwe perfect way to bring roxy back,_wwe tsela e phethahetseng ea ho tlisa roxy morao
987,and wide world of sports,le lefatše le pharaletseng la lipapali
988,because he got k bonus the give them housing and is about sports for a living that s embarrassing,hobane o fumane matlo a ba ba fe thapo mme o mabapi le lipapali bakeng sa ho iphelisa
989,_ they can have bam for,_ ba ka ba le bam bakeng sa
990,new beat by in the t at civil service cricket club,e ncha e otloa e ka ho t ho sehlopha sa li-cricket tsa lehae
991,play football it is been so so so long i miss sports,bapala bolo ea maoto e bile haholo ke hloloheloa lipapali
992,its always them damn sports when the middle school beef w another and their meeting up being a little,kamehla e lula e le lipapali tse ngata ha sekolo sa marang-rang ha seganya se seng sa sekolo sa sekolo se seng le se seng sa bona se le nyane
993,madden participant headline prime,madden o nkang karolo ea maddeen prime
994,i consistently win at a or higher win rate across all sports it is why i am able to do this for a living,ke hloile ka nako e telele ea win kapa e phahameng ea ho hapa lipapali tsohle ke hore ke ka lebaka leo ke khonang ho etsa sena bakeng sa ho iphelisa
995,_sports trade his ass,_sports khoebo ea hae
996,pretty sure that other sports being taken over have been spoke about lad to mind,ehlile hore lipapali tse ling tse nkuoeng li ne li bua ka uena ka bay nahana ka kelello
997,__indy who needs bomb ass sports when you have bomb ass,__indy ea hlokang papali ea bomo ea bomo ea bomo ha u na le bomo ea bomo
998,i am always excited for a story on because so we get unique thoughtful here about,ke lula ke thabile haholo ka pale ea hobane re nahanisisa ka taba ena ka
999,keeping core intact the right move for via,ho boloka tšepe ho tiisa letsoho le letona bakeng sa ka
1000,but you re not my mind are last in the division,empa ha o na kelello ea ka e tšoarellang karolong
1001,is this actually the only day off the year with no sports on this is boring,na ha e le hantle ke letsatsi feela la ho tloha selemong se se nang lipapali ka sena se bora
1002,_sports we were awful and beat y all by you re the last team that can talk to us,_sports re ne re le mobe ebile re otla y kaofela ha u le sehlopha sa ho qetela se ka buang le rona
1003,_sports i wonder if you set a record for most ever down at one basketball game which is hilarious don t you have your own hand symbol oh yeah,_sports ke ipotsa hore na u beha rekoto bakeng sa papali e le 'ngoe ea basketball e le' ngoe ea hau e le 'nete
1004,the technology is dodger level but the beer selection is more like the,theknoloji ke boemo ba dodger empa khetho ea biri e tšoana le
1005,not kraken but sports related what do you think,eseng joalo ka lipapali empa lipapali tse amanang le tsona u nahana eng
1006,the official live stream link is now here dynamo live streaming link live link live link,lipina tsa semmuso litse tsa liphoofolo li se li le teng hona joale dynamo live tola ea lihokelo tsa lifofane
1007,same i can not wait for sports to come back,le uena ha ke khone ho emela hore lipapali li khutle
1008,sensible 'individuals hold doubting him',batho ba bohlale 'bao batho ba neng ba re belaela'
1009,must joke this so u could not come be the sports commentator fi the night hate some style,"e tlameha ho soasoa sena, u ka se khone ho tla ba puo ea lipapali"
1010,right but a roster of war in their first year extraordinary surplus value yet will only win you you have to balance absolute value with surplus to have a serious chance to win,"ka ho le letona empa ho na le peo ea ntoa ea selemo sa pele selemong sa pele se ngotsoeng pele se le seng se tla u hlola, u tlameha ho ba le monyetla o moholo oa ho hapa"
1011,sports club v sports club sports club v sports club,sports club v sports club sports club v sports club
1012,this is the cost for just one soda but how much for just,ena ke litšenyehelo tsa soda e le 'ngoe feela empa ke bokae
1013,moors sports club v cricket and athletic club moors sports club v cricket and athletic club,moors sports club vricket le atleleten club moutlong ea sports club v cricket le ea atlelete
1014,sir what is your ministry doing about judicial you worked better as a sports' minister but now you are doing nothing just being silent i did not this from you,monghara-pele oa hau o etsa joang ka boahloli o sebelitse hantle joaloka mosebeletsi oa lipapali empa joale ha o sa etsa letho le khutsitseng ha ke a bua joalo ho uena
1015,one year ago the the title for the first time in and only the second time in franchise history a moment that will live forever in sports history,selemo se le seng tse fetileng sehlooho sa lekhetlo la pele ka lekhetlo la pele ke le nako ea bobeli ho nalane e tla phela ka ho sa feleng historing ea lipapali
1016,_sports too bad a certain on this team is ruin it for us,_sports haholo e mpe haholo sehlopheng sena se senya
1017,sports club v police sports club sports club v police sports club,lipapali tsa lipapali tsa lipapali tsa lipapali tsa lipapali tsa lipapali tsa lipapali tsa lipapali tsa lipapali tsa lipapali tsa lipapali tsa lipapali tsa lipapali tsa lipapali tsa lipapali
1018,cricket club v sri air force sports club cricket club v sri air force sports club,cricket club v sri air force sport cricket club cricket club v sri dethand sports club
1019,we are in the midst of an objectively awful sports week,re ka har'a beke ea lipapali tse mpe tsa lipapali
1020,wake forest coach on other during the kickoff in,methapo ea meru ea moru ho e 'ngoe nakong ea bo-ralitteng
1021,compression arm,kholiseho ea khoebo
1022,_claws the best part of extreme sports is,_laws karolo e ntle ea lipapali tse feteletseng ke
1023,ra st brown can make a little history in week one,ra st brown o ka etsa nalane e nyane beke le beke
1024,going to the city match at lambeau field here is what you need to know about saturday is match,ho ea toropong ho lambaa ho land ke seo u hlokang ho se tseba ka moqebelo ho tsamaisana
1025,we should won that game man gave us the this year so hopefully we win that game,re lokela ho hapa monna eo hore a re file molaetsa ona selemong sena kahoo re tla hapa papali eo
1026,stripped of ryder cup captaincy ahead of move via awesome,e hlobotsoe ka seropi sa ryder e ka pele ho ea tsamaisa ka ntle
1027,join us in the th anniversary of one of pittsburgh is favorite annual the vintage grand read more about the and other exciting upcoming here,eba le rona ho kutloisiso ea th ea pittsburgh's one pinage mokhatlo o moholo o balang haholo ka lehala le le leng le khahlisang mona
1028,fury he would battle for free with free for,halefela o tla loana bakeng sa mahala a mahala bakeng sa
1029,my husband i were at the same time in college i was in news he was in sports my mind we t meet until later when we worked at channel i came back to almost ago he s been at these,monna oa ka ke ne ke le ka nako e tšoanang kolecheng ke ne ke le ka har'a koleche eo ke neng re le lipapaling ho fihlela hamorao ha re fihla ho tsena
1030,know what i think he s one of the biggest among many why is literally the most broken of all north sports i am a fan and i know for certain that he could give a about our city s franchise and what becomes of it,tseba hore na ke nahana'ng e kholo ka ho fetisisa ho tse kholo ka lebaka la hore na ke hobaneng ha e le ea lipapali tsa leboea-joale ke tseba ho tseba hore na ke eng
1031,barcelona could turn to premier league defender if they fail to land chelsea is,barcelona e ne e ka fetoha mofetoheli oa phaene ea toko haeba a sa khone ho lula naheng ea naha ke
1032,and yes is,'me ho joalo
1033,i prefer to watch sports in person physically there all these are pale for being there,ke khetha ho shebella lipapali ka seqo ka moo tsena tsohle li leng teng bakeng sa ho ba teng
1034,it s the new stadium tonight for _edinburgh v in the premier sports cup,ke stadium e ncha bosiung bona bakeng sa _edinburgh v ka kopi ea lipapali tsa tokoloho
1035,this was the thing ever done to a sports figure these think they re truth and is hilarious too,sena ke ntho e kileng ea e-so ka e ea lipapaling tsa lipapali tsena li nahana hore li re hape ke 'nete ebile ke selila
1036,queen checkerboard _sell,mofumahali checkerboard _sell
1037,_edits the only with true utility that i actively use are with the game aspect and with the sports i am sure there is a lot more out there,_ed feela ka ts'ebeliso ea 'nete eo ke e sebelisang ka mafolofolo e le karolo ea papali le lipapali ke na le bonnete ba hore ho na le ho feta moo
1038,__indy sports,lipapali tsa __indy
1039,yo these sports be toxic just say you re in love,yo sports es chec chefo e re o lerato hape
1040,new car deal for football duo 'what nil was meant to be' via,sebetsana le koloi e ncha bakeng sa duo ea maoto
1041,i can honestly say this is the first time in my life i have seen a professional sports organization marketing and trying to sell to the opposing team s fan base they must really have no fan base,ka 'nete nka re ena ke lekhetlo la pele bophelong ba ka ke bone ho bapatsa le lipapali tsa lipapali tsa lipapali tseo ba lokelang ho li rekisetsa sehlopha sa sehlopha seo ba se hlokang haholo
1042,well now you re just being silly every athlete in every sport no and the squirmy with their sometimes but look into the other sports you of even after a player is hurt or cut,"joale, joale u hana feela moatlelete e mong le e mong papaling e 'ngoe le e' ngoe ha a le ka linako tse ling empa o sheba lipapali tse ling le ho senyeha"
1043,_sports you t talk well we did accomplish a bowl game last year,_sports u bua hantle hore re ka etsa papali ea sekotlolo selemong se fetileng
1044,_ca you mean this that he never got it i wonder why no one these post media,_ca o bolela sena hore ha a ka a ipotsa hore na ke hobane'ng ha ho se na 'muelli oa litaba
1045,sports is anime for,lipapali ke anime bakeng sa
1046,super s sports out here spitting big,sport s lipapali ka ntle ho moo ho thoeng e kholo
1047,sports club in society hill a day pass for their outdoor pool,sehlopha sa lipapali sechabeng se hirisang letsatsi la ho fetisetsa letamong la bona la kantle
1048,do i need to pay on my winnings full guide for there is good news,na ke hloka ho patala ho hapa tlhokomelo e felletseng ho ea ka ho fetisisa ho na le litaba tse monate
1049,_esfc short corner converted,_esfc sekhukhu se se se fetotsoeng
1050,amazing grace by p k,mohau o makatsang ka p k
1051,collect your f from this season is official f line up token standard polygon creator,bokella f ho tloha nakong ena ke semmuso sa sephutheloana sa polygon se tloaelehileng sa polygon
1052,join us total athlete for speed agility and strength training oh and did i mention we have o our own in house sports physical therapist total athlete,eba le rona moatlelete ka kakaretso bakeng sa boikoetliso ba matla le ho ikoetlisa ka matla a oh 'me ke boletse hore re na le setsebi sa hau sa lipapali tsa ntlo ea ntlo
1053,hi there i think your story an error it that the year old was previously into the sports hall of fame for his and in over of racing i believe you mean kelly not his brother kirk,lumela moo ke nahana hore pale ea hau e fositse hore na selemo se ne se le ka holong ea lipapali tsa botumo bakeng sa hae le ho feletseng ha ke batla moen'ae kirk
1054,the classes the sports the we what special and we got a diverse thoughtful set of to match our diverse thoughtful student body is your reason on our list,liithuti tsa lipapali tsa rona re ne re ikhethile ebile re na le sete e fapaneng ea ho nahana ka mefuta e fapaneng ea ho nahana ka mefuta e mengata ea seithuti ke lebaka la hau lenaneng la rona
1055,registration is open visit for more _at _sports,ngoliso ke ketelo e bulehileng ea _at _atle
1056,today is video an athlete that had a background not just for sports there is an issue where gleam is only one code was it one code per day or just only able to enter one code only,kajeno ho na le video ea moatlelete e neng e se ka morao eseng feela bakeng sa lipapali ho na le khoutu e le 'ngoe feela ho kenya khoutu e le' ngoe feela
1057,crap i am going to a conference next week and i have only got the same non dress i have worn through covid while tw'ing guess it is business casual with a sports coat for me,crap ke ea kopanong bekeng e tlang 'me ke na le moaparo o sa tsoa apereng liaparo
1058,_doctor who else saw that clown that covered his face with his bag,_doctor eo e 'ngoe e ile ea bona seo se ile sa koahela sefahleho sa hae ka mokotla oa hae
1059,please think about this issue from other s this is just one of the also psychiatric sports intimate care for disabled sometimes non verbal and,ka kopo nahana ka taba ena ho tsoa ho tse ling
1060,best kit in sports mate,kit kit manyolo a lipapali
1061,i assume for sports,ke nahana hore lipapali
1062,never forget the all but this expansion craze two ago when it the old big east for boston college and tech ten later it finished the conference off by and,le ka mohla u se ke ua lebala craze kaofela
1063,can t fathom by people don t get the backlash a group of who know nothing about golf and trying to buy out the tour we have watched out entire life you realize if this in any other major sports you d here the same thing right,na te fathim ke batho ba bang ho batla habo mosa oa ho se tseba ho etsa lintho tse ling tse ling tse ling tse ling tsa bophelo
1064,his hockey sense at the time was level,boikutlo ba hae ba hockey ka nako e ne e le maemong
1065,federal judge administration s effort to allow to compete in s sports,memona ea ad ficoven ad acceven
1066,_seattle in sports i believe money is also status meant something to to be top,_ mohlatle lipapaling ke lumela chelete e boetse e bolela ntho e itseng ho ba holimo
1067,softball might want to get used to seeing fort dodge in the state championship the are headed there again after beating valley in sixth fort dodge will play the winner of the northwest game,softball e kanna ea batla ho etsa ho bona qhobosheane ea 'muso e le teng hape moo ho tla ba teng ka lebaka la papali e ka leboea-bophirima
1068,so sports start paying attention to baseball,kahoo lipapali tsa lipapali li qala ho ela hloko baseball
1069,sports grounds _barrow _live,lipapali tsa lipapali _barrow - _live
1070,can in buffalo are not with these odds,e ka ba buffalo ha e na mathata ana
1071,good fake account maybe create another one and actually follow tater sports instead of over very weird,ak'haonte e ntle ea leshano e kanna ea etsa e 'ngoe' me e hlile e latela lipapali tsa khale ho fapana le tse ngata haholo
1072,dynamo link mobile enjoy free streaming right now,dynamo link mollo o natefeloa ke mahala hona joale
1073,my sports bra in the back,ke ne ke le brate ea ka ea lipapali ka morao
1074,i know what you mean and sports in general are the only reason why i am on twitter but its getting too political i may opt out of twitter,kea tseba hore na u bolelang
1075,long time no talk should be a serious consideration by i am dead serious guy is exactly what the need to be honest every team should be in on the guy,nako e telele ha ho na puo e lokelang ho nahanoa ka botebo ke ke motho ea shoeleng ea shoeleng ke hore na ho hlokahala hore ke be le bonnete ba hore ke bona ea tšepahalang sehlopha
1076,cute his does seem very fit for sports and for the cheering crowd,o motle oa hae o bonahala o loketse haholo bakeng sa lipapali le bongata bo qabolang
1077,it s hard to tell which group is the most easily offended of religion politics sports or music it might be the of a certain university,ho thata ho tseba hore na ke sehlopha sefe se khomelitseng ho na le sehlopha sefe sa bolumeli ba lipolotiki kapa 'mino.
1078,stop sports to s,emisa lipapali ho s
1079,_collector _sell _ take joe,_collec _sell _ ke joe
1080,the number of who have tested positive for to no decision yet on rematch against in,palo ea ba lekile ho se fumane qeto e sa feleng khahlanong le
1081,_joshpray it is literally the sports day of the year no or all we have is beach volleyball,_joshpray
1082,_brunson i been going to that game for not new to anything sports related well into my maybe take a rain check on this one,_brunson ke ne ke le papaling eo bakeng sa ho se ncha ho lipapali tse amanang le hore ke kene ka nako ea ka
1083,_uganda is this the same that is hosting a sports gala on st or there is another have some shame you people,_uganda ena ke ena e lumellang gala e hanang ho st kapa ho na le e 'ngoe e hlabisang lihlong
1084,mad making noise corner of the in all of sports,hlatsa ho etsa sekhutlo sa lerata la lipapali tsa lipapali tsohle
1085,tennis star heather up sun in bikini as she from,zenis star heather ola letsatsi ka bikini ha a tsoa
1086,this is the one day of the year that there is no sports and i m out of my mind how the hell did we survive of this in then again you can never have enough rest,"ena ke letsatsi le le leng la selemo seo ho se nang lipapali 'me ke se na kelello ea ka hore na lihele li ile tsa pholoha joang ka nako eo, ha u e-so phomole ka ho lekaneng"
1087,new story concussion test for fall sports,teko e ncha khothatso ea teko ea lipapali tsa faele
1088,this might be one of the worst of the year in of sports consumption other than the home run derby this week is weak,ena e kanna ea ba e 'ngoe e mpe ka ho fetisisa ea selemo ho ea ho sebelisa papali ea lipapali ntle le lapeng ka beke ena ho fokola
1089,does your hip hurt with certain sports or even the weather join us today for an excellent live event mark hurley will be about common of hip pain and how to solve it join us on today at to hear about it,na seea-le-moea sa hau se utloisa bohloko ka lipapali tse itseng kapa le maemo a leholimo a mang a matšoao a bophelo bo botle a ho phela le kamoo a ka a rarollang kajeno
1090,but since we don t have a baseball team i used to live in when i was younger when i was like i t watch sports but the are the only reason i can keep my mental sanity in sports,empa kaha ha re na sehlopha sa baseball seo ke neng ke lula ho sona ha ke ne ke le monyane ha ke ne ke rata lipapali tsa kelello lipapaling
1091,we can also test who can memorize a text faster then we ask a model agency for and in the end sports,re ka leka le mang ea ka tšoarang mongolo ka hlooho ka hlooho ka hlooho ka hlooho ka hlooho ka bophara re botsa lefa la mohlala le lipapaling tsa ho qetela
1092,o amahony on sports psychology and the influence of the tour,o amahony mabapi le psychology ea sports le tšusumetso ea leeto
1093,_itsnotlily did you know that sky sports re run old sometimes,_itsnolylily na u kile oa tseba hore lipapali tsa leholimo li tsoetse pele ka linako tse ling
1094,in the era of human race at their creative innovative peak why is there no new outdoor sports while video indoor have gone through a sea of a change the outdoor sports mostly status quo,linakong tsa batho ka bokhachane tse ncha tse ntlafalitsoeng ke hobaneng ha ho se na lipapali tse ncha tsa video ha video e ntse e le teng ka ntle ho maemo
1095,i get confused when i hear people sports for so they should not talk about it so what do you expect they talk about you people should take it easy,ke ferekana ha ke utloa linomoro tsa batho bakeng sa hona ha baa lokela ho bua ka hona joale u lebelletse hore ba lokela ho bua ka uena
1096,kyle silver _sell,kyle silve _sell
1097,and like take a couple of extra with you if you hit the streets and some sports if possible share with the those out there in need if you can it s hot and they are at risk,'me joaloka ho nka tse' maloa ho uena haeba u ka otla literateng le lipapali tse ling haeba ho ka khoneha ho chesa le ba kotsing ea ho chesa 'me ba kotsing
1098,great show as always chad g vodka chat adam is big win on being than so much more what about that hist oh my keep on sports chattin',bonolo great j vodka pont ada o hapa haholo ho feta ho ho feta ho ho feta ka hist ho ntse ke boloka lithuto tsa lipapali
1099,if it is decided the should try to trade for what does a deal to get him look like espn is provided his insight on that and if the m is or any team can pull off a trade for the before the deadline,haeba ho nkile qeto ea hore a lokela ho rekisa bakeng sa ho etsa hore a shebahale joalo ka espn a fana ka temohisiso ea hae ka seo le hore na sehlopha sefe se ka hulang khoebo pele
