,src,trg
1377,explain your go to outfit jeans and a shirt but today i wore jeans and a sports bra,hlalosa hore na u ea li-jean le hempe empa ke ne ke apara li-jeans le papali ea lipapali
1378,_edge _sports i m not saying he s going anywhere i m saying it would make more sense just my opinion,_edge _sports ha ke re a se ke a re a ea kae kapa kae moo ke reng ho ka utloisisa maikutlo a ka feela
1379,_the_only _lilith _am_i _bunny _teekeemon and there is even open enrollment which is what my do as i said before school is for sports,_the_ly _lilith _ilith _il_kunny _ekekeemon mme ho na le enwa ea ka ha ke ne ke e etsa pele ho lipapali
1380,_sell you must type in your bid sir,_sell o tlameha ho thaepa mohlomphehi oa hau
1381,the sh thole that is ea sports welcome to the,sh thole eo e leng sports e amohelehang ho
1382,sports team,sehlopha sa lipapali
1383,feel like i follow sports pretty closely but i had to ted lasso so i could pretend to know literally anything about soccer when i go to the game tonight,ikutloe eka ke latela lipapatso tse ntle haholo empa ke ile ka tlameha ho etsa eka ke tsebe hore ke tsebe ho tseba eng kapa eng ka bolo ea maoto ha ke ea papaling bosiung bona
1384,you are to belittle the issue by making it just about but it is not the point of principle is that men are to identify themselves into all women is sports erase our language pregnant people and the definition of a woman,u tla nyenyefatsa taba ka ho e etsa feela empa ha se motheo oa melao-motheo eo banna ba lokelang ho itse bonahatsa basali bohle ke tlhaloso ea mosali
1385,i was going to make a stop following me joke since he lived near me or still does i don t know but i don t need some sports turning it into something it s not you know the,ke ne ke tlo etsa ho emisa ho latela joke ho tloha ha a lula haufi le nna kapa ha ke sa tsebe hore na lipapali li tla fetoha
1386,petty yet you tear down a sports reporter for how she in a dress that is the ultimate definition of petty,hajoale u ntse u inamela moqolotsi oa lipapali bakeng sa tsela eo a apereng ka eona
1387,hawkeyes' works toward return via,e sebetsa 'mesebetsi e e ea ho ea khutla ka neng
1388,_sports glad you continue to watch,_sports ke thabela hore o tsoelepele ho shebella
1389,i my calling being in sports talk radio i m making up for lost nonsense about digital cartoon of,ke ntse ke batla ho ba radio ea lipapali ea lipapali
1390,to hawaii is for being best college athlete in women is sports,ho hawaii ke bakeng sa ho ba moatlelete oa koleche ho basali ke lipapali
1391,just love about marvel and star just the is more toxic than most sports,rata feela ka mohlolo le linaleli feela tse chefo ho feta lipapali tse ngata
1392,_gee except the issue at hand is women is right to exclude of the opposite sex from our sports where we are undressed or otherwise particularly vulnerable this male people you call men those who say they are their identity is irrelevant,_gee ntle le bothata letsohong le letona ke 'mala o ka tlase ho batho ba ratang banna bao o reng ke boitsebahatso ba bona
1393,_wallace this is literally false because young people watch other sports,_walllace sena ke 'nete hobane bacha ba shebella lipapali tse ling
1394,sports t for everyone luckily financial is drive your straight down the fairway and land in the green every time with a solid financial plan,lipapali t bakeng sa motho e mong le e mong ka lehlohonolo o hulela ka kotloloho e otlolohileng le naha ka sepheo se le seng se nang le moralo o tiileng oa lichelete
1395,ford bronco sports are certified,ford bronco lipapali li netefalitsoe
1396,yea last was harsh next year it will be ea sports play,ee ho qetela e ne e le thata selemong se tlang e tla ba ea papali ea lipapali
1397,is insane package yesterday graded and on the way back not to bad don t agree with the grade but gem mint is clutch _sell,na sephutheloana sa maobane se halikiloeng le tseleng e khutlelang ho se sebetsoang se sa lumellaneng le sehlopha empa get mine e na le clutch _sell
1398,_knab _sell auto price,_knab _sell auto
1399,yes like have really to show how unfair it is for to compete in s sports,ee joalo ka ha e le hantle e bonts'a hore na ho sa lomelle ho se lumele ho qothisana lehlokoa le sports
1400,confirm fight for the world featherweight title who fight odds,netefatsa ntoa bakeng sa ho loanela sehlooho sa lefats'e sa masiba a loantšana le ona
1401,its the basketball league mate and its on sky sports,molekane oa hae oa basketball le eona le lipapali tsa leholimo
1402,of the opposing will face in,ea hanyetsanang e tla tobana le
1403,the beginning of the end for professional sports,qalo ea pheletso ea lipapali tsa litsebi
1404,_ sports life stop trolling man,_ lipapali tsa lipapali li emisa monna
1405,imagine much influence on an entire sports like the genre of sports or the entire industry of that specific sports can relate,nahana ka tšusumetso e ngata ho lipapali tsohle tse kang mofuta oa lipapali kapa indasteri eohle ea lipapali tseo e ka li phetang
1406,even he is a football fan and friend where is he he a award show for all sports to them now its the time to them and support where is,le eena ke oa ho fallela ba folete le motsoalle o hokae hore ke pontšo ea moputso bakeng sa lipapali tsohle ho bona joale ke nako ea ho bona le ho ts'ehetsa kae
1407,_sports really solid,_sports ehlile e tiile
1408,on team construction,kahong ea sehlopha
1409,we might finally win a prime time game since we play the this year on night,re ka boela ra hapa papali ea nako ea prime ho tloha ha re bapala selemo sena bosiu
1410,i will get back to you with more,ke tla khutlela ho uena ka tse ling hape
1411,news from the time discovered previously unknown hacking the u s command,litaba tse tsoang nakong e fetileng tse sa tsejoeng tse sa tsejoeng tse sa tsebeng ho senya
1412,tennis very stupid sports,pannis lipapali tse booatla haholo
1413,each plus shipping _sell _,ntho e ngoe le e ngoe le e 'ngoe ea ho tsamaisa _sell _
1414,i simply disagree the media does not need to be everywhere all the time in regard to sports now if we are talking about our public and of which i am legally responsible for paying to then yes media being present at press are imperative,ke sa lefelle mecha ea litaba ha ho hlokahale hore ke be teng ka nako eohle haeba re bua ka sechaba sa litaba se le teng ha ke le motoapo.
1415,how cool is this a great moment because of sports,nako e monate ke efe ka lebaka la lipapali
1416,women is quarter final live score team news and,basali ke newer ea ho qetela ea lipatlisiso tsa sehlopha
1417,news from the time how unprepared northern are for a warmer world,litaba tse tsoang ka nako eo e ka leboea e sa sebetseng bakeng sa lefatše le futhumetseng
1418,news from the time an immersive next to normal in barcelona,litaba tse tsoang nakong e behiloeng e le ntho e tloaelehileng ho barcelona
1419,news from the time five you might be,litaba tse tsoang nakong ea li hlano u ka ba
1420,news from the time tired of waiting for their dream workplace these made their own,litaba tse tsoang nakong e atileng ea ho emela mosebetsi oa tsona oa litoro tsena li ile tsa iketsa ba tsona
1421,tony hawk is wasteland an extreme experience game a sports simulation game with feature and fantastic story based,tony hawk is health
1422,if it were non sports related then you are x accurate,haeba e ne e se lipapali tse amanang le lipapali ka nako eo o nepahetseng
1423,i put my penis on classic sports unfair athletics ea sports the game,ke beha botonelo ba ka ho lipapali tsa khale tse sa lefelloeng u lipapali tsa papali
1424,that they will be up with several women is sports and to uplift and inspire the next generation of to dream big,hore ba tla ba le basali ba 'maloa ke lipapali le ho khothatsa le ho khothatsa moloko o latelang oa ho lora big
1425,is it a major sports event pop concert or could it just be family and leaving the this evening what a blast,na ke konsareteng ea sebaka sa lipapali tsa lipapali kapa e ka ba lelapa le ho tlohela mantsiboeeng ana
1426,_god is amazing you just had a bad first impression from them with good and you love it,_good o a makatsa hore ebe o bile le maikutlo a fosahetseng a pele ho bona ka botle mme oa e rata
1427,is now still stupid,e ntse e le sethoto
1428,thanks for making our tribute tweet the tweet of the week in his wrestling column on the sports site the more people who get to see her incredible work the better,rea leboha ka ho etsa mochine oa rona oa tweet tweet the beke a wrestling clumn in the wa sports webosaeteng ea hae e makatsang
1429,_sell _connect follow back for,_sell _connect e latela
1430,breaking news to appoint as 'permanent' batting coach,litaba tse rerosang ho khetha e le moetsi oa kabeto oa kabeto
1431,i think its good that play multiple sports enhance their basketball track will help with speed volleyball will help train their,ke nahana hore ho bapala lipapali tse ngata ho ntlafatsa pina ea basketball ea bona e tla thusa ka lebelo la volleyball ea volley e tla thusa ho koetlisa ba hao
1432,if i was smart i would get off political twitter and just follow sports and video,haeba ke ne ke le bohlale ke tla theoha twitter ea lipolotiki ebile ke latela lipapali le video
1433,_doctor am seriously pained by this show of shame what kind of a country is this catholic for acceptability,_doctor o ne a entsoe ka mokhoa o pholileng ka ho hlakisa lihlong tse ngata tsa naha ke mok'hatholike enoa oa ho amohela
1434,sports day of the season not in breathless trade speculation junior working overtime,letsatsi la lipapali la setso
1435,anybody in to sports betting,mang kapa mang ho becha ea lipapali
1436,to accommodate a change in the will host a date on,ho amohela phetoho ho ea ho amohela letsatsi ho
1437,also the sports media that on and big market,le mecha ea lipapali ea lipapali tse ka 'marakeng o moholo
1438,oh yes that awful bigotry of not giving you everything you want such as men in single sex and sports do you hear yourself it s not bigotry it s the fact that your ie attempt to bludgeon us into submission to your unscientific,oho ee e thata ea ho se u romelle tsohle tseo u li batlang tse kang banna ba bong bo le bong le lipapaling tseo u ka li etsang ka ho fetisisa tsa ho se buu.
1439,_chinese _xiuzhong see how racist was schooled by a sports journalist,_chunesse _cipuzhong
1440,_odisha _krishna abolish_contractual_system is no longer in line _odisha,_odisha _krishna abalish_contficial_ssystem ha e sa le moleng _odisha
1441,_sports is that why you always talk about everyone always talking about you,_sports ke hore ke hobaneng ha u lula u bua ka motho e mong le e mong o lula a bua ka uena
1442,only thing about i love beside sports was and still is cedar point,ntho feela e mabapi le hore ke ratane ka thoko ho lipapali tse haufi le 'me ho ntse ho le joalo
1443,who is your boston sports coach of the year past,mokoetlisi oa lipapali oa hau oa boston ke mang ea selemo se fetileng
1444,_edge _sports he s not for the same or less than his brother he is not going to,_edge _sports ha a tšoane kapa a le tlase ho moena oa hae ha a ea
1445,sports media days 'everything is on the table' amid college football landscape via,"lipalo tsa lipampiri tsa lipapali 'tsohle li lethathamong la ""the amid collec sport foupscape ka"
1446,i agree that being at is not necessarily a bad thing and also would likely be competitive in multiple sports enhanced recruiting in would be nice i still think the big better expansion but would not be upset at all if the join,ke lumela hore ho ba teng ha se ntho e mpe ebile e kanna ea ba tlholisano ea lipapali tse ngata empa e ke ke ea koata
1447,been the next head coach of he dick steed as the next head coach of the program steed retired at the end of this past season after a year career at,e bile mothati oa hlooho ea hlooho
1448,_burner _burner the only team that heavily the chat at least i don t live near the ass crack of the earth dodger are the biggest cry in sports fandom it s almost laughable at this point with you,_burner _burner
1449,_doctor who told you those supporting them are human,_doctor ea u joetsitseng ba ba tšehetsang ke motho
1450,if you could have a drink with any one athlete from sports history who would you have the drink with and what drink would you order,haeba u ne u ka ba le seno se le seng sa moatlelete efe kapa efe ea papali ea lipapali tse tsoang na u ka be u noa le ho nwa
1451,to on winning the sports day cup,ho hlola ho hapa senoelo sa lipapali
1452,beyond the bun the many of the term hot dog,ntle le bun e ngata ea ntja e chesang
1453,my squad thanks for s sports _productions,sehlopha sa ka se leboha sports _productions
1454,i,i
1455,i know caffeine is a huge thing in sports,ke a tseba hore na caffene ke ntho e kholo lipapaling
1456,chance for smith from a corner over,monyetla oa smith ho tloha sekhutlong
1457,it is bad enough watching who make in all the other sports bitch and moan now we have doing the same thing,e mpe e sa lebelloang ea shebahalang ka ho lekaneng ea etsang linthong tsohle tse ling tsa lipapali tsa lipapali tse ling joale le rona re etsa ntho e tšoanang
1458,any sticker that is not either where their go to school or play sports,setikara se seng le se seng ha se moo ho eang teng sekolong kapa ho bapala lipapali
1459,those awe sweet,bao ba nang le monate
1460,a shot in the main event scene she s really,thunya ka mokhoa o moholo oa ketsahalo
1461,this is the last from ea so they can do it in ' with ea sports i do not understand why people it is not like ea was any better for the last decade or so their only improvement on the game is the create a club but that is a beta too missing a lot of,ena ke ea ho qetela ho ea ea kahoo ba ka e etsa le beta le ho feta
1462,_knight _daouda that s not how sports media works former turned almost always openly root for their former when is on you know he s for the is the and when wade comes on he with the heat,_kloouda
1463,in a twist worthy of the night could play a vital role in the conference s survival,ka mokhoa o tsitsitseng oa bosiu bo ka bapala karolo ea bohlokoa ho ea ho pholoha ha s pholohere ea pele
1464,_connect _sell peyton manning refractor and base plus shipping,_connect _connect _sell peyton mansing restorantor le base hammoho le shipping
1465,the and enter the all star break at all time high is now the time to bet on their _bainbridge the odds,the 'me u kenele ka nako eohle ea linaleli ka nako eohle e phahameng joale ke nako ea ho becha ka _bainbridge metlae
1466,four position to watch during training camp,boemo ba bane ba ho shebella nakong ea kampo ea koetliso
1467,it is definitely sky sports mate,ke ka nepo ke molekane oa lipapali
1468,i love,kea rata
1469,in the end sports will always be a business that does not mean i can not be about leaving at the peak of their value to the team it is like a leaving and saying it is not you it is me,lipapaling tsa ho qetela e tla lula e le khoebo e sa bolele hore nke ke ka tloha tlhōrōng ea boleng ba bona ho tloha sehlopheng seo ho ka se etsang hore ke 'na
1470,don t ever question my dedication to sports day i right across for,u se ke oa belaella boinehelo ba ka ha ke e-na le lijo tsa lipapali
1471,we are looking to recruit a general manager for a football in to apply please visit,re batla ho hira mookameli ea akaretsang bakeng sa bolo ea maoto ho etsa kopo ka kopo etela
1472,how to watch women is live streaming get live telecast of football match in,mokhoa oa ho shebella basali o phela hantle ho fumana tele ea bolo ea maoto papaling ea bolo ea maoto
1473,i honestly miss the this conference been a disappointment ever since is beyond garbage easily the worst commissioner in sports,ka botshepehi ke hloloheloa seboka sena e bile ho soetseha ho tloha ha ho na le likotsi tse ka ntle ho komiti e mpe ka ho fetisisa lipapaling
1474,_flood and that is a failure of the people at the top of the athletic department shame on them for not about badger sports being competitive,_flood le hore ke ho hloleha ha batho ba ka holimo ho lefapha la lipapali la lipapali
1475,segment judge is nightmare,moahloli oa setsi ke nightmare
1476,ravens defense in my fantasy then,ragens ts'ireletso ea ka ea pele
1477,_pau i thought that was just in general if i m being honest any sports game really,_pau ke ne ke nahana hore ke ka kakaretso haeba ke le papali ea lipapali hantle
1478,the sky locked up a berth with today is win over the storm,leholimo le koaletsoe ke sthth le kajeno le hapa sefefo
1479,thanks to all our and who came out today to support the in their sports days it was a fantastic occasion and was amazing to see so many enjoying themselves and will be posted in coming days,ka lebaka la rona le ba tsoang kajeno ho tla tšehetsa matsatsi a lipapali tsa lipapali e ne e le ketsahalo e monate ebile e le ntho e thabisang haholo 'me ba tla romelloa ka matsatsi a tlang
1480,the absolute value in itself value to the roster spot it s once these are beyond the first of control relative absolute value to be balanced i d say if do acquire the internal surplus value metric will be much more important,boleng bo phethahetseng ka boeona ba ka boeona ba le sebakeng sa pele ho moo bana ba nang le boleng bo lekanang le dit
1481,_sports we re a and pop shop luxury tax is the number concern,_sports re hape le lekhetho la popo e mabothobotho ke ntho e amehang
1482,yo that on one of the weird sports i have,ee ho e 'ngoe ea lipapali tse makatsang tseo ke nang le tsona
1483,could whistle at age and grew up around dial up s era pop music and born in the s first console was a super was a color aquamarine favorite sports are baseball and soccer did in grade school,a ka letsa matsatsi a ho letsa 'mino oa ho daela o tla ho feta' mino oa s e tlang 'me o hlahetse ho feta ha ho ne ho e-na le lipapali tsa' mala
1484,first big for world cup,pele ho kholo ea lefatše
1485,_ervin yes because multimillionaire sports are so hurting for every dollar they can get their on who know it is obviously on an individual basis i am not trying to condone to get a sig but suggesting it is for only is preposterous to me,_ervien e hobane lipapali tsa multimellion li utloisa bohloko haholo
1486,said he is up for the rebel backed series just after he was axed as europe is captain read,a re o na le letoto la letoto la marabele kamora hore a koahetsoe joalo ka ha a le naheng ea europe
1487,follow me for sports content daily,ntsela bakeng sa litaba tsa lipapali letsatsi le letsatsi
1488,imagine rocking up to your sons sports day and shelly up at the start line for the race,nahana ha o robala ho bara ba hau ba lipapali tsa bara ba hae le lebone le ipatileng moleng oa peiso bakeng sa peiso
1489,i m that the sport that i follow in with the other sports doing this exact same thing which is by the fact that i don t believe that the deal being struck with the devil is even going to be good for any of us the,ke ntho eo ke e latelang le lipapali tse ling tse etsang hore ntho ena e be taba e ts'oanang le 'nete ea hore ha ke kholoe hore ha ho na thuso ho ba teng ho mang kapa mang oa rona
1490,next month training cycle football return x week strength work to handicap golf grappling striking proficiency winter very possible to be the top in multiple sports simultaneously but i want top,khoutu ea khoele ea khoeling ea moqomo oa bohlokoa
1491,maybe you stick to sports,mohlomong u khomarela lipapali
1492,new food at some of these look a bit average is that potato but dessert i am in,lijo tse ncha ho tse ling tsa tsena li shebahala hantle haholo ke litapole empa li-sossert ke ho
1493,some people probably the super low because they think the is offensive the woke skewed the data t matter it s still the in pro sports,mohlomong batho ba bang ba tlaase haholo hobane ba nahana hore ke ntho e khopisang bomalimabe e sched ea data
1494,that s a cool sports field,le tšimo e pholileng ea lipapali
1495,i am so of he is put in a lot of work and dedication but he is just going to keep doing great in sports medicine i was happy to be his mentor for just short year and can not wait to see what he does next,ke joalo ka mosebetsi o mongata le boinehelo empa o tlo lula a etsa haholo moriana oa lipapali oo ke neng ke sa otelle ho bona seo a se etsang se latelang
1496,it will be a rare sports deal where substantially less money is for the than the deal it had before,e tla ba theko ea lipapali tse sa tloaelehang moo chelete e nyane haholo ea ho feta ea neng e ne e le teng pele
1497,this is why we love sports it is not about celebrity or and or won it is about connection,ke ka lebaka leo re ratang lipapali ha se taba ea ho labalabela ho ba haufi kapa 'me kapa ho hapile hore ke mabapi le khokahano
1498,casino finished product cross chain sports betting dividend every days mo lottery bet making power m deflationary supply,casino feela feela spons sona sland bette to aptirid letsatsi mona motty btt
1499,in your opinion which of these sports is the to predict forecast,ka maikutlo a hau ke hore na lipapali tsena ke tsa ho bolela esale pele
1500,_edge _sports you re negative it s situation you re a bit about and the pop culture that is t o probably top in league if not international a great cosmopolitan city with a booming sports scene,_edge _spor
1501,will join the sky sports f booth next season,e tla kenella lipapaling tsa leholimo tsa fals footh ya sekolo
1502,whose the now ha,eo hona joale e leng
1503,_sports _plc thank you coach,_sports _plc kea leboha
1504,if your youth sports and all the did was believe in them encourage them and demand the best from them your even if that coach was not a great coach those three trump great coaching,"haeba lipapali tsa hau tsa bocha, 'me tsohle li ne li lumela ho tsona' me li ne li ba khothatsa ebile li batla tse ntle ho tsona leha e le koetliso e kholo ea koetliso e kholo ea koetliso"
1505,nine by free,tse robong ka mahala
1506,news flash it won t be me winning it,litaba tsa flash lia hlola li tlama
1507,here s some stuff for sale from my marked waiting on for foil board add or _sell _ by all,mona s stuff ea thekiso e tšoailoeng ho ea ho e emela ho feta ea foil le _sell _ ke tsohle
1508,if men are alright with it they can use men s if not they can use third or unless they drastic to look sound male they are welcome to use s and participate in s sports as is the norm,haeba banna ba phetse hantle ka eona ba ka sebelisa mananeo a banna
1509,new client alert the one motive sports family is to announce that we have our client pape the c from graduated from southeastern in before starting his pro career with in welcome pape,tlhokomeliso ea bareki e ncha ea lipapali ke ho phatlalatsa hore re na le moreki oa rona ho tsoa ka leboea ho pelehi pele a qala mosebetsi oa hae
1510,super league and share the,super league 'me u arolelane
1511,for everyone looking for sports to watch today this of a game in less than,bakeng sa motho e mong le e mong ea batlang lipapali ho shebella kajeno ke ena ea papali ka tlase ho
1512,i never forget this on deadline i left to go home thinking it was over walk in is like t that amazing whoops good thing someone else was finishing the sports section that night,ha ke lebale sena ka nako eo ke neng ke e tlohetse hae ke ne ke nahana ka ho tsamaea ho tšoana le ho tseba hore na motho e mong o tla qeta karolo ea lipapali bosiung boo
1513,_de_johan also note they never divulge the writer it is always staff no idea if they are simply that also cover sports entertainment and news or actual,_de_johan hape ha ho mohla e hlalosang mongoli eo ho lulang ho eona ha ho na thuso haeba feela e jara boithabiso le litaba kapa litaba kapa litaba kapa litaba kapa litaba kapa litaba kapa litaba kapa litaba kapa litaba kapa litaba kapa litaba kapa litaba kapa litaba kapa litaba kapa litaba kapa litaba kapa litaba kapa litaba kapa litaba kapa litaba kapa litaba kapa tsa lithuto
1514,cause twitter is the drama zone of the it is all drama no way to it unless we use sub racist twitter drama personal life twitter drama sports twitter drama political twitter drama,sesosa sa twitter ke sebaka seo ho sona se ka se bapisoang le sona ntle le haeba re sebelisa subric ractor bophelo ba twitter drama twitter drama
1515,i m to sports by default yea the rest are doing well,ke ho bapala lipapali ka ho etsa lintho tse ling kaofela li sebetsa hantle
1516,once sports betting is legal arrowhead stadium will have a sports book in the stadium just like the and every other sports league around the world who legal betting and the are a min drive to downtown which times more to do,hang ha ho becha rached ha ho na le buka ea stated e molaong.
1517,must have had an office bet to see who could hire the excuse for a sports personality that the world ever seen was it,e tlameha ebe o ile a ba le bethe ea ofisi ho bona hore na ke mang ea neng a ka hira lebaka la botho ba lipapali tseo lefatše le kileng la bonoa ke lona
1518,sky sports and even bar _woodsy love them so it is all accepted when ever we sign someone over were a retirement home it is a sympathy vote as they can not win anything else,sky sports le bar _woodsy ba rata kahoo ha re sa le motho ea nang le kutloelo-bohloko joalo ka ha ba sa khone ho hapa eng kapa eng
1519,is it different team work building works well with team sports require a lot more individual creativity and decision making,na ke sehlopha se fapaneng sa ho aha mosebetsi hantle le lipapali tsa sehlopha li hloka ho ba le tsebo le ho etsa liqeto tse ngata
1520,_ provide to individual extra mil if player is top in can also provide individual like extra mil for winning if those were in the then maybe their all star t be the worst in sports,_ fana ka karolo ea motho ka mong haeba sebapali se holimo ho sona se ka fana ka motho ka mong hore a be le 'mila ka nako eo.
1521,challenge should expand to expect state to stay dominant,phephetso e lokela ho holisa ho lebella hore e lule e le matla
1522,already available,e se e ntse e fumaneha
1523,and s in madden,le s ho madden
