,src,trg
1468,people want you to be pliable and not stand up for yourself or be persuasive like that s all it is right people hate confident and see them as threatening problematic,batho ba batla hore o pholohe mme a se ke oa emela kapa ba tiisetse joalo ka sohle seo batho ba nang le sona ba hloileng ba nang le mathata a benyang
1469,since you want to be persuasive and can not take no for an answer,kaha o batla ho ba le tšusumetso mme o se ke oa hana karabo
1470,so if we are abiding by his logic we also need to re involve the when men testify who maybe it will be even more persuasive than under perjury,"kahoo, haeba re se re le joalo ka tšusumetso ea hae re hloka ho kenyelletsa ha banna ba paka eo mohlomong e tla ba tlasa perjury"
1471,so is this the new tactic of the accuse people of find litigious ways to get rid of the competition if only they had persuasive maybe they d be with competition the media along with the too pathetic,kahoo ke taba e ncha ea batho ba qosang batho ba nang le mekhoa e metlae ea ho tlosa tlholisano haeba feela ba ne ba susumetsa mebuana eo ba e ratang haholo
1472,oh her love easily her hand up to pet those of jet she is ever of comforting scratches along their scalp his response her smile glad to hear that you re on board i am not sure of my persuasive ability but i was prepared to try,oh moratuoa oa hae o sebetsa ka matsoho a hae ho ea ho ba jeti e tšelisang
1473,the angle where your point might be most persuasive is that economics simplistic assumption about consumer behavior that often does not hold as seen in retail electricity,angle moo ntlha ea hau e ka ba e susumetsang haholo ke bothata ba moruo bo sa lumellaneng le boits'oaro ba bareki boo hangata bo sa kang ba bonoa ho motlakase oa thepa
1474,way too often our very cannot sustain life and our nation s maternal mortality tragically bare that out bear that out and until life is perfect we will kill our own is not a persuasive argument,nako le nako ea rona haholo
1475,it s not technically open but i notice that i don t see persuasive that it s effectively closed how do we account for the significant increase in to enter and wait for their hearing not an expert but it like our asylum are being,ha ho buloe hantle empa ke bona hore ha ke bone ho susumetsa hore re koaletsoe ke karolo ea bohlokoa ea ho kena eseng setsebi empa se tšoana le setsebi sa rona se ntse se le teng
1476,_hibax oh i bet i can be persuasive,_hhibax oh i bet i bet
1477,keep it simple a simple writing is persuasive b write shorter don t write like you write a write like you talk b say it out loud and write what good,e boloke e le bonolo ho ngola ho bonolo ho susumetsa ho ngola ha ho thoe u ngola joalo ka ha u bua ka ho ngola u le molemo
1478,ah nameless that just happen to parrot government talking very persuasive,ak o sa tšoanelehe feela hore ke 'muso oa papatso o susumetsang haholo
1479,happy birthday to the assertive outstanding persuasive entrepreneurial resilient woman in the world god bless,letsatsi le monate la tsoalo ho mosali ea ikhethang o khothaletseng oa rerepreneriary ea aterese e nang le tumello ea molimo oa lefatše a hlohonolofatse
1480,they are not going to apologize or make when start dying because their are not to save them either they know that is a consequence it is not persuasive,ha ba na ho kopa tšoarelo kapa ho etsa ha ba qala ho shoa hobane ba se ke ba ba pholosa hobane ba tseba hore ke phello eo ha e susumetse
1481,a can of compressed air could probably be pretty persuasive,ho ka ba le maemo a hatelletsoeng ho ka ba le tšusumetso e ntle
1482,blame it on the city that raised me so god damn persuasive,e molato toropong e ntšosang kahoo molimo a susumetsa molimo hore a behe
1483,i thought i d be voting for in the final round but this is very persuasive leaning now toward truss,ke ne ke nahana hore ke vouta sebakeng sa ho qetela empa sena se na le tšusumetso hona joale ho trust
1484,from a liberal media hearsay and cherry picked conversation is not very persuasive who will cross examine i hope,ho tsoa ho mecha ea litaba ea liberal hearway mme moqoqo o khethiloeng ha o na tšusumetso haholo ho tla tšepa hore ke ts'epa
1485,i found this piece very persuasive,ke fumane karolo ena e susumetsang haholo
1486,are more persuasive and by a man is humor than by his beauty,ba susumetsa haholoanyane ebile ho monna ha a qaboloe ho feta botle ba hae
1487,_ why persuasive was my favorite video to wake up to,- hobaneng ho susumetsa e ne e le video eo ke e ratang haholo ho tsoha
1488,our kindness may be the most persuasive argument for that which we believe remember before video war was not a thing,mosa oa rona e ka ba khang e tiileng ka ho fetisisa eo re lumelang hore o tla hopola pele ntoa ea video e ne e se ntho
1489,_daum for the pro side darling would be a good choice she done at least one related debate i know of and she extensive experience in the industry she is articulate persuasive honest and a master is degree and she is an ex librarian,_daum
1490,be more persuasive engage in proper discuss not rant complain or judge,ho ba le tšusumetso e eketsehileng ho buisana ka nepo ho se tletleba kapa ho ahlola
1491,i m not sure i m a female and i m by behavior in giving testimony or walking up they are fragile and hysterical instead of persuasive i don t want them acting like men but rather in the face of challenge being self possessed smart and bold,ha ke na bonnete ba hore ke mosali 'me ke na le boitšoaro ba ho fana ka bopaki ba ho fana ka banna empa ho e-na le hore ba tsebe ho phela le bona
1492,i am very to go to the concert in next week but trying to convince myself my mask would keep me safe for the whole show but i m not being very persuasive and my poor pitiful sternum i m going to need sigh but stray,ke tlameha ho ea konsareteng bekeng e tlang empa ke leka ho itšehla thapo ea ka e ka 'na ea susumetsa pontšo eohle empa ha ke na ho susumetsa le ho kheloha ho feheloa empa ke khelohile
1493,i am sympathetic to that truss will give him a job will not m does not need the money but red and are very persuasive,ke na le qenehelo ea hore truss e tla mo fa mosebetsi o ke ke oa hloka chelete empa e khubelu mme e susumetsa haholo
1494,of all the leadership growth that business say they want to work on emotional intelligence is at the top of the list,khōlo eohle ea boetapele eo khoebo e reng ba batla ho sebetsa ka mokhoa oa ho sebetsa ka maikutlo e ka holimo lethathamong la lenane
1495,unfortunate i have some persuasive for service in as there is some complexity to to reflect the cost of product weekly menu is not practical at all i do not feel like this is that it is just extra,ka bomalimabe ke na le tšusumetso bakeng sa ts'ebeletso e teng kaha ho na le ho rarahana ha litšenyehelo tsa thepa ea beke le beke ha ho na taba ena
1496,i got a physics t like i do but not physicist what are the most persuasive for it i think he t really like resistance and it t work for,ke na le fisiks t joalo ka ha ke e etsa empa u se na fisiti e reng
1497,_ perfectly put could actually make some more persuasive as they have to lay it all out if they want to get their point across,_ ka botlalo ba ka ba le tšusumetso e eketsehileng kaha ba tlameha ho e beha hohle haeba ba batla ho fumana ntlha ea bona
1498,no guy a point if your persuasive metaphor summons bad it is a bad metaphor left are racist used to be good before black crime ruined them it is bad salesmanship,ha ho na motho ea nang le taba ea hore na metaphor ea hau e tiisitsoeng ke papiso e mpe ke racist e se nang khethollo ea molao pele ho tlolo ea molao
1499,_ you are thinking about it way too hard i was the term broadly as persuasive of and thought to provoke insightful that is certainly what is happening here but keep trying to tear me down it is almost working i also did a,"_ o nahana ka eona ka tsela ena, ke qalong feela ke susumetsang ho susumetsa ka kutloisiso ena empa o batla o ntse o sebetsa le nna"
1500,my keeper persuasive essay,mohopolo oa ka o khothalletsang
1501,the only persuasive argument against starting over from scratch is that the political class as currently would absolutely make something even worse,phehisano feela e susumetsang khahlanong le ho qala ho tloha qalong ea ho tloha qalong ke hore sehlopha sa lipolotiki hona joale se ka etsa hore ho be le ho hong ho hobe le ho feta
1502,if like a nightmare listen to the latest from his guest _ a persuasive case that the is the world s life raft for a future with individual,haeba joalo ka sephiri se mamelang morao-rao se tsoang ho moeti oa hae _ ke nyeoe e susumetsang ea hore bophelo ba lefatše ba lefatše bo etetse nako e tlang
1503,basically i suspect the argument  nothis technique people to sublimate their innate nature to fit in at the expense of their long term well being' is as horrific or persuasive as it ought be when the majority of people have that concept into them from birth,ha e le hantle ke belaela taba ea hore na ke manono a nothis ho hlahisa sebopeho sa bona sa ho ba le bothata ba nako e telele 'ha batho ba bangata ba le motle ho bona ho tloha ho bona
1504,is interested in moral and persuasive and how they influence consumer behaviour the the psychological behind how make,e thahasella boitšoaro bo botle le bo susumetsang le kamoo ba susumetsang bareki ba bareki ba nang le kelello e ka etsang hore
1505,the problem gap and hook approach to writing a persuasive introduction to research,bothata ba bothata le ho hokahana le ho ngola kenyelletso e susumetsang ea lipatlisiso
1506,_db_knot _mac we have you even considered s strong evidence based argument of no he s not i m not listening and you re a bot it s actually very persuasive,_db_knot _mac
1507,how people with high emotional intelligence use the 'check rule' to become extraordinarily persuasive there is a saying in the military check your it basically remember to look behind you it comes originally from the,batho ba nang le bohlale ba maikutlo bo phahameng ba sebelisa 'molao oa tlhahlobo' o khanyang ho na le polelo ea sesole seo e tla hopola ka mor'a moo ho tsoa
1508,of course it did i m very persuasive,ehlile na ke ne ke susumetsa haholo
1509,persuasive power most similar to influence a power without their stance on something when one is very effective the other superficial the two are very similar but ultimately there is not much difference between the two,matla a susumetsang haholo ho susumetsa matla ntle le maemo a bona ha motho a sebetsa hantle haholo empa qetellong a sa na phapang pakeng tsa tse peli
1510,instant classic,instant instant
1511,never underestimate the persuasive power of a tiny army of,le ka mohla u se ke ua nyenyefatsa matla a susumetsang a lebotho le lenyenyane la
1512,often find this persuasive in the right direction when said request is made,hangata fumana ntho ena e susumetsoa ka lehlakoreng le letona ha ho buuoa kopo
1513,very good resource to help aid in conversation and persuasive dialogue,sesebelisoa se setle haholo ho thusa thuso ha moqoqo le puisano e susumetsang
1514,_gerardo justice more like just us guise it is almost as if the idea of a more egalitarian society them physical pain even if it would directly benefit them still pointing out the hollowness of the argument might prove persuasive to those prone to self reflection,toka ea _ggrardo e tšoanang le rona feela e nang le eona e batla e le hantle e le hore e se ba phethoe ka ho toba khahleho ea ngangisano e ka ba e susumetsa ho ba bonolo ho itlhahisa.
1515,this t about anyone i m willing to listen to any persuasive argument that abort up to birth but all i hear is you have a penis and need to shut up i never well to that kind of debate,sena se lakatsa ho mamela ngangisano efe kapa efe e nang le mabaka empa sohle seo ke se utloang ke hore u se ke ha u koaela.
1516,persuasive manner read i think so as far as right _,mokhoa o susumetsang ke nahana hore ke nahana joalo ka ho fihlela ka ho le letona _
1517,check out my gig on i will do urgent essay writing,lekola gig ea ka ho tla etsa ho ngola moqoqo o potlakileng
1518,is this screed persuasive to anyone who is not already in the camp he is basically there is not enough grist for her partisan to attack her he the same cherry picked over and over to prove the point,ke ho susumetsa mang kapa mang ea seng teng kampong eo a sa etseng hantle ha a sa le monyane oa ho mo hlasela le ho feta ho paka ntlha
1519,my son made a persuasive argument on why he needs new,mora oa ka o ile a pheha khang ka hore na ke hobane'ng ha a hloka mocha
1520,if you have not this space you are missing a lot is a persuasive speaker he is trying to convince is that should be built on the network if it will be considered safe done a great job this space,haeba ha u na sebaka sena u se na chelete e ngata ke sebui se susumetsang hore se kholisa khokahano ea sebaka sena
1521,_bewley very persuasive,_bewley ho susumetsa haholo
1522,bridge go crazy,bridge o ea hlanya
1523,they advocate teaching g i found their argument persuasive be interested in your take,ba buella ho ruta g ke fumane khang ea bona ea hore na ho na le mabaka a susumetsang hore u thahaselle ho nka
1524,_rosenberg excellent interview really illuminating and a completely fresh slant with fascinating of historical fact and persuasive insight thanks,puisano e ntle haholo e hlile e bonesa le ho hlasimoloha ka botlalo e nang le taba ea nalane le temohisiso e susumetsang
1525,trying to be persuasive,ho leka ho susumetsa
1526,i think leadership entirely too much time working on how poll trying to move the needle in what the polling is they have many persuasive but just don t make them,ke nahana hore boetapele bo boholo haholo ba sebetsa ka nako e ngata ba sebetsa kamoo ho ka ba poloko ho leka ho tsamaisa nale ho seo ba nang le tšusumetso empa se sa setse
1527,tops of its people not by persuasive it s _,litlhare tsa batho ba teng eseng ka ho e susumetsa s _
1528,i have finally given in to the persuasive tactics of i have agreed to play war thunder tonight we are going live in min and aside from it is my first time chat please no bully,qetellong ke inehetse manong a susumetsang a ka susumetsang ho bapala thuma ea ntoa bosiung bona re tla phela ka metsotsong le ka thoko ho qoqa ka kopo
1529,with his powerful new book praying with the enemy first amendment scholar made a far more persuasive argument for than any legal brief ever could have read stand is book review here,ka buka ea hae e ncha e matla e rapela le serame sa pele se ileng sa etsa hore ho be le ngangisano e susumetsang ho feta kamoo ba ileng ba bala ka eona mona
1530,_abramov that is a persuasive argument,_abramov eo ke phehisano e susumetsang
1531,me because i use and logic in a persuasive yet not overly aggressive manner to contrast the difference in party ideology,ka hobane ke sebelisa le ho rala ka mokhoa o susumetsang empa ha ho na mokhoa o mabifi ho fapana le phapang e kholo ho fapana le phaello ea mekha ea mekha
1532,i am sure the original text for this message from to don was a bit more persuasive,ke na le bonnete ba hore mongolo ona oa pele oa molaetsa ona o tsoang ho don o ne o susumetsa le ho feta
1533,if the author to make the point more persuasive she could have chosen the more intelligent twin to chain herself to a tree was the less serious more emotional one always getting into mischief,haeba mongoli a susumelletsang haholoanyane a ka khelosa limakasine tse bohlale ho ikoahlaela sefateng ka mokhoa o tebileng maikutlo a tebileng a maikutlo a mangata a kenang hampe
1534,is a statement of fact as confirmed by the government now it s so typical for to call racist on emotion instead of persuasive argument built on,ke polelo ea 'nete e netefalitsoeng ke mmuso hona joale ho na le tloaelo ea ho bitsa khethollo ho e-na le ngangisano e susumetsang
1535,curiosity you need to learn about the product you are selling so that you can write persuasive content finding its and distinctive selling is necessary,bohelehele u hloka ho ithuta ka sehlahisoa seo u ka se rekisang e le hore u ka ngola litaba tse susumetsang tse hlokahalang
1536,very persuasive argument i hope you do not because only someone truly evil would wish something like that on another then again here you are infanticide so what do i expect,ngaka e susumetsang haholo ke ts'epa hore ha u na lebaka la hore motho a mobe a ka lakatsa ho tšoana le ho ba bang hape u le masea joale u lebelletse eng
1537,if you are going out tonight i am going out because i know you are persuasive,haeba u tsoa bosiung bona ke tsoa hobane kea tseba hore oa susumetsa
1538,due to the requirement to break up the platoon in the vicinity of most motorway as a safety precaution industry engagement the efficiency gain is probably less than would be persuasive to invest at present,ka lebaka la tlhokeho ea ho khaola setlama se haufi le bathusi ba bangata e le khoebo ea boitlamo ba polokeho e ka ba mabapi le ho tsetela hajoale
1539,yeah would be reluctant at first but him the smile and is very persuasive pran is like oh this is what it is like huh anyway it but eventually they both get insanely into it,ee e ne e tla ba ea tsitsang pele ho eena pososelo mme e susumetsa haholo pran e joalo ka eona e joalo ka hih leha e le joalo ka bohlanya bona
1540,be persuasive and tell them how you had already fixed it and its weird and not your fault,khothatsa 'me u ba bolelle hore na u ne u se u le hlophisitse joang le ho makatsa ha tsona ebile ha se phoso ea hau
1541,you made no persuasive as to why we should let russia take over,ha ua ka ua susumetsa hore na ke hobaneng ha re lokela ho lumella russia hore u nke
1542,ah the old ad how persuasive,ah papatso ea khale e susumetsang hakae
1543,annals of under artificial legal for the of winning internal status failing hard when as outward facing persuasive rhetoric oh no we no longer have the social technology to change course the ship is,libuka tse tlasa molao tsa maiketsetso bakeng sa boemo ba boemo bo hlolang bo sa tsotelloe ha a le ka ntle ha a ntse a tobane le theknoloji ea boithabiso ho fetoha
1544,now that s a persuasive persuasion perfect casting subtle direction wonderful music beautiful,hona joale ho na le tšusumetso e susumetsang e nang le 'mino o potelletseng oa' mino o motle haholo oa 'mino o motle
1545,i have just the persuasive writing accelerator here,ke na le mokhoa o susumetsang oa ho ngola
1546,from have the power to create interest and drama from even the driest data when you tell a good story you can teach inspire inform or be persuasive,ho tloha ho ba le matla a ho theha thahasello le pena e tsoang ho data e kholo ha u bua pale e ntle u ka ruta ho khothala kapa ho susumetsa
1547,it also that intolerant are more persuasive than intolerant i disagree,e boetse e mamella ho mamella ho feta ho mamella hore ha ke lumellane
1548,is one of the least persuasive people ever to appear on i do not recall ever hearing him saying something that was true,ke ntho e 'ngoe e susumetsang e kileng ea hlaha e le hore ke se ke ka mo hopola ke mo utloa a bua ho hong
1549,you are a true influencer with such persuasive,u thothokiso ea 'nete e nang le tšusumetso e joalo
1550,i that mostly non verbally but when they and their get into a sticky situation they open their mouth and suddenly say the most charming persuasive stuff ever to get them all out of it and it works every time,"ke sa bohlokoa haholo empa ha bona le bona ba kena maemong a khutšoane 'me ba bua ka tšohanyetso ea bona,' me ka tšohanyetso ba re kaofela ha bona, 'me e sebetsa nako le nako"
1551,i put you in touch with my let s just say they offer a certain community security in like this they may be of service to you and can be quite persuasive,ke u kenya ka ho re ba mpa ba re ba fana ka tšireletseho e itseng ea sechaba ho kang ena ba ka ba le taolo ho uena mme ba ka susumetsa haholo
1552,theres no oppressive group i hate more than literally the of the but at the end of the day they are still people that we coexist with and be much more persuasive of your talking if you hear their world,ha ho na sehlopha se hatellang.
1553,a is younger more violent a better liar more sickly persuasive as well as more fully engaged with who are jointly acting to utterly destroy democracy,a e nyane e monate e nang le tšusumetso e ntle haholo ka mokhoa o hlakileng le ea kopaneng le mang ka mokhoa o kopanetsoeng le hore na o sebetsa ka mokhoa o kopaneng oa ho senya demokrasi
1554,the persuasive power of perfume cannot be,matla a susumetsang a setlolo a sa khone
1555,is persuasive and not binding which kind nonsense get se next president can still ban it e ti ya were gan,e na le tšusumetso 'me e sa kholoe hore na moplaisi ea mofuta o mong o ntse o batla mopresident o latelang o ntse o ka thibeloa e ti ya ya ya ya ya ya ya ya ya ya ya ya ya ya ya ya ya ya ya ya ya ya ya ya ya ya ya ya ya ya ya ya ya ya ya ya ya ya ya ya ya ya ya ya ya ya ya ya ya ya yai
1556,_kalla font is tiny on that image but it is the same one you cite when you get to canvas,_kalla font e nyane ka setšoantšo seo empa ho tšoana le uena ea qosang ha u fihla ka seile
1557,knowledge in persuasive it s _,tsebo ea ho e susumetsa s _
1558,my and research include the persuasive and effects of immersive and participatory and exploring real world and positive through emergent narrative ken,ea ka le lipatlisiso li kenyelletsa tšusumetso le litlamorao tsa ho qoelisoa le ho hlahloba lefatše la 'nete le ho hlaka ka shoacent skar
1559,business at all can enhance their persuasive by the craft of the pitch successful foster,khoebo ho hang e ka ntlafatsa tšusumetso ea bona ke bohlanya ba ho se atlehe ho atlehile
1560,you are so persuasive non evasive with my running estate i never rectify what is right when i recalculate and this is love yeah i would be willing to bet you write another love song and i will break it down into edible little,u ka susumetsa haholo
1561,persuasive to use you money save new easy proven guarantee,tšusumetso ho u sebelisa chelete e boloka netefatso e ncha e netefalitsoeng
1562,huh i assume you don t believe in street lighting as a crime deterrent locking if it t work of the time it s not worth doing is not exactly a persuasive argument,huh ke nahana hore o lumela ho mabone a seterateng joalo ka ha ho na le nako ea botlokotsebe haeba e sa tšoanelehe ho etsa joalo eseng ntho e susumetsang maikutlo
1563,how people with high use the 'check rule' to become extraordinarily persuasive it can make a big difference in how you lead and whether other people are likely to follow,kamoo batho ba nang le 'molao oa ho hlahloba' molao oa ho hlahloba o ka etsa phapang e kholo ho tsela eo u e etellang pele le hore na batho ba bang ba ka latela
1564,that is their only strength they can hurl any insane lie and it so much effort just to untangle their nonsense the extra effort yo debunk is less persuasive to uninformed this only works because they control many of the i call it the mesh,eo ke eona feela matla a bona a ka khopameng le leng le le leng la bohlanya le boikitlaetso bo bongata ba ho se sebetse hantle hobane ke li bitsa mesh
1565,that is the last thing i of them they are big and that is why the price is dumping so i never back but this thread is pretty persuasive,"ke eona ntho ea ho qetela eo ba e ratang ka eona, ke ka lebaka leo theko e akoang kahoo ha ke so khutle empa thaere ena e susumetsoa ke eona"
1566,_ahg _studio i think you make a very persuasive argument dale at through that perspective there is a strong case for to land on both the individual,_ahg _studio
1567,the persuasive writing style needs the writer to blend research and analytical reasoning with an emotional connection that the reader to embrace the writer s subjective,setaele se susumetsang se hloka hore mongoli a be le mabaka a bokolla le tlhahlobo le khokahano ea maikutlo eo 'mali a ka e amohelang mongoli
1568,persuasive writing style persuasive writing is used to influence the reader to do what the writer them to do,ho ngola ka mokhoa o susumetsang ho sebelisoa ho susumetsa 'mali ho etsa seo mongoli hore a se etse
1569,in short the argument is not only more permeable throughout the party but more also persuasive to them,hakhutšoanyane khang ha e lumelloe feela moketjaneng empa hape e le hore e lule ho eona
1570,a pretty persuasive case study,thuto e ntle e susumetsang
1571,also at same cog for as gullibility study not pub would in journal yet found similar overall but not so much for huge persuasive lower in open minded thinking too,"hape ka cog ea hau e sa tsoakoang ha e le hantle, e se ke ea putlama ka bongata empa eseng haholo bakeng sa monahano o matla oa kelello"
1572,given that i can be a very persuasive writer and have a lot of esoteric i really out on the easiest life path of big brain guru futurist artist,ha ke fuoa sengoli se susumetsang haholo 'me nka ba le litšepe tse ngata tseo ke li ratang ka ho fetisisa tsa bophelo ba boqapi ba big bocina guru fatruist
1573,this is persuasive and essential reading before our nation from lack of interest and just before we engage in our second civil war,sena ke ho bala ka nepo pele ho sechaba sa rona ho hloka thahasello mme feela pele re etsa ntoa ea rona ea sechaba
1574,even his gesticulation is so obviously fake and consciously affected because he it is persuasive it him look cool i do not know why but it is obviously that talking with his is not something he does normally or that comes naturally,"le ka ho hlaka hore ke ho hlaka hore ke 'nete ho hlakile ebile ka letsoalo le amehile hobane oa susumetsa hore a utloe eka ha a shebahala a pholile, ha ho bolele hore o bua le eena ka tlhaho"
1575,yes we knew that specifically made a public show of over it in and he was obviously not alone in that sentiment no one a direction to engage in violence by trump mind reading is not persuasive,"ho joalo, re ne re tseba hore ho hlakile hore ke pontšo ea sechaba ka eona mme ho ne ho se joalo, ha ho na motho ea ikemiselitseng ho bala pefo ka pefo ka pefo."
