,src,trg
310,i d be mad but it would also be one of the in history if they gave that big farewell and then he,ke hlanya empa hape e tla ba e mong oa historing haeba ba ne ba fana ka mokhoa o moholo ebe oa bona
311,that is an excellent idea maybe have to say farewell to,ke mohopolo o motle mohlomong o tlameha ho bua leshano ho
312,zero reason to include a retirement farewell in a home run derby contest does nothing for the game,lebaka la zero ho kenyelletsa ho tlohela mosebetsi ho tloha sebakeng sa derby seleng ha se letho bakeng sa papali
313,we not here for this he not on a or level to where we need a farewell send off i t say it but,ha re mona bakeng sa sena ha se ka kapa se maemong a moo re hlokang mokhelo oa hau o e buang empa
314,it s real you scroll down on the from his farewell post you see it in the end,ke oa 'nete hore o theotsoe ho tsoa ho poso ea hae ea ho e bona qetellong
315,i m cool on this he not on the level of or to where i see a farewell type derby,ke pholile ho sena eseng boemong ba kapa ho ea moo ke bonang mofuta oa mofuta o monate
316,coach k farewell tour,coach k farewell tour
317,re eisenhower is farewell speech on the military industrial complex and it is geopolitics not human that is the guide check with who the against a repeat in the regime in,reisenhower ke puo ea sesole sa sesole mme ke geopolitics eseng motho eo ke mang ea tšoanang le ea ho pheta-pheta pusong
318,he s actually coming back for a proper farewell so hopefully he t lying,o hlile a khutla bakeng sa mokhoa o nepahetseng o ts'epa hore o bua leshano
319,farewell to the machine long live the goat,farewell ho mochine long e telele ho phela poli
320,_ he s actually coming back for a proper farewell,_ a hlahella ka nako e loketseng
321,_rl he s actually coming back for a proper farewell,_rl he s e khutla ka mokhoa o nepahetseng
322,not getting a farewell tour is crazy,ho se be le leeto la bohato
323,saw the script finishing with and every other player is let win just to be nice and respect his farewell tour,ke bone sengoloa se qetang le sebapali se seng le se seng se tlohella hore se be monate le ho hlompha bophelo ba hae bo botle
324,damn man i m emotional better get a crazy farewell tour in the second half of the season,mahlo a matsoho ke mmino o khanya toropo ea boraro ho halofo ea bobeli ea selemo
325,many are upset at participation in the but all of baseball should be happy that it was a stop on the farewell tour,batho ba bangata ba utloile bohloko ha ba nka karolo ho bona empa kaofela ba baseball ba lokela ho thaba hore ebe ke ho emisa ho terwall ea hau
326,yea he s washed he s fam let him get his farewell tour,ee o ile a hlatsoa
327,farewell,farewell
328,i guess they b giving him a real farewell tour towards the end of the year,ke nahana hore ba mo fa lefapha la nnete ho isa bofelong ba selemo
329,no farewell message would be enough to let the know how i felt at the same time no farewell message was to make myself understood see you again it was a wish rather than a promise,ha ho na molaetsa oa ho tseba hore na ho na le molaetsa o tšoanang ho tseba hore na molaetsa o le mong o ne o lokela ho etsa joalo ho e-na le takatso e itseng ho fapana le tšepiso
330,what do i do to get and to perform farewell flesh at trinity of terror part,ke etsa eng le ho etsa hore ho be le nama e tsamaeang ka tsela e makatsang ka boea-bo-bong ba karolo ea tšabo
331,the farewell tour t feel nearly as gross as the one,tonakholo ea farewell e ikutloa e le haufi le e kholo joaloka e
332,deserved a farewell tour,e ne e lokeloa ke leeto la bohato
333,say you should listen farewell,e re o lokela ho mamela farewell
334,for all you young hockey and this is a wonderful interview back the curtain cut to the chase provided the correct unfiltered platform for s abrupt farewell well done,bakeng sa hockey sohle se senyenyane sa hockey mme ena ke lipotso tse ntle tsa ho roma lesira tse khaotsoeng ho lelekisa ho fana ka sethala se nepahetseng sa ho se sebetse hantle
335,_infosec _conrad _m a is just a fun farewell tour,_infosec _conrad _m a ke feela ho ba teng
336,i admit i t like being added to the i take it back watching him get a farewell tour is amazing,ke lumela hore ke tlameletsoe ho 'na ke mo shebile ho mo shebile a le motsamao oa hau oa ho rata
337,let s go put this old bum and his farewell celebration out of his misery,a re se ke oa beha bum ena ea khale le mokete oa hae oa ho tsoa botebong ba pelo
338,i love the farewell tour my favorite player all time really old now,ke rata moemeli oa hau oa hau ea ratehang hore ebe ke tsofetse ka linako tsohle
339,yeah it s on his farewell post,ee ke ea poso ea hae
340,is getting a hell of farewell tour,ho nka lihele tsa maeto a ho teba
341,this is well deserved not getting a farewell tour is criminal,sena se loketse ho se fumane leeto la hau la bosepa
342,under his farewell post,tlas'a poso ea hae e ntle
343,glad they gave him that moment since he is not getting a farewell tour,ke thabile hore ebe ba ile ba mo fa nako eo ha a sa fumane leeto la boea
344,he t have even been there i don t care about his farewell tour,o bile o bile teng ha ke ntse ke tsotella ho etela bophelo ba hae
345,part of the farewell tour,karolo ea leeto la bohato
346,hey any chance we can get a gift for and in their farewell tour been somewhat so far,"lumela, ho na le monyetla ofe kapa ofe re ka fumanang mpho bakeng sa leeto la bona la boarwell e ne e le ho ba hole haholo"
347,now leech farewell,joale leech farewell
348,how the is an all star the man is washed up and got a sympathy farewell vote good grief give the spot to someone who it,"ho hlatsoa naleli eo joang, 'me ea hlatsoitsoe' me ha e-ba le kutloelo-bohloko e monate ea kutloelo-bohloko e lula ho motho e mong eo"
349,maybe that s why you only have maybe it s your attitude but talking about your and grandma that way what a charm i would gather your is your hand but i bid your nastiness farewell troll,mohlomong ke hobane'ng ha u na le maikutlo a hau feela empa u bua ka ntate oa hau le nkhono ka tsela eo ke neng ke e botsa.
350,they should have just given a proper farewell tour,ba ne ba lokela hore ebe ba file tokelo e nepahetseng
351,farewell and adieu to you fair ladies,farewell le adieu ho uena basali ba batle
352,whoever said should of had a farewell tour this is your fault,mang kapa mang ea reng o lokela ho ba le takatso ea hau ea botšehali ena ke phoso ea hau
353,this farewell tour t gone well at all,tona ena ea boits'oaro e tsamaile hantle
354,i don t think it was a part of a tour they just two final in boston as part of their farewell in the hatch shell one broke a record for most people at an independent concert at over the are,ha ke nahane hore e ne e le karolo ea leeto leo ba tlala ho feta bokhelohi ba bona ba lets'oao la bona ho konsarete e ikemetseng e fetang
355,farewell hateful,o hloile lehloeo
356,y all set that old man up on his farewell tour derby,y bohle ba beha monna ea tsofetseng hore o phahamise makunutu a hae
357,farewell twitter for like,farewell twitter bakeng sa joalo ka
358,i feel like a ceremony this its not right that not a farewell tour like and did the a and never used to his long ass career a class act i dont get the disrespect for him by the,ke ikutloa eka ke moetlo ona ha ho nesetsa bophelo bo botle joalo ka ha ho ne ho se na ho ba le motho ea ka bang molao
359,twitter i got one thing to ask y all be town for the series so i need y all to give and wainwright the farewell tour they deserve standing and all that i usually don t ask this for the other team,twitter ke ile ka fumana ntho e le 'ngoe ea ho botsa yors bakeng sa letoto ka hona ke hloka hore o fane le hore o tloaetse ho kopa sena bakeng sa sehlopha se seng
360,time to cry through my childhood sports hero is farewell tour home run derby,nako ea ho lla ka mora oa ka oa bana oa bongoana ke ho lula leetong la hae
361,say a farewell to retiring herald,bua leshano ho tlohela ho tlohela herald
362,i kith her but she me,ke moith
363,yo stay safe from i met someone who literally me while i was pranking them stay safe is not safe i wish it was still the time when gross stuff on did not exist yet i am never visiting this scary site again farewell,"o lula o sireletsehile ho nna o neng a ntšetsa pele ha ke ntse ke ba qhekella hore e se ke ea bolokeha, ha ho mohla nkileng ka etela sebaka sena sa marang-rang"
364,i shall herald the end of humanity with the fire that the world farewell farewell mash,ke tla fella qetellong ea batho ka mollo oo lefatše o lulang o rata lesela la lefatše
365,reading a discovery of at request and so i will be the main guy as farewell,"ho bala ho sibolloa ha kopo ea kopo, ka hona ke tla ba moshemane oa sehlooho"
366,our shark farewell and adieu to you fair ladies,reare ea rona ea shark lediou ho uena basali ba batle
367,this is my last farewell to the legal community before i finally start a life tomorrow of clean break and my health,ena ke ea ka ea ho qetela ho batho ba molao pele ke qala bophelo hosane ea ho phomola le bophelo ba ka
368,bid you farewell pa pa pa pa gulping love to swallow it down pa pa pa pa two of us we sleep together lying down on dirty i get the feeling i m truly living,bid u na le pa pa pa para lerato hore e theole pa pa pa pa pa pa pa pa pa pa pa pa pa pa pa pa pa pa pa pa pa pa pa pa pa pa pa pa pa pa pa pa pa pa pa pa pa pa pa pa pa pa pa pa pa pa pa pa pa pa pa pa pa pa pa pa pa pa pa pa pa pada
369,he was going to have a farewell party but now it is over zoom because he does not think that sort of thing is appropriate at this point in an outbreak take note,o ne a tla ba le mokete oa mofuta o mongata empa joale ho felile hobane ha a nahane hore mofuta ona o loketse ntlha ena e hlokomeloa
370,his farewell to sa post on,mofumahali oa hae oa ho qala
371,i m watching late but guessing today is the farewell and starting next week it s gene time,ke shebelletse haufinyane empa ke nahana hore kajeno ke mokhelo le ho qala beke e tlang e ntse e le nako ea nakoana
372,i mean what he said is true but man why are you doing this under your farewell post this,ke bolela seo a se buileng ke 'nete empa ke hobaneng ha u etsa sena ka tlas'a nako ea hau ea hau
373,they told me to play her as cute as possible and i guess it was cute because i could hear the audience going during my solo at the end of so long farewell where my character was supposed to be cute and sleepy but looking back it s a little strange to me,ba ile ba mpolella hore ke ba mphete ka hohle kamoo ho ka khonehang mme ke nahana hore ho na le motho ea motle hobane motho oa ka e batla e le ntho e makatsang ho nna
374,many farewell in life more sad than to take leave is the last we said with a smile but know that in sight,batho ba bangata ba ikutloa ba hloname haholoanyane ho feta ho nka phomolo ke ea ho qetela eo re e buileng ka pososelo empa ea tseba hore
375,our local nick grieve along with the army at the loss of our beloved leader farewell and thanks for the over the i will wear that shirt tomorrow in your honor salute,bosiu ba rona ba lehae bo soabisoa ke sesole ka lebaka la tahlehelo ea moetapele oa rona le liteboho tsa ka ho feta moo ke tla ba le khopo
376,we will give him an equally and loving farewell every match he remains to play even bigger at home full stop,re tla mo fa mokhoa o mong le o mong oa ho bapala papali ka 'ngoe eo a seng a tla e bapala le ho feta ha a emisa hae
377,and enjoy lunch with pal so multiple bankrupt parasite and rabidly loyal ex wife of sex criminal the nonce formerly known as prince is a pal of the hypocrite and a philanthropist,'me u natefeloe ke lijo tsa mots'eare le pal e ngata haholo ea ho ba le mosali ea lilemo li ngata oa ho kopanela liphatlalatsong ea thobalano ke pampiri ea boikaketsi le philanthropist
378,so glad i get to see s th farewell your on your snap have a blessed night y all,ke thabetse hore ke tla bona s th
379,seeing the original on for probably the last time some people s already rolling out the new i m glad mine t so i was able to spot dash and bid a farewell to the young mascot,ho bona ho qala ka mohlomong ke nako ea ho qetela batho ba bang ba se ke ba bina ba ncha hore ke khonne ho bala le ho feta
380,farewell until we meet you again,farewell ho fihlela re kopana le uena hape
381,every year there is a similar case of going missing and now i pray the of will at least get to say farewell all these were so young and promising,"selemo se seng le se seng ho na le nyeoe e tšoanang ea ho tsamaea, 'me joale ke rapela e tla ba e tla ba e sa le monyane ebile e le ts'ebelisano"
382,no soup for us new york lunch stalwart hale and hearty closed all of its new york with no word on if or when they would reopen,ha ho sopho ea us new york royalwart hale le pelo li koalehile kaofela ha eona york
383,it is under his farewell to the on,ke ka tlas'a seo a se batlang
384,dusting off a classic here this is from aerith is farewell during the th anniversary event in it is the first mention of stamp what are your,ho theoha ha motho enoa ho tsoa aherith ena ho tloha ka nako ea selemo sa annivery ho eona ke ntho ea bohlokoa ka lekhetlo la pele
385,this guy is had more last than kiss had farewell,monna enoa o ne a qetile ho feta ho feta ho aka
386,it s not i the myself it s on his farewell post,ha ke na ho ea ka poso ea hae
387,well then i suppose this is farewell rear your pretty little head back around and i will have it removed from your neck got it,"hantle, ke nahana hore ena ke e-na le hlooho ea hau e nyane ho potoloha ebe ke tla e tlosoa molaleng oa hau o e fumane"
388,i dont want so say it out loud farewell song,ha ke batle hore ebe ke e bua ka pina e phahameng haholo
389,i could literally just listen to farewell to on repeat for,ke ka mamela feela ho mamela ho pheta-pheta ho pheta
390,pretty fine i am not super excited by any of the but i like it as a concept multiple coming together for flair is farewell,e ntle e ntle ha ke e-so tsoelepele ke mang kapa mang oa bona empa ke e rata e le mohopolo o moholo hammoho bakeng sa flair e sa le mokhelo
391,nice farewell season get maybe come off bench,nako e ntle ea bophelo bo botle e tla fumana bencheng
392,institute for government director maddox is farewell lecture what s wrong with s government must read lecture about the lying lack of skill lack of accountability and what to do about it,setsi sa motsamaisi oa mmuso madled motsamaisi oa 'muso o ntse o etsa phoso hore na mmuso o tlameha ho bala thuto ea mang le ho etsa eng ka eona
393,his farewell post to the you scroll down,post ea hae ea ho thella
394,she still rocking her bonding from her matric farewell to cut down,o ntse a mo sutumetsa ho tsoa ho eena ho tsoa ho matrice ea hae ho fokotsa
395,it s underneath his own farewell post not the,ke ka tlasa poso ea hae e sa reng
396,farewell unit,unit ea farewell
397,i just for a chance to see in las for his final farewell,ke batla monyetla oa ho bona ho las bakeng sa ho qetela
398,gave flair a perfect gift next night on raw he received a standing ovation in front of his whole family why the does flair feel the need to rewrite history again i would never understand but i hope the farewell match is a grand success,e file baphoso e phethahetseng bosiu bo latelang a fumana pheko e emeng ka pel'a lelapa la hae kaofela hore na ke hobaneng ha ke batla ho ba le katleho e kholo
399,alas mechanical patriot in order to preserve this perfect moment i blocked you it is just too precious an event to be by your impotent keyboard farewell,ela o ile a thibela barriotiot e le hore a boloke motsotso ona o phethahetseng ke u thibetse haholo. ketsahalo e lokelang ho ba ka mokhoa oa hau oa tlholeho
400,farewell faithful friend rest in you good doggo,motsoalle oa hau oa boraro oa ho phomola o phomotsa ho uena ntja e ntle
401,farewell,farewell
402,farewell post,post ea farewell
403,the goldcrest is farewell,goldcrest ke mokhoa o monate
404,the pink hotel is by turns a love story a social satire an elegy for the planet a farewell to the glamour of old and above all a morality tale i adore this review of the pink hotel i feel seen,hotel pink ke ka ho fetola pale ea lerato hore e be karolo ea bophelo ba khale bakeng sa ho falla ha hotele ea pink ke ikutloa ke bone
405,his farewell post scroll down,moqolo oa hae oa post ea prorewell e tlase
406,i wish the wind and the rain got wet and everything hey do you remember your first conversation you said there is a beautiful farewell i said is but different there was a beautiful farewell,ke lakatsa moea le pula e kolobileng le ntho e 'ngoe le e' ngoe
407,the about the are from his he that the are under the farewell video,bohle ba tsoang ho eena ba ntseng ba le tlas'a video ea hau
408,anyhow i apologize for a fine day farewell,leha ho le joalo ke kopa tšoarelo bakeng sa letsatsi le letle la letsatsi
409,farewell party,mokhahlelo oa farewell
410,seeing in the airport is the most farewell to thing ever the universe is funny,ho bona boema-fofane ke ntho e ntle ka ho fetisisa ntho e ka bang bokahohle bo botle bo qabolang
411,i have run my race as he nice farewell,ke tšoere morabe oa ka ha a le motle
412,the red panda koala video was revealing and sobering the claim that favored the was surprising maybe his farewell address was a recognition that he d the creation of the military industry complex monster but by then it had grown beyond his control,video ea red panda koala e ne e senola le ho tebileng polelo e neng e makatsa eo a neng a e-na le eona ea tlhokomeliso e rarahaneng
413,it s his farewell post on his account,ke ha hae ka poso ea hae ka akhaonteng ea hae
414,farewell,farewell
415,farewell,farewell
416,_asvpxg they both been over it for awhile and they been doing it for so long with the exact same format they might as well just do a couple farewell after this hiatus and move on it s,_svpxg kaofela ha bona ba ne ba e-na le eona nakoana 'me ba ntse ba e etsa ka nako e telele joalo ka sebopeho se le seng le ho feta
417,do you need a photographer over the weekend for a matric farewell shoot,na u hloka setšoantšo sa boikhathollo beke bakeng sa thupa ea matric ea matric
418,at league minimum year i d do it he d be happy to do a farewell tour here and i m sure he d understand his role as a second fiddle better now that he s made his dough,ha ke le selemo sa league ke thabela ho etsa mosebetsi oa hae mona mme ke utloa hore o hlama mosebetsi oa hae ha joale o entse hlama ea hae
419,it is on his farewell post you have to scroll for a while but he really said that the,ke ka poso ea hae ea ho tsamaea ka nako eo u tlamehang ho e tsamaisa ka nakoana empa ehlile o boletse hore
420,food city will be holding its farewell fiesta on ahead of the closure of its fox plaza location,motse oa lijo o tla be o tšoere fiesta e tsamaeang ka pele ho koaheloa ke sebaka sa lona sa fox plaza
421,there is no need to thank me i shall pray that you break through the unwritten of destiny and remember each other farewell,ha ho na tlhoko ea ho leboha hore ke tla rapela hore u robehe pheletsong ea nako le ho hopola hore e mong le e mong a na
422,at the time of final farewell to the owner the goat cried in such a way that heart the video will make them cry,nakong ea papatso ea ho qetela ho mong'a eona e ile ea lla ka tsela e tla etsa hore ba lle
423,i just to see in las for his final farewell,ke mpa ke le ho bona ho las bakeng sa pholiso ea hae ea ho qetela
424,big weekend at pro power said farewell to our and had an awesome camp experience so to all of the who took the time to come out and work with us _,beke e kholo ea mafelo a pro procory ho rona mme o na le boiphihlelo ba kampo ho bohle ba ileng ba nka nako ea ho tsoa le ho sebetsa le rona _
425,farewell tour,leeto la farewell
426,i just to see in las for his final farewell,ke mpa ke le ho bona ho las bakeng sa pholiso ea hae ea ho qetela
427,farewell to my childhood new will not see dash but i will remember these as blissful times,farewell ho bongoaneng ba ka bo bocha bo ke ke ba bona dans empa ke tla hopola tsena ka linako tse monate
428,i know roast me for this but come to the for a farewell tour,kea tseba bakeng sa sena empa u tle ho leeto la bohato
429,to take u back i guess i lied when i sang farewell nostalgia,ho u khutlisa ke nahana hore ke leshano ha ke sangolwall nostalgia
430,the last farewell r i p unbearably sad the of the terrorist attack on,ho qetela ho ho qetela r i pi e sa fetoheng ea tlhaselo ea bokhukhuni ho
431,and dog on a bicycle the only one without water gun farewell song,le ntja ka baesekele e le 'ngoe feela ntle le pina ea lithunya ea metsi
432,if i have never known the sore of farewell and pain of what else should i engrave on my mind,haeba ha ke tsebe ho tseba le ho utloa bohloko le bohloko ba eng hape eo ke lokelang ho e kenyang kelellong ea ka
433,farewell buddy,farewell buddy
434,in one way or another the border to be closed we have reasonable immigration another problem is the terrorist factor how many have come into the country to many no doubt it is biden is farewell to our country when he is gone and,ka tsela e 'ngoe kapa e' ngoe e tla koaloa ke bojaki bo bong ke hona ho tlileng ka ho hlaka naha ho ea pele a sa le naha.
435,farewell lunch for visiting student from _tsukuba_en who spent several with us exciting research on novel synergistic oral antibiotic against by and,mots'eare oa lijo tsa mots'eare bakeng sa ho etela seithuti ho tsoa ho _tsukuba_ ea ileng a qeta makhetlo a 'maloa ka patlisiso e tsoang ho li-arbiotic tse ntle ka ho fetisisa
436,i hate men so so much i truly cannot put it into anyways i am going to the dentist now farewell,ke hloile banna haholo ke sa khone ho e beha ka marang-rang ke ea ho ngaka ea meno hona joale
437,today was the big farewell my name is gone my wore black and my office is bare i will always my and send well to the next leader,kajeno e ne e le lebitso la ka le leholo lebitso la ka le se le tsamaile le ofisi ea ka ke tla lula ke tla lula ke le teng kamehla le ho romela moetapele ea latelang
438,johnson is government late night confidence vote via farewell tour ever longer than some great we are sick tired of hearing the from the,johnson ke mmuso oa ho itšepa oa bophirimela ka nako ea bophelo bo botle ka ho feta ho feta ho ho kula ha rona re kula ho tsoa ho
439,farewell karaoke is off we have karaoke we will do that later in the year i hope if the staff still want to come,farewell karaoke o lahleha karaoke
440,i just to see in las for his final farewell,ke mpa ke le ho bona ho las bakeng sa pholiso ea hae ea ho qetela
441,ha i saw that farewell post were down best team,ha ke bona hore ho na le poso ea boitlamo e ne e le sehlopha se hantle
442,this is farewell sherlock,sena ke sarelock sherlock
443,so if you have ever to buy of any of my you will have a chance soon it will be a mix of film and digital almost all the digital stuff will likely be music photography,"kahoo, haeba u ka reka ka efe kapa efe ea ka u tla ba le monyetla kapele e tla ba motsoako oa filimi le lijo tsohle tsa dijithale mohlomong li tla ba le lifoto tsa 'mino"
444,but you already said all of that before say farewell all you want will be in touch about child abuse and now have your yes i have some thanks to twitter,empa u se u boletse tsohle pele u re o batla tsohle tseo u li batlang u li kopang ka tlhekefetso ea bana 'me joale ke na le teboho ho twitter
445,i am not mad at all will not be by no one other wise you really do not care about what is going on so just make sure you have at least of food and water now i will say farewell,ha ke kholoe ho hang ha ho na motho e mong ea bohlale o sa tsotelleng se etsahalang haholo
446,lost in with battery farewell,lahlehile kahare le betri
447,bloomfield is farewell party been by the omicron wave previous for a rager have to a small gathering with no food and drink on most to attend via zoom,bloomfield ke mokete oa omicron o fetileng bakeng sa nako e fetileng bakeng sa ho bokelloa hanyane ntle le lijo le lino ka ho fetisisa ho ea ho ea ho ea ho zoom
448,neither should he had deserved a respectful farewell he would have received immense damage to both parliament the country the former place into disrepute many are very angry at a deceitful liar,"hape, ha aa lokela ho ba le tšenyo e kholo ea paramente naha eo pele e neng e le bohale haholo ka lebaka la leshano."
449,farewell farm dot matrix display,farewell farm det mattrix
450,no food or drink and a limited guest list at bloomfield is farewell tonight to restrict the spread of covid,ha ho na lijo kapa lino tse ngata tsa baeti ho bloomfield ke mokhoa o monate bosiung bona ho thibela ho ata ha sephara
451,a farewell to my city island i adore this island and will come back to this theme currently i am struggling with the city theme and how to make it the way i like so for now it is a loving farewell to this version of dream address,"ho rata sehlekehlekeng sa ka ke rata sehlekehleke sena, 'me ke tla khutlela tikolohong ena hajoale ke loantšana le sehlooho sa motse le mokhoa oa ho etsa joalo hona joale ke mokhoa o lerato oa aterese ena"
452,when bid farewell to before his final home game he said the transistor radio is what bound us together via,ha papatso e le pele ho papali ea hae ea lapeng e re seea-le-moea sa hae ke se tla re tlama hammoho ka
453,let s all give our thanks to the who the olden days of dash farewell to the original,tlohella sto bohle ho tla leboha ka matsatsi a bo-ona a hlahlamang
454,farewell my first friend my enemy,fana ka motsoalle oa ka oa pele sera sa ka
455,his latest final farewell at l,moputso oa hae oa morao-rao oa ho qetela l
456,farewell hello,hello hello
457,it was nothing but a mirage a farewell memento from this bizarre place that is beyond a shadow of a doubt merely a respite on my way to the,e ne e se letho haese memelinse ea hau ea ho tsoa sebakeng sena sa sebini se fetang moriti oa lipelaelo feela ha ke le tseleng e eang
458,farewell sweet pandemic prince national review,tlhahlobo ea national pandem field term
