,src,trg
534,setting my man gabi up for failure i see who you are sports i know your game,"stel my man in om te misluk vir mislukking, ek sien wie jy is sport, ek ken jou speletjie"
535,former retired from the,voormalige afgetree uit die
536,sports nation said it is actually pink,sportnation het gesê dit is eintlik pienk
537,the day after the all star game is the worst sports day of the year,die dag na die all star -wedstryd is die slegste sportdag van die jaar
538,th pitching performance _sports _ _patriot _base _coastal _scouting,th pitching performance _sports _ _patriot _base _coastal _scouting
539,that is my favorite national sports but you sure,"dit is my gunsteling nasionale sportsoorte, maar jy is seker"
540,won the by the football from change sports please you are embarrassing yourself,"wen the by the football from change sports asseblief, jy verleë jouself in die verleentheid"
541,missing your sports fix today come join me on a deep dive of the top in all of baseball in the mid season update of the prospect vault,"as u u sportoplossing vandag mis, kom saam met my op 'n diep duik van die bokant in die hele bofbal in die middelseisoen -opdatering van die prospect vault"
542,top anime sports,top anime sport
543,love it but you re not the first first sports team to trust in did pretty well so i m sure you be better for it,"hou daarvan, maar jy is nie die eerste eerste sportspan om op te vertrou nie, het redelik goed gedoen, so ek is seker dat jy beter daarvoor is"
544,hidden a bet of on dynamo to win copy the bet here free balance available here,"verborge 'n weddenskap van op dynamo om die weddenskap hier te wen, gratis balans hier beskikbaar"
545,after of every football on nights in my high school career and still do today football be my favorite sport huge thank you to for making a just for all of us to learn about sports that we re non sport people like me,"na elke sokker op nagte in my hoërskoolloopbaan en vandag nog sokker doen, is my gunsteling sport baie dankie aan dat u 'n net vir ons almal moet leer oor sport wat ons nie wil hê nie"
546,if you do like sports or not then this is for you d give mark some love because of the sporting they is the best one yet in,"as u van sport hou of nie, is dit vir u dat u mark 'n bietjie liefde gee as gevolg van die sportsoorte, is dit die beste een in"
547,really strong piece from stuff that is both specific to working in sports and more generally applicable working is a very good way to describe how are different in today is work world,"'n baie sterk stuk uit dinge wat beide spesifiek vir sportwerk en meer algemeen toepaslik is, is 'n baie goeie manier om te beskryf hoe verskil in vandag is work world"
548,hey there there s a new channel that _ just for to enjoy d i am so excited for each to be up go my favorite sports team via,hey daar is 'n nuwe kanaal wat _ net om te geniet d ek is so opgewonde dat elkeen my gunsteling sportspan via gaan
549,i love how you advocate so diligently for sports i m curious what you believe a media deal should entail what do you believe value is for that market,"ek hou van hoe u so ywerig vir sport voorstaan, ek is nuuskierig wat u glo dat 'n media -ooreenkoms moet behels wat u glo dat die waarde vir die mark is"
550,battle in bitter race to replace boston news weather sports,stryd in bitter wedloop om boston news weather sports te vervang
551,by been the official sponsor while _ the title of official apparel for the event at mid sports car course in,"deur die amptelike borg te wees, terwyl die titel van die amptelike klere vir die byeenkoms op die middelste sportmotorbaan in"
552,i really feel like this on ur sorry analytics but in sports for example there is nothing more right now than math to the exception of all else people and sports being the most important thing only this counterpoint,"ek voel regtig so oor u jammer analise, maar in sport is daar byvoorbeeld niks meer as wiskunde nie, want die uitsondering van alles anders is mense en sport die belangrikste ding is net hierdie kontrapunt"
553,senior dare off his career with becoming the first to earn scholar all recognition from,senior durf sy loopbaan uit met die feit dat hy die eerste een is wat die erkenning van scholar verdien
554,damn maybe he should find an agent that can afford a private jet net worth commission and salary is an sports agent who a net worth of million,verdomp miskien moet hy 'n agent vind wat 'n privaat jet networtkommissie kan bekostig en salaris is 'n sportagent wat 'n netto waarde van miljoen is
555,would be a huge mistake to leave the best sports arena scene of any city in,sou 'n groot fout wees om die beste sportarena -toneel van enige stad in te laat
556,i still can not get over the voluntarily they would rather have lock than at a like while in his prime is rare and it entirely everything about the,"ek kan nog steeds nie die vrywillig oorkom nie, hulle wil eerder 'n rukkie hê as 'n rukkie in sy prima, en dit is heeltemal alles omtrent die"
557,yo to the but i think we need to back this up one of the biggest most charismatic and sports of all time now the rave community not been as welcoming to coming from and also make work so hard,"yo aan die maar ek dink ons ​​moet dit een van die grootste charismatiese en sportsoorte van alle tye rugsteun, nou was die rave -gemeenskap nie so verwelkomend om vandaan te kom nie en ook so hard werk maak"
558,showcase game today at in seal beach aim sports new court elite,vertoonwedstryd vandag by in seal beach aim sports new court elite
559,be making me bread fam and i m a fan but personally i just love great sports so whoever on the best show,"maak my broodfam en ek is 'n fan, maar persoonlik hou ek net van goeie sportsoorte, so wie ook al op die beste vertoning"
560,_connect _sell upper deck one on one dual and dual card da shipped,_connect _sell upper deck een op een dubbele en dubbele kaart da gestuur
561,picture the all star game evolution of,stel jou voor die evolusie van die all star game van
562,_hockey don t feel bad the who are routinely as the best jersey in sports are apparently,"_hockey voel nie sleg nie, want dit is blykbaar die beste trui in sport"
563,firm _sell _connect,firma _sell _connect
564,our staff that we have at other championship sports like dawn and our women is basketball program we have shown you can win at south and we will continue to at the university of south,"ons personeel wat ons by ander kampioenskapsport soos dawn en ons vroue het, is 'n basketbalprogram wat ons gewys het dat u by south kan wen en ons sal voortgaan met die universiteit van suid"
565,thirty four after its inception murphy fair is high school football magazine is no more stepping into the void is _stew more on the new book,"vier en dertig na die ontstaan ​​van murphy fair is die tydskrif high school football nie meer in die void nie, is meer oor die nuwe boek"
566,_scanner sports are the best,_scanner sports is die beste
567,_edge _sports yeah just because he was born and raised in st t mean that factor into his decision look at hockey you re clearly speaking from a bias i disagree i think with his brother in is a better fit they d be pretty scary with all the young talent,"_edge _sports ja, net omdat hy gebore en grootgemaak is, beteken dit dat die faktor in sy besluit kyk na hokkie. talent"
568,we feel we feel like they are not listening to us the chief executive officer of the world governing body felt to hit out at the on at their glacial pace of working,"ons voel dat ons voel dat hulle nie na ons luister nie, die hoof uitvoerende beampte van die wêreldbeheerliggaam wat voel om na te slaan in hul gletserskap van werk"
569,sports all over their and just a constant on all of us this is the first time i legitimately considered finding a new team to root for i m sick,"sport oral oor hul en net 'n konstante op ons almal, dit is die eerste keer dat ek dit wettiglik oorweeg om 'n nuwe span te vind om te wortel vir ek siekes"
570,it s traditionally always on a so that get at least off and potentially start a new series on today is the most boring day of the calendar year no sports,"dit is tradisioneel altyd op 'n so dat dit ten minste af is en moontlik 'n nuwe reeks op vandag begin is, is die verveligste dag van die kalenderjaar no sports"
571,the most energetic of all as we celebrate our th anniversary to you for days of you screaming sports into exciting,"die energiekste van almal, terwyl ons ons th -jarige bestaan ​​vir u vir dae van u sportsoorte opwindend"
572,there is something so carnal about wearing a random printed shirt like this is a sports team i dont know this is a place i have never been to do not mess with yeah i sure hope you wouldnt,"daar is iets so vleeslik aan die dra van 'n ewekansige gedrukte hemp soos hierdie is 'n sportspan, ek weet nie dit is 'n plek waar ek nog nooit was nie, nie met ja nie, ek hoop dat jy dit nie sou doen nie"
573,no panic as its only season but its scary how much the quality with the second half speaking of quality dipping what is up with these premier sports too,"geen paniek as die enigste seisoen nie, maar dit is eng hoeveel die kwaliteit met die tweede helfte praat van kwaliteit doop wat ook met hierdie voorste sportsoorte gaan"
574,_sell grand,_sell grand
575,segment the of college football,segment die universiteitsvoetbal
576,i am here for the pizza chatter beer and weird also the sweet digs for awesome vintage sports gear,ek is hier vir die pizza chatter -bier en vreemd ook die soet grawe vir ongelooflike vintage sporttoerusting
577,only or earphone stereo bass audio noise waterproof sports headphone with type c charging,slegs of oortelefoon stereo bas klank geraas waterdigte sportkoptelefoon met tipe c -laai
578,they on the screen forever it up as a loss sports center the next morning before class they about it hit a square ball board on al the next week with a that was a lucky week,hulle op die skerm vir ewig dit as 'n verliessportsentrum die volgende oggend voor die klas. hulle het die volgende week 'n vierkantige balbord getref met 'n gelukkige week
579,great first panel at the sports betting conference i always get a tidbit here and there at industry but is a constant stream of interesting,"wonderlike eerste paneel op die sportweddenskapkonferensie. ek kry altyd hier en daar 'n tidbit by die industrie, maar is 'n konstante stroom interessante"
580,pro contract in the all star _ with the extending the lineage of in the pro,pro -kontrak in die all star _ met die uitbreiding van die afstamming van in die pro
581,_doctor u sure say he is not in the know,_doctor u sê seker dat hy nie in die kennis is nie
582,_sports b m but need to know that the ut athletic under _dannywhite is breaking a contract that ut wrote in it will do anything for a few more dollar is also in this you listening,"_sports b m maar moet weet dat die ut -atletiek onder _dannywhite 'n kontrak verbreek wat u daarin geskryf het, alles sal doen vir nog 'n paar dollar is ook in hierdie luister"
583,smart and flip the page from national title 'we will not be at uga',slim en draai die bladsy van die nasionale titel 'ons sal nie by uga wees nie'
584,football player cole retirement after suicide attempt 'it is to ask for help',die sokkerspeler cole aftrede na selfmoordpoging 'dit is om hulp te vra'
585,golf series cannot be taken seriously and no substance,gholfreekse kan nie ernstig opgeneem word nie en geen stof nie
586,napa sponsorship of chase,napa borgskap van chase
587,are you an too your knowledge on it me suspect you or a one is also a zebra warrior my me set with a sports doc from my last and i see that doc i see opinion cardiologist st me off my file only,"is u ook 'n kennis daaroor dat ek vermoed dat u of 'n een ook 'n sebra -vegter is, my me -stel met 'n sportdokument uit my laaste, en ek sien dat ek sien dat ek opinie -kardioloog net van my lêer af is"
588,new york training camp preview tight end,new york -oefenkamp voorskou styf einde
589,projecting the boston depth in the season,die projeksie van die boston -diepte in die seisoen
590,we had so many to take the lead and still lost,ons het soveel gehad om die leiding te neem en nog steeds verloor
591,_ftww your tweet was in an article by essentially sports,_ftww u tweet was in 'n artikel van wese sport
592,breeze past by up hat trick new wrap up series check full,briesie verby by up hoed truuk nuwe wrap up reekse check full
593,_connect _sell leaf dan dress for success game worn jersey shipping national dick night train lane biography game worn jersey,_connect _sell leaf dan dress for success game gesprek jersey shipping national dick night train lane biography game gedra jersey
594,just landed at park sports,net by park sports beland
595,the piece just at the athletic that the want to in a deal that s precisely the premise i with in this discussion of how the shape up,die stuk net by die atletiek wat die wil in 'n ooreenkoms is wat presies die uitgangspunt is waarmee ek in hierdie bespreking van hoe die vorm op is
596,yep i worked most of the summer at a indoor program without it was unbearable they need to have proper cooling if that s not possible shut it down it s just silly making do sports in this kind of weather,"ja, ek het die grootste deel van die somer by 'n binnenshuise program gewerk sonder dat dit ondraaglik was om behoorlike verkoeling te hê as dit nie moontlik is nie, dit is net dom om sport te doen in hierdie soort weer"
597,first do something wrong second keep it a secret third obfuscate once it been discovered fourth handcuff yourself to your desk and refuse to leave by kelly on the hockey canada scandal,eerstens iets verkeerd doen tweede hou dit 'n geheime derde verduistering sodra dit die vierde handboeie op u lessenaar ontdek is en weier om deur kelly op die hockey canada scandal te vertrek
598,_doctor that one cover face,_doktor daardie een dek gesig
599,aha apparently sports is a wide variety of stuff,aha blykbaar sport is 'n groot verskeidenheid goed
600,bittersweet return to stage but can not pull out a win,"bittersoet terugkeer na die verhoog, maar kan nie 'n oorwinning behaal nie"
601,i hate being a sports fan,ek haat dit om 'n sportfan te wees
602,we are brand new to twitter new small business amazing with customer satisfaction being our goal,ons is splinternuut op twitter nuwe kleinsakeondernemings verbasend met klanttevredenheid ons doelwit
603,just a reminder that august is the first official day for fall sports be sure to have your final and physical done before begin physical final,"net 'n herinnering dat augustus die eerste amptelike dag vir fall sports is, maak seker dat u finaal en fisiek gedoen word voordat u begin met die fisiese finaal"
604,no,geen
605,_rappaport i truly think the total number of minor league is a huge factor in this just the in baseball to other sports i think the easiest way to do this is incentive based across the you and i both know they all don t deserve the money they want,"_rappaport ek dink waarlik die totale aantal minderjarige liga is 'n groot faktor in hierdie net die baseball vir ander sportsoorte. ek dink die maklikste manier om dit te doen, is aansporing gebaseer op die u en ek weet albei dat hulle almal nie die geld verdien wat hulle wil hê nie"
606,sports fuel and primer line blue in,sportbrandstof en primerlyn blou in
607,san state picked for middle of mountain west pack in preseason poll,san state het in die voorseisoenpeiling vir die middel van die mountain west pack gekies
608,_doctor country go catch fire,_doctor land gaan vang aan die brand
609,how those pac night could help the conference survive em,hoe daardie pac -nag die konferensie kan help om hulle te oorleef
610,my family had a lake house in the and a pot of chili was always on the stove all summer long it just after a day of water sports,"my gesin het 'n meerhuis in die en 'n pot chili gehad, was altyd die hele somer op die stoof, net na 'n dag van watersport"
611,see here is the thing you can say all this but still forget a handful of are from streets and will life over it you usually get a pass for sports but it s very few that make it but don t get it wrong then is still like that and will find a way to kick back,"kyk hier is die ding wat jy alles kan sê, maar vergeet steeds dat 'n handjievol van die strate af is, en die lewe daaroor kry jy gewoonlik 'n pas vir sport, maar dit is baie min wat dit maak, maar dit nie verkeerd doen nie, dan is dit nog steeds so en sal 'n manier vind om terug te skop"
612,to make me cry sports anime third this is our final chance to play together talk,om my te laat huil sport anime derde dit is ons laaste kans om saam te speel
613,mark and three on the football team have made their way to for the sec media days conference with a clear motivation making it back to this city in for the sec championship game,mark en drie in die sokkerspan het hul weg na die sec media days -konferensie gemaak met 'n duidelike motivering wat dit weer in hierdie stad maak vir die sec -kampioenskap
614,thanks we think you hit it out of the park with how you feel about sports,dankie ons dink jy slaan dit uit die park met hoe jy oor sport voel
615,_app life always you second chance the first digital currency big community _app communication sports and health,_app lewe altyd u tweede kans die eerste digitale geldeenheid groot gemeenskap _app kommunikasie sport en gesondheid
616,currently listening to an episode of sports because i miss doing a together the damsel in distress ad read,"luister tans na 'n episode van sport, want ek mis 'n samesmelting van die meisie in nood"
617,___alerts well never been a stopper defensively he far too much credit was a better defender then was a better defender then their offense was a great defense with then was the best defender especially in the,"___alerts was nog nooit 'n stop nie, hy was te veel te veel krediet was 'n beter verdediger."
618,_mcintyre i am an a s fan and a alum do you catch your low pay for similar in other sports is common i am sure bonus and are also provided cant wait to see you in the,"_mcintyre ek is 'n a s -aanhanger en 'n alumnus, doen u 'n lae betaling vir soortgelyke in ander sportsoorte is algemeen, ek is seker bonus en word ook voorsien, kan u wag om u in die"
619,__sports this is great,__sports dit is wonderlik
620,just under west side have on to a petition to stop in park without a community input process the close park for at a time youth and sports from the space _sabino,"net onder west side het 'n versoekskrif om in die park te stop sonder 'n gemeenskapsinvoerproses, die nabye park vir 'n tyd jeug en sport uit die ruimte _sabino"
621,s wonderful wife still beautiful at was a blessed man and she s clearly a saint,se wonderlike vrou nog mooi by was 'n geseënde man en sy is duidelik 'n heilige
622,draft foot pitcher would be ever in,konsepvoetkruik sou ooit in wees
623,summer league is at pierce sports center in san other are rev also riverside s poly north and apple valley valley view mesa rancho orange vista,summer league is by pierce sports centre in san other am rev ook riverside s poly north en apple valley view mesa rancho orange vista
624,_ijebu _am_ilemona sports petroleum power supply all,_ijebu _am_ilemona sport petroleum kragbron all
625,tomorrow is year sports day yr will need to wear kit or team all other must wear full school uniform no blazer st all are to wear normal student uniform no blazer,"môre is die jaar se sportdag jaar 'n kit of 'n span wat alle ander moet dra, moet 'n volledige skooldrag dra, geen baadjie nie, alles is om normale studente -uniform te dra, geen baadjie nie"
626,i hate every sports owner,ek haat elke sportseienaar
627,present seller summit with coop roger and,huidige verkoperberaad met coop roger en
628,not sports history gave speech at rice u before your quote comes this but why some say the moon why choose this as our goal and they may well ask why climb the highest mountain why ago fly the atlantic why does rice play,"nie die sportgeskiedenis het by rice u toespraak voordat u aanhaling kom nie, maar waarom sommige sê die maan waarom dit as ons doel kies, en hulle kan goed vra waarom die hoogste berg klim, waarom vlieg die atlantiese oseaan, waarom speel rys"
629,sorry i forgot to mention i do not want them in women is sports rape or either i am also not with in the name of your cult that clear enough for you you ridiculous twit,"jammer ek het vergeet om te noem dat ek nie wil hê dat hulle by vroue is nie, is verkragting van sport, of ek is ook nie in die naam van u kultus nie, wat duidelik genoeg is vir u belaglike twit"
630,_sell oh yeah clean easy,_sell oh ja skoon maklik
631,plan raise with our sports minister,planverhoging met ons sportminister
632,and which develop over time through communal use and participation are actually different from those which are the product of the imagination of a single individual so no other sports are not  amade up',"en wat mettertyd ontwikkel deur gemeenskaplike gebruik en deelname, verskil eintlik van dié wat die produk is van die verbeelding van 'n enkele individu, sodat geen ander sportsoorte nie opgestel word nie '"
633,naw all your doing is teaching these they can get away with being disrespectful then they end up like russel and telling to i love football and sports and athletic ability t more important than being a good person,"as u dit alles doen, is dit om dit te leer;"
634,call or request an appointment through the patient portal today for sports,bel of vra vandag 'n afspraak deur die pasiëntportaal vir sport
635,_snatched dude do it today no sports trust,_snatched ou doen dit vandag geen sporttrust nie
636,apply for adaptive camp in colorado set for august,doen aansoek vir adaptive camp in colorado set vir augustus
637,back when i was in college i some ea sports football with was unstoppable over a few span him and were two that you could do just about anything with on their,"terug toe ek op universiteit was, was ek 'n paar sportsokker met 'n paar sportsokker oor 'n paar oor 'n paar en was dit twee waarmee u omtrent alles kon doen op hul"
638,_sell _connect beat me to it good take will have a solid year,"_sell _connect klop my daaraan om dit goed te neem, sal 'n goeie jaar hê"
639,the reason your growth is because you do not stick to sports alone be consistent with sports and you will get the win,"die rede waarom u groei is omdat u nie alleen by sport hou nie, strook met sport en u sal die oorwinning behaal"
640,why does not ea sports just release the end game at the start of the cycle,waarom stel ea sports nie net die eindspel aan die begin van die siklus vry nie?
641,_sell no thanks for getting back to me,_sell nee dankie dat jy my teruggekeer het
642,_sports love the content sir enjoy following you tech are good,"_sports hou van die inhoud, meneer geniet dit om te volg is goed"
643,_connect _sell flair final edition ben significant autograph hall of fame shipped black prince dual autograph shipped,_connect _sell flair finale uitgawe ben belangrike handtekening hall of fame versend swart prince dual autograph
644,_sports when did act i remember him superhero action figured in his locker when he was in,"_sports wanneer ek gedoen het, onthou ek hom superheld -aksie het in sy toesluitkas uitgepluis toe hy in was"
645,_radners _sell that is clean,_radners _sell wat skoon is
646,the ten highest are all see the quarterback wage,die tien hoogste is almal die quarterback -loon
647,who knew conservative get a certificate when they join like they won third place at school sports day,wie weet konserwatief kry 'n sertifikaat as hulle aansluit soos hulle die derde plek op skoolsportdag verower het
648,ea sports share trailer for last ever game 'fifa ',ea sports share trailer vir die laaste wedstryd 'fifa'
649,earn academic team scholar athlete,verdien akademiese team scholar -atleet
650,we are talking about sports,ons praat oor sport
651,what people are to express frustration when they are being oppressed no one is us and have unfettered access to media have already been in women is and sports what the hell is that supposed to mean,"wat mense is om frustrasie uit te spreek as hulle onderdruk word, niemand is ons nie en het onbeperkte toegang tot media al in vroue was en sport wat de hel is wat veronderstel is om te beteken"
652,very tiring day for the department with sports day assembly will be tomorrow morning when our are in the thanks to all of you for today,baie vermoeiende dag vir die departement met sportdagvergadering is môreoggend as ons danksy u almal vir vandag is
653,if he took the covid it is probably what his death former and st round pick at via,"as hy die covid neem, is dit waarskynlik waarvoor sy dood voormalige en st -ronde via via"
654,nowadays those people all decided to get political which ruined pro sports and,deesdae het hierdie mense besluit om polities te word wat pro -sportsoorte verwoes het en
655,in our discord we have full for all sports on multiple occasionally we will post free on here link in,"in ons onenigheid het ons vol vir alle sportsoorte op verskeie af en toe, ons sal gratis op hier skakel in"
656,the spokesman for sky sports new rival in town and your bricking it sky have had the monopoly for i for one am glad of a new competitor same will come with the footy,"die woordvoerder van sky sports new cival in town en your bricking it sky het die monopolie vir i vir een bly van 'n nuwe deelnemer, dieselfde sal saam met die voetjie kom"
657,story that proprietor as low cost petty,verhaal wat die eienaar as laekoste klein is
658,as region champion with s one hit shutout of,as streekkampioen met s een treffer uitsluiting van
