,src,trg
0,lee for battle in first trailer,lee vir stryd in die eerste sleepwa
1,i m here for moral and social entertainment,ek is hier vir morele en sosiale vermaak
2,i love all the food and drink and quality so much entertainment from your series music i am not sure if i would get this as the median worker but i like the flexibility of knowledge work in,"ek hou van al die kos en drank en kwaliteit soveel vermaak uit u reeks musiek, ek is nie seker of ek dit as die mediaanwerker sou kry nie, maar ek hou van die buigsaamheid van kenniswerk in"
3,anyone who actually value to my life be it alpha entertainment or experience,"enigiemand wat eintlik vir my lewe waardeer, hetsy dit alfa vermaak of ervaring"
4,you can not deny jake the entertainment,u kan jake nie die vermaak ontken nie
5,the are disgusting but people consuming this type of entertainment are so wrong yes are cute but you do not know these they have not you looking at them a breakdown or helping in the house doing something silly stop consuming it get help,"die is walglik, maar mense wat hierdie soort vermaak verbruik, is so verkeerd, ja, is oulik, maar jy weet nie dat hulle nie het nie, jy kyk na hulle 'n uiteensetting of help die huis wat iets dom hou om op te hou om dit te help help om hulp te kry"
6,come support you favorite artist this year it is different and power in collaboration with entertainment with artist is so come let is make history big this year to the world wide,kom ondersteun u gunsteling kunstenaar hierdie jaar is dit anders en krag in samewerking met vermaak met kunstenaar is so kom laat die geskiedenis vanjaar groot wees vir die wêreld
7,ist always first variety that is to attract a new group of price conscious and turn around its sliding membership with a new ad streaming,ist altyd die eerste variëteit wat is om 'n nuwe groep prysbewus te lok en sy skuiflidmaatskap om te draai met 'n nuwe advertensiestroom
8,news update there are not but depp is being born in the lab at this moment according to his entertainment lawyer,"nuusopdatering daar is nie, maar depp word op hierdie oomblik in die laboratorium gebore volgens sy vermaaklikheidsadvokaat"
9,i wore a blue shirt to mart and they let me walk into the then found the room where make they fight for sport and entertainment,ek het 'n blou hemp aan mart gedra en hulle het my in die kamer laat stap waar hulle veg vir sport en vermaak
10,_d_cloud exactly people should stop and just watch it for entertainment and move on,_d_cloud presies mense moet stop en net kyk vir vermaak en aangaan
11,this is really depressing when i learn that a bunch of the latest i play not only do not work but are not working because some hacker group to hold them as ransom how do these heartless people live with themselves stealing others' happiness and entertainment,"dit is regtig neerdrukkend as ek verneem dat 'n klomp van die nuutste wat ek speel nie net werk nie, maar nie werk nie, want 'n hacker -groep om hulle as losprys te hou hoe leef hierdie hartelose mense met hulself om ander se geluk en vermaak te steel"
12,hold on verse you know you can call me if you need someone i will pick up the if you come undone,"hou die vers vas, jy weet jy kan my bel as jy iemand nodig het, ek sal dit optel as jy ongedaan gemaak word"
13,welcome to your special seat to this theater of twisted entertainment,welkom by u spesiale sitplek in hierdie teater van verdraaide vermaak
14,the world s biggest race driver list here we come,die wêreld se grootste renbestuurderlys hier kom ons
15,we do not need quote we need to live in an advanced country based on quality of service in work education industry searching and entertainment that is our as a human مقاطعه_شركه_وي,"ons hoef nie 'n kwotasie te hê wat ons nodig het om in 'n gevorderde land te woon nie, gebaseer op die kwaliteit van die diens in die werkonderwysbedryf en vermaak en vermaak as 'n menslike مقاطعه_شركه_وي is"
16,was the sports show you ever hit the television screen spike was top tier entertainment,was die sportprogram wat jy ooit op die televisieskerm getref het spike was top tier entertainment
17,ist always first is currently busy shooting for the upcoming film  ishehzada' and while the actor been keeping his about the shoot he also giving a,"ist altyd is tans besig om te skiet vir die komende film ishehzada 'en terwyl die akteur hom oor die opname hou, gee hy ook 'n"
18,limp and tour due to durst s unexpected health via,slap en toer as gevolg van die onverwagte gesondheid via durst s
19,swing band to host dance lesson and jazz performance,swing band om dansles en jazz -uitvoering aan te bied
20,'katrina is pregnant ' declare as she from along with,'katrina is swanger' verklaar soos sy van mekaar af
21,q a jordan peele on the and of 'nope' from,v 'n jordaan peele op die en van 'nee' van
22,is now streaming league,is nou streaming liga
23,buy run for works to earn back more this is not at all acceptable politics r not dream achieve dream achieve can be self dependent like in entertainment sector sports non public linked politics r self responsible love passion on society,"koop hardloop vir werke om meer terug te verdien, dit is glad nie aanvaarbare politiek nie. r nie droom bereik droom bereik kan selfafhanklik wees soos in die vermaaklikheidsektor sport nie openbare gekoppelde politiek r selfverantwoordelike liefde passie op die samelewing"
24,_peachcobbler the cherry on top the bottom and as after meal entertainment dessert if you will to some hung viking,_peachcobbler die kersie bo -aan die onderkant en soos na maaltye -vermaak -nagereg as u dit aan die een of ander hang viking
25,garland should be for his lack of that are on the he is a political just what ordered,garland moet wees omdat hy nie 'n politieke is nie
26,dominated this weekend as usual the scoring entertainment and derby winner,oorheers hierdie naweek soos gewoonlik die punteleer entertainment en derby -wenner
27,s special us what the future of the industry will look like with all the will be forced to bypass and go directly to their even for their,"s spesiaal ons hoe die toekoms van die bedryf sal lyk, sal gedwing word om te omseil en direk na hulle te gaan, selfs vir hulle"
28,i one of them all the who at the of the and finally made their own entertainment just wait a little bit i will putt all of you down from that heaven,"ek een van hulle almal by die van die en uiteindelik hul eie vermaak maak net 'n bietjie wag, ek sal julle almal uit daardie hemel neerlê"
29,the year is we still do not have flying x a new remix of old town road with entertainment cheese count and a zombie it is long becomes president,"die jaar is dat ons nog steeds nie met 'n nuwe remix van old town road met entertainment cheese count en 'n zombie het nie, word dit lank"
30,entertainment whats stopping you now,vermaak wat jou nou stop
31,can t say i watch them but there s no doubt the game gave me countless of entertainment for a few straight appreciate that here s an animation i made in thanks for that a while back,"kan ek nie sê dat ek na hulle kyk nie, maar daar is ongetwyfeld die spel my ontelbare vermaak vir 'n paar reguit waardeer dat hier 'n animasie is wat ek 'n rukkie terug bedank het"
32,his acting career in with  is feature film,sy toneelspelloopbaan in is speelfilm
33,t that be nice unfortunately they are entertainment and only to be taken seriously by the most foolish sheep,t wat lekker is ongelukkig is dit vermaak en net om ernstig opgeneem te word deur die dwase skape
34,i really like it works great for entertainment and productivity the option maximize organization when you have a lot going on at once,"ek hou baie daarvan dat dit goed werk vir vermaak en produktiwiteit, die opsie maksimeer die organisasie as u tegelyk aan die gang is"
35,_yeeeeet i never said that he is not even a slave in the movie or careless uncle is a great character who you root for you are just digging deep into entertainment it is meaningless to try to tear something apart that people happy,"_eeeeeet ek het nooit gesê dat hy nie eens 'n slaaf in die film is nie, of sorgelose oom is 'n wonderlike karakter wat jy wortel vir jou net diep in vermaak grawe, dit is betekenisloos om iets uitmekaar te skeur wat mense gelukkig is"
36,_ in of entertainment he might have a point the actual baseball itself was good enough but the production was incredible,"_ in die vermaak kan hy 'n punt hê dat die werklike bofbal self goed genoeg was, maar die produksie was ongelooflik"
37,now that s entertainment,nou is die vermaak
38,you have and you think that they re the people in the world but there comes a time when you realize all at once or gradually that they are actually sucking the blood from you not because they need the blood but just for their own entertainment,"u het en u dink dat hulle die mense in die wêreld is, maar daar kom 'n tyd dat u tegelyk of geleidelik besef dat hulle die bloed van u suig, nie omdat hulle die bloed nodig het nie, maar net vir hul eie vermaak"
39,_ in of entertainment d up it was the best yet but the game itself t anything special to some,"_ in die vermaak was dit die beste nog, maar die spel self is nie vir sommige nie"
40,not in music but i work in entertainment management,"nie in musiek nie, maar ek werk in vermaakbestuur"
41,_arjuner every show something good n something bad some regressive n progressive tum overpraise ho na at the end mistake disappointment better to watch show as entertainment not judge all the time,_arjuner elke show iets goeds n iets sleg 'n paar regressiewe n progressiewe tum oorgewende ho na die eindfout teleurstelling beter om te kyk na vertoning as vermaak nie heeltyd beoordeel nie
42,is the official for the star franchise in of it is run by the entertainment arm of,is die amptenaar van die star -franchise daarvan bestuur deur die vermaaklikheidsarm van
43,i think i like watching baseball for big entertainment,ek dink ek hou daarvan om bofbal te kyk vir groot vermaak
44,top most popular horror series right now on w looking for a little more horror entertainment than a horror movie can give you here are the most popular horror series according to,"die beste gewildste horror -reekse op die oomblik op w op soek na 'n bietjie meer gruwelvermaak as wat 'n horrorfilm jou hier kan gee, is die gewildste horror -reeks volgens"
45,is to get married to here is what we know,"is om hiermee te trou, is wat ons weet"
46,_ _jay i been tonight s entertainment my love,_ _jay ek was vanaand se vermaak my liefde
47,vehicle portable entertainment screen android auto reverse image wireless connection v v vehicle power input,voertuig draagbare vermaakskerm android auto reverse image wireless connection v v voertuig kraginvoer
48,center crossword clue,sentrum blokkiesraaisel leidraad
49,_riririririn _aryan _ it though cause it been someone s last straw they probably was up with the for some sort of entertainment,"_riririririn _aryan _ dit was alhoewel dit iemand se laaste strooi was, was hulle waarskynlik besig met die vir 'n soort vermaak"
50,will launch its new music entertainment show idol hit song festival on the streaming platform said the same day,sal sy nuwe music entertainment show idol hit song festival op die streaming platform op dieselfde dag bekendstel
51,this is how it is for me and after moving to canada only spoke with family and everywhere else did not speak again in my life so naturally lost it but because i watched news and entertainment sometimes i did not forget how to understand it,"dit is hoe dit vir my is, en nadat ek na kanada verhuis het, het dit net met familie gepraat en oral anders het hy nie weer in my lewe gepraat nie, so natuurlik het dit natuurlik verloor, maar omdat ek nuus en vermaak gesien het, het ek soms nie vergeet hoe om dit te verstaan ​​nie"
52,s of mick jagger touching with a woman could be yours via,"s van mick jagger wat met 'n vrou aangeraak kan word, kan joune via wees"
53,_ it honestly me how take people with charisma and personality for days and actively give them that take it all away from them as the entertainment company,_ dit is eerlikwaar my hoe mense dae lank met charisma en persoonlikheid neem en hulle aktief gee wat dit alles as die vermaaklikheidsonderneming wegneem
54,masked men task force arrest via news and entertainment,gemaskerde mans taakmag arrestasie via nuus en vermaak
55,launch event in guest singh mad mad on same stage it is mad entertainment blast st,bekendstellingsgeleentheid in gas singh mad mad op dieselfde verhoog is dit mad entertainment blast st
56,new report twitter hatred directed at amber times,nuwe verslag twitter -haat gerig op amber times
57,they are but he said that several times even after the breakout with marvel entertainment,hulle is maar hy het gesê dat dit verskeie kere selfs ná die uiteensetting van marvel entertainment
58,only need to do a movie on their and would get them out of the,hoef net 'n film op hulle te doen en hulle uit die
59,i hope you all this entertainment,ek hoop julle al hierdie vermaak
60,one of the unforeseen of working that go till almost midnight to be the and of the entertainment district on my walk home to get into the club are on a as a gal who generally am this is a different world,"een van die onvoorsiene werke wat tot amper middernag gaan om die en van die vermaaklikheidsdistrik op my huis toe te kom om by die klub in te kom, is op 'n gal wat oor die algemeen 'n ander wêreld is"
61,can you take a guess,kan jy 'n raaiskoot neem
62,the labor who council cark and shame on all of them for public money on foreign and entertainment,die arbeid wat die raad en skande van almal vir openbare geld op buitelandse en vermaak
63,s and daughter s hair transformation ahead of s birthday,s en dogter se haartransformasie voor die verjaardag
64,the ex athlete guilty to scam read here,die eks -atleet skuldig aan bedrogspul lees hier
65,made a surprise announcement that will be music to the of with the a trip down under,het 'n verrassende aankondiging gemaak dat dit musiek sal wees vir die van die a -reis onder onder
66,it is currently the feature and it is to launch next month,dit is tans die funksie en dit moet volgende maand bekendgestel word
67,anyone else on pink sauce for some reason so so confused about the whole thing i need a commentary to enlighten me from swell entertainment if u are reading this this is for u,"enigiemand anders op pienk sous om een ​​of ander rede so so verward oor die hele ding dat ek 'n kommentaar nodig het om my van swellvermaak te verlig as u dit lees, is dit vir u"
68,when i saw entertainment i was excepting something a neutral person will see the pain in doe and see chemical brother as a mature person,"toe ek vermaak sien, het ek iets behalwe 'n neutrale persoon die pyn in doe sien en chemiese broer as 'n volwasse persoon beskou"
69,starting august ken will also see herself on as one of the main cast of the musical series lyric and beat her acting debut via,vanaf augustus sal ken haarself ook sien as een van die hoofrolle van die musiekreeks lyric en haar waarnemende debuut via
70,__prachi___ dal only for entertainment,__prachi___ dal slegs vir vermaak
71,and another team that needs the entertainment may sign him the do not need an entertaining guard to go and be unable to throw a post entry pass we will see how it out from here,"en 'n ander span wat die vermaak nodig het, kan hom onderteken dat dit nie 'n vermaaklike wag nodig het om nie 'n na -ingangspas te gooi nie, ons sal sien hoe dit hiervandaan is"
72,boy band will drop its third win dow on at p m according to entertainment,boy band sal sy derde oorwinning dow op p m laat val volgens entertainment
73,formula become less entertainment because we could not see toto see live on his desk when one of his up on the,formule word minder vermaak omdat ons toto nie regstreeks op sy lessenaar kon sien as een van sy op die
74,all of the special who are academy or any of the other idol training with have already made their entertainment industry,"al die spesiale wat akademie is of enige van die ander afgodsopleiding, het hul vermaakbedryf al gemaak"
75,after consecutive of being as consistently highest audit rating to redo the stellar performance of former just to please and his another style of revision and entertainment,nadat hy agtereenvolgens so konsekwent die hoogste ouditgradering was om die uitstekende uitvoering van voormalige net om te behaag en sy nog 'n styl van hersiening en vermaak te doen
76,the presidential debate is a complete entertainment the audience to this have already decided on who to vote for so based on debate will be misleading and an absurdity,"die presidensiële debat is 'n volledige vermaak wat die gehoor hieraan al besluit het om te stem, so op grond van debat sal misleidend en 'n absurditeit wees"
77,puppeteer the raw power of entertainment can summon of himself by default his or even nearby these can only take hit before falling apart and control of them the more with them he,"poppespeler the raw power of entertainment can summon van homself sy of selfs naby dit kan slegs getref word voordat hy uitmekaar val en hulle meer beheer, hoe meer daarmee saam met hulle"
78,stocks on the move gas finance insurance credit zip tech tech auto industry ihi entertainment,aandele op die skuif gasfinansieringsversekering krediet zip tech tech auto industry ihi entertainment
79,remains a part of s as her character aurora consciousness after to die and her wish in a previous episode via,bly 'n deel van s as haar karakter aurora -bewussyn na die dood en haar wens in 'n vorige episode via
80,justice official live via,justisie amptenaar regstreeks via
81,it is mindless entertainment which is,dit is sinnelose vermaak wat is
82,your identity into the entertainment you consume is a quick way to cross the line into territory,"u identiteit in die vermaak wat u verbruik, is 'n vinnige manier om die lyn na die gebied oor te steek"
83,i need entertainment i just your page you choose violence everyday,"ek het vermaak nodig, ek is net u bladsy wat u elke dag geweld kies"
84,could not help but notice must not get out much huh musk up sun while spending time with aboard luxury yacht in,"kon nie anders as om op te let nie, moet nie veel uitkom nie, maar u moet tyd spandeer aan boord van luukse seiljagte in"
85,let is get one thing straight after this issue is and will be just like any other entertainment company in the industry who doesnt care about the fans' and or in general what is truly right,"laat ons een ding regkry na hierdie uitgawe is en sal wees net soos enige ander vermaaklikheidsonderneming in die bedryf wat nie omgee vir die aanhangers nie, en of in die algemeen wat regtig reg is"
86,khan s appearance in marvel a thumping welcome from and can agree on one thing entertainment news the express امپورٹڈ_حکومت_نامنظور,khan se verskyning in marvel 'n stamp verwelkoming van en kan saamstem oor een ding wat vermaak die express امپورٹڈ_حکومت_نامنظور gehad het
87,here with the being pure entertainment based in f and then nothing after love it,hier met die wees van suiwer vermaak gebaseer in f en dan niks na liefde daarvoor nie
88,daily stock market are of little concern to a long term investor these matter only if you are or selling on the particular day else consider it as just a form of entertainment,"die daaglikse aandelemark is vir 'n langtermynbelegger nie meer kommerwekkend as u op die spesifieke dag anders is of verkoop nie, maar dit as 'n vorm van vermaak beskou"
89,apa white men can t jump s nice racist statement but the globe are not a racist concept with their fumbling,"apa wit mans kan nie 'n lekker rassistiese stelling spring nie, maar die wêreld is nie 'n rassistiese konsep met hul fumbling nie"
90,yeah they might change slightly not not permanently i hope she never comes back in the entertainment industry as she is not worthy of being as an idol,"ja, hulle kan effens verander, nie permanent nie, ek hoop dat sy nooit weer in die vermaaklikheidsbedryf kom nie, want sy is nie waardig om as 'n afgod te wees nie"
91,and before you bring up it is sports entertainment both are physical that the overall perform worst at,"en voordat u opdaag, is dit sportvermaak, albei is fisiek dat die algehele slegste optree by"
92,mind you it difficult he to pack his and leave the entertainment industry forever but then miracle i m so of you park,"let daarop dat dit moeilik is om hom in te pak en die vermaaklikheidsbedryf vir ewig te verlaat, maar dan wonder ek so van jou park"
93,picture the a conversation and then some snot nosed little by and that s the equivalent of random boob simple minded entertainment,"stel jou voor die a -gesprek en dan 'n bietjie snot wat min is, en dit is die ekwivalent van ewekansige boob eenvoudige vermaak"
94,read and learn from a real bond trader no fear mongering no no entertainment no political spin no no just the for better or worse thank you for your great insight,"lees en leer van 'n regte verbandhandelaar geen vrees nie, nee geen vermaak geen politieke draai nee nee net die beter of slegter dankie vir u wonderlike insig"
95,i live in it s nice there s a good local hoop culture with good pickup it s walkable and but as far as entertainment food it obviously t compare to or i m pretty on personally,"ek woon daarin is lekker daar is 'n goeie plaaslike hoepelkultuur met 'n goeie bakkie, maar dit is 'n goeie manier, maar dit vergelyk dit natuurlik met of ek is mooi op persoonlik"
96,hey that is my cousin is farm and sweet lil' sully on the cover photo via,hey dit is my neef is plaas en soet lil 'sully op die voorbladfoto via
97,some while making _epoch,sommige terwyl hy _epoch maak
98,show to farewell yellow brick road tour,wys na farewell yellow brick road tour
99,editor not to hire and other trump standing ovation for,redakteur om nie te huur nie en ander trump staande ovasie vir
100,they do not even have anime on the in flight entertainment system they do have though,hulle het egter nie eens anime op die vlugvermaakstelsel wat hulle wel het nie
101,i mean it is all entertainment although some of it just being that some of it there are so many that just are not very good so many and if people like to read them who am i to say that is bad it is not for my sake they want to read them,"ek bedoel, dit is alles vermaak, alhoewel dit net so baie daarvan is dat daar soveel is wat net nie baie goed is nie, en as mense dit graag lees wie is ek om te sê dat dit sleg is, is dit nie ter wille van my nie wil dit lees"
102,the home of the best featured home of the best,die tuiste van die beste tuiste van die beste
103,th incredible of queen star smiling at final birthday party express,th ongelooflik van queen star glimlag tydens die finale verjaardagpartytjie express
104,_man it is not like have not the especially if they are extremely not subtle entertainment is entertainment,"_ man dit is nie asof dit nie die veral is as dit nie subtiele vermaak is nie, is vermaak"
105,unfortunately pansy ass world getting into the entertainment,ongelukkig het pansy ass world in die vermaak
106,blink blink at the spot how boring the spot a pat before going to track the other down again looking for more entertainment,blink blink op die plek hoe vervelig die plek 'n klap voordat u die ander weer opspoor op soek na meer vermaak
107,see and north west host car wash at home,see en noord -wes -gasheermotorwas tuis
108,on was not there some villain scheme in one of the to block out the sun and then charge people to move it out of the way i seem to recall that being one i swear the simulation gotten so bad they are entertainment as reality now,"op was nie daar 'n skurkskema in een van die om die son te blokkeer nie en dan mense aan te laai om dit uit die weg te beweeg, ek onthou dat ek een van die een is wat ek sweer dat die simulasie so sleg geword het dat hulle nou vermaak as die werklikheid is"
109,in on and  is relationship days after she outed him as 'publicly attacked' her on the set of her first film,in en is verhoudings dae nadat sy hom as 'in die openbaar aangeval' het op die stel van haar eerste film
110,have after 'working out their issues' read,lees na 'uitwerk hul probleme'
111,i think it is one thing to express an opinion like this person unengaged and lazy it is another thing to say this person is a useless piece of i have to myself and occasionally remember that this is entertainment have fun,"ek dink dit is een ding om 'n mening uit te spreek soos hierdie persoon wat onaangename en lui is, dit is 'n ander ding om te sê dat hierdie persoon 'n nuttelose stuk is wat ek vir myself het en soms onthou dat dit vermaak is om pret te hê"
112,clean ass setup and that entertainment system,skoon eselopstelling en daardie vermaakstelsel
113,it is been said before the media entertainment complex like the in pro wrestling,"dit word voor die media entertainment complex gesê, soos die in pro wrestling"
114,mart branded t bother me just to throw in a joke about money entertainment ratio and that we re honestly spoiled with that last as long as they do,"mart het my nie gepla nie, net om 'n grap oor geldvermaakverhouding in te gooi en dat ons eerlik met die laaste bederf het, so lank as wat hulle doen"
115,in of quality entertainment that game,in kwaliteit vermaak daardie speletjie
116,especially considering her charity alone does not work very well while it some there is a consistent use of it whenever she experienced severe social scrutiny,"veral as haar liefdadigheid alleen in ag geneem word, werk dit nie baie goed nie, terwyl daar sommige 'n konstante gebruik daarvan is wanneer sy ernstige sosiale ondersoeke ervaar het"
117,queen is seven million breaking chart record,koningin is sewe miljoen breekkaartrekord
118,mother happy for daughter post her wedding with 'he is her true love',moeder gelukkig vir dogter plaas haar troue met 'hy is haar ware liefde'
