,src,trg
445,exactly like his pitch is we know he s going to put up and we don t know if is going to put up men or a pawn and another man,"presies soos sy toonhoogte is, weet ons dat hy gaan sit en ons weet nie of dit mans of 'n pion en 'n ander man gaan sit nie"
446,he was brilliant that game as well even with the of on the pitch he ran the game a joy to watch,"hy was ook briljant daardie wedstryd, selfs met die van op die veld, het hy die spel 'n vreugde gehad om na te kyk"
447,back in committee along with some hardy the pitch of snow to get an combination game on which ended as one of the only in that day,"terug in die komitee, saam met 'n paar hardy die snow om 'n kombinasie -speletjie te kry waarop geëindig het as een van die enigste in daardie dag"
448,_pitch oh oh,_pitch oh oh oh
449,looking for an opponent g pitch booked at town academy for a kick off please,op soek na 'n teenstander g toonhoogte wat by town academy bespreek is vir 'n afskop asb
450,hey good to participate at you can impress relevant with your pitch you can showcase your product solution at the exhibition floor you can extend your network business see you all on,"hey goed om aan u deel te neem, kan 'n indruk maak met u toonhoogte. u kan u produkoplossing ten toon stel op die uitstallingsvloer. u kan u netwerkbesigheid uitbrei"
451,i often wonder who had to give the pitch on the mail in system for the,ek wonder gereeld wie die toonhoogte op die pos in die stelsel moes gee vir die
452,i m dubious about the competence of anyone who a hard time explaining what it is they do i m not for but a who can t give u an elevator pitch for why they make their money not uncommon certainly not rare but,"ek is twyfelagtig oor die bevoegdheid van almal wat 'n moeilike tyd verduidelik wat hulle doen, ek is nie, maar 'n wat u nie 'n hysbak kan gee nie, waarom hulle hul geld nie ongewoon maak nie, beslis nie skaars nie, maar"
453,i m really a whole jam out session i need to do this more often pitch black and i have nothing else on just me and the music this a,"ek is regtig 'n hele jam out -sessie, ek moet dit meer gereeld doen, en ek het niks anders op net ek en die musiek nie"
454,there s more turn in this pitch than in all the in combined yet these are talking as if it s a road,"daar is meer beurte in hierdie toonhoogte as in al die gekombineerde, maar dit praat asof dit 'n pad is"
455,searching for someone to write my campaign pitch for or,op soek na iemand om my veldtog vir of
456,so pitch time to do or die to float or sink and we live in the steel yard on of information,"dus het die tyd om te doen of sterf om te sweef of te sink, en ons woon in die staalwerf oor inligting"
457,what because i m not keen on his off the pitch and concerned about his possible disruptive behaviour inject it,"wat omdat ek nie van die veld af wil wees nie en besorg is oor sy moontlike ontwrigtende gedrag, spuit dit"
458,__ considering the recent surge on usage and its market is going to add a specific service for if yes can you please pitch a little about it,"__ met inagneming van die onlangse oplewing oor die gebruik en die mark gaan 'n spesifieke diens byvoeg, want indien ja, kan u asseblief 'n bietjie daaroor oprig"
459,_pitch eh she around her trying to find him oh i was going to offer him food,"_pitch eh sy om haar probeer om hom te vind, ek gaan vir hom kos bied"
460,course open summer in play are preferred are off short game area is open please repair pitch,"kursus oop somer in die spel is verkies om 'n kort speletjie te wees, is oop asb"
461,one thing is clear from the recent in test do not give more than a day to chase whatever the score and however the pitch condition is and the list will go on,"een ding is duidelik uit die onlangse toets, moenie meer as 'n dag gee om die telling te jaag nie, en die toonhoogtoestand is en die lys sal aangaan"
462,sister act scream black swan r tied pitch perfect,suster act scream black swan r vasgemaakte toonhoogte perfek
463,_zebra does not matter where the are when we are talking about choosing deserving can pitch deep into while can or does not that what is doing much more special,"_zebra maak nie saak waar dit is as ons praat oor die keuse van verdienstelike nie, kan diep in die kan slaan, terwyl dit kan of nie wat baie meer spesiaal doen nie"
464,monster pitch is a great series hilarious informative have you covered for your next d d game,"monster pitch is 'n wonderlike reeks skreeusnaakse informatiewe, het u gedek vir u volgende d d -speletjie"
465,throw per inning so a inning pitch performance is just off the game mound not anything that,gooi per beur
466,is waiting to pitch the flip idea to jasmine and once pooch leaves,wag om die flip -idee na jasmine te gee en sodra pooch vertrek
467,_themvp_ yeah i remember watching hulu through a once and being exposed to us advertising and it is all the ad goes for the first is the pitch then there is of and side effects then second tag line,"_themvp_ ja, ek kan onthou dat ek hulu deur 'n een keer gekyk het en aan amerikaanse advertensies blootgestel is, en dit is al wat die advertensie vir die eerste is, is die toonhoogte, dan is daar van en newe -effekte as die tweede etiketlyn"
468,listening to music in a pitch black room,luister na musiek in 'n pikswart kamer
469,our living room was last night but we did have the patio open for a bit then pitch shot out and did not come back till am we had the fan on all night in the living room,"ons sitkamer was gisteraand, maar ons het die patio 'n bietjie oop gehad en dan uitgeskiet en nie teruggekom voordat ons die hele nag in die sitkamer gehad het nie"
470,when you face off with a basketball company like this happen i m seasoned and i m ready to be pitch away shoot your shot luke martin nice thanks for the alley,"as u met 'n basketbalonderneming soos hierdie te kampe het, is ek gesout en ek is gereed om weg te wees, skiet u skoot luke martin mooi dankie vir die stegie"
471,they as product but they are now designing a new system for sports waste in for this we a game show the incinerator so we can have some fun it is a pitch but with circular economy,"hulle as 'n produk, maar hulle ontwerp nou 'n nuwe stelsel vir sportafval hierin. ons is 'n speletjie wys die verbrandingsoond, sodat ons kan pret hê, dit is 'n toonhoog"
472,yes please go eat self care is important to do before crushing those who wronged you take care and stay strong he on her next blink,"ja, gaan eet, selfversorging is belangrik om te doen voordat u diegene wat u onreg aangedoen het, verpletter en sterk bly, hy op haar volgende knipoog"
473,with a pitch he his bat down in frustration and we go the have as there are being thrown near the mound,"met 'n toonhoogte het hy sy vlermuis in frustrasie neergesit en ons gaan die have, want daar word naby die heuwel gegooi"
474,trying to enjoy the football but bane on the pitch,"probeer om die sokker te geniet, maar bane op die veld"
475,_league do you have a pitch and ref booked we may be able to help,"_league het u 'n toonhoogte en ref wat ons bespreek, kan ons dit help"
476,if you the draper pitch competition where five gave a two minute pitch to justify their you can still enjoy the replay here,"as u die draper pitch -kompetisie is waar vyf 'n twee minute toonhoog gegee het om hulle te regverdig, kan u steeds die herhaling hier geniet"
477,if can play on such pitch against quality he can play anywhere would be a shining star in upcoming,"as dit op so 'n toonhoogte teen kwaliteit kan speel, kan hy oral speel, 'n blink ster in die komende"
478,the gradual to the pitch in your voice,die geleidelike aan die toonhoogte in jou stem
479,no matter how big the stage or how big the is the best player on the pitch and this is so true in most of the the king whom u are to be without pep is system single won in with prime and,"dit maak nie saak hoe groot die verhoog of hoe groot die beste speler op die veld is nie, en dit is so waar in die meeste van die king wat u sonder pep moet wees, is 'n single single in prime en"
480,_failure dude please do this is actually sick and i want to see more props if you can pitch ted the in a television series format,"_ failure dude, doen dit dan is eintlik siek en ek wil meer rekwisiete sien as u in 'n televisiereeksformaat kan opstaan"
481,is ready for the first training of the newly built pitch,is gereed vir die eerste opleiding van die nuutgeboude toonhoogte
482,mermaid melody pichi pichi pitch top insight,mermaid melody pichi pichi pitch top insight
483,agreed you can t beat a dodger stadium experience the stadium i always felt angel stadium off wish could come up with some way other than the train to union station and tram to ease have to leave before st pitch driving,stem saam dat u nie 'n dodger -stadion -ervaring kan klop nie. die stadion wat ek altyd gevoel het dat angel stadium van wish af kan kom met 'n ander manier as die trein na union station en tram om te vergemaklik voordat die st pitch riving moet vertrek
484,_janty in the first season i was even angry at a point to ask my self why is starting this every week he is not doing any difference until one day in or that i finally saw in on the pitch wow this is pretty good he will be one of the best,"_janty in die eerste seisoen was ek selfs kwaad op 'n punt om my self te vra waarom hy dit elke week begin, hy doen geen verskil voordat hy een dag is nie, of dat ek uiteindelik op die veld gesien het wow dit is redelik goed, hy sal een wees van die beste"
485,if you the draper pitch competition last night where five gave a two minute pitch to justify their you can still enjoy the replay here,"as u die draper pitch -kompetisie gisteraand waar vyf 'n twee minute -toonhoogte gegee het om hulle te regverdig, kan u steeds die herhaling hier geniet"
486,feat pitch happy electronic music,feat pitch gelukkige elektroniese musiek
487,never mind the fact he stayed after he came off to sign for the or all the charity work he does or all the good he does off the pitch the fact that he on the pitch because he to win enough to abuse him everywhere he goes so predictable,"onthou die feit dat hy gebly het nadat hy afgekom het om te teken vir die of al die liefdadigheidswerk wat hy doen, of al die goeie wat hy doen, die feit dat hy op die veld is, omdat hy genoeg sou wen om hom te misbruik oral waar hy so voorspelbaar is"
488,_haider but hi match baar tho pata give credit to them also they also really well and pitch tha at start also at mid also at end also,"_haider maar hi wedstryd baar tho pata gee hulle ook krediet vir hulle, hulle is ook baie goed en slaan die begin ook aan die begin ook aan die einde ook aan die einde"
489,pitch is not the right word cause my voice is low i would like to not have to raise it significantly cause i find that taxing so i want a more relaxed low tone that just i think i do an job when speaking normally but can not raise my voice and keep it,"toonhoogte is nie die regte woord nie, want my stem is laag, ek wil dit nie aansienlik verhoog nie, want ek vind dat belasting, so ek wil 'n meer ontspanne lae toon hê dat ek net dink dat ek 'n werk doen as ek normaal praat, maar nie my kan verhoog nie stem en hou dit"
490,prize winner s pitch with power profiting as soar the new daily it to be done so do it,pryswenner se toonhoog
491,_unlimited the way i hate how people confuse reverb and like i make music and i can clearly hear the pitch correction like if you do this often enough you will hear it no matter what he got good but he got that,_unlike wat ek haat hoe verslag verslag en ek ek musiek en ek kan die pitch -korreksie oor hoor as jy dit algedig doen.
492,is it just me or i can t sleep with no sound or light pitch black dark like i can t go to sleep cause of this bright,"is dit net ek, of ek kan nie slaap sonder klank of ligte pikswart donker soos ek nie kan gaan slaap nie, want hierdie helder"
493,is this a conservative pitch for the vote based on mutual appreciation of dance are so weird they are hard to understand it is like reading or water divining,"is dit 'n konserwatiewe toonhoogte vir die stemming gebaseer op wedersydse waardering van dans, is so vreemd dat dit moeilik is om te verstaan ​​dat dit soos lees of waterdivinie is"
494,love this set up spence to prove himself to conte i think he will do well got so many at the club he can learn from on and off the pitch,"hou van hierdie opstelling spence om homself aan conte te bewys, ek dink hy sal goed doen, so baie by die klub wat hy van aan en van die veld af kan leer"
495,evil tonight was so silly they said it watch the pitch meeting for it is hilarious,"kwaad vanaand was so dom dat hulle gesê het dat dit kyk na die pitch -vergadering, want dit is skreeusnaaks"
496,someone was in a pitch meeting and the idea for and someone important said yes i don t get it,"iemand was in 'n toonhoogtevergadering en die idee vir en iemand wat belangrik is, het gesê ja, ek kry dit nie"
497,am pro pitch black h o,am pro pitch swart h o
498,hit this pitch,slaan hierdie toonhoogte
499,_haider pitch tho slow tha na many were missing so that is why pitch was batting friendly,"_haider pitch tho slow tha na baie het vermis geraak, daarom het pitch gekolfvriendelik"
500,finishing and t evidence of progress enough that yelling on pitch like progress unnecessary dig at the manager gone by,afwerking en t -getuienis van vooruitgang genoeg dat skreeu op toonhoogte soos vordering onnodige grawe by die bestuurder verbygaan
501,_pitch of course she a little bit happier and then her stomach come to think of it i lunch my afternoon snack and dinner i should probably eat something,"_pitch natuurlik sy 'n bietjie gelukkiger en dan dink haar maag daaraan, ek middagete my middag -versnapering en aandete moet ek waarskynlik iets eet"
502,d'aww there to be someone who can write my or campaign pitch o,d'aww daar om iemand te wees wat my of veldtog kan skryf o
503,taking from big to pitch an argument that pac is a conference than big is whew too much floating around on twitter,"van groot om 'n argument te neem dat pac 'n konferensie is as big, is te veel wat op twitter ronddwaal"
504,dude sore down repeat been a year i m tired of getting excited for his return sometimes just break down and are never the same like we won t see him pitch for a full season again,dude seer down herhal was 'n jaar dat ek moeg is om opgewonde te raak vir sy terugkeer soms net afbreek en nooit dieselfde is as wat ons hom nie weer vir 'n volle seisoen sal sien nie
505,the why this step of can become short term gain long term pain' approach in the thread below as they are totally on performance on the pitch and future,"die waarom hierdie stap van 'n korttermyn -wins op langtermynpyn kan word in die onderstaande draad, want dit is heeltemal op prestasie op die veld en toekoms"
506,your club he it as a training pitch you man wish your club could have a player as good as him,jou klub hy dit as 'n oefenveld wat jy man wens dat jou klub 'n speler so goed soos hy kan hê
507,watching public health people decide meeting people where they are telling people what they want to hear rather than out how to pitch in a way that uptake been very special,"kyk na openbare gesondheid mense besluit om mense te ontmoet waar hulle mense vertel wat hulle wil hoor, eerder as om uit te gaan op 'n manier wat die opname baie spesiaal was"
508,the pitcher will pitch to them in a way where they won t be able to hit the ball the other way,die kruik sal na hulle toe slaan op 'n manier waar hulle nie die bal andersom kan slaan nie
509,the bad thing about monte is pitch is told everyone who she is going after if she won the is there so people know what to expect pooch has not said in public who he would go after and that is scary because they all know it wouldnt be a guy,"die slegte ding met monte is pitch word vertel dat almal na wie sy gaan as sy dit gewen het, is daar, sodat mense weet wat om te verwag dat pooch nie in die openbaar gesê het wie hy sou gaan nie, en dit is eng omdat hulle almal weet dat dit nie 'n sou wees nie ou"
510,_ pitch out no,_ sit uit nee
511,_beek frame ability of a to scan the pitch even wen under opponent pressure we really need such with technical ability,"_beek -raamvermoë van a om die toonhoogte te skandeer, selfs wen onder teenstanders, het ons dit regtig nodig met tegniese vermoëns"
512,i would love to know the pitch for this show on a new studio like what sold that,"ek wil graag die toonhoogte vir hierdie vertoning in 'n nuwe ateljee ken, soos wat dit verkoop het"
513,this taking the elevator pitch to the bike cage,dit neem die hysbakhoogte na die fietshok
514,they the psychological part very well knowing that on the pitch they did not stand a chance go wait watch the final we just want get all d report on how sa go complain for weekend,"hulle is die sielkundige deel baie goed met die wete dat hulle op die veld nie 'n kans staan ​​nie, wag die eindstryd."
515,she is wearing and she an umbrella to pitch in the sand right by the water so she can cool off after some fun in the sun,"sy dra en sy is 'n sambreel om reg by die water in die sand te slaan, sodat sy kan afkoel na 'n bietjie pret in die son"
516,i can t find it right now but have you seen the dialogue wrote that is supposed to be about the moral education of a child it s like he wrote a pitch perfect parody of himself,"ek kan dit nie nou vind nie, maar het u gesien hoe die dialoog geskryf is wat veronderstel is om te handel oor die morele opvoeding van 'n kind, dit is asof hy 'n toonhoogte perfekte parodie van homself geskryf het"
517,it probably won t matter as it t look as if she will get my interest was almost entirely that a strong contender thought it likely to effective on a pitch re china that no leading lab or nat figure would consider in,"dit het waarskynlik nie saak gemaak nie, want dit lyk asof sy my belangstelling sal kry, was byna geheel en al dat 'n sterk aanspraakmaker op 'n toonhoogte van china gedink het dat geen leidende laboratorium of 'n nat -figuur sou oorweeg nie"
518,monte trying to flip the house with the same pitch give it up,monte probeer om die huis met dieselfde toonhoogte om te draai
519,and open the to open pitch and invest in talent as someone who is a writer producer and general do everything for a ready franchise going round some and a couple of key people right now,en maak die oop toonhoogte oop en belê in talent as iemand wat 'n skrywersprodusent is en generaal alles doen vir 'n gereed franchise wat op die oomblik 'n paar en 'n paar belangrike mense gaan
520,update are not to use the gated entrance exit by our restaurant all must use the golfer s tunnel entrance and exit please take care of the course therefore rake any replace any and repair your pitch,"die opdatering is nie om die omheinde ingang -afrit deur ons restaurant te gebruik nie, moet die gholfspeler se tonnelingang en uitgang gebruik. sorg"
521,i think in hong while most call it football i also soccer and seen in public my college campus that say soccer pitch so i feel like in some it s interchangeable,"ek dink in hong, terwyl ek dit die meeste sokker noem, het ek ook sokker en in die openbaar my universiteitskampus gesien wat sê sokkerveld, so ek voel soos in sommige dit is uitruilbaar"
522,threw out the ceremonial first pitch but they did not show it on,"het die seremoniële eerste toonhoogte uitgegooi, maar hulle het dit nie gewys nie"
523,mid league north this us host in the newly formed mid league north league would be great to see as many of you as possible down the pitch supporting the as they start the new season,mid league north hierdie amerikaanse gasheer in die nuutgestigte mid league north league sal wonderlik wees om soveel van u as moontlik op die veld te sien wat die nuwe seisoen begin
524,better to lose the toss at i guess pitch is unpredictable now,"dit is beter om die gooi by my te verloor, ek dink die toonhoogte is nou onvoorspelbaar"
525,i d say if you have a heat only boiler and it s been regularly and working without fault then just keep it more like a pitch straight out of the gas play book they offer a service contract with that,"ek sê as u slegs 'n hitte -ketel het en dit gereeld werk en sonder fout werk, hou dit net meer soos 'n toonhoogte uit die gas -speelboek, bied hulle 'n dienskontrak daarmee aan"
526,hello is it possible in any way to send you your manager the pitch script of a book we have written it is a detective story almost as cool n sexy as strange days,"hallo is dit op enige manier moontlik om u bestuurder die toonhoogte van 'n boek te stuur wat ons geskryf het, dit is 'n speurderverhaal amper net so cool n sexy soos vreemde dae"
527,guarantee will try and temper his speed going forward and then he may be able to pitch more than,waarborg sal sy spoed vorentoe probeer temper en dan kan hy meer as
528,he had to reach it with no other choice his mind was pitch black the skies and was his limit such revolutionary thought the energy his body the amount of it and gaining closer relationship to nature,hy moes dit bereik met geen ander keuse nie. sy gedagtes was pikswart die lug en was sy limiet wat so 'n rewolusionêre gedink het die energie sy liggaam die hoeveelheid daarvan en om 'n nouer verhouding tot die natuur te kry
529,can sing can dance is pretty can act your can only flex its dancing like cracking her and a sharp high pitch like in first glance people wouldnt even care you be a lunatic or blind to her,kan sing kan dans is mooi kan optree jou kan net sy dans buig soos om haar te kraak en 'n skerp hoë toonhoogte soos in die eerste oogopslag mense nie eens omgee dat jy 'n gek of blind vir haar is nie
530,found out my dad perfect pitch and i do not and it,het my pa perfekte toonhoogte uitgevind en ek doen dit nie
531,i am just thankful we do not have to listen to ray repeat his same old china for the th time i swear that guy has not his pitch since the era,ek is net dankbaar dat ons nie hoef te luister na ray herhaal dieselfde ou china vir die keer dat ek sweer dat die man nie sy toonhoogte sedert die era het nie
532,i know it s an incredibly bold statement to make but lewis is going to be in the one day i watched his pitch mix his mechanics his speed everything just up properly and of course the have been so good lewis will be in the,"ek weet dit is 'n ongelooflike gewaagde stelling om te maak, maar lewis gaan op die eendag kyk hoe sy toonhoogte sy werktuigkundiges meng, alles net behoorlik op, en natuurlik was dit so goed dat lewis in die"
533,w pitch is elite,w toonhoogte is elite
534,was the strategic choice of the king acolyte yes it was also just never a neat fit to pitch a prominent education reformer to the progressive wing of the party,"was die strategiese keuse van die king acolyte ja, dit was ook nooit 'n netjiese pas om 'n prominente onderwyshervormer aan die progressiewe vleuel van die party te gee nie"
535,location mistake with an off speed pitch that s a question al pitch ahead in the count no matter how well he executed,"liggingfout met 'n af -spoedhoogte wat 'n vraag is wat voorlê in die telling, maak nie saak hoe goed hy uitgevoer het nie"
536,_light which one can pitch,_lig watter een kan slaan
537,this pitch is doing nothing,hierdie toonhoogte doen niks
538,'first pitch first swing' his all star promise,'eerste toonhoogte eerste swaai' his all star promise
539,kind of like a data pitch drop experiment,soort van soos 'n data pitch drop -eksperiment
540,and ragwort spread on to the pitch unsuitable as surface and unfortunately need to be better stop problem at source rather than have to spray full pitch,en ragwort versprei na die toonhoogte ongeskik as oppervlak en moet ongelukkig 'n beter stopprobleem wees by die bron eerder as om die volle toonhoogte te spuit
541,_redsox that is a quarter of the payroll for a pitcher that does not pitch and a with no power but hey they were fan right,"_redsox dit is 'n kwart van die betaalstaat vir 'n kruik wat nie opsteek nie en 'n sonder krag, maar hey, hulle was reg"
542,be well and strong very soon we are looking forward to see you on the pitch again,"wees baie gou sterk, ons sien uit daarna om u weer op die veld te sien"
543,like to troll about him there considering all his not sure i would lose sleep over him doing that stellar when he does pitch though,hou daarvan om daar oor hom te troll as al sy mense nie seker is dat ek die slaap oor hom sou verloor deur die ster te doen as hy wel opstaan ​​nie
544,i for one love that any show i pitch to be broad enough to save an ailing multinational conglomerate,ek hou van die een hou dat enige show wat ek breed genoeg is om 'n sukkel multinasionale konglomeraat te red
545,get back on that pitch as,gaan terug op daardie toonhoogte as
546,see the stupidly pitch one against the other situation by virtue,kyk na die dom plek een teen die ander situasie op deugde
547,_haider pitch is getting flatter and inexperienced side,_haider pitch raak vlei en onervare kant
548,we caught it tonight and the the pure hollowness rich of his post home was so pitch perfect,ons het dit vanaand gevang en die pure hollowness rich van sy poshuis was so perfek
549,he came off injured on just before in last match he just stopped running then sat on pitch came on had a look and he had to be what the injury was,"hy het beseer afgekom net voor die laaste wedstryd wat hy net opgehou het, en op die veld gaan sit, het 'n blik gehad en hy moes wees wat die besering was"
550,_aslund that sense i hope will get over its and help support the resistance russia a destructive fire and we all need to pitch in to put it out before it,"_ as ek die gevoel het, hoop ek dat ek sal oorkom en help om die weerstand rusland 'n vernietigende vuur te ondersteun, en ons moet almal inslaan om dit voor dit uit te sit"
