,src,trg
508,do we have a for you listen to chasing the frame on,het ons 'n vir u luister om die raam op te jaag?
509,s brand protection rep is improving but for how long in the entertainment and fashion say is patent,"s handelsmerkbeskermingsverteenwoordiger verbeter, maar hoe lank in die vermaak en mode sê, is patent"
510,i was down my page and it s literally me at everything this here twitter entertaining a form of entertainment excluding fear street i mean sesame street,"ek was van my bladsy af en dit is letterlik my by alles hier twitter wat 'n vorm van vermaak vermaak, uitgesonderd fear street, ek bedoel sesame street"
511,these are to die for,dit moet sterf vir
512,injured at celebrity softball game,beseer by celebrity softball game
513,rap new life to city is music scene commercial appeal,rap new life to city is musiektoneel kommersiële aantrekkingskrag
514,rack is limited time home sale score on home goods worth over,rek is beperkte tyd huisverkoping op huisgoed ter waarde van meer as
515,news relationship status with mystery woman revealed after sighting,nuusverhoudingstatus met mystery woman onthul na waarneming
516,no the early catfish are pure entertainment,nee die vroeë katvis is suiwer vermaak
517,as a former preservationist this my heart a window in the floor load bearing construction that can fail it is too grand a view to see only a slice rather than take the elevator up to drink it all in,"as 'n voormalige bewaringsagsag, is dit my hart 'n venster in die vloerlading met konstruksie wat kan misluk."
518,and entertainment source red hot blues at a cool show,en vermaakbron red hot blues op 'n koel vertoning
519,runway entertainment,runway entertainment
520,read south entertainment agency source music the official departure of kim from girl group went on hiatus in may due to bullying source music,lees south entertainment agency source music die amptelike vertrek van kim van girl group het in mei op hiatus gegaan weens boeliesbronmusiek
521,the two most horrible entertainment,die twee aakligste vermaak
522,at this point ray fisher accountability over entertainment is and always been a joke,op hierdie punt is ray fisher -aanspreeklikheid oor vermaak en was dit altyd 'n grap
523,'i been broke in and in bombay' when felt  amoney brought a lot of with it','ek is ingebreek en in bombay' toe gevoel dat amoney baie daarmee saamgebring het '
524,demon and council some argue for the entertainment but to find the _,"demon en raad sommige argumenteer vir die vermaak, maar om die _ te vind"
525,the lead of new father daughter drama  wouldon t make me go' talk about the film s and how they are bonding with their own,die hoofrol van die nuwe vader dogter drama sou my nie laat praat oor die film en hoe hulle met hul eie bande is nie
526,by far the most epic entertainment ever,verreweg die mees epiese vermaak ooit
527,__i i take the number most likely to cause twitter of other the maximum amount of anguish this strictly for my entertainment,__ ek neem die getal wat waarskynlik die twitter van ander die maksimum hoeveelheid kwaad is vir my vermaak
528,join _official dao which you to the entertainment you want to see,sluit aan by _ official dao wat u aan die vermaak wat u wil sien
529,blackpink is accused of cultural appropriation in series the idol,blackpink word beskuldig van kulturele bewilliging in serie the idol
530,to six,tot ses
531,more out of necessity there are to visit to grow to cuddle and to read to catch up on oh and doom scroll twitter for entertainment and angst,meer uit die noodsaaklikheid is daar om te kuier om te knuffel en om te lees om oh in te haal en doom scroll twitter vir vermaak en angs
532,this weekend if you have not already got your ticket to the ultimate in sexuality entertainment and education then you can grab yours now via,"hierdie naweek as u nog nie u kaartjie na die uiteindelike in seksualiteitsvermaak en opvoeding gekry het nie, kan u u nou via die uwe gryp"
533,the academy of country music show is leaving las after nearly a formal partnership between the show and the led to the decision,die academy of country music show verlaat las na byna 'n formele vennootskap tussen die vertoning en die led tot die besluit
534,live now lyrical demonical set up just some chill and stress free entertainment bring your best cause i will judge you all very harshly art by,live now lyrical demonical stel net 'n bietjie koue en stresvrye vermaak.
535,is this account for real or a parody if actually a gov not agency i have never seen this level of be so successful if is out will other of entertainment also origin of bad it is your their oil,"is hierdie rekening vir 'n regte of 'n parodie as 'n regter nie agentskap nie gesien het nie, ek het nog nooit gesien dat hierdie vlak so suksesvol is as daar uit is nie, sal ander van vermaak ook die oorsprong van sleg, dit is u olie"
536,decided to stop dating people in the entertainment industry and then to,besluit om op te hou met mense in die vermaaklikheidsbedryf en dan om
537,what when a young traveler into bowie,wat wanneer 'n jong reisiger in bowie is?
538,the academy of country music is heading south to next year as they return to exclusively live streaming on prime video in,"die academy of country music is na die volgende jaar suidwaarts, aangesien hulle terugkeer na eksklusiewe regstreekse streaming op prime video in"
539,top celebrity news this morning at am said  notu din me double hai' after success o,top celebrity news vanoggend by am said notu din me double hai 'na sukses o
540,writer prize for writing,skrywersprys vir skryf
541,entertainment tech company gains its first of and content,vermaak -tegniese maatskappy kry sy eerste van en inhoud
542,a spokesman for the u s attorney is office said it was not probable a conviction could be and sustained given that the nine had been,"'n woordvoerder van die u s prokureur is 'n kantoor het gesê dit is nie waarskynlik dat 'n skuldigbevinding kan wees en volgehou het nie, aangesien die nege was"
543,this enterprising team of gen are culture in,hierdie ondernemende span van gen is kultuur in
544,nordstrom is shoe shining family looking neat,"nordstrom is 'n skoen wat familie lyk, netjies"
545,make over to avoid,maak oor om te vermy
546,entertainment is second from jojo is bizarre adventure diamond is unbreakable is up for preorder now at the shop us in the partner section preorder soon preorder,entertainment is tweede van jojo is bizarre adventure diamond is unbreakable is nou vooropgestel by die shop us in die partner -afdeling voorafbestelling
547,are waiting for,wag vir
548,the hit making duo of drew and pall have up to get into a capsule to a stratospheric balloon in a few and perform some above the earth,die treffer -duo van drew en pall moet in 'n paar in 'n kapsule na 'n stratosferiese ballon kom en 'n paar bo die aarde uitvoer
549,ruth prabhu to south actress who will be seen in big,ruth prabhu aan suid -aktrise wat in big gesien sal word
550,for one thing s usually the one making dinner in the kitchen,vir een ding is gewoonlik die een wat aandete in die kombuis maak
551,time for my sleep entertainment freshman me is eager,tyd vir my slaapvermaak -eerstejaars my is gretig
552,taking fantasy to reality rip 'law order' shooting crew member shot to death while parking for the show in,neem fantasie na die werklikheid rip 'law order' skietbemanningslid wat doodgeskiet is terwyl hy vir die show in parkeer het
553,thing every first time should do,ding elke eerste keer moet doen
554,_lowy i know it s by but not like fox news it is the sports and entertainment side the entertainment side is the the resident the cleaning lady some decent diverse in all ways i have never seen an ad fox news on this side,"_lowy ek weet dat dit verby is, maar nie soos fox news nie, dit is die sport- en vermaaklikheidskant. die vermaaklikheidskant is die inwoner die skoonmaakdame 'n paar ordentlike uiteenlopende op alle maniere wat ek nog nooit 'n ad fox news aan hierdie kant gesien het nie"
555,listening to today is and what i n entertainment on my twitter,luister na vandag is en wat ek op my twitter vermaak
556,please supply the entertainment next season because it was as funny as f,"verskaf die vermaak volgende seisoen, want dit was so snaaks soos f"
557,what we did tonight and karaoke,wat ons vanaand gedoen het en karaoke
558,birthday and more times the veteran actor made shocking on,verjaarsdag en meer kere het die veteraan -akteur skokkend gemaak
559,my kitchen remodel took longer than this hidden video it _stardom,"my kombuisverbetering het langer geneem as hierdie verborge video, dit _stardom"
560,is streaming up a hot bowl of entertainment apex better get yourself a,is besig om 'n warm bak met vermaaklikheidsaanslag op te stroom om jouself beter te kry
561,yes i read the times the wall street journal and listen to and for fox for entertainment,"ja, ek lees the times the wall street journal en luister na en vir fox vir vermaak"
562,is an entertainment publication nothing more,is 'n vermaakpublikasie niks meer nie
563,then left and cube entertainment was originally a trainee and almost in bigbang is,toe links en cube entertainment was oorspronklik 'n leerling en amper in bigbang is
564,neat article tron really was ground breaking for the time i agree,netjiese artikel tron was regtig besig om te breek vir die tyd wat ek saamstem
565,bonding with your does not have to be boring,binding met u hoef nie vervelig te wees nie
566,on the situation sometimes die that way and then their soon afterward pacifist strength is entertainment for the wicked sometimes being pacifist your in sight sometimes it them,"op die situasie sterf soms so en dan is hul binnekort pasifistiese krag vermaak, want die goddelose is soms pasifisties in sig, soms"
567,tonight is multiple live for your entertainment _supah stream stray go show some love,vanaand is meerdere live vir u vermaak.
568,news item about and cash hospital yahoo news,nuusitem oor en kontanthospitaal yahoo news
569,wow i this entertainment the on this are fantastic,sjoe ek hierdie vermaak die op hierdie is fantasties
570,i need entertainment,ek het vermaak nodig
571,stainless steel frame s play fence w throwing design for entertainment via,vlekvrye staalraam s speelheining w gooi -ontwerp vir vermaak via
572,great new block buster entertainment prime days,wonderlike nuwe blok buster entertainment prime days
573,the show is our own entertainment content where you can meet the colorful unique contents of every month as being will be busy all the time our content stock is safe every month,"die vertoning is ons eie vermaakinhoud waar u die kleurryke unieke inhoud van elke maand kan ontmoet, want dit sal die hele tyd besig wees met ons inhoud"
574,your funny stay in touch always need entertainment,jou snaakse verblyf in kontak het altyd vermaak nodig
575,here is a quick look at the front page today to read our go to for more entertainment news visit,hier is 'n vinnige blik op die voorblad om ons go to for more entertainment news visit te lees
576,hello i am a dark dragon in disguise of a elf i am a evil dragon that to do bad for the joy and entertainment for myself or whether it my mood i also seem to forget where i place my own traps did i make sure my traps are turned off,"hallo, ek is 'n donker draak in 'n vermomming van 'n elf, ek is 'n bose draak wat sleg is vir die vreugde en vermaak vir myself, of of dit my bui is, dit lyk ook asof ek vergeet waar ek my eie lokvalle plaas. afgeskakel"
577,_nobrow does not do news or is it only in the u s that murdoch is lawyer call his corporation an entertainment corporation,"_nobrow doen nie nuus nie, of is dit slegs in die u s dat murdoch is dat advokaat sy korporasie 'n vermaaklikheidskorporasie noem"
578,legacy home of the best,legacy tuis van die beste
579,judge in s child sex case broke promise unsealed reveal via leave that poor old man alone,regter in s kindersekssaak het belofte gebreek ongesluit onthul via verlof dat arme ou man alleen
580,_official so according to your logic if someone is following khalifa then he she should also be a people follow someone for their entertainment,"_ official so volgens u logika as iemand khalifa volg, moet sy ook 'n volk wees om iemand te volg vir hul vermaak"
581,when need to make the first thing they cut is entertainment,"wanneer dit nodig is om die eerste ding te maak wat hulle sny, is vermaak"
582,hear me out this just some i have been thinking television is entertainment i am under the firm belief that theres a lot of that are i am not going to get into but when something does not seem right i wonder if its staged,"hoor my dit net sommige wat ek gedink het televisie is vermaak, ek is onder die ferm oortuiging dat daar baie daarvan is dat ek nie gaan inkom nie, maar as iets nie reg lyk nie, wonder ek of dit opgevoer is"
583,entertainment are dumb as hell like yeah there is be a new star movie but do not tell anyone,"vermaak is dom soos die hel soos ja, daar is 'n nuwe sterfilm, maar moenie dit vertel nie"
584,this is much closer to my approach you should be all of your food beverage while traveling for work just do not be ridiculous about your entertainment nobody goes to a every night that is for special with special people,"dit is baie nader aan my benadering. u moet al u drankies wees terwyl u werk, moet u nie belaglik wees oor u vermaak waarna niemand elke aand gaan nie"
585,_paone where do you land with that should all be should reading not be a form of entertainment or escape intriguing,"_paone waar beland u daarmee, moet dit alles lees, nie 'n vorm van vermaak of ontsnapping intrigerend wees nie"
586,i honestly do not know the answer to that but now my i would not be if he did but i can definitely see him either saying cringe or what do you mean this is the pinnacle of and entertainment,"ek weet eerlikwaar nie die antwoord daarop nie, maar nou sou ek dit nie wees as hy dit gedoen het nie, maar ek kan hom beslis sien of hy krimp, of wat bedoel jy dit is die toppunt van en vermaak"
587,entertainment purple hair,vermaak pers hare
588,is it possible to work with a dialect coach if i m not at all in entertainment just want to work on the accent i have in my head it s not good,"is dit moontlik om met 'n dialekafrigter te werk as ek glad nie in vermaak wil werk nie, net wil werk aan die aksent wat ek in my kop het, dit is nie goed nie"
589,with no real meaning behind everything important was left out for to carry i suppose there is still entertainment to gain from the,"met geen werklike betekenis agter alles wat belangrik is om te dra nie, dink ek dat daar nog vermaak is om uit die"
590,if you are a and fan this will make you happy,"as u 'n en fan is, sal dit u gelukkig maak"
591,v aka kim taehyung is awkward yet funny moment with an official from world goes viral on twitter,"v aka kim taehyung is ongemaklik, maar tog snaakse oomblik met 'n amptenaar van die wêreld gaan virale op twitter"
592,why are they taking entertainment so seriously i know they are so to see grace and joe is chemistry again like two made them lose their,"waarom neem hulle so ernstig vermaak dat ek weet dat hulle so is om grace te sien, en joe is weer chemie soos twee wat hulle laat verloor het"
593,_bk can confirm i have a doodle mutt and the drama that comes out in the doodle group when someone to call them that is always worth watching i stay in those just for the entertainment,"_bk kan bevestig dat ek 'n doodle -mutt het en die drama wat in die doodle -groep uitkom as iemand om hulle te bel, wat altyd die moeite werd is om te kyk ek bly in diegene net vir die vermaak"
594,_jc because it for good entertainment on fox news,_jc omdat dit vir goeie vermaak op fox news
595,i myself and a bunch of people find it really up that people would get entertainment from doing all of this banning an account is one thing their ip is is way different continue doing this whoever this group is but when the police catch up you will be,"ek self en 'n klomp mense vind dit regtig aan dat mense vermaak sou kry om al hierdie dinge te doen om 'n rekening te verbied, is een ding wat hul ip is, is om anders te doen om dit te doen wie hierdie groep is, maar as die polisie inhaal, sal jy wees"
596,endless entertainment shake it off swift,eindelose vermaak skud dit vinnig af
597,oh god people are seeing less better stop trying to stop from dying in school the entertainment industry needs are help,o god mense sien minder beter ophou om op te hou om op skool te sterf. die behoeftes van die vermaaklikheidsbedryf is hulp
598,'law order' shooting crew member shot to death while parking for show in explore the fox news that are right for you at,'law order' skietbemanningslid het doodgeskiet terwyl hy parkeer vir show in explore the fox news wat die beste by u is by
599,unbelievable weight loss transformation of,ongelooflike gewigsverliestransformasie van
600,i believe that fun while is crucial how much of the platform is attention been on the game is entertainment then what are being taken to ensure that this game is appropriate for all and non alike,"ek glo dat pret, hoewel dit van kardinale belang is hoeveel van die platform die aandag op die spel was, is dit wat geneem word om te verseker dat hierdie speletjie geskik is vir almal en nie eenders nie"
601,_i_am_the debating is an entertainment pastime that and engage in it nothing to do with science a challenge been if you are so confident in your position why not support an opportunity to have it,"_i_am_die debatte is 'n vermaaklike tydverdryf wat daarmee niks met die wetenskap te doen het nie, was 'n uitdaging as u so vol vertroue is in u posisie waarom u nie 'n geleentheid sal ondersteun om dit te hê nie"
602,happy to find that i am already following would have been mad at myself since you and the pat down have provided me so many days worth of entertainment happy k which will come soon,"gelukkig om te vind dat ek reeds volg, sou gewees het vir myself sedert u en die klap my soveel dae van vermaak aangebied het, wat binnekort sal kom, wat binnekort sal kom"
603,funny you do not actually believe that gay is woven into the fabric of life grow up,snaaks dat jy nie eintlik glo dat gay in die weefsel van die lewe verweef word nie
604,lady reward for shooter of singer s after he s wrongly form jail us news,lady reward vir shooter of singer s nadat hy verkeerdelik tronkstraf gevorm het
605,entertainment premium premium premium premium and apple music available here,vermaakpremium premium premium premium en apple music beskikbaar hier
606,today vote for and bad buddy _family do not forget link to vote,stem vandag vir en slegte maatjie _familie moenie die skakel vergeet om te stem nie
607,create a precision shell tier list via note i really do not offend everyone if i do not have your favorite player just know i am human and this is purely for entertainment please do not cancel me,"skep 'n precision shell tier list via note ek beledig almal regtig nie as ek nie u gunsteling speler het nie, weet net dat ek 'n mens is, en dit is net vir vermaak, moet u my nie kanselleer nie"
608,alright it is time for vodka and um wood ranch county maybe some entertainment i share later tonight probably give you another spell by a day or two i do not want to overthrow you,"goed, dit is tyd dat vodka en um wood ranch county miskien 'n bietjie vermaak wat ek later vanaand deel, u waarskynlik nog 'n dag of twee gee, ek wil u nie omverwerp nie"
609,'rocketry' latter 'humbled and inspired','rocketry' laasgenoemde 'verneder en geïnspireer'
610,if they entertainment they should have portable,"as hulle vermaak, moes hulle draagbaar hê"
611,read all the top news from the world of entertainment and in today is city read today is,lees al die topnuus uit die wêreld van vermaak en vandag is city lees vandag
612,hit or miss with position from entertainment standpoint but that and exchange was fascinating no,"slaan of mis met posisie van vermaaklikheidsoogpunt, maar dit en uitruil was fassinerend nee"
613,its especially hard when i m in therapy to try and control myself better but i live in a house where no one around me is actively trying to help and they purposely trigger me because its entertainment and they can yell at me crazy and use my disorder to guilt trip me,"dit is veral moeilik as ek in terapie is om myself beter te probeer beheer, maar ek woon in 'n huis waar niemand rondom my aktief probeer help nie, en hulle aktiveer my doelbewus omdat die vermaak en hulle op my mal kan skree en my wanorde kan gebruik om skuldgevoelens te gebruik trip my"
614,how many have ever from i bet it s not even of of toxic sports related in the last sports religion politics are all more toxic art music are all just as bad as gaming if not worse,"hoeveel is daar ooit dat ek seker is dat dit nie eens van giftige sportverwante in die laaste sportgodsdienspolitiek is nie, is alles meer giftige kunsmusiek net so sleg soos spel, indien nie erger nie"
615,enjoying the glow from hallmark rating with in movie via,geniet die gloed uit hallmark -gradering met in film via
616,is now streaming chatting,is nou besig om te gesels
617,i bulk ordered and a portable player because i need entertainment at work,ek het grootmaat bestel en 'n draagbare speler omdat ek vermaak by die werk nodig het
618,this was such genuine entertainment for me for you to be angry with me that i told u i had a girl crush on someone i just met mind you never been with and you decide to send me a picture of your ex gorgeous and stunning and then list out every single one,"dit was vir my so 'n opregte vermaak om vir my kwaad te wees dat ek vir u gesê het dat ek 'n meisie het op iemand wat ek net ontmoet het, was u nog nooit met jou nie, en jy besluit om vir my 'n foto van jou eks pragtige en asemrowende te stuur en dan uit te lys elke enkele"
619,singer all his from and later a cryptic five video,sanger al sy van en later 'n kriptiese vyf video
620,disclaimer due to twitter is new policy rule i would like to inform you all that i am not associated with any of the or on this page this account is strictly for entertainment i own none of the or art,disclaimer as gevolg van twitter is 'n nuwe beleidsreël.
621,i rode around the bend and into a mix of oncoming traffic e a runner and someone walking with a dog everyone moving at different and with of awareness i,ek het om die draai gery en in 'n mengsel van 'n aankomende verkeer en 'n hardloper en iemand wat met 'n hond loop wat almal op verskillende en met bewustheid beweeg
622,is a south girl group formed by high up entertainment the group is composed of six and j they on with the release of their debut single album star to a young culture,"is 'n south girl group wat gevorm word deur high up entertainment, bestaan ​​die groep uit ses en j wat hulle voortduur met die vrystelling van hul debuut -enkelalbumster tot 'n jong kultuur"
623,the plot of the guide to entertainment circle is like a roller coaster of emotion it is riveting and full of आ_म _म _म,"die intrige van die guide to entertainment circle is soos 'n achtbaan van emosie, dit is klinkend en vol आ_म _म _म"
624,video see what this curvy lady was caught doing in a car to entertain a driver,video kyk wat hierdie krom dame in 'n motor vasgevang is om 'n bestuurder te vermaak
625,man i go to play after work and come back to some supreme entertainment of the eating each other,man ek gaan speel na werk en kom terug na die grootste vermaak van die eet van mekaar
626,bing entertainment quiz and ben tied the knot at a low key ceremony in colorado the correct answer is las a b b c b a,bing entertainment -vasvra en ben het die knoop vasgebind tydens 'n lae sleutelseremonie in colorado. die regte antwoord is las a b b b b a
627,man shot dead while working at 'law order' film location,man geskiet terwyl hy by 'law order' -filmlokasie gewerk het
628,update in year what after shark tank,opdatering in jaar wat na shark tank
629,to me the scary part is how insensitive people are on the and the differently for their entertainment and humour if only we had the power to weed out such content and behavior,vir my is die eng deel hoe ongevoelige mense op die en die ander is vir hul vermaak en humor as ons net die mag gehad het om sulke inhoud en gedrag uit te wis
630,she t exposed to ski culture' in 'nick bought me snowmobile so i can keep up',sy het nie blootgestel aan ski -kultuur 'in' nick het vir my sneeuwscooter gekoop sodat ek kan volhou nie '
631,warning graphic no copyright infringement intended all belong to their original musical and posted on twitter are for entertainment only,waarskuwing grafiek geen kopieregskending bedoel almal behoort tot hul oorspronklike musiekblyspel en geplaas op twitter is slegs vir vermaak
632,at library and made a audio recording this is a public time stamp along my creative journey for safe keeping what working on is the of art design entertainment and design into one change culture i will show you my version first praise god,by die biblioteek en 'n klankopname gemaak het. dit is 'n openbare tydstempel op my kreatiewe reis om die werking van kunsontwerp en ontwerp in een verandering in een verandering te bewaar.
633,now we know garland gave trump a reason to announce presidential run early via,nou weet ons dat garland trump 'n rede gegee het om die presidensiële hardloop vroeg aan te kondig
634,entertainment to be pretty serious about protecting their artist so they would have definitely release something in case she was innocent to protect her from hate she was never officially proven innocent so you need to release you cannot make based,"vermaak om redelik ernstig te wees oor die beskerming van hul kunstenaar, sodat hulle beslis iets sou vrygestel het as sy onskuldig was om haar teen haat te beskerm, was sy nooit amptelik onskuldig bewys nie, so u moet vrylaat dat u nie gebaseer kan maak nie"
