,src,trg
212,less red tape if we get more regulatory alignment with the eu single market however that s not the sort of pitch that will win tory,"minder rompslomp as ons meer regulatoriese belyning by die eu -enkelmark kry, maar dit is nie die soort toonhoogte wat tory sal wen nie"
213,could learn a thing or two from pitch,kon 'n ding of twee by toonhoogte leer
214,if we use that money to pay off debt but not improve the squad it would equally harmful sponsor ticket and merchandise revenue is only when the team is on pitch and to keep an operation as big as barcelona going long term you need constant inflow of cash,"as ons daardie geld gebruik om skuld af te betaal, maar nie die groep verbeter nie, sal dit ewe skadelike borgkaartjies wees, en handelsinkomste is slegs as die span op die punt is en om 'n operasie so groot te hou soos barcelona op lang termyn, moet u 'n konstante invloei van kontant hê"
215,_lw totally can not help be happy with what i am seeing i know it is just season but for the first time in i do not know how long we look and know what we are doing are not spread out too far around the pitch supporting in and running off the ball,"_lw kan heeltemal nie help om gelukkig te wees met wat ek sien nie, ek weet dit is net die seisoen, maar vir die eerste keer weet ek nie hoe lank ons ​​lyk en weet wat ons doen nie te ver versprei nie hardloop van die bal af"
216,check out who most on the pitch and with what,kyk na wie die meeste op die veld is en met wat
217,i and twitter and now everything a noise and the dark mode is pitch black,ek en twitter en nou is alles 'n geluid en die donker modus pikswart
218,can confirm this as i was on the pitch sitting near the palace fence,kan dit bevestig terwyl ek op die veld was wat naby die paleisheining sit
219,i am probably going to ramble a bit here but the is people are really bad at selling and it me that they are probably just turning people off media they might otherwise enjoy by giving a false pitch,"ek gaan waarskynlik hier 'n bietjie rondloop, maar die mense is regtig sleg om te verkoop, en dit is ek dat hulle waarskynlik net mense afskakel wat hulle anders kan geniet deur 'n valse toonhoogte te gee"
220,will be registered but only eligible for on the pitch on the bench,"sal geregistreer wees, maar slegs in aanmerking kom op die veld op die bank"
221,with the pitch and a line drive to left center and that will end the inning,met die toonhoogte en 'n lynrit na die linker sentrum en dit sal die beurt beëindig
222,_ninja if we all pitch in we can get every one of them a flight,"_ninja as ons almal inslaan, kan ons elkeen 'n vlug kry"
223,it is definitely a good pitch as to why all the stuff is regarding  is use of energy but i would not call that a drop statement made about pow,"dit is beslis 'n goeie toonhoogte oor die rede waarom al die dinge gebruik is om energie te gebruik, maar ek sou nie 'n druppelverklaring oor pow noem nie"
224,paper depth t translate to pitch depth apparently,papierdiepte t vertaal blykbaar na die diepte van die toonhoogte
225,spinning pitch match fir flat track or,spining pitch match fir flat track of
226,my computer personalization is for use in pitch black at in the morning like the disgusting rat monster that i am,my rekenaarpersonalisering is soggens in pikswart soos die walglike rotmonster wat ek is
227,happening in the sunny day just look up your will not deceive you with deadly very soon as this becomes more aware there justification will as always be this is for the greater good hence flogging you the whole climate pitch all the time,"gebeur in die sonnige dag net opkyk, sal jou nie met dodelike bedrieg nie, aangesien dit meer bewus word dat daar regverdiging sal wees, soos altyd."
228,i want to force my way into the team but i guess that s the club s decision i just got to work as hard as i can on the pitch and see what via,"ek wil my weg na die span dwing, maar ek dink dat die klub se besluit net so hard as moontlik op die veld moes werk en kyk wat via"
229,looking for a friendly this mid low level referee and pitch all sorted,op soek na 'n vriendelike op hierdie middel lae vlak skeidsregter en toonhoogte gesorteer
230,is there not enough space to have a pitch and a pitch,is daar nie genoeg ruimte om 'n toonhoogte en 'n toonhoogte te hê nie?
231,one full inning it s that only hit and only position pitch,een volledige inning dit is slegs getref en die enigste posisie -toonhoogte
232,_ug mu pitch we talk,_ug mu toonhoogte ons praat
233,f he defensive work out of position constantly and lost on the pitch he s by far the worst winger we have had,"vir die verdedigende werk wat voortdurend buite posisie is en op die veld verloor, is hy verreweg die slegste vleuel wat ons gehad het"
234,qalandar is duo on the pitch,qalandar is 'n duo op die veld
235,from up tow law the town with the highest footy pitch in the are not bad either,van die tow law is die stad met die hoogste voetjie in die are ook nie sleg nie
236,a good spinner do not need a turning track to get like got on every kind of pitch by their line length yes is a utility player to be in the team in any format of cricket,'n goeie draaier het nie 'n draaibaan nodig om op elke soort toonhoogte te kom nie.
237,i would not bother i back and i plenty and got a pitch for the vulnerable,ek sou ek nie die moeite doen nie en ek genoeg en 'n toonhoogte vir die kwesbare
238,yeah i m that perfect pitch pitch,"ja, ek is daardie perfekte toonhoogte"
239,britain is a complete and this is your pitch,brittanje is 'n volledige en dit is jou toonhoogte
240,football will have the final say in how to run their under backed by rishi in a bid today to pitch himself as a mad man of the people is promising a radical shake up in time for the world cup in,"sokker sal die finale sê hê oor hoe om hul onder te bestuur deur rishi in 'n bod vandag om homself as 'n waansinnige man van die mense op te slaan, belowe 'n radikale skudding betyds vir die wêreldkampioenskap in"
241,i was about to reply with some sarcastic ass comment but then thought about how it s dark outside and the on this side of the world must be swimming in pitch darkness and that made me sad,"ek was op die punt om te antwoord met 'n bietjie sarkastiese ass -kommentaar, maar dan nadink oor hoe dit donker is en die aan hierdie kant van die wêreld moet swem in pikduisternis en dit het my hartseer gemaak"
242,i probably should get some sleep considering we have an am first pitch tomorrow but my mind and body don t agree with each other right now watching king of the hill on hulu,"ek moet waarskynlik slaap kry as ons môre 'n eerste toonhoogte het, maar my verstand en liggaam stem nie saam met mekaar saam nie, kyk na king of the hill op hulu"
243,are you an early stage with apply to at the battlefield this in san are on a rolling so hurry the deadline is,is u 'n vroeë fase met aansoek om op die slagveld in san op 'n rol so gou die sperdatum is
244,saw another fantastic four cast prompt thing so my pitch would be strong as reed as sue glen as holt as ben as doom and throw brad bird at it and see what,"het nog 'n fantastiese vier -rolverdeling gesien, sodat my toonhoogte sterk sou wees soos reed soos sue glen as holt as ben as doom en gooi brad bird daarop en kyk wat"
245,_mayosandwich on the same pitch w a much better,_mayosandwich op dieselfde toonhoog
246,arsenal squad on the pitch at stadium th prior to the start of the season back row graham front row court rice ure,arsenal -groep op die veld in stadion th voor die aanvang van die seisoen agter ry graham front row court rice ure
247,anyway you can post the umpire camera on s pitch,in elk geval kan u die skeidsamera op s pitch plaas
248,said he was going to swing at the first pitch from and he did just that with a leadoff single more on s all star game experience,"het gesê dat hy op die eerste veld gaan swaai, en hy het dit gedoen met 'n voorsprong -single meer oor s all star game experience"
249,this is going to be a great victory for chasing on the th day on a tough pitch is no mean feat,"dit gaan 'n goeie oorwinning wees om op die dag op 'n moeilike toonhoogte te jaag, is geen gemene prestasie nie"
250,th day pitch 'n on board always love to play with,thag pitch 'n aan boord hou altyd daarvan om mee te speel
251,high pitch giggling,hoë toonhoogte giggel
252,she was a waste on the pitch,sy was 'n vermorsing op die veld
253,i to all the pitch,ek na al die toonhoogte
254,the was on is not the same flex it was got pitch correction plug,"die was op is nie dieselfde buig nie, dit het 'n toonhoogte -regstellingprop gekry"
255,pitch seen in my life,toonhoogte in my lewe gesien
256,very pitch perfect po,baie toonhoogte perfekte po
257,_ _ drew in the style of pitch cranker w,_ _ trek die styl van pitch cranker w in
258,made with not a line of code no no no social media just passionate looking for repeatable ways to this pitch deck slide brought a smile on my wife s face and i a kiss dear let s build this,"gemaak met nie 'n reël kode nie nee nee nee sosiale media net passievol op soek na herhaalbare maniere om hierdie toonhoogte te skuif, het 'n glimlag op my vrou se gesig gebring en ek 'n soen liewe laat dit bou"
259,so man he was by many while literally doing everything on the pitch glad he s proving all his wrong,"so man dat hy deur baie mense was terwyl hy letterlik alles op die veld gedoen het, bly dat hy al sy verkeerd is"
260,got to watch him pitch a st game from about the th row i was hooked every pitch even if they were nearly meaningless next,"moet kyk hoe hy 'n st -wedstryd van ongeveer die ry af opsteek, ek was elke toonhoogte vasgehaak, selfs al was hulle amper betekenisloos"
261,recent technology innovation in is leading the global trend towards smaller pitch sizes in senior research manager ken park his analysis of how this technology is shaping the led video ecosystem here,onlangse tegnologie -innovasie in die wêreldwye neiging na kleiner toonhoogte in die senior navorsingsbestuurder ken park sy ontleding van hoe hierdie tegnologie die led -video -ekosisteem hier vorm
262,why does my child have to fight barry on the footy pitch at lunch break,waarom moet my kind tydens die middagete teen barry op die voetpak veg
263,_ cannot play a pivot role it is not his kind of play is a player that to run around the pitch and be creative from deep a pivot a position his half possession and put in the right to ignite attack,"_ kan nie 'n spilrol speel nie; dit is nie sy soort toneelstuk nie, is 'n speler wat om die veld te hardloop en kreatief te wees van diep 'n draai 'n posisie in sy half besit en in die regter gestel word om die aanval aan te steek"
264,easy it just season please let just do the talking on the pitch,"maklik dit net seisoen, laat asseblief net die praatjie op die veld doen"
265,it is a feature that remains because some try hard will pitch a fit if it was not there,dit is 'n funksie wat oorbly omdat sommige probeer hard sal pas as dit nie daar was nie
266,this pitch is also bad because avoid pitching in your evening time you do not look professional doing so and what you are really is not that important and do not contact multiple people from the same publication in parallel,"hierdie toonhoogte is ook sleg, want dit is nie belangrik dat u in u aand nie professioneel lyk nie, en wat u regtig is, is nie so belangrik nie en kontak nie meerdere mense van dieselfde publikasie parallel nie"
267,_gambles over scored in the day yeah must be the pitch,"_gambles oor die dag wat in die dag aangeteken is, moet die toonhoogte wees"
268,darn tough to host big pitch session at us trail running conference looking to sponsor three new in that will use this support to elevate the experience for and continue in the trail running community,"darn tough om 'n groot toonhoogte -sessie aan te bied op die us trail running conference wat drie nuut wil borg, wat hierdie ondersteuning sal gebruik om die ervaring te verhoog en voort te gaan in die roetesgemeenskap"
269,he was always a prick on the field terrible body language when there was an error he was good but then he declined until he was also t pitch well in the,"hy was altyd 'n stokkie op die veld vreeslike lyftaal toe daar 'n fout was dat hy goed was, maar toe het hy geweier totdat hy ook nie goed was nie"
270,no team ever above in test cricket at stadium only once a side above in th the pitch is the best turning patch ever in cricket is near to win this while chasing about high praise,"geen span wat ooit in die toetskrieket in die stadion is nie, net een keer 'n kant hierbo in die veld, is die beste draai -pleister wat ooit in krieket is, is naby om dit te wen, terwyl hy agtervolg het oor hoë lof"
271,chasing on a day test match spinning pitch against sri,jaag op 'n dagtoetswedstryd wat draai teen sri
272,win their game today and are headed to we were headed to the all star game but got to pitch in this game so our all star got all of our attention,"wen vandag hul wedstryd en is op pad na ons was op pad na die all star -wedstryd, maar moes in hierdie wedstryd wees, sodat ons all star al ons aandag gekry het"
273,how many of those came when he was tipped to the pitch,hoeveel van hulle het gekom toe hy na die veld getrek is
274,be like keep the pitch count low,wees soos hou die toonhoogte laag
275,good luck to all of us and too me as i pitch you thusly,sterkte aan ons almal en ook my as ek u dus opsteek
276,giving your all for a country that does not even recognize your effort when you leave the pitch after all these some of them no go even get their due compensation after retirement,"om alles te gee vir 'n land wat nie eers u moeite erken as u die veld verlaat nie, na al hierdie sommige van hulle, kry nie hul nodige vergoeding na aftrede nie"
277,i wonder if there will be and were apparently on a yacht with brass in think another player was on that boat or was the pitch just live,"ek wonder of daar blykbaar op 'n seiljag met koper sal wees en dink dat 'n ander speler op daardie boot was, of die veld was net regstreeks"
278,_away your line a key position really me up more if you cannot see that then you have no idea of what conte and are now all about on the pitch keep up with this,"_haway u lyn 'n sleutelposisie regtig meer as u nie kan sien dat u geen idee het van wat conte nie en nou op die veld gaan, hou hiermee by"
279,here is my pitch a demonic ice machine who ice out every time you close the door until you lose your,hier is my toonhoogte 'n demoniese ysmasjien wat elke keer as jy die deur sluit totdat jy jou verloor
280,this track is something else composition singing everything is pitch perfect,"hierdie snit is iets anders komposisie wat alles sing, is perfek"
281,this is so funny manny calling home acting like he did not push an old man to get himself sent out the door sigh,dit is so snaaks manny wat huis toe roep wat optree asof hy nie 'n ou man gedruk het om homself uit te stuur sug
282,i just the 'practice singing your note' level of pitch control with a score of,ek is net die 'practice sing your note' vlak van toonhoogtebeheer met 'n telling van
283,i am writing this to draw the kind attention of the of _gurugram towards the misbehavior and disrespectful tone pitch language of the person who comes to take water meter reading in sector,ek skryf dit om die vriendelike aandag te trek van die van _gurugram na die wangedrag en oneerbiedige toon toonhoogtaal van die persoon wat in die sektor kom om watermeterlees in die sektor te neem
284,is just trying too hard for people to notice him if you be a footballer you need to perform on pitch not on twitter,"probeer net te hard vir mense om hom op te let as u 'n sokkerspeler is, moet u op die toonhoogte optree, nie op twitter nie"
285,first pitch full swing,eerste toonhoogte vol swaai
286,one of the best on the pitch had palace on there,een van die beste op die veld het daar paleis gehad
287,but only on the pitch coach,maar net op die toonhoogte -afrigter
288,_vonne_m same thing i was thinking it is pretty much a pitch,_vonne_m dieselfde ding ek het gedink dit is amper 'n toonhoogte
289,m and last season spicy differential who one of the best per start ratio in the premier league and with he will play and he will start some too always involved in the attack whenever he is on the pitch,"m en die afgelope seisoen gekruide differensiaal wat een van die beste per begin -verhouding in die premierliga is en met hy sal speel, en hy sal 'n paar te altyd by die aanval begin wanneer hy op die veld is"
290,it s literally give the ball to r who everyone on the pitch and then just like what he did in real life,dit gee letterlik die bal aan r wie op die veld en dan net soos wat hy in die regte lewe gedoen het
291,_evans_ think is just happy to keep getting on the pitch from his on field i reckon even he is unsure what his role is,"_evans_ dink net bly om aan te hou om op die veld op die veld te kom, ek dink selfs hy is nie seker wat sy rol is nie"
292,my pitch for a live action popeye anti prestige drama wit story per each in radically an also,my toonhoogte vir 'n lewendige aksie popeye anti -prestige -drama witverhaal per radikaal ook 'n
293,i just tried taking a mouth open snoring pic of josh on the pitch dark plane and the flash went off on accident and they kept sleeping,ek het net probeer om 'n mond oop snorkfoto van josh op die donker vliegtuig te neem en die flits het op ongeluk gegaan en hulle het aanhou slaap
294,every by who it listening to law in his about how much sheer talent they had in the system how they just turned this one pitch and with a few big into legit,elkeen wat dit na die wet luister in sy oor hoeveel talent hulle in die stelsel gehad het hoe hulle net hierdie een toonhoogte omgedraai het en met 'n paar groot in legit
295,i think it s tho is a standard when he s off the pitch you d notice,ek dink dit is 'n standaard as hy van die toonhoogte af sien
296,walking a day in any weather will prolong your life do not let winter discourage you remember it is just per trip this might be the only aerobic exercise you can get your heart will love you if the furniture is a close match with your taste pitch your tent,"as u 'n dag in enige weer stap, sal u lewe nie laat nie, moenie toelaat dat die winter ontmoedig nie. u onthou dat dit net per reis is, dit is miskien die enigste aërobiese oefening wat u kan kry, sal u van u hou as die meubels 'n noue pas by u smaakhoogte, u tent"
297,_rennie some people are on the pitch they think it s all over,"_rennie sommige mense is op die veld, hulle dink dit is oral"
298,_carl can always rely on you to spot the that i don t even off the pitch,_carl kan altyd op u staatmaak om te sien dat ek nie van die veld af is nie
299,platinum a good sniper like in that she cant just shred through an enemy in a high damage burst but she very high damage on her infinite skill and longer range than other anyways i like platinum this is my pitch,"platinum 'n goeie sluipskutter soos sy nie net 'n vyand in 'n groot skade kan versnipper nie, maar sy is baie groot skade aan haar oneindige vaardigheid en langer omvang as in elk geval, ek hou van platinum, dit is my toonhoogte"
300,new balance pitch tech,new balance pitch tech
301,these are just simple elementary manners and decency home training how you stay with someone for more than a day and not find someway to pitch in the house and food how shame don finish for their house,dit is net 'n eenvoudige elementêre maniere en 'n ordentlike tuisopleiding hoe u langer as 'n dag by iemand bly en nie op een of ander manier in die huis opslaan en kos hoe skande nie vir hul huis eindig nie
302,had an all star weekend to celebrate don is birthday off watching the draft by the pool home run derby at stadium more time by the pool and ended it at the field watching our guy pitch can not wait to watch the in the _____,"het 'n all star -naweek om don te vier, verjaarsdag na die konsep by die swembad home run derby in die stadion meer tyd by die swembad en dit op die veld beëindig en kyk hoe ons ou staanplek kan wag om die _____ te kyk"
303,there ever been a men s player that is equally talented and universally even off the pitch,daar was ooit 'n mansspeler wat ewe talentvol en universeel selfs van die veld af is
304,_mewitt agreed lots to enjoy with the on the pitch and the new and some re of old from the bell end were great too,_mewitt het baie ingestem om te geniet met die op die veld en die nuwe en sommige van ouds van die klokkie was ook wonderlik
305,thanks to for the game and hospitality the pitch was top class again good luck for the season,"dankie aan die spel en gasvryheid, was die toonhoogte weer die beste geluk vir die seisoen"
306,prize winner s pitch with power profiting as soar the new daily said it made sense to tax the windfall power have while are hit with surging,"die pryswenner se toonhoogte met krag wat die nuwe daaglikse styg, het gesê dat dit sinvol is om die meevaller te belas, terwyl dit getref word met die stygende"
307,yes but i m going to need because sometimes i want my place pitch black,"ja, maar ek sal nodig hê, want soms wil ek hê dat my plek pikswart wil hê"
308,do you have an idea to showcase the during the commonwealth the government is calling on everyone to pitch for the big event,het u 'n idee om dit ten toon te stel tydens die statebond wat die regering 'n beroep doen om almal op te stel vir die groot geleentheid
309,the culture of your own and running on to the pitch like an idiot,die kultuur van u eie en hardloop soos 'n idioot na die veld
310,pitch pitch pitch,pitch pitch pitch
311,can not believe that is on the verge of chasing down on a day pitch at where a total higher than only been twice,"kan nie glo dat dit op die punt is om op 'n dagveld te jaag nie, waar 'n totaal hoër is as slegs twee keer"
312,four more are entering the pitch we are delighted to welcome as the new member of to make people is easier spot will also help us achieve our big goal a united world for to learn more,nog vier is besig om die veld binne te kom.
313,to raw vocal from and from today and i have tone and pitch control so much,tot rou vokaal van en van vandag en ek het soveel toon- en toonhoogtebeheer
314,ya know if jake t make it back for or series one more start he s be lined up to pitch last game of series in and ya know how much he pitching down there think that s better too series be too much adrenaline,"jy weet of jake nie weer vir of 'n reeks een begin nie, sal hy opgestel word om die laaste reeks van reekse in te stel en jy weet hoeveel hy daar onderaan dink dat dit beter is om te veel adrenalien te wees"
315,this why you should design your brand identity like an elevator pitch learn more,"dit waarom u u handelsmerkidentiteit moet ontwerp soos 'n hysbak -toonhoogte, leer meer"
316,better add simulator to the elevator pitch i guess,"beter voeg simulator by die hysbakhoogte, dink ek"
317,wow you have so the point on haje s post that t an invitation to pitch him more,sjoe jy het so die punt op haje se pos dat 'n uitnodiging om hom meer op te stel
318,why do almost all in have this creepy alien sound with the that high pitch vibration,waarom het byna almal hierdie grillerige uitheemse klank met die daardie hoë toonhoogte -vibrasie
319,made machine well by previous user model maximum pitch to be shaped module maximum pitch circle diameter maximum face width range of min _machine,machine goed gemaak deur die vorige gebruikersmodel maksimum toonhoogte om vorm te vorm module maksimum toonhoogte sirkel deursnee maksimum gesig breedte van min _machine
320,said first pitch full swing not first swing,gesê die eerste toonhoogte vol swaai nie eers swaai nie
321,i wish fernando is first pitch was,ek wens fernando is die eerste plek
322,competition encouraging to pitch business,mededinging bemoedigend om sake te doen
323,at fire you get to camp in your very own private pitch the are private but not isolated private enough so you get to enjoy your peaceful time in nature but not so private that you are completely isolated from other book,"by fire kom u in u eie privaat toonhoogte, is privaat, maar nie privaat genoeg geïsoleer nie, sodat u u rustige tyd in die natuur kan geniet, maar nie so privaat dat u heeltemal van 'n ander boek geïsoleer is nie"
324,today we are live from both and we would like to thank all for the engagement so far we look forward to seeing you all on the pitch soon,"vandag kom ons van albei af, en ons wil almal bedank vir die verlowing tot dusver. ons sien uit daarna om u almal binnekort op die veld te sien"
325,and reference the pitch ',en verwys die toonhoogte '
326,shock the lad is just to young to be the level cried of the pitch because of a collision he s a talent let the grow up first,"skok die seun is net te jonk om die vlak van die veld te wees as gevolg van 'n botsing wat hy 'n talent het, laat die eerste grootword"
327,_jen could not agree more from the so i watched it was scrappy and aimless off target kicking from all over the pitch and clinical technical ability in the final with a soft penalty given superb from the queen though,"_jen kon nie meer saamstem van die nie, so ek het gekyk dat dit skelm en doelloos van die teikenskop van regoor die veld en kliniese tegniese vermoë in die eindstryd was, met 'n sagte strafskop, alhoewel dit 'n uitstekende van die koningin is"
328,like she was struggling with pitch and sounding airy while standing up but u talk about,"soos sy sukkel met toonhoogte en klink lugagtig terwyl sy opstaan, maar jy praat oor"
329,_epstein this is s pitch for a regular spot on where he would be with open arms,_epstein dit is 'n toonhoogte vir 'n gereelde plek waar hy met ope arms sou wees
