,src,trg
1031,entertainment and media taste official video offset,vermaak en media smaak amptelike video -offset
1032,oh god billionaire who can afford a million club just ended his purchase offer b c he its bad sadly he does not have the same disgust for bad,"o god miljardêr wat 'n miljoen klub kan bekostig, het pas sy aankoopaanbod beëindig."
1033,walk by on pop annual believe just entertainment,loop deur op pop jaarlikse believe net entertainment
1034,a minute video with former founder entertainment guest are powered by _auctions,'n minuut video met die voormalige stigter -vermaaklikheidsgas word aangedryf deur _auctions
1035,beautiful music for successful wedding,pragtige musiek vir suksesvolle troue
1036,singing trio chapel hart gave a vibrant audition on tuesday is episode that inspired the and host terry to do something they only reserve for the most exceptional of,"singing trio chapel hart het dinsdag 'n lewendige oudisie gegee, is die episode wat die aanbieding van terry geïnspireer het om iets te doen wat hulle net bespreek vir die mees uitsonderlike van"
1037,you tell me  wouldo not get too attached' like this is just entertainment,jy sê vir my sou ek nie te geheg raak nie 'soos dit net vermaak is
1038,casino myth you can make money by gambling fact gambling is a form of entertainment winning is not,"casino -mite jy kan geld verdien deur te dobbel feit dat dobbel, is 'n vorm van vermaaklikheid"
1039,we with go,ons met go
1040,a truly great _a_buzzi north actor ruth series of was a star of rowan martin s laugh in from and numerous other for four before retiring,'n werklike groot _a_buzzi -noordelike akteur ruth -reeks was 'n ster van rowan martin se lag in en talle ander vir vier voordat hy uitgetree het
1041,check out in print monthly magazine music entertainment vintage rare via,kyk in die gedrukte maandelikse tydskrif music entertainment vintage rare via
1042,smile bar venue home of the best,smile bar venue home van die beste
1043,from through join for live music and entertainment all over there will even be a th street block party in on check out for the whole schedule,"vanaf deur joy vir lewendige musiek en vermaak daar oral sal daar selfs 'n th street block party wees, kyk na die hele skedule"
1044,not to be a hat conspiracy theorist but she a relative thats high up in the entertainment world like thats the only reason i can think of,"om nie 'n hoed -samesweringsteoretikus te wees nie, maar sy 'n familielid wat in die vermaaklikheidswêreld hoog is, soos die enigste rede waarom ek kan dink"
1045,i mean it is the most devastating move in all sports entertainment,ek bedoel dit is die verwoestendste skuif in alle sportvermaak
1046,due to twitter s new policy i declare this account is purposely made for only all in this account is not with the real kim nor red velvet entertainment,"as gevolg van die nuwe beleid van twitter, verklaar ek dat hierdie rekening doelbewus gemaak is vir slegs alles in hierdie rekening is nie by die regte kim of red velvet entertainment"
1047,i see i am going to have to run the often this season so here we go this is a show for entertainment ladies these men are not your men they are not coming home to you some of y'all are already coming apart at the relax breathe,"ek sien ek sal hierdie seisoen gereeld moet hardloop, so hier gaan ons, dit is 'n vertoning vir vermaak dames, hierdie mans is nie jou mans nie; hulle kom nie na jou toe nie, sommige van julle kom al uitmekaar by die ontspannings"
1048,open drop entertainment educational zoom pro pro,open drop entertainment opvoedkundige zoom pro pro
1049,up and got  is are holding their fan this week,up en got is hierdie week hul aanhanger
1050,i still see this in my mind as someone who should be to want a autograph from we all do should not just be for the plus it s like foul like should all be able to keep what they catch it s just a sport for entertainment,"ek sien dit nog steeds in my gedagtes as iemand wat 'n handtekening van ons almal moet hê, moet nie net wees vir die plus nie, dit is soos 'n vieslike manier."
1051,mo new comedy special after settling legal dispute with streaming service yahoo entertainment,mo nuwe komedie -spesiale na die beslegting van die wettige geskil met die streaming diens yahoo vermaak
1052,i think people like san are rare it s because there are such that the entertainment world is so scary t that right san,"ek dink mense soos san is skaars, dit is omdat daar so is dat die vermaaklikheidswêreld so eng is dat dit reg is"
1053,mo finally comedy special after lawsuit times,mo uiteindelik komedie spesiaal na regsgedingtye
1054,story not the violence movie news times of the times of utm_source twitter,verhaal nie die geweldsmilm nuus van die times of utm_source twitter
1055,wrong each at least slave who works to provide food accommodation and entertainment some have a whole entourage of ranging a fair bit in age,"verkeerd elkeen ten minste slaaf wat werk om kosverblyf en vermaak te voorsien, sommige het 'n hele entoesiasie om 'n redelike tyd te wissel"
1056,_daneel_ python flip and of throughout history would like a word with you about drag as a long accepted form of entertainment,_daneel_ python flip en van deur die geskiedenis wil 'n woord saam met u oor drag as 'n lang aanvaarde vorm van vermaak
1057,polygon the itself quite video popular gaming entertainment media site by best video of __ for and as well as a best of all time list made up of exclusively video from no other,polygon die self baie video populêre gaming entertainment media site volgens die beste video van __ vir en sowel as 'n beste van alle tydlys wat bestaan ​​uit eksklusiewe video uit geen ander
1058,so hope yours stays mild but also i am sorry because there are no to be had in that tho hopefully there is entertainment,"hoop dus joune bly sag, maar ek is ook jammer, want daar is nie in die geval dat daar hopelik vermaak is nie"
1059,also go to the local quarry and skip for entertainment it would be plain fiddle faddle if we did not,"gaan ook na die plaaslike steengroef en slaan oor vir vermaak, dit sou 'n gewone vroetel wees as ons dit nie doen nie"
1060,alright bed time is and thank you for the much entertainment,goed slaaptyd is en dankie vir die baie vermaak
1061,sesame street theme park accused of racism after video character snubbing two black you know life is not always fair even for,"sesame street theme park wat van rassisme beskuldig word nadat die video -karakter twee swart geknak het, weet jy die lewe is nie altyd regverdig nie"
1062,_ pretty clear this is just a con to pretend like well we didnt find anything but its cause they it or when in dought it you people are never ending entertainment,"_ nogal duidelik dat dit net 'n voorsprong is om voor te gee soos goed dat ons niks anders gevind het nie, maar die saak wat dit is, of as dit in die gedagte is, eindig u mense nooit die vermaak nie"
1063,can not help but see k pop as such a massive corporate machine out content to their audience but then again i like marvel so maybe corporate ethics and tactics are not exactly the metric by which most people choose their entertainment from,"kan nie anders as om k te sien nie, soos 'n massiewe korporatiewe masjien vir hul gehoor, maar dan hou ek weer van marvel, miskien is korporatiewe etiek en taktieke nie presies die metriek waarmee die meeste mense hul vermaak kies nie"
1064,how 'john wick' star took script originally written for a year old man and made it his own,hoe 'john wick' -ster 'n draaiboek geneem het wat oorspronklik vir 'n jaar oue geskryf is en dit sy eie gemaak het
1065,is will is about to be pure entertainment,is will is op die punt om suiwer vermaak te wees
1066,the entertainment department on the way upstairs to have a discussion with the scouting department,die vermaakafdeling op pad bo om 'n bespreking met die verkenningsafdeling te voer
1067,new of and from courtesy,nuut van en van hoflikheid
1068,breakfast is carol as she show history with announcement,ontbyt is carol terwyl sy geskiedenis met aankondiging wys
1069,we cope mask in our own way besides i am not the kind of person to drag down with me i am a clinically depressed libra she is out content for entertainment comfort i am not her to fix me so i am not dumping it all on her or anyone i am surviving,"ons hanteer masker op ons eie manier, behalwe dat ek nie die soort persoon is om saam met my af te trek nie, ek is 'n klinies depressiewe weegskaal. enigiemand wat ek oorleef"
1070,welcome to flytrap entertainment,welkom by flytrap entertainment
1071,and most young know who graham is but they t be to somehow have experienced and know everything about something that was before they were born football is a sport we watch for entertainment not a history lesson just let people enjoy something,"en die meeste jonk weet wie graham is, maar dit is nie om op een of ander manier te ervaar nie en weet alles van iets wat voor hulle gebore is, is 'n sportsoort wat ons vir vermaak kyk, nie 'n geskiedenisles nie, laat mense net iets geniet"
1072,subtly to holding with another woman via,subtiel om met 'n ander vrou via vas te hou
1073,please end fox entertainment and misinformation channel now end the misery,beëindig fox entertainment en misinformation channel nou die ellende
1074,good thread bring it senator and i know you both care about the entertainment and news media and will easily collect b in revenue in almost all based on surveillance based advertising everyone else s work,goeie draad bring dit senator en ek weet dat julle albei omgee vir die vermaak- en nuusmedia en dat b bykans b in inkomste sal insamel in byna alles gebaseer op toesiggebaseerde advertensies wat almal se werk adverteer
1075,springtrap who we don t know that bitch we only know entertainment cheese,"springtrap wie weet ons nie die teef nie, ons ken net vermaakkaas"
1076,i feel like been around since civilization part of me just feel like public sex was as entertainment in some ancient just like public,"ek voel asof daar 'n beskawing van my is, net soos openbare seks so vermaak was in sommige antieke net soos die publiek"
1077,mine is a new game thats out a manga that i like some famous athlete and some entertainment,myne is 'n nuwe speletjie wat 'n manga uit is wat ek van 'n beroemde atleet en 'n bietjie vermaak hou
1078,this guy is one of the worst people to ever try to approach he is an to and stuck up pie' singer don true meaning of his year song,hierdie man is een van die slegste mense wat nog ooit probeer nader het dat hy 'n to -sanger don true meaning of his year song is
1079,brad proved not a good friendly husband of now old enough must leave room for to cine industry best for him to adopt social welfare for better life if have to spend his large heaps of wealth,"brad was nie 'n goeie vriendelike man van nou oud genoeg nie, moet die ruimte vir die beste vir hom wees om maatskaplike welsyn vir 'n beter lewe aan te neem as hy sy groot hope rykdom moet spandeer"
1080,biography salary height age more,biografie salarishoogte ouderdom meer
1081,entertainment i demand entertainment,vermaak ek eis vermaak
1082,fantasy entertainment go,fantasievermaak gaan
1083,all star game should be shut down it s a entertainment game and want to see and not play straight up and no defensive pitching dual for a all star game is sad,"all star game moet gesluit word, dit is 'n vermaaklikheidswedstryd en wil sien en nie regop speel nie en geen verdedigende pitching dual vir 'n all star -wedstryd is hartseer nie"
1084,entertainment all is full warranty if are fix replace mop me to avail cheap affordable,"vermaak alles is volle waarborg as dit reg is om te vervang, mop my om goedkoop bekostigbaar te maak"
1085,the entertainment industry is large enough that marvel for instance can have white male and non white male sorry that you,"die vermaaklikheidsbedryf is groot genoeg dat marvel byvoorbeeld wit manlike en nie -wit man kan hê, jammer dat jy"
1086,why did they report on a seeing an actor and a rapper leaving and entering a restaurant because it news is more and more entertainment have you that some read it as if they were an audio book in their own,"waarom het hulle verslag gedoen oor die siening van 'n akteur en 'n rapper wat 'n restaurant verlaat en binnekom, want dit is meer en meer vermaak, het u dit gelees asof hulle 'n klankboek op hul eie is"
1087,sesame street my are watch jersey shore and learn real entertainment,sesame street my is watch jersey shore en leer regte vermaak
1088,_videos let director tell you and the dying for entertainment,_videos laat regisseur jou vertel en die sterf vir vermaak
1089,tubby mary jane by tubby on for tha,tubby mary jane deur tubby op vir tha
1090,why do we need a bunch of fighter as entertainment for a stupid baseball game t we in a climate crisis it who,"waarom het ons 'n klomp vegter nodig as vermaak vir 'n dom bofbalwedstryd, ons in 'n klimaatskrisis wat"
1091,education my entertainment is considerably i think you are on your _,onderwys my vermaak is aansienlik ek dink jy is op jou _
1092,brad 'we are all of fate' via,brad 'ons is almal van die noodlot' via
1093,lost another in the second quarter amid competition and soaring inflation squeezing household,het nog 'n in die tweede kwartaal verloor te midde van kompetisie en die stygende inflasie -pers huishouding
1094,hey we get lots of rain here in especially in the fall would love to have you visit our beautiful city,"hey, ons kry baie reën hier, veral in die herfs sal u graag ons pragtige stad besoek"
1095,_post_enjoyer yes is in a friendly and simple way is media and is not even a mature way to present those to mufasa is death does not turn lion king into adult entertainment,_post_enjoyer ja is op 'n vriendelike en eenvoudige manier media en is nie eens 'n volwasse manier om diegene aan mufasa voor te stel nie.
1096,it is been funny watching and go at it quality entertainment,dit was snaaks om te kyk en het gehalte vermaak
1097,back into public eye at 'bullet train' premiere via,terug in die openbare oog by 'bullet train' première via
1098,hey we put a weapon inspired by you in our mobile game just to say thank you for all the entertainment you have given us thanks again from our and,"hey, ons het 'n wapen wat u geïnspireer het in ons mobiele speletjie geplaas net om dankie te sê vir al die vermaak wat u ons weer bedank het van ons en"
1099,his music were also jury selected his entertainment award is by industry be it dance music variety,"sy musiek was ook die jurie gekies. sy vermaakprys is deur die industrie, of dit nou dansmusiekvariëteit is"
1100,_thadeacon it s about entertainment,_thadeacon dit gaan oor vermaak
1101,_ _ the only entertainment that gone down in price freak,_ _ die enigste vermaak wat in prysfreak afgegaan het
1102,someone s time for entertainment what a lame ass,iemand is tyd vir vermaak wat 'n lam gat
1103,_damned well i am a non club group gang cult person i do not join stuff guess i am a lone wolf i do not talk serious on line i just express my obnoxious because twitter is entertainment for me and i meta few interesting people on twitter,"_ gedaal, ek is 'n bende -kultuspersoon nie klubgroep nie, ek sluit nie aan by dinge nie, dink ek is 'n eensame wolf. ek praat nie ernstig nie, ek spreek my onheilspellend uit, want twitter is vermaak vir my en ek het 'n paar interessante mense op twitter."
1104,at this point a tin is just posting the way for for entertainment we know it insecure emotional like you,"op hierdie punt plaas 'n blik net die weg vir vermaak, weet ons dat dit onseker is soos jy"
1105,_tbt by this is good entertainment i m used to youth sports this way not,"_tbt hiermee is goeie vermaak, ek is gewoond aan jeugsport op hierdie manier nie"
1106,it is a good reminder that can do everything right and outside influence can sometimes still have a greater impact it is because my brother the of every he ever had until he met his wife but at least i have the entertainment,"dit is 'n goeie herinnering wat alles reg kan doen en die invloed van buite kan soms nog 'n groter impak hê, dit is omdat my broer die van elkeen wat hy ooit gehad het totdat hy sy vrou ontmoet het, maar ten minste het ek die vermaak het"
1107,i t know her personally but she worked in entertainment at,"ek weet nie haar persoonlik nie, maar sy het in vermaak gewerk by"
1108,in the day documentary to hit in,in die dag dokumentêr om in te slaan
1109,if your show constantly talking yet overwhelmingly to reject maybe do not be if people change the channel,"as u show voortdurend praat, maar tog oorweldigend om te verwerp, is dit miskien nie as mense die kanaal verander nie"
1110,ask kind of like ask but entertainment is meant to be creative,"vra soort van soos vra, maar vermaak is bedoel om kreatief te wees"
1111,can you start drama with other again and your feud with was peak entertainment,kan u weer drama met ander begin en u vete met 'n piek vermaak
1112,entertainment k,vermaak k
1113,_gregtaylor disbar gen for slandering on fox entertainment malfeasance as the highest law officer of the state and sue fox entertainment for slander,_gregtaylor disbar gen vir laster op fox entertainment -mishandeling as die hoogste regsbeampte van die staat en sue fox entertainment vir laster
1114,little incredible you may not know,min ongelooflik weet jy miskien nie
1115,to join with for unique love story here is all about it,"om hiermee saam te werk vir 'n unieke liefdesverhaal, gaan alles daaroor"
1116,academy of country music head to on prime video,akademie vir country music gaan na prime video
1117,kim leaves source music on that it decided to terminate the k pop idol s exclusive contract with the label amid bullying according to entertainment news outlet le_sserafim twitter,kim verlaat bronmusiek daarop dat hy besluit het om die eksklusiewe kontrak van die k pop idol met die etiket te beëindig te midde van afknouery volgens die vermaaklikheidsnuus le_sserafim twitter
1118,finally found the start of the maze in season via,uiteindelik die begin van die doolhof in die seisoen via
1119,after shark tank year update,na shark tank year update
1120,would defend a if it was and under entertainment,sou 'n verdedig as dit was en onder vermaak
1121,sunny gang are all in new from their,sonnige bende is almal nuut van hul
1122,sport an activity physical exertion and skill in which an individual or team against another or for entertainment,sport 'n aktiwiteit fisiese inspanning en vaardigheid waarin 'n individu of span teen 'n ander of vir vermaak
1123,joe rogan s repulsive about shooting homeless people l a s unhoused via you may have been but ur extreme will take it serious go on shooting spree,"joe rogan is afstootlik oor die skiet van hawelose mense wat nie deur u was nie, maar u uiterste sal dit ernstig opneem op die skietery"
1124,photo by,foto deur
1125,the being used to defend pro abortion for genocide of white and goyim wonderful religion and whites allow these people to control their finance media entertainment and government,"die word gebruik om pro -aborsie vir volksmoord van wit en goyim wonderlike godsdiens en blankes te verdedig, stel hierdie mense in staat om hul finansieringsmedia -vermaak en die regering te beheer"
1126,open bar with garnish buffet colorful detailed theme specific chosen to the second by me that progressively more like an set no emcee but of entertainment and mystery surprise no maybe to keep them out,"oop balk met garnish buffet kleurvolle gedetailleerde temaspesifiek gekies vir die tweede deur my wat geleidelik meer soos 'n stel geen emcee nie, maar van vermaak en misterie verras nee, miskien om dit uit te hou"
1127,yer doing it provide stellar entertainment here,u doen dit bied sterre vermaak hier
1128,let them marry and have happy life,laat hulle trou en 'n gelukkige lewe hê
1129,is in is not just while she is there she might also enjoy the entertainment and even the beautiful desert scenery,"is in is nie net terwyl sy daar is nie, kan sy ook die vermaak en selfs die pragtige woestynlandskap geniet"
1130,oh i am going to puke and ben cried while 'emotional' according to a chapel employee who was at their wedding,"o, ek gaan puke en ben huil terwyl hy 'emosioneel' is volgens 'n kapelwerknemer wat by hul troue was"
1131,but i am tho it is all entertainment the world as we know it is ending talk yo sh t by all or throw away yo phone one,"maar ek is dit alles vermaak die wêreld, want ons weet dit is om te eindig met almal of weggooi u telefoon"
1132,mount premier entertainment you tube via,mount premier entertainment you tube via
1133,the is a fun free site where you can browse and share of you can also enter by entertainment for a chance to win monthly and maybe even launch your child is modeling career,die is 'n prettige gratis webwerf waar u kan blaai en deel van u kan ook deur entertainment in 'n kans kry om maandeliks te wen en miskien selfs u kind bekendstel.
1134,jane the virgin writer from an undocumented learner to,jane die virgin -skrywer van 'n ongedokumenteerde leerder tot
1135,major company,groot maatskappy
1136,series stealth quot in source search reason true,reeks stealth quot in bron soek rede waar
1137,he t the defendant who to bed anyone she to carve on her bedpost,hy is nie die verweerder wat iemand wat sy op haar bedpaag moet kerf nie
1138,the problem at is the politics desk and the opinion which are big of engagement they subsidize with clicky entertainment the rest of the outstanding paper we should encourage family to sub to and ask them to disregard politics,die probleem is die politiek -lessenaar en die mening wat groot is van betrokkenheid wat hulle met clicky entertainment subsidieer. die res van die uitstaande referaat moet ons die gesin aanmoedig om hulle te onderneem en hulle te vra om die politiek te verontagsaam
1139,_artists yeah because have nothing to do in life to frame someone in the entertainment industry girl get a life,"_artiste ja, want het niks in die lewe om te doen om iemand in die vermaaklikheidsbedryf te raam nie"
1140,series extraordinary attorney woo kept its top spot on s most watched non series for the second week in a row,die buitengewone prokureur woo het sy topposisie op die mees gekykte nie -reeks vir die tweede week agtereenvolgens gehou
1141,prince concerned about 'alarming',prins is besorg oor 'kommer'
1142,new_vision_muzik_chante_non_li_live_at_ gospel_entertainment_festival_fest_amp_healthcare_fair_mp _ go to listen,new_vision_muzik_chante_non_li_live_at_ gospel_entertaining_festival_fest_amp_healthcare_fair_mp _ gaan luister
1143,share on twitter,deel op twitter
1144,barney the dinosaur documentary is heading to peacock in,barney die dinosourus -dokumentêr is op pad na peacock in
1145,t think i had to explain but entertainment golf south during apartheid both in to whitewash their oppressive took a stand hope it s clearer now,"ek dink dat ek moes verduidelik, maar vermaak gholf suid tydens apartheid albei om hul onderdrukkende standpunte in te stel, hoop dat dit nou duideliker is"
1146,tipsy feel different atmosphere one stop entertainment,tipsy voel verskillende atmosfeer een stop vermaak
1147,do 'fly with the gold' no japan academy 'fly with the gold' no japan film de de 'cool on the block' na entertainment,doen 'vlieg met die goud' no japan akademie 'vlieg met die goud' geen japan film de de 'cool on the block' na vermaak
1148,looking at the cage it is too small too and does not have nearly enough space at bottom for proper he is probably overweight do to boredom and depression need constant entertainment and to do,"as ek na die hok kyk, is dit ook te klein en het dit nie na onderaan nie, maar dit is waarskynlik oorgewig om verveling en depressie voortdurend te vermaak en te doen"
1149,don back at his masterpiece 'american pie' from,don terug by sy meesterstuk 'american pie' van
1150,is a south girl group under entertainment the current of official and this is their most recent release tales of the unusual,is 'n south girl group onder vermaak die huidige amptenaar en dit is hul mees onlangse vrystellingstale van die ongewone
1151,amy cox people are not really paying they are not really turning in a lot of people live in an information bubble get their from a single source it is media when that is all you consume it is a problem it is not even media it is entertainment,amy cox -mense betaal nie regtig dat hulle nie regtig besig is om baie mense in 'n inligtingsborrel te woon nie.
1152,_ that s the word on the curb 'rhoa' spotted holding with 'love,_ dit is die woord op die randsteen 'rhoa' vasgesprek met 'liefde
1153,entertainment was never for your enjoyment,vermaak was nooit vir u genot nie
1154, nothor love and thunder' its box office dominance in,nothor love and thunder 'sy loketoorheersing in
1155,love this article about thank you for your dedication to in thank you for your dedication and brilliance virtual book launch tomorrow,hou van hierdie artikel oor dankie vir u toewyding aan in dankie vir u toewyding en glans virtuele boekbekendstelling môre
1156,and cinema are two very different of entertainment g,en bioskoop is twee baie anders van vermaak g
1157,sign me up my entertainment consumption is based on my limited and specific of free time not on whether or not i like what i m watching,"teken my aan. my vermaakverbruik is gebaseer op my beperkte en spesifieke vrye tyd, nie of ek hou van wat ek kyk nie"
1158,i need entertainment with their solo artist,ek het vermaak saam met hul solo -kunstenaar nodig
1159,times a scandal broke the it s safe to say that in the since the family gaining notoriety most people know them through the many times they to make,"keer dat 'n skandaal die it is, is dit veilig om te sê dat in die aangesien die gesin bekendheid verwerf het, die meeste mense hulle ken deur die vele kere wat hulle moet maak"
