,src,trg
0,great build up play again all from drive across pitch ball into the box and built taken down no pen given _nz _football,'n fantastiese opbou -spel weer van die rit oor die pikbal in die boks en gebou opgeëis geen pen gegewe _nz _football
1,if you can make one heap of all your winnings and risk it on one turn of pitch and toss if you can force your heart and nerve and sinew to serve your turn long after they are gone and so hold on when there is nothing in you except the will which to them hold on,"as u een hoop van al u winste kan maak en dit op een draai kan waag en gooi as u u hart en senuwee en senuwees kan dwing om u beurt te dien lank nadat hulle weg is en so vashou as daar niks in u is nie, behalwe die wil wat aan hulle vashou"
2,to a move to n because west ham will not break their wage structure for a man that spent more time on than he did on the pitch last season the man for what he is move on quickly to realistic we actually have a chance of,"na 'n verhuising na n omdat west ham nie hul loonstruktuur sal verbreek vir 'n man waaraan hy meer tyd spandeer het as wat hy verlede seisoen gedoen het nie, die man vir wat hy vinnig oorgaan na realisties, het ons eintlik 'n kans om"
3,u to attend the pitch event and holding a event in celebration of th anniversary in collaboration with next week th _official,u om die toonhoogte -geleentheid by te woon en 'n geleentheid te hou ter viering van die bestaansjaar in samewerking met volgende week
4,wish we d worry about stuff on the pitch as we do about everything else,wens ons is bekommerd oor dinge op die veld soos ons oor alles anders doen
5,getting out of my comfort zone a pitch to the industry thank you for the amazing workshop on research,"om uit my gemaksone te kom, 'n toonhoogte na die bedryf, dankie vir die ongelooflike werkswinkel oor navorsing"
6,comes in to pitch for team surf top sand surf,kom in om te staan ​​vir team surf top sand surf
7,game pitch the world of the with the difficulty level of prey and the presentation of grand theft auto,speletjie -toonhoogte die wêreld van die met die moeilikheidsgraad van prooi en die aanbieding van grand theft auto
8,proposal exotic car flood damage restoration my pitch deck so far is a video,voorstel eksotiese motorvloei skade herstel my toonhoogte -dek tot dusver is 'n video
9,the only idol who can be an ace is he can do absolutely everything sing dance rap compose perfect pitch can draw cook shoot good in sports and science his are above average even if he is doing something for the first time he is the only ace,"die enigste afgod wat 'n aas kan wees, is dat hy absoluut alles kan doen sing dance rap compose perfect pitch kan trek cook shoot good in sports en science is bogemiddeld, selfs al doen hy iets vir die eerste keer dat hy die enigste aas is"
10,i would put at a b a lot of good moving and but the execution as well as the felt only saw the first trailer so were low but felt like a good pitch more so than a landing,"ek sou baie goed bewerkstellig, maar die uitvoering sowel as die gevoel het net die eerste sleepwa gesien, so was dit laag, maar voel soos 'n goeie toonhoogte meer as 'n landing"
11,hi who is the best person to pitch a news story to for the,hallo wie is die beste persoon om 'n nuusverhaal vir die
12,i do miss the band line i a set there one night on the rane rotary with and s some of the i had to walk to the other end of the booth to adjust the pitch,ek mis die bandlyn ek 'n stel een nag daar op die rane draai met en ek moes na die ander punt van die stand stap om die toonhoogte aan te pas
13,pitch b flight still we,pitch b vlug nog steeds
14,overcast morning a little cooler on we have jack allan hole mixed on both are fully open for play please remember to replace your repair your pitch and rake the enjoy,bewolkte oggend 'n bietjie koeler op ons het jack allan hole gemeng op albei is volledig oop vir speel. onthou asseblief om u herstel te vervang en die genieting te hark
15,amazing that guy is so strong i am sure he is still looking at the spot where he picked up the pitch and the path what a hitter what an,"verbasend dat die ou so sterk is, ek is seker dat hy nog steeds na die plek kyk waar hy die veld opgetel het en die paadjie wat 'n hitter"
16,i was say i thought i remember watching him fire in a pitch for in the world series,ek het gesê ek het gedink ek kan onthou hoe ek hom in 'n toonhoogte in die wêreldreeks laat vuur het
17,offense needs to run the pitch option with and our more often example,oortreding moet die toonhoogte -opsie uitvoer en ons meer gereeld voorbeeld
18,singing in purely physical is simply a matter of pitch and timing in the next selection the computer a familiar ditty,sing in suiwer fisieke is bloot 'n kwessie van toonhoogte en tydsberekening in die volgende keuse die rekenaar 'n bekende ditty
19,i always talk at high pitch,ek praat altyd op 'n hoë toonhoogte
20,aged walking across bridge were every where when i got to the scoreboard end i never seen as many empty whisky on the floor the police had their work cut out that week end went on pitch to get in end,"die verouderde loop oor die brug was oral waar toe ek aan die einde van die telbord gekom het, ek het nog nooit soveel leë whisky op die vloer gesien nie."
21,happy birthday have a fantastic day hope to see you on the pitch again soon,gelukkige verjaarsdag 'n fantastiese dag hoop om jou binnekort weer op die veld te sien
22,slightly more than that still at least one of them must be to pitch in is any good at and doing the school run,"effens meer as dit nog, ten minste een van hulle moet wees om in te slaan, is goed daarmee en doen die skoolloop"
23,_starmer there is a narrow window left for getting proportional representation to be a major issue for the electorate with the last few conservative and almost certainly the next one we can show the system is broken and pitch as the way forward,_starmer daar is 'n smal venster oor om die proporsionele voorstelling te kry as 'n groot probleem vir die kiesers met die laaste paar konserwatiewe en byna seker die volgende een wat ons kan wys dat die stelsel gebreek is en die pad vorentoe is
24,_m_charles must be inspirational on and off the pitch not piano ne tattoo hay those are just,_m_charles moet inspirerend wees op en van die veld af en nie klavier ne tatoeëring hooi nie
25,we made it to the to watch our live pitch on tomorrow from please register here,ons het dit na die regstreekse môre laat kyk vanaf asseblief om hier te registreer
26,_may _hq _cameron _ and now that the constructive death sentence lynch mob mentality been to progress to fever pitch everyone their part in it does take my life because they do not want to be the one to that someone as if a is correct,"_may _hq _cameron _ en noudat die konstruktiewe doodsvonnis lynch mob mentality was om te vorder om koors te gee, neem hulle deel daaraan toe, want dit wil nie die een wees vir iemand asof 'n korrek is nie"
27,test export we can not continue to play in surviving mode the counter attack is the key for to shatter down the confidence of or else they will easily eat these who choose survival mode on a pitch providing crazy spin,"toetsuitvoer ons kan nie voortgaan om in die oorlewende modus te speel nie; die teenaanval is die sleutel om die vertroue van die vertroue te verbreek, anders eet hulle maklik hierdie wat die oorlewingsmodus kies op 'n toonhoogte wat 'n mal draai bied"
28,q a about what arise when adaption to the human voice how many is able to are there any that would like to explore in the future check out story pitch space q a on,"v a oor wat ontstaan ​​wanneer aanpassing aan die menslike stem hoeveel daar in staat is om daar te wees wat in die toekoms wil verken, gaan kyk uit storiehoogte q a on"
29,look for famous in ur genre find their and pitch your music to them till dey start paying attention to you dont be all over the place with your music you wont get consistent doing that,"soek beroemd in u genre vind hulle en gee jou musiek aan hulle toe totdat dey begin let daarop dat jy nie oral moet wees met jou musiek nie, sal jy dit nie konsekwent doen nie"
30,a whole pitch,'n hele toonhoogte
31,the nexus between back to the rise of military later carried out the legacy of anti secular politics in read,die nexus tussen terug na die opkoms van die militêre later het die nalatenskap van anti -sekulêre politiek in lees
32,miss grand united kingdom in a flawless pitch dress,juffrou grand verenigde koninkryk in 'n foutlose toonhoogte rok
33,take a look at three one to two minute from explaining their work and its impact on the world celebrated by and at the pitch it clever via,kyk na drie een tot twee minute van die verduideliking van hul werk en die impak daarvan op die wêreld wat gevier word deur en op die veld dit slim via
34,on he people to help pitch in for his his lack of accountability is astonishing,"op he mense om te help om sy gebrek aan aanspreeklikheid in te dien, is verbasend"
35,seeking all of for airport radio rotation premium pitch,op soek na almal vir lughawe -radio -rotasie premium toonhoogte
36,new gimmick the product of a four year old pitch,nuwe foefie die produk van 'n vierjarige toonhoogte
37,all over the pitch cant wait for the start,oor die hele veld kan nie wag vir die begin nie
38,quite specific but i like it who can you pitch the idea too,"redelik spesifiek, maar ek hou daarvan wie kan jy ook die idee gee"
39,_and_cigar fernando is first pitch to dodger he is and always will be number,_and_cigar fernando is die eerste plek om te dodger wat hy is en sal altyd nommer wees
40,we are looking for a friendly th pitch booked referee booked ko cost opposition step or above would be preferred,ons is op soek na 'n vriendelike thit -bespreekte skeidsregter wat bespreek word ko -koste -opposisie -stap of hoër sou verkies word
41,he will be a great for any of those only if they are too serious about getting popular on on the pitch i don t need to speak much about his as a united fan,"hy sal 'n wonderlike vir enigeen van diegene wees slegs as hulle te ernstig is om op die veld gewild te raak, hoef ek nie veel oor hom te praat as 'n verenigde aanhanger nie"
42,run it back to and let the know what pitch is coming,hardloop dit terug en laat weet watter toonhoogte kom
43,just watched s first pitch by super cool feel like getting one of them myself,het net 'n eerste plek gekyk deur super cool voel om self een van hulle te kry
44,she is not legally to work i am aware of banking and concerning loan hope can pitch in here,"sy is nie wettiglik om te werk nie, ek is bewus van bankwese en rakende leningshoop kan hier inkom"
45,it s because of the green pitch,dit is as gevolg van die groen toonhoogte
46,i remember i used to pitch semi randomly because i thought people did that just because it cool not for the sake of key still knew how to do stuff at least,"ek kan onthou dat ek vroeër lukraak semi opgeslaan het, want ek het gedink dat mense dit doen net omdat dit nie koel nie, nie ter wille van die sleutel nie, het hy ten minste geweet hoe om dinge te doen"
47,i need some pitch black right now,ek het nou 'n bietjie pikswart nodig
48,i feel bad for _official that despite being in terrific form he been from xi and been given opportunity and t perform when team him to stay at the pitch captain give it a thought,"ek voel sleg vir _ official dat hy, ondanks die feit dat hy in 'n geweldige vorm was, van xi af was en geleentheid gekry het en t op te tree as hy hom saamspan om by die pitch captain te bly, dit 'n gedagte gee"
49,_shoe love your new june it is good to remember it is not r it is just child romance your music and song are always fire did you track and pitch shift your voice in groomer you are the only glamorous one in this video june you are the best,"_shoe is lief vir jou nuwe junie, dit is goed om te onthou dat dit nie is nie, dit is net kinderromanse, jou musiek en liedjie is altyd vuur, het jy opspoor en steek jou stem in grooter jy is die enigste glansryke een in hierdie video junie jy is die beste"
50,why do some think singing in high registered voice is as fake voice and when are singing in lower they label it real voice no the pitch just,"waarom dink sommige dink dat sing in 'n hoë geregistreerde stem net so 'n vals stem is, en wanneer sing hulle laer sing, noem hulle dit regtig stem nee die toonhoogte net"
51,_ is regardless of of how much h they give him anyone who is good at heat will have no problem against him he no pitch diversity is solid though,"_ is ongeag hoeveel h hom gee vir iemand wat goed is met die hitte, sal geen probleem teen hom hê nie, hy is egter geen toonhoogte nie"
52,there was one that there are slightly more ankle if there are lots of rubble crumbly little on the pitch none have found the risk significantly greater the only thing is the surface which is hardly unique plenty of unfair about,daar was een dat daar effens meer enkel is as daar baie puin min op die veld is.
53,which is your position on the pitch,wat is jou posisie op die veld
54,do not be by the media all those so throwing in their pitch on who does this and who does that we need a fresh start fresh had his chance and it so when it comes down to it we have two ladies left so it is up to the to decide,"moenie deur die media wees nie, al die diegene wat so ingegooi word op wie dit doen en wie doen dat ons 'n nuwe begin nodig het, het sy kans gehad, en as dit daarop neerkom, het ons twee dames oor, so dit is die beste by die om te besluit"
55,is a joke from administration right down to the people who cut grass the less said about quality of football on the pitch the better till around one could name entire line up ya i do not even know do not watch it as well,"is 'n grap van administrasie tot by die mense wat gras sny, die minder gesê oor die kwaliteit van sokker op die veld, hoe beter tot ongeveer 'n mens die hele lyn kan noem. ek weet nie eens nie."
56,quite normal between the two u can decide how u want to manage your and some pool in some don t we keep ours separate but do pitch in equally by splitting the and smaller,"heeltemal normaal tussen die twee u kan besluit hoe u u en 'n paar swembad wil bestuur, en ons hou ons s'n apart, maar doen ewe veel deur die en kleiner te verdeel"
57,thinking about an elevator pitch to convince their true enemy is the wheeler delivery truck,die wheeler -afleweringsvragmotor dink aan 'n hysbak om hul ware vyand te oortuig
58,_carltoncole exactly the same here until they run onto the pitch i could not give a toss who we are linked with,"_carltoncole presies dieselfde hier totdat hulle op die veld hardloop, kon ek nie 'n gooi gee met wie ons gekoppel is nie"
59,that is pitch perfect,dit is toonhoogte perfek
60,fever pitch was his big chance and it t do good enough to launch him,koors toon sy groot kans en dit doen goed genoeg om hom te loods
61,can not wait to see sterling on the pitch,kan nie wag om sterling op die veld te sien nie
62,_bryan a shame your pitch seemingly caught at a bad time but yes excited to see and s vision of the dance hope you are doing well,"_bryan jammer dat u toonhoogte skynbaar op 'n slegte tyd vasgevang is, maar ja, opgewonde om die dans te sien en die dans hoop dat u goed gaan"
63,not sure about it to be honest had a lot of off the pitch think a few have been time will soon tell,"nie seker daaroor om eerlik te wees nie, het baie van die veld af gedink dat 'n paar tyd sou wees"
64,due to a cancellation our st team are on the look out for a game this we have a pitch and booked would have to be a kick,"as gevolg van 'n kansellasie, is ons st -span op die uitkyk vir 'n speletjie wat ons 'n toonhoogte het en bespreek moet word"
65,cricket week from on the pitch so far for the and two brilliant of food and entertainment today we welcome our good for a over game starting at this evening is the annual beer ping,"krieketweek van op die veld tot dusver vir die en twee briljante kos en vermaak vandag, ons verwelkom ons goeie vir 'n te veel speletjie wat vanaand begin, is die jaarlikse bierping"
66,for here and lost the pitch count one good thing i went light i guess,"want hier en die toonhoogte verloor een goeie ding wat ek aan die lig geloop het, dink ek"
67,_mufc _chief found sniffing the pitch straight,_mufc _chief gevind dat die toonhoogte reguit snuif
68,pitch shift wavering i am going in and out of puberty,pitch shift wankel ek gaan in en uit puberteit
69,l d like to pitch this one as deserving a bit more attention i made this regulus piece for birthday last year the you see are positioned after the night sky with regulus standing out and the cross are forming the constellation,l d wil hierdie een as verdienstelik 'n bietjie meer aandag gee. ek het hierdie regulusstuk vir verjaardag verlede jaar gemaak. die u sien is geplaas na die naghemel met regulus wat uitstaan ​​en die kruis vorm die sterrebeeld
70,and won t even come correct no registered no business plan no pitch deck no pro an idea nothing without a plan and people family don t understand what it,"en sal selfs nie korrek kom nie, geen geregistreerde geen sakeplan geen toonhoogte dek geen pro 'n idee niks sonder 'n plan nie en mense se familie verstaan ​​nie wat dit is nie"
71,still a long way to go i am my down and in experience in the camp may not handle the pressure remember its a th day pitch and the ball is viciously turning,"nog steeds 'n lang pad om te gaan, ek is my af en in die kamp in die kamp sal miskien nie die druk hanteer nie, onthou dit is 'n dag -toonhoogte en die bal draai kwaadwillig om"
72,fi cat can you pitch for me can hit those and,"fi kat kan jy vir my opsteek, kan dit tref en"
73,better miss that spare or you t seeing the pitch next season,beter mis die spaar of jy die volgende seisoen nie die veld sien nie
74,is pitch perfect as the deep is so dumb obsequious flawed yet you can t fully hate him you actually feel sorry for him at times he is so sincere about his concern love for his sea his when octopus brush or grab his face,"is 'n toonhoogte, want die diep is so dom, gebrekkig, maar jy kan hom nie heeltemal haat nie, jy voel hom soms jammer vir hom, hy is so opreg oor sy besorgdheid oor sy see."
75,it glowing red in the breeze so i the fire out but it s an area the size of a football pitch with plenty of unburnt material that needs watching,"dit gloei rooi in die briesie, so ek is die vuur, maar dit is 'n gebied so groot soos 'n sokkerveld met baie onverbrande materiaal wat moet kyk"
76,i always slipped into the darkness with this pitch black body and the end of it all i was not anyone,ek het altyd met hierdie pikswart lyf in die duisternis gegly en die einde daarvan was ek nie iemand nie
77,ah is that a new nation columnist making their pitch,ah is dat 'n nuwe nasie -rubriekskrywer hul toonhoogte maak
78,the land plant group that and like pitch pine lower land like and tend to have long similar these disseminate the pollen willy on the wind they need long chain to protect it,"die landaanleggroep wat en soos 'n pyn denne -onderste land soos en geneig is om lank te hê, dit versprei die stuifmeel op die wind wat hulle nodig het om dit te beskerm om dit te beskerm"
79,we re losing that intuition if we take this away with pitch based on analytics catcher best view and knowledge of what s working and not working,ons verloor daardie intuïsie as ons dit wegneem met die toonhoogte gebaseer op die beste siening en kennis van wat werk en nie werk nie
80,can we also talk about how much with the tone and pitch this time the back to back contrast of high and low pitch guerrilla preview _perf_preview _movement _guerrilla,kan ons ook praat oor hoeveel met die toon en toonhoogte hierdie keer die rug -aan -rug -kontras van hoë en lae toonhoogte guerrilla -voorskou _perf_preview _movement _guerrilla
81,we do our talking on the pitch dude see you all in,"ons praat op die toonhoogte -ou, sien julle almal in"
82,_oakden at a birthday football party last year they had a match and i got and was to leave the pitch for winding up the little with my,_oakden tydens 'n verjaarsdagvoetbalpartytjie verlede jaar het hulle 'n wedstryd gehad en ek het die veld verlaat om die kleintjie met my
83,poor t get a chance to pitch,arme t kry 'n kans om op te slaan
84,see free of charge movie pitch but house girl when the clock,"kyk gratis filmhoogte, maar huismeisie as die klok"
85,karamu e th st,karamu e th st
86,out for me but good morning and good day to all the in and around the world can t wait for to be back out on the pitch next week,"uit my, maar goeie more en goeie dag vir al die in en oor die wêreld, kan nie wag om volgende week weer op die veld te wees nie"
87,red defensive was worldly known for his way to play and how incredibly ruthless he was on the pitch during his year career in and football,red defensive was wêreldse bekend vir sy manier om te speel en hoe ongelooflik genadeloos hy op die veld was tydens sy jaarloopbaan en sokker
88,rool red this retired central had a year career full of polemics and criticism due to his on the pitch where he used to take too far,rool red hierdie afgetrede sentraal het 'n jaar loopbaan vol polemieke en kritiek gehad as gevolg van hom op die veld waar hy te ver gevat het
89,this song is literally down to of its original pitch why does it so good,"hierdie liedjie is letterlik van die oorspronklike toonhoogte af, waarom doen dit so goed"
90,_ is sharpness and confidence poor decision making not just this match but in the previous one as well for me he was the worst player on the pitch hope he back on the track by the end of preseason,"_ is skerpheid en selfvertroue swak besluitneming, nie net hierdie wedstryd nie, maar ook in die vorige een vir my die slegste speler op die veld hoop dat hy teen die einde van die voorseisoen op die baan terug is"
91,van de beek is a student of just watch dis we only need a n den will start all n will direct on d pitch,"van de beek is 'n student van just watch dis, ons hoef net 'n n den te begin alle n sal regstreeks op d pitch"
92,on one of those said holding onto the hand of the cameraman the living space was lovely the coloring spread on the coffee table she also the pastel pink and pitch black coffee settled close together at the edge of the table,"op een van die genoemde wat die kameraman aan die hand van die kameraman vashou, was die leefruimte heerlik. die kleur versprei op die koffietafel."
93,chasing such a big total is no joke on a fifth day pitch as long the wall of is there in sha we will win,"om so 'n groot totaal te jaag, is geen grap op 'n vyfde dagveld nie, want die muur van is daar in sha sal ons wen"
94,believe me you re not the only one saying truss will be tanked in the and gave the anti austerity pitch him perhaps of how s similar stagnancy roll on the election,glo my jy is nie die enigste een wat sê dat truss in die tenk sal wees nie en gee die anti -soberheid hom miskien van hoe 'n soortgelyke stagnansie op die verkiesing rol
95,a pitch,'n toonhoogte
96,pitch is they are just extra pressure on themselves,toonhoogte is hulle net ekstra druk op hulself
97,_ _ without on the bench and on the pitch we made it with them we will make it good morning fellow,"_ _ sonder op die bank en op die veld het ons dit saam met hulle gemaak, ons sal dit 'n goeie oggend maak"
98,u will care on with on the pitch,jy sal omgee met op die veld
99,i want to force my way into the team but i guess that s the club s decision i just got to work as hard as i can on the pitch and see what,"ek wil my weg na die span dwing, maar ek dink dat die klub se besluit net so hard as moontlik op die veld moes werk en kyk wat"
100,minor championship round wishing our minor and their management the very best of luck as they take on in the first round of championship th pitch please support,"minderjarige kampioenskapronde wat ons minderjarige en hul bestuur die beste geluk wens as hulle in die eerste ronde van die kampioenskap th pitch aangaan, ondersteun asseblief"
101,a big thank you to _olan_ and the rest of the team for day with shine from the that their story and specially for his training in pitch development,'n groot dank aan _olan_ en die res van die span vir day met shine van die dat hul verhaal en spesiaal vir sy opleiding in toonhoogte -ontwikkeling
102,v difficult pitch sir too much spinning,v moeilike toonhoogte meneer te veel draai
103,i mean i know i can pitch like a boss but a little time prep is all a girl needs,"ek bedoel ek weet ek kan soos 'n baas opsteek, maar 'n bietjie tyd is 'n meisie wat 'n meisie nodig het"
104,it is not about it is a whole new breed of to dominate every terrain that is the pitch by,dit gaan nie daaroor dat dit 'n hele nuwe ras is om elke terrein wat die toonhoogte is nie
105,_pitch hell yeah glad you re enjoying it,_pitch hel ja bly jy geniet dit
106,i would really recommend club this is expensive though but its such a nice area you can always go into which is such a nice place to visit but it is from i have also about diamond caravan park being a great place to pitch a tent,"ek sal die klub regtig aanbeveel, dit is egter duur, maar dit is so 'n lekker area waaraan u altyd kan gaan, wat so 'n lekker plek is om te besoek, maar dit gaan ook oor die diamant -karavaanpark wat 'n uitstekende plek is om 'n tent op te slaan"
107,our need as much rest as possible for the half though to be honest the game got boring fast after the th and dog did not even get to pitch,"ons behoefte soveel as moontlik vir die helfte, maar om eerlik te wees, het die spel vinnig vervelig geraak nadat die th en die hond nie eers by die veld gekom het nie"
108,mate pro most powerful night vision see through pitch black in full colour,mate pro kragtig nagvisie kyk deur pitch black in volkleur
