,src,trg
660,it is just so obvious that is a leech he nothing on and off the pitch for the club yet he does not want to leave,"dit is net so voor die hand liggend dat dit 'n bloedsuier is dat hy niks op en van die veld vir die klub is nie, maar hy wil nie vertrek nie"
661,the go head to head with the with first pitch at am in the japan pacific league to give out a free client play around this one as is in their last ten,die kop aan kop met die eerste toonhoogte by am in die japan pacific league om 'n gratis klientspeletjie rondom hierdie een uit te gee soos in hul laaste tien
662,thank you i continue to pitch until someone yes again,dankie ek gaan voort om te slaan totdat iemand weer ja is
663,s pitch surface it was pal a nightmare had but what the our defence other than frightening friendly or not,"s pitch -oppervlak was dit 'n nagmerrie, maar wat ons verdediging anders as angswekkend is of nie"
664,was ever the head of media the best in the business surely and always had that role between them on and off the pitch,was altyd die hoof van die media die beste in die besigheid en het altyd daardie rol tussen hulle op en buite die veld gehad
665,he t pitch at all,hy het glad nie 'n toonhoogte nie
666,sadly there is nothing in the pitch for in,ongelukkig is daar niks in die veld vir in nie
667,less chance of serious injury on a g pitch the underneath are shock absorbing do not get caught when turning as in grassed no mud a surface no because of drainage less chance of frozen pitch no off,minder kans op ernstige beserings op 'n g toonhoogte die onderkant is skokabsorberende nie.
668,the guy from pitch perfect,die man van pitch perfect
669,_sells _whs all the pitch great and tony t so i blame him he gave up those i blame him more than the offense,"_sells _whs al die toonhoogte en tony t, so ek blameer hom dat hy diegene wat ek hom die skuld gee, meer as die oortreding opgegee het"
670,__ agar pitch ho to se round,__ agar pitch ho to se round
671,of course and i know t blame you either and when i get my on whoever this is that made you even think these starting to drip getting lost in his protective rage a bit,"natuurlik, en ek weet dit nie vir jou nie, en as ek my oor wie dit ook al is, het dit jou selfs laat dink dat dit 'n bietjie verdwaal in sy beskermende woede"
672,united will not waste more than without scoring but wasted good in the pitch without scoring a single goal for,"united sal nie meer mors as sonder om te score nie, maar goed vermors op die veld sonder om 'n enkele doel te behaal"
673,_dhruvvvvv_ _srj yeah don t worry wheel will come off by storm the pitch like crying,'
674,brave but desperate they have lost all their now pitch its magic,"dapper, maar desperaat, hulle het al hul nou sy magie verloor"
675,is limping on the pitch is he,"is hy op die veld, is hy"
676,good pitch where do i buy,goeie toonhoogte waar koop ek
677,_butcher thanks need to learn my lesson not go anywhere near a football until i am fully as the instinct the better of me every time even on a pitch with yr old know what you mean about daily routine work is my biggest barrier to doing full daily tricky,"_butcher dankie om te leer dat my les nêrens naby 'n sokker gaan nie, totdat ek ten volle as die instink is, hoe beter van my elke keer, selfs op 'n veld met yr old, weet wat u bedoel oor die daaglikse roetine -werk, is my grootste hindernis om daagliks moeilik te doen"
678,i did not hear you pitch,ek het jou nie gehoor nie
679,_hof i thought the guy who got the winning run should have been but they gave it to the guy who had the best story line for hit a bad pitch by the pitcher where it a pitch almost a foot out of the strike zone,"_hof ek het gedink die man wat die wenlopie gekry het, moes gewees het, maar hulle het dit gegee aan die man wat die beste storielyn gehad het om 'n slegte toonhoogte deur die kruik te slaan, waar dit 'n toonhoogte byna 'n voet uit die stakingsone was"
680,some company tried to get a dub of probably the biggest current year little anime franchise up and running tried that pitch was and funny enough it used as a basis for the script,"'n kompanjie het probeer om 'n dubbel te kry van waarskynlik die grootste huidige jaar -anime -franchise aan die gang, en dit was snaaks genoeg wat dit as basis vir die draaiboek gebruik het"
681,more and pitch is crossed,meer en toonhoogte is gekruis
682,do not forget them a two days first pitch at the game when amy schneider was throwing the first pitch about a month ago then lying about it being a technical,"moenie hulle 'n eerste toonhoogte van twee dae vergeet nie, toe amy schneider ongeveer 'n maand gelede die eerste toonhoogte gegooi het en dan gelieg het dat dit 'n tegniese is"
683,this elite stuff the amount of trust in each other and a plan on every pitch,hierdie elite vul die hoeveelheid vertroue in mekaar en 'n plan op elke toonhoogte
684,i watched the original for the first time in awhile and i forgot how much better it was there was like no reason at all to raise the pitch,"ek het die oorspronklike vir die eerste keer in 'n rukkie gekyk en ek het vergeet hoeveel beter dit was, was daar geen rede om die veld te verhoog nie"
685,that bomb by was a good pitch in gonsolin is just beat him i do not know how but he did,"dat die bom deur 'n goeie toonhoogte in gonsolin was, is net om hom te klop, ek weet nie hoe nie, maar hy het"
686,_pitch picked up pitch and gave him a tight hug thank you pitch thank you so much her were tearing up again,"_pitch het 'n toonhoogte opgetel en hom 'n stywe drukkie gegee, dankie pitch dankie dat sy weer geskeur het"
687,how do you pitch fear the walking dead who framed roger rabbit to without getting out the window,hoe kan jy die wandelende dooies opsteek wat roger rabbit omraam sonder om by die venster uit te kom
688,_jordan and your pitch is not based in reality why would anyone believe you after your collaboration with and your about a year old child,"_jordan en u toonhoogte is nie in werklikheid gebaseer nie, waarom sou iemand u glo na u samewerking met en u jaar oue kind"
689,i like my brother and sister took an oath to support and defend the constitution of the united against all foreign and domestic and there is no expiration date all you woke keep that in mind,ek hou daarvan
690,spending long nights talking to him keeping him company and i know it s easy to look back and point out what you could and should and all that but you can t be too hard on yourself you had no way of knowing this would happen,"as hy lang nagte spandeer om met hom te praat, hou hy hom geselskap en ek weet dat dit maklik is om terug te kyk en uit te wys wat jy kan en moet, en dit alles, maar jy kan nie te hard aan jouself wees nie, jy het geen manier gehad om te weet dat dit sou gebeur nie"
691,saw him pitch alan in a short season a ball game in both got to the show,het gesien hoe hy alan in 'n kort seisoen 'n balwedstryd in albei na die show bereik het
692,me hastily my shipping so childe and are but to ashen for a while during the whole gnosis incident along w childe a pale crush on the traveler but it become anything might have a pitch crush on him,"ek is vinnig my aflewering so childe en is net 'n rukkie vir ashen tydens die hele gnosis -voorval langs w childe 'n ligte druk op die reisiger, maar dit word alles wat 'n toonhoogte op hom het"
693,in pakistan is visit to they day five on chasing they were out for but on a far more difficult batting pitch,"in pakistan is hulle besoek aan die dag vyf toe hulle agtervolg het, maar op 'n baie moeiliker kolfveld"
694,i mean if could find a way to pitch again,"ek bedoel, as dit 'n manier kan vind om weer op te slaan"
695,get in here i have to pitch,"kom hier in, ek moet toonhoogte"
696,are not purely aesthetics as many see it are visual so the right pitch and a correct tone of communicating via those designing avail much,"is nie suiwer estetika nie, want baie mense sien dit is visueel, so die regte toonhoogte en 'n korrekte toon om te kommunikeer via diegene wat ontwerp is, baie"
697,i had a brilliant violin teacher with perfect pitch who admitted to me that he got a d in music theory sometimes the mechanics don t matter,"ek het 'n briljante vioolonderwyser met perfekte toonhoogte gehad wat aan my erken het dat hy 'n d in musiekteorie gekry het, soms is die meganika nie saak"
698,seen him pitch a in couple back probably spent more time then he did on the mound,"hy het gesien hoe hy 'n paartjie terug het, waarskynlik meer tyd deurgebring as hy op die heuwel gedoen het"
699,show him of the of and what he said at end of s term election year and a or any other disingenuous pitch so maybe he it through during because trump t matter to the election,wys hom van die van en wat hy gesê het aan die einde van die termynverkiesingsjaar en 'n of enige ander onheilspellende toonhoog
700,a dog adopted pitch as their child,'n hond het toonhoogte as hul kind aangeneem
701,why did not pitch and are make it up to his for messing up their trip to not have him pitch,waarom het hy nie opgeslaan nie en is dit aan hom om hul reis te verswak om hom nie te hê nie
702,we have good news is in from and so send in your pitch to hello and stand a chance to win a million investment,"ons het goeie nuus, en stuur dus u veld na hello en staan ​​'n kans om 'n miljoen belegging te wen"
703,these of can be seen everywhere in nobody for the are only for middle class i have seen thousand of with pitch dark tinted glasses but i guess they do not come under the law,"hierdie van kan oral gesien word by niemand, want dit is slegs vir die middelklas, ek het duisend gesien met 'n donker getinte bril, maar ek dink hulle kom nie onder die wet nie"
704,only utterly anti democratic people could be angry that a few hundred thousand were inspired to join a party by someone with some decent that people need to have previous loyalty to a party to get involved is anathema to your whole pitch of appealing to non lab,"slegs anti -demokratiese mense kan kwaad wees dat 'n paar honderdduisend geïnspireer is om by 'n party aan te sluit deur iemand met 'n paar ordentlike dat mense 'n vorige lojaliteit aan 'n party moet hê om betrokke te raak, is 'n anathema vir u hele beroep op nie -laboratorium"
705,media pitch,mediahet
706,they your pitch deck should have extensively covering growth also they you need to make us understand in,"hulle moet u toonhoogte -dek breedvoerig dek, en hulle moet ons laat verstaan"
707,nash and tucker have the right idea but nash can t seem to keep the pitch and tucker very unsure of his decision,"nash en tucker het die regte idee, maar dit lyk asof nash nie die veld hou nie en tucker baie onseker oor sy besluit"
708,you are right how about players' on and off the pitch would not his current action draw negative energy in camp,"u is reg wat van spelers 'op en van die veld af, sou sy huidige aksie nie negatiewe energie in die kamp trek nie"
709,_unlimited i am also a music producer there is real time on his microphone they all use real time in not to say he can not sing it is just to pitch correct so it is subtle a real good ear to notice,"_unlimited ek is ook 'n musiekprodusent, daar is reële tyd op sy mikrofoon. hulle gebruik almal intyds om nie te sê dat hy nie kan sing nie, dit is net om reg te staan, so dit is 'n goeie oor om op te let"
710,are you about to strike out the side in the game yeah what pitch you want me to do it on backdoor slider oh you are sexy i can do that for you,"is jy op die punt om die span in die spel te slaan, ja, watter toonhoogte jy wil hê ek moet dit doen op die agterdeur -skuif, jy is sexy, ek kan dit vir jou doen"
711,now that s a pitch that me,nou is dit 'n toonhoogte wat ek
712,_ i read that did not want to pitch as he is starting on,_ ek het gelees wat nie wou opstaan ​​soos hy begin nie
713,right to me maybe slightly sharp but i am not pitch perfect,"reg vir my miskien effens skerp, maar ek is nie perfek nie"
714,love and thunder pitch meeting via,liefde en donderhoogte -vergadering via
715,tough one should score more although will score more off the pitch,"taai een moet meer aanteken, hoewel dit meer van die veld af sal wees"
716,then u have to worry he t simply pitch in second half postseason in order to prove he can take the ball is worth you re pay him it t end up causing lasting damage for next year beyond,"dan moet u bekommerd wees dat hy nie in die tweede helfte na die seisoen opsteek om te bewys dat hy die bal kan neem nie, is die moeite werd om hom weer te betaal."
717,_not yuh n just a replay of a different first pitch,_ nie yuh n net 'n herhaling van 'n ander eerste toonhoogte nie
718,pitch next to well if i know anything about you i know you did you everything you could to help with the whole mirror thing i saw you spending long days in that cave carefully that mirror back together,"sit naas goed as ek iets van jou weet, ek weet jy het jou alles gedoen wat jy kon om te help met die hele spieël ding wat ek gesien het dat jy lang dae in daardie grot deurbring"
719,i do think same ka out pitch tha ball k se spin ho k wicket lag,ek dink wel dieselfde ka uit toonhoogte tha ball k se spin ho k paaltjiewag
720,oh hey _gee nice one thanks for the kindness,o hey _gee lekker een dankie vir die vriendelikheid
721,_johnson not that i am this but i would be curious to see where the use loyalty as a pitch in short i do not see the trade anything to do with loyalty doing best for both sides at this juncture it is a business at the end of the day,"_johnson nie dat ek dit is nie, maar ek sal nuuskierig wees om te sien waar die gebruikslojaliteit as 'n toonhoogte kortom, ek sien die handel niks te doen met lojaliteit wat die beste vir albei kante doen nie, dit is 'n besigheid aan die einde van die dag"
722,eventually though i decided that genuine fear its own unique pitch,uiteindelik het ek besluit dat opregte vrees sy eie unieke toonhoogte
723,and it like it was all judge was thinking about as he struck out on a pitch a foot high and a foot outside,"en dit was asof alles waaraan die regter dink, toe hy op 'n veld 'n voet hoog en 'n voet buite geslaan het"
724,nowadays we can not believe on pitch behaviour that it will become unplayable blah blah blah pitch can change any time just trust on your batting,deesdae kan ons nie glo oor toonhoogte dat dit onspeelbaar sal word nie bla bla bla -toonhoogte kan verander elke keer as u net vertrou op u kolf
725,why is rhe door open but the theater pitch dark,"waarom is die deur oop, maar die teater pik donker"
726,_ on last day ran through order is such a dangerous pitch,_ op die laaste dag het dit so 'n gevaarlike toonhoogte geloop
727,_official the club prob doing any work on the pitch yet more like,_ official die klub sal waarskynlik meer werk op die veld
728,i know what i m looking at and i know how the pitch works hit my brain still no,"ek weet waarna ek kyk en ek weet hoe die toonhoogte my brein tref, nog steeds nee"
729,did pitch,het die toonhoogte gedoen
730,nice cruciferous for roasting,lekker kruisig om te braai
731,he is an player who is a liability he on the pitch,hy is 'n speler wat 'n aanspreeklikheid is wat hy op die veld is
732,i am so excited to be heading to tomorrow to rep with at thanks again to for helping us prepare our pitch we are ready,"ek is so opgewonde om môre op pad te wees om weer te bedank by die bedanking dat ons ons help om ons toonhoogte voor te berei, ons is gereed"
733,i think are good pitch is not easy sorry do not agree with amir,"ek dink 'n goeie toonhoogte is nie maklik nie, jammer, stem nie saam met amir nie"
734,more there than he did on the pitch,meer daar as wat hy op die veld gedoen het
735,_derek on the show hazel mae if he was told he was going to get to pitch in the game and he said he probably would late in the game,_derek op die show hazel mae as daar aan hom gesê word dat hy in die spel gaan opstaan ​​en hy het gesê dat hy waarskynlik laat in die wedstryd sou wees
736,dude let it go i realize this was the but he got to pitch and he did well literally nothing,"dude laat dit gaan, ek besef dit is die was, maar hy moes opstaan ​​en hy het letterlik niks gedoen nie"
737,apparently from the pitch of this to the studio to the and eventual start of was about five crazy,blykbaar was van die veld hiervan tot die ateljee tot die en die uiteindelike begin van ongeveer vyf mal
738,you think a man who almost of a brain tumor would show a bit more respect towards another man who nearly on the pitch sure i suppose you wrote this is your support t shirt,"u dink dat 'n man wat amper van 'n breingewas 'n bietjie meer respek sou toon teenoor 'n ander man wat amper op die veld seker is dat ek dink dat u dit geskryf het, is u ondersteuning t -hemp"
739,yeah so you can tell me how it if i am ever off beat if i need to change my sound pitch a bit,"ja, so jy kan my vertel hoe dit is as ek ooit van die maat af is as ek my klankhoogte 'n bietjie moet verander"
740,yeah this is a pitch,ja dit is 'n toonhoogte
741,this is the worst pitch i have ever seen,dit is die slegste toonhoogte wat ek nog ooit gesien het
742,i am not sure rob or anyone high up in baseball this but b w the and this year is draft baseball is on the up pitch ghost and lottery is are meaningless promote your black and get more of them and you can reclaim the throne,"ek is nie seker dat rob of iemand hoog in die bofbal is nie, maar b w die en hierdie jaar is die konsep -bofbal op die up pitch ghost en lottoy is is sinloos bevorder jou swart en kry meer daarvan en jy kan die troon herwin"
743,maybe said he t want to pitch,miskien het hy gesê dat hy nie wil slaan nie
744,sonny and romero could both kiss on the pitch as long as that is still a possibility i m watching everything live,"sonny en romero kan albei op die veld soen, solank dit steeds 'n moontlikheid is dat ek alles regstreeks kyk"
745,it t end at racism they like to mix in some as well,dit eindig by rassisme wat hulle ook graag wil meng
746,movement t important as a hitter it was the and spin that like his on plane til it was too late best pitch in baseball it,"beweging is nie belangrik as 'n hitter nie, en dit was 'n draai wat soos sy op die vliegtuig was tot dit te laat was die beste toonhoogte in bofbal"
747,the depth you see on paper actually to the pitch and we have not even seen and play this season yet scary,"die diepte wat u op papier sien, is eintlik op die veld en ons het nog nie eens die seisoen gesien en gespeel nie"
748,where was he did not get a chance to pitch appalling in la no less,waar het hy nie die kans gekry om in la nie minder te ontstel nie
749,he out since he and likely will pitch,hy uit sedert hy en waarskynlik sal opstaan
750,gave him a pitch black coat and at the end of the day when he comes back to her it is completely white fatui is getting and as he,"het hom 'n pikswart jas gegee en aan die einde van die dag as hy na haar terugkom, is dit heeltemal wit fatui wat kry en soos hy"
751,hope howe must get allan saint moving forwards on the pitch,hoop hoe moet allan saint vorentoe beweeg op die veld
752,this is an inadvertent pitch for a sequel to,dit is 'n onbedoelde toonhoogte vir 'n opvolger van
753,the real pitch is to the people already taking birth control you already take care of yourself should not your dick take care of you too,"die regte toonhoogte is vir die mense wat reeds geboortebeperking neem wat u alreeds vir uself sorg, moet u piel ook nie vir u sorg nie"
754,one of the great of my life is that i have the sam cadence and scratch down to a science but the pitch and tone of my voice is something like an oboe wished to become a real boy,"een van die groot van my lewe is dat ek die sam cadence het en tot 'n wetenskap neerskiet, maar die toonhoogte en toon van my stem is iets soos 'n hoboe wat 'n regte seun wil word"
755,late night crew first pitch am pst like below to be sent the play you got min then i m logging off,laatnag bemanning eerste toon
756,right need to pitch something to her because is so good,"reg moet iets aan haar opslaan, want is so goed"
757,do not let them leave until you pitch your idea for a new animated adult cartoon,moenie toelaat dat hulle vertrek voordat u u idee vir 'n nuwe geanimeerde volwasse tekenprent gee nie
758,cup b group v pitch for the day,cup b group v toonhoogte vir die dag
759,match day final group cup b group if v pitch by,match day final group cup b group as v toon
760,now populous sundae pitch,nou bevolkte sundae -toonhoogte
761,first pitch first swing that is it,eerste toonhoogte eerste swaai dit is dit
762,is great but for united i feel like they become lazy type when is on the pitch and they think he can do everything but when his not on the pitch they feel like to step it up same goes for when was on the team,"is wonderlik, maar vir united voel ek asof hulle 'n lui tipe word wanneer op die veld is, en hulle dink hy kan alles doen, maar as hy nie op die veld is nie, voel hulle om dit op te stel, want wanneer dit in die span was"
763,the witch behind gingerly the door strangely enough the space inside had no opening to the light leaving the entire place pitch dark the doll instinctively clung to the fool now let is see where did i put those said the fool in its,"die heks agter gemmer, die deur vreemd genoeg het die ruimte binne geen opening aan die lig gehad nie en die hele plek pik donker, die pop het instinktief aan die dwaas vasgehou, laat sien waarheen het ek die gesê die dwaas in sy"
764,pitch it to an unknown actor who probably would jump at it,sit dit aan 'n onbekende akteur wat waarskynlik daarin sou spring
765,like training on a real pitch you can not have such sexy flow of football,"soos om op 'n regte toonhoogte te oefen, kan u nie so 'n sexy vloei van sokker hê nie"
766,_a_ me to any lower and i would be on the pitch,_a_ my tot enige laer en ek sou op die veld wees
767,your boy turned on that pitch hope he stays healthy all the way through this year i guess he s done running,jou seuntjie het die toonhoogte aangeskakel en hoop dat hy hierdie jaar gesond bly
768,also remember we went from he is going to throw an inning or two in the last game before the break last year to not seeing him pitch in a game since,onthou ook dat ons van weggegaan het dat hy 'n beurt of twee in die laaste wedstryd voor die pouse verlede jaar gaan gooi om hom sedertdien nie in 'n wedstryd te sien nie
769,will pitch this weekend against the cool go beat him,sal die naweek opstaan ​​teen die cool go klop hom
770,_ _thfc he based it on football tennis not on the pitch,_ _thfc hy het dit gebaseer op sokker -tennis nie op die veld nie
771,fantastic first female pitch event so many great and fascinating pitching tonight,fantastiese eerste vroulike toonhoogte -byeenkoms soveel wonderlike en fassinerende toonhoogte vanaand
772,i feel like i personally do a lot but we all need to pitch in to do more,"ek voel asof ek persoonlik baie doen, maar ons moet almal inpak om meer te doen"
773,i have a little pitch for what i think they should have done,ek het 'n klein toonhoogte vir wat ek dink hulle moes gedoen het
774,let me pitch this idea make glow in the dark and thank you patten pending,laat ek hierdie idee in die donker laat gloei en dankie patten hangende
775,is the worst game ever ever ever ea and whoever thought on a pitch was a good idea you sewer rat,"is die slegste wedstryd ooit ooit ea ooit, en wie ook al op 'n toonhoogte gedink het, was 'n goeie idee dat jy rioolrat is"
776,by do you mean arrogant men who try to hit every pitch are who try to put the ball in play reason baseball become unwatchable,"met bedoel jy arrogante mans wat probeer om elke toonhoogte te tref, is wat probeer om die bal in die spel te plaas rede bofbal word onbewoonbaar"
777,he has not thrown a pitch in a calendar year he even that good he blocked me which is v,"hy het nie 'n toonhoogte gegooi in 'n kalenderjaar dat hy selfs so goed hy geblokkeer het nie, is v"
778,they want to take a but do not want to do so do we really need him he lost majority of times on the pitch,"hulle wil 'n neem, maar wil nie doen nie, het ons hom regtig nodig, hy het die meeste kere op die veld verloor"
779,_pitch i don t know yet hopefully i figure it out soon she very very upset i just i hate that i left and the mirror i should been there i should known better,"_pitch ek weet nie nog nie, maar hopelik vind ek dit binnekort uit, sy is baie ontsteld, ek haat dat ek weg is en die spieël wat ek daar moes gewees het, sou ek beter moes weet"
780,_evans_ this is his latest for is this really a thats why you need to watch not just looking at starting line up he practically as right on the pitch despite the starting line up,"_evans_ dit is sy nuutste vir dit is regtig 'n daarom moet u kyk hoe u nie net na die aanvangskolwer kyk nie, hy is prakties so reg op die veld ondanks die beginpunt"
781,if you are upset that threw remember never got to pitch in,"as u ontsteld is, het onthou dat onthou nooit sou opstaan ​​nie"
782,and should replace who literally does nothing on pitch,en moet vervang wat letterlik niks op die toonhoogte doen nie
783,pitch good also,toonhoogte ook goed
784,that foo said first pitch swing and a hit off,daardie foo het gesê die eerste toonhoogte en 'n treffer
785,_ would be on days rest if he in either against day prior cole will be pitching i would imagine he could go there he also did not pitch in like cole ray needs to face him if it is tho to tie record,"_ sou op dae rus wees as hy in een van die dag teen die dag van die dag af gaan staan, sou ek my voorstel dat hy daarheen kon gaan, hy het ook nie in die steek gelaat soos cole ray hom moet in die gesig staar as dit die rekord moet bind nie"
786,_ _ yeah he s good watched him officiate at mess pitch,"_ _ ja, hy het goed gekyk hoe hy op die mess pitch optree"
