,src,trg
0,golden state star out of his comfort zone as host of the,golden state star uit sy gemaksone as gasheer van die
1,grant some of the trash talk he at green,gee 'n paar van die asblikpraatjies by green
2,rowan found a appointment sports massage quickly thanks to and felt much better afterwards get a free minute consultation for help with your and,"rowan het vinnig 'n afspraaksportmassering gevind danksy en voel baie beter daarna, kry 'n gratis minuut konsultasie vir hulp met u en"
3,_sell _ yours me,_sell _ joune my
4,local golf ace pair win tourney title,plaaslike gholf -ace -paar wen -toernooi titel
5,where my sports anime about driving,waar my sport anime oor bestuur
6,i saw this question on and to know how you would answer come join me my code and prove it with a double welcome bonus,ek het hierdie vraag gesien en om te weet hoe u sou antwoord
7,join us at at stadium sports bar smokehouse for district trivia stadium sports in three good food good and good times we pride ourselves for helping bring the good times with district trivia grab your and come out and join us,"sluit aan by die stadion sports bar smokehouse vir district trivia stadium sports in drie goeie kos goeie en goeie tye. ons is trots daarop om die goeie tye te help bring met die distriktrivia, gryp jou en kom saam met ons"
8,bishop s veteran coach ad retirement,bishop se veteraanafrigter advertensie -aftrede
9,the fellowship is chapter for the  is port it' project with _lacrosse the representation of around the world the importance of 'olympian mentality' what good sports _shaked,die genootskap is hoofstuk vir die is -poort dit 'projek met _lacrosse die voorstelling van oor die hele wêreld die belangrikheid van' olimpiese mentaliteit 'what good sports _shaked
10,but people in buffalo ate passionate about their sports bay the population and look at their attendance,maar mense in buffalo het passievol oor hul sportbaai geëet en na hul bywoning gekyk
11,the season is almost here join us at j w stadium this fall by getting your season now at the link below,die seisoen is amper hier by ons in die j w -stadion in die herfs deur u seisoen nou op die skakel hieronder te kry
12,when it comes to hydrated water is essential but if your are during their summer they need try sports and even pickle juice,"as dit by gehidreerde water kom, is dit noodsaaklik, maar as u gedurende hul somer is, moet hulle sport en selfs piekelsap hê"
13,_boston _alo the conglomerate needs competition in s sports they will not treat s sports and its of all justly w out pressure until broadcast competition,_boston _alo die konglomeraat benodig kompetisie in s -sportsoorte.
14,strong from but we could have said the same when left the player that is,"sterk van, maar ons kon dieselfde gesê het toe hy die speler verlaat het"
15,i love that all sports are back and,ek is mal daaroor dat alle sportsoorte terug is en
16,men is luxury fine fashion premium top quality genuine dial design stainless steel watch,mans is 'n luukse fyn modepremium topgehalte egte skakelontwerp vlekvrye staalhorlosie
17,club partner we re delighted to have as our club shop partner again this season bateman s sports have been established since and are known for a first class service with quality to suit your needs,klubvennoot ons is verheug om weer as ons klubwinkelvennoot hierdie seisoen te hê bateman se sportsoorte is sedertdien gestig en is bekend vir 'n eersteklas diens met gehalte om aan u behoeftes te voldoen
18,low cost sports for your are available at call today for an appointment x august,laekoste -sportsoorte vir u is vandag beskikbaar vir 'n afspraak x augustus
19,a monster must follow _com a global leader in all sports check it out gambling legislation and a ton more no stop everyday,'n monster moet volg _com 'n wêreldleier in alle sportsoorte kyk na die wetgewing van dobbelary en 'n ton meer geen stop elke dag
20,east coast summer are coming brought to you by the exclusive all in one streaming scoring and recruiting sports platform check,die ooskus -somer word aan u gebring deur die eksklusiewe alles in een streaming punte en werf sportplatformkontrole
21,_talk_sports i know it s hard to have for people when you don t watch the,_talk_sports ek weet dit is moeilik om vir mense te hê as u nie die kyk nie
22,_sacrebleu i do not enjoy sports in person from to commentary to not being around d that will be down if they lose and if there win to eating what i want and taking a break at any point i enjoy baseball the most and still go to those,_sacrebleu ek geniet nie van sport wat persoonlik van kommentaar tot kommentaar is om nie te wees nie.
23,i am now streaming on twitch sports,ek stroom nou op twitch sports
24,this is one of the i ever seen on any sort of sports broadcast i was glued to the for this inning i wish they d do this more often,dit is een van die ek wat ek ooit gesien het op enige soort sportuitsending.
25,just condemned drag racing by saying our streets have become sports for non thats exactly what this race is and why we don t want it,"net veroordeel drag racing deur te sê dat ons strate sport geword het vir nie, dit is presies wat hierdie wedloop is en waarom ons dit nie wil hê nie"
26,i d say clay is the worst voice in sports but there s always,"ek sê klei is die slegste stem in sport, maar daar is altyd"
27,wish i was sports resort,wens ek was sportoord
28,ur next day delivery is not working still have not delivery between and must be us time zone guess i will be a different sports shop next time false advertising,"die volgende dag werk aflewering werk nie nog nie tussen nie en moet die amerikaanse tydsone wees, dink ek sal 'n ander sportwinkel wees volgende keer dat vals advertensies"
29,was a stopper a few back he was the best defensive player in the league other than at the time defense always been to me the worse position in basketball and i seen him get plenty of times,"was 'n paar terug, hy was die beste verdedigende speler in die liga, behalwe toe die verdediging altyd die slegter posisie in basketbal was, en ek het gesien hoe hy baie kere kry"
30,she only watching boxing she never attention to any other sports,sy kyk net boks en kyk nooit na enige ander sportsoorte nie
31,celebrate in sports entertainment food fashion and more sign up,vier in sportvermaak -kosmode en meer aanmelding
32,uconn is sophomore running back carter was one of to the walker award preseason watch list by the athletic forum morning,uconn is die tweede keer terug carter was een van die walker award -voorseisoen -horlosielys deur die athletic forum morning
33,new slam pop cover figure with case are up on,nuwe slam pop cover figuur met die saak is aan die gang
34,_sports it s a little weird to dig on your own and find out who are l are known for making this up and as soon as she saw she could get the bag from some of them later she s making up classic gold digger,"_sports dit is 'n bietjie vreemd om op u eie te grawe en uit te vind wie is bekend daarvoor dat hy dit opmaak, en sodra sy sien dat sy die tas van sommige van hulle kan kry, maak sy 'n klassieke goudgrawer uit"
35,the next step for smart and total domination,die volgende stap vir slim en totale oorheersing
36,this kind of money going on in college sports is weak stupid,"hierdie soort geld wat in universiteitsport aangaan, is swak dom"
37,i wit it for me making sure to go once a month now i tried every sauna except the gold charcoal one did a massage next time i got i m add the sports massage and a facial,"ek het dit vir my laat sorg dat ek een keer per maand gaan, ek het elke sauna probeer, behalwe die goue houtskool wat 'n massering gedoen het die volgende keer as ek die sportmassering en 'n gesig bygevoeg het"
38,great shot of the silver fox to cleanse the was born in michigan in michigan and was such a great athlete that he lettered in sports at alma college football basketball track and golf in addition to baseball,"'n groot skoot van die silver fox om die skoon te maak, is in michigan in michigan gebore en was so 'n wonderlike atleet dat hy in sport by alma college football basketball track and golf was, benewens bofbal"
39,video s mother weeps on live radio over s ban,video se moeder huil oor live radio oor die verbod
40,sports usually like to watch the sport being at the highest level for basketball that s the if a player from the was competitive there everyone would watch i remember the buzz about in the,"sport hou gewoonlik daarvan om te sien hoe die sport op die hoogste vlak vir basketbal is, as 'n speler van die mededingend daar was, sou almal kyk, ek onthou die gons in die"
41,keep your team spirit high when the season is over bring a piece of your favorite team home,"hou u spangees hoog as die seisoen verby is, bring 'n stuk van u gunsteling span"
42,settled in at the sports complex for semifinal you covered for and northwest that will be around start i will have north and center should start around,"het in die sportkompleks gevestig vir die halfeindronde waarvoor u gedek is en noordweste wat aan die begin sal wees, sal ek noord hê en die sentrum moet begin"
43,poor sports i would of been grateful with the would be such a blessing but i guess for most people winning what they win is not enough,"swak sportsoorte sou ek dankbaar gewees het met die seën, maar ek dink dat die meeste mense wat hulle wen, nie genoeg is nie"
44,boxing building mental toughness talk about it with now,boksbou geestelike taaiheid praat nou daaroor
45,why is no one talking about how hard it is to put on a sports bra in this heat,waarom praat niemand oor hoe moeilik dit is om 'n sportbh in hierdie hitte aan te trek nie?
46,nice make a wish story year old from and ' video in thread below,mooi maak 'n wensverhaal jaar oud en 'video in draad hieronder
47,it is a what is up w that with and will join at am to talk about all listen on,dit is 'n wat gaan met die en sal saam met am deelneem om oor alles te luister
48,grad is taking his pitching to michigan state university,grad neem sy werf na die michigan state university
49,_iliana _update _tweets happy birthday i owe my career to an conference i and the i met there many ago no done more for sports journalism,"_iliana _update _tweets gelukkige verjaardag ek skuld my loopbaan aan 'n konferensie i en die ek het daar baie gelede ontmoet, nog nie meer gedoen vir sportjoernalistiek nie"
50,_ed a faint whiff of cigarette smoke on a hot summer breeze me of sports day in elementary school,_ 'n vaal geur van sigaretrook op 'n warm somerbriesie van sportdag in die laerskool
51,_ramkalyan _sweta oh no problem ur welcome i just saw so i thought to tell u even i do not know the live ma'am sports bahut maza,"_ramkalyan _sweta ag geen probleem u welkom ek het net gesien nie, so ek het gedink om u te vertel, selfs ek ken nie die lewendige ma'am -sport bahut maza nie"
52,that defense could be one of the worst in the and they could start own them,dat die verdediging een van die slegste in die en hulle kan begin besit
53,upper st clair is own is to after the club a transfer agreement with united from,upper st clair is eie om na die klub 'n oordragooreenkoms met united van
54,nick surpass m in nil,nick oortref m in nul
55,jump to professional baseball pitcher for the grey a central alumnus are a sports franchise learning what goes into one through field research this summer,spring na die professionele bofbalkruik vir die grey a central alumnus is 'n sportfranchise wat leer wat hierdie somer deur veldnavorsing gaan
56,no that s not what i m saying we re not talking about how the name the word we call sports are made up but the actual physical game with they re made up,"nee, dit is nie wat ek sê nie, ons praat nie oor hoe die naam die woord wat ons noem sport bestaan ​​nie, maar die werklike fisieke speletjie met hulle is opgemaak"
57,position switch walled lake western is burst onto scene carve out college path,posisie skakelaar walled lake western is uitgebars op die toneel.
58,this is why we say beat l a we say beat l a before during national league is loss in all star game,dit is die rede waarom ons sê klop l a ons sê klop l a voorheen tydens die national league is verlies in alle sterre spel
59,ex pro bowler is ready for a comeback i m going to give it one more run,"ex pro bowler is gereed vir 'n comeback, ek gaan dit nog een lopie gee"
60,it is back premier combine for state is high school football organized by resident to area at end of the month more here,dit is terug premier combine for state is high school football wat aan die einde van die maand deur die inwoner gereël word
61,inventory to spend looking for lots paying depending on the card only and up per card iso burrow but will look at anything _connect _sell,"voorraad om te spandeer op soek na lotte wat betaal, afhangende van die kaart slegs en op per kaart iso -graaf, maar sal na enigiets kyk _connect _sell"
62,betting with sports offer new bet get opt in via the tab place your first bet of or more get in bonus offer link below t,weddery met sportaanbieding nuwe weddenskap kry kies via die tab plaas u eerste weddenskap van of meer get in bonus -aanbodskakel hieronder t
63,a four year apprenticeship in turkey hunting with then what he learned with a and a big story,'n vierjarige vakleerlingskap in turkye jag met destyds wat hy geleer het met 'n groot verhaal
64,recently of the sports turf association,onlangs van die sports turf association
65,oh what a night for sports in wi one year ago today the won the title,ag wat 'n aand vir sport in wi 'n jaar gelede vandag die titel gewen het
66,about left let is go chasing _sell,oor die linkerkant is laat agtervolg _sell
67,letter and continue to spout misinformation and west news weather and sports,brief en gaan voort om verkeerde inligting en west news weather and sports te tuit
68,which have or declined the most via,wat die meeste via die meeste gedaal het
69,car pool when possible especially sports with late we don t have much traffic and lots of offer food and other in our area which is a nice gesture and goes a long way with us,"motorpoel waar moontlik, veral sport met laat, ons het nie baie verkeer nie en baie kos en ander in ons omgewing, wat 'n lekker gebaar is en 'n lang pad by ons is"
70,_hats under gold are not to talk about sports,_hats onder goud is nie om oor sport te praat nie
71,and in general away from enjoying music to for sports i still have not toxic for dragging the whole show i cant even check my wo stupid happening i am donee,"en in die algemeen weg van musiek geniet vir sport, het ek nog steeds nie giftig om die hele show te sleep nie, ek kan nie eers na my dom gebeur nie, ek is nie"
72,as an audience member i was so disappointed to be sat in a sports stadium watching the poor through like cattle i was that my did not even get a handshake for his,as gehoorlid was ek so teleurgesteld om in 'n sportstadion te sit en die armes deur te kyk soos beeste dat ek nie eens 'n handdruk vir hom gekry het nie
73,thank you for this article _football,dankie vir hierdie artikel _football
74,sports boston ex mac as sneaky pick,sport boston ex mac as sneaky pick
75,_sports who will deny first with,_sports wat eers sal ontken
76,yes sports are racist,ja sport is rassisties
77,_sell thank you,_sell dankie
78,we look forward to hosting forth valley in the cup final will we see you there on the of at sports complex,"ons sien uit daarna om die valley in die bekerfinaal aan te bied, sal ons u daar sien op die van at sports complex"
79,great looking vintage and junior and adult sizes available eye catching design affordable find more here,fantastiese voorkoms vintage en junior en volwasse groottes beskikbare opvallende ontwerp bekostigbare vind meer hier
80,twitter play sports,twitter speel sport
81,i have my with the bereavement list only being days but we were all emotional when this,"ek het my met die roulys net dae, maar ons was almal emosioneel toe dit"
82,is really really good coach smart does a fantastic job with that program they can play duke t play them on their tour and,"is regtig 'n goeie afrigter, doen 'n fantastiese werk met die program wat hulle kan speel, kan hulle speel op hul toer en"
83,stop trying to force this the are not interested they re going with until suspension is up,"hou op om dit te probeer dwing, is nie geïnteresseerd waarmee hulle gaan totdat die skorsing op is"
84,verstappen is lead him casino,verstappen is lei hom casino
85,hey  is what is your favorite mix tape embrace nostalgia with this genuine sports bid now on our st wilfrid is shop pencil for not included this is in excellent condition and fully working,hey is wat is jou gunsteling mengband -nostalgie met hierdie opregte sportbod nou op ons st wilfrid is winkelpotlood om nie ingesluit te wees nie. dit is in 'n uitstekende toestand en ten volle werk
86,performance poetry in motion it s all about your rhythm,uitvoering poësie in beweging dit gaan alles oor jou ritme
87,will compete at the u men is basketball for the fifth time next month in the team the ticket to the continental showpiece after and in regional,"sal aan die u men meeding, is basketbal vir die vyfde keer volgende maand in die span die kaartjie na die kontinentale vertoonstuk na en in die streek"
88,smart knew he d be about how goes out and to replicate the success of the season in,smart het geweet dat hy gaan oor hoe gaan en om die sukses van die seisoen in te herhaal
89,yesterday here s the story on sprint football,gister hier is die verhaal oor sprint -sokker
90,give to special new york to help more hit the field and discover the power of sports in their double your impact and change a life today,gee aan special new york om meer te help om die veld te tref en die krag van sport in hul dubbele u impak te ontdek en vandag 'n lewe te verander
91,slam magazine in stock at,slam magazine in voorraad by
92,ray slam magazine in stock at,ray slam magazine in voorraad by
93,kemp slam magazine in stock at,kemp slam magazine in voorraad by
94,_hit_hunters you can save at by subbing with or similar bulk submitter for they also do bulk i have no affiliation with them just a good interview with them on sports card advantage pod and am now an sub myself,"_hit_hunters u kan stoor deur met 'n soortgelyke grootmaat voor te lê, want hulle doen ook grootmaat. ek het geen verbintenis met hulle nie, net 'n goeie onderhoud met hulle op die sportkaartvoordeelpod en is nou self 'n sub"
95,van de beek united still have room for improvement sports mole,van de beek united het nog steeds ruimte vir die verbetering van sport mol
96,community not club we hit a major milestone this week we now have over active member in our soccer community making us the sports organization in north but we know it s not about being the biggest it s about being the best we can be,"gemeenskapsklub ons het hierdie week 'n groot mylpaal getref. ons het nou 'n aktiewe lid in ons sokkergemeenskap wat ons die sportorganisasie in noord maak, maar ons weet dat dit nie die grootste is om die beste te wees wat ons kan wees nie"
97,_edge _sports it s not debatable it s s decision everyone else is just just because he grew up in st t mean he to move home,"_edge _sports dit is nie debatteerbaar nie, dit is besluit dat almal anders is net omdat hy grootgeword het, bedoel hy om huis toe te gaan"
98,to be dealt before the deadline _ a lot of to pump the on that idea on today is locked on sports today with full conversation,om voor die sperdatum behandel te word _ baie van die op daardie idee op vandag is dit vandag op sport gesluit met volledige gesprekke
99,in just a few the fall sports season do you have your physical done final did you sign up for all the sports you plan to play next year fall sports meeting th fall sports begin august st,"in slegs 'n paar van die herfs -sportseisoen het u 'n fisieke eindstryd gedoen, het u ingeskryf vir al die sportsoorte wat u beplan om volgende jaar te speel. sportvergadering th fall sports begin augustus st"
100,the exodus from sports entertainment continued with confirmation that chief operating officer mark hart resigned effective,die uittog van sportvermaak het voortgegaan met die bevestiging dat die bedryfshoof mark hart effektief bedank het
101,the volleyball season is right around the corner with tipping off their in the second week of august and set to begin in,die vlugbalseisoen is om die draai met hul afval in die tweede week van augustus en begin om in te begin
102,check out our new screaming aquatic center,kyk na ons nuwe screaming aquatic centre
103,golf call a snake after his intention to join the tour,gholf bel 'n slang na sy voorneme om by die toer aan te sluit
104,s new o lineman is the most flexible big man in all of college football does full split at,"s nuwe o lineman is die mees buigsame groot man in die hele universiteitsokker, doen die volle verdeling"
105,former auburn who threw helmet at opponent in to avoid suspension for hilarious reason,voormalige auburn wat 'n helm na die teenstander gegooi het om skreeusnaakse rede te vermy
106,franchise in cricket south s t league into the reliance family as part of its ongoing unconditional commitment towards the sports arena,franchise in cricket south s t league in die reliance -familie as deel van sy voortdurende onvoorwaardelike verbintenis tot die sportarena
107,native franklin the st u s woman to medal in the triple jump at the track and field world it is a dramatic comeback for the south grad who spoke openly about her mental health at the,inheemse franklin die st u s -vrou om in die drievoudige sprong op die baan- en veldwêreld te medalje dit is 'n dramatiese terugkeer vir die suid -graad wat openlik oor haar geestesgesondheid op die
108,we have seen getting involved in a lot of sports lately could be one of them this tour car advantage of both their purple and red and i love how it came out,"ons het gesien hoe om by baie sportsoorte betrokke te raak, een van hulle kan wees."
109,college basketball are back on the road this week scouting for future talent in the final evaluation period,kollege -basketbal is hierdie week weer op pad na toekomstige talent in die finale evalueringstydperk
110,_b that is the policy question legal sex is not good policy forcing everyone to agree that sex is now a feeling is not progressive saying i must pretend men in my sports is is not teaching some are in wrong is not,_b dit is die beleidsvraag wettige seks is nie 'n goeie beleid wat almal dwing om saam te stem dat seks nou 'n gevoel is nie progressief is om te sê dat ek moet voorgee dat mans in my sportsoorte nie is nie
111,the premise that minor are not livable wages,die uitgangspunt dat minderjarige nie lewende lone is nie
112,editor news montana include one news reporter with the sports editor on content and working closely with the advertising director,redakteur news montana sluit een nuusverslaggewer by die sportredakteur aan inhoud in en werk nou saam met die advertensie -direkteur
113,a and a sports psychologist was part of the support team for the world champion in his loss to bobby,a en 'n sportsielkundige was deel van die ondersteuningspan vir die wêreldkampioen in sy verlies aan bobby
114,is beer not this expensive at all sporting i been to a good amount of and sports and it like beer is almost always around i m confused by these at the fair beer was,"is bier nie so duur nie, maar ek was baie sport en sport, en dit is asof bier byna altyd daar is."
115,politician live at the san sports arena by on stream,politikus woon in die san sports arena deur on stream
116,group picked up the franchise in the all new t league set to begin,groep het die franchise in die nuwe t -liga opgetel om te begin
117,within an expanding sec to strengthen its football position,binne 'n groeiende sec om sy sokkerposisie te versterk
118,the thing is the latest symptom of the plague that is inappropriate behaviour by men in hockey everyone from to national to sports to refuse to acknowledge or talk about abuse in any form until and not every time they get busted,die ding is die jongste simptoom van die plaag wat onvanpas is deur mans in hokkie almal van nasionale tot sport om te weier om te erken of te praat oor mishandeling in enige vorm totdat en nie elke keer as hulle gesukkel word nie
119,former adoree' reflected on his relationship with coach mike on the cut to it,voormalige adoree 'besin oor sy verhouding met afrigter mike op die sny daaraan
120,i mean don t steal our you re literally sky sports news,"ek bedoel, moenie ons steel nie, jy is letterlik sky sports news"
121,can register at youth soccer league home registration will close on,kan registreer by die registrasie van die jeugsokkerliga -huis
122,more days left until summer camp get ready,meer dae oor totdat die somerkamp gereed is
123,happy national day from sports beautiful and more the keystone state so much to offer,gelukkige nasionale dag van sport mooi en meer die keystone -staat soveel om te bied
124,the still try to claim sports people as being until they lose and then they are again,die probeer om sportmense nog te eis totdat hulle verloor en dan weer
125,i wearing sports almost right away well before coming out to anyone else and before they were just so,ek het amper dadelik sport gedra voordat ek na iemand anders uitgekom het en voordat hulle net so was
126,player to,speler tot
127,waterproof wireless for sports w fast charging case,waterdigte draadloos vir sport w vinnig laaikas
128,where is headed,waarheen word op pad
129,on the final day of the draft on five mu baseball were selected in the draft the most since,op die laaste dag van die konsep op vyf mu -bofbal is die meeste sedertdien in die konsep gekies
