,src,trg
1426,we have a great show lined up for everyone tonight sports report live at yesterday got everyone out of the corner with a goal on corner kick tonight we will focus on winning football in instead of on stadium,"ons het 'n wonderlike vertoning vir almal wat vanaand sportverslag regstreeks regstreeks opgestel het, almal uit die hoek met 'n doel op hoekskop vanaand, ons sal fokus op die wen van sokker in plaas van op stadion"
1427,_danny this is why he s when compare him to a top athlete in team sports history,_danny dit is die rede waarom hy hom vergelyk met 'n topatleet in die sportgeskiedenis
1428,white and are very to have their y sports as this morning when the baton relay through especially when they are told  nothey were great and a real credit to you' what an amazing event to be a part of,"wit en is baie om hul y -sportsoorte te hê soos vanoggend wanneer die stokkie -aflos deurgaan, veral as daar aan hulle gesê word dat nothey wonderlik was en 'n ware krediet vir jou is 'wat 'n ongelooflike gebeurtenis om deel te wees van"
1429,welcome to the unresponsive sports game in history,welkom by die nie -reaksie -sportspeletjie in die geskiedenis
1430,they play a sport made up for people flying on but are so insanely woke that can not bear calling it what she did maybe just do something new,"hulle speel 'n sportsoort wat bestaan ​​vir mense wat voortvlieg, maar word so waansinnig wakker dat dit nie kan dra om dit te noem wat sy gedoen het nie, miskien net iets nuuts doen"
1431,some gay at the pool was making fun of me wearing a sports bra while laying out in the sun god are so dense,"sommige gay by die swembad het my spot met my om 'n sportbh te dra terwyl ek in die son gaan lê, is god so dig"
1432,in fox sports world cup,in fox sports world cup
1433,did you say overreach and the motor sports industry in the same sentence how about you start with stopping the government from my uterus,"het u gesê dat u oorreaksie en die motorsportbedryf in dieselfde sin het, hoe gaan dit met u om die regering uit my baarmoeder te stop?"
1434,_sports _ wait so you,_sports _ wag so jy
1435,shout out to wright for coming through and training with playmaker sports,skree vir wright omdat hy saam met playmaker sports deurgekom en oefen
1436,this is what like law religious in college sports,dit is wat soos law religious in college sports
1437,_faithful sorry i meant do you get any footage from training camp i get coverage from sky sports for the actual in season i can buy a game pass which will get me coverage of most,"_ faithful jammer ek bedoel, kry u enige beeldmateriaal van die oefenkamp, ​​ek kry dekking van sky sports vir die werklike seisoen."
1438,this is what sports great always been a good dude was sad when he left michigan for boston college but super happy for him and his success clearly he it all,"dit is wat sports great altyd 'n goeie ou was, was hartseer toe hy michigan na boston college verlaat het, maar baie bly vir hom en sy sukses is dit duidelik dat hy dit alles het"
1439,_edge _sports st but should do well in this trade no matter where he goes,"_edge _sports st, maar behoort goed te doen in hierdie handel, maak nie saak waarheen hy gaan nie"
1440,a couple d c council want to allow sports betting other than access to the d c mobile sports wagering market the council chairman and the lottery t so sure change is,"'n paartjie d c -raad wil sportweddenskappe toelaat, anders as toegang tot die d c mobile sports -weddenskapmark, die voorsitter van die raad en die lotto t so seker verandering is"
1441,how you feeling,hoe voel jy
1442,two gamecock women is have shown they are not down any time soon read more _peyton courtesy of tribune news service,"twee gamecock -vroue het gewys dat hulle nie binnekort af is nie, lees meer _peyton met inagneming van tribune news service"
1443,the do not seem to be doing themselves many in their quest to keep,dit lyk nie asof hulle nie baie doen in hul strewe om te hou nie
1444,was an offensive lineman for from under head coach,was 'n aanstootlike lineman vir van onder hoofafrigter
1445,walking dead stuff sam auto currently ladies that kick ass in sports i only collect,walking dead stuff sam auto tans dames wat esel in sport skop wat ek net versamel
1446,iso other rare _ _sell,iso ander skaars _ _sell
1447,most allow you to bring in food and many too out of all the major sports by far most affordable,die meeste laat jou toe om kos in te bring en baie te veel van al die belangrikste sportsoorte
1448,all my sports team looking like they have a good season this year that i can finally talk my again let s,al my sportspan lyk asof hulle hierdie jaar 'n goeie seisoen het dat ek uiteindelik weer met my kan praat
1449,super summer are here for the national sports forum th th plan and save on your days of innovation with top in the sports industry click here to learn more,super summer is hier vir die national sports forum th plan en bespaar op u dae van innovasie met top in die sportbedryf klik hier om meer te wete te kom
1450,one of my favorite i have worked on in a while is making history with the of the she is one of several making a huge impact in the game of baseball lately,"een van my gunsteling waaraan ek al 'n ruk gewerk het, is om geskiedenis te maak met die van die she is een van die verskeie wat die afgelope tyd 'n groot impak op die spel van bofbal maak"
1451,a of misogyny ago i stopped listening to their radio due to the hurtful hateful about in sports they deny it now but they are lying like most misogynist today,"'n van misogynie gelede het ek opgehou om na hul radio te luister as gevolg van die kwetsende haat in sportsoorte, ontken hulle dit nou, maar hulle lieg vandag soos die meeste misoginis"
1452,sports betting can begin with the dangerous practice of taking action on every pitch in a baseball game gambling on and with each pitch is chasing action and a risk to public health must be with public health policy,sportweddenskappe kan begin met die gevaarlike praktyk om op elke toonhoogte op te tree in 'n bofbalwedstryd op en met elke toonhoogte is die aksie en 'n risiko vir openbare gesondheid moet by die openbare gesondheidsbeleid wees
1453,peaty to return from injury at commonwealth,turf om terug te keer van die besering by commonwealth
1454,fantasy sports smith,fantasy sports smith
1455,my son is starting to be at for being slow due to finished a distant last at sports day i did the same in the race to show some solidarity even though it meant finishing behind a dad in a full suit then at me off for not trying my best,my seun begin om stadig te wees as gevolg van 'n laaste laaste op sportdag. beste
1456,the many ways to listen to orlando is sports leader am just search the game just say play ninety six point nine the game,"die vele maniere om na orlando te luister, is sportleier. soek net die speletjie, sê net negentig punt nege nege die spel"
1457,by one of our former give it a listen for great sports talk,deur een van ons voormalige gee dit 'n luister na great sports talk
1458,_iq it is so stupid the nearest from my home is hardly a kilometer but you have to cross main road and walk on a road with no footpath and it is an extreme sports and one to change and walk for but this city you to use a car,"_iq dit is so dom dat die naaste van my huis skaars 'n kilometer is, maar u moet hoofweg oorsteek en op 'n pad stap sonder voetpaadjie, en dit is 'n uiterste sport en een om te verander en te loop, maar hierdie stad om 'n motor te gebruik"
1459,people really hate and real sports that they want other people to quit doing it quit watching it,mense haat regtig en regte sportsoorte wat hulle wil hê dat ander mense ophou om dit op te hou om dit op te hou kyk
1460,agree,ooreenstem
1461,summer is the perfect time to get active to help get at least of physical activity each day try these ranging from organized sports to daily and more,"die somer is die perfekte tyd om aktief te raak om elke dag ten minste van fisieke aktiwiteite te help kry, probeer dit van georganiseerde sportsoorte tot daagliks en meer"
1462,would you put good money on to hit a big passing milestone in,sou u goeie geld aan sit om 'n groot verbygaande mylpaal in te slaan
1463,i wish i got into those my sports were baseball and basketball my brother was more into those physical sports like football wrestling used to pull some on me when we were young that is cool you study them also swimming is one of the best sports,"ek wens ek het by die sportsoorte gekom, was bofbal en basketbal my broer was meer besig met die fisieke sportsoorte soos sokkerstoei wat gebruik het om my te trek toe ons jonk was, is cool, jy bestudeer hulle ook swem is een van die beste sportsoorte"
1464,_doctor when he is not even is not the only way,"_dokter as hy nie eens is nie, is nie die enigste manier nie"
1465,more than people have an petition on calling for the united tennis association and the u s government to allow to compete in the u s open,meer as mense het 'n versoekskrif oor die versoek van die verenigde tennisvereniging en die u s -regering om toe te laat om aan die u s open te kompeteer
1466,_sports _ i got bosh and d wade ready just,_sports _ ek het bosh en d wade gereed net
1467,weekend of fun at history house sports display reunion competition and much more view the newsletter here to join our newsletter list sign up here,weekend of fun at history house sports display reunion -kompetisie en baie meer kyk na die nuusbrief hier om by ons nuusbrieflys aan te sluit
1468,the will be sporting a new look without but underwood is experience at other prepared him for this upcoming season a new brand of basketball is coming to champaign but it is not necessarily a bad thing by,"die sal 'n nuwe voorkoms sonder, maar underwood is ervaring by ander voorberei hom vir die komende seisoen. 'n nuwe handelsmerk basketbal kom na champaign, maar dit is nie noodwendig 'n slegte ding nie"
1469,_doctor twitter people dey drag this thing sha because i no dey here all these,"_doctor twitter mense trek hierdie ding sha, want ek is nie hier al hierdie dinge nie"
1470,u deserve,u verdien
1471,is grinding too who what this team can be i think the are be really fun team to watch during camp and preseason,"is ook slyp wie wat hierdie span kan wees, ek dink dit is 'n baie aangename span om na te kyk tydens die kamp en voorseisoen"
1472,wright most of his opportunity against,wright die meeste van sy geleentheid teen
1473,_sports more of this,_sports meer hiervan
1474,_hello you perform glycolytic activity which blood sugar for fuel performance and recovery and is muscle sparing meaning those help reduce the rate of muscle atrophy during phases of caloric you it before it s sports nutrition,"_hello u voer glikolitiese aktiwiteit uit wat bloedsuiker vir brandstofprestasie en -herstel en spierspaar is, wat beteken dat dit help om die tempo van spieratrofie te verminder tydens fases van kalorie u dit voordat dit 'n sportvoeding is"
1475,be sure to vote for for season player of the year by vote here,sorg dat u hier vir die seisoen speler van die jaar stem deur te stem
1476,it is my birthday to celebrate i am giving away or for the _sportmedia the association for in sports media to support at all of sports media with and professional development support,dit is my verjaarsdag om te vier dat ek weggee of vir die _sportmedia wat die vereniging in sportmedia by alle sportmedia ondersteun met en professionele ontwikkelingondersteuning
1477,in our very first competitive game as phoenix sports u we travelled to little did we know we d come out what a great start to our life at phoenix,"in ons heel eerste mededingende speletjie as phoenix sports u het ons tot min gereis, het ons geweet dat ons uitkom wat 'n wonderlike begin van ons lewe by phoenix"
1478,who for the and this week at old,wie vir die en hierdie week by oud
1479,of the court _sell,van die hof _sell
1480,thank you to _museums for the wonderful hull sports history box both class and class thoroughly their enquiry and inference sessions based on the,"baie dankie aan _museums vir die wonderlike hull sports history box, sowel as klas as klas, hul ondersoek- en inferensiesessies gebaseer op die"
1481,join me on world sports between and on as we take a look at the aftermath of coach ogum s sudden resignation from,sluit aan by my op wêreldsport tussen en aan terwyl ons kyk na die nasleep van die skielike bedanking van die afrigter ogum
1482,it is dirt just like the world cup in money money money i that some sports had a sound personal value base but when it comes down to it it nothing,"dit is vuil net soos die wêreldkampioenskap in geldgeld geld. ek het 'n gesonde persoonlike waardebasis gehad, maar as dit daarop neerkom, is dit niks"
1483,love your passion for your sports i see you represent,hou van jou passie vir jou sportsoorte wat ek sien jy verteenwoordig
1484,_sell _ mick,_sell _ mick
1485,wake wa arsenal player profile date of birth age citizenship height m position left back current international,wake wa arsenal spelerprofiel datum van geboorte ouderdom burgerskap hoogte m posisie links agter die huidige internasionale
1486,it was a rough morning in college station for one of a m is team,dit was 'n rowwe oggend in die universiteitstasie vir een van 'n m is -span
1487,great news both the a b legion will be today both start around b legion will be on w mike mason link below a legion will be on border sports kindred or via,"goeie nuus albei die a b legion sal vandag wees, albei begin b legion sal op die mike mason -skakel onder 'n legioen wees op grenssport of via via"
1488,sad to see this coach anti abortion only due to u m celebrity you good with this,"hartseer om hierdie afrigter teen aborsie te sien slegs as gevolg van die beroemdheid, is u goed hiermee"
1489,it is a good job that is how his surname is spelt otherwise that white woman sports reporter from last week would be calling for a more diverse surname,dit is 'n goeie werk.
1490,fun list from our sister site low based on alone but it is one heck of a list up and down,"prettige lys van ons susterwebwerf low, gebaseer op alleen, maar dit is een van 'n lys op en af"
1491,_doctor this is great he came back about later and x and also did incredible magic,_doctor dit is wonderlik dat hy later teruggekom het en x en ook ongelooflike magie gedoen het
1492,on the dress code black tie suit full stop cocktail and you can generally wear a pair of neutral a button up shirt and a sports coat tie usually optional if you can get a linen shirt and a light sports coat you should do alright in the heat,op die rokkode swart daspak vol stop -skemerkelkie en u kan gewoonlik 'n paar neutrale a -knopp -hemp dra en 'n sportjas -das wat gewoonlik opsioneel is as u 'n linne -hemp en 'n ligte sportjas kan kry
1493,to watch sports not to bet or nothing we talking bout just to watch,om na sport te kyk om nie te wed of niks wat ons praat net om na te kyk nie
1494,_sports whatever the hell their mascot is,_sports wat ook al die geluk is
1495,sent you a about coming on my radio show on this weekend we are a golf radio show but love to have sports on,"het u 'n oorkomende komende komende radioprogram die naweek gestuur, ons is 'n gholfradio -program, maar hou daarvan om sport te hê"
1496,thanks to all who and me best sports radio host show and to you are the,dankie aan almal wat en my beste sportradio -gasheerprogram en aan u is die
1497,the is a great avenue for most collegiate athletics and it them the opportunity to fulfill their _sports,die is 'n wonderlike manier vir die meeste kollegiale atletiek en dit is die geleentheid om hul _sport te vervul
1498,in what considered a blend of racism against who was a native and a fanatical devotion to the idea of amateurism were among the of his disqualification by victor,"in wat 'n mengsel van rassisme beskou het teen wie 'n inheemse en 'n fanatiese toewyding aan die idee van amateurisme was, was die van sy diskwalifikasie deur victor"
1499,_sell take metal,_sell neem metaal
1500,i have no clue who this guy is outside from what s said on your show that i know that he a raging hard on for but i don t see in the other sports acting this way maybe he see you in an airport one day like tony,"ek het geen idee wie hierdie man buite is van wat s op u show gesê het dat ek weet dat hy 'n harde woed nie, maar ek sien nie in die ander sportsoorte wat op hierdie manier optree nie, miskien sien hy u eendag soos tony"
1501,_d the entire goal of the fund is to normalize funded sports to increase foreign investment in i think the big thing is that its now going to make a us based entity tour worse,_d die hele doel van die fonds is om befondsde sportsoorte te normaliseer om buitelandse beleggings te verhoog. ek dink die groot ding is dat dit nou 'n amerikaanse entiteitstoer gaan maak
1502,_baller __giordano got more you got to switch sports to even compare how many your team got bum,"_baller __giordano het meer gekry, jy moet sport oorskakel om selfs te vergelyk hoeveel jou span bum gekry het"
1503,we have been so busy that we have not even gotten a chance to celebrate the sports that have the herd so thank you the train does not stop because of you,"ons was so besig dat ons nie eens die kans gekry het om die sportsoorte wat die kudde het nie, te vier, so dankie dat die trein nie ophou nie"
1504,_sell if that is with shipping i want,"_sell as dit met die aflewering is, wil ek hê"
1505,iowa is picked by deal with white sports,iowa word gekies deur white sports
1506,i just feel like a different person when i am wearing my sports bra,ek voel net soos 'n ander persoon as ek my sportbh dra
1507,finished in the combined sports team state champion mercer island was st mead were th the panther were in their a total of top state congratulation _scores,eindig in die gekombineerde sportspan -staatskampioen mercer island was st mead toe die panther in hul altesaam top state gelukke _cores was
1508,one hour til kick off v sports club u s,een uur tot die afskop van v sportklub u s
1509,s stokes' final with run win,s stokes se eindstryd met run win
1510,morning runner five today you and runner are off to new canton to look for sports and then get back here for  wouldebriefing',morning runner five vandag is jy en runner na new canton om na sport te soek en dan weer hierheen te kom vir wildebriefing '
1511,i do more sports than sleep per night,ek doen meer sport as slaap per nag
1512,why would he think differently running,waarom sou hy dink anders hardloop
1513,the sports in this country dey love spread bad unsubstantiated news pass,die sportsoorte in hierdie land het die liefde vir slegte ongegronde nuuspas versprei
1514,yeah it me sad there was nothing more majestic in sports than seeing all those across the diamond,"ja, dit is hartseer dat daar niks meer majestueus in sport was as om almal oorkant die diamant te sien nie"
1515,year today at sports day today well done everyone who took part,jaar vandag by sportdag vandag goed gedoen almal wat deelgeneem het
1516,sports like me are of their and these,sport soos ek is van hulle en hierdie
1517,if you are yourself from r and indeed you should maybe ditch those stupid,as jy jouself van r af is en inderdaad die dom daal
1518,throw out the first pitch at a game check out the ladies huddle auction by the auction at register for ladies huddle by at you do not want to miss it,gooi die eerste toonhoogte uit by 'n wedstryd. kyk na die damesknopveiling deur die veiling by register for ladies huddle deur by you wil dit nie mis nie
1519,that lately all the and title in and other fight are from former i am a fan of pugilistic sports always was studied some self defense over the but prefer boxing best full body exercise ever maybe to swimming,"dat al die titel en die titel in en ander stryd afkomstig is van die voormalige i is 'n aanhanger van pugilistiese sportsoorte, is altyd 'n mate van selfverdediging bo die boks, maar verkies die beste liggaamsoefening ooit, miskien bo swem"
1520,new research what coming back retention in a sport based positive youth development program,nuwe navorsing wat terugkom in 'n sportgebaseerde positiewe jeugontwikkelingsprogram
1521,this a man sport they have sports for you to watch powder puff girl,dit is 'n mansport wat hulle sport vir jou om na poeierblou meisie te kyk
1522,few to go set alarm at am,min om te gaan sit alarm by am
1523,no sports only baseball time of the year,geen sportsoort nie baseball tyd van die jaar nie
1524,_eau you are just being ignorant there is literally no proof that are better than at sports stop projecting to push your reactionary ideology,_eau jy is net onkundig daar is letterlik geen bewys wat beter is as by sportstop om te projekteer om jou reaksionêre ideologie te druk nie
1525,lot shipping only silver pack and rainbow foil _sell _connect to claim,lot gestuur slegs silwer pak en reënboogfoelie _sell _connect om te eis
1526,boston sports nut he is politically homeless,boston sports nut hy is polities haweloos
1527,michigan is outrage over pro life how dare he have a different opinion,michigan is verontwaardig oor die pro -lewe hoe hy durf 'n ander opinie het
1528,_sports take off of them,_sports neem daarvan af
1529,i am in a constant battle to decide whether being a sports fan is even for me i know i am on the other side of the stick to sports debate but when is speaking at an anti abortion rally we are gone we are lost i assume the next target will be gay marriage,"ek is in 'n voortdurende stryd om te besluit of dit 'n sportliefhebber is, selfs vir my, ek weet dat ek aan die ander kant van die stok aan die sportdebat is, maar wanneer ons praat by 'n anti -aborsie -byeenkoms, is ons weg, neem ek aan teiken sal gay huwelik wees"
1530,get in touch for all your needs our all all kick all sky sports and sport along with a load of other sport,"kontak vir al u behoeftes, ons almal skop alle sky sports and sport saam met 'n klomp ander sportsoort"
1531,_sports as long as they do not give up anything on the main team or anything that is going to bring them,_sports solank hulle niks opgee in die hoofspan of iets wat dit gaan bring nie
1532,snubbed,snuif
1533,_edge _sports like most hockey and some high end they won t play in canada is feeling it this year but this t a one off any team in the obviously if hockey is taking less to play in it t look good for the,"_edge _sports soos die meeste hokkie en 'n bietjie hoë punt wat hulle nie in kanada gewen het nie, voel dit hierdie jaar, maar dit is 'n een of ander span in die duidelike as hokkie minder neem om daarin te speel, sal dit goed lyk vir die"
1534,meet the physically fellow who is becoming a role model to many in is a talented and award winning journalist who on sports health culture and tourism related,"ontmoet die fisieke genoot wat vir baie mense 'n rolmodel word, is 'n talentvolle en bekroonde joernalis wat oor sportgesondheidskultuur en toerismeverwant is"
1535,that tweet is more blasphemous than the tweet ea sports tweet of me not being top in speed for,daardie tweet is meer godslasterlik as die tweet ea sports tweet van my nie die beste in die snelheid nie
1536,the public real biological only in sports we do not want in who are crap in the male category trying to cheat and rob their way to money and with self id,"die publieke werklike biologiese slegs in sport wat ons nie wil hê nie, wat in die manlike kategorie is, probeer om hul weg na geld en met self -id te verneuk en te beroof"
1537,it is it was worth him have to present the the world series trophy in one of the most awkward in sports,dit is die moeite werd om die the world series -trofee in een van die ongemaklikste in sport te bied
1538,did a track day there a few ago and all of us said it was motor sports best kept secret,het 'n paar gelede 'n baandag daar gedoen en ons almal het gesê dit is die beste geheim van motorsport
1539,district showing their sports team spirit _mst,distrik wat hul sportspan spirit _mst vertoon
1540,earn special mention for academic success from the,verdien spesiale vermelding vir akademiese sukses van die
1541,_doctor bot alert do not engage i repeat do not engage,"_doctor bot waarskuwing moenie betrokke raak nie, ek herhaal nie"
1542,sports clearly are not paying attention to bill and his ' men,sport gee duidelik nie aandag aan bill en sy mans nie
1543,kickoff commissioner 'everything is on the table' when it comes to league is future,"kickoff -kommissaris 'alles is op die tafel' as dit by die liga kom, is toekoms"
1544,that s every boston sports fan,dit is elke boston sports -aanhanger
1545,do not have to be considered sports on who your f rally endurance racing require certain athleticism and driving talent to do but what this is is some straight up goofy town that y'all speaking,"hoef nie as sport beskou te word oor wie u uithouvermoë -uithouvermoë sekere atletiek en talent nodig het om te doen nie, maar wat dit is, is 'n reguit dorp wat u praat"
1546,metal ninety fine take all for _sell,metaal negentig fyn neem alles vir _sell
1547,gave a year old a moment he never forget it s people like this that give me hope in humanity,het 'n jaar oud 'n oomblik gegee dat hy nooit vergeet dat mense soos hierdie wat my hoop in die mensdom gee nie
1548,a study defined an athlete as a sport specializer if he or she met the following criteria athletic participation limited to sport which is in in year and to the exclusion of all other sports read more,'n studie het 'n atleet as 'n sportspesialiser gedefinieer as hy of sy aan die volgende kriteria voldoen aan atletiekdeelname beperk tot sport wat in die jaar is en die uitsluiting van alle ander sportsoorte meer lees
1549,_sports that s to you,_sports wat vir u is
1550,year at sports day today well done everyone who took part,jaar op sportdag vandag goed gedoen almal wat deelgeneem het
1551,sports casual,sport gemaklik
