,src,trg
1403,but to thank everyone for joining last night it is always so much fun with y'all and being a giant idiot for hopefully your entertainment w and thank you so much to and _b for the my see you wed,"maar om almal te bedank dat hulle gisteraand aangesluit het, is dit altyd soveel pret met jou en om 'n reuse -idioot te wees vir hopelik jou vermaak w en baie dankie aan en _b vir die my sien jou wo wed"
1404,we saw his show in absolutely fantastic yellow brick road been one of my favorite since i was five wishing him all the best from the end of the world to your town john is news,"ons het gesien hoe sy show in 'n absoluut fantastiese geel baksteenweg een van my gunsteling was, want ek was vyf wat hom alles van die beste wou wens van die einde van die wêreld tot u stad, john is nuus"
1405,same friend said baseball dont wear the team uniform that the play for in all star game any more now wear national league i said its like the stop at the super bowl they just dont get it entertainment is the name of the game,"dieselfde vriend het gesê bofbal dra nie die spanuniform waarvoor die toneelstuk in all star game nog meer nou dra nie, dra national league, ek het gesê dit is soos die stop by die super bowl, hulle kry net nie die vermaak is die naam van die spel nie"
1406,entertainment industry been me for too long that if i am not conventionally attractive i should perish d,"die vermaaklikheidsbedryf was te lank dat as ek nie konvensioneel aantreklik is nie, ek d d"
1407,candidate for pa governor video that to climate change as 'pop science',kandidaat vir pa -goewerneur video wat tot klimaatsverandering as 'popwetenskap'
1408,check this out if you want entertainment,kyk hierna of u vermaak wil hê
1409,not on the connection but entertainment just how to market them and marketing them to people they are confident that the capacity to be the monster,"nie op die verbinding nie, maar vermaak net hoe om dit te bemark en dit aan mense te bemark, is hulle vol vertroue dat die vermoë om die monster te wees"
1410,yeah the more i been investigating my own budget the more i d rather just do the work of to raising more money on the onset and dividing up the surplus or stretch since entertainment t a sure fire profit building system to begin with,"ja, hoe meer ek my eie begroting ondersoek het, hoe meer doen ek eerder net die werk om meer geld in te samel en die surplus te verdeel of te rek, aangesien vermaak 'n seker brandwinsboustelsel begin het om mee te begin"
1411,_greever buddy this is entertainment,_ grref maat dit is vermaak
1412,big is automatic entertainment dude is a walking electric factory,big is automatic entertainment dude is 'n walking electric factory
1413,i used to like the much better when it was more about the baseball than the entertainment,ek het vroeër baie beter gehou toe dit meer oor die bofbal was as die vermaak
1414,and mero made a bunch of people feel good which is the best legacy you can have laughter is harder and harder to come by these days which their split that much,"en mero het 'n klomp mense goed laat voel, wat die beste nalatenskap is wat jy kan lag, is moeiliker en moeiliker om deesdae te kom, wat hulle soveel verdeel"
1415,coming soon,kom binnekort
1416,i cannot stand when people call to pass time are so important to me like yes call to catch up n have a whole or if you re in an emergency but if you call and ur in the line at or sum get creative and find other of entertainment,"ek kan nie staan ​​as mense roep om tyd te slaag nie vir my so belangrik is soos ja, oproep om 'n geheel in te haal, of as u in 'n noodgeval is, maar as u bel en u in die lyn bel of kreatief raak en ander vermaak vind"
1417,this been an outstanding show from fox so far lots of fun content and entertainment,dit was 'n uitstekende vertoning van fox tot dusver baie prettige inhoud en vermaak
1418,outside of the entertainment industry the us is just a third world,buiten die vermaaklikheidsbedryf is die vsa net 'n derde wêreld
1419,this weekend enjoy the entertainment and during the pier eats event see classic muscle and trucks at or enjoy a scenic view at the beautiful organic higher taste blueberry farm more on our,geniet hierdie naweek die vermaak en kyk tydens die pier eats -geleentheid klassieke spier en vragmotors by of geniet 'n skilderagtige uitsig op die pragtige organiese hoër smaakbloubessie -boerdery meer op ons
1420,she is so stupid,sy is so dom
1421,too good hilarious relatable bole to full on entertainment now u r a hero lyricist guitarist singer a trader,te goed skreeusnaakse relatiewe bole om vol te wees op vermaak nou 'n held lyricist kitaarspeler 'n handelaar
1422,watch and read for free entertainment,kyk en lees vir gratis vermaak
1423,_un_ramen your or order through big bad entertainment earth and other specialty toy,_un_ramen u of bestel
1424,love actor silence on casting,liefdesakteur stilte op rolverdeling
1425,i have absolutely no use for pro ship nonsense if fiction had absolutely zero effect on people in real life fictional would be nothing but empty as they would carry no entertainment value,"ek het absoluut geen nut vir pro -skeepsnonsens as fiksie absoluut nul uitwerk op mense in die werklike fiktief sou niks anders wees as leeg nie, want dit sou geen vermaaklikheidswaarde dra nie"
1426,what ever _in  is artistic freedom freedom of speech eh _bjp  is 'emergency' controversy as congress to her portrayal of,"wat ook al is, is artistieke vryheid van spraakvryheid eh _bjp is 'n noodtoestand 'kontroversie as die kongres vir haar uitbeelding van"
1427,cheap rent three and free entertainment easy yes,goedkoop huur drie en gratis vermaak maklik ja
1428,is peak entertainment,is piek vermaak
1429,was a spy sent by starship entertainment to destroy,was 'n spioen wat deur starship entertainment gestuur is om te vernietig
1430,pooch is pure entertainment so he be,"pooch is pure vermaak, so hy is"
1431,to stop spending time on for personal growth bed sofa entertainment,om op te hou om tyd aan te spandeer vir persoonlike groeibeddad
1432,'i am coming' mystery vignette with to undertaker and is fake staged,'ek is kom' mystery vignet met aan undertaker en is vals opgevoer
1433,th committee chairman will miss next hearing after testing positive for covid,die voorsitter van die komitee sal die volgende verhoor mis nadat hy positief vir covid getoets het
1434,from bear after she caught him cheating,van bear nadat sy hom bedrieg het
1435,oh my god they also on this show a insanely hot guy as a masked wrestler whose gimmick is he does to win we must destroy the world wrestling entertainment corporation immediately,"o my god hulle ook op hierdie show 'n waansinnige warm ou as 'n gemaskerde stoeier wie se foefie is om te wen, ons moet die world wrestling entertainment corporation onmiddellik vernietig"
1436,the pacific daily news free of upcoming entertainment and other as part of our on the feature in submit your event by information to life and include such as date time,die pacific daily news gratis van opkomende vermaak en ander as deel van ons op die funksie in die indiening van u geleentheid per lewe en sluit in soos datum tyd
1437,love these powerful must unforgettable inspiration empowerment and page turning entertainment the kind you love get here now,"hou van hierdie kragtige moet onvergeetlike inspirasie bemagtiging en bladsy draai vermaak die soort wat jy liefhet, kry nou hier"
1438,_tv watch _shows the _films and the best _tv and all with a day free trial with amazing on your with no contract see review see offer,"_tv watch _hows the _films en die beste _tv en almal met 'n dagvrye proeflopie met ongelooflike op u sonder kontrak, sien review sien aanbod"
1439,video minute with host cross entertainment guest are powered by _auctions,video -minuut met gasheer cross entertainment guest word aangedryf deur _auctions
1440,around taken from hoarding situation,rondom geneem uit die situasie
1441,pot meet kettle you hopped into a conversation trying to trade with someone who t even know you of course you get entertainment from this you obviously have no life,"pot ontmoet ketel wat jy in 'n gesprek gespring het om te probeer handel dryf met iemand wat jou selfs ken, natuurlik kry jy vermaak hiervan, jy het natuurlik geen lewe nie"
1442,they all act and think the same it is senseless i just get entertainment from reading these type of they are running away from their and hate themselves but also talk about themselves so highly yeah that is entertainment value,"hulle tree almal op en dink dieselfde is dit sinneloos dat ek net vermaak kry as hulle hierdie soort lees van hulle weghardloop en hulself haat, maar ook so baie oor hulself praat, ja, dit is vermaaklikheidswaarde"
1443,_janie he did get actually and it was not even fan at all but all in due time so far he kept pushing out quality work so i am not worried at all,"_janie wat hy wel gekry het, en dit was glad nie eens 'n aanhanger nie, maar op die regte tyd het hy tot dusver voortdurend gehalte -werk uitgestoot, so ek is glad nie bekommerd nie"
1444,i recruiting getting mad because tech worth and watching tech roast this man is the only entertainment i need tonight,ek werf om kwaad te word omdat tegnologie die moeite werd is om te kyk en na tech roast hierdie man is die enigste vermaak wat ek vanaand nodig het
1445,is now streaming of duty vanguard,is nou streaming van plig vanguard
1446,check out the _supernetwork channel,kyk na die _supernetwork -kanaal
1447,vote for entertainment media excellence one vote per day best eme scene,stem vir uitnemendheid vir vermaakmedia een stem per dag beste eme -toneel
1448,like is only and her life is pretty much ruined it is over for her in the entertainment industry and it is be so hard to find a normal job too she is going to get for the rest of her life,"soos net is en haar lewe redelik verwoes is, is dit verby vir haar in die vermaaklikheidsbedryf en dit is so moeilik om 'n normale werk te vind dat sy die res van haar lewe gaan kry"
1449,tonight i play video live for your entertainment and mine join me on twitch as i continue my journey through and then maybe some as a nice cool down,vanaand speel ek video live vir u vermaak en myne sluit my op twitch aan terwyl ek voortgaan met my reis en dan miskien 'n lekker koel
1450,being entertainment global year day,word global year day entertainment
1451,new shorts extremely irresistible experience above chopping board napa _animation,nuwe kortbroek uiters onweerstaanbare ervaring bo die kap van die bord napa _animasie
1452,'回 song of the sirens' highlight medley,'回 song of the sirens' highlight medley
1453,these black are s dining scene via,hierdie swart is 'n eetkamer via
1454,i used to model when i was a i been to plenty of and have been in more times than i can count i t born a man i love me a good conspiracy theory but the whole all of entertainment is gender inverted is ridiculous but you do you,"ek het vroeër modelleer toe ek 'n ek was en al meer kere was as wat ek kon tel, ek het 'n man gebore, ek is lief vir my 'n goeie samesweringsteorie, maar die hele vermaak is geslagsoming is belaglik, maar jy doen jou"
1455,prince harry at un on nelson mandela is links to his late mother princess via a one minute video of harry the un yesterday on nelson international day,prins harry by vn op nelson mandela is skakels na sy oorlede moederprinses via 'n een minuut video van harry die vn gister op nelson international day
1456,daily posted this article about the color purple adaptation you can check out the full article here,daily geplaas hierdie artikel oor die color purple -aanpassing u kan die volledige artikel hier besoek
1457,had bullying when her group first and those turned true so the entertainment company her out of the group,"het afknouery gehad toe haar groep eers was, en dit het waar geword, so die vermaaklikheidsonderneming het haar uit die groep"
1458,entertainment you re next,vermaak jy is volgende
1459,me a breakdown on the ur welcome for the free entertainment,my 'n uiteensetting van die ur welkom vir die gratis vermaak
1460,someone the poor thing just cannot leave wild life alone they are their pathetic entertainment,"iemand die arme ding kan net nie die wilde lewe alleen laat nie, hulle is hul patetiese vermaak"
1461,it is entertainment is what it is is not selling individual game when they play tech i football or basketball to attempt to mitigate their out theirs which is not hard to do in the first place,"dit is wat vermaak is, is om nie 'n individuele speletjie te verkoop as hulle tegnies speel nie, sokker of basketbal om hul s'n te versag, wat in die eerste plek nie moeilik is om te doen nie"
1462,there is a lot at play on right now besides the connector s bay building for the entertainment district transportation public safety public space and more,"daar is nou baie aan die gang, behalwe die connector se bay -gebou vir die openbare veiligheid van die vermaaklikheidsdistrik vir openbare veiligheid en meer"
1463,queen break with the first album in history to sell seven million,queen break met die eerste album in die geskiedenis wat sewe miljoen verkoop het
1464,i can tell i genuinely get on social media for my own entertainment and i don t be knowing anybody else be doing like how do i be on these all day still miss everything,"ek kan sien dat ek regtig op sosiale media gaan vir my eie vermaak, en ek weet nie dat iemand anders doen soos hoe ek die hele dag hiermee gaan nie, mis nog alles"
1465,it is an it can be used as an entertainment equipment in,dit is 'n gebruik as vermaaktoerusting in
1466,yeah how dare he be more than what you watch on the screen people don t exist purely for your entertainment grow up,"ja hoe durf hy meer as wat jy op die skerm kyk, mense bestaan ​​nie net vir jou vermaak nie"
1467,law order organized crime crew member in new york in early morning ambush,law order organized crime crew -lid in new york vroegoggend hinderlaag
1468,forever disgusted by entertainment,vir ewig gewalg deur vermaak
1469,_urns our relationship to is now intimately with and entertainment these are not legitimate for gun a is illegitimate in my too i absolutely want gun but the approach should be new gun that represent the modern context,"ons verhouding is nou intiem met en vermaak, dit is nie wettig vir geweer nie."
1470,i m going to s upcoming space will you join too,"ek gaan na die komende ruimte, sal u ook aansluit"
1471,my had an unyielding faith in a rating and an underlying belief that most were appropriate family entertainment,my het 'n ongeërgde geloof in 'n gradering en 'n onderliggende oortuiging dat die meeste geskikte gesinsvermaak was
1472,this is my favorite form of entertainment,dit is my gunsteling vorm van vermaak
1473,looking forward to your debut it is been great entertainment seeing your lovely today,"sien uit na u debuut, dit was 'n wonderlike vermaak om u lieflike vandag te sien"
1474,i agree but i enjoy the entertainment,"ek stem saam, maar ek geniet die vermaak"
1475,s team up for r b track rain day,s span op vir r b track rain day
1476,and are trying to run their about empty at the it at p m on a weekday and know a forced bogus piece of phony entertainment when they see one but the strip mall i am sure would be,"en probeer om op 'n weekdag om die leë plek by die it by p m te hardloop en ken 'n gedwonge valse stuk fyn vermaak as hulle een sien, maar die stripsentrum wat ek sekerlik sou wees"
1477,my midnight entertainment i miss his,my middernag vermaak ek mis syne
1478,always about his appearance entertainment,altyd oor sy voorkomsvermaak
1479,happy birthday i still remember to relive and relate to the magnificent of the history and entertainment great that we share to you i glad it is your birthday and many more for you brother as always,"gelukkige verjaarsdag ek onthou nog om te herleef en verband te hou met die wonderlike van die geskiedenis en vermaak wat ons aan u deel, ek is bly dit is u verjaardag en nog vele meer vir u broer soos altyd"
1480,and entertainment,en vermaak
1481,the shelf is from s outlet the are from a million the and are from my local comic shop but i m sure they can be found they re the new green canary i ordered from entertainment earth the were a gift bottom from bookish box,"die rak is van die afsetpunt van 'n miljoen die en kom uit my plaaslike strokiesprent, maar ek is seker dat hulle gevind kan word dat hulle die nuwe groen kanarie wat ek by entertainment earth bestel het, 'n geskenkbodem van bookish box was"
1482,take a tour of the mo sign war between mcdonald is and dairy queen and let us know what you think about this battle of the in the,neem 'n toer deur die mo sign war tussen mcdonald is en dairy queen en laat weet wat u dink oor hierdie stryd om
1483,it is for entertainment why do you ask,dit is vir vermaak waarom vra u
1484,_neko unfortunately they do not have a more mature appearance but that is a matter of opinion her personality however is fully not only is it a familiar anime trope up for entertainment it is by psychological trauma not a phase or indicative of age,"_neko ongelukkig het hulle nie 'n meer volwasse voorkoms nie, maar dit is 'n kwessie van mening dat haar persoonlikheid egter nie net 'n bekende anime -trop is vir vermaak nie. dit is deur sielkundige trauma, nie 'n fase of 'n aanduiding van ouderdom nie"
1485,no war is a reality show i pray there is not one human on this earth that war as any form of entertainment,"geen oorlog is 'n werklikheidsprogram nie, ek bid dat daar nie een mens op hierdie aarde is wat oorlog as enige vorm van vermaak is nie"
1486,our animal logic have been bought up by in a bid to broaden their offering,ons dierelogika is gekoop in 'n poging om hul aanbod te verbreed
1487,summit entertainment production company was so diverse how u produce the twilight and the step up,summit entertainment production company was so uiteenlopend hoe u die twilight en the step up produseer
1488,do you have a favorite episode _amc,het u 'n gunsteling episode _amc
1489,thanks to for tonight is entertainment great to see and storm talent is talent nothing to do with the brand omega is still,dankie aan vir vanaand is vermaak wonderlik om te sien en storm talent is talent niks te doen met die handelsmerk omega is nog steeds nie
1490,system of hate we who walk with god home of the best,stelsel van haat ons wat saam met die huis van die beste wandel
1491,less entertainment for we the are very happy watching a real fight instead of the circus they with and,minder vermaak vir ons is baie gelukkig om na 'n regte geveg te kyk in plaas van die sirkus waarmee hulle en
1492,australia is biggest cuckold peter hellier is upset,australië is die grootste cuckold peter hellier is ontsteld
1493,_rubin his old at are very much aware that reverse engineering is under fair use doctrine i suggest you look up entertainment corp to sue over their emulator and lost on all,_rubin sy ou at is baie bewus daarvan dat omgekeerde ingenieurswese onder billike gebruik is.
1494,_lukky is now streaming,_lukky is nou stroom
1495,entertainment in the,vermaak in die
1496,global interactive entertainment brand that its headquarters office been officially in,global interactive entertainment -handelsmerk waarin sy hoofkantoor amptelik was
1497,release date when will the movie stream on plus,vrystellingdatum wanneer sal die film stroom op plus
1498,would make this type of movie with hint it is not a threesome although and does have a certain ring to it,"sou hierdie tipe film met wenk maak, dit is nie 'n trio nie en het wel 'n sekere ring"
1499,watch now garden contest place,kyk nou garden contest place
1500,at the beginning lyric video fox family entertainment,aan die begin het lyric video fox family entertainment
1501,reading the for entertainment,lees die vir vermaak
1502,_ the crowd around him does not even look upset they are smiling while saying  wouldeath' this is entertainment to them the persecution of the other not from hatred but from boredom,"_ die skare rondom hom lyk nie eens ontsteld nie, maar glimlag terwyl hulle sê 'dit is vir hulle vermaak die vervolging van die ander nie van haat nie, maar van verveling"
1503,honest to god you will need to watch pee your pants laughing entertainment thanks for the,"eerlik teenoor god, u sal moet kyk na u broek wat lag en lag, dankie vir die"
1504,maybe they also chose to eliminate art music literature entertainment because too many if them were becoming offended by or getting their hurt by other people is self expression maybe that is how they war poverty,"miskien het hulle ook gekies om kunsmusiekliteratuurvermaak uit te skakel, want te veel as hulle aanstoot neem of deur ander mense seerkry, is dit selfuitdrukking, miskien is dit hoe hulle oorlogsarmoede het"
1505,you mean the guy that came back to a tweet days later because he s and is searching for entertainment oh i got it,"jy bedoel die man wat dae later teruggekeer het na 'n tweet, want hy s en soek na vermaak, ek het dit gekry"
1506,into this and we as a nation have consistently and and every adult entertainment aspect over our and their needs and as a parent in a blue state the fear is very real about what will come in fall when school again,"in hierdie en ons as 'n volk het konsekwent en en elke volwasse vermaak -aspek van ons en hul behoeftes, en as ouer in 'n blou toestand is die vrees baie werklik oor wat in die herfs sal kom wanneer dit weer skool is"
1507,there is more to life than,daar is meer in die lewe as
1508,that is based as i hate when people say that art are better than entertainment or they are completely different how are you judge them both the same,"dit is gebaseer soos ek haat as mense sê dat kuns beter is as vermaak, of dat hulle heeltemal anders is, hoe beoordeel u albei dieselfde"
1509,is the best entertainment i turned on specifically for them they never miss,is die beste vermaak wat ek spesifiek vir hulle aangeskakel het wat hulle nooit mis nie
1510,enough both to visit same time so both can enjoy birth of or space all little fam so they have something to do bowling like in this build indoor lap pool outdoor too all master probably go this time spa entertainment,"genoeg om dieselfde tyd te besoek, sodat albei die geboorte van of die ruimte kan geniet, so hulle het iets om te boul soos in hierdie bou -binnenshuise skoot swembad buite, te almal, sal waarskynlik hierdie keer spa -vermaak gaan"
1511,live on up all tonight news trolling,live up all tonight news trolling
1512,new session of gopman is comedy class tonight do not miss out on the next one visit for more oh my entertainment,nuwe sessie van gopman is vanaand 'n komedie -klas. moenie die volgende een besoek mis nie
1513,no need to take my word for it and it with appropriate conduct regarding his body generally,"u hoef nie my woord daarvoor te neem nie, en dit met toepaslike gedrag rakende sy liggaam in die algemeen"
1514,_marks thankfully you t an entertainment executive,_merke gelukkig is u nie 'n vermaaklikheidsbestuurder nie
1515,vote for entertainment media excellence one vote per day best dramatic scene in a series,stem vir uitnemendheid vir vermaakmedia een stem per dag beste dramatiese toneel in 'n reeks
1516,i believe it was as family friendly entertainment,ek glo dit was as gesinsvriendelike vermaak
1517,did the entertainment network fire ben is he no longer the reporter at his are correct but we re better off left unsaid,"het die entertainment network fire ben gesê dat hy nie meer die verslaggewer op sy korrek is nie, maar ons is beter as hy nie gesê het nie"
1518,candidate for pa governor video that to climate change as 'pop science' is for real why does he claim to be an expert at at everything does it seem obvious he his from beyond the,"kandidaat vir die pa -goewerneurvideo dat om klimaatsverandering as 'popwetenskap' te werk, waarom beweer hy dat hy 'n kundige is by alles, lyk dit duidelik dat hy van buite die"
1519,forgot link for more,skakel vergeet vir meer
1520,my yr old a gaming crew a group of five same age and they play together a few a week on a private server let me tell you i get as much joy entertainment as she does as i listen to them chat on discord,"my jaar oud 'n spelpersoneel 'n groep van vyf dieselfde ouderdom en hulle speel 'n paar per week op 'n privaat bediener, laat ek jou vertel dat ek soveel vreugdevermaak kry as wat sy doen as ek luister na hulle gesels op discord"
1521,is a global full service music sports and entertainment platform by imagine then be diverse _tvu,"is 'n wêreldwye volledige diens musieksport- en vermaakplatform van imagine, wees dan uiteenlopend _tvu"
1522,_varu feeling alone entertainment,_varu voel alleen vermaak
1523,check it out,kyk daarna
1524,the new from original creator,die nuwe van oorspronklike skepper
1525,only love to good entertainment,net liefde vir goeie vermaak
1526,_wehe right we d lose the entertainment value,_wehe reg ons verloor die vermaaklikheidswaarde
1527,the answer is a little but the violence in stray is generally much more abstract than graphic you may see a cute kitty with the word dead printed over it a few in which the cat from somewhere high up and then for awhile,"die antwoord is 'n bietjie, maar die geweld in verdwaalde is oor die algemeen baie meer abstrak as grafies."
1528,the jeff fox show _chisholm the very first born all star from your sports entertainment,the jeff fox show _chisholm die heel eerste gebore all star uit u sportvermaak
1529,vote for entertainment media excellence one vote per day most iconic scene in a series,stem vir uitnemendheid vir vermaakmedia een stem per dag die meeste ikoniese toneel in 'n reeks
1530,carnage million loss of in company history,carnage million -verlies aan die geskiedenis van die maatskappy
