,src,trg
1045,hill offer join hill bet on our dark horse get in free claim here new customer offer t c s apply,hill -aanbod sluit aan by hill bet op ons dark horse get in gratis eis hier nuwe klante -aanbod t c s is van toepassing
1046,_handle in theory ha mobile betting play along along with already done so would be a driver for to switch to a competitive market of real betting from and will want to fire up their same while they re in let them,"_handvat in teorie ha mobiele weddenskappe saam met reeds gedoen, so sou 'n drywer wees om oor te skakel na 'n mededingende mark van regte weddenskappe en sal dit wil opskiet terwyl hulle dit weer inhou"
1047,_edge _sports if they want a young star player in return trade him for twitter is player ever,"_edge _sports as hulle wil hê dat 'n jong ster -speler in ruil daarvoor wil verhandel vir twitter, is die speler ooit"
1048,city high easily handle and out in little will face city high,city high maklik hanteer en in little sal die stad hoog wees
1049,guide young generation to read every day they should read a new topic it may be history sports politics over the period of time they will start gaining knowledge of each and every field,"lei jong generasie om elke dag te lees. hulle moet 'n nuwe onderwerp lees, dit kan 'n geskiedenis -sportpolitiek wees oor die tydperk dat hulle kennis van elke veld sal begin opdoen"
1050,cry out by scarlet red,uitroep deur scarlet red
1051,welcome to de,welkom by de
1052,came of tiny buda western to become a state high champ legend now he is a bureau county sports hall of,"kom uit die klein buda western om 'n staatskampioen -legende te word, nou is hy 'n buro county sports hall of"
1053,and grit rookie at plate,en gruis rookie op bord
1054,yes but reading about it it like punch been part of it for many even before the latest lot it is like the worst sports except on two and that this aggression is acceptable laudable at some level,"ja, maar om daaroor te lees, dit was soos punch 'n deel daarvan vir baie, selfs voor die nuutste lot, is dit soos die slegste sportsoorte, behalwe op twee en dat hierdie aggressie op 'n sekere vlak aanvaarbaar is"
1055,i believe the is,ek glo die is
1056,_michael _floodlight i think is in good shape because able to to get the working class pa vote even if they are republican leaning over because i mean is a really candidate even locally walker on the other hand is apparently a local legend for his sports career,"_michael _ floodlight dink ek is in 'n goeie vorm, want om die werkersklas pa -stem te kry, selfs al is hulle republikeinse om te leun, want ek bedoel, is 'n baie kandidaat, selfs plaaslik walker, aan die ander kant, is blykbaar 'n plaaslike legende vir sy sportloopbaan"
1057,enjoy vacation good sir,geniet vakansie goeie meneer
1058,if you are passionate about the and want to gain experience as an sports journalist join more,as u passievol is oor die en wil ondervinding opdoen as 'n sportjoernalis meer aan
1059,wonder what hour at like come along with us for all days of content in sports health safety professional and character development live sport panel,wonder watter uur saam met ons kom vir alle dae van inhoud in sportgesondheidsveiligheid en die live sport -paneel vir karakterontwikkeling
1060,some are bigger than sports but to make it harder to vote something to think about,"sommige is groter as sport, maar om dit moeiliker te maak om oor iets te stem om na te dink"
1061,for any looking to play college sports give this one a listen of us through the recruiting process all the do s and don,"vir elkeen wat op soek is na universiteitsport, gee hierdie een 'n luister na ons deur die werwingsproses al die do s en don"
1062,she is the tournament top with five england is beth mead to score in extra time or in a penalty is of odds and for coming up at go,"sy is die toernooi -top, met vyf engeland is beth mead om ekstra tyd te score of in 'n strafskop is van kans en dat hy by go opdaag"
1063,sam if he were a car he would be tony a really cool sports car sam running on,"sam as hy 'n motor was, sou hy tony 'n baie oulike sportmotor wees wat aan die gang is"
1064,packer is awesome wish he still had his afternoon off campus show on best radio show covering college sports i,packer is fantasties wens hy het nog sy middag op die kampusvertoning op die beste radioprogram gehad wat college sports ek dek
1065,_ rad denigrate men and promote privilege for on principle you will note that she did not mention even in passing that can not be men can not soldier like men can not father like men you can bet that if were men in sports she have no,"_ rad denigrate mans en bevorder voorreg vir in beginsel, sal u daarop let dat sy nie genoem het nie, selfs nie in die verbygaan wat nie mans kan wees nie, kan nie soldaat soos mans nie, soos mans, jy kan wed dat as mans in sport is, sy nie het nie"
1066,of our winning on and off the track one of only two _sports to have both and earn all academic team recognition this season,van ons wen op en buite die baan een van slegs twee ports om albei te hê en alle akademiese spanherkenning hierdie seisoen te verdien
1067,install alert new barrier netting going up for today,installeer waarskuwing nuwe versperringsnetwerk vir vandag
1068,the commissioner college sports still a soul he may be wrong but it s nice someone still,"die kommissaris -kollege sport nog steeds 'n siel, hy kan verkeerd wees, maar dit is nogal lekker iemand"
1069,sports can be so toxic,sport kan so giftig wees
1070,just posted a photo evolution sports performance training,pas 'n foto -evolusie -sportprestasie -opleiding geplaas
1071,skin colored sports and t all they re cracked up to be,velkleurige sportsoorte en alles wat hulle weer gekraak het
1072,minister for sport had a moment at tennis club during his tour of local sports today,minister van sport het 'n oomblik by tennis club gehad tydens sy toer na plaaslike sportsoorte vandag
1073,have always that look like them or came from the same as them or believe the same they do representation in sports,het dit altyd soos hulle gelyk of van dieselfde as hulle gekom of glo dieselfde as wat hulle in sport verteenwoordig
1074,powerful image by off my edit for today s press selection of news sports and entertainment for the page,kragtige beeld deur my wysiging vir vandag se pers seleksie van nuussport en vermaak vir die bladsy
1075,and with this we come to the end of days host done and,en hiermee kom ons aan die einde van die dae se gasheer en
1076,stenson is tenure as ryder cup captain 'brought to an end' via,stenson is verblyfreg as die ryderbeker -kaptein 'tot 'n einde gebring' via
1077,_convo it is sports suck and camp has not yet that is why,_convo dit is sportsuig en die kamp het nog nie die rede nie
1078,last chance to grab history get your limited edition player of the year card pack helping benefit by,"laaste kans om die geskiedenis te gryp, kry u beperkte uitgawe player of the year -kaartpakket om voordeel te trek"
1079,revisionism and recency bias are so bad in sports even just this last durant a consensus top player in the world to everyone who was everyone had people saying him because of four but after the poor he s barely t,"revisionisme en vooroordeel is so sleg in sport, selfs net hierdie laaste keer 'n konsensus -topspeler ter wêreld vir almal wat almal was, het mense hom gesê weens vier, maar na die armes is hy skaars t"
1080,the next sonic sports game will be infinite and sonic at the,die volgende sonic sports -speletjie is oneindig en sonic by die
1081,i m curious why no one interested in and for the pac like las is an untapped market for college sports san sense for them maybe,ek is nuuskierig waarom niemand daarin belangstel nie en vir die pac soos las 'n onbenutte mark vir universiteitsport san sense vir hulle is
1082,from to josh here are of  is roster ahead of training camp,van tot josh hier is van is -rooster voor die oefenkamp
1083,a sports team is not about race but performance what do you say about the football or basketball in us being mostly composed by and that is fine best must play,"'n sportspan gaan nie oor ras nie, maar prestasies wat sê jy oor die sokker of basketbal in ons, meestal saamgestel, en dit is goed die beste moet speel"
1084,a mental health and in is a public good could we get your on this and or an action plan to stop school from gender their gender identity,'n geestesgesondheid en 'n openbare voordeel kan ons hieroor en of 'n aksieplan kry om die skool te keer om hul geslagsidentiteit te geslag
1085,_da_beast _girl now do track and soccer and endurance sports,_da_beast _girl doen nou spoor- en sokker- en uithouvermoë sport
1086,_john sports casual my teeth itch,_john sport gemaklik my tande jeuk
1087,sports who view as who could never have an off day and are really disgusting and have no right to call themselves,sport wat beskou as wie nooit 'n afdag kan hê nie en regtig walglik is en nie die reg het om hulself te bel nie
1088,any current,enige stroom
1089,today is the driest sports day of the year so it would be a fantastic day for harden to actually sign that deal with the,"vandag is die droogste sportdag van die jaar, so dit sou 'n fantastiese dag wees vir harden om die ooreenkoms met die"
1090,finally a real take i am glad this person is coming from someone that sports rather than just being a homer,"uiteindelik 'n regte ding, ek is bly dat hierdie persoon van iemand kom wat sport eerder as om net 'n homer te wees"
1091,no incident but its definitely the exception racism turned into a hustle where some use a broad brush boston daughter works in pro sports she s only prob she s had was black she s not racist so won t generalize,"geen voorval nie, maar dit is beslis die uitsondering wat rassisme verander het in 'n gewoel waar sommige 'n breë kwas boston -dogter gebruik in pro -sportsoorte wat sy net waarskynlik was, swart sy is nie rassisties nie, so hy het nie veralgemeen nie"
1092,if he had gone on and said abortion is a wonderful thing nobody would care as it is the radical will probably either cost him his job or get him shot to change,"as hy aangegaan het en gesê het dat aborsie 'n wonderlike ding is, sal niemand omgee nie, want dit is die radikale wat hom waarskynlik sy werk sal kos of hom geskiet het om te verander"
1093,yes there is when men who demand we pretend they are try to get into s locker and sports have you been under a rock for the past,"ja, daar is wanneer mans wat eis dat ons voorgee dat hulle probeer om in s locker en sports te kom, was u al die afgelope tyd onder 'n rots"
1094,_bernstein tonight is more about the almighty dollar than sports,_bernstein vanaand gaan meer oor die almagtige dollar as sport
1095,people do not watch sports because they are horny for the holy except women is tennis,"mense kyk nie na sport nie, want hulle is geil vir die heilige, behalwe dat vroue tennis is"
1096,da the sports day trophy,da die sportdagtrofee
1097,imagine any other job where you are so by an entire city for making the best decision for you and your family i get it sports but for the athlete as well as the organization it is business then again i will miss judge if he leaves,"stel jou voor dat enige ander werk waar jy so deur 'n hele stad is om die beste besluit vir jou en jou gesin te neem, ek kry dit sport, maar vir die atleet sowel as die organisasie is dit sake, dan sal ek weer regter mis as hy vertrek"
1098,come tune in _sports,kom instel in _sports
1099,will the big deal be worth more than what the pac can get great breakdown from former of sports at fox sports and current media analyst,sal die groot saak meer werd wees as wat die pac 'n groot uiteensetting kan kry van voormalige sportsoorte by fox sports en current media analyst
1100,worse in sports,erger in sport
1101,from different expert get of free premium,van verskillende kundiges get of free premium
1102,man it was so cool to watch this one of the best days a sports fan could have,man dit was so gaaf om te kyk na hierdie een van die beste dae wat 'n sportliefhebber kon hê
1103,i truly do believe in my heart of hearts and soul of that i have the right to do sports and do it well or maybe being delusional because watching too many sport,"ek glo waarlik in my hart van harte en siel dat ek die reg het om sport te doen en dit goed te doen of miskien misleidend te wees, want te veel sport kyk"
1104,rusty who before house committee the are not good sports apparently in the game they play telling the truth with get you a yard penalty,"rusty wat voor die huiskomitee die nie goeie sportsoorte is nie, blykbaar in die spel wat hulle speel en die waarheid vertel met 'n werf straf"
1105,may be the last person in power who college sports still a soul worth saving that might be dangerously naive but at least someone somewhere still what this was all supposed to be about once,"kan die laaste persoon aan bewind wees wat die universiteit nog steeds 'n siel is wat die moeite werd is om te red wat gevaarlik naïef kan wees, maar ten minste iemand êrens nog steeds waaroor dit alles veronderstel was om een ​​keer te wees"
1106,took to the podium during football kickoff and touched on conference realignment and the state of the program,na die podium geneem tydens die afskop van die sokker en het die konferensie -herbelyning en die stand van die program aangeraak
1107,great in sports by j great i,groot in sport deur j great i
1108,is amazing at sports i t want to face him in either he would whoop my ass is the man,"is ongelooflik by sport, ek wil hom nie in die gesig staar nie, hy sou my gat die man is"
1109,great great _glennon so of all your hard work your home family and sports family love you for it _gaa,groot wonderlike _glennon so van al u harde werk is u huisfamilie en sportfamilie lief daarvoor _gaa
1110,could do so much more for s sports by just them on and not them to or streaming than they ever done with a marketing campaign,kan soveel meer vir s -sportsoorte doen deur net hulle aan en nie na hulle of te stream nie as wat hulle ooit met 'n bemarkingsveldtog gedoen het
1111,with won and lost winning percentage and won and lost,met gewenste en verlore wenpersentasie en gewen en verloor
1112,mercer high school football preview,mercer high school football preview
1113,our focus was simply to come out here play the best baseball that we could our brand of baseball for as many as we got out here tonight and we got that done,"ons fokus was bloot om hierheen te kom speel die beste bofbal wat ons bofbal vir soveel as wat ons vanaand hier kon uitkom, en ons het dit gedoen"
1114,yahoo sports ex mac as sneaky pick,yahoo sports ex mac as sneaky pick
1115,_doctor there is no government in state is not just stupid for saying that is a state he is something worst than that his are nothing but a goat he is a disgrace to i am ashame to say i am because of,"_doktor daar is geen regering in die staat nie net dom om te sê dat dit 'n staat is nie. hy is iets wat die ergste is as dat hy niks anders is as 'n bok nie, hy is 'n skande vir i am ashame om te sê ek is as gevolg van"
1116,yahoo sports madden running given surprisingly low,yahoo sport madden hardloop verbasend laag
1117,it would be nice if this was a watershed moment in sports journalism where are with a secondary source before where spin become the focus but i doubt it it will be more forelock tugging to whatever club in,"dit sal lekker wees as dit 'n waterskeidingsmoment in sportjoernalistiek was, waar met 'n sekondêre bron voor die spin die fokus word, maar ek twyfel of dit meer voorlok sal wees om na watter klub ook al"
1118,super bowl champ and former first round draft pick dead at what are the odds it something to do with the jab,super bowl -kampioen en voormalige eerste ronde konsepdood op die kans is dit iets te doen met die steek
1119,espn is sports humanitarian team of the year,espn is 'n humanitêre span van die jaar
1120,o i watched a single frame in deep into the pandemic and the guy had me hooked onto a sport i never of before the goat the best sports guy ever an icon,o ek het 'n enkele raam diep in die pandemie gekyk en die man het my aan 'n sportsoort vasgehaak wat ek nooit voor die bok die beste sportman ooit 'n ikoon gehad het nie
1121,with ea sports and dissolving their partnership and both into their own football which one are you more likely to buy and why keep pes in mind when you make your decision and after voting,"met ea -sportsoorte en die ontbinding van hul vennootskap en beide in hul eie sokker, wat u meer geneig is om te koop, en waarom u pes in gedagte hou as u u besluit neem en nadat u gestem het"
1122,_ i certainly think making a football video game to be one of the most complicated sports to make with the infinite number of physics and at any given moment ea could definitely try a little more but i definitely don t envy their job,"_ ek dink beslis om 'n sokkervideospeletjie te maak om een ​​van die mees ingewikkelde sportsoorte te wees met die oneindige aantal fisika, en op enige gegewe oomblik kan ea beslis 'n bietjie meer probeer, maar ek is beslis nie van hul werk nie"
1123,_un _ k you been posted same and and no have fun with this mute,_un _ k u is dieselfde geplaas en nee pret met hierdie stomme
1124,for the record i done zero research on what are doing so they may be doing this stuff already this is just where prof sports brain went to start,"vir die rekord het ek geen navorsing gedoen oor wat doen nie, sodat hulle hierdie dinge al doen, dit is net waar prof sportbrein begin het"
1125,_sports i play,_sports wat ek speel
1126,is and always will be my favorite player football t everything in life he his dream and did what he felt was best for his family family first he s the example of a sports figure i d want my son to idolize,"is en sal altyd my gunsteling speler sokker wees, en alles in die lewe het hy sy droom en gedoen wat hy die beste vir sy familiefamilie was. eerstens is hy die voorbeeld van 'n sportfiguur wat ek wil hê dat my seun moet afgod"
1127,good luck tonight _sports,sterkte vanaand _sports
1128,thanks i out to them and i am looking forward to hearing from them hope you continue to feel better everyday,dankie ek aan hulle en ek sien uit daarna om van hulle te hoor hoop dat u elke dag beter voel
1129,yea but men in woman sports integrity,"ja, maar mans in vrousportintegriteit"
1130,_sports cause we said so,_sports want ons het so gesê
1131,i am a alumni and i covered men is basketball during the era and i do not pay much attention to prep sports in or new i did not know much about you but damn man,"ek is 'n alumni en ek het mans gedek, is basketbal gedurende die era en ek let nie veel aandag aan voorbereidingsport of nuut nie, ek het nie veel van jou geweet nie, maar verdomde man"
1132,_sell _connect take the,_sell _connect neem die
1133,_walters most southern constitutional carry near total on abortion and from sports i do not see getting in the way of this other than virtue on twitter maybe,_walters die meeste suidelike grondwetlike dra byna totaal op aborsie en uit sport sien ek nie in die pad van hierdie ander as deug op twitter nie
1134,_nicolefalls you ai not told no went to a work outing and was like i been looking at the wrong sports also just eye candy i am happily married,"_nicolefalls you ai het nie gesê nee het na 'n werkuitstappie gegaan nie en was asof ek na die verkeerde sportsoorte gekyk het, ook net oogkoekies, ek is gelukkig getroud"
1135,_boardpb _punjab will lead and prove their on this gear platform,_boardpb _punjab sal hul op hierdie ratplatform lei en bewys
1136,i want to change the colour of my medal at these said,ek wil die kleur van my medalje by hierdie gesê verander
1137,i do i used to own a sports store and did for sports and city sports i don t do it but happy to share or answer if i know material shrinkage,"ek het vroeër 'n sportwinkel besit en vir sport- en stadsport gedoen. ek doen dit nie, maar deel dit graag of antwoord as ek weet"
1138,can t wait to see all the sky sports on how short he is,kan nie wag om al die lugsport te sien oor hoe kort hy is nie
1139,oh,ag
1140,you need to refresh your history on the who are saying this there is a lot of greed and mediocrity which how overly important people value sports and and they feel sponsor do not care but their own exposure period,"u moet u geskiedenis verfris oor die who wat dit sê, daar is baie gierigheid en middelmatigheid, wat hoe te veel mense sport waardeer en dat hulle borg nie omgee nie, maar hul eie blootstellingstydperk"
1141,thank you will miss you,dankie sal jou mis
1142,like roe v wade forgiving all student loan debt and how about those that were going to go out the second the senate he said all of those but i know some people like to treat politics like sports and never criticism their team,"soos roe v wade wat alle studieleningsskuld vergewe en hoe gaan dit met diegene wat die tweede keer die senaat gaan uitgaan, het hy al hierdie dinge gesê, maar ek weet dat sommige mense daarvan hou om politiek soos sport te behandel en nooit hul span te kritiseer nie"
1143,former and hotspur defender 'oj' told marawa is  amarawa sports worlwide' he does not watch the premier soccer league any more,die voormalige en hotspur -verdediger 'oj' het aan marawa gesê amarawa sports worlwide 'hy kyk nie meer na die voorste sokkerliga nie
1144,a house on islay well did he gave it to his ex wife every year they celebrated his birthday by going over for the last two of and doing sports day we can t go this year went last year but no but the weather will be so not that bad,"'n huis op islay het dit goed gedoen aan sy eksvrou elke jaar dat hulle sy verjaardag gevier het deur die laaste twee van te gaan en die sportdag te doen, ons kan nie hierdie jaar gaan nie, maar nee, maar die weer sal so wees, nie so nie sleg"
1145,i may be but i think the winged wheel is one of the best if not the best in sports it s dope meaning and good on anything,"ek is miskien, maar ek dink die gevleuelde wiel is een van die beste, indien nie die beste in sportsoorte wat dit beteken nie en goed op enigiets"
1146,truly the sports movie god,waarlik die sportfilm god
1147,thus men liking sports more than at times sure i think the word emotion is a bit off though but i see where you are,"dus hou mans wat van sport hou as soms seker dat ek dink dat die woord emosie 'n bietjie af is, maar ek sien waar jy is"
1148,tomorrow is the last day to sign up for sports,môre is die laaste dag om aan te meld vir sport
1149,episode talented sports reporter who was first runner up miss she about her journey _ _cardonaa,"episode talentvolle sportverslaggewer wat die eerste naaswenner was, juffrou she about her journey _ _cardonaaa"
1150,the offense will be better no doubt but they were also until they some of the worst in the league last year was a great move but outside of him everyone else is either bad or and their first and there last are brutal,"die oortreding sal ongetwyfeld beter wees, maar dit was ook totdat hulle van die ergste in die liga verlede jaar was, was 'n wonderlike stap, maar buite hom is almal sleg of en hul eerste en daar laas is dit brutaal"
1151,an unmotivated will give up world chess title,'n ongemotiveerde sal die wêreldskaaktitel prysgee
1152,the football sports club annual camp in full swing this week so many great such as the future student a chance to connect with our current high school student leadership stay strong _sportsclub,"die sokkersportklub se jaarlikse kamp in volle swaai hierdie week, so baie goed, soos die toekomstige student 'n kans om kontak te maak met ons huidige hoërskoolleerlingsleierskap, bly sterk _sportsclub"
1153,i m in the mood for any psychotic supporter this evening i m on my own dropping on my and you re insulting me in my comment section i won t let today s own slide god forbid bat thing i won t,ek is in die bui vir enige psigotiese ondersteuner vanaand. ek is op my eie om my te laat val en u beledig my in my kommentaarafdeling.
1154,underdog story in all of sports worst team ever to be a dynasty,underdog story in al die sport se slegste span om 'n dinastie te wees
1155,you haven t in the league or do what i do so you can t critique my performance is a really poor take and always will be some of the best talent and never pro sports,"u het nie in die liga of doen wat ek doen nie, sodat u nie my prestasie kan kritiseer nie, is 'n baie swak rol en sal altyd van die beste talent wees en nooit pro -sportsoorte wees nie"
1156,is nfl is highest here are position by salary,is nfl is die hoogste hier is posisie volgens salaris
1157,new york unveil legacy for the season,new york onthul nalatenskap vir die seisoen
1158,its mike in the walk with sports gear summer,dit is mike in the walk with sports gear summer
1159,to coach on his selection as _sports lacrosse coach of the year independence high school,om af te rig op sy keuring as _sports lacrosse coach of the year independence high school
1160,_sports yeah that lady is speaking in support of he must not have even watched the video just found a clip of a white woman talking and ran with it,_sports ja dat dame praat ter ondersteuning van hy moes nie eens gekyk het dat die video net 'n snit van 'n wit vrou gevind het wat praat nie en daarmee gehardloop het
1161,i never understood why people get so mad at madden,ek het nooit verstaan ​​hoekom mense so kwaad word vir madden nie
1162,thank you so much for this legit my favorite sports movie,baie dankie vir hierdie wettige my gunsteling sportfilm
1163,golden redemption at,goue verlossing by
1164,love this for her,hou hiervan vir haar
1165,oh man rising you say i wish could learn a bit more about him and  is recruitment i fam,"o man styg, jy sê ek wil 'n bietjie meer oor hom leer en is werwing ek fam"
1166,segment airport,segment lughawe
