,src,trg
0,the farewell yellow brick road tour in and it t have been a more perfect start with the ben,riendzo ra gondzo ra xitina xo tshwuka ro famba endzeni naswona ri ve masungulo lama hetisekeke swinene hi ben .
1,what a welcome to with two amazing here s some farewell yellow brick road tour from opening night,what a welcome to with two amazing here s some farewell yellow brick road tour ku suka eka vusiku byo pfula
2,a week of the farewell yellow brick road tour in five fantastic in and ben,vhiki ra riendzo ra le gondzweni ro tshwuka ra ku wisa eka five fantastic in na ben .
3,if i have blocked you it is only because we as targeted must protect our and what we allow ourselves to take in are secretly trying to mind control us with certain post if you rattle on about negative or ignorance then we must bid you farewell,loko ndzi ku blocked it is only because we as targeted hi fanele ku sirhelela our na leswi hi pfumelelaka ku swi nghenisa hi le xihundleni hi ringeta ku mind control hi certain post if you rattle on about negative or ignorance then hi fanele hi mi bida farewell .
4,the farewell yellow brick road tour is in all this week as giving us the most amazing here s some from rod laver arena,riendzo ra farewell yellow brick road ri le ka hinkwaswo leswi vhiki tani hi leswi ri hi nyikaka leswi hlamarisaka ngopfu laha s van’wana va le rod laver arena .
5,wrapping up the final farewell yellow brick road show of in ben,ku phutsela nkombiso wo hetelela wo wisa wa gondzo ra switina ro tshwuka ra in ben .
6,during his latest farewell yellow brick road tour show in spoke about the raging across as he he was one million to the relief fund,hi nkarhi wa yena wa sweswinyana wo wisa wa yellow brick road tour show in u vulavule hi ku tsemakanya loku nga hundza loko a ri na miliyoni yin’we eka nkwama wa mphalalo .
7,that golden win with a sensational start to the farewell yellow brick road tour ben,ku hlula koloko ka nsuku hi ku sungula loku hlamarisaka eka riendzo ro wisa ro tshwuka ra xitina xa le gondzweni ben .
8,hopelessly devoted to you newton paying a visit to the farewell yellow brick road tour in ben,hi ndlela yo pfumala ntshembo u tinyiketerile eka wena newton a ri karhi a endzela riendzo ra le gondzweni ra xitina xo tshwuka ro wisa eben .
9,back in with the first of seven final farewell yellow brick road tour ben,ku tlhelela endzeni na ro sungula eka nkombo wo hetelela wo wisa wo tshwuka wa xitina xa le gondzweni ra gondzo ra ben .
10,back on stage and back in here s some farewell yellow brick road tour from this amazing adventure,ku tlhelela exitejini na ku tlhelela endzeni s some farewell yellow brick road tour ku suka eka riendzo leri ro hlamarisa
11,farewell,lelana
12,from the penultimate farewell yellow brick road tour but before there s one last show in on th march ben,ku suka eka riendzo ra le penultimate farewell yellow brick road kambe emahlweni ka ku va na nkombiso wun’we wo hetelela eka on th march ben .
13,farewell and thank you you made the last few an unforgettable chapter of the farewell tour ben,farewell and thank you u endle ndzima yo hetelela yo hetelela ya farewell tour ben .
14,the farewell sermon of the prophet today the faithless have of ur religion so do not fear them but fear me today i have perfected your religion for u and i have my blessing upon u and i have as your religion surah al ma'idah,the farewell sermon of the prophet today the faithless have of ur religion so mi nga va chavi kambe mi chava namuntlha ndzi hetisekile vukhongeri bya n'wina hi mina naswona ndzi na nkateko wa mina eka u naswona ndzi na wona tani hi vukhongeri bya n'wina surah al ma'idah .
15,the pure of through the path of _khum and it been in the middle of the farewell we were for good every choice its own,the pure of through the path of _khum naswona a swi ri exikarhi ka ku wisa hi ve hi ri lavanene eka nhlawulo wun’wana ni wun’wana wa wona.
16,unverified farewell forger we wish you a safe journey do not hesitate to come back,unverified farewell forger hi mi navelela riendzo leri hlayisekeke mi nga kanakani ku vuya
17,farewell my friend,farewell munghana wa mina .
18,no one and i mean no one is ready for the farewell and i will make when new like i m not even ready myself,akuna munhu and ni vula ku hava munhu loyi a lunghekeleke ku wisa and ni ta endla loko new like i m no even ready myself .
19,do not remind me about how i dramatically my farewell message a few days ago i just to be as part of the squad since i barely had any together with them during the last series anyway how is been treating you so far,u nga ndzi tsundzuxi hi ndlela leyi ndzi drarewell rungula ra mina hi ndlela yo hlamarisa masiku ma nga ri mangani lama hundzeke ndzi fanele ku va tanihi xiphemu xa xipano tanihi leswi ndzi nga riki na nchumu swin’we na vona hi nkarhi wa nongonoko wo hetelela hambi swi ri tano how is been treating you so far .
20,there was a classy farewell board at by he airport for,a ku ri na classy farewell board at hi he airport for .
21,farewell,lelana
22,how will you say farewell to your and on employment exit through retirement leadership development center retirement,xana u ta vula njhani ku wisa eka ku huma ka wena na le ka ntirho hi ku tirhisa senthara ya nhluvukiso wa vurhangeri bya mudende .
23,a final farewell to little none of us can begin to understand the pain her beloved mummy will be going through with the loss of her daughter by a missile another heinous war crime by russia god bless you dear god bless,ku wisa ko hetelela eka switsongo a nga kona eka hina loyi a nga sungulaka ku twisisa ku vava mummy loyi a n’wi rhandzeke u ta hundza hi ku lahlekeriwa hi n’wana wa yena wa nhwanyana hi xihaha-mpfhuka xa nyimpi xa nyimpi xa nyimpi lexi nyenyetsaka hi rhaxiya xikwembu a xi katekiseni xikwembu xi katekise
24,i the ending with everybody being well together was not henry s redemption it was so nice their little family was too it s definitely one of my now definitely t expect it to be that great farewell,i the ending with everybody being well together was not henry s redemption it was so nice ndyangu wa vona lowuntsongo a wu ri too it s definitely one of my now definitely t expect it to be that great farewell .
25,nope he is the only president without an affiliation then us about the democratic republican party and the federalist party read about his on political farewell address,nope hi yena ntsena muungameri loyi a nga riki na vuxaka hi nkarhi wolowo us mayelana na democratic republican party na federalist party va hlaya hi ta yena eka mbulavulo wa ku wisa ka tipolitiki .
26,funeral at sombre farewell for,xilahlo xa le sombre farewell xa .
27,the last us of john is farewell tour go off with and,hina wo hetelela wa john is farewell tour go off with and .
28,saying farewell to a track and field legend is officially retired,ku xeweta ka track and field legend swi le ku wiseni ximfumo .
29,as of today we bid farewell to thank you for making naos' contents worth the watch we hope to work with you again in the future fly high,ku sukela namuntlha hi wisa ku khensa ku endla leswaku leswi nga endzeni ka naos swi fanela ku langutiwa hi tshemba leswaku hi ta tirha na n’wina nakambe enkarhini lowu taka fly high .
30,so long farewell normal spell shuffle from your hand into your deck shuffle card on the field into the deck this effect cannot be and effects cannot be in response to this card is activation,so long farewell normal spell shuffle kusuka eka voko ra wena kuya eka deck shuffle card ya wena enhoveni kuya eka deck effect leyi ayi nge vi kona naswona effects ayi nge vi eka nhlamulo ya khadi leri is activation .
31,farewell ceremony,nkhuvo wo wisa .
32,another from we were a farewell party from local private school,yin’wana ku suka eka we a ku ri nkhuvo wo wisa ku suka eka xikolo xa le makaya xa le ndhawini ya ka n’wina .
33,farewell ceremony,nkhuvo wo wisa .
34,the government an emergency meeting on to discuss for the heat but prime minister who is stepping down reportedly did not attend instead to hold a farewell party no hell hot enough,mfumo an emergency meeting on to discuss for the heat but prime minister loyi a nga tshika ntirho ku vikiwa leswaku a nga va kona ematshan’wini ya sweswo ku khoma nkhuvo wo wisa ku nga ri na tihele leti hisaka ku ringana
35,farewell smiler hello,farewell smiler hello .
36,farewell it is been an absolute delight as always until next time,farewell swi ve ntsako lowu heleleke tanihi minkarhi hinkwayo ku fikela nkarhi lowu taka .
37,so until then i wish you well i love you my farewell my dear,so ku fikela kwalano ndzi ku navelela kahle ndzi ku rhanda my farewell my dear .
38,only a few more days left untill farewell we will miss you,ku sale masiku ma nga ri mangani ntsena ku fikela loko hi wisa hi ta ku tsundzuka .
39,farewell of manila,ku wisa ka manila .
40,i m just waiting for the day when comes back to for his farewell tour,i m just waiting for the day loko a vuya a ya eka riendzo ra yena ro wisa .
41,_heat farewell friend,_heat munghana wo wisa .
42,yet nothing on the which does not surprise me can we have a general election now,yet nothing on the which a swi ndzi hlamarisi hi nga va na general election now .
43,farewell my future,farewell vumundzuku bya mina .
44,farewell,lelana
45,let your farewell from this institute open for you may you achieve success forever,a ku tshamisekile ka wena eka institute leyi yi pfulekile hikuva u nga ha humelela hilaha ku nga heriki .
46,_bhkt _me if i may hence a premarital of is must what are the i expect of the boy to take the lead respect privacy the life style of their married son it s good to be together with give them a respectable farewell,.
47,but we have the devil to glorify suicide many rick with his stunt of a farewell message,kambe hi na diyavulosi wo dzunisa ku tidlaya vo tala rick hi stunt xa yena xa ku wisa rungula .
48,thank you and farewell for now,ndza khensa na ku wisa sweswi .
49,recently we bid farewell to our creative facilitator as she on exciting new with her visual art practice we will miss her and wish her all the best you can check out nabilah is upcoming and work here,sweswinyana hi wisa ku wisa eka mufambisi wa hina wa vutumbuluxi tani hi leswi a nga eka new exciting new hi maendlelo ya yena ya vutshila byo vona hi ta n’wi tsundzuka naswona hi n’wi navelela hinkwaswo leswinene leswi u nga swi langutaka nabilah is upcoming and work here .
50,mac a priest son of st might be of race of so related to st  ist bidding farewell to the white horse' by,mac muprista n'wana wa st a nga va wa rixaka ra so related to so st ist bidding farewell to the white horse' hi .
51,have mercy upon me o lord for i am weak,vana na tintswalo ehenhla ka mina wena hosi hikuva ndzi tsanile .
52,all right i wish i could have fought beside you in the army you at least now your fight is over farewell,all right ni navela onge ni nga va ni lwile etlhelo ka nwina eka army you at least sweswi nyimpi ya nwina yi le henhla ka farewell .
53,_kdester _ farewell to you,_kdester _ ku wisa eka wena .
54,_official certainly the bullet had been at very close quarters i can remember that last night when he bade farewell to my mother,.
55,would it be our final farewell or would it be a sweet memory that we over when we were again,xana a ku ta va ku wisa ka hina ko hetelela kumbe a ku ta va ku ri xitsundzuxo xo nandziha lexi hi xi heleketaka loko hi ri nakambe .
56,i cannot withstand this nonsense they i bid you farewell,a ndzi nge swi koti ku tiyisela vuhunguki lebyi vona ndzi mi bidhala
57,so sick tired of being alone so long farewell i am on my own,so sick tired of ku va ndzexe so long farewell ndzi ri ndzexe .
58,_ farewell group hug,_ ku hug ka ntlawa wo famba .
59,farewell my till we meet again in,farewell my till hi hlangana nakambe hi .
60,here is an argument the shogun assassination arc farewell arc and arc are the one of the best in and these are back to back,hi lowu njhekanjhekisano lowu shogun assassination arc farewell arc na arc hi wona wu nga wa kahle swinene eka wona naswona leswi swi tlhelela endzhaku hi le ndzhaku .
61,bid you farewell gulping them swallow the we both leap into the sea our nude we feel so free i get the feeling i m truly living,bid you farewell gulping them swallow the both leap into the sea nude ya hina hi titwa hi ntshunxekile swinene ndzi kuma feeling i m truly living .
62,so i have bid farewell to my precious and flip it into are please treat him well he is my new baby,so ni bid farewell to my precious and flip it into are please ku n'wi khoma kahle hi yena n'wana wa mina lontshwa .
63,a ha ha farewell to those days when i wept my out,a ha ha farewell eka masiku wolawo loko ndzi rila my out .
64,a heartfelt farewell to galaxy amid ongoing speculation linking him with a move to full story,ku wisa loku humaka embilwini eka galaxy exikarhi ka ku vulavula loku yaka emahlweni loku n’wi hlanganisaka ni ku rhurhela eka xitori lexi heleleke .
65,we present song of farewell at,hi nyikela risimu ro wisa eka .
66,and have no place in the world at least not in yours it this is truly farewell,naswona a va na ndhawu emisaveni at least not in yours it leswi hakunene i ku wisa .
67,well farewell,ku wisa kahle .
68,farewell cam,cam yo wisa .
69,farewell doctor who fan o,farewell doctor who fan o .
70,the curriculum farewell it evil it is i and we _,kharikhulamu yi le ku hlongoleni ka yona vubihi i mina na hina _ .
71,farewell to professor on editorship in pandemic time,farewell to professor eka vuhleri ​​hi nkarhi wa ntungukulu .
72,farewell,lelana
73,th tomorrow and th farewell stream feel free to come by to say or wish me well in japan,th mundzuku na th farewell stream titwe u ntshunxekile ku ta hi ku ta ndzi vula kumbe ku ndzi navelela kahle ejapani
74,should have said earl of since he is probably the earl of it is late good night good night is such sweet sorrow that i shall say good night till it be morrow my are embark would farewell definitely not an actor,should have said earl of since kumbexana i earl ya yona i late good night good night is so sweet gome lero ndzi ta ku good night till it be morrow my are embark would farewell definitely not an actor .
75,farewell i am leaving by music by on keep the faith radio,farewell ndzi famba hi vuyimbeleri hi on keep the faith radio .
76,he could be right about to return and continue shooting his airplane he might use these days to properly bid his farewell after all when he will return no one would beat him up all the time make him be the ox the horse wash clothes fold serve tea carry water,a nga ha va a ri kusuhi no vuya a ya emahlweni a duvula xihahampfhuka xa yena a nga ha xi tirhisa masiku lawa ku n'wi wisa kahle endzhaku ka hinkwaswo loko a ta vuya a nga kona loyi a nga ta n'wi ba nkarhi hinkwawo a n'wi endla a va hosi ya ku hlamba swiambalo swa ku hlantswa swiambalo serve tea carry . mati
77,no one gave a farewell no shedded or lamentation,a ku na munhu loyi a nyikeleke hi ku wisa ku nga ri na ku rhurhumela kumbe ku rila .
78,oh dude in truth i m i could get to hear these live in fairness yeah the old band reunion thing is pretty commonplace i mean how long kiss been at that and i think they literally had over a dozen farewell at this point,oh dude in truth i m ndzi nga kuma ku twa leswi swi hanya hi fairness yeah nchumu wa khale wa band reunion i pretty commonplace i mean how long kiss been at that and i think they literally had over a dozen farewell at this point
79,with an unprecedented emotional gesture the staff of police station have bid farewell to their sho there was an outpouring of as they gave him a beautiful send off,hi xikombiso xa mintlhaveko lexi nga si tshamaka xi va kona vatirhi va xitichi xa maphorisa va xeweta sho ya vona a ku ri na ku chuluriwa ka swona loko va n’wi nyika ku rhumeriwa ko saseka .
80,they have and are following thanks so much for your help it is here in so i will say farewell for now time to sleep here is is doing well,va na and are following thanks so much for your help it is here in so ndzi ta ku farewell for now time to sleep laha is is doing well .
81,_ do you know title mila tha farewell se,_ xana wa swi tiva title mila tha farewell se .
82,dis at farewell shuttlecock a body of water wit nerver and flooding all music at p m flyer by rose brown,dis at farewell shuttlecock miri wa mati wit nerker na ku khukhula vuyimbeleri hinkwabyo eka p m flyer hi rose brown
83,i think this is farewell,ndzi ehleketa leswaku leswi i ku wisa .
84,server farewell is terrible is that girl who was wet in the rain,server farewell yi chavisa ngopfu hi leswaku nhwanyana yoloye loyi a a tsakama hi mpfula .
85,mamba valley cap farewell tour collection limited edition,mamba valley cap farewell tour collection nkandziyiso lowu nga nyawuriki .
86,we are by life itself we who simply like the idea of the word a little too much with no knowledge of a true farewell are by life itself,hi hi vutomi hi byoxe hina lava hi tsakelaka ntsena mianakanyo ya rito hi ku tlula nyana hi nga ri na vutivi bya ku wisa ka ntiyiso hi vutomi hi byoxe .
87,i am bidding my farewell and saying hello to my brightly signature and my excitement is at an all time high i am so excited for you to see the brand new content i have in store _ me incredibly excited,ndzi bidding my farewell and saying hello to my brightly signature and ntsako wa mina wu le ka all time high ndzi tsakile swinene eka wena ku vona brand new content leyi ndzi nga na yona in store _ me incredibly excited .
88,a farewell is like the other side of a coin it will only happen when there is an encounter rather than the day we have to part should not we be happy that we had the chance to meet today instead,ku wisa swi fana na tlhelo rin’wana ra mali ya nsimbi swi ta endleka ntsena loko ku ri na ku hlangana ku nga ri siku leri hi faneleke ku ri part should not we be happy that we had the chance to meet today instead .
89,the of violence is a long misunderstood curio about three of dandy who exude raw masculinity toward a dim witted chip against a backdrop of magic hour pink you will have to put up with the corny farewell scene,the of violence is a long misnunderstood curio about three of dandy lava va humesaka vununa lebyi nga swekiwangiki ku ya eka chip leyi nga vonakiki kahle leyi nga ni xivumbeko xa le ndzhaku xa awara ya masalamusi ya pinki u ta boheka ku tiyisela xivono xa ku wisa ka corny .
90,lots of were during the process took me around total to finish this additionally i want to thank for everythin' consider this an early farewell gift of,lots of were during the process taken me around total ku heta leswi ku engetela ndzi lava ku khensa everythin’ teka leswi i nyiko yo wisa ya le ku sunguleni ya .
91,a lovely work colleague is finishing up this week so i decided to go full on and wrote this farewell lunch invitation thanks for the inspiration,mutirhi kulorhi wo tsakisa u le ku hetiseni ka vhiki leri kutani ndzi endle xiboho xo ya ndzi tele naswona ndzi tsale xirhambo lexi xa swakudya swa ninhlikanhi swo wisa ndza khensa ku hlohloteriwa .
92,to paraphrase an old saying maybe ivana is farewell gift to was dying mysteriously is the best revenge,ku hlamusela xivuriso xa khale maybe ivana is farewell gift to was dying mysteriously is the best revenge .
93,of color color my butt as an i have never thought in color farewell identity politics people are so tired of you,of color color my butt as an a ndzi si tshama ndzi ehleketa hi color farewell identity tipolitiki vanhu va karhele ngopfu hi wena
94,farewell,lelana
95,it was a simple prayer from the start after all my admiration is gradually disappearing from here on out as the curtain s raising up we leave this quiet meeting place and bid farewell,a ku ri xikhongelo xo olova ku sukela eku sunguleni endzhaku ka loko ku hlamala ka mina hinkwako ku nyamalarile hakatsongo-tsongo ku suka laha ku ya ehandle loko kheteni ri ri karhi ri tlakuka hi suka endhawini leyi yo rhula ya nhlengeletano ivi hi wisa ku wisa .
96,ga s farewell evil spawn,ga s farewell yo biha ya spawn .
97,a farewell to my layout you were precious,a farewell to my layout a wu ri wa risima .
98,s farewell derby win as departure speculation,s farewell derby win tani hi ku ringanyeta ka ku suka .
99,farewell archaic lord,ku wisa hosi ya khale .
100,_english the horror his sister his farewell party get over yourselves people,_english the horror sesi wa yena party ya yena yo wisa get over youlf people
101,likewise farewell,hilaha ku fanaka ku wisa .
102,today is sunrise is the perfect farewell,namuntlha i ku huma ka dyambu i ku wisa loku hetisekeke .
103,i felt sad for both of them but i cried the scene in the graveyard young and barret and bidding farewell in elmyra is house,ndzi titwe ndzi ri na gome eka vona havambirhi kambe ndzi rile ndhawu leyi nga exigwitsirisini young and barret and bidding farewell in elmyra is house .
104,then i will bid you farewell a polite nod but the command on long cloak trailing against the ground as she,kutani ndzi ta ku xeweta ku pfumela hi nhloko hi ndlela ya xichavo kambe xileriso xa le long cloak lexi landzelaka ehansi loko a ri karhi a .
105,__maximoff you take care and have a good night he gave the hug back and her farewell,;
106,by the way i bet most of those if they are truly for a career could kick most of our they are in amazing physical condition and that ballet as well watch the farewell video and how fit those are,by the way i bet most of those if they are truly for a career could kick most of our va le ka xiyimo xo hlamarisa xa miri na ballet yaleyo xikan’we na ku farewell video na ndlela leyi va faneleke ha yona.
107,listen the best music now ariel farewell ariel farewell remember listen on,yingisela vuyimbeleri bya kahle swinene sweswi ariel farewell ariel farewell tsundzuka yingisa eka
108,'crazy rich asians' you can stay at the ultra luxe resort that and nick is farewell party,'crazy rich asians' u nga tshama eka ultra luxe resort leyi na nick is farewell party .
109,to you still beautiful even after death i say my farewell,eka wena wa ha sasekile hambi endzhaku ka rifu ndzi ri farewell ya mina .
110,today was rough got to say my final farewell to my i miss her so much,namuntlha was rough got to say my final farewell eka ya mina ndzi n'wi tsundzuka ngopfu .
111,that it farewell to the harbor to my old,leswaku swi le ku xeweteni ka ribuwa ra lwandle ku ya eka swa mina swa khale .
112,wa i am sorry for i have to save you from cringe please forgive me there was too much cringe until we meet again farewell,wa ndzi rivaleli ndzi fanele ndzi mi ponisa eka cringe ndzi kombela mi ndzi rivalela ku ri na cringe yo tala ngopfu ku kondza hi hlangana nakambe ku wisa
113,there is no sadness only the confession of love there is no farewell only the confession of love,akuna gome ntsena ku tiphofula ka rirhandzu akuna ku wisa ntsena ku tiphofula ka rirhandzu .
114,farewell would be funny,farewell a swi ta va swi hlekisa .
115,i just to see in las for his final farewell,mina ntsena ku vona e las eka ku wisa ka yena ko hetelela .
116,i set out in the still night across the dark heath no one bade me farewell farewell my were love and sorrow,ndzi suke hi vusiku lebyi nga tsekatsekiki ndzi tsemakanya the dark heath a ku na munhu loyi a ndzi leriseke ku wisa ku wisa ka mina a ku ri rirhandzu ni gome .
117,farewell to it s been a short but fun trip thanks again to for me out,farewell to it it been a short but trip thanks again to for me out .
118,i am excited about the farewell yellow brick road the final tour allegiant stadium las tue who is in,ndzi tsakile hi farewell yellow brick road riendzo ro hetelela allegiant stadium las tue loyi a nga eka .
119,every once in a while it like one of my old brain and as it is dying it up some bizarre audio tidbit it is been holding on to for like the song for in i it for you did i do good koff koff gasp farewell,every once in a while it like one of my old brain and tani hi leswi a yi ri karhi yi yi fa up some bizarre audio tidbit yi ve yi khomela eka yona for like the song for in i it for you did i do good koff koff gasp farewell
120,de y dawn el con en el summer swag concert farewell to and dawn plus hug with at summer swag concert,de y dawn el con en el summer swag concert farewell to and dawn plus hug na at summer swag concert
121,family community to say final farewell to frank young,vaaki va ndyangu ku vula ku wisa ko hetelela eka frank young .
122,in downtown me _reign_ finished in the studio with s dog and champagne we not done farewell,eka downtown ya mina _reign_ u hetile e studio na s dog na champagne a hi endlanga farewell .
123,farewell o lovely bard and farewell o lovely dragon would that we had met in a different time and place to meet to song and dance together,farewell o lovely bard na farewell o lovely dragon a swi ta va hi hlanganile hi nkarhi na ndhawu yo hambana ku hlangana na song na ku cina swin'we
124,sir farewell to you as the vice president of we will remember you for your great towards our nation,sir farewell to you tani hi xandla xa phuresidente wa hi ta mi tsundzuka eka n'wina lavakulu eka rixaka ra hina .
125,i was always looking forward to twitter farewell is lonely i am a fan wherever i go,ndzi tshama ndzi ri karhi ndzi langutela ku wisa ka twitter is lonely i am a fan kun’wana na kun’wana laha ndzi yaka kona .
126,unlike the people at did attempt to cover johnson is they also the fact that he yet another cobra meeting,ku hambana na vanhu va le ka did attempt to cover johnson is na vona mhaka ya leswaku yena u ta va cobra meeting yin’wana .
127,praying for your happiness health well being prosperity in time to come farewell my love,ku khongelela ntsako wa wena rihanyo well being prosperity in time to come farewell my love .
