,src,trg
523,just got off the plane in and it s like waking into a warm furnace of a welcome back hug a little bit different from where it was a warm breeze of a farewell my heart is torn between the two as always i m lucky to have so many people i call home,just chiking off the plane in and it s like waking into a warm furnace of a welcome back hug swi hambanile nyana na laha a ku ri moya wo kufumela wa ku wisa mbilu ya mina yi handzuka exikarhi ka lavambirhi tani hi minkarhi hinkwayo i m lucky ku va na vanhu vo tala swinene . ndzi vitana kaya .
524,i am beginning to think they this absurd meeting so they could have yet another dig at as he was holding his farewell party at and obviously would not or even need to attend this silly meeting,ndzi sungula ku ehleketa leswaku vona nhlengeletano leyi yo ka yi nga twisiseki leswaku va ta va na ku ceriwa kun’wana eka swona tani hi leswi a a khome nkhuvo wa yena wo wisa eka wona naswona swi le rivaleni leswaku a va nga ta lava kumbe hambi ku ri ku ya eka nhlengeletano leyi ya vuphukuphuku .
525,getting covid right as i m about to start my farewell tour honestly,ku kuma covid kahle loko ndzi ri kusuhi no sungula riendzo ra mina ro wisa hi ku tshembeka .
526,in farewell to who on following a rocket strike in the city center people three were of the bombardment people for help of them were four,hi ku wisa eka who eka ku landzelela xitereka xa rocket exikarhi ka doroba vanhu vanharhu a va ri va tibomo ta vanhu leswaku va pfuniwa hi vona a ku ri mune .
527,i just to see in las for his final farewell,mina ntsena ku vona e las eka ku wisa ka yena ko hetelela .
528,the b s we never set out to change people is but it that way,the b s a hi si tshama hi veka ku cinca vanhu hi yona kambe yona hi ndlela yaleyo .
529,_resist you are so very lost and it to see i m not going to argue with you about this any further peace be with you and farewell,.
530,oh leaving someone without farewell is so tragic always made me think that maybe other too must have taken the meeting as mere coincidence it sis especially the emotional aspect,oh ku siya munhu a nga ri ku xeweteni i khombo swinene minkarhi hinkwayo swi ndzi endle ndzi ehleketa leswaku kumbexana van’wana na vona va fanele va teke nhlengeletano tanihi ku hlangana ntsena it sis ngopfu-ngopfu xiphemu xa mintlhaveko .
531,until next time farewell,ku fikela nkarhi lowu taka wo wisa .
532,farewell,lelana
533,already posted about this on my alt twitter but i post it here i beat farewell on _game real time was i quit after getting halfway to go do other all i have left is to collect all the and beat the c side,se se ndzi postile hi mhaka leyi eka alt twitter ya mina kambe ndzi yi veka laha ndzi beat farewell on _game real time was i quit after getting halfway to go do other all i have left is to collect all the the and beat the c side
534,going in tower of song by so i bid you farewell i do not know when i will be back going out as i am a doctor who fan i want the sound of the for a laugh by the doctor who theme,going in tower of song by so i bid you farewell a ndzi tivi leswaku ndzi ta vuya rini ndzi huma tani hi leswi ndzi nga muyingiseri wa dokodela loyi ndzi lavaka mpfumawulo wa for a laugh by the doctor who theme
535, is farewell party,is party yo wisa .
536,farewell darling the tig,ku wisa ku rhandzela tig .
537,i just to see in las for his final farewell,mina ntsena ku vona e las eka ku wisa ka yena ko hetelela .
538,yes and president us in his farewell address we must guard against the acquisition of unwarranted influence whether sought or unsought by the military industrial complex the potential for the disastrous rise of power and will persist,ina na phuresidente us eka mbulavulo wa yena wo wisa hi fanele ku tivonela eka ku kuma nkucetelo lowu nga fanelangiki hambi wu laviwa kumbe wu nga laviwi hi ndhawu ya tiindasitiri ya masocha vuswikoti bya ku tlakuka ka matimba loku nga ni khombo naswona ku ta phikelela .
539,the b s we never set out to change people is but it that way feed,the b s a hi si tshama hi veka ku cinca vanhu hi yona kambe yona hi ndlela yaleyo feed .
540,yep so few people have seen that speech still my mind that with everything on his plate that was the topic of his farewell address it,yep so few people have seen that speech still my mind that with everything on his plate that was the topic of his farewell address it .
541,_guzman in what might be his last the difference with his goal would be a good way for the star to say farewell to red faithful,_guzman eka leswi swi nga ha vaka ku hambana ka yena ko hetelela hi pakani ya yena ku ta va ndlela leyinene eka nyeleti ku xeweta eka red faithful .
542,attack on had more final than kiss had farewell,attack on had more final than kiss a a ri eku wiseni .
543,thank you all for the farewell day stream i appreciate all of you so much and i can t to see you again soon thank you me to k twitch and i am immensely thankful clip happy early to you check,ndza khensa hinkwenu eka day stream ya farewell ndzi mi tlangela hinkwenu ka n'wina swinene and i can t to see you again soon thank you me to k twitch and i am immensely thankful clip happy early to you check
544,waiting on my new my old one me farewell wherever you are,ku rindza ka mina new my old one me farewell kun’wana na kun’wana laha u nga kona .
545,for once your babe enter bike wey you tell her farewell she is no longer only your but our,for once babe ya wena yi nghena bike wey u n'wi byela ku farewell leswaku a nga ha ri only ya wena but ya hina .
546,this is a farewell to you too,lexi i xirhalanganyi eka wena na wena .
547,farewell king she quickly left the room and making her way out of the castle,farewell king u hatle a huma ekamareni a endla ndlela yo huma exigodlhweni .
548,farewell my j,farewell ya mina j .
549,last chance to visit with these four best before they all get adopted evening we wish we could keep all four together but and nova will be going as to some very lucky hop on by to bid the farewell,last chance yo endzela na lava va mune best loko hinkwavo va nga si kuma ku amukeriwa madyambu hi navela onge hi nga hlayisa hinkwaswo swa mune swin’we kambe na nova yi ta ya emahlweni tanihi yin’wana ya nkateko swinene hop on hi ku bid the farewell .
550,for now let me stay and though s breath caught heart stuttering from one beat to the next he let him it was a quiet wordless farewell but that was all they had ever had and so it should not have him that it was how they would part,hikuva sweswi ndzi pfumeleleni ndzi tshama naswona hambi s ku hefemula ku khome mbilu ku rhurhumela ku suka eka ku ba kun’we ku ya eka loku landzelaka u n’wi tshikile a ku ri ku wisa loku rhuleke loku nga riki na marito kambe sweswo hi swona ntsena leswi va tshameke va va na swona naswona hikwalaho a swi fanelanga swi va na yena leswaku a ku ri ndlela leyi va nga ta hambana ha yona .
551,i am not be and this week due to extreme in the hope understand and i wish you farewell for now,i am not be and this week due to extreme in the hope understand and ndzi mi navelela farewell for now .
552,who is ready for some we tried local soda homemade and even something a duck to follow here we are saying our farewell to until next time anyway,i mani loyi a lunghekeleke van’wana hi ringetile soda ya laha kaya leyi endliweke ekaya hambi ku ri nchumu lowu nga ni nkuku lowu hi faneleke hi wu landzela laha hi nga ku le ku xeweteni ka hina ku fikela nkarhi lowu taka hambi swi ri tano
553,a last farewell to in,ku wisa ko hetelela eka in .
554,i just to see in las for his final farewell,mina ntsena ku vona e las eka ku wisa ka yena ko hetelela .
555,farewell to one purveyor of egregiously and,ku wisa eka muphakeri un’we wa ku nyenyetsa na .
556,this is not my life it is just a farewell to a friend,leswi a hi vutomi bya mina i ku wisa ntsena eka munghana .
557,i m the only one who is in pain around farewell,i m loyi ntsena a nga le ku vavisekeni around farewell .
558,i see farewell then,ndzi vona farewell then .
559,i see what you mean but personally i think it put to the test could he put his love for aside in order to be rational chloe is love for also gave more sympathy and her farewell to him in the book was much better she well and,ndzi vona leswi u swi vulaka kambe hi ndzexe ndzi ehleketa leswaku swi vekiwile eka ndzingo xana a nga veka rirhandzu ra yena etlhelo leswaku a ta va rational chloe i rirhandzu ra ku tlhela a nyika ntwela vusiwana wo tala naswona ku wisa ka yena eka yena ebukwini a ku antswa swinene she well and .
560,your husband the occasional headache i said that is farewell it evil it _,nuna wa wena ku pandza ka nhloko nkarhi na nkarhi ndzi te sweswo i ku xeweta it evil it _
561,the b s we never set out to change people is but it that way,the b s a hi si tshama hi veka ku cinca vanhu hi yona kambe yona hi ndlela yaleyo .
562,and you will not fight me when i say farewell,naswona a wu nge ndzi lwi loko ndzi ku farewell .
563,well then it s time for me to set sail so i shall bid you adieu play nice everyone make sure to brush your teeth after you eat promise your pinky promise farewell my sorry for the,well then it s time for me to set sail so ndzi ta ku bid adieu play nice un'wana na un'wana tiyisisa leswaku u hlamba meno endzhaku ka loko u dyile promise your pinky promise farewell my sorry for the .
564,farewell,lelana
565,farewell little green men we hardly knew ye,farewell vavanuna lavatsongo va rihlaza a hi nga swi tivi nikatsongo n'wina
566,__london we will be running out of old stock to say farewell to soon,__london hi ta heleriwa hi xitoko xa khale ku ya wisa ku nga ri khale
567,i just to see in las for his final farewell,mina ntsena ku vona e las eka ku wisa ka yena ko hetelela .
568,on in this farewell address president against the establishment of a military industrial complex war is a racket a speech and a short book by d butler major general and two time medal of honor recipient,on in this farewell address president ku lwisana na ku simekiwa ka nyimpi ya masocha ya tifemeni i racket nkulumo na buku yo koma ya d butler major general na two time medal of honor recipient .
569,who the show what did a top general warn of in his farewell speech the military industrial complex public record and coming to light now on how deep it goes with military add thread,who the show what did a top general warn of eka mbulavulo wa yena wo wisa the military industrial complex rhekhodo ya mani na mani na ku huma erivaleni sweswi hi ndlela leyi yi dzikaka ha yona hi masocha add thread
570,farewell hello evil,ku xeweta hello evil .
571,have you seen the farewell,xana u vone ku wisa .
572,excellent he extending his arm for her to take as thane bid them farewell once the other male was out of sight cyrus let out a sigh why he on walking around looking so unseemly i never understand you really have to question how noble his house is,excellent he extend his arm for his to take as thane bid them farewell once the other male were out of sight cyrus let out a sigh why he on ku famba-famba a languta hi ndlela yo ka yi nga ri ya nkoka a ndzi swi twisisi hakunene leswaku u fanele ku kanakana leswaku yindlu ya yena yi le henhla ku fikela kwihi .
573,farewell it was an absolute blast another successful summit in the,ku wisa a ku ri ku buluka loku heleleke eka nhlengeletano yin’wana leyi humelelaka eka .
574,performer holly valance and husband nick candy are set to farewell their,performer holly valance na nuna nick candy va vekiwile ku wisa vona .
575,farewell and see you then on the next bull run,farewell u ku vona then eka bull run leyi landzelaka .
576,until now how many times i have tried to tell you please take care of yourself then with tear i sadly said good bye as i waved and wished you farewell,ku fikela sweswi i kangani ndzi ringeta ku mi byela ndzi kombela mi ti hlayisa then with tear i sadly said good bye loko ni ri karhi ni rhurhumela ni ku mi navelela farewell .
577,farewell my friend i will miss you,farewell munghana wa mina ndzi ta ku tsundzuka .
578,really don t want to have to put a willy farewell post,hakunene a swi lavi ku boheka ku veka willy farewell post .
579,arar port farewell to the third batch of with,arar port farewell eka ntlawa wa vunharhu wa y
580,it was a farewell party as for cobra meeting what a joke a day plus he does not have to attend he can be,a ku ri nkhuvo wo wisa loko ku ri cobra leyi hlanganaka na xihlekiso hi siku plus a nga boheki ku va kona a nga va a nga va .
581,to musk thank you to farewell and to all the,ku musk ndzi khensa ku wisa na le ka hinkwaswo .
582,smith another dispatcher gave her farewell,smith murhumeri un’wana u n’wi nyike ku wisa .
583,th chapter she successfully to the top of the mountain this is not the last time she will face as you see later in the game with farewell but she is made considerable progress and that alone is good enough for her,th chapter she processing to the top of the mountain lowu a hi wona wo hetelela a ta langutana tani hi leswi mi swi vonaka endzhaku eka ntlangu hi ku wisa kambe u endliwa nhluvuko lowukulu naswona sweswo ntsena i swinene ku ringana eka yena .
584,the matrix trilogy all of them is slicker but are and reward reflection stranger than fiction fantastic fox day the straight story pilgrim the world than it the farewell,matrix trilogy hinkwavo ka vona i slicker kambe va tlhela va hakela reflection stranger than fiction fantastic fox day the straight story pilgrim the world than it the farewell .
585,because if you believe in that mandate then there s no further i can discuss with you while taking you serious if the reason for that is not self explanatory for you then farewell,hikuva loko u pfumela eka xileriso xexo then there s no further i can discuss with you while taking you serious loko xivangelo xa sweswo xi nga ri self explanatory eka wena then farewell .
586,old when my become worn and falling apart i take them on a final farewell vacation then i ditch them in the hotel garbage can so i don t have to pack them to go home it s sad when come to an end,old loko ya mina yi sungula ku onhaka yi tlhela yi va yi ri karhi yi va teka eka final farewell vacation then ni va ditch eka hotel garbage can so i don t have to pack them to go home it s sad when come to an end an end .
587,yes indeed farewell of is my favorite song,yes indeed farewell of i risimu leri ndzi ri tsakelaka swinene .
588,chapel by the sea farewell luncheon included ice cream for the rev pelt in,chapel by the sea farewell luncheon yi katsa ice cream ya rev pelt hi
589,i said farewell to all of my and they all were hugging me and saying i was their favorite,ni te farewell to all of my and hinkwavo a va ni angarhile va ku i was their favourite .
590,this is pure logic and as factual as it and exactly president us for in his farewell speech,leyi i logic yo basa naswona yi nga ntiyiso ku fana na yona naswona kahle-kahle yi hi va president for eka mbulavulo wa yena wo wisa .
591,when she to leave i will go to her in person and have a farewell party,loko a famba ndzi ta ya eka yena hi xiviri ndzi ya endla nkhuvo wo wisa .
592,never saw him though farewell to him,a nga si tshama a n'wi vona hambileswi a n'wi xeweta .
593,farewell sheep,tinyimpfu to wisa .
594,his farewell tour before being,riendzo ra yena ro wisa a nga si va .
595,farewell my sweet lucky,farewell my sweet lucky .
596,do not miss the root beer for reproductive justice at farewell original and straight edge from spine that is it it is over and doldrums a root beer pony keg and all go to abortion fund,u nga hundziwi hi biya ya timitsu ya vululami bya ku veleka eka farewell original na straight edge kusuka eka nkolo leswaku yi herile naswona doldrums a root beer pony keg and all go to abortion fund
597,the farewell message from,rungula ro wisa ku suka eka .
598,you and farewell the phone game was farewell with darkness consuming me,wena na farewell ntlangu wa tifoyini a wu ri wo wisa na munyama lowu a wu ndzi dya .
599,sou eu de farewell dear please calm your from this day forth i am a wanderer once more,sou eu de farewell murhandziwa ndzi kombela u rhurisa wena ku sukela siku leri ndzi ya emahlweni ndzi famba-famba kan'we nakambe
600,there will be a proper farewell i also want to get for my the coaching staff and the,ku ta va na ku wisa loku faneleke loku ndzi tlhelaka ndzi lava ku ku kuma eka vatirhi va mina va vuleteri na .
601,i also said that i would come back to for a proper farewell after barcelona is trip to the which until,ndzi tlhele ndzi vula leswaku ndzi ta vuya eka ku wisa loku faneleke endzhaku ka loko barcelona yi ri riendzo ro ya eka leri ku fikela loko ri fikela loko ri fika .
602,on his farewell there was no time for a proper farewell everything had to happen very quickly and spontaneously i said 'guys thank you very much everything will be today ' we made history together i will never forget that,on his farewell a ku nga ri na nkarhi wa ku wisa loku faneleke hinkwaswo a swi fanele swi humelela hi ku hatlisa swinene naswona hi ku tisungulela ndzi te 'vafana va khensa swinene hinkwaswo swi ta va namuntlha ' hi endle matimu swin'we a ndzi nge pfuki ndzi rivarile sweswo .
603,fair and following skipper this week will bid farewell to our commander and director captain we appreciate your leadership and guidance for the past two join us in wishing him well,fair and following skipper vhiki leri yi ta wisa eka murhangeri wa hina na mukongomisi captain hi tlangela vurhangeri bya wena na nkongomiso eka lavambirhi lava hundzeke va hi joyina eka ku n’wi navelela kahle .
604,and schneider talk about how their hobby music together exploded into a career and how the death of almost ended the b s for good,na schneider va vulavula hi ndlela leyi vuyimbeleri bya vona byo tihungasa swin’we byi bulukeke ha yona eka ntirho wa ntirho na ndlela leyi rifu ra kwalomu ka ku hetelela ri heleke ha yona hi ndlela leyinene .
605,t quit the tour not the final bow is a review of the st of on his leg of the farewell tour,t quit the tour not the final bow is a review of the st of on his leg of the farewell tour .
606,why does this read like he decided to quit the whole farewell tour thing,why leswi swi hlayeka onge u endle xiboho xo tshika nchumu hinkwawo wa farewell tour .
607,here is where you can see the film and so farewell,laha hi laha u nga vonaka filimi na so farewell .
608,farewell to this boisterous world,ku wisa eka misava leyi ya huwa leyi nga ni huwa .
609,farewell tour,riendzo ro wisa .
610,the of this is making me more because of the ser companion viva la of revenge of the farewell ser not sure yet and for the romance p,the of this is making me more hikwalaho ka ser companion viva la ya ku rihisela ka serwell ser not sure yet and for the romance p .
611,my film and so farewell the jazz film festival this past week the audience was quite and stayed for the q a to talk about the film great interview by film journalist very happy amusing to see my poster with this particular,filimi ya mina na so farewell the jazz film festival vhiki leri nga hundza vahlaleri a va ri kahle swinene naswona va tshamile eka q a ku vulavula hi filimi ya great interview hi mutsari wa tifilimi a tsakile swinene a hlekisa ku vona phositara ya mina hi leswi swo hlawuleka .
612,_chimdi yeah farewell to fantasy land i hope u wake up one day and face reality,_chimdi yeah farewell to fantasy land i hope u pfuka siku rin'wana u langutana na ntiyiso
613,not everyone in this guy we need to find someone else and bid this guy farewell he does not rep his at all,a hi vanhu hinkwavo eka jaha leri hi fanele hi kuma munhu un'wana hi bid this guy farewell a nga rep his at all
614,we need bigger convention,hi lava ntsombano lowukulu .
615,my man was going on to relax but instead got to remember all of his relieve the downfall of his clan the passing of his father the farewell of his best friend and be exposed to people he met day ago,wanuna wa mina a a ya emahlweni a wisa kambe ematshan’wini ya sweswo u fike a tsundzuka hinkwaswo swa yena swi ntshunxa ku wa ka rixaka ra yena ku hundza ka tata wakwe ku wisa ka munghana wa yena lonkulu ni ku hlangana ni vanhu lava a hlanganeke na vona siku leri hundzeke .
616,off to the land of nod farewell my friend,off to the land of nod farewell munghana wa mina .
617,to see in las for his final farewell,ku vona e las eka ku wisa ka yena ko hetelela .
618,the ending of end of time doing a farewell tour of people he traveled with as a way of saying good bye ending with rose meeting him for what is the first seeing the woman he before she him or s phone call to in s first episode,mahetelelo ya ku hela ka nkarhi ku endla riendzo ro wisa ra vanhu lava a fambeke na vona tanihi ndlela yo vula good bye ku hetelela hi rose a hlangana na yena eka leswi nga sungula ku vona wansati loyi a nga si n'wi vitana kumbe s phone call to in s first episode
619,even if you to externally compose yourself the residue of fear in the pit of your stomach step on a and you ought to bid your farewell to your life his presence only abysmal fortune for you,hambi loko u fanele ku tivumbela ehandle masalela ya ku chava ekheleni ra khwiri ra wena step on a naswona u fanele ku wisa ku wisa ka wena eka vutomi bya wena vukona bya yena ntsena abysmal fortune eka wena .
620,we leave this quiet meeting place and bid farewell,hi suka eka ndhawu leyi yo rhula ya nhlengeletano ivi hi xeweta ku wisa .
621,siliqua the pod is cast traditional farewell at end of ancient audio recording,siliqua the pod is cast traditional farewell eku heleni ka ku rhekhoda ka khale ka audio .
622,for no matter the of hell death is never the final farewell,hikuva ku nga khathariseki leswaku i ya rifu a hi ku wisa ko hetelela .
623,oh i have got to give one last farewell,oh ndzi fanele ndzi nyika yin'we yo hetelela yo wisa .
624,bade farewell to my cock take good care my friend,bade farewell eka mbolo ya mina take kahle munghana wa mina
625,farewell to a life of time begun to implement,ku wisa eka vutomi bya nkarhi lebyi sunguleke ku tirhisa .
626,farewell my i will miss you days is days too long,farewell my i will miss you days is days too long
627,mad bull meet up,mad bull hlangana u hlangana .
628,sorry i know this t the farewell party you were for,sorry ndza swi tiva leswi t the farewell party a wu ri swona
629,farewell i am glad this was not the first i ever read,farewell ndza tsaka leswi a ku nga ri ro sungula ndzi hlaya .
630,for paying you a farewell to thank you it was an emotional sent off,hi ku ku hakela ku wisa ku ku khensa ku ve emotionalt off .
631,wine time now so may i wish all a farewell and stay safe in the neat take care well done for the shout if you got 'em and may the good god bless you all,wine time sweswi ndzi nga navela hinkwaswo ku wisa ni ku tshama ndzi hlayisekile eka neat ti hlayisa kahle swi endliwe kahle for the shout if you got 'em and onge xikwembu lexinene xi mi katekise hinkwenu
632,_chimdi you can not ascertain the number that will move but it is good we have come to a conclusion that will to so i bid you farewell at this point,.
633,i am you you are me i shall always watch over you from within farewell,mina ndzi wena wena ndzi mina ndzi ta tshama ndzi ri karhi ndzi ku hlayisa u ri endzeni ka xihlawulekisi .
634,o who hath done this deed nobody i myself farewell,o loyi a endleke xiendlo lexi a ku na munhu loyi mina hi ndzexe ndzi xewetaka .
635,i am torturing myself with junmyeon is farewell to realize one more time how lucky we are right now too much love,ndzi ti xanisa hi junmyeon is farewell to realize one more time ndlela leyi hi nga na lucky ha yona sweswi too much love .
636,oh hello and farewell i try to draw every day,oh hello and farewell ndzi ringeta ku dirowa siku na siku .
637,bidding farewell to tonight as i will be up extra early to get to the airport a piper was on the street this afternoon as we home thoroughly plucked,bidding farewell to tonight as i will be up extra early ku fika erivaleni ra swihahampfhuka muchayeri wa tiphayiphi a ri exitarateni madyambu lawa loko hi ri ekaya hi ri karhi hi tshovela hi ku helela .
638,g night it is that time again where i bid u farewell it is bedtime now hope you have all had a lovely day going to be very hot so please be careful as it set of my asthma this evening check on stay well hydrated g night god bless sleep,g night i nkarhi wolowo nakambe laha ndzi nga sala u wisa i nkarhi wo etlela sweswi ndzi tshemba leswaku hinkwenu mi vile na siku ro tsakisa leri nga ta hisa swinene so please be careful as it set of my asthma madyambu lawa check on stay well hydrated g night god bless etlela
639,seeing on her farewell season,ku vona eka nguva ya yena yo wisa .
640,dude you re just like my year old i wish i could get you in class and provide you a good public school education to help you understand the constitution and our world but that s not going to happen so i bid you farewell and peace,dude you re just like my year old ndzi navela onge ndzi nga ku kuma etlilasini ndzi ku nyika dyondzo ya kahle ya xikolo xa mfumo ku ku pfuna ku twisisa vumbiwa na misava ya hina kambe sweswo a swi nge endleki so i bid you farewell and peace
641,now the best rock pop dance farewell odd crew on,sweswi i rock pop dance ya kahle swinene yo wisa odd crew eka crew eka
642,to this no name life farewell to the correct answer if i follow this fuzzy abnormal feeling there d be no end to everyone s,to this no name life farewell to the correct answet loko ndzi landzelela fuzzy leyi abnormal feeling there d no end to everyone s
643,he was given a farewell party organized by private book was still by private effort in relation to this expensive watch was gifted truly and we know too well who,u nyikiwile nkhuvo wo wisa lowu a wu hleriwe hi private book a wa ha ri hi matshalatshala ya le xihundleni mayelana na wachi leyi yo durha a yi ri na nyiko hakunene naswona ha swi tiva kahle leswaku i mani .
