,src,trg
194,baba based on last night is debate it that is on making not account for his role as the sitting deputy president in this economy next week must not escape this through his thank you,baba hi ku ya hi vusiku bya tolo i debate leswaku i ku endla leswaku ku nga vi na ku tihlamulela eka xiave xa yena tanihi xandla xa muungameri loyi a tshameke eka ikhonomi leyi vhiki leri taka a nga fanelanga ku balekela leswi hi ku nkhensa ka yena .
195,the project is very difficult i sympathize with any candidate would still floor her the presidential debate will be,phurojeke ya tika swinene ndzi twela vusiwana muhlawuriwa wihi na wihi a a ta ha n'wi floor njhekanjhekisano wa vupresidente wu ta va .
196,can we get a debate for the culture you will be how much about that we dont,xana hi nga kuma debate ya ndhavuko u ta va ku fikela kwihi hi sweswo we dont .
197,no body should assume never the debate,ku hava miri lowu faneleke ku teka never the debate .
198,it was  nothe deputy presidential debate ' which she the point in that case to speak to the nation she would simply have the media to her office this was a debate,it was nothe deputy presidential debate ' which she the point in that case ku vulavula na rixaka a ta va ntsena na vuhangalasi bya mahungu ehofisini ya yena leswi a ku ri njhekanjhekisano .
199,and good governance for that matter he made the subject matter and on campaign they have been in to score in the debate he even carried a print out source of information known to himself the were quite lenient to him,na vulawuri lebyinene eka mhaka yoleyo u endle mhaka leyi naswona eka pfhumba leri va nga va eka rona ku kuma swikoweto eka njhekanjhekisano u tlhele a rhwala xihlovo xo kandziyisa xa rungula leri a ri tiviwa hi yena n’wini leri a ri n’wi olova swinene .
200,if was you on that debate dong send cancel the mission,loko a wu ri eka njhekanjhekisano wolowo dong send cancel mission .
201,_zhang they cant debate the schedule is tight they just say their speech and listen to the next,_zhang they cant debate xiyimiso xi tiyile va vula ntsena mbulavulo wa vona va yingisela lowu landzelaka
202,exactly he was full of vengeance spoke with a lot of hate the debate me to change my mind immediately i would not like to have such a vice president i would rather go for a sober mind,kahle kahle a a tele hi ku rihisela u vulavule hi rivengo ro tala njhekanjhekisano wa mina ku cinca miehleketo ya mina hi ku hatlisa a ndzi nge swi tsakeli ku va na xandla xa muungameri wo tano ndzi nga tsakela ku ya eka mianakanyo leyi hlutekeke .
203,a debate is not a political rally,njhekanjhekisano a hi nhlengeletano ya tipolitiki .
204,objective analysis prof you sit on the panel again during the presidential debate,nxopaxopo wa xikongomelo prof u tshama eka phanele nakambe hi nkarhi wa njhekanjhekisano wa vupresidente .
205,it t he just she was a ventriloquist dummy and gove was her like was s it s not debate it s just abuse,it t he just a ri ventriloquist dummy and gove a ku ri yena like was s it it s not debate it s just abuse .
206,some of y all acting like we don t have i was in debate club in middle school for a reason why can t we have respectful here as well,swin'wana swa y hinkwaswo swi endla onge a hi na swona ndzi ri eka debate club exikolweni xa le xikarhi hi xivangelo xa leswaku ha yini hi nga va na xichavo na laha na kona laha .
207,_fels its because he had a tip of all the that were going to be even before the debate that is why he came in with we are not stupid,.
208,after the do and debate we now demand a debate between and who are supposedly chief over to you,endzhaku ka do na debate sweswi hi lava njhekanjhekisano exikarhi na lava ku vuriwaka leswaku va chief over to you .
209,_lr _blak _david _muya _mwangi _humphrey and have no moral authority to lecture on state capture composed throughout the debate and stuck to,.
210,last night on all media the deputy presidential were subjected to an impressive national debate can you engage the parliamentary through a debate,vusiku bya tolo eka swihangalasamahungu hinkwaswo xandla xa phuresidente va ve ehansi ka njhekanjhekisano wa rixaka lowu hlamarisaka xana u nga nghenelela eka palamende hi ku tirhisa njhekanjhekisano .
211,join value in health economics policy group for a live debate on reform the debate on for please register here or view us on live streaming,joyina value in health economics policy group eka njhekanjhekisano lowu hanyaka eka mpfuxeto wa njhekanjhekisano eka for hi kombela u tsarisa laha kumbe u hi languta hi ku fambisa hi ku kongoma .
212,bund are an observation climate change is unfortunately a source of debate the headline can quickly turn into the underlying issue not sure the there is comparable,bund i xivono xa ku cinca ka maxelo khombo ra kona i xihlovo xa njhekanjhekisano nhlokomhaka yi nga hatla yi hundzuka mhaka leyi nga xisekelo yi nga tiyiseki leswaku there is comparable .
213,in a debate where the opponent was keen on provoking her and on she calm composed and articulate,eka njhekanjhekisano lowu mukaneti a a swi navela swinene eku n’wi hlundzukiseni ni le ka yena a rhulile a qaxiwile ni ku vulavula hi ku kongoma .
214,_alicenganga _kuria _waruguru yesterday debate converted all million to raise vote against project,_alicenganga _kuria _warururu tolo debate yi hundzule miliyoni hinkwayo ku tlakusa vhoti yo lwisana na phurojeke
215,according to lost because she to be emotional she to focus on and she lost because she to turn the debate into and duel,hi ku ya hi lost hikuva a ri emotional she to focus on and she lost hikuva a ta hundzula debate yi va na duel .
216,i agree he is a proper e on an average day he a d in yesterday is night debate,ndza pfumela leswaku i e proper e hi siku ra xikarhi he a d in tolo is night debate .
217,the debate exposed our as a society merit and objectivity remains a mirage,mphikizano wu paluxile tani hi tani hi society merit and objectivity wu tshama wuri mirage .
218,the from st place in to th in world it enormous but made it sound like it s the only health system post pandemic with such know setting up a debate,the from st place in to th in world yormous but swi endle leswaku swi twala onge it s the health system post pandemic with such know setting up a debate .
219,part of the debate where she said that,xiphemu xa njhekanjhekisano laha a vuleke leswaku .
220,_plibersek this talking point from the is utterly we are fortunate that in we do not have the sort of divisive debate reps have already come out in support of in the us this will be a future policy and this rhetoric is going to increase,_plibersek this talking point from the is utterly hi na nkateko wa leswaku eka a hi na muxaka wa divisive debate reps se va humile va seketela eus leswi swi ta va pholisi ya nkarhi lowu taka naswona rhetoriki leyi yi ta tlakuka .
221,someone hacked account this is the real of the debate,munhu loyi a hacked account leyi i ya xiviri ya debate .
222,well it you don t know anyone this t a debate about whether it was right or wrong it s a fact that some station and all revenue staff were and hour on full pay were topped up as furlough these are,well it you don t know anyone this t a debate about whether it was right kumbe wrong it s a fact that some station and all revenue staff were and hour on full pay were topped up as furlough these are .
223,_ you are a liar,_ u muhembi .
224,_strong good question we need to have this debate fear not the best way to motivate action,_xivutiso lexinene hi fanele ku va na njhekanjhekisano lowu ku chava hayi ndlela leyinene yo hlohlotela xiendlo .
225,thanks to _english for the graphic novel which are totally what i believe too have added your to my debate with a colleague,hi khensa _xitsonga xa novhele ya swifaniso leswi hi ku helela leswi ndzi pfumelaka na swona swi engeteleke njhekanjhekisano wa wena eka njhekanjhekisano wa mina na mutirhi-kulorhi .
226,the articulation of power of convincing passion of integrity and highly level of during the debate yesternight was so outstanding mum you are that and the world yearning to have may our good lord make it happen,the articulation of power of convincing passion of integrity and highly level of during the debate yesternight was so outstanding mum you are that and the world heratures to have may our good lord make it happen
227,with a climate debate between a subject expert and a gammon,hi njhekanjhekisano wa maxelo exikarhi ka mutivi wa timhaka na gammon .
228,_am_bhu_shn how could good education save a if only is educated and the men thats same that how will be be saved if is only by not men simple logic read to understand not to debate,.
229,watch devastating critique of the in government during the vote of confidence debate,languta ku soriwa loku onhaka ka in mfumo hi nkarhi wa njhekanjhekisano wa vhoti ya ku tshemba .
230,in a maternity hospital because of a political debate get out of here mate it does not make any sense,eka xibedlhele xa ku veleka hikwalaho ka njhekanjhekisano wa tipolitiki get out of here mate a swi endli nchumu .
231,she lost the debate she could not much opinion from all media above,u lahlekeriwe hi njhekanjhekisano a nga swi kotanga ku vona mavonelo yo tala ku suka eka swihangalasamahungu hinkwaswo leswi nga laha henhla .
232,i was supporting and but after the debate and listening to i have my mind and am now fully supporting ruto is journey to,a ndzi ri eku seketeleni naswona kambe endzhaku ka njhekanjhekisano ni ku yingisela ndzi ni mianakanyo ya mina naswona sweswi ndzi seketela ruto hi ku helela i riendzo ro ya eka .
233,german energy debate against industry under eu private and critical infrastructure such as and old people s are from gas shut while industry is not,mphikizano wa eneji ya le jarimani lowu lwisanaka na indasitiri ehansi ka switirhisiwa swa phurayivhete na swa nkoka swa eu swo fana na na vanhu va khale s swi huma eka ku pfala ka gasi kasi indasitiri a hi .
234,another against bullying debate on where s they will never take the serious they just use it for sensationalism,yin'wana yo lwisana na njhekanjhekisano wa ku xanisiwa wa leswaku s a va nge pfuki va tekile leswi va swi tirhisaka ntsena eka ku endla leswaku va va ni vuxiyaxiya .
235,citizen is not happy that in that debate you have and for a blemish and this is the best you could find,citizen a nga tsakanga leswaku eka debate yoleyo u na yona na for a blemish and leswi hi swona swi nga kahle ngopfu leswi u nga swi kumaka .
236,after the debate after thought,endzhaku ka njhekanjhekisano endzhaku ka ku ehleketa .
237,very one sided debate on climate change and yet again this damages the argument to stop oil,very one sided debate eka ku cinca ka maxelo naswona nakambe leswi swi onha njhekanjhekisano wo yimisa oyili .
238,the debate was it is in for free kindly go listen to explaining why are not getting at she of corrupt govt is for personal gain,the debate was it is in for free kindly go listen to explaining why are are getting at she of corrupt govt is for personal gain
239,or the same childish message and uncompromising tactics which have in nothing but legislative stagnation will hand the reins of power this fall oh and i do not agree with your either but you are too arrogant to debate with,kumbe rungula leri fanaka ra vuhlangi na tindlela to pfumala ku tiyimisela leti nga riki na nchumu handle ka ku yima ka nawu swi ta nyika vulawuri bya matimba eka ku wa loku oh naswona a ndzi pfumelelani na na wena kambe u tikukumuxa ngopfu ku kanetana na .
240,boss kwan debate when did she sell the manifesto,boss kwan debate rini u xavise manifesto .
241,_ke i about winning the and not the debate like your is failing you when it comes to nitty gritty comprehension,_ke i hi ku hlula the and not the debate like your is failing you loko swi ta eka nitty gritty comprehension .
242,maybe kim and goodman as gene meet when she randomly at in where she s from where gene is and just their look at each other fin that s how i debate this only seeing how depressed gene to be,kumbexana kim na goodman tani hi gene va hlangana loko a randomly at eka laha she s from where gene is and just their look at each other fin that s how i debate this only seeing how depressed to be .
243,i am really glad that yesterday is debate proved just how is is all she clearly from her do i was in active politics statement the brains strategy for the job however supermarket,ndzi tsakile swinene leswaku tolo is debate proved just just is is all she clearly from her do i was in active politic statement the brains strategy for the job however supermarket .
244,a hero a king himself to be to end a debate as old as time itself i,nhenha hosi hi yexe ku va ku herisa njhekanjhekisano wa khale tanihi nkarhi hi woxe i .
245,a bright leader discuss an average leader discuss event while a foolish leader discuss people thought that debate was all about the president,murhangeri wo tlhariha u burisana hi murhangeri wa xiyimo xa le henhla u burisana hi xiendlakalo loko murhangeri wa vuphukuphuku a ri karhi a burisana hi vanhu va ehleketa leswaku njhekanjhekisano hinkwawo a wu ri hi muungameri .
246,and sent a junior minister out in parliament yesterday thus ruling out any debate on the ruinous trade deal they hold the public in contempt,naswona u rhumele holobye lontsongo ehandle epalamende tolo xisweswo a vula njhekanjhekisano wihi na wihi eka ntwanano wa mabindzu lowu onhakeke lowu va wu khomaka vaaki hi ku delela .
247,act wazalendo is leadership is on the process of e petition to tackle higher education challenge after we need response from the government our petition have to be considered for debate in the parliament,act wazalendo is leadership is on the process of e petition ku lwisana na ntlhontlho wa dyondzo ya le henhla endzhaku ka loko hi lava nhlamulo ku suka eka mfumo xikombelo xa hina xi fanele ku tekeriwa enhlokweni ku kanetiwa epalamende .
248,i think we just need another covered covered as white and can inverted perfectly up for debate but should be priority in case we sign anyone again,ndzi ehleketa leswaku hi lava ntsena yin’wana leyi funengetiweke yi funengetiwile tanihi yo basa naswona yi nga hundzuriwa hi ku hetiseka ku ya eka njhekanjhekisano kambe yi fanele ku va ya nkoka loko ko tshuka ku va na ku sayina mani na mani nakambe .
249,the call for debate is to understand how the government in it is duty to protect the nation is and wealth,xikombelo xa njhekanjhekisano i ku twisisa ndlela leyi mfumo lowu nga eka wona wu tirhaka ha yona ku sirhelela rixaka na rifuwo .
250,mine said wote ni noma on the debate,mine said wote ni noma eka njhekanjhekisano .
251,poll after the deputy presidential debate timothy super market state capture g,poll endzhaku ka deputy njhekanjhekisano wa vupresidente timothy super market state capture g .
252,in my own opinion some level of professionalism and tried as much to avoid the normal of making the subject matter of the debate knew his weakness of thin substratum on of governance constitutionalism,hi ku vona ka mina xiyimo xo karhi xa vutshila naswona ndzi ringete ku papalata leswi tolovelekeke ku endla mhaka ya njhekanjhekisano a swi tiva ku tsana ka yena ka thin substratum on of governance constitutionalism .
253,people could not shut up yesterday about how is the iron lady until after the debate where her dust even herself was,vanhu a va nga swi koti ku miyela tolo hi ndlela leyi iron lady yi nga xiswona ku kondza ku va endzhaku ka njhekanjhekisano laha ntshuri wa yena hambi ku ri yena n'wini a wu ri kona .
254,_morema we did not choose running mate we did not organize for the debate so i think you lack what you could have said we you go for hunting you choose capable sharp and you chose and we chose what did you expect,_morema a hi hlawulanga running mate a hi nga hleli njhekanjhekisano so i think you lack leswi a wu ta va u swi vule hi ya eku hloteni u hlawula capable sharp and u hlawurile and hi hlawurile leswi a wu swi languterile
255,met the other one was trained on how to speak of the nose that before the debate ended a feeble mind i can say,met un’wana u leteriwile hi ndlela yo vulavula hi nomo wa leswaku emahlweni ka njhekanjhekisano wu herisa mianakanyo leyi tsaneke ndzi nga vula .
256,you also the debate,na wena njhekanjhekisano .
257,they should give us a debate before the both should be to use mother tongue where need that is where the real beef and we want the violence covered live in,va fanele ku hi nyika njhekanjhekisano loko havumbirhi bya vona va fanele ku va ku tirhisa ririmi ra manana laha xilaveko xexo ku nga laha nyama ya homu ya xiviri na hi lavaka leswaku madzolonga ma funengetiwile va tshama kona eka .
258,you nowadays make sense a lot i have not seen you that lady after that debate na,wena masiku lawa make sense ngopfu a ndzi ku vonanga lady liya after that debate na
259,it was supposed to be a debate not a political rally in,a ku fanele ku ri njhekanjhekisano hayi nhlengeletano ya tipolitiki hi .
260,i hope you ai not saying about subject matter of the debate the debate is not about and this time then wheelbarrow,ndzi tshemba leswaku u ai u nga vuli hi mhaka ya njhekanjhekisano lowu njhekanjhekisano wu nga riki wona naswona nkarhi lowu wu ta va hi mavhilwa .
261,in under her party manifesto stock the debate schooled her opponent on the law up the auditorium with a joke and dried up her mop after the floor power puff,eka under her party manifesto stock njhekanjhekisano wu dyondzele mukaneti wa yena eka nawu ku ya ehenhla ka holo hi ku hleka ivi a omisa mop wa yena endzhaku ka floor power puff .
262,_kenya i advise baba the th to boycott the presidential debate with this bottom up can speak whoever did make to heaven is not for you,.
263,stop thinking like a we knew whom we sent there to debate and we had trust that she will do the job unlike the who were seeing their aspirant raping kenyatta is family with any to justify the truth,tshika ku ehleketa ku fana na a hi swi tivile leswaku hi rhumele mani kwalahaya ku debate and we had trust leswaku u ta endla ntirho ku hambana na lava a va vona aspirant ya vona va pfinya kenyatta i ndyangu na any ku justify ntiyiso
264,lady trying to raise the level of debate above the miaow miaow level,wansati a ringeta ku tlakusa xiyimo xa njhekanjhekisano ehenhla ka xiyimo xa miaow miaow .
265,we are in the middle of an intense political debate on pay tax spending and economic growth productivity is at the heart of this debate and a long term policy perspective rather than short term as i discuss in this piece in today,hi le xikarhi ka njhekanjhekisano lowukulu wa tipolitiki eka ku tirhisiwa ka mali ya xibalo xa muholo na ku kula ka ikhonomi vuhumelerisi bya le xikarhi ka njhekanjhekisano lowu na langutelo ra pholisi ya nkarhi wo leha ku tlula nkarhi wo koma loko ndzi ri karhi ndzi burisana eka xiphemu lexi eka namuntlha .
266,_brian this time round they were not for debate,_brian this time round a va nga ri for debate .
267,he only about you after being why he did not congratulate you like did to immediately after the debate your captain had to wait for,he only about you after being why a nga ku hoyozelanga like u endle ku hatlisa endzhaku ka debate njhekanjhekisano captain ya wena yi boheke ku yimela .
268,once again tay set the he really did ask such a good question that it was chosen as a topic of debate,nakambe tay set the he really did ask such a good question that yi hlawuriwile tani hi nhlokomhaka ya njhekanjhekisano .
269,the damage control upon that verbal they now want to flip the narrative to did not show up to debate,ku lawula ku onhaka eka rito rero sweswi va lava ku flip xitlhokovetselo ku ya eka ku nga tikombisi ku kanetana .
270,how arrogant is his attitude towards the general public what an over inflated opinion of himself i the tory party to be able to have a say in politics no matter how small i understand fully the leadership debate i will vote for who i consider the best candidate,xana langutelo ra yena ri tikukumuxa njhani eka vaaki hi ku angarhela leswaku i mavonelo yo tlula mpimo ya yena i the tory party ku kota ku va na rito eka tipolitiki ku nga khathariseki leswaku ndzi twisisa hi ku helela njhekanjhekisano wa vurhangeri hi ku helela ndzi ta vhotela mani loyi ndzi n’wi tekaka a ri muhlawuriwa lonene ngopfu .
271,what is the issue is of party affiliation story za she will be good in shouldnt be here bibi ya na the point of the debate is to show prowess and agenda her eloquence is the eloquence of her party if her please,what is the issue is of party affiliation story za she will be good in shouldnt be here bibi ya na mhaka ya njhekanjhekisano i ku kombisa vutshila na ajenda vutshila bya yena byo vulavula i vutshila bya vandla ra yena loko a kombela leswaku a kombela .
272,can not wait for that ga us senate debate it is kind of like a mathematical competition with goofy the dog or even walker,a ndzi nge swi koti ku rindza njhekanjhekisano wolowo wa ga wa senate swi fana ni mphikizano wa tinhlayo ni goofy mbyana kumbe hambi ku ri walker .
273,i hope in the presidential debate we get to put and in one table we need this,ndzi tshemba eka njhekanjhekisano wa vupresidente lowu hi wu kumaka ku wu veka naswona eka tafula rin’we hi lava leswi .
274,a thread a fair bit is made about scouting when they sign over the course of this summer there been as usual much debate at the o s let s dispel the myth first that we need that was not only,thread a fair bit is made about scouting loko va sayina hi ku famba ka ximumu lexi ku vile na as usual much debate at the o s let s dispel the myth first that we need that was not only ntsena .
275,_jibon the only debate is among short if you debate beyond that you just need to learn more,_jibon nkanelo wun'we ntsena i exikarhi ka short loko u debate ku tlula sweswo u lava ntsena ku dyondza swo tala .
276,yes i am a lawyer who studied law and can understand how are twisted and judiciary is being used politically i can give what is your understanding of law ready to debate,ina ndzi gqweta leri dyondzeke nawu naswona ndzi nga twisisaka leswaku swi soholotiwile njhani naswona vuavanyisi byi tirhisiwa hi tlhelo ra tipolitiki ndzi nga nyika leswi ku twisisa ka wena ka nawu ku lunghekeleke ku kanetiwa .
277,news abortion debate running a major anti abortion rally,mahungu ya ku susa khwiri njhekanjhekisano lowu fambisaka nhlengeletano leyikulu ya anti abortion rally .
278,after much analysis won the debate on key and,endzhaku ka nxopaxopo wo tala u hlule njhekanjhekisano hi xilotlelo na .
279,debate on group is may national interest dewan speaker,mphikizano wa ntlawa i may national interet xivulavuri .
280,after debate is it after thought,endzhaku ka njhekanjhekisano i endzhaku ka ku ehleketa .
281,why did you not have a go at trump when he was wading into debate like other right wing client journalist you stand for nothing other than pushing the agenda your and tell you too consistency t ever exist,why u nga ri na go at trump loko a ri karhi a wading eka debate ku fana na van'wana va right wing client journalist a wu yimeli nchumu handle ko susumeta agenda ya wena u ku byela too consistency t ever exist
282,pure propaganda if you watched the debate from the start you could have seen they had picked on who to start the,pure propaganda loko wo hlalela debate ku sukela eku sunguleni u nga vona va hlawulerile eka mani wo sungula ku .
283,but his team to be heading at each debate session,kambe xipano xa yena xi ta va xi kongoma eka xiyenge xin’wana ni xin’wana xa njhekanjhekisano .
284,i never said to not give them push back if you are able to some people literally can not engage with right wing people in debate because of their mental health i am telling you it is to assume everyone who an opinion can safely defend it,a ndzi se tshama ndzi vula leswaku a ndzi va nyiki push back loko u kota ku vanhu van’wana hi ku kongoma a wu nge ngheneleli na vanhu va le tlhelo ra xinene eka debate hikwalaho ka rihanyo ra vona ra miehleketo ndzi mi byela leswaku i ku teka un’wana na un’wana loyi vonelo a nga ri sirhelela hi ku hlayiseka .
285,part of the fun of life public debate is weird theoretical or unlikely,xiphemu xa njhekanjhekisano wa le rivaleni wo tsakisa wa vutomi i weird theoretical kumbe a swi nge endleki .
286,the deputy presidential debate,mphikizano wa vupresidente wa vupresidente .
287,_alexis if you are going to debate me bring your a game this weak sauce ai not get it there is no win for the target in any world there is only the world with the best odds for the target and that is armed there is no that,.
288,v of britain is least woke statue queen victoria is memorial to her husband is old this month and there is so much more to it than the eye,v ya britain is least woke statue queen victoria i xitsundzuxo xa nuna wa yena i khale n’hweti leyi naswona ku na swo tala swinene eka xona ku tlula tihlo .
289,your pillar of strength won that debate,nsika ya wena ya matimba yi hlule njhekanjhekisano wolowo .
290,__ this t a serious debate is clear of,__ this t a serious debate yi le rivaleni .
291,like yesterday is debate was on all so many were not covered,like tolo is debate a yi ri eka hinkwavo vo tala swinene a va nga funengetiwanga .
292,i share the same who are the people who for the debate,ndzi avelana leswi fanaka lava nga vanhu lava for the debate .
293,was wrong to debate who was not on stage and is not vying for any political seat,a swi hoxile ku kanetana hi leswaku i mani loyi a a nga ri kona exitejini naswona a nga lying for any political seat .
294,we thank the deputy for sure he did great work in debate,hi khensa deputy for sure u endle ntirho lowukulu eka debate .
295,it on your who won the debate,it on ya wena loyi a nga hlula eka debate .
296,when he may have excellently we could have this debate,loko a nga ha va na kahle swinene hi nga va na njhekanjhekisano lowu .
