,src,trg
951,of law non legal and virtual all over the world have been able to grow thanks to our working culture we love being part of your team,ya nawu non legal na virtual emisaveni hinkwayo va swi kotile ku kula hikwalaho ka ndhavuko wa hina wo tirha hi swi tsakela ku va xiphemu xa xipano xa wena .
952,did they did they really have wade say his favorite movie is mountain they need to quit with the pop culture please,did they did they really have wade say movie leyi a yi tsakelaka i mountain leyi va yi lavaka ku tshika na pop culture please .
953,it will amaze you to know that lot of and still do not understand what culture even,swi ta ku hlamarisa ku tiva leswaku lot of and still a wu swi twisisi leswaku i ndhavuko wihi hambi ku ri .
954,i only appreciate culture from a distance and i get by them on this they are truly horrible,ndzi tlangela ntsena ndhavuko ndzi ri ekule naswona ndzi kuma hi vona eka leswi va chavisaka hakunene .
955,a clone of culture,clone ya ndhavuko .
956,i would get my car done in now they got some car culture out there boy don t know why la and h town only get the limelight,a ndzi ta endla movha wa mina wu endliwa sweswi va kume ndhavuko wa movha ehandle kwalaho boy a ndzi swi tivi leswaku ha yini la na h town va kuma ntsena limelight .
957,to see that s culture of care commitment to been on fortune s best for list it s an exciting time to work in hospitality be part of an incredible organization join us,ku vona leswaku s ndhavuko wa nhlayiso ku tinyiketela ku va eka fortune s best for list it s an exciting time to work in hospitality be part of an incredible organization join us .
958,_nassolo this is what different i think we are our culture if not less understanding,_nassolo leswi hi swona leswi ndzi ehleketaka leswaku hi swona ndhavuko wa hina loko ku nga ri ku twisisa kutsongo .
959,a great team a great team and culture dramatically your company is of success if your team t great your company will not succeed no matter how good the idea,xipano lexikulu xipano lexikulu na ndhavuko hi ndlela yo hlamarisa khamphani ya wena yi humelela loko xipano xa wena t xikulu khamphani ya wena a yi nge humeleli ku nga khathariseki leswaku mianakanyo yi kahle ku fikela kwihi .
960,fun food music history culture at now in we are there with a wearable craft to make history display authentic parade costume from our collection,fun food music history culture at now in we are there with a wearable craft ku endla history display authentic parade costume ku suka eka nhlengeleto wa hina
961,not the same but that one time i was talking about those with to black music and like they seen the coming of god and ex well consider we have a really conservative culture,a swi fani kambe nkarhi wolowo wun’we a ndzi vulavula hi lava na vona eka vuyimbeleri bya vantima naswona ku fana na loko va vona ku ta ka xikwembu na ex well consider we have a really conservative culture .
962,catch up with the digital dissection three navigate pop culture in comedic ways new mon wed pro lew feat lew temple,khoma ku tsemiwa ka digital three navigate pop culture hi tindlela ta vuhlekuri new mon wed pro lew feat lew temple .
963,awareness to the prison culture through food and,ku lemukisa hi ndhavuko wa le khotsweni hi ku tirhisa swakudya na .
964,our culture and heritage is being washed away day by day,ndhavuko na ndzhaka ya hina swi hlantswiwa siku na siku .
965,art hive art all _ _culture _ _crafts,art hive art hinkwaswo _ _ndhavuko _ _crafts .
966,title folio from section juz' of a manuscript of the qur'an decorated frontispiece verso location culture date c,title folio from section juz' ya tsalwa ra voko ra qur'an leri khavisiweke ra le mahlweni verso ndhawu ndhavuko siku c
967,only if you really think we should forever stunt culture to the the machine,ntsena loko hakunene u ehleketa leswaku hi fanele hi heta ndhavuko wa stunt forever eka the machine .
968,ten since the college first college principal alan on as a creative hub making a name for themselves and some future,khume kusukela eka kholichi yo sungula ya nhloko ya kholichi alan eka tani hi ndzhawu yo tumbuluxa yi endla vito ra vona na vumundzuku byin’wana .
969,don t get cocky is a phrase reserved for people with it your not permitted to behave assertively this thread about how patriarchal culture can make progressive legal gains meaningless is well worth the read,don t get cocky i xivulwa lexi vekeriweke vanhu lava nga na xona a swi pfumeleriwi ku tikhoma hi ndlela yo tiyisisa leswaku thread leyi ya ndlela leyi ndhavuko wa vupatriyarka wu nga endlaka leswaku ku vuyeriwa ka nawu loku yaka emahlweni ku nga vi na xikongomelo is well worth the read
970,wright that the trauma and long term effects of and slavery still his family today by blocking their ability to pass wealth down through the by via,wright leswaku khombo na vuyelo bya nkarhi wo leha bya na vuhlonga bya ha ri ndyangu wa yena namuntlha hi ku sivela vuswikoti bya vona byo hundzisela rifuwo ehansi hi ku tirhisa hi ku tirhisa .
971,basic help ensure consistent cell culture such as laboratory setup safety and aseptic brush up on your and expand your knowledge with a wide variety of,mpfuneto wa xisekelo wu tiyisisa ndhavuko wa tisele lowu nga cincekiki ku fana na vuhlayiseki bya ku vekiwa ka laboratori na aseptic brush up eka wena na ku ndlandlamuxa vutivi bya wena hi ku hambana ka swilo swo hambana hambana .
972,are you an amazing non creator join other like you the foundation for in gaming to sponsor you on the magnificent mythology stream fig share your culture with the world with art and and you keep the,are you an amazing non creator join other like you the foundation for in gaming ku ku sponsor eka magnificent mythology stream fig share your culture with the world with art and you keep the .
973,kyle new culture at red mountain,kyle ndhavuko lowuntshwa entshaveni ya red .
974,an inquiry known as the report by the uk is labour party into its own management that the party a racist and otherwise discriminatory culture and that it used as a factional weapon,ndzavisiso lowu tivekaka tani hi xiviko xa uk i labour party eka vufambisi bya wona leswaku vandla i ndhavuko wa xihlawuhlawu na hi ndlela yin’wana ya xihlawuhlawu na leswaku wu tirhise tani hi tlhari ra ntlawa .
975,it s honestly like he brought together an all star squad of i mean we have from everywhere we have from mesquite corona sol all of them have been really good to us,it s honestly like a hlanganisile all star squad ya i mean we have from hinkwako laha hi nga na kona ku suka emesquite corona sol hinkwavo va ve kahle swinene eka hina
976,watch the moment town player the love island villa,languta nkarhi lowu mutlangi wa le dorobeni the love island villa .
977,a keen eye for material culture the colors and and and light that make so transcendent my first book review for for  is meet me by the fountain on,a keen eye for material culture mihlovo na na na ku vonakala loku endlaka leswaku ku tlula ka mina ka buku ya mina yo sungula nxopaxopo for for is meet me by the fountain on .
978,cancel culture where do they come from is it some d somewhere that just to cause trouble,cancel culture where va huma kwihi is it some d somewhere that just to cause trouble .
979,failing show life when he bash by a head of show that he will be doing so hypocrite always talking about cancel culture woke and he s the biggest hypocrite profiting off the back of m h when he was out on he walk off like baby,failing show life loko a bash hi nhloko ya show leswaku u ta va a endla tano vukanganyisi a tshama a vulavula hi cancel culture woke and he s the biggest hypocrite profiting off the back of m h loko a ri ehandle a famba ku fana na nwana
980,the whole cancel culture thing is insane freedom of speech does not mean freedom from being told that people think you are a jerk because of what you said,the whole cancel culture thing is insane ntshunxeko wo vulavula a swi vuli ku ntshunxeka ku byeriwa leswaku vanhu va ehleketa leswaku u jerk hikwalaho ka leswi u swi vuleke .
981,looking to share your love of culture consider to we offer classes in many subject for for culture heritage apply today,ku languta ku avelana rirhandzu ra wena ra ndhavuko anakanya eka hi nyika titlilasi eka tidyondzo to tala for for culture heritage apply today
982,we ask me anything with and backstage at,hi ndzi vutisa xin'wana na xin'wana na backstage eka .
983,it s hard to promote a wholesome company culture in normal times and harder still to do so one misunderstood group slack message and problematic fire at a time the biggest problem with,swi tika ku tlakusa ndhavuko wa khamphani leyi hanyeke kahle hi minkarhi leyi tolovelekeke naswona swi tika swinene ku endla tano rungula rin’we leri nga twisisekiki ra ku olova ka ntlawa ni ndzilo lowu nga ni swiphiqo hi nkarhi lowu nga ni xiphiqo lexikulu eka .
984,is that white culture appropriation i see,is that white culture appropriation ndzi vona .
985,we are only able to solve increasingly complex because of culture and the ability to signal across space and time language and then writing we build on others' work but without a way of keeping track of history we are no more complex,hi kota ntsena ku tlhantlha swiphiqo leswi yaka swi rharhangana hikwalaho ka ndhavuko na vuswikoti byo kombisa ku tsemakanya ndhawu na ririmi ra nkarhi ivi hi tsala hi aka eka ntirho wa van’wana kambe handle ka ndlela yo hlayisa matimu a hi ha ri na swiphiqo swo tala .
986,did you catch on this morning comes to this,did you catch on this morning come eka leswi .
987,all the are here interesting that a symbol of counter culture is now being as a tourist attraction,hinkwaswo leswi swa tsakisa laha ku nga xikombiso xa ndhavuko wa counter sweswi i ku va ndhawu yo koka rinoko ra vaendzi .
988,stop as working class their culture is not ur costume,yima tani hi vatirhi ndhavuko wa vona a hi ur costume .
989,__camacho ___ just out of curiosity what culture or place are you from,__camacho ___ ntsena hi ku lava ku tiva leswaku u huma eka ndhavuko kumbe ndhawu yihi.
990,i am being tonight on  is earth calling show at p m pacific time my research and the between art visual culture and environmental justice tune in here,ndzi karhi ndzi va vusiku bya namuntlha i earth calling show eka p m pacific time ndzavisiso wa mina na le xikarhi ka vutshila bya swifaniso swa vutshila na vululami bya mbango tune in here .
991,me of saying that she had read so much about history and culture before going there that she felt like she already knew the place,mina hi ku vula leswaku u hlayile ngopfu hi matimu na ndhavuko a nga si ya kona lerova a titwa onge se a tiva ndhawu leyi .
992,you the now you can let your hair down at this ally pally shindig,wena the sweswi u nga tshika misisi ya wena yi ya ehansi eka ally pally shindig leyi .
993,ensure your inclusive culture you shape the future of the world access ensure your inclusive culture you shape the future of the world,tiyisisa leswaku ndhavuko wa wena wo katsa hinkwavo u vumba vumundzuku bya mfikelelo wa misava tiyisisa leswaku ndhavuko wa wena lowu katsaka hinkwavo u vumba vumundzuku bya misava .
994,mormon history and culture ago preacher convinced many was about to return,matimu ya mormon na ndhavuko lowu hundzeke muchumayeri u khorwisile leswaku vo tala va le kusuhi no vuya .
995,bisexual culture is not knowing who you want more,bisexual culture a yi tivi leswaku u lava swo tala mani .
996,culture of trance,ndhavuko wa trance .
997,emphasis on the the development of modern celebrity and fan culture it s an endemic that really needs to be studied,ku kandziyisiwa ka nhluvukiso wa ndhuma ya manguva lawa na ndhavuko wa vaseketeri it s an endemic leyi hakunene yi lavaka ku dyondziwa .
998,i think my conclusion is that cancel culture is less the existence of public it is always but rather that being part of as many as possible and never ever calling for moderation is the way to guarantee you will not be targeted,ndzi ehleketa leswaku mahetelelo ya mina hi leswaku ku khansela ndhavuko a hi vukona bya mani na mani i minkarhi hinkwayo kambe ku tlula kwalaho ku va xiphemu xa vo tala hilaha swi kotekaka hakona naswona u nga tshuki u vitana ku ringanisela i ndlela yo tiyisisa leswaku a swi nge kongomisiwi eka .
999,mormon history and culture biography the many of the 'apostle to the indians',mormon history and culture biography vanyingi va ‘muapostola wa maindiya’.
1000,they actively support crunch culture all the except one are pro crunch like they all be like this is how the industry works am so tired being considering dropping out but since i do not want to go back to my or stay here and struggle with money am,they actively support crunch culture all the except one are pro crunch like they all be like leyi i ndlela leyi indasitiri yi tirhaka ha yona am so tired ku ehleketa ku drop out kambe tani hi leswi ndzi nga laviki ku tlhelela eka my kumbe ku tshama laha ndzi lwisana na mali am .
1001,as long as you cower away from calling it what it is by cloaked like controversial instead of racist you are actively and racism in hockey s culture,as long as you cower away from calling it what it is by cloaked like controversial ematshan'wini ya racist u actively na xihlawuhlawu eka hockey s culture .
1002,am streamline architecture hotel s city island historic beach st noll culture butler memory myth identify the of st s confederate monument,am streamline architecture hotel s city island xihlala xa matimu st noll ndhavuko butler ntsheketo identify the of st s confederate monument
1003,we were we help redefine music culture just like the great moment in army history,we were hi pfuna ku hlamusela hi vuntshwa ndhavuko wa vuyimbeleri ku fana na nkarhi lowukulu eka matimu ya vuthu
1004,mormon history and culture uncle will and the curse a review,mormon matimu na ndhavuko malume will na the curse a review .
1005,cancel culture even the most secure of when it comes to peer,khansela ndhavuko hambi ku ri ku sirheleleka swinene ka loko swi ta eka tintangha .
1006,consume spiced buttermilk like water if given the choice it is an inseparable part of culture best can be found alongside the parallel to the river in all of perfectly spiced genuine a milk butter,tirhisa mati yofana na buttermilk lawa yanga na swipayisisi loko ku nyikiwa nhlawulo i xiphemu lexi nga hambanisiwiki xa ndhavuko kahle swinene xinga kumeka etlhelo ka parallel na nambu eka hinkwaswo swa perfectly spiced genuine a milk butter .
1007,in my own experience the culture best for life is one that our natural response to visual let people wear scant clothes without this or demanding sex feeding the baby outside is normal not sexual but many in the world will disagree with me,hi ntokoto wa mina ndhavuko lowunene ngopfu evuton’wini i wun’wana wa leswaku nhlamulo ya hina ya ntumbuluko eka ku vona vanhu va tshika vanhu va ambala swiambalo leswi nga nyawuriki handle ka leswi kumbe ku lava rimbewu ku dyisa n’wana ehandle i ntolovelo ku nga ri ka rimbewu kambe vo tala emisaveni a va nge pfumelelani na mina .
1008,mormon history and culture the of summer life in long ago salt lake city,matimu ya mormon na ndhavuko the ya vutomi bya ximumu eka khale ka salt lake city .
1009,no one said that you everything and that s the issue much of culture is rooted in and culture that t mean i m not and that i have to choose a silly race for people like you to sleep better at night,akuna munhu loyi a nga vula leswaku wena hinkwaswo na leswaku s the issue much of culture is rooted in and culture that t mean i m not and leswaku ndzi fanele ku hlawula mphikizano wa vuphukuphuku eka vanhu vo fana na wena ku etlela ku antswa nivusiku .
1010,so much history and culture plus some amazing food do not judge it off of and limited vision home of the original 'vs everybody ' mantra,so much history and culture plus some amazing food don't judge it off and limited vision home ya original 'vs everybody ' mantra .
1011,was how you yourself from imperialist persecution all these combine to s patriarchy and our familial rule abiding culture our often change when we relocate to more economically sound and socially diverse but that s not always the case,a ku ri ndlela leyi wena hi wexe ku suka eka nxaniso wa vuimperiyali hinkwaswo leswi swi hlanganaka eka s patriarchy na nawu wa hina wa ndyangu lowu landzelaka ndhavuko wa hina lowu talaka ku cinca loko hi rhurhela eka ku va hi ri na ikhonomi yo tala na ku hambana ka ntshamisano kambe sweswo a hi minkarhi hinkwayo swi nga tano.
1012,reading about how the thought was going to get by al in the early  is as part of a plot to destabilize culture by famous,ku hlaya hi ndlela leyi miehleketo a yi ta hundza ha yona hi al in the early is as part of a plot to destabilize culture by famous .
1013,thanks for following make sure to keep up with us on,ndza khensa ku landzela tiyisisa leswaku u ta fambisana na hina eka .
1014,i feel for the three best who have been by the team over the past have to walk in and fox is it the city management culture i really like the city of so i don t get it,ndzi twa hi vanharhu lava nga kahle lava nga va hi xipano eka nkarhi lowu hundzeke va fanele ku nghena naswona fox is it the city management culture i really like the city of so i don t get it .
1015,_tinline too known to be extremely clever very good with detail highly accomplished business career surely a man who was coming into parliament to get done did not last an uneasy fit culture clash possibly did not help that this was in opposition but still,.
1016,_rinaldi i m that our culture a like this can so freely say what can or should be,.
1017,we have a choice we can have culture with or we can have reasonable gun control good paying oversight food safety reliable power transit justice in the legal system and a public education system with,hi na ku hlawula loku hi nga vaka na ndhavuko na kona kumbe hi nga va na vulawuri bya xibamu lebyi ringaneleke ku hakela kahle vulawuri swakudya vuhlayiseki ku tshembheka matimba vululari eka sisiteme ya nawu na sisiteme ya dyondzo ya mfumo na .
1018,love this great woman born in was one of the st talking in public about the are incompatible with us western culture people so accurate based experience,rhandza wansati loyi lonkulu loyi a velekiweke eka yena a a ri un'wana wa va-st talking in public about the are incompatible na hina va le vupeladyambu ndhavuko vanhu so accurate based experience
1019,wisdom life experience from to music culture in general as well,ntokoto wa vutomi bya vutlhari ku suka eka ku ya eka ndhavuko wa vuyimbeleri hi ku angarhela na swona .
1020,_weymouth agree mon is experienced she from predominately white culture the gave hope but they do not represent the diverse needs across a full of diverse with no reason to agree a challenge for human nature,.
1021,you it i find politics very important because my future older self needs social safety net or entitlement but for someone else in their s student loan debt is important i believe following any spectator sport or pop culture is the waste of time ever,you it ndzi kuma tipolotiki ti ri ta nkoka swinene hikuva vumundzuku bya mina bya khale bya self needs social safety net kumbe entitlement kambe eka munhu un'wana eka s student loan ya vona i swa nkoka ndzi pfumela leswaku ku landzela spectator sport yin'wana na yin'wana kumbe pop culture is the waste of time ever
1022,well this is just my opinion in the shipping culture if it s the older version of him he s older than then yeah i would just simply tolerate it if i hate it if it s the child version of him then that s off body t to handle that yet,kahle kahle leswi i mavonelo ya mina ntsena eka ndhavuko wa ku rhumela loko ku ri version ya khale ya yena he s older than then yeah a ndzi ta swi tiyisela ntsena loko ndzi swi venga loko s the child version ya yena then that s off body t to handle . leswaku hambi swi ri tano .
1023,_nft for the culture,_nft ya ndhavuko .
1024,no comment many law are still skittish about drilling down and providing information and data on some of what they do and who does it read here print copy here,no comment nawu wo tala wa ha skittish hi ku bora ehansi na ku nyika vuxokoxoko na data eka swin’wana swa leswi va swi endlaka na leswaku i mani loyi a swi endlaka laha print copy laha .
1025,the conclude that bridging the gender gap will require more than increasing the number of female it will require to better understand its own culture of knowledge production,va gimeta hi leswaku ku hlanganisa xivandla xa rimbewu swi ta lava swo tlula ku engetela nhlayo ya vavasati leswi swi nga ta swi lava ku twisisa ku antswa ndhavuko wa swona wa vuhumelerisi bya vutivi .
1026,i really it it gave us a fascinating insight into culture and not that which is by news,i really it swi hi nyikile vutivi byo tsakisa eka ndhavuko and not that which is by news .
1027,my culture is not a costume,ndhavuko wa mina a hi xiambalo .
1028,i remember seeing someone say that covering their was a part of culture no it is privacy and,ndzi tsundzuka ndzi vona munhu a vula leswaku ku funengeta swa vona a ku ri xiphemu xa ndhavuko hayi i vuhlayiseki bya xihundla naswona .
1029,we do not have to live like this we can have culture mass with or we can have reasonable gun control privacy for all good paying food safety reliable power transit good public education with,a hi boheki ku hanya hi ndlela leyi hi nga va na culture mass na yona kumbe hi nga va na vuhlayiseki bya swibamu lebyi ringaneleke eka hinkwaswo leswinene leswi hakelaka swakudya vuhlayiseki ku tshembheka matimba ku hundzisela kahle dyondzo ya mfumo na .
1030,i see you re a man of culture,ndzi vona wena re a man of culture .
1031,_ny g_ just so you know pal and it does not take away the fact that the a complete balloon down south are known as northern no matter what your culture or colour so i should not take that one to heart as racist just of a nob,.
1032,do you mean 'at the back of ' and should that be  ispeaker is' maybe a full stop after the parenthesis space between 'no' and ' ' still when you have had a few what is a bit of grammar between eh minister for culture,xana u vula 'endzhaku ka ' naswona loko sweswo swi fanele ku va ispeaker i' kumbexana ku yima loku heleleke endzhaku ka ndhawu ya xiphemu exikarhi ka 'hayi' na ' ' ya ha ri na swi nga ri swingani leswi nga xiphemu xa ririmi exikarhi ka eh minister for culture .
1033,it me so happy to see people from other around the world and culture if you ever wear a national or or attempt to cook a national dish i will sob,it me so happy ku vona vanhu va van'wana emisaveni hinkwayo na ndhavuko loko wo tshuka u ambala national kumbe kumbe ku ringeta ku sweka swakudya swa tiko ndzi ta sob .
1034,for the woman is despicable act was not funny the reason and context for her are debatable especially within her context your comment is a loaded statement based on your profile and the word 'culture' was clearly a veiled reference to her race,hikuva wansati is despicable act was not funny the reason and context for her are debatable ngopfu ngopfu endzeni ka context ya yena comment ya wena i statement leyi layichiweke leyi sekeriweke eka profile ya wena naswona rito 'culture' a swi ri erivaleni leswaku a ku ri reference leyi funengetiweke hi rixaka ra yena
1035,culture is crazy how you go from a to a with a fat ass and tooth pick,culture is crazy how u suka njhani ku ya eka a na xitombo xo nona na meno pick .
1036,kindly join in there was a technical hitch but we carry on with the discussion how can youth in contribute to a culture of peaceful,hi musa ku joyina a ku ri na xiphiqo xa vuthekiniki kambe hi ya emahlweni na mbulavurisano xana vantshwa va nga hoxa xandla njhani eka ndhavuko wa ku rhula .
1037,i have just posted a new job we are for downstream microbial cell culture at international limited,ndzi lo vhela ndzi veka ntirho wuntshwa hi le ka ndhavuko wa ti cell ta switsongwatsongwana swa le hansi eka international limited .
1038,_o pure racism they there food and there culture is part of our country,_o pure racism they food and there ndhavuko i xiphemu xa tiko ra hina .
1039,looking down on someone for their nationality culture is still racism g,ku languta ehansi eka munhu eka ndhavuko wa vona wa rixaka wa ha ri racism g .
1040,who about his opinion on rap regardless don t try and clean what he said he s been a culture vulture since he,who about his opinion on rap regardless don t try and clean leswi a swi vuleke he s been a culture vulture kusukela a .
1041,i vote tice s reform the time comes when you got to say enough is enough otherwise this s hit show on until is no longer is losing it s identity culture being clearly tory party aint do anything,i vote tice s reform the time comes when you got to say enough is enough otherwise s hit show on ku kondza is a ya ha lahlekeriwi hi it s identity culture ku va swi ri erivaleni tory party aint do anything
1042,i speak with author journalist and gay activist about his brilliant new book the constitution of knowledge we discuss free speech minority identity cancel culture the existential threat from the far right and much more,ndzi vulavula na mutsari wa muteki wa mahungu na mulwela-ntshuxeko wa tinghwavava mayelana na buku ya yena leyintshwa yo tlhariha leyi nge the constitution of knowledge hi burisana hi vutivi bya vanhu va le hansi bya ku vulavula hi ku ntshunxeka ku herisa ndhavuko nxungeto wa vukona ku suka exineneni xa le tlhelo na swin’wana swo tala
1043,on u for decoration too right when we said our culture and our people have always been entertainment we was wrong and sensitive maybe y all just sitting in ur happily uneducated,on u for decoration too right loko hi ku culture ya hina na vanhu va hina va tshama va ri vuhungasi hi hoxile and sensitive maybe y all just sitting in ur happily unaducated
