,src,trg
257,best in my opinion four arc decisive battle arc courtesan of a nation arc silver soul arc shogun assassination arc farewell arc in,best hi ku vona ka mina mune wa ti-arc ta xiboho xa nyimpi arc courtesan ya rixaka arc silver soul arc shogun assassination arc farewell arc in
258,music in season a bell of blessing farewell a million this is love upside down _heneciatwt,vuyimbeleri in season a bell of blessing farewell miliyoni leyi i rirhandzu upside down _heneciatwt .
259,farewell transmission on converge radio,ku hundziseriwa ka ku wisa eka converge radio .
260,star road kim farewell taxi,star road kim taxi .
261,my uncle off the mortal coil farewell meat for another today days,malume wa mina off the mortal coil farewell nyama for another today days
262,farewell text to a person who every other hour blocked,farewell text eka munhu loyi awara yin'wana na yin'wana a yi pfaleke .
263,what if the real elysia is the one going to destroy er and it with farewell angst animated,ku vuriwa yini loko elysia wa xiviri a ri loyi a nga ta herisa er na yona hi farewell angst animated .
264,when i  is bottling plant last week in to meet their team tour the state of the art lab i bade farewell to _ painted by my team broke a coconut a tree was to see this message up in,loko ndzi ri karhi ndzi chela mabodlhela vhiki leri nga hundza eka ku hlangana na riendzo ra vona ra xipano xa state of the art lab lexi ndzi xi leriseke ku _ xi pendiwile hi xipano xa mina xi tshove khokhonati murhi a ku ri ku vona rungula leri ri tlakuka hi .
265,the farewell from a female but i amma playa i ai not gone tell you all the,the farewell from ya xisati kambe i amma playa i ai not gone ku mi byela hinkwaswo .
266,the of the sha tin stand farewell and for the,the ya sha tin stand farewell na for the .
267,productive monsoon session as farewell gift,productive monsoon session tani hi nyiko yo wisa .
268,bid you farewell pa pa pa pa tearing love up into pa pa pa pa red the feeling we lose our clothes it s you i chose and gracefully so i gracefully so,bid you farewell pa pa pa pa ku handzula rirhandzu ku ya eka pa pa pa pa red the feeling hi lahlekeriwa hi swiambalo swa hina s you i chose and gracefully so i gracefully so i
269,s farewell _official on his transfer away from quick good and his journey ahead at,s farewell _official eka ku hundziseriwa ka yena ku suka eka quick good na riendzo ra yena emahlweni eka .
270,they re finally killing off thank god please not again he to stay alive farewell is not going anywhere,they re finally killing off thank god please a nga ha tlheli a hanya a hanya farewell a nga yi kun'wana .
271,i hate coming to play for for their farewell,ndzi venga ku ta ku ta tlangela for their farewell .
272,in farewell in looking forward to tomorrow will be better let us smile more beautiful,hi ku wisa eku languteleni ka mundzuku swi ta antswa swi hi pfumelela ku n’wayitela ku saseka swinene .
273,farewell gift to my chef,farewell nyiko eka mupheki wa mina .
274,shogun assassination arc to farewell arc is probably the best back to back run in anime,shogun assassination arc to farewell arc kumbexana i ya kahle swinene ya back to back run eka anime .
275,a festival trade a festival farewell,bindzu ra festival a festival farewell .
276,t plan to post but oh well a farewell gift to,t plan to post but oh well a farewell gift to .
277,farewell my beloved,farewell murhandziwa wa mina .
278,the set premonition of the couple is farewell,set premonition ya mpatswa lowu i farewell .
279,farewell and,ku wisa na .
280,i just to see you one last time to say my farewell place a soft kiss to katsuki is forehead before away sleep tight until you wake up its all over de despite already being onto his beloved still trying to,i just to see you one last time to say my farewell place a soft kiss to katsuki is forehead before away sleep tight ku kondza u pfuka all over de despite already being onto his beloved still trying .
281,farewell transmission on converge radio,ku hundziseriwa ka ku wisa eka converge radio .
282,farewell legend of the,ku wisa ntsheketo wa .
283,i do not fear your farewell i fear the desolation that my soul to know that i will no longer be able to get lost in your or to melt on your skin,a ndzi chavi ku wisa ka wena ndzi chava ku onhaka ka leswaku moya wa mina ku tiva leswaku a ndzi nge he swi koti ku lahleka eka wena kumbe ku n’oka eka nhlonge ya wena .
284,_art i will just assume you are trolling at this point farewell and good,_art ndzi ta ehleketa ntsena leswaku u trolling eka nkarhi lowu wo wisa na kahle .
285,now i bid you farewell rice lover,sweswi ndzi ku bida hi murhandzi wa rhayisi wo wisa .
286,his were 'farewell mistress ' nothing else,ya yena a ku ri 'farewell mistress ' a ku na swin'wana .
287,it was such a great time although i might consider to dye it back next year but it is enough for now thanks i will be waiting for your proper farewell any time you decide to dye it into different color,a ku ri nkarhi lowunene swonghasi hambi leswi ndzi nga ha ehleketaka ku yi daya endzhaku lembe leri taka kambe yi ringanerile sweswi ndza khensa ndzi ta va ndzi yimele ku xeweta ka wena loku faneleke nkarhi wun’wana ni wun’wana loko u endla xiboho xo yi daya yi va muvala wo hambana-hambana .
288,i am some trouble on that day because will be bade a nasty farewell,ndzi na xiphiqo xo karhi hi siku rero hikuva ndzi ta fade a nasty farewell .
289,if u do not want to be at or u do not love then me and leave me alone and farewell,loko u nga lavi ku va at kumbe u nga rhandzi mina ndzi ndzi tshika ndzi ri ndzexe ndzi farewell .
290,_en because they are totally going to read every single comment and care about one person saying the art is ugly go off i guess i didnt get to argue about my opinion on art so i bid you a farewell,;
291,farewell bye,ku wisa ka bye .
292,not even a farewell party he d a personal party for this weekend at his and grace residence but was so it instead it this another lie,a hi hambi ku ri nkhuvo wo wisa u d a personal party for this weekend at his and grace residence kambe a ku ri so it instead it this another lie .
293,yeah it that way s finale was pretty wild we also bid farewell to our friend pete,yeah it that way s finale was pretty wild hi tlhele hi wisa munghana wa hina pete .
294,impossible here where we have the you say farewell to someone and half an hour later you are still talking to them,impossible laha hi nga na wena the say farewell to someone and half an hour later wa ha vulavula na yena .
295,farewell,lelana
296,farewell you beautiful plush cat you brought to more than you could possibly ever know,farewell you beautiful plush cat leyi u yi tiseke ku tlula leswi u nga swi tivaka
297,dude really to party the government an emergency meeting on to discuss for the heat but prime minister who is stepping down reportedly did not attend instead to hold a farewell party,dude really to party the government an emergency meeting on to discuss for the heat but prime minister loyi a nga tshika ntirho ku vikiwa leswaku a nga va kona ematshan'wini ya sweswo ku khoma vandla ro wisa .
298,should say something but it is not going to be me i am disappointed that we had an opportunity to make change and instead blocked everyone who his personal change and accountability tiring troubling absolutely predictable adieu music farewell,should say something but a swi nge vi mina ndzi khunguvanyekile leswaku hi vile na nkarhi wo endla ku cinca naswona ematshan’wini ya sweswo hi sivele un’wana na un’wana loyi ku cinca ka yena ka munhu hi xiyexe na vutihlamuleri swi karhataka troubling absolutely predictable adieu music farewell .
299,that is her farewell dinner,sweswo i swakudya swa yena swa ni madyambu swo wisa .
300,farewell soldier,socha ro wisa .
301,_taylor let is not forget her farewell tour in which she flew all over canada to swim in each ocean and great lake,.
302,the and i bid you a farewell good night,the na mina ndzi mi bidhile vusiku bya kahle .
303,_ the farewell,_ ku wisa .
304,if that is it for in regular season one of to hit goal mark other is villa golden boot winner and finalist in cup winner in current golden boot leader,loko sweswo swi ri swona for in regular season one of ku ba goal mark yin'wana i villa golden boot winner na finalist eka cup winner eka current golden boot leader .
305,we don t belong to the word farewell,a hi vi wa rito leri nge farewell .
306,farewell party i feel like i m missing some here,farewell party ndzi twa onge ndzi mi pfumala swin'wana laha .
307,farewell,lelana
308,farewell went,ku wisa ku fambile .
309,i have no one like him when was in prison and martyrdom he his faithful friend timothy for a last farewell,a ndzi na munhu wo fana na yena loko a ri ekhotsweni ni ku dlayiwa hikwalaho ka ripfumelo yena munghana wa yena wo tshembeka timothy for a last farewell .
310,farewell transmission on converge radio,ku hundziseriwa ka ku wisa eka converge radio .
311,its was real and it is was fun but when you realize that you are just a pawn in the game you focus on family not no posting on an so with that i say farewell twitter,its was real and it is was fun but loko u swi vona leswaku u pawn ntsena eka ntlangu u focus eka ndyangu not no posting on an with that i say farewell twitter .
312,after days of touring and other we made it to the farewell dinner the perfect ending to a great first tour,endzhaku ka masiku ya ku famba-famba ni swin’wana hi swi kotile ku ya eku wiseni swakudya swa ni madyambu leswi nga ni makumu lama hetisekeke ya riendzo ro sungula lerinene .
313,sexual farewell,ku wisa hi tlhelo ra rimbewu .
314,i was not a fan of trump at first i thought for sure he was get our bombed off the face of the earth but when i saw that video of him bidding kim un farewell i said huh maybe this guy is not so bad,a ndzi nga ri muyingiseri wa trump eku sunguleni ndzi ehlekete hi ku tiyiseka leswaku u khomiwe hi tibomo ta hina emahlweni ka misava kambe loko ndzi vona vhidiyo yoleyo ya yena a ri karhi a wisa kim un farewell ndzi te huh maybe this guy is not so bad
315,i just to see in las for his final farewell,mina ntsena ku vona e las eka ku wisa ka yena ko hetelela .
316,nu kink white farewell to the fairground,nu kink white farewell ku ya fika endhawini ya nkombiso .
317,how about this will be autonomous as well as in about your will soon smell of your own urine as you lay in your own little prison cell have you not your world getting smaller farewell little man,xana leswi swi ta va swi tifuma swin’we ni le ka ku navela ka wena ku nga ri khale ku nun’hwela nchuluko wa wena loko u etlele exitokisini xa wena lexitsongo xa khotso a wu na wena misava ya wena yi kuma ku wisa lokutsongo little man .
318,to you still beautiful even after death i say my farewell,eka wena wa ha sasekile hambi endzhaku ka rifu ndzi ri farewell ya mina .
319,belief and that is farewell it evil it is i and we parted _,ripfumelo na sweswo i farewell it evil i mina naswona hi hambanile _ .
320,wrote about who scored in  is first win over at red bull arena since and it is very likely that the match might be his last for the club,u tsarile hi leswaku i mani loyi a nga nghenisa eka is first win over eka red bull arena ku sukela naswona swi nga endleka swinene leswaku ntlangu wu nga va wo hetelela eka xipano .
321,_dann _official i hope he comes back for one last dance and a grand farewell,_dann _official ndzi tshemba leswaku u vuya eka ncino wun'we wo hetelela na ku wisa lokukulu .
322,as farewell gift want for smooth running of chairman,as farewell gift want for ku famba kahle ka mutshama-xitulu .
323,farewell,lelana
324,can th come any faster i see that plane getting a farewell with lots of sad how they to raise fund for her dream to fulfill,can th come any faster i vona xihahampfhuka xexo xi kuma ku wisa hi ku va na gome ro tala ndlela leyi va nga ta hlengeleta mali ha yona leswaku norho wa yena wu hetisisa .
325,maybe i am awkward but farewell,kumbexana ndzi awkward but farewell .
326,sexual farewell god on most high,ku wisa ka rimbewu xikwembu eka xiyimo xa le henhla swinene .
327,farewell sweet cruelty,farewell sweet cruelty .
328,farewell to the nightingale hello to the lark,ku wisa eka nightingale hello ku ya eka lark .
329,farewell my alma matter,farewell my alma matter .
330,today we said farewell to the with a late hit for yellowtail no for our upcoming offshore we will be tuna yellowtail and dorado,namuntlha hi vule ku wisa hi na late hit for yellowtail no eka offshore ya hina leyi taka hi ta va tuna yellowtail na dorado .
331,of farewell to oban fame was a policeman who never once made an arrest during his entire career,ya ku wisa ndhuma ya oban a ku ri phorisa leri nga si tshamaka ri khomiwa kan’we hi nkarhi wa ntirho wa yena hinkwawo .
332,they now bade farewell to the kind but unseen people of the cottage and after the man had their attention to a high pyramid shaped mountain on the opposite side of the valley and told them how to travel in order to reach it they again upon their journey,sweswi va lerise vanhu va muxaka kambe va nga voniwi va xiyindlwana naswona endzhaku ka loko wanuna loyi a vangiwe hi ntshava leyi nga ni xivumbeko xa piramidi leyi tlakukeke etlhelo lerin’wana ra nkova ivi va va byela ndlela yo famba leswaku va ta tlhela va yi fikelela loko va ri karhi va famba hi riendzo ra vona.
333,live your life watch the sunrise in the mornings drink plenty of water smile at the because they will not understand this token of kindness the entire world is on your side do not worry you will be safe farewell,live your life watch the sunrise in the mornings nwa mati yo tala ku n'wayitela ka mati eka hikuva a va nge twisisi xikombiso lexi xa musa misava hinkwayo yi le tlhelo ka wena u nga vileli u ta va u hlayisekile
334,i mean do not get me wrong i want to see a solid farewell to cap'n jack sparrow,ndzi vula leswaku u nga ndzi twi ku biha ndzi lava ku vona ku wisa loku tiyeke eka cap'n jack sparrow .
335,farewell to a legend we say to and talk the big win against,farewell to a legend hi ri ku na ku vulavula hi ku hlula lokukulu ku lwisana na .
336,_yukiheart _wdf so farewell el and weather painter aurora,_yukiheart _wdf so farewell el na muvalangi wa maxelo aurora .
337,its after dark come out while we bid farewell _streamers,its after dark come out loko hi ri karhi hi xeweta _streamers .
338,my urge to give early farewell to my,nsusumeto wa mina wo wisa ka ha ri ni nkarhi eka mina .
339,farewell my concubine directed by a historical piece in china largely about a friendship between men of the opera beginning in we see the civil war the cultural revolution unfold through their friendship,farewell my concubine leyi kongomisiweke hi xiphemu xa matimu echayina ngopfu ngopfu hi vunghana exikarhi ka vavanuna va opera ku sukela hi vona nyimpi ya le xikarhi ka matiko nhundzu ya ndhavuko yi humelela hi vunghana bya vona
340,change of edward is farewell with impartiality on the door she had been under every pleasant might result of his,ku cinca ka edward i ku wisa hi ku pfumala xihlawuhlawu enyangweni lowu a a ri ehansi ka vuyelo byin’wana ni byin’wana lebyi tsakisaka bya yena .
341,another farewell,ku wisa kun’wana .
342,to other player who found the farewell lulu wang in s,eka mutlangi un’wana loyi a kumeke ku wisa lulu wang eka s .
343,thank you to and for hosting a farewell celebration for _cabello the chile boston connection remains as vibrant as ever looking forward to many more in the future,ndza khensa na ku khoma nkhuvo wo wisa eka _cabello the chile boston connection yi tshama yi ri leyi hanyaka ku fana na leswi nga tshama swi langutela swin’wana swo tala enkarhini lowu taka
344,we never set out to change people is but it that way down with the rest of the group for interview but is not going to be a part of the farewell tour,a hi si tshama hi tiyimisela ku cinca vanhu is but it that way down with the rest of the group for interview but a swi nge vi xiphemu xa farewell tour .
345,result sent convulsion to and their especially in state the jittery is becoming loud that they are ready to punish everybody and pack their farewell he is not coming back again on my mind,result sent convulsion to and their especially in state jittery yi sungula ku twala leswaku va lunghekele ku xupula vanhu hinkwavo no paka ku wisa ka vona a nga ha vuyi nakambe emiehleketweni ya mina .
346,_updates pooch farewell party,_updates pooch farewell party .
347,tread in farewell fell in bread,tread in farewell yi wele hi xinkwa .
348,farewell,lelana
349,farewell to all the earthly remains,ku wisa eka masalela hinkwawo ya misava .
350,bin made a personal farewell to president bin at airport he t there for,bin u endle ku wisa ka munhu hi xiyexe eka president bin erivaleni ra swihahampfhuka he t there for .
351,good night century s farewell,vusiku lebyinene century s farewell .
352,farewell to the one and only goat of,farewell to the one and only mbuti ya .
353,you seem pretty of your arms time to bid them farewell,u vonaka u sasekile hi mavoko ya wena nkarhi wo va xeweta .
354,farewell to a very nice time,farewell to nkarhi wo tsakisa swinene .
355,the farewell,ku wisa .
356,farewell,lelana
357,though life is merely a journey to the grave it must not be without hope only then will a traveler is story live on by those who bid him farewell,hambi leswi vutomi byi nga riendzo ro ya esirheni ntsena a ri fanelanga ri va handle ka ntshembo ntsena hi kona laha mufambi a nga ta va xitori hi ku kongoma hi lava va n’wi xewetaka
358,''gretel'' ''hänsel'' who wander the graveyard they bid farewell to the world of the dead and search for new,''gretel'' ''hänsel'' lava famba-fambaka esirheni va wisa misava ya vafi va lava leswintshwa .
359,it is one more dance and then farewell cheek to cheek in hell with a dead girl,i ku cina kun’we nakambe ivi u wisa marhama u ya marhama etiheleni ni nhwanyana la feke .
360,_neo _enhorn ah farewell and thanks for everything today i look forward to chatting with you more you re all cool,_neo _enhorn ah farewell and ndza khensa eka hinkwaswo namuntlha ndzi langutele ku burisana na wena more you re all cool
361,sports everywhere on my man is opinion column open wild best in sports skid to all star break hacksaw is open farewell tiger i cover every team every story link,mintlangu hinkwako eka munhu wa mina i kholomo ya mavonelo open wild best in sports skid to all star break hacksaw is open farewell tiger i cover every team every story link
362,i her in the like farewell episode too and how she about that even if i am curious to see if she had anything interesting to say,i her in the like farewell episode too and how she about that hambi ndzi lava ku vona loko a ri na nchumu wo tsakisa wo wu vula .
363,sexual farewell,ku wisa hi tlhelo ra rimbewu .
364,my last farewell promo_my last fare well,my last farewell promo_my last fare kahle
365,as always you the house suck when you do a farewell tour but best bet your ass i be there for it keep on rocking hard,as always you the house suck loko u endla farewell tour kambe best bet xitombo xa wena ndzi va kona for it keep on rocking hard .
366,we are by life itself we who simply like the idea of the word a little too much with no knowledge of a true farewell are by life itself,hi hi vutomi hi byoxe hina lava hi tsakelaka ntsena mianakanyo ya rito hi ku tlula nyana hi nga ri na vutivi bya ku wisa ka ntiyiso hi vutomi hi byoxe .
367,today is day for muhammadi those who obey have to obey of th on the way back from farewell by prophet taken a from muhammadi at site of oath is man fa,namuntlha i siku eka muhammadi lava va yingisaka va fanele ku yingisa th endleleni yo vuya hi le ku xeweteni hi muprofeta taken a ku suka emuhammadi eka ndhawu ya xihlambanyo i munhu fa .
368,easy to get a really awesome sword he admitted but maybe we can forge you something similar well she spoke a little more to the phantom she came across eventually waving farewell as she to near the exit once again the other two,easy to get a really awesome sword he admitted but maybe hi nga ku forge swin'wana swo fana na leswi a swi vulavula nyana hi phantom leyi a nga hlangana na yona eku heteleleni a wave farewell as she to near the exit once again the other two .
369,why is good morning a greeting and why is good night a farewell,ha yini good morning yi ri ku xeweta naswona ha yini good night a farewell .
370,i m play the doom equivalent of celeste s farewell this week so much fun,i m tlanga doom leyi ringanaka na celeste s farewell vhiki leri so much fun .
371,i just to see in las for his final farewell,mina ntsena ku vona e las eka ku wisa ka yena ko hetelela .
372,one for the road restless farewell the glass,yin’we ya patu ku nga tshamisekanga ku wisa nghilazi .
373,everyone thank you all so much for everything you have done to help me whether you were aware of it or not i will be back in love you all farewell o,hinkwenu va khensa hinkwenu swinene eka hinkwaswo leswi mi swi endleke ku ndzi pfuna hambi mi swi tiva kumbe e-e ndzi ta tlhelela eka rirhandzu ra n'wina hinkwavo ku wisa o .
374,hopefully her own farewell song,hi tshemba leswaku risimu ra yena ro wisa .
375,farewell to book by d and is one of my,farewell to book hi d naswona i un'wana wa mina .
376,most of them leave long before they say some of them are so used to farewell that they never even unpack their they show up with a half smile ready for their half stay offering their half love and ask to share your half life,vunyingi bya vona va famba khale va nga si vula leswaku van’wana va vona va tolovele ku wisa lerova a va si tshama va pfula hambi ku ri ku pfula ka vona va humelela hi ku n’wayitela ka hafu va lunghekele ku tshama hafu ya vona va nyikela hi rirhandzu ra vona ra hafu ni ku kombela ku avelana hafu ya vutomi bya wena
377,vice president 'farewell gift' in form of  ameaningful and productive',xandla xa phuresidente wa 'farewell gift' hi xivumbeko xa ameaningful and productive'.
378,farewell food tour with a from and some coke zero because i m out and i have a problem,farewell food tour na a from and some coke zero hikuva i m out and ndzi na xiphiqo .
379,we did this with argosy for my grandfather they kept the rear of the boat clear and let us do our thing as we his ashes into the sound they around all of us in the wake as kind of a last farewell it s nice when allow for these of,hi endle leswi na argosy eka kokwa wa mina va hlayise le ndzhaku ka xikepe xi ri erivaleni naswona a hi endleni ka swilo swa hina loko hina nkuma wa yena hi nghena eka mpfumawulo lowu va hi rhendzeleke hinkwerhu hi ku pfuka tanihi muxaka wa ku wisa ko hetelela it s nice loko ku pfumeleriwa eka leswi . ya
380,v rock is my favorite out of their trilogy so much weight and so much on the line but in the end it was a fitting farewell until later memorable finale,v rock i favourite ya mina out of their trilogy so much weight and so much on the line kambe eku heteleleni a ku ri ku wisa loku faneleke ku fikela endzhaku ka nkarhi memorable finale .
381,thank you to former s and miss for s hosting the most royal farewell for the current sisterhood advice great food t until check in for,ndza khensa eka khale ka s na miss eka s ku rhurhela ku wisa ka royal ngopfu eka xitsundzuxo xa sweswi xa vumakwerhu bya xisati great food t ku fikela loko u nghena eka .
382,jimmy farewell,jimmy ku wisa .
383,tool fear inoculum primus farewell to rush r,xitirhisiwa ku chava inoculum primus ku wisa ku tsutsumela r .
384,this is something general needs to remember return to their especially those retiring for they have not sent out a farewell thank you letter to anyone retiring these are the very hit in s bankruptcy,leswi i nchumu wo angarhela lowu faneleke ku tsundzuka ku tlhelela eka vona ngopfu-ngopfu lava va nga eku wiseni hikuva a va rhumelanga papila ro nkhensa ro wisa eka mani na mani loyi a tshikaka ntirho hi yena loyi a nga hlaseriwa swinene hi s bankruptcy .
385,please seek medical assistance farewell,hi kombela u lava mpfuneto wa swa vutshunguri wo wisa .
386,i just to see in las for his final farewell,mina ntsena ku vona e las eka ku wisa ka yena ko hetelela .
387,even though this is the dawn of our farewell it like the sun set on our separation and the night of our union is at hand,hambi leswi ku nga ku sungula ka ku wisa ka hina ku fana na dyambu leri pendiweke eka ku hambana ka hina naswona vusiku bya nhlangano wa hina byi le kusuhi .
388,then i say farewell and good hunting i hope you find what you re looking for just know that you can lose yourself to revenge,kutani ndzi vula farewell and good hunting ndzi tshemba leswaku u kuma leswi u swi lavaka ntsena swi tiva leswaku u nga lahlekeriwa hi wena n'wini ku rihisela .
389,she felt awful leaving him out of the blue without saying farewell or him,u titwe a bihile swinene a n’wi siya a huma hi le ka blue a nga vulanga ku wisa kumbe yena .
390,farewell fountain street,xitarata xa xihlovo xa ku wisa .
391,evil and that damn device the i am still about was farewell with save me from the underworld,evil and that damn device the i am about a ku ri ku wisa na save me ku suka emisaveni ya vafi .
392,farewell pepper lip smacker,farewell pepper smacker .
393,i m at the first farewell i m not ready to see the end of the,i m at the first farewell i m a ndzi lunghekanga ku vona makumu ya .
394,thanks for sticking with me until today this is farewell have a nice dream see you in hell,thanks for sticking with me until today this is farewell have a nice dream see in hell
395,so long farewell bye bye penny,so long farewell bye bye peni .
396,what and cut into our farewell party and time,i yini na ku tsemiwa eka nkhuvo wa hina wo wisa na nkarhi .
397,to my father thank you to my mother farewell and to all the,eka tatana ndzi khensa manana wo wisa na le ka hinkwavo .
