,src,trg
2896,god will send thunder with gonorrhea to anyone that t vote in the,xikwembu xi ta rhumela ku dzindza ka tilo na gonorrhea eka mani na mani loyi t a vhotaka eka .
2897,during the promotion of his upcoming film in the national capital star about the song from his movie getting,hi nkarhi wa ku tlakusa filimi ya yena leyi taka eka the national capital star mayelana na risimu ra filimi ya yena getting .
2898,the best switch of,swiwitsi leswinene ngopfu swa .
2899,mero the late night talk show on won t be for a fifth season,mero the late night talk show on won t be for a fifth season
2900,for me it on what i m doing work definite background noise but at home it s an opportunity to be social and meet people as well as watch be on the for entertainment i m all over the map when it comes to twitch but i m grateful for all of it,for me it on what i m ​​doing work definite background noise but at home s s an opportunity to be social and meet people as well as watch be on the for entertainment i m hinkwako emepeni loko swi ta eka ku rhurhumela kambe ndzi m grateful for all of it .
2901,creative trapped in her own reality got a fast flexible and innovative mind if she she will make up a whole story for her own entertainment you can hear her say wow at least times in class because knowledgement her she will never be full of it,creative trapped in her own reality got a fast flexible and innovative mind loko a ta endla xitori hinkwaxo xa vuhungasi bya yena n’wini u nga n’wi twa a ku wow at least minkarhi etlilasini hikuva vutivi bya yena a nge pfuki a tele hi byona .
2902,should be in the rock and roll hall of fame,swi fanele swi va eholweni ya ndhuma ya rock and roll .
2903,while the twist of  ams marvel' about the future of the head writer k inverse the real heart of the story is in kamala is family i m not interested in an us versus them story i m interested in an us story,loko ku ri ku soholota ka ams marvel' mayelana na vumundzuku bya mutsari wa nhloko k inverse mbilu ya xiviri ya xitori yi le ka kamala i ndyangu i m a nga tsakeli eka us versus them story i m interested an us story
2904,after calling city boy singer jagaban is son trend,endzhaku ko vitana xiyimbeleri xa le dorobeni ra vafana jagaban i n'wana wa mufana trend .
2905,live action series entertainment news magazine variety on that netflix is upcoming live action series based on togashi is manga cast actor click photo for more,nxaxamelo wa swiendlo leswi hanyaka entertainment news magazine ku hambana-hambana eka leswaku netflix i nongonoko lowu taka wa swiendlo leswi hanyaka leswi sekeriweke eka togashi is manga cast actor click photo for more
2906,'base one' is a pioneer in port harcourt is entertainment industry with multiple music video for his work and several currently making in the industry base one made an indelible mark in the entertainment it sector in southern,‘base one’ i phayona eport harcourt i indasitiri ya vuhungasi leyi nga na vuyimbeleri byo tala bya vhidiyo ya ntirho wa yena naswona vo hlayanyana lava sweswi va endlaka eka xisekelo xa indasitiri yin’we va endle mfungho lowu nga heriki eka xiyenge xa ​​it xa vuhungasi edzongeni .
2907,cheeky too broad mate in our life everything is entertainment,cheeky too broad mate evuton'wini bya hina hinkwaswo i vuhungasi .
2908,up with at his successful release for his latest out now check it out n to for the latest,up with at his successful release for his latest out now check it out n to for the latest
2909,__ that s entertainment that s not his real life,__ that s vuhungasi lebyi s not his real life .
2910,s chief equity officer j s breakfast club and and law firm in,s muofisirinkulu wa equity j s breakfast club na na feme ya nawu eka .
2911,singer boy debut performance in get the latest on entertainment news and all you love with mobile,muyimbeleri boy debut performance in get the latest on entertainment news na hinkwaswo leswi u swi tsakelaka hi mobile
2912,in near and the city of booked entertainment by jeff sterling for artist availability in,eka kusuhi na doroba ra booked entertainment hi jeff sterling eka ku kumeka ka vatshila eka
2913,i can not bear to listen to this dinosaur what is in it for him why deny just accept and fix these people get brought on again and again for entertainment to mock the only people doing anything with any real urgency must stop listening to these awful old men,a ndzi nge swi koti ku tiyisela ku yingisa dinosaur leyi leswi nga eka yona eka yona why deny just accept and fix vanhu lava va tisiwa hi ku phindha-phindha leswaku va ta tihungasa ku hlekula vanhu ntsena lava endlaka nchumu hi xihatla xihi na xihi xa xiviri va fanele ku tshika ku yingisela vakhalabye lava vo chavisa .
2914,do you remember we used to give photo for entertainment,xana wa tsundzuka hi tshame hi nyika xifaniso xa vuhungasi .
2915,i don t think give about reputation the way left is good entertainment,i don t think give about ndhuma hi ndlela leyi saleke i vuhungasi bya kahle .
2916,blizz radio blizz the pearl post the pearl directory those are all of blizz entertainment limited as you have always done we seek your support blizz radio face the music,blizz radio blizz the pearl post the pearl directory hinkwato i ta blizz entertainment limited tani hi leswi u tshameke u endla swona hi lava nseketelo wa wena blizz radio face the music
2917,my me why i always need my phone to go to the bathroom like girly t know i spend on the toilet every time i poop it s for entertainment,mina wa mina why ndzi tshama ndzi lava foni ya mina ku ya bathroom like girly t know i spend on the toilet every time i poop it it it for entertainment
2918,untitled is harmless for the most part but always looking for entertainment,untitled a yi na khombo eka xiphemu lexikulu kambe minkarhi hinkwayo u lava vuhungasi .
2919,jazz festival review assembly roxy by,jazz festival review assembly roxy hi .
2920,_boubel were used all over i was based in the bay area extremely handy all displayed brother is,.
2921,she is missing' of her brain after surviving two,u pfumala' ya byongo bya yena endzhaku ko pona vambirhi .
2922,got a business degree in and entertainment management please hire me instead,got a business degree eka na vufambisi bya vuhungasi ndzi kombela u ndzi thola ematshan'wini ya sweswo .
2923,_gypsy _teekeemon _lilith when one is a l w supporter news is too much for their brains to handle they need mindless entertainment like tuckum is,.
2924,and that too lo background voice specific ga but still its in top in entertainment sector,na leswaku too lo background voice specific ga kambe still its in top in entertainment sector .
2925,news star all area entertainment hello green light _pppat,mahungu nyeleti hinkwaswo vuhungasi bya ndhawu hello green light _pppat
2926,people always block people or them not me i like to close closer it s crazy to see how much people block and bash in the hobby he to high she s a liar they are it s entertainment for me card game is modern day,vanhu va tshama va blocka vanhu or them not me i like to close closer it s crazy ku vona ku vanhu va blocka ku fikela kwihi na bash eka hobby he to high she s a liar they are it s entertainment for me card game is modern day
2927,this is,leswi i
2928,and all the sheep driving w b c gas cheer at their own harm demise and of for may i have more please the self of the resistance cult is the very best in entertainment,na tinyimpfu hinkwato leti chayelaka w b c gasi cheer at their own harm demise and of for may i have more please the self of the resistance cult is the best in entertainment
2929,are you no prosecution for for u s,xana a wu na vuchuchisi for for u s .
2930,a change to the ornate main at the library of congress that say remove the symbolic funct'l heart of the beaux masterpiece landed the on the d c preservation league s list of most,ku cinca eka main yo khavisiwa elayiburari ya congress loku nge susa mbilu yo fanekisela ya ntirho wa beaux masterpiece yi fike yi fika eka nxaxamelo wa le ka d c preservation league s wa vunyingi
2931,singer up about being a rubbish collector before getting fame,singer up hi ku va muhlengeleti wa thyaka a nga si kuma ndhuma .
2932,staged for sure,staged for sure .
2933,entertainment are profit money comes first people second this leaves feeling and no industry is an exception and whoever to see that has not maturity,entertainment are profit money comes first people second leswi swi siya feeling and ku hava indasitiri i exception and who everes to see that has not maturity
2934,cool my who i literally last week watched get by the and all the homeless people downtown must feel secure with your proper understanding of the entertainment district and the promise that extra will actually help this time,cool my who i literally last week va hlalerile get by the na hinkwavo vanhu lava pfumalaka makaya exikarhi ka doroba va fanele ku titwa va sirhelelekile hi ku twisisa ka wena loku faneleke ka xifundzha xa vuhungasi na xitshembiso xa leswaku extra entiyisweni yi ta pfuna nkarhi lowu
2935,unique to try in from a german beer hall to via,ku hlawuleka ku ringeta ku nghena ku suka eka holo ya biya ya le jarimani ku ya eka via .
2936,ex police chief in reference to location rip off case news all map,ex police chief hi ku kombetela eka ndhawu rip off case news all map
2937,i know he is a total but i have to give him a for sheer entertainment value the man is a lot of fun to watch,ndza swi tiva leswaku i total kambe ndzi fanele ndzi n'wi nyika a for sheer entertainment value wanuna u tsakisa ngopfu ku hlalela .
2938,_pup unvaccinated are to test for many medical work school travel entertainment there are many where unvaccinated are to test are not it is extremely odd for you to not know this imply otherwise,_pup unvaccinated are to test for many medical work school travel entertainment ku na vo tala laha va nga tshunguriwangiki va nga ta kamberiwa kona are not it is extremely odd for you to not know this imply otherwise
2939,nothing can beat true definition of a mass movie with proper commercial content and entertainment,a ku na nchumu lowu nga hlulaka nhlamuselo ya ntiyiso ya filimi ya vanhu vo tala leyi nga ni swilo leswi faneleke swa mabindzu ni vuhungasi .
2940,running as deputy for different political in their state of origin,ku tsutsuma tanihi mupfuni wa tipolitiki to hambana eka xiyimo xa vona xa masungulo .
2941,the pair break up before their one year anniversary,vambirhi lava va hahluka va nga si sungula ku tlangela lembe rin’we .
2942,i think i have a certain amount of anonymity being from and probably not many people knowing me new village trustee said i just want to do what s best for the village and i have zero agenda,ndzi ehleketa leswaku ndzi na nhlayo yo karhi ya ku nga tiviwi ka vito ku suka eka naswona kumbexana a hi vanhu vo tala lava ndzi tivaka mutshama-xitulu lontshwa wa muganga va vule leswaku ndzi lava ntsena ku endla leswi s best for the village naswona ndzi nga na zero agenda .
2943,this month is jam with incredible street and boasting fabulous food and entertainment for the whole family get the complete guide to s can t miss and now,n’hweti leyi i jam na xitarata xo hlamarisa na ku tinyungubyisa hi swakudya swa xiyimo xa le henhla na vuhungasi eka ndyangu hinkwawo kuma nkongomiso lowu heleleke wa s can t miss and now .
2944,the most entertaining player ever to grace the surface of the earth if football is purely for entertainment i would pay a fortune to watch him play everyday,mutlangi wo tsakisa swinene loyi a nga tshama a khavisa vuandlalo bya misava loko bolo ya milenge yi ri ya vuhungasi ntsena a ndzi ta hakela mali yo tala yo n’wi hlalela a tlanga siku na siku .
2945,because that is what when you raise a generation with entertainment that is no better than,hikuva hi swona leswi loko u kurisa xitukulwana hi vuhungasi lebyi nga antswiki ku tlula .
2946,it good on you sound sultan s wife late husband s trousers in photo react,it good on you sound sultan s nsati wa yena la nga lova buruku eka xifaniso react
2947,this is the one royal 'hated being compared' to,leyi i yin’we ya vuhosi leyi ‘vekiweke yi pimanisiwa’ na .
2948,here is the link to yoongi is,hi leyi link ya yoongi is .
2949,in today is game market what really need is an game with enough entertainment value of the vision of balancing two key of play and earn always been the top concern of how will game team focus on this,eka namuntlha i game market leswi swi lavaka hakunene i ntlangu lowu nga na nkoka wo ringana wa vuhungasi bya xivono xa ku ringanisela swilotlelo swimbirhi swa ntlangu na ku hola minkarhi hinkwayo a ku ri ku vilela lokukulu ka ndlela leyi xipano xa ntlangu xi nga ta kongomisa ha yona eka leswi .
2950,where in the universe am i,laha evuakweni hinkwabyo am i .
2951,the down in touching post as she,the down in touching post as yena .
2952,good to see henry keeping cool like you i can not imagine the suffering that are in this heat on shooting and those being for entertainment,good to see henry keeping cool like you a ndzi nge swi koti ku ehleketa ku xaniseka loku nga eka ku hisa loku eka ku duvula na lava va nga ku tihungasa .
2953,_realist pretty vague i love golf has not been the best or most entertaining golf thus far i have watched all and have been i at the open for the extra but that been the peak of entertainment,.
2954,but i have to say is serious entertainment,kambe ndzi fanele ndzi vula leswaku i serious entertainment .
2955,prime video prime time entertainment,prime video vuhungasi bya nkarhi wa nkoka .
2956,it s be this announce of new album sun,it s be this announce ya album leyintshwa sun .
2957,he t need to do an audition for fox entertainment,u fanele ku endla audition ya fox entertainment .
2958,more people need to watch the most fi show on prime video,vanhu vo tala va fanele va hlalela nongonoko wo tala wa fi eka prime video .
2959,he he s royalty that canada is his he us to pay for his luxury and entertainment and be happy about it once he s removed we need to sue raid dismantle the foundation for every dime and recoup as much of what he stolen as possible,he he s royalty that canada is his he us ku hakela vulovolovo bya yena na vuhungasi na ku tsaka hi swona loko a susiwile hi lava ku mangalela raid dismantle the foundation for every dime and recoup as much of what he syeple anges po maccouse .
2960,no no we can not tell them how else can we reduce reuse recycle their for our communal enrichment and entertainment,hayi hayi a hi nge va byeli leswaku hi nga hunguta njhani swin’wana ku tirhisiwa nakambe ka vona ka vona eka ku fuwisa ka hina ka vaaki na vuhungasi .
2961,this coming we are on stage with echo chamber for summer music festival come join us,this coming hi le xitejini na echo chamber for summer music festival come hi hi joyina
2962,why on my 'weekend' from work am i thinking to dust and polish and rearrange my entertainment center sickening i tell you,why on my 'weekend' from work am i thinking to dust and polish and rearrange my entertainment center sickening i tell you
2963,in the and my only source of entertainment is and staring at a fireplace,eka na xihlovo xa mina ntsena xa vuhungasi i na ku languta ndhawu yo hisela ndzilo .
2964,young people coming out is admirable but i imagine how harder and braver it must be for older people to come out as part of the community whether or gay or or whatever queer identity one n,vantshwa lava humaka swa bumabumeriwa kambe ndzi ehleketa leswaku swi fanele swi tika no va na xivindzi ku fikela kwihi leswaku vanhu lavakulu va huma tanihi xiphemu xa vaaki hambi kumbe gay kumbe kumbe kumbe kwihi na kwihi queer identity one n .
2965,mount for pure entertainment only via,ntshava ya vuhungasi byo basa ntsena hi ku tirhisa .
2966,whoa to see this back up and running,whoa ku vona leswi back up na ku tsutsuma .
2967,wait you mean to tell me wasnt always there for entertainment,wait u vula ku ndzi byela wasnt always there for entertainment .
2968,this the st i be providing the opening entertainment for the grand re opening of cinema w th st this is the movie premiere of jordan peele s nope i kick off at movie at p c u out,this the st i be provide the opening entertainment for the grand re opening of cinema w th st leyi i premiere ya filimi ya jordan peele s nope leyi ndzi yi sungulaka eka filimi eka p c u out .
2969,_purplekiss entertainment solo concept photo purple kiss _to_geekyland _kiss _purplekiss,_purplekiss vuhungasi solo concept xifaniso xa xitshopani kiss _to_geekyland _kiss _purplekiss
2970,actress nana ama to after united saga,mutlangi wa swifaniso nana ama to after united saga
2971,a lot of u think i m fake but i m real deal so come get your entertainment here,a lot of u think i m fake kambe ndzi m real deal so tana u ta kuma vuhungasi bya wena laha .
2972,i mean about you but i as a listener of only enjoy spending listening to people read talking about based on said and immediately after talking about by fan ambivalence and nothing else this is entertainment,ndzi vula hi wena kambe mina tani hi muyingiseri wa ku tsakela ntsena ku heta nkarhi wo yingisela vanhu va hlaya ku vulavula hi ku ya hi ku vuriwa na hi ku hatlisa endzhaku ko vulavula hi hi fan ambivalence naswona a ku na swin’wana leswi i vuhungasi .
2973,after saying he no with singer jagaban is son trend,endzhaku ko vula leswaku e-e na xiyimbeleri jagaban i n'wana trend .
2974,one man is accident failure should not be another is entertainment i would like to eradicate from my social media,wanuna un'wana i ku tsandzeka ka timhangu a nga fanelanga ku va un'wana i vuhungasi lebyi ndzi nga tsakelaka ku byi herisa eka social media ya mina .
2975,job coaching and guest for an entertainment venue,ku letela ntirho na muyeni eka ndhawu yo hungasa .
2976,i m convinced my gang with me for their entertainment only to come to the rescue at the last minute,i m ku khorwisa gang ya mina na mina hi vuhungasi bya vona ntsena ku ta va ta ponisa hi minete yo hetelela .
2977,bishop her risque she may have recently broken up with her long term partner but the still her way around an eggplant,bishop risque ya yena a nga ha va a ha ku hambana na munghana wa yena wa nkarhi wo leha kambe ndlela ya yena yo rhendzeleka ku rhendzeleka na eggplant .
2978,i was for a show not a campaign rally portable african is leading for sports music news and entertainment,i was for a show not a campaign rally portable african is leading for sports music news and entertainment .
2979,_globe the fool from king lear for entertainment from the tempest magic tend to come in handy from a loyal friend and tough fighter to protect me,.
2980,asa is performance was not an entertainment but a protest on our behalf guess those old did not notice thats how dumb and dull they are event and all i see it where are the owner of the oil,asa is performance was not an entertainment but a protest on our behalf guess lavaya va khale a va swi xiyanga thats how dumb and dull they are event and all i see it where are the owner of the oil .
2981,same but only for pure entertainment it s so,same kambe ntsena eka vuhungasi byo basa swi tano .
2982,th committee chairman will miss next hearing after testing positive for covid via,th committee chairman u ta pfumala ku tengiwa ka nandzu lowu landzelaka endzhaku ko kamberiwa a ri na covid via .
2983,_____ would be free entertainment at first but then cry for justice and medical for her,_____ a a ta va vuhungasi bya mahala eku sunguleni kambe endzhaku ka sweswo a rila hi vululami ni vutshunguri hikwalaho ka yena .
2984,you know the entertainment value alone of him crying he was and all the election fraud in republican the chaos that will ensue will be worth it,wa swi tiva nkoka wa vuhungasi ntsena wa yena a ri karhi a rila a ri na vuxisi hinkwabyo bya nhlawulo eka republican mpfilumpfilu lowu nga ta landzela wu ta va wu fanerile .
2985,on full on entertainment,on full on vuhungasi .
2986, is tour back on schedule after his hunt diagnosis check,is tour back on schedule endzhaku ka ku kamberiwa ka yena ka vukamberi bya ku hlota .
2987,i want entertainment,ndzi lava vuhungasi .
2988,i was completely blown away by this surprising paradox which is that are the most people from a distance close up i have never been more as a stranger in b j s movie revenge is a dish best funny,i was completely blown away by this surprising paradox leyi nga vanhu vo tala ku suka eka mpfhuka wo tshinelela ekule a ndzi si tshama ndzi va muendzi eka b j s movie revenge is a dish best funny .
2989,you have never smoked weed ruth na party is said during the president debate that the kind of marijuana they are talking about is not the kind people for,a wu si tshama u dzaha weed ruth na party ku vuriwa hi nkarhi wa president debate leswaku muxaka wa mbangi leyi va vulavulaka hi yona a hi vanhu va musa wa .
2990,people see entertainment but i see pain they are in their late teens to s and they look old and tired i get emotional when i see stuff like this,vanhu va vona vuhungasi kambe ni vona ku vava va le ka late teens to s and va languteka va dyuharile va karhala ni karhi ni emotional loko ni vona swilo swo fana na leswi .
2991,i don t know why we expect much from entertainment good job with outing yourself as a fraud,a ndzi tivi leswaku hikokwalaho ka yini hi langutele swo tala eka vuhungasi ntirho lowunene hi ku tihungasa tanihi vuxisi .
2992,hello good evening everyone our new company is entertainment it is by all of social and corporate organization will be done by our company so kindly please contact us for more information,hello good evening un'wana na un'wana khamphani ya hina leyintshwa i vuhungasi swi le ka hinkwaswo swa nhlangano wa swa matirhiselo ya vanhu na swa mabindzu swi ta endliwa hi khamphani ya hina so musa hi kombela u hi tihlanganisa ku kuma vuxokoxoko byo tala
2993,lovely song too,risimu ro tsakisa na rona .
2994,off her wedding band as she to dance studio after wedding,off her wedding band loko a ri ku cina studio endzhaku ka mucato .
2995,sparks entertainment out  amaid to kill' red carpet tonight _sparks,sparks entertainment out amaid ku dlaya' khapete yo tshwuka vusiku bya namuntlha _sparks
2996,our all weather car magnet your personality and sense of humor everywhere you go may even thank you for the entertainment while stuck in traffic click the button to get yours,magnet ya hina ya all weather car magnet na ku hlekisa hinkwako laha u yaka kona swi nga ha ku khensa hambi ku ri ku tihungasa loko u ri karhi u khomiwa hi le magondzweni click the button ku kuma ya wena
2997,for me it the relationship is getting boring but i still love you let is find entertainment then later we can continue dating pull up your in the land of it wa bora let is end it when your ready,for me it relationship yi sungula ku borha kambe ndza ha ku tsakela ku let is find entertainment then later hi nga ya emahlweni hi jola pull up your in the land bora let is end it when your ready
2998,_ _productions area in the us i would say that in itself is a pretty damn good reason we need to have in event not in hillbilly is a great city with awesome entertainment dining and world class and other tourist,_ _ndhawu ya vuhumelerisi eus ndzi nga vula leswaku hi yoxe i xivangelo lexinene ngopfu lexi hi faneleke ku va na xona eka xiendlakalo lexi nga riki ehillbilly i doroba lerikulu leri nga na vuhungasi byo hlamarisa byo dyela na bya xiyimo xa misava na van’wana va vaendzi .
2999,meet and our junior at an entertainment business offering arcade redemption a play area and a party room for and across all,hlangana na junior wa hina eka bindzu ra vuhungasi leri nyikelaka arcade redemption ndhawu yo tlangela eka yona na kamara ra nkhuvo eka na ku tsemakanya hinkwaswo
3000,journey of self love as she a bikini pic on is the best,journey of self love as she a bikini pic on is the best .
3001,little big town announce of new album sun via,little big town yi tivisa hi alibamu leyintshwa ya sun via .
3002,it is insanity they are degrading the value of entertainment time it is gone past madness it is a infestation,i ku penga va degrade nkoka wa nkarhi wo hungasa it is gone past madness it is a infestation .
3003,check out this home bedroom bathroom home perfect for the st time home buyer or individual looking to just from trail shopping dining and entertainment several fantastic this home,languta kamara leri ra le kaya ro hlambela ro hlambela leri hetisekeke eka muxavi wa le kaya wa st time kumbe munhu hi xiyexe loyi a lavaka ntsena ku suka eka trail shopping dining na vuhungasi byo hlayanyana lebyi hlamarisaka kaya leri
3004,_messiah he has not to the fact that the entertainment landscape and how we consume it also now million for a niche program is considered excellent and profitable that is how can stay on the air as well,.
3005,necessary are entertainment first and foremost,swi laveka i vuhungasi byo sungula ni bya nkoka swinene .
3006,be a crash dummy for their entertainment if you want to,be a crash dummy for vuhungasi bya vona loko u lava ku .
3007,i say it several times live because i have several pop in some sort of commentary on entertainment and pop culture its the biggest show right now other people want to know my,ndzi swi vula minkarhi yo hlaya live hikuva ndzi na ti pop to hlayanyana eka some sort of commentary on entertainment and pop culture its the biggest show sweswi vanhu van’wana va lava ku tiva ya mina .
3008,let him go let him go away we have gotten enough entertainment from him,a tshikeni a ya n'wi tshika a famba hi kume vuhungasi byo enela eka yena .
3009,_g_official _abaho _ awesome entertainment forever,_g_official _abaho _ vuhungasi byo hlamarisa hilaha ku nga heriki .
3010,to star in producer vijan is love story film more,ku tlanga eka muhumelerisi vijan i love story film more
3011,actually his alone can win the entertainment,kahle kahle ya yena ntsena yi nga hlula eka vuhungasi .
