,src,trg
0,a recipe for forgiveness via,ricepe ra ku rivalela hi ku tirhisa .
1,_keelang i never once pedophilia u said it was morally reprehensible regardless of culture and i just pointed out that that true,.
2,a lot of people are being hyperbolic when they talk about stuff but that is not really how this works woman is a social concept and unique from culture to culture it is not an idea we are born with we have to learn them people learn the,vanhu vo tala va va va ri hyperbolic loko va vulavula hi swilo kambe sweswo a hi swona kahle-kahle ndlela leyi wansati loyi a tirhaka ha yona i social concept na ku hlawuleka ku suka eka ndhavuko ku ya eka ndhavuko a hi mianakanyo leyi hi velekiweke na yona hi fanele ku dyondza vona vanhu va dyondza .
3,the most painting ever by the u s government democracy at its most realistic,xifaniso lexikulu lexi tshameke xi va kona hi xidemokirasi xa mfumo wa u s eka xiyimo xa xona xa xiviri swinene .
4,it s indicative of what s wrong with youth sport culture in this country are trying to sell themselves to a coach school at the off chance they would play scholarship rather than enjoy the game and be it s based on pressure from and society,it s indicative of what s wrong with youth sport culture in this country va ringeta ku tixavisa eka xikolo xa coach hi off chance va ta tlanga scholarship ku tlula ku tiphina hi ntlangu and be it s based on pressure from and society .
5,check out jess piper is video hysteria was and so is the coming culture war against the community especially against,check out jess piper is video hysteria was and swi tano na hi nyimpi ya ndhavuko leyi taka yo lwisana na vaaki ngopfu ngopfu ku lwisana na .
6,it is not my culture i do not eat or and i made a clear argument and all you have is a straw man and deflection me on the other hand happy to point you to some rational insight on a topic you know nothing about,a hi ndhavuko wa mina lowu ndzi nga wu dyiki kumbe naswona ndzi endle njhekanjhekisano lowu nga erivaleni naswona leswi u nga na swona i wanuna wa straw naswona u ndzi deflection hi tlhelo rin’wana ndzi tsakile ku ku komba ku twisisa ko karhi loku twisisekaka eka nhloko-mhaka leyi u nga tiviki nchumu ha yona .
7,barcelona need to be and like mad and forced to reset entire club and culture around it is grim give them the treatment and let them rebuild,barcelona yi lava ku va na ku fana na mad and forced to reset entire club and culture around it is grim give them the treatment and let them rebuild .
8,_bastiat why do you people always default to fear it is not fear it is disgust have done nothing to improve our culture or our society acceptance of them only the family and ended any sense of public morality,.
9,are a bunch of going well you re in respect their culture as if it t one of the on earth,are bunch of going well you re in respect their culture as if it t one of the on earth .
10,literacy culture,ndhavuko wa vuleteri .
11,all we is big people i do not think we should have to explain to you why you can not just go around calling people culture disgusting now everybody laughing at yuh belly,all we is big people i do not think hi fanele hi mi hlamusela leswaku hikokwalaho ka yini mi nga fambi ntsena mi vitana vanhu ndhavuko wo nyenyetsa sweswi vanhu hinkwavo va hleka hi yuh belly .
12,they are they don t have the same culture why are you so mad,va kona a va na ndhavuko wun'we why u mad so .
13,it is crazy that this is 'counter culture' for straight edge,swi penga leswaku leswi i 'counter culture' for straight edge .
14,_muppetries _mamadeb _seeadler _drcjm_ _man_dan _empyreangoals _o_brien _wendy but you keep making the argument that men are somehow supposed to solve all that a culture figure out how to make a perfect world for a baby and endlessly strive for a unicorn like system otherwise a woman should be able to kill her child false dichotomy,. ku dlaya n’wana wa yena false dichotomy .
15,the topic of mental health in general is something that my culture community does not really talk about there is lots of stigma misinformation ignorance it is thanks to the i have gotten to know here that i am starting to inquire about the topic regarding myself,nhlokomhaka ya rihanyo ra miehleketo hi ku angarhela i nchumu lowu vaaki va ndhavuko wa mina va nga vulavuli hi wona hakunene ku na ku pfumala mahungu yo hoxeka ya ku rhuketela i ku khensa eka the i have gotten to know here that i am starting to inquire about the topic regarding myself .
16,_malek very unsettling that this guy is one of the premier hustle culture finance doing unspeakable brain damage to a generation of impressionable young men,.
17,the culture dont exist out in the real world,ndhavuko a wu kona ehandle emisaveni ya xiviri .
18,political culture always been autocratic despotic it always sought to subjugate oppress the of social ethnic,ndhavuko wa tipolitiki minkarhi hinkwayo a wu ri vulawuri bya tihanyi bya vulawuri bya tihanyi minkarhi hinkwayo a wu lava ku hlula ku tshikileriwa ka rixaka ra ntshamisano .
19,glad to see you are a man of culture,ndza tsaka ku vona u ri munhu wa ndhavuko .
20,and someone for being queer is not anywhere regardless of culture or religion or,naswona munhu wo va queer a nga ri kwihi na kwihi ku nga khathariseki ndhavuko kumbe vukhongeri kumbe .
21,yeah you have to understand that china billion people we are not a small country or a small culture if you continued to do thing like this it will drag you reputation down think about it before you release any original shameful,yeah u fanele u twisisa leswaku china billion vanhu a hi tiko leritsongo kumbe ndhavuko wutsongo loko u ya emahlweni u endla swilo swo fana na leswi swi ta ku koka ndhuma ehansi ehleketa hi swona u nga si humesa tingana tihi na tihi to sungula .
22,i am with you on this really awful title the poem also maybe a bit off the mark but mostly does criticize white south culture and does point out rightly that crime precipitously since the end of apartheid,i am with you on this really awful title the poem also maybe a bit off the mark but mostly dos dos criticise white south culture and does pointly rightly that crime precipitously since the end of apartheid
23,the sign of the is a sophistication and instinctive culture while your village to the ground,xikombiso xa i ndhavuko wa vutshila ni wa ntumbuluko loko ximutana xa wena xi ri ehansi .
24,no hate but i hope culture you look dumb as hell,no hate but i hope ndhavuko u languteka u ri dumb as hell .
25,to be a part of the culture to the moon,ku va xiphemu xa ndhavuko ku ya en’wetini .
26,a new casting call is looking for people to appear in newsroom,call call leyintshwa yi lava vanhu lava nga ta humelela eka newsroom .
27,_panther _katy and i m from north miss being near the coast hope you enjoy your,_panther _katy na i m ku suka enorth miss ku va ekusuhi na ribuwa ntshembo wa leswaku u tiphina hi wena .
28,get well soon sending love,kuma kahle ku nga ri khale u rhumela rirhandzu .
29,_vision the culture not being a natural space for growth because it t allow the real union of male and female and when it s based on that then there s a lack of understanding so i m saying it to the whole men t or the of,.
30,hey clown is this album supposed to be about toxic culture in social media,hey clown i album leyi yi fanele yi va yi vulavula hi toxic culture eka social media .
31,_payne _ _jerkins fellow man of culture,_payne _ _jerkins munhu kulobye wa ndhavuko .
32,i agree it t respectful to refer to a language that is a part of people s identify as a hobby language and i am sorry to see some who rightly demand respect for our own culture showing disrespect to in this manner,i agree it t respectful to refer to a language that is a part of people s identify as a hobby language and i am sorry ku vona van'wana lava va lavaka ku xiximiwa hi ndlela leyi faneleke eka ndhavuko wa hina lowu kombisaka ku pfumala xichavo eka wona hi ndlela leyi
33,no i m not talking bout his rapping ability i m talking about the way he the culture to this better type no other rapper on this list done something like that in the past,no i m not talking bout his rapping ability i m ku vulavula hi ndlela leyi a va culture to this better type no other rapper eka list leyi a nga endla swo fana na sweswo eka nkarhi lowu hundzeke
34,no hookup culture is useless and a waste of time as in my essay,no hookup culture a yi pfuni nchumu naswona i ku tlanga hi nkarhi tanihi le ka xitsalwana xa mina .
35,_mugabi when the economy is bad people sell off some of the assets even the only asset they have for survival it part of the national culture,.
36,the best food a huge and beautiful plenty to see and do every culture you can imagine now,swakudya leswinene ngopfu swi tele ni ku saseka ko tala ku vona ni ku endla ndhavuko wun’wana ni wun’wana lowu u nga wu ehleketaka sweswi .
37,it that this truth and justice which is simply in people who create art and i think that s a huge part of why we re going to win this war,it leswaku ntiyiso lowu na vululami leswi nga ntsena eka vanhu lava tumbuluxaka vutshila and i think that s a huge part of why we re going to win this war .
38,i honestly do not understand the culture in right now play the campaign finish it have separation anxiety roam the open world for a bit play the version move on i would take new content in a sequel over more detail in a,i honestly don't understand the culture in right now play the campaign finish it have separation anxiety roam the open world for a bit play the version move on i would take new content in a sequel over more detail in a .
39,to lead s c forward by being one of the first to join matchboard see how they are our technology to build vibrant and that strengthen the city is economy culture and sense of community,ku yisa s c emahlweni hi ku va un’wana wa vo sungula ku joyina matchboard vona leswaku i ndlela leyi va nga thekinoloji ya hina ha yona ku aka vutomi na leswaku ku tiyisisa doroba i ndhavuko wa ikhonomi na ku titwa ka vaaki .
40,unreal culture reporter fake culture war for amber via what a disgrace is,unreal culture reporter fake culture war for amber via what a disgrace is .
41,oh no brought back the i felt uncomfortable in class once and that was a cancel culture lady the were just too good,oh no tected the i ndzi titwe ndzi nga ntshunxekanga etlilasini kan’we naswona sweswo a ku ri cancel culture lady the were just too good .
42,if you support violence against in the womb how can anyone respect your opinion about violence against in a mentality that life in all and is the right direction for the culture of life,loko u seketela madzolonga eka ekhwirini a nga ma xixima njhani mavonelo ya wena hi madzolonga eka miehleketo ya leswaku vutomi hinkwabyo naswona i ndlela leyinene eka ndhavuko wa vutomi .
43,often considered the initial step in the design thinking process empathy and align with one another and promote deep connection and understanding,hakanyingi ku tekeriwa enhlokweni goza ro sungula eka endlelo ra ku ehleketa hi dizayini ntwela vusiwana naswona u fambisana na un’wana na un’wana na ku tlakusa ku hlangana loku dzikeke na ku twisisa .
44,agreed the role to place geography as a part of and impetus to culture is often under for instance,va pfumelelanile xiphemu xo veka ntivo-misava tanihi xiphemu xa na nsusumeto wa ndhavuko lowu talaka ku va ehansi ka xikombiso .
45,only one death scene was nominated by two different people,xifaniso xin’we ntsena xa rifu lexi hlawuriweke hi vanhu vambirhi vo hambana-hambana .
46,sans survey a culture to significantly improve your organization s security posture via,sans survey ndhavuko wo antswisa swinene xiyimo xa vuhlayiseki bya nhlangano wa wena hi ku tirhisa .
47,are incompatible with culture not a statement but a fact,a swi fambisani na ndhavuko hayi xitatimende kambe ntiyiso .
48,your culture is saying men are better than you can t even see the truth about what you are saying,ndhavuko wa wena wu ri vavanuna va antswa ku tlula ku vona hambi ku ri ntiyiso hi leswi u swi vulaka .
49,collaboration create a culture of collaboration by a technology stack that cloud based that can be at any time from any location and are rich with,ntirhisano wu tumbuluxa ndhavuko wa ntirhisano hi xithaki xa thekinoloji lexi sekeriweke eka xigwitsirisi lexi nga vaka kona nkarhi wihi na wihi ku suka eka ndhawu yihi na yihi naswona xi fuwile hi .
50,top tier remix the block captain b dot ave real via just take some time again to listen share and appreciate this good music from the culture,top tier remix the block captain b dot ave real via just take some time again ku yingisela share na ku tlangela vuyimbeleri lebyi bya kahle kusuka eka ndhavuko
51,no one the reason he left one church for another whether it was dispute heresy decision to merge regardless i wait while you provide me with justification of starting a church because you have a pop culture,akuna munhu xivangelo xa leswaku a siya kereke yin'wana a ya eka un'wana hambi ku ri ku kanetana xiboho xa vugwinehi xo hlanganisa ku nga khathariseki ndzi rindzele loko u ri karhi u ndzi nyika ku lulamisiwa ka ku sungula kereke hikuva u na ndhavuko wa pop .
52,the only thing than actual people who identify as gay is the military it is why we call everything gay in the military even getting pussy was gay it is our culture our military industrial complex soaked in the fresh blood of a drone strike on a wedding culture,nchumu wun'we ntsena ku tlula vanhu va xiviri lava tivulaka gay i masocha it is why hi vitana hinkwaswo gay eka vusocha hambi ku ri ku kuma pussy a ku ri gay it is our culture our military industrial complex soaked in the fresh blood of a drone strike on a wedding culture
53,_culture if anyone goblin is better you need help is clearly million times better than,_culture loko munhu a ri kahle u lava ku pfuniwa swi le rivaleni leswaku u antswa ku tlula million times ku tlula .
54,and your up cancel culture is also dragging my our girl was proven innocent and that accuser was not even from the same school and made up a school name i know which fandom is blow this up too,na wena up cancel culture na yona yi koka my our girl was proven innocent and yoloye accuser a nga ri kona hambi ku ri ku huma exikolweni xin'we a endla vito ra xikolo i know what fandom is blow this up too .
55,it is very telling though your jest i am always on about how the do not have any culture or any longer and every single one of them 'wot about morris dancing then which rather my,it is very telling though your jest i am always on about how the do not have any culture or any longer and un'wana na un'wana wa vona 'wot about morris dancing then which rather my .
56,culture was built around separating people from their money and it was so successful it is now on separating people from money they do not even have,ndhavuko wu akiwile ku rhendzela ku hambanyisa vanhu na mali ya vona naswona swi humelerile swinene lerova sweswi i ku hambanyisa vanhu eka mali leyi va nga riki na yona hambi ku ri ku va na yona .
57,it s not about me it s about the other people in who want to hear my people who come here because they love the culture and they love going to the book fair they love going to the library to the community center now they can t hear me,it s not about me it s about the other people in lava va lavaka ku twa vanhu va mina lava va taka laha hikuva va tsakela ndhavuko naswona va swi tsakela ku ya eka buku leyi va yi tsakelaka ku ya elayiburari va ya e community center sweswi a va ndzi twi .
58,is a different culture i get that but fundamentally men know it is cruel and inhumane to beat their they absolutely know use religion as the excuse to abuse another human being that is too much for me,i ndhavuko wo hambana lowu ndzi wu kumaka sweswo kambe hi xisekelo vavanuna va swi tiva leswaku i tihanyi naswona a hi vumunhu ku hlula vona hi ku helela va swi tiva use vukhongeri tanihi xivangelo xo xanisa munhu un’wana loyi a nga tala ngopfu eka mina .
59,if that s y all culture it s disgusting how much for bus to i have to take care of something,loko sweswo s y all culture swi nyenyetsa how much for bus to i have to take care of something .
60,hello i apologize for you but i thought i read that it does not bother you i to show you this piece that is one of my because of what it for me the ancient culture is very important to remember from where we come from,hello i apologise for you but i thought i read leswaku a swi ku karhati i ku mi komba xiphemu lexi lexi nga xin'wana xa mina hikwalaho ka leswi swi nga eka mina ndhavuko wa khale i swa nkoka swinene ku swi tsundzuka ku suka laha hi humaka kona .
61,tune in one minute man by missy feat live on we are the culture,tune in one minute man by missy feat live eka hina
62,a destination fit for hockey apart from against local there is more to discover in beautiful city and historic culture or get the adrenaline flowing with a visit to world for more on to visit our,a destination fit for hockey apart from against local ku na swo tala swo swi kuma edorobeni ro saseka na ndhavuko wa matimu kumbe ku kuma adrenaline leyi khulukaka hi ku endzela misava ku kuma swo tala hi ku endzela ya hina .
63,finally,heteleleni
64,if you take propaganda as true then you are in that parallel universe too this is war try to take from kill its people then erase education and culture and those sending far into,loko u teka propaganda tani hi ntiyiso then u le ka parallel universe na yona leyi i nyimpi ringeta ku teka eka kill its people kutani sula dyondzo na ndhavuko na lava va rhumelaka kule eka
65,the appeal of cognitive wellness culture then is identical to its main deficiency it never you to take on unchosen,ku tsakisa ka ndhavuko wa vuhlayiseki bya mianakanyo kutani swi fana ni ku pfumaleka ka wona lokukulu a swi tshuki u swi teka eka leswi nga hlawuriwa .
66,while they force and sex education for into our culture,loko va ri karhi va sindzisa na dyondzo ya rimbewu ku nghena eka ndhavuko wa hina .
67,the sad thing is if you do not have your slavery to talk about then your identity to be gone because you throw all of your identity into being now that you know we have all been every culture what do you have to talk about now,lexi twisaka ku vava hi leswaku loko u nga ri na vuhlonga bya wena byo vulavula hi swona kutani vumunhu bya wena byi nga ha ri kona hikuva u lahlela vutivi bya wena hinkwabyo sweswi u swi tivaka leswaku hinkwerhu hi ve ndhavuko wun’wana ni wun’wana lowu u faneleke u vulavula ha wona sweswi
68,the was a great success in thank you for your vibrant culture with our community,the was a great success in thank you for your vibrant culture with our community .
69,creative and rich culture seamlessly blend to show off public art and across the state on the new and culture passport visit and start earning free today,ndhavuko wa vutumbuluxi na lowu fuweke wu hlangana hi ndlela yo pfumala swiphiqo ku kombisa vutshila bya mani na mani na le xifundzheni hinkwaxo eka riendzo ra pasi lerintshwa na ra ndhavuko na ku sungula ku hola mahala namuntlha .
70,you can tell from her writing she is too busy living,u nga swi vona hi ku tsala ka yena leswaku u khomekile ngopfu hi ku hanya .
71,have been selected in a number of,va hlawuriwile eka nhlayo ya .
72,water structure science site map of all known water is probably the most studied least understood the true foundation of all culture is the knowledge understanding of water link is safe,mepe wa ndhawu ya xivumbeko xa mati ya ndhawu ya ndhawu ya mati ya mati hinkwawo kumbexana i nchumu lowu dyondziweke ngopfu lowu nga twisisiwiki ngopfu masungulo ya ntiyiso ya ndhavuko hinkwawo i vutivi byo twisisa ku hlanganisiwa ka mati i ku hlayiseka .
73,club culture is really silly like these in the liquor store don t even cost that much but in the club splash ridiculous,club culture is really silly ku fana na lava exitolo xa byala a swi durhi ngopfu kambe eka club splash ridiculous .
74,_k most of the from south to that is bad just because is international language does not mean you should not promote a language which is much closer to your culture and language too in of grammar and all and just keep on barring it grow there,.
75,getting into not because i know or like any famous pop culture but just because i want to look cool,ku nghena ku nga ri hikuva ndzi swi tiva kumbe ndzi tsakela ndhavuko wihi na wihi wa pop lowu dumeke kambe ntsena hileswi ndzi lavaka ku languteka ndzi ri cool .
76,suddenly may after he of chest pain and via,hi xitshuketa may after he ya ku vava ka xifuva na via .
77,_ my belle,_ belle ya mina .
78,or even the utter irrelevance of government sorry government who needs to be government when you already have the the and culture all upstream of politics the civil service the eu the the and all public sector irrelevant or,kumbe hambi ku ri ku pfumala nkoka loku heleleke ka mfumo sorry mfumo loyi a lavaka ku va mfumo loko se u ri na the na ndhavuko hinkwaswo swa le henhla ka tipolitiki vukorhokeri civil service the the the the and all public sector irresevant kumbe .
79,it s always their way or the highway while all the while they re too wrapped up in their counter culture ego to even know what they are talking about they never got over high school,it s always their way or the highway while all the while they re too spract up in their counter culture ego to even know leswi va vulavulaka hi swona a va nga si tshama va tlula xikolo xa le henhla .
80,it was bad enough when i was a but it s worse now my are all great and the one summer only because the coach was begging for him to play my sister and can t afford to do it again though the culture anyway,it was bad enough loko ndzi ri a but it s worse now my are all great and the one summer only because coach a ri karhi a kombela leswaku a tlanga sesi wa mina and can t afford to do it again though the culture anyway .
81,yes it does i do not get the beef theres in apparently politics over story in good customer service and better is supposed to be racist but been cool to me other black i am not part of this culture war,yes it does a ndzi kumi nyama ya homu there eka appearent politics over story in good customer service and better is supposed to be racist but been cool to me other black i am not part of this culture war
82,if my knew my wife goes to the beach without me they would respond with and you let her because i don t subscribe to that toxicity of my culture me a free agent thinker,loko my knew my wife goes to the beach va nga ri na mina a va ta hlamula hi yona and u n'wi pfumelela hikuva a ndzi tssoblisanga toxicity yaleyo ya culture ya mina mina a free agent thinker .
83,exactly i found myself living in another country i quickly found work for a lot less than i was earning in total change of direction as well but i had to put bread on the table i have always the local culture and myself i think,kahle kahle ndzi tikume ndzi tshama etikweni rin’wana ndzi hatle ndzi kuma ntirho hi mali yitsongo swinene ku tlula leyi a ndzi yi hola eka ku cinca loku heleleke ka ndlela na yona kambe ndzi boheke ku veka xinkwa etafuleni ndzi tshama ndzi ri na ndhavuko wa ndhawu na mina ndzi ehleketa leswaku ndzi ehleketa leswaku
84,so why don t the focus on the environment instead of getting caught up in the nonsense culture leave that to the other,so why don t the focus on the environment instead of getting up in the nonsense culture leave that to the other .
85,_ _gorex also from the of you it like you haven t even hit puberty yet what would you really know about working a hard job sure you still live with your not that there s anything wrong with that but you are too inexperienced to argue work culture,_ .
86,fringe here are recent live at the set to play the festival this year,fringe here are recent live at the set ku tlanga festival lembe leri
87,we won t accept if you do coz we love the culture,we won t accept loko u endla coz hi rhanda ndhavuko .
88,i your culture theres nothing you can do about it,i ndhavuko wa wena theres nothing you can do about it .
89,your to report bullying and racism to you from recent i have found that are not always trustworthy or it may be just a school culture to cover up,your to report bullying and racism to you from recent ndzi kume leswaku a hi minkarhi hinkwayo swi tshembekaka kumbe swi nga ha va ntsena ndhavuko wa xikolo ku wu funengeta .
90,_stroop so is pretty much every part of human culture from literature to to theater and in fact some people use of culture as justification for doing really awful use other or even the same as a source for good does not mean we should ban,.
91,we re for these to expand democracy to limit confusion and to voting and to ultimately build a culture of civic engagement in move organizer,hi re lava ku ndlandlamuxa xidemokirasi ku hunguta ku pfilunganyeka na ku vhota na ku hetelela hi ku aka ndhavuko wa ku nghenelela ka vaaki eka move organizer .
92,colin and penelope is season is officially underway,colin na penelope is season yi le ku endliweni ximfumo .
93,what don t we understand about the missing dogs and squid game culture,leswi hi nga swi twisisiki hi timbyana leti lahlekeke na squid game culture .
94,coach i just can t agree with this are some monumental no doubt but the culture and building the youth program can be done anywhere time creativity credibility knowledge charisma and organization,coach i just can t agree with this are some monumental no doubt kambe ndhavuko na ku aka nongonoko wa vantshwa swi nga endliwa kun'wana na kun'wana nkarhi vutumbuluxi vutivi vutivi charisma na nhlengeletano .
