,src,trg
0,one thing i learnt from the do go for an interview or debate with one agenda in mind you are a question find a way of it to that agenda in other fight your corner and hold on to the ropes when you are under utmost pressure,xin’wana lexi ndzi xi dyondzeke eka do go for an interview or debate hi ajenda yin’we emiehleketweni u xivutiso u kuma ndlela ya swona eka ajenda yoleyo eka tin’wana nyimpi ya wena u khomelela eka tintambhu loko u ri ehansi ka ntshikilelo lowukulu .
1,excellent roundup of the tory debate,xirhendzevutana xa kahle swinene xa njhekanjhekisano wa tory .
2,decided to be actually it is let her continue selling propaganda there do not expect her to be objective and impartial in a debate,xiboho xo va kahle-kahle i ku n'wi tshika a ya emahlweni a xavisa mavunwa kwalahaya a nga langutelanga leswaku a va na xikongomelo naswona a nga na xihlawuhlawu eka njhekanjhekisano .
3,_ let is stick to what do you look for in a debate how do you judge the success of a debate for me one indicator like a candidate from up and himself is a of a failure,.
4,its going to be very interesting to see how this one out keeping close eye on this one for being brave enough to fight for fair and balanced debate,its going to be very interesting ku vona ndlela leyi leyi yi humaka yi veka tihlo swinene eka leyi hi ku va yi ri na xivindzi xo lwela njhekanjhekisano lowu lulameke no ringanisela .
5,the most annoying part of the debate is that claim in the same breath he had no talented but also that look how great he is for scoring and assist,xiphemu lexi hlundzukisaka ngopfu xa njhekanjhekisano hi leswaku claim in the same breath a nga ri na vuswikoti kambe na ku languta leswaku u nkulu eka ku nghenisa na ku pfuneta .
6,and another thing was completely not cordial from the beginning to the end of the debate she can not smile she was wearing her smirk she was very tense during her opening statement they did not teach her breathing,naswona nchumu wun'wana a wu nga ri na cordial hi ku helela ku sukela eku sunguleni ku ya fika emakumu ka njhekanjhekisano lowu a nga n'wi n'wayitelani a ambale smirk ya yena a ri na tense swinene hi nkarhi wa xitatimende xa yena xo pfula a va n'wi dyondzisanga ku hefemula .
7,this is why the the final debate last night,leswi hi swona swi endlaka leswaku the the final debate tolo vusiku .
8,_ramesh you are go by the agenda decided a day is not make a difference we the people want to see strong debate from both sides also on your placard at least get the debt spelling right it is not,.
9,is the clear winner of the debate grip eloquent the incoming deputy president of,i muhluri loyi a nga erivaleni wa njhekanjhekisano wa ku khoma hi ndlela yo vulavula hi ndlela yo vulavula hi mupfuni wa muungameri loyi a nghenaka wa .
10,i think given the fact that was unpopular the debate him and more than and the expectation was low on him so it was up to him to shift the narrative with few days to the election this debate was never going to add anything to,i think given the fact that was unpopular the debate him and more than and ku languteriwa a ku ri ehansi eka yena so a swi ri eka yena ku cinca xitlhokovetselo hi masiku nyana eka nhlawulo debate leyi a yi nga ta engetela nchumu eka .
11,deputy president is debate to have well on her she was smart and articulate in all way from to presentation madam ruth to be shaky she was not even spending ¾ of her time given i admired madam a lot,deputy president is debate ku va na kahle eka yena a ri smart and articulate in all way from ku ya eka presentation madam ruth to be shaky a nga ha heti 3⁄4 wa nkarhi wa yena given i admired madam a lot
12,were clearly watching another debate this is the problem with za,were clearly ku hlalela debate yin'wana leyi i problem ya za .
13,to school for winning the central region _afrika is of your hard work and success as your school motto you have surely from your of hard work,ku ya exikolweni xo hlula eka xifundzha xa le xikarhi _afrika i swa ntirho wa wena wo tika ni ku humelela tanihi xiga xa wena xa xikolo hakunene u huma eka ntirho wa wena wo tika .
14,the debate should incorporate public participation for coming debate time needs to be allow for generalized even personal and time for they offer accountability then finally quiz from public,mphikizano wu fanele ku katsa ku nghenelela ka vaaki eka nkarhi wa njhekanjhekisano lowu taka wu lava ku pfumeleriwa ku andlariwa hambi ku ri ka munhu hi xiyexe na nkarhi wa leswaku va nyika vutihlamuleri kutani eku heteleleni xivutiso ku suka eka vaaki .
15,_anderson you ask an unreasonable question if an country a working refinery this are elementary you ask a child in primary school i debate above such level of understanding it s a waste of time to go back and forth on such,_anderson u vutisa xivutiso lexi nga twisisekiki loko tiko a working refinery this are elementary u vutisa n'wana exikolweni xa le hansi ndzi debate ehenhla ka xiyimo xo tano xa ku twisisa swi ri ku tlanga hi nkarhi ku ya emahlweni na le ndzhaku eka swo tano
16,so u think u know beyond the hyena n debate is not about running the mouth it is about,so u think u tiva beyond the hyena n debate a hi ku tsutsuma nomu it is about .
17,because of the debate we want somebody past debate,hikwalaho ka debate hi lava munhu un'wana past debate .
18,_fatal _of_debate _felinemenace _bobby _s _dr _damn_muteki _clarkej anyone can rape excusing rape when it s by a woman you a rape apologist and a predator and that have high of raping people you a liar,_fatal _of_debate _felinemenace _bobby _s _dr _damn_muteki _clarkej munhu un'wana na un'wana a nga pfinya ku pfinya loko s hi wansati wena a rape apologist and a predator and that have high of raping people you a liar
19,_ruto did you watch the same debate everyone else watched or you had yours sometimes you should accept the verdict so that you can improve are days away and that is enough to learn and beat these people full of,.
20,the debate are hilarious,mphikizano wa kona wu hlekisa .
21,are know you re not looking for a debate in this but,are know you re not looking a debate eka leswi kambe .
22,i all ladies in that debate na white na white,mina hinkwavo va ladies eka debate yaleyo na white na white .
23,_lr _blak _david _muya _mwangi _humphrey till now do not know what hit them they need time to recover the of the debate were sharp to put the next debate quite apart this was a whitewash,.
24,had and if had no that guy could get confused in the debate,had and if had no guy a nga pfilunganyeka eka debate .
25,why are you people are not competition t they there to market themselves and their and you win by the number of you convince to join your side through the debate are just and are competition,why n'wina vanhu mi nga ri competition t there kwala ku ti market na ta vona and mi wina hi number ya nwina mi khorwisa ku mi ta joyina side ya nwina through the debate are just and are competition
26,more debate is whether this is due to co² or a natural cycle there also needs to be a discussion on the report in the have not in and are actually lower now than the before,njhekanjhekisano lowu engetelekeke hi leswaku xana leswi swi vangiwa hi co2 kumbe xirhendzevutani xa ntumbuluko ku tlhela ku lava ku va na mbulavurisano eka xiviko eka have not naswona entiyisweni swi le hansi sweswi ku tlula ka before .
27,debate on st s university trust cardiac surgery mortality review,mphikizano eka st s university trust vuhandzuri bya mbilu ndzavisiso wa ku fa .
28,the same level of of that as with non existent your other opinion is irrelevant for the debate,xiyimo lexi fanaka xa xa sweswo tanihi lexi nga riki kona vonelo ra wena rin’wana a ri na nkoka eka njhekanjhekisano .
29,_ was this your first debate to watch,_ was this your first debate yo hlalela .
30,take action have an honest debate with someone you disagree with,teka goza va na njhekanjhekisano wo tshembeka na munhu loyi u nga pfumelelaniki na yena .
31,from iron lady to nylon lady the power of a min debate,ku suka eka iron lady ku ya eka nylon lady matimba ya min debate .
32,on the illuminati level conspiracy theory i raise you opus but the work t have the debate so yes the take that personally if you are a literature geek the are just more fun to engage but you know who is really hao wa diocese,on the illuminati level conspiracy theory ndzi ku tlakusa opus kambe ntirho t have the debate so yes the take that personally loko u ri literature geek the are just more fun to engage but wa swi tiva ku i mani really hao wa diocese .
33,what do u economy let is have a debate jo field he is me e rho record export remittance growth thy tha,what do u economy let is have a debate jo field he is me e rho record export remittance growth thy tha .
34,life is like a high school debate tournament except there are so many that it is unnecessary if not detrimental to be consistently perfect every single time,vutomi byi fana na mphikizano wa njhekanjhekisano wa xikolo xa le henhla handle ka loko ku ri na swo tala lerova a swi laveki loko swi nga ri na khombo ku va u hetisekile nkarhi wun’wana ni wun’wana nkarhi wun’wana ni wun’wana .
35,won that debate,u hlule njhekanjhekisano wolowo .
36,it all on how everyone and the debate as of that will leave to each their own until when will be objective in voting stop voting on tribal party and emotional weeping we have a long way to go,it all on how everyone and the debate as of that will leave to each their own until will be objective in voting stop voting on tribal party and emotional weeping hi na ndlela yo leha yo famba .
37,one more point president please also settle the debate that is extending his rule through you we believe this to be a lie by tell the nation that it will be an government with you as our captain as deputy leader,muungameri un’wana wa tiphuinti hi kombela u tlhela a lulamisa njhekanjhekisano lowu wu engetelaka vulawuri bya yena hi ku tirhisa n’wina hi pfumela leswaku leswi i mavunwa hi ku byela rixaka leswaku swi ta va mfumo na n’wina tanihi mukaputeni wa hina tanihi xandla xa murhangeri .
38,what you mean while reasonable people do not debate the world is getting warmer there is obviously huge scope for debate about what to do about it,leswi u vulaka swona kasi vanhu lava twisisaka a va kaneti misava yi ya yi kufumela swi le rivaleni leswaku ku ni ndhawu leyikulu ya njhekanjhekisano malunghana ni leswi va faneleke va swi endla ha yona .
39,_jbo _prue _parto no the role of the to count and to tell us who the winner of the election was on that basis not their role to debate whether there is a mandate the idea of an mandate is controversial i constantly the for lack of diversity in,.
40,found this in my during his tenure president in contrast to the current debate of our country he was the president of who in office,u kumile leswi eka mina hi nkarhi wa tenure president wa yena ku hambana na njhekanjhekisano wa sweswi wa tiko ra hina a ri president wa who eka office .
41,who you last night debate,i mani n'wina tolo ni vusiku debate .
42,____ i know its been quite a lively debate i would be up for a coffee,____ i know its been quite a lively debate ndzi ta va ndzi ri ehenhla ka kofi .
43,posting this and then someone like o on a flagship show for a serious debate about climate change when he broke for that same sex consensual between are predatory for is quite the look for,ku posta leswi ivi ku landzela munhu wo fana na o eka nkombiso wa xiyimo xa le henhla wa njhekanjhekisano lowukulu mayelana na ku cinca ka maxelo loko a tshoveka eka ku pfumelelana koloko ka rimbewu rin’we exikarhi ka yena are predatory for is quite the look for .
44,i returned to this excellent to discuss the harry potter franchise with that in mind are human this is not up for debate and if you do not like that go yourselves,ndzi tlhelele eka leswi swa kahle swinene ku ta burisana hi franchise ya harry potter hi ku ehleketa leswaku i human leswi a swi le henhla ka njhekanjhekisano naswona loko mi nga swi tsakeli sweswo mi famba mi ya .
45,on debate am a hyena on sale at the market place will be the show stopper but at the end of the day it is the goat that will be bought proverb,on debate am a hyena on sale at the market place will be the show stopper kambe eku heleni ka siku i mbuti leyi nga ta xaviwa xivuriso .
46,_ _uganda _ lost sense of debate and making baseless and on the subject matter,_ _uganda _ ku lahlekeriwa hi njhekanjhekisano na ku endla baseless na on subject matter .
47,last time i checked she was to a debate no matter how much you twist it you lose,last time ni check a ri ku debate no matter how much you twist it you lose .
48,_ i totally agree with you but one does not have to defend one is uniqueness as it is not up for debate can anyone prove a certain person is not unique,.
49,seem you did not watch the debate you were sleeping,swi tikomba onge a wu wu hlalelanga njhekanjhekisano lowu a wu etlele .
50,i have one what do they look for in a debate i even gave him a tip on how i assess ie diversionary tactics and on other is time is a way to fail which is exactly what did,ndzi na yin'we leyi va yi langutaka eka njhekanjhekisano ndzi tlhele ndzi n'wi nyika xitsundzuxo xa leswaku ndzi kambela njhani ie diversionary tactics and on other is time is a way to fail which is exactly what did .
51,it was a debate not a taking for a picnic at animal,a ku ri njhekanjhekisano hayi ku teka ka pikiniki eka xiharhi .
52,ah the 'which puppet' debate same hand though,ah the 'which puppet' debate voko rin'we hambiswiritano .
53,winning the debate does not mean winning the election won but guess what,ku hlula eka njhekanjhekisano a swi vuli ku hlula eka nhlawulo lowu hluleke kambe guess what .
54,_makokha that is y on issue based debate not but there was no time to that,_makokha leyi nga y eka issue based debate not kambe a ku ri hava nkarhi eka sweswo .
55,it was not a family that was a national debate,a ku nga ri ndyangu lowu a wu ri njhekanjhekisano wa tiko hinkwaro .
56,_kitheka on point before debate all over microphone sasa tune when god is on your side who can be against you all are there,_kitheka on point before debate all over microphone sasa tune loko xikwembu xi ri eka tlhelo ra wena leri nga ku lwisana na wena hinkwenu va kona
57,well than i think you could have send a notice to combine the two of them so that they can debate with,kahle ku tlula mina ndzi nga va u rhumele xitiviso xo hlanganisa havumbirhi bya vona leswaku va ta kanetana na vona .
58,c a m p a i g n l i e s that every presidential aspirant for the general will willingly attend the presidential debate am sick am not in i have a crucial meeting i will buy i do not care about the,c a m p a i g n l i e s leswaku un'wana na un'wana wa vupresidente loyi a navelaka jenerala u ta va kona hi ku tirhandzela njhekanjhekisano wa vupresidente am sick am not in i have a crucial meeting i will buy i do not care about the .
59,a premise in a debate is a statement in which one to derive a conclusion you do not need any thesis or anti thesis plus how exactly am i gaslighting do you even know the of these that you are,premise eka debate i xitatimende lexi eka xona munhu a nga ta kuma mahetelelo u nga lavi thesis kumbe anti thesis plus kahle-kahle ndzi gaslighting u swi tiva njhani hambi ku ri swa leswi u nga swona .
60,labor and liberal are on track for a c increase this global crop by that is away now is the tipping point reduction it at increase this should not even be a debate,labor and liberal va le ndleleni ya c ku engetela ntshovelo lowu wa misava hinkwayo hi sweswo wu le kule sweswi i ku hunguta tipping point it at increase leswi a swi fanelanga hambi ku ri njhekanjhekisano .
61,the debate was too hot for him,mphikizano a wu hisa ngopfu eka yena .
62,no need to debate if it is happening,a swi bohi ku kanetana loko swi humelela .
63,news about title debate the future of and the the,mahungu mayelana na title debate vumundzuku bya na the the .
64,some of these people never saw debate in parliament wait till he the floor with that liar,van'wana va vanhu lava a va nga si tshama va vona debate epalamende va yime ku kondza a va ehansi hi muhembi yoloye .
65,_of_debate _fatal _felinemenace _bobby _s _dr _clarkej yes it does it explicitly a double standard by sex in law under the presumption that the same offense carried out by a presumably woman is less severe that is misogyny,_of_debate _fatal _felinemenace _bobby _s _dr _clarkej ina yi swi endla hi ku kongoma a double standard hi rimbewu eka nawu ehansi ka ku ehleketa leswaku nandzu lowu fanaka lowu endliwaka hi wansati lowu ku ehleketiwaka leswaku wu ta va wu nga ri wukulu ngopfu lowu nga misogyny
66,_ the debate around circumcision is outdated,_ mphikizano lowu rhendzeleke ku yimba wu hundzeriwe hi nkarhi .
67,she may but she can t hold her own in a debate or argument when she is stood there engaged she up and all tongue tied possibly a good politician but not a leader,a nga ha va kambe a nga swi koti ku khoma swa yena eka njhekanjhekisano kumbe njhekanjhekisano loko a yimisiwile a nghenelerile u pfukile naswona ririmi hinkwaro ri bohiwile swi nga endleka a ri n’watipolitiki lonene kambe ku nga ri murhangeri .
68,i watched a fascinating debate yesterday on between a pastor and an atheist about the resurrection of the atheist was right about all evidence being anecdotal however,ndzi hlalele njhekanjhekisano wo tsakisa tolo eka exikarhi ka mufundhisi na munhu loyi a nga pfumeriki leswaku xikwembu xi kona mayelana ni ku pfuxiwa ka mupfumeri wa leswaku xikwembu a xi kona a swi ri ntiyiso malunghana ni vumbhoni hinkwabyo lebyi a byi ri bya anecdotal hambiswiritano .
69,_ke _moindi its brother at the end of the day if baba win i will support him but from yesterday debate do you think he can beat,_ke _moindi makwavo wa yona eku heleni ka siku loko baba a hlula ndzi ta n'wi seketela kambe ku sukela tolo debate do you think a nga hlula
70,_dida you lost the debate cope had time to apply kiwi to the and not have any to their policy agenda,.
71,and joe should take the presidential debate those two are very informed,naswona joe u fanele a teka njhekanjhekisano wa vupresidente lavambirhi va tivisiwile swinene .
72,wait for his debate you see the disappointment,yimela njhekanjhekisano wa yena u vona ku khunguvanyeka .
73,_rukwaro the thing i most about the debate was karua is composure confidence and focus she stood out as one candidate who was not by hidden in her closet good for an incoming if you me,.
74,you are calling a fairly debate which both voluntarily witchcraft,u vitana njhekanjhekisano lowu ringaneleke lowu havumbirhi bya wona hi ku tirhandzela wu nga witchcraft .
75,remember that debate about these,tsundzuka njhekanjhekisano wolowo malunghana ni leswi .
76,no it just into your drinking water and you like you said you do not want a true debate you just want to preach,hayi it just into your drinking water and u fana na wena u te a wu lavi debate ya ntiyiso u lava ku chumayela ntsena .
77,i m a school governor now and the two and teacher are chalk and cheese both very demanding and both by the public if only there was a public body that could debate and set a strategy,i m a school governor sweswi na lavambirhi na mudyondzisi i choko na cheese havumbirhi bya swona swi lava ngopfu naswona havumbirhi bya swona hi vaaki loko ntsena a ku ri na huvo ya vaaki leyi a yi kota ku kanetana no veka maqhinga .
78,we born to settle this debate once for all,hi velekiwile ku lulamisa njhekanjhekisano lowu kan’we eka hinkwavo .
79,debate for the resolve amicably and with respect kudos to both of you gentleman,njhekanjhekisano wa ku tiyimisela hi ndlela ya xinakulobye na hi xichavo kudos eka n’wina va gentleman .
80,i would not lump and far right together it the word and the weight of that word i do not have enough energy to debate politics at am but a moderate conservative and a are very different,a ndzi nga ta lump and far right together the word and the weight of that word a ndzi na matimba yo ringana ku debate tipolotiki eka am kambe a moderate conservative and a are very different .
81,_aswim _ meaning that he should always first consultant the people from the opposition who should be from the side to debate with them,.
82,left cant properly form policy if they dont they never get to be final say that only some are up for debate m end being to act as the state when crime is afoot will bring left back to philosophy fear loathe,left cant properly form policy if they dont they never get to be final say leswaku i van'wana ntsena lava up for debate m end being to act as the state loko vugevenga byi ri eku fambeni byi ta vuyisela left eka philosophy fear loathe .
83,_pach also not argue whatsoever i just want a light debate but like a lot of do not have like where i live there tofu there arent,.
84,both are and only debate whether which one is better than the other,havumbirhi bya swona i naswona i njhekanjhekisano ntsena loko hi wihi loyi a antswaka ku tlula un’wana .
85,it is now a trend that will lose in every head to head with then they will run to social media to control opinion on the same can never defeat baba in any form of debate but when the topic is wash wash,sweswi i trend leyi nga ta lahlekeriwa hi nhloko yin’wana na yin’wana na yona then va ta tsutsumela eka social media ku lawula mavonelo eka leswi fanaka a va nge pfuki va hlule baba eka xivumbeko xihi na xihi xa njhekanjhekisano kambe loko nhlokomhaka yi ri wash wash .
86,with such a debate over the best chicken we now want to find out what s the best alternative for beef let us know below,hi njhekanjhekisano wo tano mayelana na huku ya kahle swinene sweswi hi lava ku kuma leswaku i yini s ndlela ya kahle swinene ya nyama ya homu hi tivise laha hansi .
87,let is all embrace this energy debate the stone age did not end because there were no but because we to other _uganda,let is all embrace this energy debate the stone age a yi nga heli hikuva a ku nga ri na yona kambe hikuva hina eka van'wana va _uganda .
88,now waiting for presidential debate hope it will not be about who did that and why but what they will do and how,sweswi ku rindzela njhekanjhekisano wa vupresidente ntshembo wa leswaku a swi nge vi swa leswaku i mani loyi a endleke sweswo ni leswaku ha yini kambe i yini leswi va nga ta swi endla ni ndlela leyi va nga ta swi endla ha yona ni ndlela leyi .
89,i am trying to see how the do won that debate,ndzi ringeta ku vona leswaku do yi hlule njhani debate yoleyo .
90,i was undecided voter according to this debate have successfully to,ndzi vile muvhoti loyi a nga endlangiki xiboho hi ku ya hi njhekanjhekisano lowu hi ku humelela ku .
91,_kuria know you are bitter and crying after the only hope and had for was screwed hard yesterday in the debate will b crushed crucified by,.
92,all the talk debate decade after decade truth is the status quo em personally they change the machine the machine them identify with it still it is sustainable,all the talk debate decade after khume ra malembe ntiyiso i status quo em hi xiviri va cinca muchini muchini lowu va wu tivaka na wona still it is sustainable .
93,_damn_muteki _of_debate _fatal _felinemenace _bobby _s _dr _clarkej but it does not encode misogyny none of the to the drafting of rape in law stand and though trying to be hidden the real objection is transparently obvious,.
94,will host live debate on as last two standing in tory leadership race go head to head,will host live debate on tani hi leswi vambirhi vo hetelela va yimeke eka mphikizano wa vurhangeri bya tory va ya emahlweni
95,up in a religious discussion is like up the in political debate usually out of ignorance is a cheap shot and never well,up in a religious discussion is like up the in njhekanjhekisano wa tipolitiki hi ntolovelo hi ku pfumala vutivi i xibalesa xo chipa naswona a xi si tshama xi va kahle .
96,i know penny is trying to rewrite history on her,ndza swi tiva leswaku penny u ringeta ku tlhela a tsala matimu eka yena .
97,another great essay from on the tory leadership debate,xitlhokovetselo xin’wana lexikulu ku suka eka njhekanjhekisano wa vurhangeri bya tory .
98,look like a th form debate any one of you three will be great for labour as none have a clue you can all fix the economy that you have cocked up over the last but wish you well,languta ku fana na th form debate un'wana na un'wana wa n'wina vanharhu u ta va lonkulu eka labour tani hi leswi ku nga riki na un'we loyi a nga na xikombiso xa leswaku hinkwenu mi nga lulamisa ikhonomi leyi mi nga yi cocking over yo hetelela kambe yi mi navelela kahle
99,as research depression is not by a chemical imbalance there needs to be a debate about the rise in anti,tanihi leswi ku vilela ka ndzavisiso ku nga riki hi ku nga ringaniseli ka tikhemikhali ku fanele ku va ni njhekanjhekisano malunghana ni ku tlakuka ka anti .
100,please stay calm i for on debate but on th will get it,hi kombela mi tshama mi rhulile i for eka debate kambe on th will get it
101,that brought some under age to a debate that would last up to to reinforce her sense of motherhood to the nation was a flop it irresponsible good sleep hygiene is for child is development,sweswo swi tise van’wana lava nga ehansi ka malembe eka njhekanjhekisano lowu a wu ta tshama nkarhi wo leha ku tiyisisa ku titwa ka yena ka vumanana eka tiko a ku ri flop it irresponsible good sleep hygiene is for child is development .
102,why are hell bent on telling what we ourselves believe saw on debate too ask them what we believe we tell,why are hell bent on telling leswi hina hi hexe hi pfumelaka ku vona eka debate too vutisa leswaku hi pfumela leswaku hi byela yini hi byela .
103,when the debate is centered around name calling is bound to arise,loko njhekanjhekisano wu kongomisiwe eka ku vitaniwa ka mavito ku bohekile ku humelela .
