,src,trg
1001,we need a top golf closer to this always drive a hour plus for some entertainment,hi lava golf ya le henhla ekusuhi na leswi minkarhi hinkwayo hi chayela awara plus ku kuma vuhungasi byo karhi .
1002,two from made me chuckle third liberation for good entertainment,two from made me chuckle third liberation for vuhungasi lebyinene .
1003,b are matching for s th birthday party,b va fambelana na s th birthday party .
1004,_willcompton will is gold in the entertainment world always down for anything,_willcompton will i nsuku emisaveni ya vuhungasi minkarhi hinkwayo ehansi eka xin'wana na xin'wana .
1005,i cannot i actually sacrifice my sleep entertainment time for such simple yet tough job i would like to have per day,a ndzi nge swi koti hakunene ndzi nyikela hi nkarhi wa mina wa vuhungasi bya vurhongo eka ntirho wo olova swonghasi kambe wo tika lowu ndzi nga tsakelaka ku va na wona hi siku .
1006,prince harry enjoy a date night in after un appearance,prince harry tiphine hi vusiku byo jola endzhaku ka ku humelela ka un
1007,the coin will go far beyond the of popular news and entertainment in addition to the coin new revenue for web site it also the community to develop the buy,mali ya nsimbi yi ta hundza ekule swinene na ya mahungu lama dumeke na vuhungasi ku engetela eka mali ya nsimbi leyintshwa ya mali leyi nghenaka eka web site yi tlhela yi va vaaki ku hluvukisa the buy .
1008,he is not wrong are entertainment and art when you tip the scales in of one it becomes something else they are supposed to be seen on a massive screen that is part of the reason why,a nga hoxanga i vuhungasi na vutshila loko u tiphina hi swikalo eka swa xin’we swi hundzuka nchumu wun’wana lowu va faneleke ku voniwa eka xikirini lexikulu lexi nga xiphemu xa xivangelo xa leswaku ha yini .
1009,better entertainment than and,vuhungasi byo antswa ku tlula na .
1010,sometime the all we want is doing art and it is really an entertainment by ourselves,nkarhi wun’wana lowu hi wu lavaka i ku endla vutshila naswona hakunene i vuhungasi hi hexe .
1011,_rado that s entertainment,_rado leswaku s vuhungasi .
1012,lamar is the big tour center in city tonight with special baby and the center which can seat nearly is within easy walking distance of the entertainment district,lamar i ndhawu leyikulu ya vupfhumba ecity vusiku bya namuntlha na n’wana wo hlawuleka naswona senthara leyi nga tshamaka yi ri ekusuhi na yona yi le kusuhi na ku famba hi milenge yo olova ku suka eka xifundzha xa vuhungasi .
1013,why go speaking for myself many times i am i usually decline yet they insist so i oblige i like millions of have family who are working for the trump circus entertainment can be found almost anywhere if one is looking for it,why go speaking for myself minkarhi yo tala i am i usually decline yet va sindzisa so i oblige i like millions of have family lava va tirhelaka trump circus entertainment va nga kumeka kwalomu ka kun’wana na kun’wana loko munhu a ri karhi a yi lava .
1014,to do it right we d need funds to make the show entertainment unfortunately t free,ku swi endla kahle we d need funds ku endla show entertainment khombo ra kona t free .
1015,and its not only spreading its flooding w pointless content too sure real do that to get attention marketing but thats pertaining to entertainment space it should not cross into politics or news,and its not only spreading its flooding w pointless content too sure real do that to get attention marketing but thats pertaining to entertainment space a yi fanelanga ku tsemakanya yi va tipolitiki kumbe mahungu .
1016,is back this week with another great movie a free screening of the iron giant will take place this on union square in downtown hickory the featured sponsor for this evening of family friendly entertainment is lake hickory realty,is back this week with another great movie xifaniso xa mahala xa xihontlovila xa nsimbi xi ta va kona eunion square entsindza wa hickory muxavisi la kombisiweke wa madyambu lawa ya vuhungasi lebyi nga ni xinghana xa ndyangu i lake hickory realty .
1017,falcon entertainment not giving you what you want,falcon entertainment a yi ku nyiki leswi u swi lavaka .
1018,is a platform with a heavy focus on digital assets privacy digital will focus on gaming and regulation compliance for b b entertainment real estate,i pulatifomo leyi nga na ku kongomisa lokukulu eka vuhlayiseki bya xidijitali vuhlayiseki bya xidijitali byi ta kongomisa eka mintlangu na ku landzelerisa milawu eka b b vuhungasi bya tindlu na misava .
1019,marvel had its exciting finale last week and are still buzzing about an after scene that finally links vellani is young heroine to the m word mutant,marvel yi vile na mahetelelo ya yona yo tsakisa vhiki leri nga hundza naswona ya ha rhurhumela hi xivono xa le ndzhaku lexi eku heteleleni xi hlanganisaka vellani i nhenha leyitsongo na m word mutant .
1020,writer crystal skull were a mistake yes it was a mistake but the film was enjoyable all the same the thrill of jones' and ford were all what was such 'fantastic' are now,writer crystal skull were a mistake yes a ku ri xihoxo kambe filimi a yi tsakisa hinkwaswo leswi fanaka the thrill of jones' na ford hinkwaswo a swi ri leswi a swi ri 'fantastic' sweswi are now .
1021,up about her experience surviving two brain gratitude that she been able to recover after losing quite a bit of the organ,up about her experience ku pona ku tlangela ka byongo byimbirhi lebyi a koteke ku byi hola endzhaku ko lahlekeriwa hi organ yo tala swinene .
1022,you can say that to aka entertainment aka aka egotistic racist himself who is in fact among those people who does not give some credit,u nga vula sweswo eka aka entertainment aka aka egotistic racist hi yexe loyi entiyisweni a nga exikarhi ka vanhu volavo lava nga nyikiki xikweleti xo karhi .
1023,the first season of netflix is resident evil series last dabb expressed interest in familiar from the into future which towering vampiric fan favorite lady,nguva yo sungula ya netflix i resident evil series last dabb u kombisile ku tsakela eka familiar from the into future leyi vampiric fan favourite lady yo tlakuka .
1024,for fist bumping in that s the decision of all time,for fist bumping in that s xiboho xa nkarhi hinkwawo .
1025,i think a good long break is what you need whatever you do do not delete the channel and twitter account you have built up a great and you are a great source of entertainment and do not want to see that go,ndzi ehleketa leswaku long break ya kahle hi yona leyi u yi lavaka xin'wana na xin'wana lexi u xi endlaka u nga susi channel na twitter account leyi u yi akeke yi ri kahle naswona u xihlovo lexikulu xa vuhungasi naswona a wu lavi ku vona leswaku go .
1026,economics as storytelling and entertainment for the economics as part of the entertainment industry,ikhonomi tanihi ku vulavula hi switori na vuhungasi bya ikhonomi tanihi xiphemu xa bindzu ra vuhungasi .
1027,woman hit with racism while at concert at amphitheater,wansati u ba hi xihlawuhlawu loko a ri ekhonsatini eamphitheater .
1028,_boots in the best dense can walk to the grocery store rely on public transit access entertainment and public you can not do that from most of regina is new,_boots in the best dense can walk to the grocery store va titshege hi public transit access entertainment na public a wu nge swi koti ku endla sweswo ku suka eka vunyingi bya regina is new .
1029,the herald is a rag entertainment magazine with yellow so who,the herald i magazini wa vuhungasi bya rag lowu nga na yellow so who .
1030,law order organized crime crew member shot on set of drama yahoo entertainment entertainment law news at,law order organised crime crew member leyi duvuriweke eka set ya drama yahoo vuhungasi bya vuhungasi bya nawu mahungu at
1031,we are dealing this business since year happy to provide you with our reliable service we offer k live k plus all football of series all sports and entertainment and much more,hi le ku xaviseleni ka bindzu leri ku sukela eka lembe hi tsakile ku mi nyika vukorhokeri bya hina byo tshembheka hi nyika k live k plus all football of series all sports and entertainment na swin'wana swo tala
1032,are the best entertainment,i vuhungasi lebyinene ngopfu .
1033,watch a minute video video with host ross entertainment guest are powered by _auctions,languta vhidiyo ya minete leyi nga na mufambisi wa nongonoko ross entertainment guest yi fambisiwa hi _auctions
1034,point being hawke is are disingenuous at worst certainly should approach on their and with an understanding of genre but he is still the idea that there are real and then there is entertainment,point being hawke is are disingenuous at worst certainly should approach on their and with an understanding of genre kambe wa ha ri mianakanyo ya leswaku ku na ya xiviri ivi ku va na vuhungasi .
1035,basically she s dead right,hi xisekelo u file kahle .
1036,this debate is too polite where it s entertainment,mphikizano lowu wu na vutianakanyi ngopfu laha wu nga ta ku tihungasa .
1037,bring back up u better call ur boy to back u up that will tear international entertainment media,buyisa up u better call ur boy ku back u up leyi nga ta handzula swihangalasamahungu swa vuhungasi bya matiko ya misava
1038,we are to announce the first ever comedy contest and from golden entertainment sign up now for the contest vote now cash management classes meet and,hi fanele ku tivisa mphikizano wo sungula wa vuhlekuri naswona ku suka eka golden entertainment tsarisa sweswi eka mphikizano vhoti sweswi titlilasi ta vulawuri bya mali ti hlangana na .
1039,video entertainment in,vuhungasi bya vhidiyo hi .
1040,maybe you just are not a sports entertainment fan,kumbexana u lo va muyingiseri wa vuhungasi bya mintlangu ntsena .
1041,_life like i said i am tired of the group and how you have to fall in line or else i a movement to save entertainment i got into a stupid civil war society of who think teaching to is as bad as the left racism,.
1042,waiting for ur entertainment,ku rindza vuhungasi bya ur .
1043,no matter how bad are you can at least be happy that you woke up this morning good morning,ku nga khathariseki leswaku u nga tsaka ku fikela kwihi at least ku va u pfukile mixo lowu good morning .
1044,the new documentary on streaming today i spoke with about ryan is that will likely never be broken from no to to an,documentary leyintshwa ya streaming namuntlha leyi ndzi vulavuleke na yona hi ryan hi leswaku swi nga endleka yi nga tshuki yi tshoveka ku suka eka no to an .
1045,a train was made for a one take action sequence  ishamshera' director,xitimela xi endleriwe ku endla one take action sequence ishamshera' director .
1046,you judge too much from a single video which was clearly taken for entertainment,u avanyisa ngopfu hi vhidiyo yin’we leyi a yi ri erivaleni leswaku yi tekiwile leswaku yi ta hungasa .
1047,bad couple of for they have had to turn on joe rogan musk soon the only entertainment that will not be a trump enemy will be the weather channel,bad couple ya for va boheke ku hundzukela joe rogan musk ku nga ri khale vuhungasi lebyi nga ta ka byi nga vi nala wa trump ku ta va ku ri weather channel .
1048,everyone who some entertainment come read this thread church and youth are crazy,un'wana na un'wana loyi a nga ta tihungasa a hlaya thread leyi kereke na vantshwa va penga .
1049,the world is not just a video game and not just made for entertainment is a new tool for communicating in a new style and each individual to start up his own business,misava a hi ntlangu wa vhidiyo ntsena naswona a hi ku endleriwa vuhungasi ntsena i xitirho lexintshwa xo vulavurisana hi xitayili lexintshwa ni munhu un’wana ni un’wana leswaku a sungula bindzu rakwe .
1050,the colonel show from on smile radio home of the best,the colonel show from on smile radio home of the best
1051,because entertainment,hikuva vuhungasi .
1052,i lose every time i point this out i am not talking about who often have no choice survival wise but if the vast majority choose public health over fleeting entertainment it people and an economic message that 'fend for yourself' is not viable,ndzi lahlekeriwa hi nkarhi wun’wana na wun’wana loko ndzi kombisa leswi a ndzi vulavuli hi leswaku i mani loyi a talaka ku va na ku hlawula ku pona hi vutlhari kambe loko vunyingi lebyikulu byi hlawula rihanyo ra vaaki ku tlula vuhungasi bya nkarhinyana bya it vanhu na rungula ra ikhonomi leri ‘tirheleke’ ri nga humeleriki .
1053,caravan s story of struggle to north,xitori xa caravan s xa ku lwela ku ya en'walungwini .
1054,sparks entertainment red carpet premiere for maid to kill is tomorrow night,sparks entertainment red carpet premiere ya maid to kill i mundzuku nivusiku
1055,when of a production team were june they had been a segment for the show said the unlawful entry case was not strong enough to pursue,loko ya ntlawa wa vuhumelerisi a ku ri june va vile xiphemu xa nkombiso va vule leswaku nandzu wo nghena lowu nga riki enawini a wu tiyile ku ringana ku hlongorisa .
1056,_ we should be the latter our constitutional republic the of its destruction when a corrupt party without moral control of the looking for entertainment instead of leadership,_ hi fanele ku va le ndzhaku ka vumbiwa bya hina republic the ya ku lovisiwa ka yona loko vandla ra vukungundzwana leri nga riki na vulawuri bya mahanyelo bya ku lava vuhungasi ematshan'wini ya vurhangeri .
1057,boy is 'last last' billboard hot debut,boy is 'last last' billboard hot debut .
1058,i know people will slam him for airing his dirty laundry but that s an old fashioned take basically saying nobody should talk about their and whilst there were shallow people seeing it as entertainment i watched the whole thing and cried several times often,ndza swi tiva leswaku vanhu va ta n'wi slam for airing his dirty laundry but that s an old fashioned take basically saying a ku na munhu loyi a faneleke ku vulavula hi vona and whilst a ku ri na vanhu lava nga ehansi va swi vona tani hi vuhungasi ndzi hlalele mhaka hinkwayo ndzi rila minkarhi yo hlayanyana nkarhi na nkarhi .
1059,real honest review rant woke disaster or great new series i watched the whole series and here is what i have to say,real honest review rant woke disaster or great new series ndzi hlalele nongonoko hinkwawo naswona hi leswi ndzi nga na swona ku swi vula .
1060,do not miss this comment for all global and m elite you are more than personal best and entertainment spectacles,u nga hundziwi hi comment leyi eka hinkwaswo swa global na m elite u tlula ku va munhu hi xiyexe best na entertainment spectacles .
1061,_aleph i had a whose head unit did not have requisite chips to make car play possible so someone saved a few will cost the end user k to get an essential entertainment feature,.
1062,in the s a new breed of rock organized for abortion could that happen today,eka s muxaka wuntshwa wa ribye lowu hleleriweke ku susa khwiri swi nga endleka leswaku swi nga endleka namuntlha .
1063,fox news t that bad they re just partisan like i want to be partisan it s fox opinion entertainment at night that are the overt,fox news t leswaku bad va re just partisan like ndzi lava ku va partisan it s fox opinion entertainment nivusiku leyi nga overt
1064,_tory _fabricant you need to get out more air show is not put on for public entertainment,_tory _fabricant u fanele ku huma more air show a yi vekiwi eka vuhungasi bya mani na mani
1065,is now streaming theft auto,sweswi i streaming theft auto .
1066,wait does not group to entertainment why here it  is mention entertainment or else the new rookie have made mistake,wait does not group to entertainment why laha ku boxiwa entertainment or else rookie leyintshwa yi endle xihoxo
1067,that is what i have been saying it is the entertainment industry and he needs these people and this interaction to get known as he does i would never visit his concert ore any that is not my place if any i support him in whatever he does x,hi swona leswi ndzi nga tshama ndzi swi vula leswaku i bindzu ra vuhungasi naswona u lava vanhu lava naswona ku tirhisana loku ku tiviwa hilaha a endlaka hakona a ndzi nge pfuki ndzi endzele khonsati ya yena ore any that is not my place if any i support him in whatever he does x .
1068,well is not that a total shock who would have the army of locked comment support of random pretty off would be fake,kahle kahle a hi leswaku total shock leyi a yi ta va na vuthu ra locked comment support ya random pretty off swi ta va swi ri fake .
1069,why are you so good my experience on on th was the best i had in domestic flight be it cozy cabin comfortable inch entertainment eye pleasing safety instruction across and your meal definitely d best,why are so good my experience on on th was the best i had in domestic flight be it cozy cabin comfortable inch entertainment eye pleasing safety instruction across and meal ya wena definitely d best
1070,_nova this really is just entertainment at this point,_nova leswi hakunene i vuhungasi ntsena eka nkarhi lowu .
1071,we are not irrelevant pink music video for new song 'irrelevant ' and racism in the us,a hi music video ya pink leyi nga riki ya nkoka ya risimu lerintshwa ra 'irrelevant ' na xihlawuhlawu eus .
1072,am i watching s of love and hip hop for entertainment absolutely,am i watching s of love na hip hop for entertainment hi ku helela .
1073,follow on apple,landzela eka apple .
1074,i been thinking this for some they saw how useful was how staid she now and decided to carry the perverse percentage this way it s entertainment it s publicity notoriety and i m certain if the inner to stop it they would,ndzi vile ndzi ehleketa leswi eka van'wana va vone ndlela leyi a pfunaka ha yona leswaku yena u tshamisekile ku fikela kwihi sweswi naswona u endle xiboho xo rhwala phesente yo homboloka hi ndlela leyi it s entertainment s publicity notoriety and i m certain if the inner to stop it they would .
1075,is one of the that built sports entertainment and ran as their chief commercial officer for over four he also worked for the new york square garden entertainment corp prudential center and the new jersey,i yin’wana ya leti a ti aka vuhungasi bya mintlangu naswona yi tsutsume tanihi mutirhela-mfumo wa vona lonkulu wa mabindzu hi mali yo tlula mune u tlhele a tirhela new york square garden entertainment corp prudential center na new jersey .
1076,in this glittering satire about greed excess and human folly aim at our tenuous class system and a kill shot a great interview with for about her new novel the pink hotel out today,eka xitlhokovetselo lexi xo hatima mayelana na makwanga ku tlula mpimo na vuphukuphuku bya vanhu ku kongomisa eka sisiteme ya hina ya tlilasi yo olova na ku dlaya ku duvule mbhurisano lowukulu na eka kwalomu ka novhele ya yena leyintshwa ya the pink hotel out today .
1077,a well timed article from we got our first air conditioned subway in the s,xihloko lexi nga ni nkarhi wo tala ku suka eka hi kume xitimela xa hina xo sungula xa xitimela xa le hansi ka misava lexi nga ni moya wo titimela eka s .
1078,_mantra after you pay income tax you pay municipal tax house tax fee road tax toll tax professional tax interest on entertainment tax custom duty and of on these,.
1079,a video of some dancing left social media buzzing with due to the nature of their style there was not much left to the imagination as they energetically,vhidiyo ya ku cina kun’wana yi siye social media yi ri karhi yi rhurhumela hikwalaho ka muxaka wa xitayili xa vona a ku nga ri na swo tala leswi a swi sele eka miehleketo tanihi leswi va nga ni matimba .
1080,pinnacle entertainment group curse of the crimson throne thanks preorder news,pinnacle entertainment group curse of the crimson throne hi khensa mahungu ya le mahlweni
1081,a new hero the gladiator of the in the wonderful world of welcome,nhenha leyintshwa the gladiator ya le misaveni yo hlamarisa ya welcome .
1082,pinnacle entertainment group final week for our summer on and graphic novel,vhiki ro hetelela ra ntlawa wa vuhungasi wa le pinnacle eka novhele ya hina ya ximumu na graphic novel .
1083,best and worst stocks in spy so far today best entertainment carnival royal worst j j azo,switoko swa kahle swinene na swo biha eka tinhlori ku fikela sweswi namuntlha vuhungasi byo antswa carnival royal worst j j azo
1084,pinnacle entertainment group licensee spotlight from dog house,pinnacle entertainment group munyiki wa layisense ya swivoni swa le henhla ku suka eka yindlu ya mbyana
1085,for insurance i had to sign a form agreeing that i do not work in the entertainment business as a jazz musician in i felt confident making that assertion,eka insurance ndzi boheke ku sayina fomo ndzi pfumela leswaku a ndzi tirhi eka bindzu ra vuhungasi tanihi muyimbeleri wa jazz eka i felt confident making that assertion .
1086,it is a form of awareness creation to keep to youth glue to your brand you need to be consistent constantly selling your candidate in a way that to them which is entertainment,i xivumbeko xa ku tumbuluxiwa ka vutivi ku hlayisa eka vantshwa glue eka brand ya wena u fanele ku va consistent nkarhi hinkwawo u xavisa candidate ya wena hi ndlela leyi eka vona leyi nga vuhungasi .
1087,pinnacle entertainment group of the savage community survey,ntlawa wa vuhungasi wa pinnacle wa savage community survey .
1088,live open roof with carol catch all the latest entertainment and gossip around town all in one show,live open roof with carol catch all the latest entertainment and gossip around town hinkwaswo eka nkombiso wun’we
1089,_intro _mumbaikar gift city financial not interested move in but token presence due pressure from coz there is no non food no entertainment no golf no can not be international city compare with port,_intro _mumbaikar gift city financial not interested move in kambe vukona bya token lebyi faneleke ku suka eka coz a ku na non food no entertainment no golf no a swi nge vi swa matiko ya misava ku pimanisa na port
1090,the jane was top tier entertainment i remember loving as a child and one of the main for that was and their relatability was insane their talent even back then on show about time they were brought back,the jane was top tier entertainment i remember loving as child and one of the main for that was and relatability ya vona a yi penga talenta ya vona hambi ku ri hi nkarhi wolowo hi nkarhi wolowo hi nkarhi lowu va vuyisiweke ha wona .
1091,what the hell is this a tap against a glass full of bubbling black tar living latex entertainment department an improvement to the synthetic second skin huh what is it do you ever read a about living armor what,what the hell is this a tap against a glass leyi taleke hi bubbling black tar living latex entertainment department an improvement to the synthetic second skin huh i yini lexi u nga tshama u xi hlaya a about living armor what
1092,_kitty you are cheap entertainment,_kitty u vuhungasi byo chipa .
1093,skipping available everywhere,ku skipa swi kumeka hinkwako-nkwako .
1094,across new prime day block buster down great entertainment join _pr ya,ku tsemakanya new prime day block buster down vuhungasi lebyikulu hlanganyela _pr ya
1095,inside devgan is vacation with,endzeni ka devgan i nkarhi wo wisa na .
1096,no if you watch than they provide you with entertainment and a different faster style than the the sane way all sports provide with entertainment,hayi loko u hlalela ku tlula ku ku nyika vuhungasi na xitayili xo hambana xo hambana ku tlula the sane way all sports provide with entertainment .
1097,_heady_again best entertainment ever,_heady_again vuhungasi bya le henhla ever ever
1098,you can not force a viral trend or a but if you keep providing people with entertainment it is bound to happen,a wu nge sindzisi viral trend kumbe a kambe loko u tshamela ro nyika vanhu vuhungasi swi bohekile ku humelela .
1099,are made in heaven or hell to find out watch happily ever after on,swi endliwa etilweni kumbe etiheleni ku kuma ku hlalela hi ntsako ku ya emahlweni .
1100,hi i m the over at and i would like to state for the record that we have no business of any kind with or sparks entertainment and had never of those up until this moment when we saw this tweet,hi i m the over at naswona ndzi lava ku vula ku kuma rhekhodo leswaku a hi na bindzu ra muxaka wihi na wihi na kumbe sparks entertainment naswona a hi nga si tshama hi va lava ku fikela eka nkarhi lowu loko hi vona tweet leyi
1101,on the with the rock goddess total entertainment via,on the na the rock goddess total entertainment via .
1102,nothing wrong with film are entertainment consume as much or as little as you want,a ku na lexi hoxeke hi filimi i vuhungasi lebyi dyaka ngopfu kumbe byintsongo hilaha u lavaka hakona .
1103,the victim you the one crying he himself his all this i t no victim i m just and you provided me with min of entertainment while you rage,muhlaseriwa wena loyi a rilaka yena hi yexe hinkwaswo leswi i t no victim i m just and u ndzi nyikile min ya vuhungasi loko u ri karhi u rage
1104,who needs a fresh new punk t shirt all sizes some great colors and free shipping it is a great way to support our little independent book,i mani loyi a lavaka fresh new punk t shirt all sizes some great colours and free shipping i ndlela ya kahle yo seketela buku ya hina leyitsongo yo tiyimela hi yoxe
1105,express his to singh,hlamusela ya yena eka singh .
1106,here is some utility is hosting a party in a castle in with entertainment and a free for all this is awesome and me happy to have a piece of trevor is work in my collection,hi lowu wun’wana wa vukorhokeri i ku khoma nkhuvo exigodlhweni eka entertainment na mahala eka hinkwaswo leswi swa chavisa naswona mina ndzi tsakile ku va na xiphemu xa trevor i ntirho eka nhlengeleto wa mina .
1107,are you business owner and want to your like this then this and register your business free,are you business owner and want to your like this then this and register business ya wena mahala
