,src,trg
483,dude someone just told me to educate myself because i why a restaurant that sauce daily and it in the would need to put in the sauce if dump it nightly like its not an intense political debate,dude munhu un'wana u ndzi byele ntsena leswaku ndzi tidyondzisa hikuva mina why a restaurant that sauce daily and it in the a swi ta lava ku veka sauce loko yi ri karhi yi lahlela vusiku na nhlikanhi like its not an intense political debate .
484,this must be front and center of the debate at the next rushed trade the new domestic agricultural policy in of which their is none certainly not for food and the removal of critical support for the rural economy particularly in,leswi swi fanele ku va emahlweni na le xikarhi ka njhekanjhekisano eka bindzu leri landzelaka leri hatlisisiweke pholisi leyintshwa ya vurimi bya laha kaya leyi eka yona ya vona yi nga riki yona hakunene ku nga ri ya swakudya na ku susiwa ka nseketelo wa nkoka eka ikhonomi ya le makaya ngopfungopfu eka .
485,did win the debate for sure,did win the debate for sure .
486,we stop trying to debate that for now,hi tshika ku ringeta ku debate sweswo for now .
487,giving my honest view on yesterday is debate to me really did it well explaining the manifesto the was good but there was of especially from who came to debate with rather than credit to she kept,ku nyika vonelo ra mina ro tshembeka eka tolo i njhekanjhekisano eka mina hakunene swi endle kahle ku hlamusela manifesto the was good but there was of especially from who came to debate with rather than credit to she kept .
488,indeed debate not,hakunene njhekanjhekisano hayi .
489,_ramesh the problem with congress been that they have merely perfected the art of spreading misinformation to confuse innocent people rather than to they are actually reluctant to debate or discuss in parliament but cause disruption,.
490,ya post debate analysis who it,ya post debate analysis .
491,running spar in debate,ku tsutsuma spar eka debate .
492,give the we miss to here him talk from that i conclude that presidential debate he will be embarrassed at na pressure,give the we miss to here him talk from that ndzi gimeta hi leswaku president debate u ta khomiwa hi tingana eka na pressure .
493,same goes for darts snooker horse racing though whether those are pure athletic sports is another debate,same goes for darts snooker horse racing though loko sweswo swi ri pure athletic sports i njhekanjhekisano wun’wana .
494,_of_debate _bobby _fatal _s _dr _felinemenace _damn_muteki _clarkej _exists why do you think men or doing  istereotypical feminine' them men and can present themselves any way they want any way they enjoy or feel comfortable the very fact of in 'feminine' ways does not change their sex or  ishame them',. kumbe ishame vona' .
495,d you can keep quiet to talk please we can organize another debate with,d u nga miyela ku vulavula hi kombela hi nga hlela njhekanjhekisano wun'wana na wona .
496,when i said can not debate your one of them we from tribal thing air your opinion tribal,loko ndzi ku can't debate your one of them we from tribal thing air mavonelo ya wena tribal .
497,he was my debate teacher my creative writing teacher and my teacher and he tragically of way too young but he made me who i am my heart for,a a ri mudyondzisi wa mina wa debate mudyondzisi wa mina wo tsala hi vutshila na mudyondzisi wa mina naswona hi ndlela yo vava hi ndlela yo va ntsongo swinene kambe u ndzi endlele leswi ndzi nga swona mbilu ya mina hikwalaho ka .
498,the debate and clubbing do not have any,njhekanjhekisano na ti clubb a swi na swona .
499,we are just going to get into a debate on what a legitimate therapy is but plenty of people drink all the time to cope with and they continue to do so because it works,hi ta nghena ntsena eka njhekanjhekisano wa leswaku vutshunguri lebyi nga enawini i yini kambe vanhu vo tala va nwa nkarhi hinkwawo ku langutana na swona naswona va ya emahlweni va endla tano hikuva swa tirha .
500,of those who watched the debate agree on one thing those who did a good job what this is that left on his own cannot hold a meaningful discourse a leader does not need to be on how to lead that is a failure,eka lava va hlaleleke njhekanjhekisano va pfumelelana eka nchumu wun’we lava endleke ntirho lowunene leswaku leswi hi swona leswi saleke hi yexe a va nge khomi mbulavulo lowu nga ni nhlamuselo murhangeri a nga lavi ku va wa ndlela yo rhangela leswaku i ku tsandzeka .
501,i am behind truss i can not trust and definitely not not sure why he is so popular amongst mp is worrying henry truss' leadership launch,i am behind truss i can not trust and definitely not sure ku why a tsakeriwa ngopfu hi mp is worrying henry truss' leadership launch
502,did she say or did you even watch the debate ama ni tweet the calibre of we have in,did she say kumbe u endle hambi ku ri ku hlalela debate ama ni tweet caliber ya we have in .
503,how can i lie and we all watched the debate if can be what is the price of kerosene and he by saying that i dont go to what kind of leadership will this person when,ndzi nga hemba njhani naswona hinkwerhu hi hlalele njhekanjhekisano loko wu nga va wu ri yini nxavo wa pharafini naswona yena hi ku vula leswaku a ndzi yi rhanga ku ya eka vurhangeri bya muxaka muni lebyi munhu loyi a nga ta .
504,above average he gave a government to expect in case the opposition government into power important as that what the debate should be all about how hungry they are for power but not to help a local is the best can ever get,ehenhla ka avhareji u nyikile mfumo ku langutela loko ko tshuka ku va na mfumo wa nkaneto eka matimba ya nkoka tani hi leswaku leswi njhekanjhekisano wu faneleke ku va hinkwaswo mayelana na ndlela leyi va nga na ndlala ha yona eka matimba kambe ku nga pfuni munhu wa laha kaya is the best can ever get .
505,u r a catch up debate congratulatory comes immediately wen leave stage,u r a catch up debate congratulatory yi ta hi ku hatlisa wen leave stage .
506,your was debating against and was not in the debate realistically and do not know who they are actually against you cant compete against yourself,your was debating against and a yi nga ri kona eka debate realistically and a yi tivi leswaku kahle kahle va lwisana na mani cant compete against yourself .
507,the debate was reduced to mere inquiry digging into personal life at the expense of real affecting the common man _servant,mphikizano wu hungutiwile wu va ku vutisa ntsena ku cela eka vutomi bya munhu hi xiyexe hi ku lahlekeriwa hi ku khumba ka xiviri munhu wo tolovela _nandza .
508,_aplha certainly is weird that s not up for debate,_aplha hakunene i weird leswaku s not up for debate .
509,straight on debate it s a tough gig and simp conspiracy push him aside and have a drink,straight on debate it s a tough gig na simp conspiracy yi n'wi susumeta etlhelo u nwa byala .
510,_poole the debate on news would have been delicious and a fantastic way to remind the state funded that they re supposed to serve us and not the other way round,.
511,_damn_muteki _of_debate _felinemenace _bobby _s _dr _clarkej as of this year,.
512,debate we did not even get a medal in the men is m event,debate a hi kumanga hambi ku ri mendlele eka vavanuna i m event .
513,_ flash forward advise not to attend that debate the opponent is a known lethal dangerous armed with with a sting of a wasp on the other hand is used to his all time song corruption that is all he but no feasible plan to solve he will be,.
514,let the debate on be about graft are deep and muddy no politician is clean we know that case of the pot calling the kettle black,a ku ve njhekanjhekisano wa be about graft are deep and muddy no n'watipolitiki wu basile ha swi tiva leswaku case ya poto ri vitana kettle black .
515,let us not lie to did nothing in his debate he should learn to have respect especially to his boss president he is being a question and then answer what he not been,a hi hembeni a nga endlanga nchumu eka debate ya yena a fanele a dyondza ku va na xichavo ngopfu ngopfu eka boss president ya yena a ri ku va xivutiso ivi a hlamula leswi a nga riki swona .
516,is top tier my voice was ahead of it s time literally the blue print and it s not up for debate,is top tier rito ra mina a ri ri emahlweni ka it s time literally the blue print and it s not up for debate .
517,the debate was about their and what they plan to do for it is was not about the mess himself about not time to explain what brought him there some of you should focus with na,mphikizano a wu ri wa vona na leswi va kunguhataka ku swi endla eka swona a ku nga ri hi mpfilumpfilu hi yexe mayelana na ku nga hlamuseli leswi n’wi tiseke kona van’wana va n’wina mi fanele ku focus na na .
518,an adult is how they will deal with and they will never disagree is the height of idiocy that i in that debate yesterday,munhu lonkulu i ndlela leyi va nga ta langutana na yona naswona a va nge pfuki va pfumelelanile i ku tlakuka ka vuphukuphuku lebyi mina eka njhekanjhekisano wolowo tolo .
519,debate and just say me is broke as nonsense,debate and just say me yi broke as nonsense .
520,did you just wake up because this debate yesterday,xana u lo pfuka ntsena hikuva debate leyi tolo .
521,you clearly seem to have plenty of time for ad but nothing any content and or i do not believe you have enough knowledge or intelligence to have a debate so you go straight to personal to hide your it is so typical,u vonaka swi ri erivaleni leswaku u na nkarhi wo tala wa ad kambe ku hava nchumu wihi na wihi wa nhundzu naswona kumbe a ndzi tshembi leswaku u na vutivi lebyi eneleke kumbe vutlhari byo va na njhekanjhekisano so u kongoma eka personal ku fihla ya wena it is so typical .
522,no each contributor to state their and as an aside it is since an inconvenient truth and none of those have come to fruition we have to stop hysterical headline and have a reasoned debate,hayi un'wana na un'wana loyi a hoxaka xandla ku vula vona na tani hi aside it is since an inconvenient truth and akuna na un'we wa lava va nga fika a humelela hi fanele ku yimisa hysterical headline and have a reasoned debate .
523,_singh sir parliament is a place to discuss debate on protest should be done on road not in parliament,_singh sir palamende i ndhawu yo burisana hi njhekanjhekisano wa ku kombisa ku vilela wu fanele ku endliwa endleleni hayi epalamende .
524,the bathroom debate gave it a nice ring of the last decade not lie the why the document was right now are all too obvious,mphikizano wa le bathroom wu yi nyike ring ya kahle ya khume ra malembe lawa ya hundzeke a hi hemba leswaku why document was right now all too obvious .
525,if anyone is a it is truss who the loyal card and clung on to her job but was forced to admit would not be welcome in her cabinet at sunday is debate,loko munhu a ri it is truss who the loyal card and clung on to her job but a sindzisa ku pfumela leswaku a nga ta amukeriwa eka khabinete ya yena hi sonto is debate .
526,i challenge you to a debate about the ethics of to conquer,ndzi mi tlhontlha eka njhekanjhekisano mayelana na mahanyelo ya ku hlula .
527,__g sen alan we be more than happy to debate with anyone who to the bill but if we might be forced to go to the supreme court to question the validity of the said bill,.
528,withdrawal by subsequent cancellation of the debate becomes more understandable when you see those telling each other what a mess the tory government s made during their tenure when today s the day do as i do,ku hoxa hi ku herisiwa loku landzelaka ka njhekanjhekisano ku va loku twisisekaka swinene loko u vonana va byelana leswaku i mpfilumpfilu wihi lowu mfumo wa tory wu wu endleke hi nkarhi wa vona loko namuntlha s the day do as i do .
529,all those saying is in the us can we beg to a debate for him and in the us let is see who will fail to show up i intentionally peter name cos i do not see him as a serious candidate he is a waste of time,hinkwaswo leswi swi vulaka swi le us swi nga kombela eka debate ya yena and in the us let is see ku i mani a nga ta tsandzeka ku ti komba i intentionally peter name co a ndzi n'wi voni tani hi serious candidate a ri ku tlanga hi nkarhi .
530,that debate was for the not short sighted,njhekanjhekisano wolowo a wu ri wa ku nga voniwi hi ku komisa .
531,yes its like the show soon as the question is difficult they do not want open debate what is it going to be like at question time sorry that is to difficult to answer i will deal with it next week house full of fool is election next,yes its like the show soon as question ya tika a va lavi open debate ku swi ta va njhani at question time sorry ku swi tika ku hlamula i will deal with it next week house full of fool is election next
532,i have been supporting and but after this debate and listening to i have my mind i am now supporting ruto is journey to i now go back to my commitment h e,ndzi vile ndzi seketela naswona kambe endzhaku ka njhekanjhekisano lowu na ku yingisela ndzi na miehleketo ya mina sweswi ndzi seketela ruto i riendzo ro ya eka mina sweswi ndzi tlhelela eka ku tinyiketela ka mina h e .
533,_kinuthia even the of yesterday is were itumbi is advise the old man to keep off the or better still make sure the of their debate are ma cow wa freedom is coming,.
534,sir parliament is a place to discuss debate on protest should be done on road not in parliament,sir palamende i ndhawu yo burisana hi njhekanjhekisano wa ku kombisa ku vilela wu fanele ku endliwa endleleni hayi epalamende .
535,yesterday debate had so many main affecting were not i think the should change tact in the upcoming presidential debate,tolo debate had so many main affecting were not i think the should change tact eka njhekanjhekisano wa vupresidente lowu taka .
536,why just there are people on both sides who are crazy we need more people in the middle who can actually just debate and have without just being dismissive and abusive i feel like that use to happen but not,why just there are people on both sides lava va pengaka hi lava vanhu vo tala exikarhi lava kahle kahle va nga just debate and have without just being dismissive and abusive i feel like that uvot to happen but not .
537,it was a political matter the congress to debate and create policy there is no precise language in the constitution about abortion which in his opinion the congress no constitutional on abortion related legislation,a ku ri mhaka ya tipolitiki congress ku kanetana no tumbuluxa pholisi a ku na ririmi leri kongomeke eka vumbiwa mayelana na ku susa khwiri leri hi ku vona ka yena congress ku nga ri na vumbiwa eka milawu leyi fambelanaka na ku susa khwiri .
538,_ramesh the chairman the opposition to allow the question hour continue smoothly then a debate on price rise will b taken up why you people r not the question hour to take place,.
539,you do not do political debate you throw mud to see what sticks,a wu endli political debate u lahlela ndzhope ku vona leswi sticks .
540,for goodness sake collect tax more efficiently and fund social properly left shaking their as ambulance ramping debate the point hill,for goodness sake hlengeleta xibalo hi ndlela leyinene na ku seketela social kahle left shaking the their as ambulance ramping debate the point hill .
541,the difference between fact and truth is a philosophical even moral debate i believe it does exist the problem with his statement i think is that it is intended for mischief and a weighty issue he is a philosophical point to distract,ku hambana exikarhi ka ntiyiso na ntiyiso i filosofi hambi ku ri njhekanjhekisano wa mahanyelo ndzi pfumela leswaku wu kona xiphiqo xa xitatimende xa yena lexi ndzi ehleketaka leswaku i xa leswaku xi endleriwe vubihi naswona i mhaka yo tika i yinhla ya filosofi ku kavanyeta .
542,the debate the other day check it out on the,njhekanjhekisano siku rin’wana wu wu languta eka .
543,why is twitter this tweet censorship debate and suspicion,ha yini twitter yi ri eka tweet censorship debate leyi na ku kanakana .
544,if i do not respond immediately please do not block me only available from to am till further notice i am a shy conservative girl who is open to debate believe me when i say i am not a hateful person i am open to new idea debate me if you dare you open,loko ndzi nga hlamuli hi ku hatlisa ndzi kombela u nga ndzi blocki ntsena a kumeka ku suka eka ku ya emahlweni ku fikela emahlweni notice i am a shy conservative girl loyi a pfulekeke ku debate kholwa loko ndzi ku a ndzi munhu wo venga ndzi pfulekile eka new idea debate me if . u na xivindzi xo pfula .
545,stop watching the debate yesterday the st was better the one we t discuss the proper,tshika ku hlalela debate tolo st a swi antswa loyi hi t discuss the proper .
546,why is it even a debate i respect both to death but in my book gasly is much better,why it even a debate i respect both to death kambe ebukwini ya mina gasly swi antswa swinene .
547,i did not know you reason to this extent the debate was not policy driven,a ndzi nga swi tivi leswaku u ehleketa ku fika eka mpimo lowu njhekanjhekisano a wu nga fambiwi hi pholisi .
548,please stop in news so that everyone can live in peace its the media who on baseless and create disturbance between and the result of the debate is nothing but only violence,hi kombela mi yima eka mahungu leswaku un'wana na un'wana a ta hanya hi ku rhula its the media who on baseless and create disturance between na mbuyelo wa njhekanjhekisano a hi nchumu handle ka madzolonga ntsena .
549,have to agree with de on this the issue of how disabled will be to access t was not fully by the minister in her response to the debate about scrapping i hope will think again fast about the way it is doing this,va fanele ku pfumelelana na de eka leswi mhaka ya leswaku va lema ku fikela kwihi ku fikelela t a yi nga ri hi ku helela hi holobye eka nhlamulo ya yena eka njhekanjhekisano mayelana na ku scrapping i hope will think again fast about the way it is doing this .
550,could turn into a debate but mostly i just to actually sit down with an open mind hopefully you do the same and just talk about our and why we think the we do rather than trying to claim one being right or something learn about our,swi nga hundzuka njhekanjhekisano kambe ngopfu-ngopfu mina ntsena ku tshama ehansi hakunene hi mianakanyo leyi pfulekeke hi tshemba leswaku na wena u endla leswi fanaka ivi u vulavula ntsena hi hina ni leswaku ha yini hi ehleketa leswaku hi endla ku tlula ku ringeta ku vula leswaku munhu u lulamile kumbe swin’wana swo dyondza hi swa hina .
551,you have an appointment with president joe on the day of the presidential debate how true,u na ku thoriwa na president joe hi siku ra njhekanjhekisano wa vupresidente leswaku i ntiyiso njhani .
552,climate do nothing but debate not our fault if you prefer crackpot conspiracy over reality,climate a yi endli nchumu handle ka debate hayi xihoxo xa hina loko u tsakela crackpot conspiracy ku tlula ntiyiso .
553,watching debate and it is like watching two argue over nothing,ku hlalela debate and swi fana na ku hlalela vambirhi va kanetana hi nchumu wun'wana .
554,_ron when the debate is lost slander becomes the tool for the loser,.
555,_makokha as the dust on the of a debate we were with that threat is one of the that will rear its head and it will not be a beautiful one,.
556,this video clip was a split second away from making it to s debate on on safety of,video clip leyi a yi ri second second ku suka eka ku endla s debate on on safety of .
557,did delete a post debate poll after it leading,did delete post debate poll endzhaku ka loko yi rhangele .
558,was there to debate not,was there ku debate not .
559,we will not let putin is rich hide in the,a hi nge pfumeleli putin a fuwile hi ku tumbela eka .
560,you may have a point there i always assumed he an that somewhat itself on semi intellectual debate if indeed he himself as nothing more than outrageous comedian then the mistake to those who take him as more myself included,u nga ha va na yinhla kwalahaya ndzi tshama ndzi ri karhi ndzi ehleketa leswaku an that somewhat itself on semi intellectual debate loko hakunene yena hi yexe tani hi nchumu wun’wana handle ka vuhlekuri bya vukarhi kutani xihoxo eka lava va n’wi tekaka tani hi leswi van’wana hi ndzexe ndzi katsiweke .
561,_sam_dav right i want someone to watch it w me and then go on a full rabbit hole about the episode and then debate and it and then watch another one i am a very specific acquired taste,.
562,in the next presidential debate remind that it is he is debating not,eka njhekanjhekisano lowu landzelaka wa vupresidente tsundzuxa leswaku i ku kanetana hayi .
563,_tibet to she won the debate,_tibet to she won the debate .
564,if g made stammer the whole debate i hope an excuse to not attend that debate cos it will be chaotic here,loko g make stammer the whole debate ndzi tshemba leswaku xivangelo xo ka va nga vi kona eka debate yaleyo cos swi ta va na mpfilumpfilu laha .
565,that is cool you want to have a semantical debate but i do not agree with your premise you may think a blastocyst in a uterine wall a right to and i would think you are either dumb or not in good faith in my experience it is usually the latter,sweswo swa tsakisa u lava ku va na njhekanjhekisano wa semantiki kambe a ndzi pfumelelani na premise ya wena u nga ha ehleketa hi blastocyst eka rirhangu ra mbeleko a right to and ndzi nga ehleketa leswaku u mbheveve kumbe u nga ri na ripfumelo eka ntokoto wa mina hi ntolovelo i . sweswi
566,what is your take on last night is deputy presidential debate,i yini ku teka ka wena eka vusiku bya tolo i deputy president debate .
567,_ is so brilliant and honest and articulated her very well hope will follow suit you will only fail if you allow to take control of the debate and spread his usual,.
568,_tibet it is only i saw in that debate,_tibet i ntsena ndzi swi vonile eka njhekanjhekisano wolowo .
569,whether to spend money on outer space exploration or to apply it to solve serious on earth like climate change and food is a contentious debate,leswaku u ta tirhisa mali eka ku lavisisa exibakabakeni kumbe ku yi tirhisa ku tlhantlha swinene emisaveni ku fana ni ku cinca ka maxelo ni swakudya i njhekanjhekisano lowu nga ni njhekanjhekisano .
570,the only way his life was by lining his up from gullible when he his book just look at him debate against and you will see how much of a phony he is he literally his platform with an atheist,ndlela yin’we ntsena leyi vutomi bya yena a ku ri hi ku lining his up from gullible loko yena buku ya yena yi n’wi languta ntsena debate against u ta vona leswaku he is phony ku fikela kwihi he literally platform ya yena na atheist .
571,everyone is preferred candidate won the debate,un'wana na un'wana u tsakeriwa muhlawuriwa wo hlula eka njhekanjhekisano .
572,empty seat at the policy table i write about the need for more and balance in the digital economy policy debate look forward to your,xitulu lexi nga riki na nchumu eka tafula ra pholisi ndzi tsala hi xilaveko xa swo tala na ku ringanisela eka njhekanjhekisano wa pholisi ya ikhonomi ya xidijitali hi mahlo-ngati ku langutela ka wena .
573,i tend to prefer broadcast order anyways and its much easier to find normally there even a debate either most people say to only do chronological for i only figured id ask this is the only time seen a ton of people say both,i tend to prefer broadcast order anyways and its much easier to find normally there even a debate either most people say to only do ntsena chronological for i only figured id ask this is the only time seen a ton of people say both both say both .
574,pale grind as we analyze the deputy president s debate,pale grind loko hi ri karhi hi kambisisa njhekanjhekisano wa xandla xa phuresidente .
575,madam how you to stay calm when man was and spewing corrosive venom at who was even not part of the debate is unbelievable he had a moment of temporary insanity you really have of steel well done and,madam ndlela leyi u nga tshama u rhulile ha yona loko munhu a ri na ku rhurhumela ka vuxungu bya corrosive at who was even not part of the debate a swi khorwisi a ri na nkarhi wa ku penga ka xinkarhana hakunene u na steel well done and
576,_ so like as to several these days left arm seam exploded over the course of this century this t a matter of debate the can be tracked,.
577,the debate is going on in the supreme court regarding the government whether government will remain or will it be decided soon if government remains then what will happen to the decision of the constitutional bench by the supreme court,mphikizano wu ya emahlweni eka khoto ya le henhla mayelana na mfumo loko mfumo wu ta tshama kumbe wu ta tekiwa xiboho ku nga ri khale loko mfumo wu sala kutani ku ta humelela yini hi xiboho xa bench ya vumbiwa hi khoto ya le henhla .
578,the supreme court on suspended protection from coercive action in connection with against her in several over her on the prophet made during a television debate show,huvo-nkulu ya nsirhelelo lowu yimisiweke eka goza ro sindzisa mayelana na yena eka vo hlayanyana eka yena eka muprofeta loyi a endliweke hi nkarhi wa nkombiso wa njhekanjhekisano wa thelevhixini .
579,when we say is the professor of politics you understand how true it all saw how his the do was ready for debate an epitome of courage and content with confidence meanwhile let s wait for next week baba,loko hi ku i profesa wa tipolitiki wa swi twisisa leswaku hinkwaswo hinkwaswo swi vone ndlela leyi do wa yena a a lunghekele ku kanetiwa ha yona epitome ya xivindzi na ku eneriseka hi ku titshemba hi nkarhi wolowo a pfumelela ku rindza vhiki leri taka baba .
