,src,trg
2004,tomorrow is the day we finally get to sit down with the kids' media sensation they have completely shaken up how consume entertainment and made their stake in the digital first world tune in tomorrow to get the,mundzuku i siku leri hi hetelelaka hi fika hi tshama ehansi hi ku twa ka vana eka swihangalasamahungu va tsekatsekise hi ku helela ndlela leyi ku dya vuhungasi ha yona ni ku endla xiphemu xa vona eka digital first world tune in mundzuku ku kuma .
2005,though celebrity gossip been around for as long as there was a star system the early s marked the start of an era,hambileswi ku hleva ka vanhu lava dumeke ku nga nkarhi wo leha loko ku ri ni fambiselo ra tinyeleti s yo sungula yi funghe ku sungula ka nguva yo karhi .
2006,cate bon the more delight during day of pitchfork rebellious magazine by editor via,cate bon the more delight hi nkarhi wa magazini wa pitchfork rebellious hi muhleri ​​hi ku tirhisa .
2007,it was a pleasure to join the festival by for in afghani culture and heritage with live entertainment from and,a swi tsakisa ku joyina festival hi for in afghani ndhavuko na ndzhaka na vuhungasi byo hanya ku suka na .
2008,to do and the hip taste of orchard park chalk art garden,ku endla na hip taste ya orchard park chalk art garden .
2009,blake on 'entertainment tonight' blake on gwen is family home to,blake eka 'entertainment tonight' blake eka gwen i kaya ra ndyangu eka
2010,to be the audience s choice thanks for all the love and support continue watching every sat at only on geo entertainment,ku va ku hlawula ka vayingiseri ku khensa rirhandzu hinkwaro na nseketelo emahlweni u hlalela every sat at only on geo entertainment .
2011,jake aiming to fight mike next if he,jake hi xikongomelo xo lwa na mike next loko a .
2012,faro the revenue potential of all its business by both the physical digital world revenue we believe this model will be the way forward for all and future entertainment,faro vuswikoti bya mali ya bindzu bya yona hinkwabyo hi vumbirhi bya yona mali leyi nghenaka ya misava ya xidijitali hi tshemba leswaku modele lowu wu ta va ndlela yo ya emahlweni eka vuhungasi bya hinkwaswo na bya nkarhi lowu taka .
2013,the teaser for the world is most expensive series ever made and twitter can not keep calm _paul,teaser ya misava yi durha ngopfu series leyi nga tshama yi endliwa naswona twitter a yi nge swi koti ku hlayisa ku rhula _paul .
2014,give your a,nyika wena a .
2015,our passion for stunning rick dobson dobson entertainment,ku navela ka hina ku hlamarisa rick dobson dobson entertainment .
2016,in a few in the windy city comic entertainment august it good to be back i will be in artist alley table w,eka swi nga ri swingani eka windy city comic entertainment august swi kahle ku vuya ndzi ta va ndzi ri eka artist alley table w
2017,these two are so gross deserve 'rushed' to get married and was afraid ben would get 'cold feet' before wedding report fox news,lava vambirhi va gross swinene va faneriwa hi 'rushed' ku tekana naswona a chava ben a ta kuma 'cold feet' before wedding report fox news .
2018,report vehicle grid integration will help electric meet clean energy via,xiviko xa ku hlanganisiwa ka giridi ya movha swi ta pfuna gezi ku hlangana na eneji yo basa hi ku tirhisa .
2019,every social media account is a show the and are the and the more drama the more and make no mistake no one about you on your social media they care what entertainment you can provide them,every social media account is a show the and are the and the more drama the more and a va endli xihoxo ku hava munhu hi wena eka social media ya wena va khathala hi vuhungasi byihi lebyi u nga va nyikaka byona .
2020,_e_bishop aside there is nothing here the weather is terrible at least a year no entertainment and little in the way of good paying,_e_bishop etlhelo akuna nchumu laha maxelo ya chavisaka at least a year no entertainment and swintsongo endleleni yo hakela kahle
2021,influential municipal preservation law expert hunt by city of via,mutivi wa nawu wa nhlayiso wa masipala lowu nga ni nkucetelo ku hlota hi doroba ra via .
2022,oh no actually not we re you for entertainment there when it comes to we use these,oh no actually hayi we re you for entertainment kwalahaya loko swi ta eka ku tirhisa leswi .
2023,i am watching this show on with my family do watch you will get many more information and entertainment too,ndzi hlalela nongonoko lowu emahlweni na ndyangu wa mina do watch u ta kuma vuxokoxoko byo tala na vuhungasi na wena .
2024,fantastic night for with our event where creativity on animation for the wonderful to meet with entertainment industry old new introduce designate,vusiku byo hlamarisa bya na xiendlakalo xa hina laha vutumbuluxi eka animation ya the wonderful ku hlangana na indasitiri ya vuhungasi old new introduce designate .
2025,last but not least is by press get these,last but not least is hi press get leswi .
2026,gossip club soon will be follow us for latest entertainment news,gossip club ku nga ri khale yi ta hi landzelela eka mahungu ya vuhungasi bya sweswinyana
2027,movie level,level ya tifilimi .
2028,joe rogan s repulsive about shooting homeless people l a s unhoused via incredible how use selective outrage when this been making offensive now you mad,joe rogan s repulsive about shooting homeless people l a s unhoused via incredible how use selective outrage loko leswi swi ri karhi swi endla ku khunguvanyisa sweswi you mad
2029,still beating and still the best queen is seven million breaking chart record,still beating and still the best queen is seven million breaking chart record .
2030,and but and it actually sobbing,naswona kambe naswona entiyisweni swi ri karhi swi rila .
2031,who the role of officer  wouldelhi crime show is close to my heart',i mani ntirho wa officer woldelhi crime show wu le kusuhi na mbilu ya mina'.
2032,s of tall scraggy loom large in people s here is a chance to see the swiss artist is of the human form,s of tall scraggy loom large in people s hi leyi nkarhi wo vona mutshila wa le switzerland a ri wa xivumbeko xa munhu .
2033,because the menticide machine algorithm brain hacked base believe everything that is repeated back to them by the gruesome foursome nightly fox news the of entertainment news,hikuva menticide machine algorithm brain hacked base yi pfumela hinkwaswo leswi phindha-phindhiwaka endzhaku eka vona hi gruesome foursome nightly fox news the of entertainment news .
2034,order now at entertainment earth link in learn more pop animation bleach fully w chase exclusive link in learn more,oda sweswi eka entertainment earth link eka dyondza swo tala pop animation bleach fully w chase exclusive link eka learn more
2035,the news is not news it is entertainment there sole purpose is to keep people watching if they told real news about what in the world people would turn off stop reading be honest fat chance,mahungu a hi mahungu it is entertainment there xikongomelo i ku hlayisa vanhu va hlalela loko va byela mahungu ya xiviri mayelana na leswi emisaveni vanhu va nga ta tima va tshika ku hlaya be honest fat chance .
2036,real entertainment free muscle show now,vuhungasi bya xiviri free muscle show sweswi .
2037,but what they do to the is not good and sadly this is the reality of the industry we or entertainment industry many and are being abuse by the power of the people who is to them,kambe leswi va swi endlaka eka a swi kahle naswona lexi twisaka ku vava leswi i ntiyiso wa indasitiri hina kumbe bindzu ra vuhungasi vo tala naswona hi ku xanisiwa hi matimba ya vanhu lava nga eka vona .
2038,this we are delighted to welcome the brilliant no sun to provide your entertainment in the bar from entry is free so get here early,leswi hi tsakile ku amukela brilliant no sun ku nyika vuhungasi bya wena ebarheni ku suka eku ngheneni i mahala so get here early .
2039,coming soon take a look at the world s entertainment and see if the pizza is any good,ku nga ri khale languta vuhungasi bya misava hinkwayo u vona loko pizza yi ri kahle .
2040,want good non woke entertainment back arroz is it is a book and a novel,want good non woke entertainment back arroz is i buku na novhele .
2041,to resume his justice world tour post hunt syndrome recovery here is when he will perform in,ku tlhela a sungula ku hola ka yena ka justice world tour post hunt hi nkarhi lowu a nga ta tlanga hi wona hi nkarhi lowu a nga ta tlanga ha wona hi .
2042,lead by jake tapper who at the mouth with the mere mention of biden is name constantly on and his hand after he lied us into the war and to several one of the true of cable news,ku rhangela hi jake tapper loyi enon’wini hi ku boxiwa ntsena hi biden a nga na vito nkarhi hinkwawo a ri kona naswona voko ra yena endzhaku ka loko a hi hembele enyimpini naswona eka vo hlayanyana va ntiyiso wa mahungu ya tikhebulu
2043,people t going to bother going to entertainment and hospitality if they have to wear and take part in some freak show they will have house instead and resort to other of entertainment this is really basic stuff,vanhu t going to bother going to entertainment and hospitality loko va fanele va ambala no teka xiphemu eka swin'wana freak show va ta va na yindlu instead and resort to other of entertainment leswi hakunene is basic stuff
2044,not giving away my of entertainment,ku nga nyikeli ka mina ka vuhungasi .
2045,i am done with this entertainment i am not someone who this low class with some underage,ndzi hetile hi vuhungasi lebyi a ndzi munhu loyi low class leyi yi nga na underage yin'wana .
2046,halcyon make music for music home of the best,halcyon endla vuyimbeleri bya vuyimbeleri kaya ra leswinene
2047,about the possibility of a th pie film his new single and more inside,malunghana na ku koteka ka filimi ya th pie single ya yena leyintshwa na swin'wana endzeni .
2048,her 'glamour was overwhelming' for,‘ku glamour ka yena a ku ri kukulu swinene’ .
2049,but you have a chance to break my foot for entertainment or fun think about it,kambe u na chance yo tshoveka nenge wa mina for entertainment or fun think about it .
2050,we had such a great time during the first at in on ate drank sang and on the new terrace live entertainment was provided by local drag thank you for us,hi vile na nkarhi wo tsakisa swonghasi hi nkarhi wo sungula eka in on ate drank ndzi yimbelerile naswona eka terrace leyintshwa vuhungasi byo hanya byi nyikiwile hi ku koka ka ndhawu hi khensa hina
2051,honestly that s where her heart is she s big in the entertainment industry she use to manage artiste back in the day,honestly that s where heart is she s big in the entertainment industry leyi a yi tirhisaka ku lawula artiste back in the day .
2052,murphy will star in prime video s holiday comedy candy cane lane will direct the film from imagine entertainment and murphy from a spec script written by kelly younger it the team behind boomerang,murphy u ta tlanga eka prime video s holiday comedy candy cane lane yi ta kongomisa filimi ku suka eka imagine entertainment na murphy ku suka eka spec script leyi tsariweke hi kelly younger it the team behind boomerang
2053,_marie agreed the tie breaker a bit heartless for a game show entertainment for all,_marie u pfumerile tie breaker a ri na mbilu nyana eka ntlangu wa mintlangu entertainment for all .
2054,all i have is the voice in my head n a bunch of for entertainment,leswi ndzi nga na swona i rito leri nga enhlokweni ya mina n a bunch of for entertainment .
2055,when first generation goes to court and meet their friend who is a generation lawyer only for entertainment his friend,loko xitukulwana xo sungula xi ya ekhoto xi ya hlangana na munghana wa vona loyi a nga gqweta ra xitukulwana ntsena xa vuhungasi munghana wa yena .
2056,her 'glamour was overwhelming' for  amen have had no with me','glamour was overwhelming' ya yena hikuva amen a nga ri na yona na mina'.
2057,bridging the gap between entertainment let s,ku hlanganisa xivandla exikarhi ka vuhungasi let s .
2058,another broken egg is opening a brunch restaurant on the coast,tandza rin’wana leri tshovekeke i ku pfula ndhawu yo dyela eka yona ya brunch eribuweni ra lwandle .
2059,actress is here to steal the show,mutlangi wa swifaniso u kona ku ta yiva nkombiso .
2060,_janie entertainment is transforming fast,_janie entertainment yi hundzuka hi ku hatlisa .
2061,_mihko thank you both for the entertainment,_mihko ndza khensa havumbirhi bya n'wina eka vuhungasi .
2062,the las are must see entertainment,va las va fanele va vona vuhungasi .
2063,to resume his justice world tour post hunt syndrome recovery,ku tlhela a sungula vululami bya yena bya vululami bya misava hinkwayo bya post hunt syndrome recovery .
2064,entertainment to congratulate kore di,vuhungasi byo hoyozela kore di .
2065,honestly yes and i do not regret it as it provided great entertainment,honestly yes and a ndzi tisoli tani hi leswi a swi nyika vuhungasi lebyikulu .
2066,and i am saying this as someone who that evolution and the super movie are both pretty good entertainment so i understand lots of people but it just like you have you want to say since you keep about it,futhi ndzi vula leswi tani hi munhu loyi evolution yaleyo na super movie hi vumbirhi bya vona va nga pretty good entertainment so ni twisisa vanhu vo tala but it just like you have you want to say since u keep about it .
2067,and was on the phone prime time entertainment,naswona a a ri eka riqingho prime time entertainment .
2068,queen is seven million breaking chart record no neither do i,queen is seven million breaking chart record no neither do a ndzi .
2069,all other of entertainment irrelevant and yet i continue to write,hinkwaswo swin'wana swa vuhungasi a swi na mhaka naswona hambi swi ri tano ndzi ya emahlweni ndzi tsala .
2070,the decision made by the u s attorney is office in comes after determined they cannot move forward with the misdemeanor against the nine people,xiboho lexi endliweke hi gqweta ra u s i xikhundlha eka xi ta endzhaku ka loko va kumile leswaku a va nge swi koti ku ya emahlweni na nandzu wo lwisana na vanhu va nhungu .
2071,why have drag who know the score about their entertainment themselves to become in this mess do they they are being as men who groom,why va na drag who know the score about their entertainment hi voxe ku va eka mess leyi va nga va va ri ku fana na vavanuna lava groom .
2072,these black are s dining scene,lava va ntima i s dining scene .
2073,i did not know that was involved in the bear,a ndzi nga swi tivi leswaku a a katseka eka bere .
2074,just as a clarification no one should rely on any of our as a legal representation of anything that was said this live is for informational and entertainment only the court will issue the only official transcript,tanihi leswi ku hlamusela ku nga riki na munhu loyi a faneleke ku titshega hi un’wana wa hina tanihi vuyimeri bya le nawini bya nchumu wun’wana na wun’wana lowu vuriweke ku hanya loku i ka vuxokoxoko na vuhungasi ntsena khoto leyi nga ta humesa tsalwa ra ximfumo leri nga roxe .
2075,might be worse than only reason this dude on the show to be for entertainment only,swi nga ha va swi bihe ngopfu ku tlula ntsena xivangelo lexi dude eka nongonoko a va wa vuhungasi ntsena .
2076,all the entertainment people brag about being the best at why we don t have our own amusement park for the,vanhu hinkwavo va vuhungasi va tinyungubyisa hi ku va lavanene ngopfu eka why we don t have our own amusement park for the .
2077,the time star went to comic con before anyone knew what it was entertainment weekly,the time star u ye eka comic con before munhu a nga si tiva leswaku i yini entertainment weekly .
2078, is summer entertainment is not to be,is ximumu vuhungasi a hi ku va .
2079,is it really the end for sally and,xana hakunene i makumu ya sally na .
2080,it s important to understand that it s better to be alone than with people who don t respect you if they disrespect you that you t their first choice and they don t value your company you are just entertainment for them distance yourself you deserve better,i swa nkoka ku twisisa leswaku swa antswa ku va u ri wexe ku tlula ku va na vanhu lava nga ku xiximiki loko va ku pfumala xichavo leswaku u t nhlawulo wa vona wo sungula naswona a va teki va ri va nkoka eka khampani ya wena u tihungasa ntsena eka vona va tihambanisa na wena u faneriwa hi ku antswa .
2081,a serene picture chilling amid blue in,xifaniso xo rhula lexi titimelaka exikarhi ka wasi hi .
2082,surprise steven directed and shot s new music video with a cell phone video,xihlamariso steven u kongomise no duvula s new music video hi vhidiyo ya selfoni
2083,c amon ana the point later on that this is about specifically how reading is singled out as a higher form of entertainment over comic or watching other of entertainment,c amon ana the point later on leswaku leswi swi vula hi ku kongoma ndlela leyi ku hlaya ku hlawuriweke ha yona tanihi xivumbeko xa le henhla xa vuhungasi ehenhla ka xihlekiso kumbe ku hlalela swin’wana swa vuhungasi .
2084,next up is by,next up hi yona .
2085,entertainment for the let is just watch record do nothing instead of or getting that child away from that violence unbelievable,vuhungasi bya let is just watch record do nothing instead of kumbe ku susa n'wana yoloye eka madzolonga wolawo a nga khorwisi .
2086,shocker,shocker .
2087,user noir a day man i wonder if the entertainment blessed my today me a normal day living my life in my lane unbothered noir this will not do i have to poke fun at them so i can laugh me why do i hear boss music,user noir a day man i wonder if the entertainment blessed my today me a normal day living my life in my lane unbothered noir leswi a swi nge endli leswaku ndzi va poke fun eka vona so i can laugh me why ni twa vuyimbeleri bya boss
2088,order pop bleach fully entertainment earth exclusive,order pop bleach fully entertainment misava yo hlawuleka .
2089,yahoo entertainment kelly out sesame place over viral video of performer seemingly black  nothis just made me so mad' via,yahoo entertainment kelly out sesame place over viral video ya performer yi vonaka yi ri black nothis just made me so mad' via
2090,the soon to be mother her maternity shoot that she is a baby girl,the soon to be mother her maternity shoot leswaku i nwana wa nhwanyana .
2091,like it me how the only educational we have are so lame i feel like we live in a time when entertainment is kind of meaningless like we are now at the point where everything is which is beautiful but its also kind of nihilistic id rather wat,like it me how the only educational we have are so lame ni twa onge hi hanya hi nkarhi lowu vuhungasi byi nga na muxaka wa ku pfumala nhlamuselo ku fana na sweswi eka nkarhi lowu hinkwaswo swi nga ku saseka kambe its also kind of nihilistic id rather wat .
2092,is only famous on twitter and on high school entertainment night,yi dume ntsena eka twitter na le ka vusiku bya vuhungasi bya le xikolweni xa le henhla .
2093,actor his grass to grace story and how he financially before becoming famous,actor his grass to grace story na ndlela leyi hi tlhelo ra timali a nga si duma .
2094,for entertainment i am on a strip of gaudy _,eka vuhungasi ndzi le ka strip xa gaudy _ .
2095,as a dancer in skimpy attire on her husband gold african is leading for sports music news and entertainment,tanihi mucinci loyi a ambaleke swiambalo swo khwaxa eka nuna wa yena gold african u rhangela eka mahungu ya vuyimbeleri bya mintlangu na vuhungasi .
2096,if you a girl getting to talk to for entertainment or for sex is not a flex or accomplishment,loko wena ntombi yi kuma ku vulavula na yona for entertainment or for sex a hi flex kumbe accomplishment .
2097,now doing business with again after dragging her name and trying to blackball her out of the entertainment industry see how the universe works i know they gave her what she at first and probably more,sweswi ku endla bindzu na nakambe endzhaku ko koka vito ra yena no ringeta ku n’wi blackball ehandle ka bindzu ra vuhungasi vona leswaku vuako byi tirha njhani ndzi swi tiva leswaku va n’wi nyikile leswi eku sunguleni naswona kumbexana swin’wana .
2098,i do not know why i come onto twitter to feel any level of entertainment when these are the i have it is downright depressing how many the legitimately factually incorrect get,a ndzi tivi leswaku hikokwalaho ka yini ndzi ta eka twitter ku twa level yihi na yihi ya vuhungasi loko leti ti ri the i have it is downright depressing leswaku i vangani lava nga legitimately factually incorrect get .
2099,and were not going to fight this was just for your entertainment,naswona a va nga ta lwa na leswi a swi ri swa vuhungasi bya n'wina ntsena .
2100,daily rainbow six se gaming with core i alder lake and for today is offering an excellent low price for an,daily rainbow six se gaming na core i alder lake naswona eka namuntlha yi nyikela nxavo wa kahle swinene wa le hansi eka an .
2101,set a set based on the iconic game console is coming august,set set leyi sekeriweke eka iconic game console yi ta hi august .
2102,_stevo entertainment at its even can have a bout of jack do not worry still a fan thanks _stevo,.
2103,razer pro review the razer pro one of the gaming of last year but at such a high price it s just not worth paying extra for,razer pro review the razer pro yin'wana ya mintlangu ya lembe leri nga hundza kambe hi nxavo wa le henhla swonghasi s just not worth paying extra for .
2104,sylvester tore into 'rocky' franchise over  nothe worst unhuman i have ever met in the movie industry',sylvester u handzule franchise ya 'rocky' over nothe worst unhuman leyi ndzi nga tshama ndzi hlangana na yona eka bindzu ra tifilimi'.
2105,are hacking into the genesis game are hacking into the genesis game after the,va hacking eka ntlangu wa genesis va hacking eka ntlangu wa genesis endzhaku ka .
2106,i need for pure entertainment,ndzi lava vuhungasi byo basa .
2107,the butcher of black bottom slasher horror to  is comic con killadelphia is rodney is back with the butcher of black bottom a stylish,the butcher of black bottom slasher horror to is comic con killadelphia is rodney u vuyile na butcher ya black bottom a stylish .
2108,i m sure you re being this millions of times in the last but the used at s wake were those your personal used or staged for the episode thank you so much for the of entertainment you put forward in,i m sure you re being this millions of times in the last but the used at s wake a ku ri leti ta wena ta munhu hi xiyexe leti u ti tirhiseke kumbe ku ti staged eka xiphemu lexi ndza khensa ngopfu eka the of entertainment u veka emahlweni eka
2109,no more will not be a switch exclusive after no more will come to series x s one and in ending what will,no more a swi nge vi switch exclusive endzhaku ka loko ku nga ha ri na swin'wana swi ta ta eka series x s one naswona eku heriseni ka leswi nga ta .
2110,is now streaming ball,sweswi i bolo leyi khulukaka .
2111,_teekeemon _lilith all news for entertainment at least tucker an make people laugh people are laughing at the other news just not the,.
2112,how long is stray stray now available on and is a mysterious adventure through a new world where you play as a cat but how long can you expect that,xana stray stray stray yi kumeka nkarhi wo tanihi kwihi naswona i adventure leyi nga twisisekiki hi misava leyintshwa laha u tlangaka tanihi kati kambe u nga langutela leswaku sweswo swi ta teka nkarhi wo tanihi kwihi .
2113,i am seeing this show this is going in so amazing way and i doing more entertainment of this show,ndzi vona show leyi leswi swi famba hi ndlela yo hlamarisa swinene naswona ndzi endla vuhungasi byo tala bya nongonoko lowu .
2114,on the thread you posted i saw entertainment please elaborate there is there be like an event or karaoke night because this is a farmer is market i am not like huge huge event where people are drinking heavily and waking up to drama the next day,on the thread you posted i saw entertainment please elaborate there is there be ku fana na event kumbe vusiku bya karaoke hikuva leyi i n'wamapurasi i market i am not like huge huge event laha vanhu va nwaka ngopfu va pfuka va drama hi siku leri landzelaka
2115,well they are free to do so cause it s prime entertainment i unblocked her sorry ass to respond but taking away their opportunity to keep up is also fun so she better enjoy it while it,kahle kahle va ntshunxekile ku endla tano cause it s prime entertainment ndzi pfule xitombo xa yena sorry ku hlamula kambe ku teka nkarhi wa vona wo ya emahlweni na swona swa tsakisa so she better enjoy it while it .
2116,mat and to develop matchbox live action motion picture,mat na ku hluvukisa xifaniso xa matchbox lexi hanyaka xifaniso xa ku famba .
2117,ill beef when want entertainment,ill beef loko u lava vuhungasi .
2118,he is a jewel in entertainment industry and the judge realize that,i ribye ra risima eka bindzu ra vuhungasi naswona muavanyisi u swi xiya leswaku .
2119,it is almost as if other entertainment and creative other creative wow,swi lava ku fana na loko vuhungasi byin’wana na vutumbuluxi byin’wana byo tumbuluxa wow .
2120,flying to tomorrow for a wedding and this will be my in flight entertainment also,ku khandziya xihahampfhuka ku ya mundzuku eka mucato naswona leyi yi ta va ya mina eka flight entertainment na yona .
2121,politics t entertainment t to depend on and show unquestioning allegiance to we can t afford to wait on them to save us and have the same tired flat this shambling mess forward,politics t entertainment t to depend on and show unquestioning allegiance to we can t afford to wait on them to save us and have the same tired flat this shambling mess forward
2122,white about the most trivial will always be my favorite on the job entertainment,white about the most trivial will always be my favorite on the job entertainment .
2123,tables and entertainment,matafula na vuhungasi .
