,src,trg
0,the entertainment horror of dating this could be a long thread,ku chavisa ka vuhungasi bya ku jola leswi ku nga va thread yo leha .
1,and that is the entertainment sitting next to her oh dear,naswona sweswo i vuhungasi lebyi tshameke ekusuhi na yena oh murhandziwa .
2,i have always why people in the entertainment industry are to be temperamental and rude there is no excuse in any workplace why are they,i have always why vanhu eka entertainment industry va fanele ku va temperamental na rude a ku na xivangelo eka ndhawu yihi na yihi ya ntirho why va .
3,honestly an entire episode on the would be peak entertainment,ku vula ntiyiso xiphemu hinkwaxo eka the would be peak entertainment .
4,don t kill me but my went up the day he was talking about loving the breakfast club but i let it go then it to add up he t just think it s entertainment he in,don t kill me but my went up the day a ri karhi a vulavula hi ku rhanda breakfast club kambe ni swi tshika swi famba then ku add up he t just think it s entertainment he in
5,entertainment at the very warm but always welcoming,vuhungasi eka ku kufumela swinene kambe minkarhi hinkwayo ku amukeleka .
6,dance under the with a hot of entertainment this week at the center bar,ku cina ehansi ka na ku hisa ka vuhungasi vhiki leri ebarheni ya le xikarhi
7,it out as this argument between these two fake entertainment but it exploded and what is going on now,it out as this argument between ti fake entertainment leti timbirhi kambe yi bulukile na leswi swi humelelaka sweswi .
8,crazy to type this as a but i got to speak to bassist about their connection to and love of the most moment of my career,ku penga ku thayipa leswi tani hi a kambe ndzi fike ndzi vulavula na bassists hi ku hlangana ka vona na na rirhandzu ra nkarhi wo tala wa ntirho wa mina .
9,the annual peach festival was as popular as ever with entertainment a midway a car show and or course this year was notable in that most of the sold were locally grown,nkhuvo wa lembe na lembe wa peach a wu tsakeriwa ku fana na khale hi vuhungasi a midway a car show and or course lembe leri a yi tiveka hikuva vunyingi bya lava xavisiweke a va byariwa laha tikweni
10,_barlow and that is to be a when the real was put through of her and people are angry about it,.
11,see you this,hi ta vona leswi .
12,real quote was i think the reason why have less entertainment is because there s just too much performance gap between the these f news need to stop there terrible of news so that they can get a few extra and,real quote was i think xivangelo xa ku va na vuhungasi byintsongo hikuva ku na just too much performance gap exikarhi ka these f news need to stop there terrible of news leswaku va ta kuma swin'wana swo engetela na .
13,_jackson _luke _ _extra why is it sad you are our local and the last year given me so much entertainment it is brilliant,_jackson _luke _ _extra why is sad you are our local and last year yi ndzi nyikile vuhungasi byo tala swinene it is brilliant
14,you would think the and would demand shooting come to a end and production to a safe state like when the do that for abortion,u nga ehleketa leswaku na ku lava ku duvuriwa ku fika emakumu na vuhumelerisi eka xiyimo xo hlayiseka ku fana na loko the do that for abortion .
15,just going through ben s he might be the most triggered person on this free entertainment to see how mad he at that don t pertain to him,just going through ben s a nga ha va a ri munhu loyi a hlohloteriweke ngopfu eka vuhungasi lebyi bya mahala ku vona ndlela leyi a nga penga ha yona hi ndlela yoleyo a nga n'wi fanela .
16,up about miscarriage she at age via,up about miscarriage she age via .
17,how boring are at over cricket now unless they are bullying small fry like the get the f king finger out it is meant to be entertainment,how boring at over cricket now unless va xanisa ti small fry ku fana na get the f king finger out it is meant to be entertainment .
18,'law order' shooting crew member shot to death while parking for show in needs law and order,'law order' shooting crew member yi duvuriwile ku fikela eku feni loko yi ri karhi yi paka ku kombisa eka swilaveko swa law and order
19,check out all new music by j rag on please subscribe,languta vuyimbeleri hinkwabyo lebyintshwa hi j rag eka please subscribe
20,it is one thing to be up front and declare we are in the us entertainment industry and we think you have a great presence would you be interested in acting instead they tried to kill me because i am a business woman after spine surgery and a coma,i nchumu wun'we ku va up front u tivisa leswaku hi le ka us entertainment industry naswona hi ehleketa leswaku u na vukona lebyikulu u nga tsakela ku tlanga ematshan'wini ya sweswo va ringetile ku ndzi dlaya hikuva ndzi wansati wa mabindzu endzhaku ka vuhandzuri bya nkolo na coma .
21,is a 'climate criminal' for taking a minute flight on private jet,i ‘xigevenga xa maxelo’ hi ku khandziya xihahampfhuka xa minete hi xihahampfhuka xa private jet .
22,i feel like peele is the only contemporary who in nailing the balance had on balancing social on horror with genuine entertainment would love to see what peele is take on something like q the winged serpent would be like,ndzi twa onge peele hi yena ntsena wa manguva lawa loyi eku naneteni ka ku ringanisela a nga na kona eka ku ringanisela social eka ku chavisa na vuhungasi bya xiviri a nga tsakela ku vona leswi peele a swi tekaka eka nchumu wo fana na q nyoka leyi nga ni timpapa yi nga va yi fana na
23,it is i guess an extremely slow entertainment news day,hi mina ndzi ehleketaka leswaku i siku ra mahungu ya vuhungasi leyi nonokaka swinene
24,_duzit is now streaming,_duzit sweswi yi khuluka .
25,i absolutely hate it when a newspaper a new report but then t link to it so here is the missing link,ndzi swi venga hi ku helela loko phepha-hungu a ri xiviko lexintshwa kambe t link to it so here is the missing link .
26,today laura neal is how many are queer,namuntlha laura neal i vangani lava nga queer .
27,call it spire entertainment real talk this me beautiful beautiful beautiful hot rod well will be calling the this weekend,call it spire entertainment real talk this me ku saseka ko saseka ka hot rod kahle swi ta va swi vitana the this weekend
28,'zack snyder is justice league' messy superhero epic out now on digital one of the most lonely and brainless ever written,'zack snyder is justice league' messy superhero epic out now on digital yin'wana ya leti nga riki na munhu naswona yi nga riki na byongo lebyi tshameke byi tsariwa .
29,great eastern entertainment plush,great eastern entertainment plush .
30,_bo_fo_sho i have never understood someone is trust to prank them for your entertainment,_bo_fo_sho a ndzi si tshama ndzi swi twisisa leswaku munhu wa tshemba ku va prank for entertainment ya wena
31,not just for no polygon is newish patch newsletter some interesting stuff across entertainment in general mainly written on polygon but not exclusively,a hi for no polygon is neish patch newsletter ntsena swilo swo tsakisa eka vuhungasi hinkwabyo hi ku angarhela ngopfu-ngopfu swi tsariwile eka polygon kambe a hi swona ntsena .
32,public announcement speed is in another level of the entertainment industry that' is cruise someone should hold him anything more than this is craze,public announcement speed is in another level ya entertainment industry that' is cruise munhu u fanele a n'wi khoma swin'wana na swin'wana ku tlula leswi i craze .
33,was a member vocally based girl group under entertainment the group of and they their debut single solar flare on they re,a a ri xirho xa ntlawa wa vanhwanyana la tshamaka hi rito ehansi ka vuhungasi ntlawa wa na vona single ya vona yo sungula solar flare eka vona re .
34,a artist justice humor and insight into this tarot deck,a artist justice humor na ku twisisa eka deck leyi ya tarot .
35,is that what it s about entertainment is that what we have come to the responsibility that on these is so unwarranted m people rely on these people to have their at the heart of their it s literally embarrassing,hi leswaku leswi it s about entertainment hi leswaku leswi hi nga fika eka vutihlamuleri bya leswaku eka leswi is so unwarrantted m vanhu va titshege hi vanhu lava ku va na vona at the heart of their it s literally embarrassing .
36,_arcuri what oak got to do with it a non summary please i make my own entertainment it s just i see that symbol around a lot and it all a bit to me,_arcuri leswi oak a nga swi endla hi yona a non summary please i make my own entertainment it s just i see that symbol around a lot and it all a bit to me
37,an exciting time for all this afternoon inspired by we decided to hold our very own afternoon of variety entertainment cuerden is got talent our for the afternoon were the van and are you ready,nkarhi wo tsakisa eka hinkwavo madyambu lawa lama hlohloteriweke hi ku teka xiboho xo khoma madyambu ya hina ya ku hambana-hambana ka vuhungasi cuerden is got talent our for madyambu a ku ri van and are you ready .
38,best and entertainment ever too bad they are lost in this new digital generation,best and entertainment ever too bad va lahleka eka xitukulwana lexi lexintshwa xa xidijitali .
39,at least eight pitch but only one will get before the broadcast away and wrongly so entertainment is dead bring it back,at least 8 pitch kambe i yin'we ntsena yi nga ta fika emahlweni ka vuhaxi a famba na yona hi ndlela yo biha so entertainment is dead yi vuyise .
40,_thejeopardyfan at the risk of being too for a twitter take yes it is cerebral and a long standing institution but it is also a game show on there is a balance between and entertainment and the show had to evolve with the existence of social media viral,_thejeopardyfan hi khombo ro va too for a twitter take yes it is cerebral and a long standing institution kambe yi tlhela yi va ntlangu wa ntlangu eka ku va na ku ringanisela exikarhi na vuhungasi naswona nkombiso wu boheke ku hluvuka hi vukona bya social media viral .
41,illegal auction abroad of painting,auction leyi nga riki enawini ya le matikweni mambe ya ku penda .
42,we should not but sometimes i feel like some do not care about her and just her to be their instrument of entertainment,a hi fanelanga kambe nkarhi wun’wana ndzi twa onge van’wana a va na mhaka na yena naswona ntsena va yena ku va xichayachayana xa vona xa vuhungasi .
43,also stop acting like as if youve never hurt a single person in your life you have and you learned from it if you didnt just see your as of entertainment youd have some faith in them and that theyll learn especially in case when they,also stop acting like as if youve never vavisa munhu un'we evuton'wini bya wena u na swona and u dyondze eka swona if you didnt just see your as as of entertainment youd have some faith in them and that theyll learn especially in case loko va .
44,may i present your for this evening is entertainment peony and blush handsome dee scene,onge i present ya wena ya madyambu lawa i vuhungasi peony na blush handsome dee scene
45,na official verbatim not very constructive but definitely top tier entertainment,na official verbatim not very constructive but definitely top tier entertainment .
46,make sure you continue to stand directly on the dam as are starting to explode you are not in any danger learned anything or are we all just stupefied around thinking they are living in a movie for their entertainment,tiyisisa leswaku u ya emahlweni u yima hi ku kongoma edamu tani hi leswi ku sungulaka ku buluka a wu le khombyeni ro karhi leri u ri dyondzeke kumbe hinkwerhu hi lo vhe hi rhurhumela ntsena hi ehleketa leswaku va hanya eka filimi ya vuhungasi bya vona
47,_therat the is still broken can entertainment do nothing right,_therat the is still broken can vuhungasi a byi endli nchumu kahle .
48,also did you know that that photo of was without her consent she never its release yet people have been it to further their and you are doing the same is this right,also did you know that that photo of was without her consent she never its release yet vanhu va ve it to further their and you are doing same is this right .
49,_america even for used are insane k oversized small with entertainment electronics that i have no use for nobody basic transportation or work it is all hat no cattle,.
50,brad out retiring from the cinema it was as a declaration of retirement but i did not mean that,brad out ku huma penceni eka cinema a ku ri tani hi xitiviso xa ku huma penceni kambe a ndzi nga vuli leswaku .
51,great news will perform at the enjoy a night full of entertainment the best music in town from the original live at get your now at,mahungu lamanene ya ta tlanga eka ku tiphina hi vusiku lebyi taleke hi vuhungasi vuyimbeleri bya kahle swinene edorobeni ku suka eka original live at get your now at .
52,is to present our annual festival of music in from th august th from heaven the music of in hard times will present the music and entertainment that during the great depression,is to present our annual festival of music in from th august th from heaven vuyimbeleri bya le minkarhini yo tika byi ta humesa vuyimbeleri na vuhungasi lebyi hi nkarhi wa great depression .
53,_council income tax on every product cess property tax excise tax import duty entertainment tax municipality tax toll tax from pin to car you only tax earning going in tax every is fed up now do something,_khokholo xibalo xa xibalo eka xitirhisiwa xin’wana na xin’wana cess property tax xibalo xa xibalo xa xibalo xa le handle xibalo xa ku nghenisa xibalo xa vuhungasi masipala xibalo xa xibalo ku suka eka pin ku ya eka movha u lo hola ntsena ku ya eka xibalo xin’wana na xin’wana xi dyisiwa sweswi endla swo karhi
54,it is lunch time we hit follower this morning i am streaming tonight let is go until then whose live i need some lunch time entertainment comment your links,i lunch time hi ba follower mixo lowu ndzi stream vusiku bya namuntlha let is go until whose live i need some lunch time entertainment comment your links
55,holiday casting call odd o t s entertainment and the zoo are holding for energetic and engaging to take part in our and at the zoo for more information,holiday casting call odd o t s entertainment na zoo va khome hi matimba na ku nghenelela ku teka xiphemu eka hina na le zoo ku kuma vuxokoxoko byo tala
56,have been your series for the last few days trying to catch up on the i have you bring the perfect combination of entertainment and education to my lunch by far my favorite person to follow on,have been your series for the last few days trying to catch up on the i have you bring the perfect combination of entertainment and education to my lunch by far my favorite person to follow on .
57,__ i understand this that s why i said it s not to my taste most people are assuming she was the person bring the message she s legit the entertainment and that s why they for like people know she controversial why is it a surprise every few,__ ndza swi twisisa leswi leswaku s why ni te it s not to my taste vanhu vo tala va ehleketa leswaku a ku ri munhu loyi a tisaka message she s legit vuhungasi and that s why they for like people know she controversial why is it a surprise every few .
58,another dividend ever get the feeling you been,dividend yin’wana yi tshama yi kuma ku titwa loku u tshameke u ku endla .
59,what else would do for entertainment,leswi a swi ta endla swin’wana swa vuhungasi .
60,here really needs to log out of n get grass outside its rude to yank or pull hand in there is no chance of earth do such a foolish work in a place of all ure doing here nothing but making a clown ure own entertainment purpose,here really needs to kill out of n get grass outside its rude to yank or pull hand in there is no chance of earth do such a foolish work in a place of all ure doing here nothing but making a clown ure own entertainment purpose .
61,i think for pure entertainment value with hindsight i might pick,ndzi ehleketa leswaku eka pure entertainment value na hindsight ndzi nga ha hlawula .
62,_socal plus we must with high profile hatred from too joe rogan s repulsive about shooting homeless people l a s unhoused,_socal plus hi fanele hi ri na rivengo ra xiyimo xa le henhla ku suka eka too joe rogan s repulsive about ku duvula vanhu lava nga riki na makaya l a s unhoused
63,but also entertainment when they see each other out the window occasionally they have staring hissing but i never got that on camera,kambe na vuhungasi loko va vonana ehandle hi fasitere nkarhi na nkarhi va ri na ku hisa hi mahlo kambe a ndzi si tshama ndzi kuma sweswo eka khamera .
64,entertainment but they shut one off from _,vuhungasi kambe va pfala yin'we ku suka eka _ .
65,_ _ _ is the more professional site used for and marketing yourself is only for pure entertainment,_ _ _ i sayiti ya xiphurofexinali leyi tirhisiwaka na ku xavisa hi wexe ntsena eka vuhungasi byo basa .
66,entertainment and culture minister grange advised of the public to disregard all communication from the hacked account,holobye wa vuhungasi na ndhavuko grange u tsundzuxile hi vaaki ku honisa vuhlanganisi hinkwabyo ku suka eka akhawunti leyi hakeriweke .
67,and the entertainment,ni vuhungasi .
68,look at my cool new i need entertainment,languta cool new ya mina ndzi lava vuhungasi .
69,corruption is not a affair of one family at the top but a collective effort of a club what we are watching is entertainment but irregardless of whoever there shall be a three legged handshake for this country to run,vukungundzwana a hi mhaka ya ndyangu wun’we ehenhla kambe i matshalatshala yo hlengeletana ya xipano leswi hi swi hlalelaka i vuhungasi kambe ku nga pfumeli leswaku mani na mani loyi a nga ta va na ku khomana hi mavoko ka milenge yinharhu leswaku tiko leri ri ta tsutsuma .
70,said if she tell you she not interested in you and she still talking she fishing for entertainment,ku vula loko a ku byela leswaku a nga ku tsakeli naswona wa ha vulavula a ri karhi a phasa tinhlampfi ta vuhungasi .
71,if we get hyper attached to the idea that this is unsafe and we need to divest from sex as entertainment into wrestling i think we start to play with fire and anti sex work politics but we can t keep our in the sand power either nuance,loko hi kuma hyper attached eka mhaka ya leswaku leswi a swi hlayisekanga naswona hi fanele ku divest from sex as entertainment into wrestling ndzi ehleketa leswaku hi sungula ku tlanga hi tipolotiki ta ndzilo na anti sex but we can t keep our in the sand power either nuance
72,senior developer live entertainment sports at unity,mutumbuluxi wa le henhla wa vuhungasi byo hanya wa mintlangu ya vun’we eka unity .
73,i did not watch debate on principal but will not mind going through your analysis i thought is purely for entertainment only can you vote to a president you loath,a ndzi hlaleli debate eka principal kambe a ndzi nge vi na mhaka na ku hundza eka nxopaxopo wa wena ndzi ehlekete leswaku i purely for entertainment ntsena u nga vhotela president u nyenya .
74,your source please please provide the information you have on this bill please do not use as your source as we all know fox is nothing but a entertainment source they are not a news source,xihlovo xa wena hi kombela u nyika vuxokoxoko lebyi u nga na byona eka nawu lowu hi kombela u nga wu tirhisi tani hi xihlovo xa wena tani hi leswi hinkwerhu hi swi tivaka leswaku fox a hi nchumu handle ka xihlovo xa vuhungasi a hi xihlovo xa mahungu
75,_ j yeah but most sports t try to make a half attempt at entertainment like made and whether you like it or not just like auto racing is a different sport and only rewarding a driver who not only won less and only won because everything was reset is dumb,_ j yeah but most sports t ringeta ku endla hafu ya matshalatshala ya vuhungasi ku fana na made na loko wa swi tsakela kumbe a wu swi tsakeli ku fana na mphikizano wa timovha i ntlangu wo hambana naswona wu hakela ntsena muchayeri loyi a nga hluliki ntsena na ku hlula ntsena hikuva hinkwaswo a swi ri reset is is . xiphunta
76,let me get this entertainment for free,ndzi pfumeleleni ndzi kuma vuhungasi lebyi mahala .
77,from the denial of the cut to the of being toxic and ray fisher s story this all from entertainment and not a controversial figure like can have genuine,ku suka eka ku kaneta ku tsemiwa ku ya eka ku va na chefu na ray fisher s xitori leswi hinkwaswo ku suka eka vuhungasi naswona ku nga ri xifaniso xo fana na lexi nga na njhekanjhekisano xi nga va na ntiyiso .
78,it s very funny that think they can just churn up an iconic movie franchise from the vat running and on top most successful entertainment into a pile of paste and they can the next billion dollar hit,swi hlekisa ngopfu ku ehleketa leswaku va nga ha churn up an iconic movie franchise ku suka eka vat leyi tsutsumaka na le henhla vuhungasi lebyi humelelaka swinene ku va nhulu ya paste naswona va nga endla biliyoni leyi landzelaka ya tidolara hit .
79,this is my entertainment,lexi i vuhungasi bya mina .
80,did he actually or are you just intentionally in a way that controversy because it you more than actual i think the reason why have less entertainment is because there s just too much performance gap between the,did he actually or are you just intentionally in a way that controversy hikuva it you more than actual i think xivangelo xa ku va na vuhungasi byintsongo is because there s just too much performance gap between the .
81,the downward spiral of a 'great man' is in a new novel post bulletin,xirhendzevutani xa le hansi xa 'munhu lonkulu' xi le ka novhele leyintshwa ya post bulletin .
82,_ update am best entertainment award for exchange so so so much,_ update am best entertainment sagwadi ra ku cincana hi ndlela leyi swi nga tano.
83,works for fox news we know they t considered real news only entertainment,works for fox news ha swi tiva va t considered mahungu ya xiviri ntsena vuhungasi .
84,are all we get from her entertainment,are hinkwaswo leswi hi swi kumaka eka vuhungasi bya yena .
85,you want the truth you can not handle the truth attorney rose hart the entertainment industry on the stand on part of her fascinating interview with us and her love for the film badham is classic,u lava ntiyiso a wu nge swi koti ku khoma ntiyiso gqweta rose hart bindzu ra vuhungasi eka xiyimo xa le henhla eka interview ya yena yo tsakisa na hina na rirhandzu ra yena eka filimi ya badham is classic .
86,the series the lord of the of power on the cover of entertainment weekly,nxaxamelo wa the lord of the of power eka xifunengeto xa entertainment weekly .
87,he that new generation entertainment,yena xitukulwana lexintshwa vuhungasi .
88,_ t you supposed to be a journalist oh right it s fox entertainment channel people to be,_ t u fanele u va muteki wa mahungu oh right it s fox entertainment channel vanhu ku va .
89,obsidian entertainment s grounded being into animated series,obsidian entertainment s grounded ku va a ri eka nxaxamelo wa swifaniso leswi nga ni vutomi .
90,the overhaul comes as into the entertainment business is giving prime video a face lift,ku lunghisiwa ku nghena tani hi leswi eka bindzu ra vuhungasi ku nga ku nyika prime video a face lift .
91,_wip entertainment industry in people from other more than any industry as for tech driving up cost of housing this been exaggerated home exasperated low lastly is the biggest driver of increase of housing cost,.
92,in an episode of the anthology series which is with a variety of famous,eka xiphemu xa nxaxamelo wa anthology lexi nga na tinxaka to hambana hambana ta ndhuma .
93,the following series received the for the season to all involved in increasing gender equity in the entertainment industry,nxaxamelo lowu landzelaka wu amukerile for the season eka hinkwavo lava katsekaka eka ku engetela ku ringana ka rimbewu eka indasitiri ya vuhungasi .
94,_aweek nope did you get the memo,_aweek nope xana u kume memo .
95,tommy t watch the real news he s to busy lying with the channel in court their an entertainment service not news are they lying in court or on the air,tommy t hlalela mahungu ya xiviri he s to busy ku hemba na channel ekhoto ya vona an entertainment service hayi mahungu are they lying in court or on the air
96,usher his recently las residency is all about giving the ladies what they want with entertaining of theatrics and rollerskating,usher recently las residency ya yena hinkwayo i ku nyika vamanana leswi va swi lavaka hi ku hungasa ka theatrics na rollerskating .
97,al was not satisfied with the entertainment authority and the as they are a great insult to the position he previously as the imam of the great mosque of rather,al a nga enerisekanga hi vulawuri bya vuhungasi na the as they are great insult to the position khale tani hi imam ya mosque leyikulu ya rather .
98,spend a year on entertainment with streaming and gaming taking biggest slice report more than of will be paying for streaming by end follow our news live for th,tirhisa lembe eka vuhungasi hi streaming na gaming ku teka slice report yo tlula ya will be paying for streaming by end follow our news live for th
99,reading on these berserk is pure entertainment this one to every comment it,ku hlaya eka ti berserk leti i pure entertainment this one to every comment it .
100,wedding photo as she she and ben are married 'we did it' via could pass for ben is daughter so youthful looking it is incredible,xifaniso xa mucato tani hi leswi yena na ben va tekiweke 'we did it' via could pass for ben is daughter so youthful looking it is incredible .
101,glad to be of entertainment,ndza tsaka ku va wa vuhungasi .
