,src,trg
1509,through our and culture we are now a very much party with our and we have proved ourselves on so much so that we are the first point of call for any future work learn more from our,hi ku tirhisa na ndhavuko wa hina sweswi i nkhuvo wo tala swinene na hina naswona hi tikombisile eka swo tala swinene lerova hi ri yinhla yo sungula yo vitana ntirho wihi na wihi wa nkarhi lowu taka dyondza swo tala eka hina .
1510,i here last year absolutely wonderful city people culture architecture comedy,mina laha lembe leri nga hundza hi ku helela ku hlamarisa ka vanhu vanhu vanhu ndhavuko vumaki comedy
1511,i would rather have an intelligent billionaire than an idiotic selfish pauper social media driven from minority have a culture where classification is more important than qualification,ndzi nga tsakela ku va na biliyoni yo tlhariha ku tlula vutianakanyi bya vuphukuphuku bya vutianakanyi bya le ka social media lebyi susumetiwaka ku suka eka vuntsongo byi na ndhavuko laha ku hlawuriwa ku nga ka nkoka ku tlula ku faneleka .
1512,this is all the more reason we our restaurant culinary program featured in multiple business to develop raw talent into get them before they bad you will not only improve your team culture but you will positively impact their,leswi hi swona swi endlaka leswaku hi va phurogireme ya hina ya swakudya swa le restoran leyi kombisiweke eka mabindzu yo tala ku hluvukisa talenta yo ka yi nga swekiwanga ku va va va kuma va nga si biha a wu nge antswisi ndhavuko wa xipano xa wena ntsena kambe u ta khumba hi ndlela leyinene ya vona .
1513,i been stuck in a lab for several possibly a thousand i do not know anything about the new culture,ndzi khomiwile elaboratori hi swin’wana leswi nga ha vaka swi ri gidi a ndzi tivi nchumu hi ndhavuko lowuntshwa .
1514,_vision that sexual liberation in society it harder to find a mate in the antiquated dating structure still cling to now want the sex to be abundant enough in culture to titilate personal taste but not enough to challenge romantic tie value to,.
1515,whether you traveled across town from the west coast or across the pond welcome to boston we are excited to be together for our summer,kunga khathariseki leswaku u fambe u tsemakanya doroba kusuka e west coast kumbe etlhelo ka xidziva mi amukeriwile e boston hi tsakile ku va swin’we eka ximumu xa hina .
1516,culture is what you allow to achieve organizational integrity your culture must be driven by your mission core and vision,ndhavuko hi swona leswi u swi pfumelelaka ku fikelela vutshembeki bya nhlangano ndhavuko wa wena wu fanele ku fambisiwa hi vurhumiwa bya wena bya vurhumiwa na xivono .
1517,he s his character the white man fan is not the drag twitter it is meanwhile your page is full of non black like both don t have a history of being anti black stealing my culture and being racist,he s his character the white man fan is not the drag twitter it is meanwhile page ra wena ri tele hi non black like both don have a history of being anti black stealing my culture and ku va racist .
1518,one day in the future will have a page on ancient culture and influence and how it led to the spawning of this abomination of nature,siku rin’wana enkarhini lowu taka ri ta va ni tluka ra ndhavuko wa khale ni nkucetelo ni ndlela leyi swi endleke leswaku ku tswariwa manyala lawa ya ntumbuluko .
1519,incoming wave of of rich white suburbanite walking toward their doing it for the culture,incoming wave of ya valungu va valungu va le dorobeni lava fambaka va ya eka ku endla ka vona eka ndhavuko .
1520,because it don t make sense and that s why you can t explain and want me to accept something that don t make sense so you can feel right your culture and the original argument is about race is not a race and race t a real thing,hikuva a swi endli nhlamuselo naswona sweswo swi endla leswaku u nga hlamuseli ni ku lava ndzi amukela nchumu lowu nga twisisekiki leswaku u ta titwa u ri kahle ndhavuko wa wena naswona njhekanjhekisano wo sungula i wa rixaka a hi rixaka ni rixaka t a real thing .
1521,school leadership and school culture next level leadership here,vurhangeri bya xikolo na ndhavuko wa xikolo vurhangeri bya xiyimo lexi landzelaka laha .
1522,as especially when we work we think about how we communicate with everyone and how this might impact one is productivity at work check out this insightful by peter to learn more,tanihi leswi ngopfu-ngopfu loko hi tirha hi ehleketa hi ndlela leyi hi vulavurisanaka ha yona na un’wana na un’wana na ndlela leyi leswi swi nga khumbaka munhu i vuhumelerisi entirhweni languta leswi hi ku twisisa hi peter ku dyondza swo tala .
1523,the reason you re not seeing the impact of your is because the methodology is still rooted in white culture said it best master s can t dismantle his house,xivangelo xa leswaku u nga voni nkucetelo wa wena hileswi endlelo ra ha dzimeke timitsu eka ndhavuko wa valungu ri vule leswaku it best master s can t dismantle his house .
1524,they should give their a proper burial the fact they would flush a dead baby how we are a culture of death,va fanele va nyika ku lahliwa ka vona loku faneleke mhaka ya leswaku va ta hlantswa n’wana la feke ndlela leyi hi nga ndhavuko wa rifu .
1525,i got culture shock i met many of,ndzi kume culture shock ndzi hlangane na vo tala va .
1526,the game is much more than just as a cat it is about the why they are there and what to you uncover about the past and the culture of these,ntlangu lowu wu tlula ngopfu tanihi kati ntsena i mayelana na leswaku ha yini va ri kona ni leswi eka wena u swi paluxaka hi nkarhi lowu hundzeke ni ndhavuko wa leswi .
1527,party on a freeway s much tunnel tops park in the presidio via,nkhuvo eka freeway s much tunnel tops park e presidio via .
1528,_erikk it is not past it is still practiced only that people are so taken by the western culture culture that they now think it is evil but it is not,.
1529,but they re not the fact that he married a white they re the hypocrisy that men are to do whatever the f they want but are and into culture as they put it,kambe a va swi koti ku teka mulungu va re the hypocrisy leswaku vavanuna va fanele ku endla whatever the f they want but are and into culture as they put it .
1530,i let you know where i end up will a meet up with you soon whilst you re in i just spent getting over covid,ndzi mi tivisa laha ndzi hetelelaka ndzi ta hlangana na n'wina ku nga ri khale loko mi ri karhi mi nghena ndzi lo heta ntsena ku hundza covid .
1531,somebody s say this is another instance of a white person stealing taking credit for black culture,somebody s say this is another instance ya munhu wo basa a yiva a teka credit for black culture .
1532,they have been to the to a giant lava lamp to six now they are sailing east to the pot a cathedral full of soup where people worship a cat and meanwhile strange are happening up above on a network of flying full of culture,va tshame va ya eka ku ya eka rivoni lerikulu ra lava ku ya eka tsevu sweswi va famba va ya evuxeni va ya embiteni kereke-nkulu leyi teleke hi supu laha vanhu va gandzelaka kati naswona hi nkarhi wolowo va nga tolovelekangiki va humelela ehenhla ehenhla eka netiweke ya ku haha ​​loku teleke hi ndhavuko .
1533,and all you diseased woke lot this is what you are supporting and want to bring into the stone age culture and religion pedophilia no place is this country failure to condemn it is to support it,naswona hinkwenu n'wina va divamad woke lot leswi hi swona leswi mi swi seketelaka naswona mi lavaka ku tisa eka ndhavuko wa stone age na religion pedophilia akuna ndhawu leyi tiko leri ri tsandzekaka ku ri sola ku ri ku ri seketela .
1534,talking down where i understand very much so if that is y'all culture it is disgusting so next,ku vulavula ehansi laha ndzi twisisaka ngopfu so if that is y'all culture swi nyenyetsa so next .
1535,is d,i d .
1536,i think he that ant the culture and feeling of the team more than because ant is more excessive and out going was back and about basketball not the media like ant,i think he that ant the culture and feeling of the team more than hikuva ant yi hundzeleta ngopfu and out going was back and about basketball not the media like ant .
1537,_memes i see your a person of culture,_memes ndzi vona munhu wa wena wa ndhavuko .
1538,not sure she to drop when it was about getting the mp is on her side should have gone full culture war as soon as clear it was between her and truss as anti candidate,not sure ku u ta drop loko ku ri ku kuma mp yi ri on her side should have gone full culture war as soon as clear it was between her and truss as anti candidate .
1539,as much as i want to see a global transformation of work culture that everyone i can t lie somehow being t as sweet when everyone i know is also it s taken the smugness right out of it,as much as i want to see a global transformation of work culture leswaku un'wana na un'wana ndzi nga hemba hi ndlela yo karhi a ri t as sweet loko un'wana na un'wana loyi ndzi n'wi tivaka a tlhela a tekiwa smugness right out of it .
1540,the of have added to their up universe with if you have on what they should make next let them know in discord,the of have added to their un universe na loko u ri na leswi va faneleke ku swi endla next va tivise in discord .
1541,is a melting pot of the dominant culture is selfishness,i poto ro n’oka ra ndhavuko lowu lawulaka i vutianakanyi .
1542,_squirrel not true many do not have year current us culture a little over of lying cheating stealing and murdering because their national culture only came into being in the s,.
1543,purity culture is so toxic,ndhavuko wa ku basa wu ni chefu swinene .
1544,none but are some unknown force you possession of rational culture and _,a ku na yin'wana ya matimba lama nga tiviwiki ya wena ku va na ndhavuko wa mianakanyo na _ .
1545,looking for ways to improve the culture of your fully remote or hybrid team it is critical to consider how you can create a sense of belonging and purpose read more below,ku lava tindlela to antswisa ndhavuko wa ntlawa wa wena wa le kule kumbe wa le kule hi ku helela i swa nkoka swinene ku languta ndlela leyi u nga tumbuluxaka ku titwa ka ku va xiphemu xa nkoka ha yona na xikongomelo hlaya swo tala laha hansi .
1546,personally i would hate to live in a culture dominated by s comic and i m glad that s not the case,hi mina ndzi nga venga ku hanya eka ndhavuko lowu lawuriwaka hi s comic and i m glad that s not the case .
1547,i have now down and would like to for it s nice that these people appreciate my culture,i have now down and ndzi nga tsakela for for it s nice leswaku vanhu lava va tlangela ndhavuko wa mina .
1548,i do not need a reason to be interested in culture and politics that is one of the of not living in china or north,a ndzi lavi xivangelo xo tsakela ndhavuko na tipolitiki leti nga yin’wana ya ya ku nga tshami echina kumbe en’walungwini .
1549,is contaminant that polluted the political culture beyond repair to of for imposing such dirty on nation,i thyaka leri thyakeke ndhavuko wa tipolitiki ku tlula ku lunghisiwa ku ya eka ku sindzisa ku thyaka ko tano eka rixaka .
1550,that is a product of the what have you done for me lately culture,sweswo i xiendliwa xa leswi u ndzi endleleke swona lately culture .
1551,i was so big on dating only then i dating my it was the best decision i ever made learning a whole new culture getting to try new food getting like i walk on water recommend,i was so big on dating only then i dating my it was the best decision i ever made a new a new culture getting to try new food getting like i walk on water recommend .
1552,thanks for reading i am a web consultant and pop culture host exploring the intersection of pop culture nostalgia and web,ndza khensa ku hlaya ndzi mutsundzuxi wa webu na muhaxi wa ndhavuko wa pop loyi a kambisisaka ku hlangana ka pop culture nostalgia na web .
1553,this why the culture stuck to gogo music,leswi swi endle leswaku ndhavuko wu namarhela vuyimbeleri bya gogo .
1554,_hughes why do we need diversity in everything the value of art is in the author is original intention not in the by some offended minority if you have to rewrite the source text for some maybe is they who are racist phobist if they can not accept culture,.
1555,can help provide the opportunity to foster a collaborative and a healthy culture,swi nga pfuna ku nyika nkarhi wo kurisa ndhavuko wa ntirhisano na wa rihanyo .
1556,so why mass adoption because 'pop' culture is by definition popular that you need a large audience seeing an already familiar concept being sold in a new format people enter the space when they otherwise would not,so why mass adoption hikuva 'pop' culture is by definition popular leswaku u lava vayingiseri vo tala u vona concept leyi se yi tolovelekeke yi xavisiwa hi xivumbeko lexintshwa vanhu va nghena eka space loko otherwise a va nga ta swi endla .
1557,on to this ya is somewhat like the it s an impolite way to call someone like hey you usually used in a way if not used amongst people you re close with formality is an important aspect to culture and language so do keep note,on to this ya is somewhat like the it s an impolite way to call someone like hey you usually used in a way if not used amongst people you re close with formality is an important aspect to culture and language so do keep note
1558,culture is taking over,ndhavuko wu teka vulawuri .
1559,_poppins _myth _baber i read their just to laugh,_poppins _myth _baber ndzi hlayile just to laugh .
1560,no more culture for you getting us excited for,no more culture eka wena ku hi endla hi tsaka hi .
1561,just by his word you can relax and enjoy the natural peace that comes from knowing god is nearby i am to a track with a deep and meaningful message by god he away the normal appreciation of culture from him your consciousness is,hi rito ra yena ntsena u nga ntshunxeka u tiphina hi ku rhula ka ntumbuluko loku humaka eku tiveni ka xikwembu ndzi le kusuhi ndzi le ka track leyi nga na rungula leri dzikeke no va na nhlamuselo hi xikwembu he away the normal appreciation of culture from him consciousness ya wena i .
1562,why a culture of inquiry is so important,leswaku ha yini ndhavuko wa ku vutisa wu ri wa nkoka swinene .
1563,we will see how many smart young tech want to live in a state where can not make about their own are not safe in school you promote snitch culture it is hard to vote you charge us extra to make us freeze in the dark,hi ta vona leswaku i ti smart young tech tingani leti lavaka ku hanya eka xifundzha laha ti nga kotiki ku endla hi ta tona a ti hlayisekanga exikolweni u promota snitch culture swa tika ku vhota u hi charge extra ku hi endla freeze in the dark .
1564,it is getting harder for fossil fuel to sponsor or to their image,swi ya swi tika leswaku mafurha ya fossil ma va sponsor kumbe eka xifaniso xa vona .
1565,_oraaa the an history being it so thats why black people get offended when non black wear it it t feel right thats why i m not black but personally is not racist or culture appropriation to me is more like culture appreciation but i get it why is offensive,_oraaa the an history being it so thats why vantima va khunguvanyeka loko non black va ambala it t feel right thats why i m not black but personally is not racist or culture appropriation to me is more like culture appreciation but i get it why is offensive
1566,i say this as someone who s in horribly bad shape but i really think that people on the left need to start building a better physical culture in part for its own sake but mainly so that those of us who are able to fight physically ready to do so and to defend those who cannot,ndzi vula leswi tani hi munhu loyi a nga eka xivumbeko xo biha swinene kambe ndzi ehleketa hakunene leswaku vanhu va le tlhelo ra ximatsi va fanele ku sungula ku aka ndhavuko wo antswa wa nyama hi xiphemu hi xikongomelo xa wona kambe ngopfu-ngopfu leswaku hina lava hi kotaka ku lwa hi nyama hi lunghekele ku endla . hikwalaho ni ku sirhelela lava nga swi kotiki .
1567,so are you saying that there was no or anything else burned how is that culture mon to training sometime never been made to feel more welcome,so u vula leswaku a ku ri hava kumbe swin'wana leswi hisiweke swi njhani leswaku ndhavuko wu mon to training sometime never been made to feel more welcome .
1568,culture is so funny cos why do album look like i love it,culture is so funny cos why u endla album yi languteka ndzi ri love it .
1569,president prime minister both in opposing cricket squad for to prove substantially that sent us in the world to play cricket to make not to ameliorate plight of the downtrodden culture of the fortress of,phuresidente holobyenkulu hi vumbirhi eka xipano xa khirikhete lexi kanetanaka leswaku a kombisa hi xiviri leswaku u hi rhumele emisaveni ku ya tlanga khirikhete ku nga endli leswaku ku nga tluli xiyimo xa ndhavuko lowu tshikileriweke wa khokholo ra .
1570,the game is to hold onto power as long as possible entrench themselves in our political system such that they cannot easily be removed even if the people is will and write in the service of a culture war that most ordinary people are not fighting,ntlangu lowu i ku khomelela eka matimba loko ntsena swi ri karhi swi tikuma hi voxe eka fambiselo ra hina ra tipolitiki lerova va nga swi koti ku susiwa hi ku olova hambiloko vanhu va ri ku navela ni ku tsala entirhweni wa nyimpi ya ndhavuko leyi vanhu vo tala lava tolovelekeke va nga lwisaniki na yona .
1571,auto show is coming to on the th it is a family friendly car show that will feature to club to magazine featured trophy it really will have it all further information can be found here,auto show is coming to on the th it is a family friendly car show leyi nga ta feature to club to magazine featured trophy hakunene yi ta va na yona hinkwayo vuxokoxoko byo tala byi nga kumeka laha .
1572,join my game to lose _ _shen _nathan _rot _maker,joyina ntlangu wa mina ku lahlekeriwa hi _ _shen _nathan _rot _maker .
1573,we are looking for hip hop and of the culture to join the hip hop,hi lava hip hop na ya ndhavuko ku joyina hip hop .
1574,culture will be an unfortunate victim,ndhavuko wu ta va muhlaseriwa la nga riki na nkateko .
1575,on behalf of all black men we love it when ya will embrace our culture and acknowledge our history,hi ku yimela vavanuna hinkwavo va vantima hi swi tsakela loko ya yi ta amukela ndhavuko wa hina ni ku amukela matimu ya hina .
1576,i would have said an running the culture department,a ndzi ta va ndzi vule an running the culture department .
1577,here i am raising my around god family community music culture non fiction reading science she is and we are trying for more then i see this and just wonder why you would want to deprive your child a chance in life i just do not get it at all,laha ndzi kurisa around god family community music culture ya mina ya ndyangu non fiction reading science she is and hi ringeta ku tlula then ndzi vona leswi and just wonder why u ta lava ku tsona nwana wa wena chance evuton'wini i just do not get it at all
1578,here it is again in all its glory construction bike lane in our very own city good change is coming slowly and sometimes let s make it culture behind the truck we had a whole lane,laha yi tlhela yi va eka hinkwaswo swa yona swa ku vangama ko aka xikanyakanya edorobeni ra hina swinene ku cinca lokunene ku ta hi ku nonoka naswona minkarhi yin’wana ku tshika ku swi endla ndhavuko endzhaku ka lori a hi ri na layini hinkwayo .
1579,for the culture beard gang,eka ntlawa wa ndhavuko wa malebvu .
1580,my dad was dropping some off at little free and found some which he took and threw away censorship and cancel culture fine too far,my dad a ri karhi a drop some off at little free a kuma swin'wana leswi a swi tekeke a swi lahlela censorship a cancel culture fine too far
1581,always lose on culture war if the focus were on like climate income inequality and the republic as we know it maybe we win more and could pass this type of legislation we are losing our cause we are losing,minkarhi hinkwayo ku hluriwa eka nyimpi ya ndhavuko loko ku kongomisiwa eka ku fana na ku nga ringani ka miholo ya maxelo na riphabliki tani hi leswi hi swi tivaka kumbexana hi hlula ngopfu naswona hi nga pasisa muxaka lowu wa milawu leyi hi lahlekeriwaka ha yona hi mhaka ya hina hi lahlekeriwa .
1582,perhaps it on the country culture as you say literary fiction always been dark gritty i m not but i d agree popular us seem nowadays does that reflect a trend or is catching up with the eternally gritty,kumbexana it on the country culture as you say literary fiction always been dark gritty i m not but i d agree popular us seemas nowadays does that reflect a trend or is catching up with the eternally gritty
1583,basically up the entirety of modern sexual culture,kahle-kahle ku ya ehenhla ka ndhavuko hinkwawo wa rimbewu ra manguva lawa .
1584,community and culture are nice but financial speculation to be the predominant driving force for most,community and culture swi sasekile kambe ku ringanyeta ka timali ku va matimba lama susumetaka ngopfu eka vunyingi .
1585,_winter but illegal are the backbone of this country so rich in culture so smart and educated trusting and loyal not to mention hard working why t in blue and wanting more of them,.
1586,cancel culture was by pathetic,ku khansela ndhavuko a ku ri hi ndlela yo twela vusiwana .
1587,__cgo if you want to follow a team whose owner the name to bow to cancel culture a woke cheap owner have at it i have watched this team fail of a owner not spending enough money he wont add good free he away when they approach free agency for more cheap,__cgo loko u lava ku landzelela xipano lexi n’wini wa xona vito a nga nkhinsama ku khansela ndhavuko n’wini wo chipa loyi a nga na xona ndzi hlalerile xipano lexi xi tsandzeka ku va n’wini a nga tirhisi mali yo ringana u nga engeteli kahle mahala he away loko va tshinelela free agency for swin'wana swi chipa
1588,a new card game was designed and written by ai,ntlangu lowuntshwa wa makhadi wu endliwile no tsariwa hi ai .
1589,weird for some reason a culture of servitude to inbred to create weak people,weird for some reason ndhavuko wa vuhlonga eka inbred ku tumbuluxa vanhu lava tsaneke .
1590,actually is very easy to explain we have a war of on our culture between us and the fact that each province its own culture rather than an unified culture,kahle kahle swa olova swinene ku hlamusela hi na nyimpi ya ndhavuko wa hina exikarhi ka hina na mhaka ya leswaku xifundzha xin’wana na xin’wana xa xona ndhavuko ku tlula ndhavuko lowu hlanganeke .
1591,what do you think such an authentic culture possible,xana u ehleketa leswaku ndhavuko wo tano wa ntiyiso wa koteka .
1592,exclusive the powerful role as marine veteran in breaking,exclusive the powerful role tani hi marine veteran eka ku tshoveka .
1593,probably to do with being in upper culture where is pretty much nonexistent as well my thought process even with mall was this adult is not how i expect to behave and it is me,probably to do with being in upper culture where is pretty much nonexistent as well my thought process even with mall was this adult is not how i expect to behave and it is me me .
1594,the military is made up of our entire nation we are a melted big pot which is our strength no one to fight in very little to do with woke and more about who the culture war and tenacity to serve in something higher than themselves,vusocha byi vumbiwa hi rixaka ra hina hinkwaro hi n’okiso wa poto lerikulu leri nga matimba ya hina a ku na munhu wo lwa hi switsongo swinene ku endla na ku pfuka na swo tala hi leswaku i mani nyimpi ya ndhavuko na ku tiyisela ku tirha eka nchumu lowu tlakukeke ku tlula vona vini .
1595,i do not want in office period call it religious discrimination if you like but is not just a religion it is a and it is a culture which with this culture read the he is a nice man but i do not vote for nice i vote for our constitution,a ndzi lavi eka nkarhi wa hofisi vitana xihlawuhlawu xa vukhongeri loko u swi tsakela kambe ku nga ri vukhongeri ntsena i a naswona i ndhavuko lowu hi ndhavuko lowu wu hlayaka the he is a nice man but a ndzi vhoteli nice i vote for our . vumbiwa .
1596,brought to the bird saying that i would get them or the cancel culture now all they do is rant about their b on my,va tisa eka xinyenyana lexi a ndzi vula leswaku ndzi ta va kuma kumbe ndhavuko wa ku khansela sweswi leswi va swi endlaka i ku rhuketela hi b ya vona .
1597,_katy this like such a delightful idea,_katy leswi ku fana na miehleketo yo tsakisa swonghasi .
1598,part of our culture is old look amazing,xiphemu xa ndhavuko wa hina i old look amazing .
1599,this weekend is it is the celebration of south culture in the north of and it is free some of the biggest in the and international entertainment scene perform on two on both days more here,mahelo ya vhiki lawa i ku tlangela ndhavuko wa le dzongeni en’walungwini wa naswona i mahala swin’wana swa swikulu eka na xivandla xa vuhungasi bya matiko ya misava lexi tlangaka hi timbirhi eka masiku lawa hamambirhi swin’wana laha .
1600,_jordan translation mass gun violence is a unique attribute of modern culture these killing will become steadily more frequent and claim an increasing number of will do nothing about it if limiting of or unfettered access to,.
1601,there is plenty of history and culture to experience while in,ku ni matimu yo tala ni ndhavuko lowu u faneleke u wu kuma loko u ri eka .
1602,discovery of device blamed on lackluster culture via,ku tshuburiwa ka xitirhisiwa lexi soriwaka eka ndhavuko wa lackluster via .
