,src,trg
767,me in in the debate and gave back in equal measure he won you do not expect to win a brawl against a pig in his environment he is drag you the murk,mina in in the debate and gave back in equal measure a mi hlula mi nga languteli ku wina brawl against a pig in his environment a mi koka mirk mirk
768,the are now clear it is between objective debate and subjective it is between social justice for all or bottom up it is between fight against corruption or fight against it is between restoration of our dignity or revenge,the sweswi swi le rivaleni leswaku yi le xikarhi ka njhekanjhekisano lowu nga na xikongomelo na subjective it is between social justice for all or bottom up it is between ku lwisana na vukungundzwana kumbe ku lwisana na byona is between restoration of our dignity or revenge .
769,the 'old boy network' supporting one another,'old boy network' yi seketelana .
770,the have on the deputy president debate no real disappointed,the have on the deputy president debate no real disappointed .
771,let debate how is jordan seriously better than but you cannot mention his,let debate xana jordan u antswa njhani ku tlula kambe a wu nge swi koti ku vula his .
772,if you think is going to at the presidential debate then you need to think again baba always been on top of his game will have a terrible night,loko u ehleketa leswaku u ya eka njhekanjhekisano wa president kutani u fanele ku ehleketa nakambe baba minkarhi hinkwayo a ri ehenhla ka ntlangu wa yena u ta va na vusiku byo chavisa .
773,i m all for debate and an exchange of opinion but when two people are talking at the same time nobody can hear anything it s waste of time so don t do it and it s also unprofessional,i m all for debate na ku cincana ka mavonelo kambe loko vanhu vambirhi va vulavula hi nkarhi wun'we a ku na munhu loyi a nga twaka nchumu it s waste of time so don t do it and it s also unprofessional .
774,the problem is that we know that sex is driving it but the exact activity during sex is up for debate,xiphiqo hi leswaku ha swi tiva leswaku rimbewu ri ri eku ri chayelani kambe ntirho lowu kongomeke hi nkarhi wa rimbewu wu le ku pfumeleni .
775,does use kerosene surely that was the is your name of last night is debate useless pointless question was about the retail price of two was about that of bread only,does use kerosene surely that was the i vito ra wena ra vusiku bya tolo xivutiso lexi nga pfuniki nchumu xivutiso a xi ri xa nxavo wa vuxavisi wa vanhu vambirhi a xi ri mayelana na xa xinkwa ntsena
776,have in removing their opinion poll from twitter here it is as at after the debate,va na eku suseni ka mavonelo ya vona ya mavonelo eka twitter laha swi le ka after the debate .
777,it that to get to that position as a non white male one to be more extreme and further right of my main consideration during the first leader s debate was who is least likely to take us to war my instinct was rishi,it leswaku ku fika eka xiyimo xexo tani hi non white male one to be more extreme and further right of my main consideration hi nkarhi wa njhekanjhekisano wa murhangeri wo sungula a ku ri leswaku i mani loyi a nga ta hi yisa enyimpini enyimpini ya mina a ku ri rishi .
778,you the policy in the live debate on do you genuinely support the policy given the home office select committee s report or is your support merely a tory vote winner when in fact it is one of this government s most shameful,wena pholisi eka njhekanjhekisano lowu hanyaka eka xana u seketela hi ntiyiso pholisi leyi nyikiweke xiviko xa komiti yo hlawula ya hofisi ya le kaya kumbe i nseketelo wa wena ntsena muhluri wa vhoti ya tory kasi entiyisweni i wun’wana wa tingana leti ta tingana swinene .
779,in any case it is useless to debate this those who seek to disarm their will come out and as i said di mau m duit,in any case a swi pfuni nchumu ku debate leswi lava va lavaka ku hluvula matlhari ya vona ya huma and as i said di mau m duit .
780,'look into the eye' black eye occasionally opaque or a iris appear to be early sign of ai among healthy sadly we saw the first chick fitting the eye cloudy is it a haemorrhage and debate it is necropsy may bring understanding,‘languta etihlweni’ tihlo ra ntima nkarhi wun’wana riva opaque kumbe iris switikomba swiri xikombiso xosungula xa ai exikarhi ka rihanyo lerinene hi vone ximbutana xosungula xiringanela mapapa ya tihlo is it a haemorrhage and debate it is necropsy may bring understanding .
781,his whole debate was about president the other was about the commission of inquiry on corruption really commission of inquiry i understand it is hard for people involved in corruption to deal with it,mphikizano wa yena hinkwawo a wu ri wa presidente lowun’wana a wu ri mayelana na ku endliwa ka vulavisisi eka vukungundzwana hakunene khomixini ya vulavisisi ndza swi twisisa leswaku swa tika eka vanhu lava katsekaka eka vukungundzwana ku langutana na byona .
782,why have not you posted a congratulatory tweet on last night is debate ama it is what it is,why u nga se posta congratulatory tweet eka vusiku bya tolo i debate ama hi leswi yi nga xiswona .
783,_desires i appreciate the offer i would not mind it but i will not be lazy and make you do the work it just like there is a lot of debate on those so leaving it to the best for the country and i like that there is potential,.
784,won the debate she sticked to which the debate was supposed to be about thank you,yi hlule njhekanjhekisano lowu a wu namarhele lowu njhekanjhekisano a wu fanele wu va hi ku nkhensa .
785,your question is as dumb as what is a nuke when a nuke is not a thing but we all know it nuclear bomb you literally are and semantics here you should not debate this because your take does not hold any water,xivutiso xa wena i xiphukuphuku ku fana na leswi nuke yi nga nuke loko nuke yi nga ri nchumu kambe hinkwerhu ha swi tiva bomo ya nyutliya hi ku kongoma na semantiki laha a wu fanelanga ku kanetana leswi hikuva take ya wena a yi khomi mati wahi na wahi .
786,so i understand you me the once exposed that you were swinging wildly then you turned to the cool at the cool table to try to tear me down through their sycophant tell them our debate eric eric you are pathetic,so i understand you me the once exposed leswaku a wu swing wildly then u hundzukela eka cool at the cool table ku ringeta ku ndzi handzula hi sycophant ya vona va byela debate ya hina eric eric u pathetic .
787,_boy _jr we watched a different debate in the debate i watched she clearly stated twice that the only land e is the one with her house in and her home belonging to her father who registered it in her name you go to court she is ready,.
788,alright thank you for ending the debate have a nice day it s am here and i need to read my daily dose of nice talking to you,alright ndza khensa ku heta njhekanjhekisano va na siku ro saseka it s am here and ni lava ku hlaya dose ya mina ya siku na siku ya nice talking to you
789,the supposed to attend the debate and that during the debate,leswi faneleke ku va kona eka njhekanjhekisano na leswaku hi nkarhi wa njhekanjhekisano .
790,t even have the decency to debate her political shame on san for continuously this selfish individual who only about enriching her own family,t hambi ku ri ku va ni xichavo xo kanetana hi tingana ta yena ta tipolitiki eka san for continuously this selfish individual loyi a nga ta fuwisa ndyangu wa yena ntsena .
791,i have been supporting and but after this debate and listening to i have my mind i am now supporting thief ruto is journey to,ndzi vile ndzi seketela naswona kambe endzhaku ka njhekanjhekisano lowu no yingisela ndzi na miehleketo ya mina sweswi ndzi seketela khamba ruto i riendzo ro ya eka .
792,did very well at the debate telling it like it is he brought receipts state capture,did very well at the debate a swi byela onge hi yena a tisaka receipts state capture .
793,i did not know is this smart was reduced to nothing ni the main debate with and is not yet please skip the debate with this is not thing,a ndzi nga swi tivi leswaku i smart leyi yi hungutiwile yi va nothing ni the main debate na yona and is not please skip the debate with this is not thing
794,water is wet feel free to debate me in the,mati ya tsakama titwe u ntshunxekile ku ndzi kanetana eka .
795,imagine president deliberately the debate cant wait to see prof grill,imagine president hi vomu njhekanjhekisano cant wait ku vona prof grill .
796,_damn_muteki _fatal _of_debate _felinemenace _bobby _s _dr _clarkej most do not want bottom surgery,.
797,the debate was yesterday,mphikizano lowu a wu ri tolo .
798,i know you are disappointed after seeing prowess in debate sorry because you lost my vote bye papa,ndza swi tiva leswaku wa khunguvanyeka endzhaku ko vona prowess eka debate sorry hikuva u lahlekeriwe hi vhoti ya mina bye papa .
799,_tweet _ramesh get your corrected they never to debate neither raised this with speaker not let the respond all they did was intentional disruption and the house,.
800,so an out and suspended for days for to debate the issue while this nincompoop away with,so an out and suspended for days for ku kanetana hi mhaka leyi loko nincompoop yi ri ekule na .
801,yesterday is debate i how hard it is was to explain where money comes from like a lot of it working hard to be successful ni scam,tolo is debate i how hard it is was ku hlamusela laha mali yi humaka kona ku fana na swo tala swa yona swi tirha hi matimba ku va successful ni scam .
802,he is the same man who could not attend the gubernatorial debate,i wanuna loyi a nga swi kotangiki ku ya eka njhekanjhekisano wa vuhosi .
803,let is agree that the media can broadcast the presidential debate but sit out out on the moderation,a hi pfumerile leswaku swihangalasamahungu swi nga haxa njhekanjhekisano wa vupresidente kambe swi tshama ehandle hi ku ringanisela .
804,_marielmueller i have been supporting and but after this debate and listening to i have my mind i am now supporting thief ruto is journey to,_marielmueller ndzi vile ndzi seketela naswona endzhaku ka njhekanjhekisano lowu na ku yingisela ndzi na miehleketo ya mina sweswi ndzi seketela khamba ruto i riendzo ro ya eka .
805,_scindia india is and their are useless because neither they debate on the issue of the nor they show the truth they run news they do not care that the is dying due to inflation keep dancing on the behest of the government,.
806,what an eye catching phrase to describe the debate nearly the rice,i xivulwa lexi kokaka mahlo swonghasi ku hlamusela njhekanjhekisano kwalomu ka rhayisi .
807,glover part time penny is so obviously unfit to be so is is by far better choice,glover part time penny yi le rivaleni swinene leswaku a yi faneleki ku va tano is is by far better choice .
808,maybe the reason the final tory leadership debate was was because it such great campaign material for,kumbexana xivangelo xa njhekanjhekisano wo hetelela wa vurhangeri bya tory a ku ri hikuva it such great campaign material for .
809,let legal fraternity deliberate saninathan is to know his professional ethics his verdicts' content are like third rated channel debate guest to spew venom on other religious people and protect yellow journalism,a hi nge nawu wa vumakwerhu wa le nawini saninathan u fanele ku tiva mahanyelo ya yena ya xiphurofexinali leswi nga endzeni ka swiboho swa yena swi fana ni muyeni wa vunharhu wa channel debate guest ku hlantswa vuxungu eka vanhu van’wana va vukhongeri ni ku sirhelela vujornalisti byo tshwuka
810,just in will not attend presidential debate after his running mate miss and,just in will not attend presidential debate endzhaku ka running mate miss ya yena na .
811,it is when the on the to attack instead of debate got to the dead end,i loko the on the to attack ematshan'wini ya debate yi fika eka dead end .
812,they should have something like this at local level all the main party at an open debate so get to see who they vote for,va fanele va va na swo fana na leswi eka local level all the main party at an open debate so get to see who they vote for .
813,when i see of wrongdoing i understand that the people wrongdoing have the burden of proof when i look at one side of a debate and find them constantly their on very weak evidence i am not persuaded by their insistence that they are right,loko ndzi vona ku endla swilo swo biha ndza swi twisisa leswaku vanhu vo biha va ni ndzhwalo wa vumbhoni loko ndzi languta tlhelo rin’we ra njhekanjhekisano ivi ndzi va kuma nkarhi hinkwawo va ri eka vumbhoni lebyi tsaneke swinene a ndzi khorwisiwi hi ku sindzisa ka vona leswaku va lulamile .
814,sincerely i wish gave us as their presidential candidate it would have been a presidential debate between two brilliant,hi ku tshembeka ndzi navela ku hi nyika tanihi n’wandla wa vona wa vupresidente a swi ta va swi ri njhekanjhekisano wa vupresidente exikarhi ka vambirhi vo tlhariha .
815,content just sit back and see the outcome from yesterday is debate one key lesson is overconfidence is bad and its running mate overconfident never judge a book by the cover you all posting coz you mercilessly relax,content just sit back u vona mbuyelo wa tolo is debate dyondzo yin'we ya nkoka is overconfidence is bad and running mate overconfident ya yona never judge a book by the cover you posting coz you mercilessly relax
816,debate is not about yapping or brutal oratory rather great sense in,debate a hi ya ku yapa kumbe brutal oratory rather great sense in .
817,_tragon_de_la i really really do not want to plant a flag in the debate to the extent that there is a debate i do not care i do not have a position i think is right or wrong but if you look at a map of la proper it is very hard to imagine at the center even if it historically was,_tragon_de_la hakunene hakunene a ndzi lavi ku byala mujeko eka njhekanjhekisano ku fikela laha ku nga na njhekanjhekisano a ndzi na mhaka na mina a ndzi na xiyimo lexi ndzi vonaka xi lulamile kumbe xi hoxile kambe loko u languta mepe wa la proper wu ri swi tika swinene ku swi anakanya exikarhi hambi leswi hi matimu a swi ri .
818,is a top pen in battle rap i debate that all day wit n,is a top pen in battle rap i debate leswaku siku hinkwaro wit n .
819,what did he debate apart from and state capture is that what will make you excited in cant wait to see your reason and after th your friend was but money him too so we are not,xana u debate yini na state capture hi leswaku lexi nga ta ku endla u tsaka hi cant wait ku vona xivangelo xa wena and after th munghana wa wena a ri but money him too so we are not we are not .
820,_russia _eeas _eu difficult to fit into a twitter 'box' but essentially it healthy debate young people are subjected to the politics of thinking rather than the far more fruitful action of creative thought process,_russia _eeas _eu swi tika ku nghena eka 'bokisi' ra twitter kambe hi xiviri it healthy debate vantshwa va le hansi ka tipolitiki ta ku ehleketa ku nga ri xiendlo lexi vekaka mihandzu swinene xa endlelo ra miehleketo yo tumbuluxa .
821,it would be great fun to watch debate about dollar rupee and other economic on the open stage would love to see his acting there,swi nga tsakisa swinene ku hlalela njhekanjhekisano mayelana na dollar rupee na swin’wana swa ikhonomi eka xiteji lexi pfulekeke swi nga tsakela ku vona vuyimbeleri bya yena kwalaho .
822,i hope will be the chief moderator during the bugfish presidential debate,ndzi tshemba leswaku u ta va mufambisi lonkulu hi nkarhi wa njhekanjhekisano wa vupresidente wa bugfish .
823,democrat communist it is not even up for debate,democrat communist a swi tano hambi ku ri ku kanetiwa .
824,good luck with the debate today,ndzi na nkateko eka njhekanjhekisano namuntlha .
825,they do not tackle any just corruption how to reduce the cost off living their source of wealth na ni the catch it was more of a who are you kind of debate did better,a va lwisani na vukungundzwana ntsena ndlela yo hunguta ku durha off ku hanya xihlovo xa vona xa rifuwo ni ni ku khoma it was more of a who a are kind of debate did better .
826,i seek clarity from the of the debate was debating with or why is it that the were unable to remind him stick to the main that of him very boring debate,ndzi lava ku va erivaleni eka ya njhekanjhekisano a ku ri ku kanetana na kumbe ha yini ku ri leswaku the va tsandzeka ku n'wi tsundzuxa ku namarhela eka main that of him very boring debate .
827,_randy _nz _ _barton _oakley goodness are we back to the endless nuclear debate again,_randy _nz _ _barton _oakley vunene hi tlhelela eka njhekanjhekisano wa nyutliya lowu nga heriki nakambe .
828,to as the iron lady she carried the day by her opponent heavily on the debate yesterday,ku as the iron lady u rhwale siku hi muxanisi wa yena ngopfu eka debate tolo .
829,people have saman priest and saman mean priest of religion this debate is finish are turk for sure,vanhu va na saman priest na saman mean muprista wa vukhongeri njhekanjhekisano lowu wu hela i turk for sure .
830,a very poorly debate,njhekanjhekisano lowu nga riki kahle swinene .
831,our mother of all us well in the debate ignore the arrogant and a dictator as well as the disrespectful _fels let is vote our mother if you love your mother,mana wa hina wa hina hinkwerhu kahle eka njhekanjhekisano hi honisa ku tikukumuxa na mufumi wa tihanyi xikan'we na _fels let is vote our mother if you love your mother .
832,debate guy is good,debate guy u kahle .
833,well i am none of your business too you were the one who on my not respecting mine your debate allow for mine too so stay fluid,kahle kahle a ndzi na un'we wa bindzu ra wena na wena a wu ri wena loyi eka mina not respecting mine your debate allows for mine too so stay fluid .
834,i think the debate which made some sense in what is happening now is the first one those two ladies as they are but the second debate involved a gentle man and a lady about themselves and their,ndzi ehleketa leswaku njhekanjhekisano lowu a wu endla nhlamuselo yo karhi eka leswi humelelaka sweswi i wo sungula vamanana volavo vambirhi tanihi leswi va nga xiswona kambe njhekanjhekisano wa vumbirhi wu katse wanuna wo olova ni wansati hi vona vini ni va vona .
835,the next deputy president won the debate,xandla xa phuresidente loyi a landzelaka u hlule eka njhekanjhekisano .
836,it is important for the survival and prosperous future of our nation that our national idea debate and policy should be driven by thought,i swa nkoka eka ku pona na vumundzuku lebyi humelelaka bya rixaka ra hina leswaku njhekanjhekisano wa hina wa miehleketo ya rixaka na pholisi swi fanele ku fambisiwa hi ku ehleketa .
837,literally me for trial data then me ask yourself if a person is that unsure of their position to debate are they being honest with you,literally me for trial data then mina ti tivutisa ku munhu a nga tiyiseki hi xiyimo xa yena xo debate are they being honest with you
838,boss you know we will that the debate was a low affair with no were there was no take home for the undecided the media entertain mediocrity the people love mediocrity and the politician it wasted,boss wa swi tiva leswaku hi ta swi endla leswaku njhekanjhekisano a wu ri wa le hansi lowu a wu nga ri kona a ku nga ri na ku tekiwa ekaya eka lava nga endlangiki xiboho va mahungu va hungasa mediocrity vanhu va rhanda mediocrity na n'watipolitiki it wasted .
839,politically unproductive but capable of no debate in house probably should consult her psychologist,swi nga ha humelerisiwi hi tlhelo ra tipolitiki kambe swi kota ku pfumala njhekanjhekisano endlwini kumbexana u fanele a ya eka mutivi wa yena wa mianakanyo .
840,there is no presidential debate in our country it is just some sack of old brains that go and sit there on the seat i support though,akuna njhekanjhekisano wa vupresidente etikweni ra hina i saka ntsena ra byongo bya khale lebyi yaka emahlweni byi tshama kwalaho eka xitulu lexi ndzi xi seketelaka though .
841,debate short men prefer tall and tall men prefer short a lot people believe that men and who are of smaller stature prefer men or who are of a bigger stature and vice what is your take on this topic,debate short men prefer tagle and tag tall parege vanhu vo koma va pfumela leswaku vavanuna na lava nga va small stature va tsakela vavanuna kumbe lava nga na stature leyikulu na vice what is your take on this topic .
842,_ he the debate mercilessly,_ yena njhekanjhekisano hi ndlela yo pfumala tintswalo .
843,___ debate with you is like trying to get a guy to move on from his hot ex his crazy about and she you all like crap but cos you are so with her you do not mind,___ debate na wena swi fana na ku ringeta ku endla leswaku jaha ri ya emahlweni eka hot ex ya rona ya yena yo penga na yena hinkwenu mi fana na crap but cos you are so with her you do not mind
844,some people have an issue with my body not my and it nurse she was told her are inappropriate sparking debate,vanhu van'wana va na mhaka na miri wa mina hayi my and it nurse a byeriwe leswaku are inappropriate sparking debate .
845,a debate between someone who de their mind and one who has not and the learned and unlearned very interesting,njhekanjhekisano exikarhi ka munhu loyi a de miehleketo ya vona na loyi a nga endlangiki na lava dyondzekeke na lava nga dyondzekangiki va tsakisa swinene .
846,how yesterday is debate was one of the best debate any would appreciate it was all about and from both,how tolo is debate was one of the best debate any would appreared it was all about and from both .
847,another debate with totally incorrect,mphikizano wun’wana lowu nga ni swilo leswi hoxeke hi ku helela .
848,was your the debate in,was your the debate in .
849,not like the any real to deal with so sure let the governing party debate people s very existence,a swi fani na leswi nga riki swa xiviri ku langutana na swona so sure let the governing party debate vanhu s very vukona .
850,no doubt about curry he the beautiful game of basketball and his name will always be in the history of basketball but i am choosing before him in the goat debate,no doubt about curry he ntlangu wo saseka wa basketball na vito ra yena ri ta tshama ri ri eka matimu ya basketball kambe ndzi hlawula emahlweni ka yena eka njhekanjhekisano wa timbuti .
851,maybe this is the reason the final tory leadership debate was excellent work from,kumbexana lexi i xivangelo xa leswaku njhekanjhekisano wo hetelela wa vurhangeri bya tory a ku ri ntirho wa kahle swinene ku suka eka .
852,the deputy presidential debate between and ruth i have that have been lied so much that even when you present to them a different new and practical ways to boost the economy of our nation they still think it is madness,mphikizano wa vupresidente exikarhi ka na ruth lowu ndzi nga na wona lowu hehliweke ngopfu lerova hambi loko u va nyikela eka vona tindlela letintshwa to hambana na leti tirhaka to tlakusa ikhonomi ya rixaka ra hina va ha ehleketa leswaku i vuhlanya .
853,check out lostsheppard is video wow wow wow rand the vaccine debate in a brilliant and magnificent way,check out lostsheppard is video wow wow wow rand njhekanjhekisano wa murhi wo tshungula hi ndlela yo hlamarisa no hlamarisa
854,_uk quality they t even do a live debate,_uk quality they t even do a live debate .
855,_fatal _of_debate _felinemenace _bobby _s _dr _damn_muteki _clarkej can and do rape,.
856,_fatal _of_debate _felinemenace _bobby _s _dr _damn_muteki _clarkej yes and now you know they will lobby for the law to be they really want to pretend hold the same risk as men and therefore do not need single sex,_fatal _of_debate _felinemenace _bobby _s _dr _damn_muteki _clarkej ina sweswi wa swi tiva leswaku va ta lobby eka nawu ku va va lava ku endla onge hakunene va khoma khombo leri fanaka na ra vavanuna naswona hikwalaho a va lavi rimbewu rin'we
857,the presidential debate should include all the to get the real gist,mphikizano wa phuresidente wu fanele ku katsa hinkwavo ku kuma gist ya xiviri .
858,you chose the part you to listen and watch it is evidence that you did not watch the entire debate,u hlawurile xiphemu lexi u nga ta xi yingisela u xi hlalela i vumbhoni bya leswaku a wu hlalelanga njhekanjhekisano hinkwawo .
859,_am_gathoni there was no debate at least not on the epicly,_am_gathoni a ku ri hava njhekanjhekisano at least not on the epicly .
860,a debate can tell you about a person no matter how much one to keep anonymous you just need to put one controversial topic in people come out through,mphikizano wu nga ku byela hi munhu ku nga khathariseki leswaku u nga tiviwi hi vito ku fikela kwihi u lava ntsena ku veka nhloko-mhaka yin’we leyi kanetanaka eka vanhu va huma hi ku tirhisa .
861,_spike there is some debate about the exact nature of it but divorce in viking society to be by although men could divorce their for adultery just by saying in front of that they were,.
862,how is it possible for her to survive her chronically bad debate she was clearly below a very low par,swi kotekisa ku yini leswaku a pona njhekanjhekisano wa yena wo biha lowu nga heriki a a ri ehansi ka par ya le hansi swinene .
863,i totally agree sir the were totally unable to steer the debate the most important of this election economy health education agriculture governance,ndzi pfumela hi ku helela sir the a va tsandzeka hi ku helela ku kongomisa njhekanjhekisano wa nkoka swinene eka ikhonomi ya nhlawulo lowu wa rihanyo dyondzo ya rihanyo ya vurimi vulawuri .
864,true the debate from politics to personal,i ntiyiso njhekanjhekisano ku suka eka tipolitiki ku ya eka munhu hi xiyexe .
865,oh and don t think you don t have to vote debate blah blah blah,oh and don t think a wu fanelanga ku vhota debate blah blah blah .
866,state capture we need people who these and provide long term to i wish you were with this in the debate,state capture hi lava vanhu lava lava and provide long term to i wish you were na leswi eka debate .
