,src,trg
644,ambition and making progress in life my nose is broken i said that is farewell it _,ambition and making progress in life nomo wa mina wu tshovekile ndzi vule leswaku sweswo swa xeweta _
645,farewell anime north we will see ya in,farewell anime north hi ta vona ya in .
646,did you tell that to other during your farewell speech from the podium,xana u swi byerile sweswo eka van’wana hi nkarhi wa nkulumo ya wena yo wisa ku suka eka xitulu xa le henhla .
647,_english well would not want to miss her brother' s belated wedding i meant farewell party would she,.
648,inviting program and to join us at the family summer celebration free food from branded and school live zoo th grade farewell and more registration for current,nongonoko wo rhamba na ku hi joyina eka ndyangu wa ximumu nkhuvo swakudya swa mahala ku suka eka branded na xikolo live zoo th grade farewell na ku tsarisa ko tala eka sweswi
649,_cois dude not literally take in the context,_cois dude not literally take eka mongo .
650,it ever stopped u from eating i a whole melon yesterday even tho my throat got so itchy and i dont plan on saying my farewell to fruit my throat decided to be a pussy like ur let a fruit control ur life be me,it ever stopped u ku dya i a whole melon tolo even tho my throat got so itchy and a ndzi hleli ku vula ku wisa ka mina ku tswala nkolo wa mina u endle xiboho xo va xitombo ku fana na ur let a fruit control ur life be me
651,farewell to year old and year old who apart from can watch this footage without crying will forever be seven will forever be four may they both rest in peace,farewell to year old and year old lava handle ko kota ku hlalela footage leyi handle ko rila va ta va va nkombo hilaha ku nga heriki va ta va hilaha ku nga heriki va nga va mune may havumbirhi bya vona va wisa hi ku rhula .
652,president and secretary general _ace as they bid their final farewell to rip comrade,presidente na matsalana-jenerala _ace loko va ri karhi va wisa ku wisa ka vona ko hetelela ku rip comrade .
653,for ten i and i finally got to see it i am all up i owe this all to you thank you i that the legendary of test chosen by them to get close i am going to track let is meet again farewell,for ten mina na mina hi hetelele hi fikile ndzi swi vona ndzi all up ndzi kolota leswi hinkwaswo eka n'wina ndzi khensa i leswaku legendary of test leyi hlawuriweke hi vona ku tshinela ndzi ya track let is meet again farewell .
654,will i die before this train is ready,xana ndzi ta fa xitimela lexi xi nga si lungheka .
655,t it crossed off tho,t yi tsemakanye hi tho .
656,it was time to bid farewell to some more of our this evening as they move on to the next stage of their thankfully was on hand to present a couple of gold before they left,a ku ri nkarhi wo wisa eka van’wana va hina madyambu lawa loko va ya emahlweni va ya eka xiteji lexi landzelaka xa vona hi ku khensa a va ri kona ku ta nyikela nsuku wun’we va nga si famba .
657,_craig i m not interested wasting my time on a silly twitter spat with your kind so i bid you farewell and hope your uninformed get you nowhere in life,_craig i m not interested ku tlanga hi nkarhi wa mina eka silly twitter spat na muxaka wa wena so i bid you farewell and hope your uninformed get you nowerheher in life
658,farewell on bbc is final morning after trying to make the best out of a bad show never rated it take on above their station just to appear clever,ku wisa eka bbc i mixo wo hetelela endzhaku ko ringeta ku endla leswinene eka nkombiso wo biha lowu nga si tshamaka wu ringanisiwa wu teka ehenhla ka xitichi xa vona ntsena leswaku wu vonaka wu tlharihile .
659,too stoned for this i bid you farewell,too stoned for leswi ndzi mi biged farewell .
660,after all when you meet form and end up falling in love only to have to say farewell in the end it really,phela loko u hlangana na fomo u hetelela u rhandzana ntsena ku fanele ku xeweta eku heteleleni hakunene swi .
661,my name is shadow i am the world is ultimate life form there is no time for farewell,vito ra mina i shadow i am the world is ultimate life form akuna nkarhi wo wisa .
662,farewell s,ku wisa s .
663,when you are entering it is that will welcome you and when you are leaving will bid you farewell in the end the people of won the not,loko u nghena hi yona leyi nga ta ku amukela naswona loko u huma yi ta ku wisa eku heteleleni vanhu va win the not .
664,like i can not even remember 'farewell',ku fana na loko ndzi nga ha tsundzuki hambi ku ri 'farewell'.
665,a farewell to a great beer drinking a monks' reserve ale by mccoy is beer,ku wisa eka biya leyikulu leyi nwaka monks’ reserve ale hi mccoy i biya .
666,particularly since he is not going until unless it is going to be just one big week farewell party,ngopfu-ngopfu tanihi leswi a nga fambi ku kondza ku nga ri ku va ku ri nkhuvo wun’we ntsena wo wisa wa vhiki lerikulu .
667,alright i m starting a like over hour historical drama about a painter i might become insane if this is the case and it most likely will i wish you all a happy and cheerful farewell,alright i m ​​ku sungula drama ya matimu yo fana na awara mayelana na muvalangi ndzi nga ha penga loko leswi swi ri tano naswona swi nga endleka ngopfu leswaku ndzi ta mi navelela hinkwenu ku wisa loku tsakisaka ni loku tsakisaka
668,i will say farewell to what i can not tell,ndzi ta vula ku xeweta leswi ndzi nga ta ka ndzi nga swi byeli .
669,farewell i shall go into the back of the van if anyone needs me i will be,farewell ndzi ta nghena endzhaku ka veni loko ku ri na munhu loyi a ndzi lavaka ndzi ta va .
670,farewell music in unplugged,vuyimbeleri byo wisa eka unplugged .
671,farewell venus is we hope to see you again soon,farewell venus is hi tshemba ku ku vona nakambe ku nga ri khale
672,i really did love you all and that is not a lie however as sad as it is it is time for a brief oh of mine oh the beautiful days of my youth farewell until we meet again,i really did love you all and that is not a lie however as sad as it it is it is time for a brief oh of mine oh the beautiful days of my youth farewell ku kondza hi hlangana nakambe .
673,queen needs to be fed farewell salad,queen yi lava ku dyisiwa saladi yo wisa .
674,good farewell,ku wisa lokunene .
675,well i was the only person the cashier at the grocery store did not address with a greeting and farewell everyone else it was hello sir ma'am have a good day sir ma'am for me alone she sir ma'am so i guess that is some kind of progress,kahle kahle a ku ri mina ntsena munhu loyi cashier ya le xitolo xa swakudya a nga yi address hi ku xeweta a tlhela a wisa vanhu hinkwavo a ku ri hello sir ma'am have a good day sir ma'am for me alone she sir ma'am so i guess that is muxaka wo karhi wa nhluvuko .
676,just as one t sew the to the of the to stop them from falling i want us to laugh and say let s meet again someday we each other in a wonderful manner so i m sure we can make this a wonderful farewell,as one t sew the to the of the ku va yimisa ku wa ndzi lava hi hleka hi ku let s ku hlangana nakambe siku rinwana hina hi ndlela yo hlamarisa so i m sure hi nga endla leswi swi va farewell yo hlamarisa .
677,anyone else been weird notification with their s ultra old up as new constantly an old song funky,un'wana na un'wana a ri weird notification na s ultra old up ya vona tani hi new constantly an old song funky
678,therefore farewell i see thou me not,hikokwalaho ndzi lehisa mbilu ndzi vona wena hayi .
679,silver las were brilliant throughout the tournament special mention to who the highest scorer award and we bid farewell to a legend of the game thank you for everything,silver las a va ri brilliant eka mphikizano hinkwawo wo hlawuleka wo boxiwa eka who the highest scorer award naswona hi wisa eka ntsheketo wa ntlangu hi khensa hinkwaswo eka hinkwaswo
680,very bold from to bid farewell to his when keep turning away,very bold from ku ya wisa ku ya eka ya yena loko u ya emahlweni u fularhela .
681,farewell ray farewell sissy may we meet again you may be alive but probably never see you again,farewell ray farewell sissy may we meet again u nga ha hanya kambe kumbexana a nga ha tlhelanga .
682,farewell,lelana
683,bid their last farewell to the year old boy,bid the their last farewell eka mufana wa lembe ra old .
684,going to the exhibit today at the museum time to see my,ku ya eka nkombiso namuntlha eka museum nkarhi wo vona ka mina .
685,what about a farewell to great in northern plus six you get san nearby you could even head up to,what about a farewell to great e northern plus six u kuma san ekusuhi na wena u nga ha kongoma e henhla eka .
686,_fa _dkjr_ literally posted his last farewell video on,_fa _dkjr_ hi ku kongoma u veke vhidiyo ya yena yo hetelela yo wisa eka
687,farewell sissy,ku wisa sissy .
688,someone in the said this might be her farewell show and i felt that her speech on the piano saying she never thought she d tour again i felt so bad for her like she clearly needs a break,munhu un'wana eka said this may be her farewell show and ni twa onge mbulavulo wa yena eka piyano a vula leswaku a nga ha ehleketi leswaku u d tour nakambe ni titwe ndzi bihile swinene eka yena onge a swi le rivaleni leswaku u lava break .
689,farewell hello frown,ku wisa hello xirhendzevutana .
690,all the piano music for elysia s chapter don t play god damn they are gorgeous yeah er is definitely getting cause this is farewell music,vuyimbeleri hinkwabyo bya piyano bya elysia s chapter don t play god damn they are gorgeous yeah er is definitely getting cause leyi i vuyimbeleri byo wisa
691,you can not test us because it is proprietary wut,a wu nge hi kambeli hikuva i vulawuri bya vulawuri .
692,farewell my l u v dont touch my radio vol loft heaven days focus zoo up down happy light obsession gloomy girl stella,farewell my l u v dont touch my radio vol loft tilo masiku focus zoo up down happy light obsession gloomy girl stella
693,my heart is an ego rock nonsense at i smash what i am to know and bid farewell to tomorrow,mbilu ya mina i ego rock nonsense eka i smash leswi ndzi nga ku swi tivaka no wisa ku wisa eka mundzuku .
694,bet prob do a day stay next time so i can guarantee i see again on his farewell tour,bet prob do a day stay next time so ndzi nga tiyisisa leswaku ndzi vona nakambe eka riendzo ra yena ro wisa
695,_nces farewell,_nces ku wisa .
696,_lagos may god accept her and forgive her farewell madam nelson action woman her style of made me to like her back then,.
697,a fun week on the running around with lots of dog walking gym cut with some people and said farewell after lots of book and but it s not worth the other that come with it lot of time peace of mind is number,vhiki ro tsakisa eka ku tsutsuma-tsutsuma na timbyana to tala to famba-famba eka gym leti tsemiweke na vanhu van’wana ivi u wisa endzhaku ka buku yo tala naswona kambe a swi ringani na yin’wana leyi taka na yona nkarhi wo tala ku rhula ka mianakanyo i nomboro
698,holding farewell party at grace and country estate this weekend missing in action it s a bit of sun just be sensible media have only it up to sell more doom,ku khoma nkhuvo wo wisa eka grace and country estate mahelo ya vhiki lawa ya lahleka hi ku teka goza it s a bit of sun just be sensible media have it up to sell more doom
699,a horse a horse my kingdom for a horse the finale of s is here thank you to _aya the cast production team and for this piece to life my heart as if saying farewell to the of,a horse a horse my kingdom for a horse the finale of s is here thank you to _aya the cast production team na le
700,the way i was about to add farewell that movie is just so,hi ndlela leyi a ndzi ri kusuhi no engetela farewell leswaku movie is just so .
701,hi it is i am officially leaving and moving to i need some over there my close are welcome farewell,hi it is i am officially leaving and ku rhurhela eka i need some over there my close are welcome farewell .
702,farewell,lelana
703,of farewell at festival at the edge with taffy little and peter,ya ku wisa eka nkhuvo wa le tlhelo na taffy little na peter .
704,to you still beautiful even after death i say my farewell,eka wena wa ha sasekile hambi endzhaku ka rifu ndzi ri farewell ya mina .
705,he surely saw the hunt as a dirge of farewell wishing only that his prey might rest in peace never again to awaken to another harrowing nightmare,hakunene u vone ku hlotiwa tanihi thyaka ra ku wisa a navela ntsena leswaku xiharhi lexi a xi dlayeke xi nga ha wisa hi ku rhula a nga ha tlheli a pfuka a ya eka norho wun’wana lowu khomisaka gome .
706,nope on what i learn are good at on if your match your the interest will remain if not farewell,nope on leswi ndzi swi dyondzaka are good at eka loko match ya wena the interest yi ta tshama loko ku nga ri farewell .
707,when you win the open and still leave yourself enough time to make it to street for the farewell,loko u hlula eka ku pfuleka naswona wa ha ti siya nkarhi lowu eneleke wo fika exitarateni leswaku u ya wisa .
708,just found out how to mute certain farewell copious in my about i don t watch,just found out ndlela yo miyeta certain farewell copious eka about ya mina i don t watch .
709,i would not mind seeing a super bowl on as much as i would kick myself for missing one of my favorite farewell in that stadium and i get two i would have to pick it,a ndzi nga ta va na mhaka na ku vona super bowl eka swo tala ku fana na leswi a ndzi ta ti raha hi ku pfumala xin’wana xa ku wisa loku ndzi ku tsakelaka exitediyamu xexo naswona ndzi kuma timbirhi ndzi ta boheka ku yi hlawula .
710,like pay for what if someone to do a task for you how do you say you pay for that as a farewell if he is pay for it why is he agreeing to do it it is clearly oh i know slap some in there that will give it some flavor never mind what it,like pay for what if munhu wo ku endlela ntirho how do u vula leswaku u hakela sweswo tani hi farewell loko a hakela for it why a pfumela ku swi endla swi le rivaleni oh i know slap some in there that will give it some flavor never mind leswi swi .
711,a fitting farewell to oban from the oban inn oban,ku wisa loku faneleke eka oban ku suka eka oban inn oban .
712,may blair brown t blow of critical cobra to hold self indulgent farewell to network money spinning after they leave office though,may blair brown t blow ya critical cobra ku khoma self indulgent farewell ku network money spinning after va huma ehofisini though
713,anything in last not booking they way they should flair another farewell match at old keeping the fiend bit going after he left turning into a gimmick go brock and at every,anything in last not booking they way they should flair another farewell match at old ku hlayisa fiend bit yi ri karhi yi famba endzhaku ka loko a fambile a hundzuka gimmick go brock and at every .
714,farewell,lelana
715,the latest regarding the scandal for our year end at the halfway point of farewell to the era of an injury update on a former champion this week s edition of,lava va sweswinyana mayelana na manyala ya ku hela ka lembe ra hina eka hafu ya ndlela yo wisa eka nguva ya ku pfuxetiwa ka ku vaviseka eka khale ka nghwazi leyi vhiki leri s nkandziyiso wa .
716,a shame as i say farewell to one of my best days on twitter as it slowly becomes and to himself,tingana loko ndzi ri karhi ndzi xeweta rin’wana ra masiku ya mina lamanene eka twitter tanihi leswi swi yaka swi va kona hakatsongo-tsongo ni le ka yena n’wini .
717,this wage from justice' hand do earn the future to discern and yet farewell o secret of to morrow,muholo lowu evokweni ra justice' do earn the future to discern and yet farewell o secret of to morrow .
718,about no farewell reach for the summit is the best celeste song,about no farewell reach for the summit i risimu ra kahle swinene ra celeste .
719,it was the wedding party was not it just as a farewell party,a ku ri nkhuvo wa mucato a wu nga ri wona ntsena tanihi nkhuvo wo wisa .
720,farewell for now anyway sweet pedro i know you will have lots of great wherever you go,farewell for now anyway sweet pedro ndza swi tiva leswaku u ta va na swilo swo tala leswikulu kun'wana na kun'wana laha u yaka kona
721,a farewell is not just the go and the discordant of moving on there s a lot of bittersweet that remains,ku wisa a hi ku famba ntsena naswona ku nga twanani ku ya emahlweni ku ri na ku nandziha ko tala loku saleke .
722,on the topic of a x maybe one day i will do a escape plan like farewell mona or something,on the topic of a x maybe siku rin'wana ndzi ta endla escape plan ku fana na farewell mona kumbe swin'wana .
723,he in a farewell message,yena eka rungula ro wisa .
724,with all due respect we should a farewell series for instead of just benching or kicking him out respect,hi xichavo hinkwaxo hi fanele hi farewell series for ematshan’weni yo bench ntsena kumbe ku n’wi hlongola xichavo .
725,_ __london in all fairness from my experience it was mostly the that the grown were fine for the most part but you know it is a train farewell there is always bound to be an,_ __london in all fairness from my experience it was mostly the that the grown were fine for the most part but you know it is a train farewell there is always bound to be an
726,resting hilarious and hypocritical will return to and you will not talk to her until you have farewell oh mighty lan,ku wisa hilarious na vukanganyisi swi ta tlhelela eka swona naswona a wu nge vulavuli na yena ku kondza u wisa oh mighty lan .
727,you both shook bid farewell and went your separate ways,havumbirhi bya n'wina mi rhurhumerise bid farewell mi famba hi tindlela ta n'wina to hambana .
728,farewell to our who will continue their softball journey may your next chapter in life bring you the spirit of a red falcon courage of a warrior strength of a bison focus of a falcon curiosity of a shark and nobility of always work hard and be great,farewell to our who will continue their softball rendzo
729,i came across my old stuff from when i was in elementary school i read all their farewell oh my gosh the nostalgia the wow,ndzi fike ndzi hlangana na swilo swa mina swa khale ku sukela loko ndza ha ri exikolweni xa le hansi ndzi hlaya ku wisa ka vona hinkwako oh my gosh the nostalgia the wow .
730,may seem forever farewell is like the end but in my heart is a memory and there you will always be,swi nga ha vonaka swi ri hilaha ku nga heriki swi fana ni makumu kambe embilwini ya mina i xitsundzuxo naswona kwalaho u ta tshama u ri kona .
731,farewell and the lord of the underworld the my device is was you with the devil come,farewell na hosi ya misava ya vafi xitirhisiwa xa mina a ku ri wena na diyavulosi come .
732,study it till eternity it won t change the fact that you your people and they have you farewell,dyondza yi huma eka retenity a swi nge cinci mhaka ya leswaku n'wina vanhu va n'wina na vona va mi sharewell .
733,b s what a glorious run,b s i yini ku tsutsuma loku vangamaka .
734,at hale pun intended to get the line to st so i can make my train home farewell  is you have us well for,at hale pun intended to get the line to st leswaku ndzi ta kota ku endla xitimela xa mina xi tshama ekaya is you have us well for .
735,farewell to the apricot season you have been good to us this year too last part of the harvest those mushy and overripe found their way to for the winter firmer have been as part of the daily fruit intake see you next summer,farewell to the apricot season u vile kahle eka hina lembe leri na kona xiphemu xo hetelela xa ntshovelo lava va mushy na overripe va kumeke ndlela ya vona ku ya eka xixika xi tiya va vile tani hi xiphemu xa daily fruit intake see you ximumu lexi taka
736,_ssb thank you i will be back someday so this is not a permanent farewell i just need to step back for a while and look forward to when i feel like i want to return,_ssb ndza khensa ndzi ta vuya siku rin'wana so leswi a hi ku wisa ka nkarhi hinkwawo ndzi lava ntsena ku tlhelela endzhaku nkarhinyana ndzi langutela loko ndzi twa onge ndzi lava ku vuya .
737,_jay_y _refusenik no not the and industrial military complex read the warning former president said in his farewell address on,.
738,farewell to our ladder as it us well we look forward to you to our new truck very soon,farewell to our ladder as it us kahle hi langutele wena eka lori ya hina leyintshwa ku nga ri khale swinene
739,_english definitely not the wedding celebration though definitely confirmed the farewell party everybody clear,_english definitely not the wedding celebration though definitely confirmed nkhuvo wo wisa everybody clear .
740,_ farewell,_ lelana
741,alright farewell and profuse thanks to you both i shall have to host you at the estate when my sister is next available,alright farewell na profuse thanks to you both i will have to host you at the estate loko sesi wa mina a ri next available .
742,i just to see in las for his final farewell,mina ntsena ku vona e las eka ku wisa ka yena ko hetelela .
743,the met a black haired youth in who is name was after spending a brief time together bid farewell she was still not ready to settle like her father,the met a black haired youth in who is name was a endzhaku ko heta nkarhi wo koma swin'we bid farewell a ha ri ready ku tshamiseka ku fana na tata wa yena
744,it literally in collaboration with the right here at this point you must be a troll farewell,hi ku kongoma hi ku tirhisana na the right here eka nkarhi lowu u fanele ku va troll farewell .
745,also i read farewell a few nights ago and i was just i said he was gay but he is literally in love with barley,nakambe ndzi hlayile farewell vusiku byintsongo lebyi hundzeke naswona a ndzi ri ntsena ndzi te i gay kambe hi ku kongoma u le ku rhandzeni ka barley .
746,funny if someone talk about me but does not know me well farewell then,funny loko munhu a vulavula hi mina kambe a nga ndzi tivi kahle farewell then .
747,a pair of front row bon farewell tour at field plus another band of yours opening up for them or a pair of first row super bowl line made it,a pair of front row bon farewell tour epeals plus band yin’wana ya wena yi va pfulela kumbe pair ya first row super bowl line yi endle leswaku yi va .
748,we will miss you _wlos if you lauren is final farewell during morning is broadcast you can catch that and more great at the link here,hi ta ku tsundzuka _wlos loko u lauren i final farewell hi nkarhi wa mixo i ku haxiwa u nga khoma sweswo and more great eka link laha .
749,love na love farewell,rirhandzu na rirhandzu xirhendzevutani .
750,farewell x,ku wisa x .
751,_kae this moment never to bring sweet melancholy to my heart _ farewell until we meet again,.
752,his boots they had a different tale to tell a story of a bittersweet farewell,mabofu ya yena a va ri na ntsheketo wo hambana ku vula xitori xa ku wisa loku vavaka ku nandziha .
753,to the _ group on yesterday is farewell this is what we should be talking about but instead the talking point to be the of a small minority anyway all the best for the s might be down for some might not,to the _ group on tolo is farewell leswi hi swona leswi hi faneleke ku va hi vulavula hi swona kambe ematshan'wini ya sweswo the talking point to be the of a small minority anyway all the best for the s swi nga ha va ehansi eka van'wana swi nga ha endleka swi nga ri tano
754,this scene just me right on up it is such a simple and powerful wish this and farewell just so hard,xifaniso lexi just me right on up it is such a simple and powerful wish this and farewell just so hard .
755,no wedding feast but did host a 'farewell party' this weekend little coverage in the media wondering why if we find out there was a wedding cake should we assume the outgoing prime once again been by a cake,no wedding feast but did host a 'farewell party' weekend leyi coverage yitsongo eka swihangalasamahungu yi tivutisa leswaku hikokwalaho ka yini loko hi kuma leswaku a ku ri na khekhe ra mucato loko hi fanele hi teka prime leyi humaka nakambe yi tlhele yi va hi khekhe .
756,_ farewell good dog,_ ku wisa mbyana ya kahle .
757,farewell,lelana
758,just the in hungry they need you my ex in the us friend the best farewell me,just the in hungry va lava wena ex ya mina eka us munghana wa kahle the best farewell me
759,john is wonderfully idiosyncratic farewell,john i ku wisa loku hlamarisaka ka idiosyncratic .
760,farewell home run,xihahampfhuka xa le kaya .
761,farewell,lelana
762,farewell,lelana
763,loose women is white farewell to star 'our loss is channel  is gain',vavasati lava ntshunxekeke i ku wisa ka valungu ku ya tlanga 'ku lahlekeriwa ka hina i channel is gain'.
764,tomorrow is farewell party my semester exam my is good at we to do for farewell d hell are we going to do our exam,mundzuku i farewell party my semester exam my is good at we to do for farewell d hell hi ta endla xikambelo xa hina
765,i just to see in las for his final farewell,mina ntsena ku vona e las eka ku wisa ka yena ko hetelela .
766,farewell i lost interest too,farewell na mina ndzi lahlekeriwe hi ntsakelo .
767,_ it me that a who is perfect for the system whose farewell show was a against inter in is not on the club radar,_ it me that a who is perfect for the system leyi nkombiso wa yona wo wisa a wu ri against inter in a yi le ka club radar .
768,he is giving a farewell it s only time,u nyika ku wisa s s only time .
769,have fun at the party yesterday it was the wedding one dressed up as a farewell for our part time care piss taker of a i presume,have fun at the party tolo a ku ri mucato lowu ambariwaka tani hi farewell eka part time care piss taker ya hina ya i presume .
770,canada c th anniversary farewell to plated via _canada,canada c th thing ku wisa ku plated hi ku tirhisa _canada .
