,src,trg
480,who t like a bit of culture and in a pint sized format,who t like a bit of culture naswona hi xivumbeko xa pint size .
481,is whether it is alcohol we should not be or act arrogant towards any other culture as lord our ai not perfect instead pray for as it ai not easy being one spread love not hate people,is whether i byala a hi fanelanga ku va kumbe ku endla ku tikukumuxa eka ndhavuko wun'wana tani hi hosi ai ya hina not perfect instead khongela tani hi leswi ai not easy ku va munhu a hangalaka rirhandzu hayi ku venga vanhu .
482,i hope the subscription t in a culture war sense,ndzi tshemba leswaku xikhokhelo xa t hi ndlela ya ndhavuko wa nyimpi .
483,live stuck by on we are the culture,live stuck by eka hina ndhavuko .
484,y is it that the overwhelming majority of these r or is there something in their culture that cheating people money or is it simply the law of since so many people of these r engaged in business,y is it leswaku vunyingi lebyikulu bya lava r kumbe ku na swin'wana eka ndhavuko wa vona leswi ku kanganyisaka vanhu mali kumbe i nawu ntsena wa ku sukela eka vanhu vo tala va lava r va nghenelerile eka bindzu .
485,that part is true but trek does not endorse in the least the desire for ideological conformity and endorsement of nasty politics that define modern politics cancel culture in trek simply does not exist,xiphemu xexo i ntiyiso kambe trek a yi seketeli nikatsongo ku navela ka ku pfumelelana ka mianakanyo ni ku seketela tipolitiki to nyenyetsa leti hlamuselaka tipolitiki ta manguva lawa ti herisa ndhavuko etrek ntsena a swi kona .
486,i very much look forward to reading this deep dive in to in its own right and for the to other of science policy and culture drug use and,ndzi langutele swinene ku hlaya ku nghena loku loku dzikeke eka ku tiyimela ka yona na ku ya eka yin’wana ya pholisi ya sayense na ku tirhisiwa ka swidzidziharisi hi ndhavuko na .
487,this is what we are trying to do at that continue to make us better and shape our culture,leswi hi leswi hi ringetaka ku swi endla eka sweswo hi ya emahlweni hi endla leswaku hi antswa no vumba ndhavuko wa hina .
488,their research is with who for at least over two i am curious if men would also report a desire to avoid conflict and engaging in emotional labor i e a culture of high conflict can be harmful to everyone,vulavisisi bya vona i bya mani ku tlula vambirhi ndzi lava ku tiva loko vavanuna na vona va nga vika ku navela ku papalata ku lwisana ni ku nghenela ntirho wa mintlhaveko i e a ndhavuko wa ku lwisana lokukulu wu nga va ni khombo eka un’wana ni un’wana .
489,for black self care is not a luxury it is a necessity,for black self care a hi luxury it is a necessity .
490,the culture he was raised in taught him to hate himself he learned his lesson well,ndhavuko lowu a kurisiweke eka wona wu n’wi dyondzisile ku ti venga u dyondze dyondzo ya yena kahle .
491,indeed i have worked for some great before and as both terrific of that but is proving to be quite wonderful and a pinnacle the culture is real fundamental and a source of incredible strength for team,hakunene ndzi tirhile eka swin’wana leswikulu khale naswona tani hi leswi havumbirhi bya swona swi chavisaka swa sweswo kambe ndzi tikomba ndzi ri wo hlamarisa swinene naswona i xiyimo xa le henhla ndhavuko i wa xiviri wa xisekelo naswona i xihlovo xa matimba lama nga tshembisiki eka xipano .
492,worst not for use in make better earth culture,worst not for use in make better earth culture .
493,beer is good for meat and basting but potentially disastrous when used in other ways so if you must pour your beer into something other than your mouth here are four ways to do it effectively,beer yi kahle eka nyama na basting kambe yi nga ha va na khombo loko yi tirhisiwa hi tindlela tin’wana kutani loko u fanele ku chela biya ya wena eka swin’wana handle ka nomu wa wena hi leti tindlela ta mune to endla hi ndlela leyinene .
494,y all always want to tell people about their own culture rest,y hinkwaswo swi tshama swi lava ku byela vanhu hi ta ndhavuko wa vona wo wisa .
495,man spirit is beginning to suffer the fate of hot topic where its being over saturated in other pop culture crap they are selling pastel that are not even spooky i guess this is the cost of getting the spooky push the other merch,man spirit is beginning to suffering the fate of hot topic laha ku va ku ri over saturated eka swin'wana pop culture crap va xavisa pastel leyi nga riki na spooky i guess leyi i cost yo kuma spooky push the merch yin'wana
496,by the same author this is all making sense now,hi mutsari un'we leswi hinkwaswo swi endla nhlamuselo sweswi .
497,_s both of you are right we need to expand access we also don t have the same culture as japan even for those with relatively easy access to medical care often ignore until it s way past due even if they can see a doctor with ease,.
498,our culture,ndhavuko wa hina .
499,don t give to get your local and to start reaching out to new people and them into our world change the culture,don t give to get your local na ku sungula ku fikelela vanhu lavantshwa na vona emisaveni ya hina va cinca ndhavuko .
500,o success with our culture our commitment to customer service and our promote from within philosophy for our latest opening in wa to become our next delivery,o ku humelela hi ndhavuko wa hina ku tinyiketela ka hina eka vukorhokeri bya vaxavi na ku tlakusa ka hina ku suka endzeni ka filosofi eka ku pfuriwa ka hina ka sweswinyana ewa ku va ku rhumeriwa ka hina loku landzelaka
501,x the catalina and beach clearly know how to party see their brash masculine leaning humor and voice perfectly with a beer brand like bud light which also on humor and party culture for their advertising,x the catalina na beach va swi tiva kahle ku endla nkhuvo vona brash masculine leaning humor na rito hi ku hetiseka hi brand ya biya yo fana na bud light leyi na yona eka vuhungasi na ndhavuko wa nkhuvo eka swinavetiso swa vona
502,yeah and i thought when said that they are going on a break that we were included in that break guess not again we our clown and our clown culture army are this clown life is pretty busy,yeah na mina ni hleketa loko va vuriwa ku va ya hi break leswaku hi nghenisiwile eka break yaleyo guess not again we our clown and our clown culture army are this clown life is pretty busy
503,woke culture a  wouldisastrous effect' on comedy daily mail,woke culture a wouldisastous effect' eka comedy daily mail .
504,_chan not those of are specifically for black it s apart of my culture and it s my culture it s not her s and keep saying this yea she a grown that needs to hold herself accountable i m not jealous of her but,.
505,totally disagree with your the damage of secret as attempt to achieve those if that is the standard for fit or sexy most will never achieve it and spend a lifetime chasing the of diet culture,hi ku helela a wu pfumelelani na ku onhaka ka wena ka xihundla tanihi ku ringeta ku fikelela sweswo loko sweswo ku ri mpimanyeto wa ku ringanela kumbe sexy vo tala a va nge pfuki va swi fikelela naswona va heta vutomi hinkwabyo va ri karhi va hlongorisa the of diet culture .
506,please do not give me any advice of how you feel about the look to your and start your versus the united where we had free speech until your cancel culture been trying to take over,ndzi kombela u nga ndzi nyiki switsundzuxo swa ndlela leyi u titwaka ha yona hi ku languteka ka wena ivi u sungula versus ya wena the united laha hi nga va na ntshunxeko wo vulavula ku kondza ndhavuko wa wena wa cancel wu ringeta ku teka ndhawu .
507,i mean we should support baseball more don t think his message was for negativity culture support in a minority league goes a long way,ndzi vula leswaku hi fanele hi seketela baseball ngopfu a ndzi ehleketi leswaku rungula ra yena a ri ri ra nseketelo wa ndhavuko wa negativity eka ligi ya switsongo yi famba ndlela yo leha .
508,_pop there s a good argument that was a high capacity leader i d say that of the culture of the is to become high capacity then it s wrong some of ministry do require high capacity people but they need rest and plenty of it,.
509,daily citizen symphony orchestra you to swipe right on its th season,daily citizen symphony orchestra wena ku swipa right on its th season
510,no every culture is beautiful bragging about your genetic diversity is a very weird flex brag about their and not innate especially those that are untrue,no every culture is beautiful bragging about your genetic diversity is a very weird flex brag about their and not innate ngopfu ngopfu lava va nga riki ntiyiso .
511,your organization was perfectly designed to produce the it s want change be intentional about new and don t ignore culture,nhlangano wa wena a wu endleriwe hi ku hetiseka ku humesa it s want change be intentional about new and don t ignore culture .
512,sir then apply the same culture that applied for _adani,sir u tlhela a tirhisa ndhavuko lowu fanaka lowu endleke xikombelo xa _adani .
513,body positive culture is to blame here,ndhavuko wa miri lowunene i ku sola laha .
514,the question is there space for a unified founding media alliance to wage shock and awe warfare in our culture you have how to expand in lieu of con daily wire and faith,xivutiso iku kuna ndzhawu ya unified founding media alliance ku va na ku chava na ku chava nyimpi eka ndhavuko wa hina u na ndlela yo ndlandlamuxa ematshan’wini ya con daily wire and faith .
515,a bit of culture on st with _ touring shakespeare is the tempest,a bit of culture on st na _ shakespeare yo famba-famba i xidzedze .
516,he literally spread awareness about poor education and a donation to those people their beautiful culture and he even bought a for a disabled person did you actually watch the video,hi ku kongoma u hangalase vutivi mayelana na dyondzo yo biha na munyikelo eka vanhu volavo ndhavuko wa vona wo saseka naswona u xavele hambi ku ri a for a disabled person did you actually watch the video .
517,they want hive not independent you my friend are a threat to date every group is a victim of cancel culture i hope people see this unity at the ground level is their biggest fear,va lava hive not independent you my friend are threat to date ntlawa wun'wana na wun'wana i muhlaseriwa wa cancel culture ndzi tshemba leswaku vanhu va vona vun'we lebyi eka xiyimo xa le hansi i ku chava ka vona lokukulu
518,_daniel the too many beloved of culture are always seen as low risk but i am not sure mood and people are less willing to forgive bad,.
519,i will grant that fascism are in the shape of their reactionary the skepticism of modernity as a deep threat the of the better culture of a poorly past with the odd futurism threaded into the reaction but,ndzi ta nyika leswaku vufasisi byi le ka xivumbeko xa ku hlamula ka vona ku kanakana ka vumunhu bya manguva lawa tanihi nxungeto lowu dzikeke the of the better culture of a poorly past with the odd futurism threaded into the reaction but .
520,_mic_smith fiasco no border control increasing crime inflation retirement funds cancel culture in education a weak and mentally president losing world and us support,_mic_smith fiasco ku hava vulawuri bya mindzilakano ku engetela vugevenga inflexini ya ku huma penceni yi herisa ndhavuko eka dyondzo a weak and mentally president losing world and us support
521,disgusting dirty old men getting away with that what a sick culture,vakhalabye lava thyakeke lava nyenyetsaka va balekela sweswo i ndhavuko wa vuvabyi .
522,hopefully they do not start making then what are we going to take another since columbine stop spinning your political and address the elephant in the room culture narcissistic psychopath that just so happen to use,hi tshemba leswaku a va sunguli ku endla then hi ta teka yin'wana ku sukela loko columbine yi tshika ku rhendzeleka ka tipolotiki ta wena yi vulavula na ndlopfu eka kamara ra kamara narcissistic psychopath leyi ntsena yi humelelaka ku yi tirhisa .
523,yep any character that in that parade is considered to be successful show or a pop culture icon,yep ximunhuhatwa xin'wana na xin'wana lexi eka parade yoleyo xi tekiwaka xi ri show leyi humelelaka kumbe pop culture icon .
524,i had the opportunity to explore the left is denial of common sense and accepted wisdom of our culture,ndzi vile na nkarhi wo lavisisa left i ku ala ku twisisa loku tolovelekeke na vutlhari lebyi amukeriweke bya ndhavuko wa hina .
525,that so if or dig into into their lineage and find themselves to have or whatever native blood it t mean they start the culture or deeply who they are and honestly it won t make them not white,leswaku so if or dig into into their lineage va tikuma va ri na or whatever native blood it t mean they start the culture or deeply who they are and honestly it won make them not white .
526,content and pop culture where just an easy to sell excuse for being a prick,content and pop culture laha ku nga na xivangelo xo olova xo xavisa ntsena xa ku va xirilo xa prick .
527,like obviously its understandable if you arent interested in it a huge part of poly history to do with culture in some but if someone a d dating lum ne its only marked off as her dating one of them this is just an example,like obviously its understandable if you arent interested in it a huge part of poly history to do with culture in some but loko munhu a d dating lum ne its only marked off as her dating one of them this is just an example .
528,it like her complaint is that verbal consent can be reduced to a ritual yes instead of an actual choice which could be a valid criticism of how rape culture to the times but it more like she does in fact want to date mind,swi fana na xivilelo xa yena hi leswaku mpfumelelo wa nomu wu nga hungutiwa wu va nkhuvo ina ematshan’wini ya ku hlawula ka xiviri loku nga vaka ku sola loku twalaka ka ndlela leyi ndhavuko wa ku pfinyiwa eka minkarhi kambe swi fanaka ngopfu na leswi a swi endlaka entiyisweni a lava ku jola na miehleketo .
529,not many people are educated on being by why is that when there is a poly ship many people disregard it and say it is not the ship of x together but only validate one side i am so sick n tired to see my culture get over as if it is not good enough,a hi vanhu vo tala lava dyondzisiweke hi ku va hi ku endla yini hi leswaku loko ku ri ni xikepe xa poly vanhu vo tala va xi honisa ni ku vula leswaku a hi xikepe xa x swin’we kambe va tiyisisa ntsena tlhelo rin’we ndzi vabya ngopfu n ti karhele ku vona ndhavuko wa mina wu hundza onge hi loko . a swi kahle ngopfu .
530,becoming an licensee partner program the opportunity to build a business shape culture and invest in a better future,ku va nongonoko wa mutirhisani wa layisense nkarhi wo aka ndhavuko wa xivumbeko xa bindzu na ku vekisa eka vumundzuku byo antswa .
531,of what is really about because a lot of it is and how do i cope with being a person in a world that is very antagonistic to people how do i use my heritage and culture in a way to advance my star trek,ya leswi swi vulavulaka hi swona hakunene hikuva swo tala swa swona i naswona ndzi langutana njhani na ku va munhu emisaveni leyi lwisanaka swinene na vanhu ndzi yi tirhisa njhani ndzhaka ya mina na ndhavuko hi ndlela yo yisa emahlweni star trek ya mina .
532,is the next josh he s stay in that closet til the day his die it s just his culture sad but true,is the next josh he stay in that closet til siku ra yena it s just his culture sad but true .
533,i am literally begging you to shut up and stop with the is an you cannot separate our religion and culture without ending is you are a world where supreme go you hateful monster,i am literally begging you ku miyela u yima na the is an a wu nge swi koti ku hambanisa vukhongeri na ndhavuko wa hina handle ko hela hi leswaku u misava leyi supreme go wena hateful monster .
534,you their religious crusade also the commonly used term culture war is used to hide the crusade it really is fundamentalist say it out loud but can t and instead use culture war to disguise the religious intent,wena crusade ya vona ya vukhongeri na yona rito ra ndhavuko leri tirhisiwaka ngopfu nyimpi yi tirhisiwa ku fihla nyimpi ya nxandzuko hakunene i ya xisekelo yi vula hi rito leri tlakukeke kambe yi nga t and instead use culture war ku fihla xikongomelo xa vukhongeri .
535,_dee it s a straw man argument to act as if what he is saying is a lie or even directed exclusively toward the of the few people in the thread not a commentary on how the general culture to,.
536,i also remember that cross culture love story,ndzi tlhela ndzi tsundzuka xitori xexo xa rirhandzu xa cross culture .
537,it s the culture,i ndhavuko .
538,yes they are with cancel culture twitter people can lose their by such openly,yes va na cancel culture vanhu va twitter va nga lahlekeriwa hi vona hi ku vulavula hi ndlela yo tano .
539,frozen for ten it is fantastic fantastic why the border here between culture of myth and culture of science,frozen for ten it is fantastic fantastic why ndzilakano laha exikarhi ka ndhavuko wa ntsheketo na ndhavuko wa sayense .
540,_culture the man of steel sequel would be more interesting than ben the batman movie,_culture man of steel sequel a yi ta tsakisa ku tlula ben the batman movie .
541,_fromoz _statesx _lib _lorean _pilled _magoo once again these is a problem because talking point this way and therefore that fact you just said does not count because the culture war and the and,.
542,sorry to mention that i have and who hate their culture,sorry ku vula leswaku ndzi na swona na lava vengaka ndhavuko wa vona .
543,pete is a man of culture,pete i munhu wa ndhavuko .
544,maturity comes from family culture success and life experience she to believe she s the cartoon character she s for herself like a really believing they are batman,ku kula swi huma eka ku humelela ka ndhavuko wa ndyangu na ntokoto wa vutomi yena ku pfumela leswaku i ximunhuhatwa xa khathuni lexi a xi tiendlaka ku fana na ku pfumela hakunene leswaku i batman .
545,the painful about motherhood exposed via _culture and have always been ''racist countries'' both have people for ''hundreds of years'',leswi vavaka hi vumanana swi paluxiwile hi ku tirhisa _ndhavuko naswona swi tshama swi ri ''matiko ya rixaka'' hivumbirhi bya swona swi na vanhu ku ringana ''madzana ya malembe''.
546,bay are for rent so i took the plunge,bay are for rent so ndzi teke plunge .
547,camera phone culture out everything on earth,camera phone culture out hinkwaswo emisaveni .
548,every single woman i know been at or by men at some point or more in her life every single woman stop telling that it s bigotry to want their single sex that is the definition of rape culture,wansati un'wana na un'wana loyi a nga tekiwangiki loyi ndzi n'wi tivaka kumbe hi vavanuna eka nkarhi wo karhi kumbe ku tlula evuton'wini bya yena wansati un'wana na un'wana a tshika ku byela leswaku it s bigotry to want their single sex that is the definition of rape culture
549,from with my and watching them get upset at how their culture and race is i learned that all it would take to make people feel included is to research and learn because ignorance on the matter just people,ku suka eka mina ni ku va hlalela va hlundzukisiwa hi ndlela leyi ndhavuko ni rixaka ra vona swi nga xiswona ndzi dyondze leswaku hinkwaswo leswi swi nga ta swi teka ku endla leswaku vanhu va titwa va katsiwa i ku endla ndzavisiso ni ku dyondza hikuva ku pfumala vutivi emhakeni leyi ntsena vanhu
550,you have seen mad recent behaviour have not you extraordinary from the culture secretary even embarrassed and that is saying something,u vonile mad recent behavior a hi wena extraordinary kusuka eka culture secretary hambi kuri ku khomiwa hi tingana and sweswo swi vula swokarhi .
551,yeah it was one of my culture coming here i guess that rule t apply of course not everyone does it though,yeah it was one of my culture coming here i guess rule t apply of course a hi vanhu hinkwavo va swi endlaka though though .
552,na that hustle culture getting no sleep is,na leswaku hustle culture ku pfumala vurhongo i .
553,son of son of son of be as always because you are from the land of truth love beauty freedom tolerance respect wisdom believe culture courage happy birth day wish you all the best keep your fight,n'wana wa n'wana wa n'wana wa be as always because u huma etikweni ra ntiyiso rirhandzu ku saseka ntshunxeko ku tiyisela xichavo vutlhari believe ndhavuko xivindzi happy birth day wish you all the best keep your fight
554,monochrome v the final mix in the series out now and as always a free sample pack for the culture you can peep the mix here,monochrome v the final mix eka series out sweswi na tani hi minkarhi hinkwayo i free sample pack ya culture u nga peep mix laha .
555,i am beginning to hate them too i am also in awe of a culture of people that i did not previously know,ndzi sungula ku va venga na mina na mina ndzi le ku hlamaleni ka ndhavuko wa vanhu lava a ndzi nga va tivi khale .
556,either or is fine with me i just see something different learn about the culture try some new food visit some,either or or is fine na mina ndzi vona ntsena swin'wana swo hambana dyondza hi ndhavuko ringeta swin'wana swakudya leswintshwa endzela van'wana .
557,_guo on the other side it s also insane how much better a team will perform once you rid them of the talented bad culture fit i never met a person who this particular trigger or felt like they did it soon enough,.
558,_co content about the beauty of imperfect social media written by with an extra special s o to for on of culture,_co content mayelana na ku saseka ka swihangalasamahungu swa le ka social media leswi nga hetisekangiki leswi tsariweke hi na s o yo hlawuleka yo engetela eka for on of culture .
559,are lazy so let s import the third world and accept people who will accept a lower standard of living declined society and completely degrade the culture at the same time,are lazy so let s import the third world and accept vanhu lava nga ta amukela xiyimo xa le hansi xa vutomi va arile vaaki na ku onha ndhavuko hi ku helela hi nkarhi wun'we .
560,is not there a simpler answer tech too much choice which all of not just but no common no feeling of a culture ever closer to pure atomization,xana a ku na nhlamulo yo olova tech too much choice which all of just but no common not feeling of a culture ever closer to pure atomization .
561,in a beautiful new book artist and designer a celebration of around the world that bring s people together,eka buku leyintshwa yo saseka ya mutshila na muendli wa swifaniso ku tlangela emisaveni hinkwayo loku hlanganisaka vanhu va s .
562,that s how this culture we t to say anything without someone telling us to shut up those people you rule you are hilarious and awesome,that s how this culture we t to say anything handle ka munhu a hi byela ku mi pfala vanhu volavo mi fuma mi va hilarious and awesome
563,people who are not interested in china really should not force themselves to come foreign who truly love culture and respect people are welcome here even if china is not your final home your experience here will be a wonderful chapter in your life,vanhu lava nga tsakeriki china hakunene a va fanelanga ku ti sindzisa ku ta va ri va matiko mambe lava hakunene va tsakelaka ndhavuko na ku xixima vanhu va amukelekile laha hambi loko china ri nga ri kaya ra wena ro hetelela ntokoto wa wena laha wu ta va ndzima yo hlamarisa evuton’wini bya wena
564,what a dynamic personality she is ma'am for your new song 'aks e khushbu'' video coming soon with musical chit chat,i vumunhu bya dynamic lebyi a nga ku ma'am eka risimu ra wena lerintshwa ra 'aks e khushbu'' video leyi taka ku nga ri khale na musical chit chat
565,him if he no but yeah if that s what you want to do fine is the correct answer on a lot of the hot button culture war and we would all be a lot happier if we their salience,yena if he no but yeah if that s leswi u lavaka ku swi endla kahle i nhlamulo leyinene eka ngopfu hot button culture war naswona hinkwerhu hi ta va hi tsakile swinene loko hi ri salience ya vona
566,the secret service is looking pretty sleazy today told to preserve and then them instead wow this culture of arrogance and apparent immunity from any accountability for despicable behavior is unacceptable,vukorhokeri bya xihundla byi languteka byi ri kahle swinene namuntlha byi byeriwe ku hlayisa ivi endzhaku ka sweswo va wow ndhavuko lowu wa ku tikukumuxa ni ku vonaka ku sirheleleka eka vutihlamuleri byihi na byihi bya mahanyelo lama nyenyetsaka a swi amukeleki .
567,_dee he made a comment toward the culture the general public who participate in this man mostly likely largely the same culture t constantly condemn another celebrity w a more recent terrible sketchy history,.
568,a culture of doing improvement with those you serve is important whether this part how two in improvement with to increase belonging and connection in large stem gateway,ndhavuko wo endla ku antswisiwa na lava u va tirhelaka i wa nkoka loko xiphemu lexi xa ndlela leyi vambirhi va antswisaka ha yona ku engetela ku va xiphemu na ku hlanganisiwa eka nyangwa lowukulu wa nsinya .
569,culture racist woman,ndhavuko wansati wa xihlawuhlawu .
570,girl culture as well i hate it they be so quick to call you out and tell you big around the back or built like a refrigerator,girl culture as well i hate it va hatlisa swinene ku ku vitana va huma va ku byela big around the back or built like a refrigerator
571,despite its small size had a large influence on s contemporary art scene since opening a permanent location in san in,hambi leswi yi nga na vukulu byintsongo a yi ri na nkucetelo lowukulu eka s contemporary art scene ku sukela loko yi pfule ndhawu ya nkarhi hinkwawo esan hi .
572,the best death in theater and more,rifu lerinene ngopfu eka theatre na swin'wana .
