,src,trg
1500,i will give you a blow by blow account of my wicket haul for the league team against river is which included that second pitch which was known as,ndiza kukunika i-akhawunti yokubetha ye-wicket yam ye-wicket kwiqela leligi ngokuchasene nomlambo iquka i-pitch yesibini eyaziwa ngokuba yi
1501,the back tomorrow us booked next week and the sun is out the again tomorrow best pitch in the country as always and life is good up the well,umqolo ngomso ubhukelwe kwiveki ezayo kwaye ilanga liphelile kwakhona ngomso
1502,perfect storm know physical movement belief so they pitch small to shift thinking over time non self select as a draw the ire of the deflect blame ask for money and do nothing,isaqhwithi esifanelekileyo sazi inkolelo yomzimba ukukholelwa ukuba i-pitch encinci ukuba incinci ukuba itshintshe ngaphezulu kwexesha lokuzibeka njengendawo yokugcina imali kwaye ingenzi nto
1503,you the pitch to get a pic with only to end up getting no and a lifetime ban from,wena i-pitch ukuze ufumane i-pickess ngokuphela ukuphela ungafumani kwaye uvaliwe
1504,the national grid for the th time in year thereby throwing the entire nation into pitch darkness once again can you tell me one thing that have not in this regime we all brought this avoidable calamity upon ourselves and we shall all enjoy it,igridi yesizwe kangangexesha elithile enyakeni ke iphosa ilizwe lonke ukuba libe nobumnyama obambeleyo kule meko singenayo kule meko yethu size siyinandiphe le ntlekele kuthi kwaye sonke siya konwaba
1505,that was great bowling from on a good pitch this one is against a pretty decent attack in their fortress on one of the worst for a th chase such are rare so just because could not do it against this time does not mean they can never do it,le yayiyingcwaba elihle ukusuka kwi-pitch elungileyo le ichasene nohlaselo oluhle kakhulu kwinqaba yesona sibambiso sesona sitshutshiso sinqabile ngenxa yeli xesha ngenxa yokuba ungaze uyenze
1506,all the best _toffolo you t have given to this club on and off the pitch and you deserve a shot at the,zonke ezona zibalaseleyo _toffoloup yakho uyinike le klabhu kwaye icinywe kwi-pitch kwaye ufanele ukudubula kwi
1507,hey apply for at of s fast pitch competition include global and ongoing exposure corporate and live feedback from learn more and apply by,heee ufaka isicelo sokhuphiswano olukhawulezileyo olukhawulezileyo lubandakanya ukuvezwa kwehlabathi kunye nengxelo eqhubekayo kunye nengxelo yokufunda ukusuka ngokufunda ngakumbi kwaye isebenze nge
1508,_direct and you are forgetting still just like he did in civil war he a higher pitch when he is peter and always l,_direct kwaye uyalibala nje njengoko wenzayo kwimfazwe yamakhaya wafaka idreyini ephezulu xa ungupeter kwaye uhlala e
1509,i went with to at the end of june my st trip his th he does annual performance i on an archaeology dig touring the manor its grounds visiting and a pitch meeting but the food chef kiss,ndaye ndahamba ndaya ekupheleni kukajuni uhambo lwam lwe-st usebenzisa imisebenzi ye-archeology ye-archeology imba amandla amabala atyelelekileyo kunye nentlanganiso ye-pitch kodwa i-chef ye-chef kodwa i-chef chef
1510,was as a franchise based business model in which could pitch their capital to get into contract based under the governing authority of let is talk about now in ipl is brand value stood at billion and,yayinjengemodeli yeshishini elisekwe kwi-franchise apho unokuphanga imali yabo ukuba angene kwimvumelwano esekwe phantsi kwegunya lolawulo lokuvumela ukuba i-ipp ixabisekile kwaye
1511,gantry pitch flood perpetrator its undo do nest moon tentacle stony in the air,i-gantry pitch fieneyike umestrate ye-hureso ye-hound yentloko yentloko ye-hothy ye-hush mothy emoyeni
1512,end of in to pitch for,ukuphela kwe-pitch ye
1513,at this point  is that the tour is would count for something cause anything is better than pure pitch black silence,okwangoku kukhenketho luya kubala into ebangela nantoni na engcono kune-pitch emsulwa emsulwa
1514,_jordan who the militia what are they suppose to use if they do not have quick grab your pitch,_jordn ngubani na ukuba basebenzise ntoni ukuba basebenzise ntoni ukuba abanayo ngokukhawuleza i-pitch yakho
1515,high is the easiest pitch to hit out did you watch the derby those the ball up the entire time,iphezulu yeyona pitch ilula ukubetha ngaphandle kokuba ubukele ibhola iphele ixesha lonke
1516,_a there is your pitch give her a go she even,_a kukho i-pitch yakho yamnika ihashe
1517,world cup a million investment to the winner of the global pitch competition from a firm that in and,indebe yehlabathi yesigidi kwisigidi sotyalo-mali kwi-winner yokhuphiswano lwesttch yehlabathi kwi-fifeble
1518,with the lack of pitch not hearing back unless you follow up two or three why is simultaneously pitching still considered so bad you and your story time,ngokunqongophala kokuthambisa ngaphandle kokuba ulandele ezimbini okanye ezintathu ukuba kutheni ngaxeshanye zithathwa njengezithambile kakhulu kuwe nakwibali lakho lebali
1519,i wish you could pitch to the out of everything i seen that s not a trade this is the most realistic and could actually happen,ndinqwenela ukuba ungayithambisa i-pitch uye kuyo yonke into endiyibonileyo ukuba ayisebenzi le yeyona nto inokwenzeka kwaye inokwenzeka
1520,_mufc if half the heart that bailey does on pitch no one would have any with,_mufc ukuba i-haile yentliziyo i-bailey isebenza kwi-pitch akukho mntu unokuba nayo
1521,hillsdale is right wing president larry once said you do not have to be an expert to educate a child because basically anybody can do it good that school are seeing through this pitch,i-hilldale ingumongameli ofanelekileyo ularry ukhe wathi akufuneki ukuba ube yingcali yokufundisa umntwana kuba wonke umntu unokukwenza okuhle ukuba isikolo sibona le pitch
1522,_tonge aggression of which there was plenty on the pitch but never an issue off it,i-_ntonge i-asresion yayo apho kukho into eninzi kwi-pitch kodwa engapheli
1523,my thermostat is i am we can all pitch in to make sure everyone today,i-thermostat yam ndiyinto yonke endinokuhlala kuyo ukuze ndiqiniseke ukuba wonke umntu namhlanje
1524,_toffolo sad to see you go especially for everything you did off the pitch least of all the support you gave to leading up to his passing all the best with the rest of your career,i-_toffolo ibangelwa kukubona uhamba ngakumbi yonke into oyenzileyo i-pitch ubuncinci kuyo yonke inkxaso oyinikezileyo ukuba iphumelele konke konke okusemandleni akho ngayo
1525,that can be said for every player on the pitch one of the biggest was change of tactics to sit back and taking off rice you would have known that if you understood football,oko kunokuthethwa ukuba wonke umdlali kwi-pitch enye yeyona ndlela inkulu yayikukutshintsha kwamaqhinga okuhlala emva nokuthatha irayisi ngewayile
1526,probably just a pitch to calm the uva,mhlawumbi i-pitch nje yokuzola i-uva
1527,even the light in a pitch black room is going to be if i m paying to see a movie i don t want people it if it s really important leave the theater to deal with whatever and come back when you re done,nokuba ukukhanya kwigumbi lomnyama epitch kuya kubakho ukuba ihlawula i-movie andifuni ukuba kubaluleke kakhulu kwithiyetha ukujongana nayo nayiphi na into owenzileyo
1528,dream prediction fantasy cricket pitch report and injury for match of cricket league,uqikelelo lwephupha le-fickosy cetch picket ye-picket ye-picket kunye nokulimala kumdlalo we-qaciji
1529,pitch invasion for,ukuhlasela i-piit
1530,pitch off of an immaculate inning,ukuthambisa kwi-intshi ye-intshi
1531,is coming to the el we re with and the bridge accelerator for a public event come watch our pitch their,iza kwi-el sir sir kunye ne-bridge i-acviletor yomnyhadala kawonke-wonke siyibukele i-pitch yethu
1532,mode c so if you are blind you can not actually see what is going on consider these funky a teaser this interesting ping system stereo pitch to display of interest turn audio on,imowudi c ke ukuba awukhosi na ongaboniyo awunakuyibona into eyenzekayo ukuba ithathele ingqalelo le fucky i-tem stereo le nkqubo ye-ping stereo yokubonisa inzala i-audio enomdla
1533,from to the professional pitch is to support and those who play the beautiful game today one year to go until the s world cup who s excited,ukusuka kwi-pitch yobungcali kukuxhasa kwaye abo badlala umdlalo omuhle namhlanje unyaka ukuya kwindebe yehlabathi yehlabathi evuya
1534,pitch at bat triple crown southeast,i-pitch kwisithsaba esiphuthi mpuma mpuma
1535,tony dropping some,i-tony ilahla abanye
1536,nice touch by to have throw out the first pitch last night,ukuchukumisa okuhle kakhulu ukuba ikhuphe i-pitch yokuqala iphela ebusuku
1537,_ hopefully he does stays and that he is still a big influence on the pitch,_ ngethemba ukuba uyahlala kwaye useyimpembelelo enkulu kwi-pitch
1538,with not one of the first to pitch i m guessing they anticipate a deal coming in the next few days,ngaphandle kwenye yokuqala yokuphelisa ndiqikelela ukuba balindele ukuba bacinge ngesivumelwano esizayo ngeentsuku ezimbalwa ezizayo
1539,_gerson since we havent seen or pitch in a while what do you expect from them,_gorni ukusukela esikhe sabona okanye sibambe i-pitch okwethutyana ulindele ntoni kubo
1540,to be honest is creative and his on the pitch just different speed but need more creative one trick pony,ukuthembeka kuyila kwaye kukwi-pitch ngesantya esahlukileyo kodwa sifuna ngakumbi ukudala i-qwa yeqhinga elinye
1541,would love to see you on the pitch for us for many more,ndingathanda ukukubona kwi-pitch kuthi ezininzi
1542,wearing pitch did u even see the game,ndinxibe i-pitch uye wabona umdlalo
1543,gave s and t let pitch in the i will remember this,wazisa i-pitch apha
1544,we will take jordan walker and that pic of throwing out the first pitch that is hanging up in the station hallway,siza kuthatha ijordani iwadker kwaye ifoto yokuphosa i-pitch yokuqala exhonywe kwiholo yesitishi
1545,ready to get brilliant zoom into my pitch starting mon from,ilungele ukufumana i-boom enkulu kwi-pitch yam iqala nge-mon evela
1546,with so many the same you need to stand out with your lead generation learning how to build with and drive a conversation before a pitch and help increase your lead generation,uninzi ke olufanayo kufuneka luvele kunye nesizukulwana sakho sifunda indlela yokwakha kunye nokuqhuba incoko ngaphambi kwesandi kunye nokunceda ukwandisa isizukulwana sakho
1547,did not he just pitch four where did that good one come from,khange akhuphe nje amane apho avela khona
1548,off the pitch definitely he out the minute that whistle,ngaphandle kwe-pitch ngokuqinisekileyo uphuthaze umzuzu ukuba impempe
1549,this all like a effort by team to delay return as long as possible ideally he a handful of good to maximize contract value it s not likely he can pitch in before breaking down again and t want to enter free agency injured,zonke ezi zinto zifana neqela lokulibazisa ukubuya kangangoko kunokwenzeka ukuba unomdla wokukhupha ixabiso lokuphinda uchithe i-arhente yasimahla yenzakalisiwe
1550,i better not see anywhere near the pitch or the bench tonight world tour or bust,kungcono ndibone naphi na kufutshane ne-pitch okanye ibhentshi yokubanjwa
1551,yep so random big fan and dreamt that riley got hit by a pitch in the all star game last night went after the pitcher a manager and start whooping some ass so real though,yep ke i-fan engaqhelekanga kwaye iphupha ukuba i-riley ifikile yi-pitch kuwo wonke umdlalo wenkanyezi izolo ebusuku yaya emva kwe-bitcher kwaye iqale i-ass i-assion yeyokwenyani nangona kunjalo
1552,i hate python i have been for some time now also python was my first language when i start development but to be honest i hate python its slow and it me focus,ndiyithiyile ipython bendikho ixesha elithile ngoku ipython yayilulwimi lwam lokuqala xa ndiqala ukukhula kodwa ndithembekile ndilithiyile i-python
1553,play i will use u in different u may like to try on the pitch,dlala ndiza kukusebenzisa ngokwahlukileyo ungathanda ukuzama kwi-pitch
1554,from to to we got a full day of from amazing from and don t miss out join us on sign up to pitch or your for the event and,ukusukela ukuya kuthi ga ngoku sinemihla egqwesileyo evela kwaye ungaphoswa ngu-thif tay osijoyine ukuze usayine kwi-pitch okanye kumsitho wakho kwaye
1555,this me so the walk the tunnel towards the end of it and the go off on the pitch and it your blood rushing,lo mhlambi uhamba usiya esiphelweni sayo kunye nokuya kwi-pitch kwaye igazi lakho lixakekile
1556,maya thank you for choosing our club looking forward to you on the pitch excited to see the difference you can make looking good in red,maya enkosi ngokukhetha iklabhu yethu ijonge kuwe kwi-pitch ivuyisekile ukubona umahluko onokwenza ukuba ujongeke kakuhle
1557,on this pitch back into his load the back and this ball up bouncing it over the fence off the warning track for a ground rule double _uncommitted,ngale pitch ibuyele kumthwalo wakhe emva kwaye lebhola inyuke ngaphezulu kocingo lokucima umkhondo wesilumkiso kumgaqo ophindwe kabini _umitshi
1558,it will take forever to see a striker like he had everything a force on the pitch who die for and a gud man off the pitch he is the reason i said i will forever support football club i used to write my t his name n number king,iya kuthatha ngonaphakade ukuze ibone ukubetha ngokungathi wayenayo yonke into enesitayile esifa kunye ne-gud indoda kwi-pitch esisizathu sokuba ndikwazi ukubhala igama lam
1559,the pitch was a high heater that almost no one could hit for a homer,i-pitch yayiyi-heater ephezulu ethe phantse akukho mntu unokufumana i-homer
1560,you dragged this conversation away from the original point the point is if t pitch at all this year he will likely opt in t matter what he said previously or whether you think it was smart for him to say it,ukhuphele le ngxoxo
1561,competitive side coming in from how many full pitch are we going to get from this season i wonder,icala lokukhuphisana lingena malunga ne-pitch engapheliyo esiya kuthi siphume kweli xesha lonyaka ndiyabuza
1562,next year is home run derby should be the derby have come in pitch i see baseball bats flung into the,unyaka olandelayo lixesha lokuba i-derby kufuneka ibe yi-derby ifikile i-pitby ndibona ama-baseball amalulwane abhabha kwi
1563,we would be better moving on with the at his disposal in and looking at other in other of the pitch,singahamba ngcono siye kwi-intanethi kwaye sijonge enye kwenye indawo yesandi
1564,will never forgive my little brother for moaning about a headache he t have and missing the pitch invasion,soze ndixolele umntakwethu omncinci ukuba agungxule malunga nentloko ebuhlungu uza nayo kwaye elahle ihlaselo lwe-pitch
1565,footy themselves at the top of the pitch not,i-footy ngokwazo phezulu kwi-pitch hayi
1566,the pain is the pitch your should help your target audience or find a solution to their issue,intlungu yipitch yakho kufuneka incede abaphulaphuli bakho ekujolise kulo okanye bafumane isisombululo kumcimbi wabo
1567,his pitch control is next level,ulawulo lwe-pitch liyinqanaba elilandelayo
1568,randy tall thin once hit a bird with a pitch mullet baseball good player very tall,i-randy ide inqabile yabetha intaka nge-baset ye-baset ye-baseball entle yomdlali omde kakhulu
1569,the last thing i saw of the before falling asleep in front of the was jeff getting hit by a pitch d,into yokugqibela endiyibonileyo ngaphambi kokulala phambi kwe-jeff ifihliwe yi-pitch d
1570,do you think the can make a pitch based on their development system decent money and getting into a great development program to be a compelling offer perhaps his best chance to get to the,ngaba ucinga ukuba i-pain yenza i-pitch ngokusekwe kwimali yabo yokuphuhliswa kwesicwangciso senkqubo yokuphuhliswa ukuze ibe yinkqubo enyanzelekileyo ukuba ibe yindawo yakhe enyanzelekileyo ukuba ifumaneke
1571,the football player that made me love the beautiful game player of all time the king of bridge most clutch player ever to touch the pitch,umdlali webhola ondenze ndayithanda umdlali omnandi wexesha lonke ixesha lokumkani we-blodge kakhulu
1572,game day we can t wait to get back on the pitch tonight,usuku lomsebenzi singalinda ukubuyela kwi-pitch ngokuhlwanje
1573,oh they got sent why then is acting up it does not show me the u sent they all pitch black or probably my net is up,oh bathunyelwa ukuba kutheni le nto isebenza ayindibonisi ukuba uthumele yonke i-pitch emnyama okanye mhlawumbi umnatha wam uphakamile
1574,it is the flip side of a political culture where we lurch from existential crisis to humanitarian emergency to national garment and back again all in the space of a week politics at a high pitch but completely substance,yicala le-flip yenkcubeko yezopolitiko apho sizifaka kwingxaki eqhubekayo kwimicimbi yongxamiseko yesizwe kwaye iphinde ibuyisele yonke indawo kwi-pitch ephezulu ye-pitch kodwa iphela ngokupheleleyo
1575,pitch your at these rad west coast,i-pitch yakho kule ndawo irad west coast
1576,it is not that he is gay it is just that he would be a horrible president he could not even run south bend as mayor he is by the black community the and pretty much everyone but a small group that is by his youth and car salesman pitch,"asikuko ukuba usisinyambili kukuba uza kuba ngumongameli owoyikekayo wayengakwazi nokuyeka u-south assor ungoyena mntu ulungileyo wonke umntu, kodwa ilungu elincinci eliselunxwemeni"
1577,mane this he been so consistent on and off the pitch he is such a humble,mane le nto ihambelana kwaye icinyiwe kwi-pitch ukuba uthobekile
1578,more days,iintsuku ezininzi
1579,rustic cabin living or pitch a tent daily delicious campfire breakfast living orthodox pick up sports nature appreciation swimming cost day which room board donation,i-rustic car khadi ihlala okanye i-pitch intente yesidlo sayo yesidlo sayo yesidlo sasemini i-orthodox ithatha i-orthodox yendalo yokuhlala ibhunling ixabisa usuku lwebhodi yebhodi yebhodi
1580,i am already in the pitch perfect,sele ndikwindawo egqibeleleyo
1581,no pitch only them,akukho kuphela kwabo kuphela
1582,we are poor off the pitch thats down to the owner and revered board,sihlwempuzekile kwi-pitch mas phantsi komnini kwaye sihlonitshwe ibhodi
1583,as said once he our the route to get century it will be easier to follow the same path next time over and over that is what we can hope but it simply has not for us we bit more after airee is ton in tu relatively good pitch,njengoko besithi sele eyokuthatha indlela yokuthimba ikhulu kuya kuba lula ukulandela indlela efanayo kwixesha elizayo kwaye ingenzile yinto engaphezulu kwe-tut
1584,wrexham is new training pitch,i-wrexham yi-pitch entsha yoqeqesho
1585,i know that is good at ball distribution he is at least decent at it but i also seen him miss passing the ball out of the pitch when a teammate was away times around the th minute while we were trailing it s somehow in my brain and me anxious,ndiyazi ukuba kulungile ukusasazeka kwebhola okungenani kuyo kodwa ndambona nomzuzu ohambayo xa umntu ehamba ngomzuzwana xa sihamba ngam ngengqondo yam kunye nam ixhala
1586,agree with you except yes if another good level starter is available do it three of our down the stretch last year with one not even able to pitch we still don t have enough for a deep run sorry as well as bench dom drew,vumelana nawe ngaphandle kuka-ewe ukuba elinye i-starter elungileyo iyafumaneka kulo ntathu ukuya kulo nyaka uphelileyo kunye nokungakwazi ukuthambeka sine-tr run run run
1587,pay pitch never block,hlawula i-pitch ungaze ivimbe
1588,that is an excellent point the on both of almost any 'characteristic' curve be it masculinity strength vocal pitch are longer for we have more of both,le yeyona ndawo intle kakhulu kwi phantse kuyo nayiphi na i-curve ye-curve ye-masculinity yamandla e-procal ye-procal pitch ixesha elide sinalo sobabini
1589,top of pinch for to pitch for in bottom of end of,phezulu kwepinki ukuze ichaphazele ezantsi ekupheleni kwe
1590,pitch shift bang,i-shick shift bang
1591,his tiny high pitch haw,i-pitch yakhe ephezulu ye-pitch
1592,million people tuned in to see pitch i m sure they re be he t get to throw his i don t know how they make it,izigidi zabantu abathathwayo ukuze babone i-pitch i-m iqinisekile ukuba ingaba ingaba ufumana ukuphosa i-t
1593,this is just as bad he s tone deaf and a flat voice and is slightly off pitch it s to admit he s not the best singer on the planet better than most people but hardly a star solely because of his vocal talent,oku kubi kanye e-tone sne sneative kunye nelizwi elithe tyaba kwaye kucinywe kancinci ukuba angayivumeli imvumi ebalaseleyo kunombindi we-preace kuphela ngenxa yetalente yakhe yelizwi
1594,kicking off my first pitch subset with gold medalist who threw out the first pitch at a game on may st,ukukhaba iseti yam yokuqala ye-pitch ene-mendolist yegolide ephosa i-pitch yokuqala kumdlalo onokuthi ungomeyi
1595,they probably talk to in empty too,kusenokwenzeka ukuba bayathetha nabo
1596,rep claim a desire for small and no fed interference but then they let interfere and contradiction is their true platform small is a pitch that they have no intention or true belief in,ingabanga ukuphazamiseka komnqweno omncinci kwaye kungabi nakuphazamiseka kodwa emva koko bavumela ukuphazamisa iqonga labo eliyinyani yindawo encinane i-pitch engenanjongo okanye inkolelo yokwenyani
1597,of,ye
1598,_samfire_ _akari it is from world builder a where you can make an original theme and pitch it to i have a few you should try it out,_simire_ _akari ivela kwi-worldawamakhi wehlabathi apho unokwenza khona umxholo wokuqala kwaye ube nomxholo wokuqala ukuba uneembalwa kufuneka uzame ngaphandle
1599,red his red is all all knowing of his pain red is blood red is his anger red is his world red is his fate and it is his lover all at once once pitch black he now willingly into this red eternity,"bomvu bomvu, yonke le nto ukwazi iintlungu zakhe zibomvu yigazi ngumsindo wakhe, kwaye sisithandwa sakhe sonke ngoku"
1600,_trinityefc and the quote you was made against the backdrop of the aspect of running a premier league football club its approach to off the pitch the threat of the super league it is convenient for same as the 'you have had good times' comment,i-_triunityefc kunye neconse owenziwe ngokuchasene ne-backdrop ye-prover yebhola yebhola yephambili ye-league supel iliague ilungelelene
1601,probably one of the most pitch perfect to a film comedy particularly the last line,mhlawumbi yenye yezona zinto zigqibeleleyo kwifilimu yefilimu ngakumbi kumgca wokugqibela
1602,_mckenzie that is a fairly responsible pitch and i would not object to that generally speaking though would insist on any false or unproven,_mckencenzie enesisandi esifanelekileyo esifanelekileyo kwaye andizukuchaza ukuba intetho ithethile nangona inganyanzelisa nakuphi na ubuxoki okanye ngokungavuni
1603,great stuff kudos to and i how booth was a pitch in the box,izinto ezinkulu kudos ukuya kwaye ndiyindlela ebekwe ngayo i-pitch ebhokisini
1604,if it is not straight and white fox does not care look what they did when the on june they to show a throwing out the first pitch,ukuba ayilunganga kwaye imhlophe impunguku ayikhathali jonga into abayenzileyo xa kujuni babonisa ukuphosa isitayile sokuqala
1605,from the daily herald there is no for to do anything but pitch once he in the organization said our have seen some pretty special out of him,ukusuka kwi-herald yemihla ngemihla akukho nto yokwenza into ngaphandle kwe-pitch xa sele embuthweni etsho ukuba ibone ikhethekileyo kuye
1606,the bus for mountain view did not show up and yesterday the did not pitch up question is the bus be available today it will be best if you notify us if they are no longer available so that we plan for the slot please respond,ibhasi yombono weentaba ayibonisi kwaye izolo azenzenga ukuba i-they ifumaneka namhlanje iya kuba njalo xa sisazi ukuba singakwazi ukuphendula
1607,color pitch my my,umbala pitch yam
1608,_is_sn not that much flat as it was there or pitch he din rough crack se uneven bounce st day se,_is_sn not that much flat as it was there or pitch he din rough crack se uneven bounce st day se
1609,_red _blake _ut _futboioscar the goal he conceded was his mistake but i am just going to ignore that why because his mind on the pitch while like he is on squid so you think it is enough to assess a player during have not a minute of football have you,_red _blake _ut _utebbooscar injongo awazisileyo yimpazamo yakhe kodwa kutheni ucinga ukuba kwanele ukuba kuvavanywe umdlali webhola wena
1610,never seen martial or just give up and walk around the pitch before many had bad form last season but only clear lack of effort and refuse to challenge for the ball for me he more to do than anyone to get back into the team,ungaze ubone ukuba yi-farlial okanye unikezele kwaye uhambe ujikeleze i-pitch ngaphambi kokuba uninzi lube neyona ndlela imbi kakhulu kodwa ungabikho mngeni kwaye ungavumi ukubuyela kwiqela
1611,_ on this tough pitch for did a very good job,_ kule ntloko inzima yomsebenzi olungileyo
1612,_ are you just job in the pitch do you even play football,_ ngaba ungumsebenzi nje kwi-pitch ngaba ukhe wadlala ibhola
1613,today join live for this quick pitch session a select group of ten and an experienced panel of when th click here,namhlanje zijoyine ziphila kule seshoni ye-pitch ekhawulezayo yeqela le-ten kunye nepaneli enamava xa ucofa apha
1614,no pitch just really a lot of about how unexpectedly healing working on this been like i love these way too much but writing in particular been like giving my younger self a much hug and also her to be feral,akukho pitch ngokwenene malunga nokuphiliswa ngokungalindelekanga ukusebenza kwezi zinto zinjengokuthanda kakhulu ezi ndlela kodwa ukubhala ngokukodwa ukuba u-hug kunye naye ukuba abe yinto ebi kakhulu kunye naye
