,src,trg
0,celebration at visit of miss second runner up celebrated with great hon'ble also the occasion,ukubhiyozela kutyelelo lokuphosa imbaleki yesibini phezulu ebhiyozelwe nge-honeble enkulu nangesithuba
1,workman s turned ten at the height of the pandemic so two later the club are finally marking the occasion,umntu osebenzeleyo wajika ukuphakama kwe-pindemic ke ezimbini kamva iklabhu iphawula isihlandlo
2,_ and got the digs and nearly on more than one occasion good times,_ kwaye ndine-dig kwaye phantse ngaphezu kwesihlandlo esinye ixesha elifanelekileyo
3,today we been married for twenty it s a celebratory occasion and i am of the love we have that said no one had to codify our union it s love is love,namhlanje sitshatile kangangesihlandlo samashumi amabini angumbhiyolo kwaye ndinothando esinalo onalo akukho mntu kwakufuneka silithandane sothando
4,no but count it as an occasion can t wait for next weekend for season to begin,hayi kodwa ukubala njengoko ixesha lingalinda kwimpelaveki ezayo ngexesha elifanelekileyo
5,no he s not he s bloody awful the man can t answer a question and on the rare occasion he does it s with a lie,hayi akanguye igazi elinetyala lendoda inokuthi iphendule umbuzo kunye nexesha elingapheliyo alijonganga ngobuxoki
6,some will rise to the occasion some will fall may the best man win,abanye baya kuphakama kumcimbi abanye baya kuwa ngeyona ndoda ilungileyo
7,mario is are the perfect gift for any occasion,umario sisipho esifanelekileyo ngalo naliphi na ixesha
8,team distributed food and to people on occasion of  is birthday wishing you a very happy prosperous birthday ma'am have a wonderful year ahead,iqela lasasaza ukutya kunye nabantu ngamaxesha athile kukuzalwa kukunqwenelela usuku oluhle kakhulu lokuzalwa
9,the difference is that in one occasion i am involuntarily myself because i want to be more like that character i love so much and in the other one i would be forcing myself to act look differently to make someone else happy one thing i am sure of myself is that i can not,umahluko kukuba ngelinye ixesha ndiyathandana kuba ndifuna ukungaphezulu nje kokuba ndithanda kakhulu kwaye kwelinye icala ndinganyanzela ukuba ndenze into eyahlukileyo kwinye into endiqiniseke ngayo ngaba andikwazi
10,_zee of course we need to schedule a tequila shot for when we get off work i got on deck since it is a special occasion,_zee ngokuqinisekileyo kufuneka sicwangcise i-tequila i-tequila xa siphuma emsebenzini ndingena kwidesika kuba sisihlandlo esikhethekileyo
11,the only one actually dressed for the occasion leave him alone,inye kuphela enxibe inyameko kumsitho mshiye wedwa
12,greeting for every occasion and he them to crew instead of just sending in he will send a get well card it is your birthday he will send you a birthday card it is also how he when it is time for him to get a physical,ukubingelela ngalo lonke ixesha kwaye kubo ukuba baphumelele endaweni yokuthumela ikhadi le-filly yikhadi lakho lokuzalwa luza kukuthumela indlela azokufumana ngayo emzimbeni
13,same but on this occasion and increasingly over the last couple of its a brick wall,ngokufanayo kodwa ngalo mcimbi kwaye ngokunyuka ngaphezulu kwesibini sokugqibela sodonga lwezitena
14,a nice occasion i hope the he was wearing a mask as he said it otherwise he could be as just a hypocrite labour hard for lifting the mask mandate too early,isihlandlo esimnandi ndiyathemba ukuba wayenxibe imaski njengoko ebetshilo ngenye indlela inokuba njengomsebenzi we-hayporched ukuphakamisa igunya kakhulu
15,why as an adult are you going to the sugar factory for any occasion,kutheni le nto umntu omdala uya kumzi-mveliso weswekile ngalo naliphi na inqanaba
16,of on an occasion of public ceremony is not fair to secularism,kwisihlandlo somsitho woluntu ayilunganga kwindalo
17,_priestess they had to set us up extra crispy for this occasion what can i say,_priestess kuye kwafuneka siseke i-cuspy eyongezelelweyo ngalo mcimbi ndingathini
18,weel dun doctor bit ye a bit o as it wis a special occasion,i-weel dun gude bit bit o kancinane
19,happy birthday childe once you are free from your today perhaps we can spend some time together at the beach miss director went out of her way to get me a new swimsuit for this occasion so i do hope it is not too much if i decided to wear it art,usuku lokuzalwa olumnandi nje ukuba ukhululekile ukuba ukhululekile namhlanje i-art
20,so this is what it when the ground suddenly under foot twice in her occasion,ke lento yile xa umhlaba ngequbuliso uphantsi kwesihlandlo esithile
21,my late your every occasion they to find a in that envelope or else after my i was going through her and discovered she had saved them all,emva kwexesha lam ngalo lonke ixesha baya kufumana imvulophu okanye enye into emva kwam bendihamba naye ndafumanisa ukuba wabasindisile bonke
22,to be a strong case for those rare occasion where good policy good politics,ukuba lityala elomeleleyo layo phepha-nkqubo apho ipolitiki elungileyo ilungile
23,the still believe there s a three word slogan for every occasion,ukukholelwa ukuba kukho isilogani esithathu segama ngalinye
24,_of_kings where is chasuble worn to occasion if not to celebrate mass this is a total messy stunt they,_of_kings apho ityhutyha i-chasness ukuba ingacingi ukuba ingabhiyoze i-mass lo le nto i-desings iyonke
25,_obrian i am trying to imagine something that is not possible portable to perform in this type of occasion,_obrian ndizama ukucinga into engasebenziyo inokwenzeka ukuba yenze kolu hlobo lomntu
26,you are dressed for this special occasion penny hope you get some hot dog today enjoy,unxibe le thuba elikhethekileyo le-penny ndiyathemba ukuba ufumana inja eshushu namhlanje
27,are for the first time spending more on mezcal and than on u s made by they will likely supplant as the liquor category what is your adult beverage of choice i like vodka soda lime with dinner on occasion,yeyokuqala ichitha ixesha elingaphezulu kwi-mezcal kwaye ngaphezulu kwenziwe ngakwenziwa ngabasekiweyo njengohlobo lotywala ukuba yintoni i-vodka ye-vodka ye-vodka inesiqhelo
28,just had a fascinating encounter at the monument a man comes up with a and it in the direction of the site i what the occasion was and he said something along the of the land for our lord with a,ukudibana nje okumangalisayo kwilitye lesikhumbuzo umntu oza ne-a kwaye kwicala lendawo endiyithethayo ngayo kwaye wathetha into ecaleni kwenkosi yenkosi yethu nge-a
29,nobody said anything about seek out good rise to the occasion,akukho mntu uthethe nantoni na malunga nokufuna ukunyuka okufanelekileyo kumsitho
30,if you have any for the affiliate celebration let me know here i know it is not the most special occasion but it the world to me and i do what i can for my community even if it embarrassing myself for d,ukuba unayo nayiphi na into yokuba umbhiyozo ohambelana nayo mandazi apha ukuba ndiyazi ukuba ayisiyonto ikhethekileyo kodwa ihlabathi kum kwaye ndenza into endinokuzihlazisa.
31,_mafia he is a graduate of state poly,_mafia unesidanga sepoly spoly
32,the shot some chaos i was also carrying those traffic cones in my tote bag for the occasion,i-pud i-chaoos bendinethwele iicones zetrafikhi kwingxowa yam ye-tote yomsitho
33,lovely to see you maria and share the occasion with you,kuyathandeka ukukubona umaria kwaye wabelane nawe ngesithuba
34,designate a regular quiet and keep it organized inspirational and clean meal prep and stay hydrated take advantage of being able to make a hot meal on occasion,yakhethi tu ithe cwaka kwaye igcine ukuba ikhuthaze ikhuthazo kwaye icocekile i-preper prep kwaye ihlale i-hydd kwaye ihlale isebenzisa ithuba lokufumana isidlo esishushu ngamanye amaxesha
35,_sharma if thats true there is not much we can do because these reside in control the super and so advanced on many occasion poor suffer silently as their voice is not on many,_sharma ukuba ayikho kangako akukho nto ingako sinokukwenza kuba lihlala ilawula i-super kwaye ihambile kakhulu kwilinye ihlwempu lithe cwaka njengelizwi labo
36,not sure how many you due to fire crackers so many on the occasion of your show off birthday make her your brand ambassador for no fire crackers after her,awuqinisekanga ukuba zingaphi ngenxa ye-crackers yomlilo kangangokuba uninzi kumnyhadala wohlobo lwakho lokuzalwa umenzele i-amessike yakho ye-rackers yakho emva kwakhe
37,anywhere from ' to ' depending on the occasion,naphi na 'ukuya' kuxhomekeke kumsitho
38,when i i was a truss supporter i to i am now back with truss sadly the on the whole do not go with who i like b t perhaps on this occasion they will,xa ndandingumxhasi we-truss i ndibuyile ngoku nge-truss esibuhlungu xa yonke le nto ayihambi nto ndithanda ukuba mhlawumbi
39,now he who seed to the sower for food will also supply your store of seed the of your righteousness you will be in every way so that you can be generous on every occasion through us your generosity will result in thanksgiving to god,"ke yena lowo mbewu esimlalini wokutya, uya kuyinikezela imbewu yakho ngembewu, ubulungisa bakho, uya kuba nesisa kuwo onke amathuba osa esisa kuyehova, kuya kuba ngumbulelo kuthixo."
40,_somerville _drott in you been waiting for this precise moment haven t you aw man i apologize for such a special occasion allow me to bequeath this dub unto you for such a big analysis of my crucible prowess bye now,_somerville _drott kuwe ulinde le mzuzu uchanekileyo i-awn umntu ndicela uxolo malunga nohlalutyo olunje ngoku
41,ago today nasa is landed on the moon it was one small step for man one giant leap for mankind were you with us in when we celebrated this momentous occasion with salgado is wonder of moonrise photo by,edlulileyo namhlanje i-nasa ifihliwe enyangeni yayilinyathelo elincinci lendoda enkulu yokuba umntu okrwada kuluntu yayinguwe xa sibhiyozela le nto i-salgado ingumzi wefoto
42,it s nothing to do with that it s the club massively over priced the thinking they could take advantage of the occasion and the about it sure they t be too happy with a flight to and either,ayikho into eyenziwayo ngayo yiklabhu eninzi ngaphezulu kwexabiso lokucinga abanokuthi basebenzise ithuba leso sihlandlo kwaye malunga naloo nto ngenqwelomoya
43,you sure got that right hopefully the occasion to rise up there with will be when is found guilty of all his treasonous and thrown in prison for the rest of his life no matter how long or short that may be the longer the better in my opinion,uqinisekile ukuba unethemba lokuba eli thuba liza kuphakama apho liza kuba lifunyaniswa linetyala layo yonke loo nto ingekabinantolongweni ngenxa yobomi bakhe obungcono
44,_jun is hubby involved here both are the by hubby treat on an occasion,_jun yi-hubby ebandakanyekayo apha zombini i-hubby inyanga isihlandlo
45,even a rock will definitely keep selling as much as possible at these the lower the goes the the once in a lifetime occasion to get awesome roi,nokuba ilitye liya kuqhubeka lithengisa kangangoko kula kuphantsi kweyona ndawo ihamba ixesha elide ukuze ufumane i-roi eyoyikekayo
46,infinity is not a loop beyond infinity there is an infinite amount of infinity as infinitely outwards as inwards now think of it as infinitely layered infinitely infinitely soluble everything we exist together at a place within all of that where this occasion is,i-infinity ayiloop ngaphaya kwe-infinity yenani elingenasiphelo njengamanani angaphandle njengokungena ngaphakathi ngoku ukuba ungazicingeli ngokungafanelekanga kuyo yonke into esikuyo
47,it is a rare occasion,sisihlandlo esinqabileyo
48,top just to sit on the bench in case we go at the back on occasion plus budget wise,phezulu nje ukuze uhlale ebhentshini kwimeko yokuba siye ngasemva ngexesha le-qabane kunye nohlahlo-lwabiwo mali
49,i would do a date or use a special occasion,ndingayenza umhla okanye usebenzise itheko elikhethekileyo
50,something i have on the anyways is if you hover and it some amount of the video it goes in to your history even if you did not watch it so it could count that in their suggestion algorithm so i tend to clean up my view history on occasion,into endinayo ngayo nayiphi na indlela yokuba uhambahamba kwaye isixa sevidiyo singena kwimbali yakho nokuba awukayibukeli loo nto kwi-algorithm yabo ukuze ndicoce imbali yam
51,it probably an attack on finland less likely and it also an attack on finland more likely to cause we are dealing with who are on occasion terribly unpredictable,kusenokwenzeka ukuba kuhlaselo lwefinland kube lula kwaye kuhlaselo lwe-finland kunokwenzeka ukuba lubangele ukuba sijongane nabangesithuba esingalindelekanga
52,i do like drinking but mostly the seasonal occasion like family on new year as someone who legally does i don t recommend it for a daily living man how it s ruin you so badly if you re addicted or simply ignorant of your future medical cond,ndithanda ukusela kodwa ikakhulu itheko lamaxesha onyaka njengosapho lonyaka omtsha njengomntu owenzayo ngokusemthethweni ukuba uyonakalisa kanjani ukuba usona
53,o god bless my and those who have done me wrong now as i pray this prayer let me not still cherish in my heart the resolve to requite them when occasion,owu thixo abasikelele kwaye abo baye bandoyiki ngoku njengoko ndithandaza ndithandaza andizukuyixabisa entliziyweni yam isigqibo
54,i love your lost world perfect size for more than a less than a letter and beautiful enough for any occasion,ndiyakuthanda ubungakanani behlabathi lakho elilahlekileyo elingaphezulu kweleta engaphantsi kweleta kwaye intle ngokwaneleyo ngalo naliphi na ixesha
55,authentic beauty is always in style step outside the box with bold from tahjee' beauty we offer unique apparel for every occasion visit our to browse,ubuhle obuqinisekileyo buhlala busitayile inyathelo ngaphandle kwebhokisi nge-tahjee 'ubuhle esinikezela ngentengiso nganye sinika ishenxiso yalowo wonke umntu otyelelayo
56,even a rock is going to definitely keep panic selling as little as possible with these low the lower the market goes the the lifetime occasion to obtain incredible,nokuba ilitye liza kuqhubeka lithengisa ngokuthengisa kancinci kangangoko kunokwenzeka ukuba le iphantsi iphantsi imakethi ihamba ixesha lokuphila.
57,thinking about that robot woman she me only on occasion i wonder if its loneliness that her to make up mad about and prison if i could find and introduce her to steven i think she might find much in common with another robot voice,ukucinga ngalo mfazi robhothi ndim kuphela ngamanye amaxesha ndiyazibuza ukuba ilolo lize lizenzele ilolo malunga nentolongo ukuba ndingayifumana kwaye ndimazise ukuba angayifumana enye izwi lerobhothi
58,she been involved in any dodgy impropriety not as far as i know still the truth on occasion though,wayebandakanyekile nakweyiphi na i-dodgy ayihambelani kangako njengoko ndisazi ukuba ikhoyo inyani ngesihlandlo
59,khan will never disappoint you there is a video for each and every occasion,i-khan ayisoze idanise ukuba ikhona ividiyo ye-video kunye nawo onke amaxesha
60,branded a great giveaway for any occasion,i-brated i-tiaway enkulu ngalo naliphi na ixesha
61,they could if those ballot box were laminated imagine the furore cost of living crisis and the committee is ballot box but it does seem that on this occasion they have on their after getting this lamination issue right,banokufumana ukuba iibhokisi zevote zazicinga ukuba i-furore indleko zengxaki yokuphila kunye nekomiti ibhokisi ye-ballot ibhokisi kodwa kubonakala ngathi kwesi sihlandlo siye safumana lo mbandela wale meko
62,you look so much like and glad you chose not to miss the occasion,ujongeka kakhulu kwaye uyonwabile ukuba ukhethe ukuba ungaphoswa ngumsitho
63,pottery cock is for every occasion,ilahleko ye-pottery yey nganye nganye
64,truss obscene wealth a woman of principle whichever principle the occasion see the image is anyone inspired by the prospect of either as,"i-truss obscene ngobutyebi obhinqileyo, ibhinqa elingumgaqo iphi isithuba esibonayo umntu obona umfanekiso ophefumlelwe ngumntu ophethwe ngu"
65,there is no one worse he gave everyone permission to be their worst boy did they rise to occasion,akukho namnye owanika wonke umntu imvume yokuba yeyona nkwenkwe imbi kakhulu yayiye yaphakama
66,to the of the masjid e award ceremony on the auspicious occasion of al in addition our thanks to for joining us for this special occasion,kumsitho we-massid escemon osela umsitho wexesha eliqinisekileyo lokwenza umbulelo wethu ngokusijoyina le thuba likhethekileyo
67,_ these priest are new and were strictly made for this occasion,_ lo mbingeleli intsha kwaye ilungiselelwe eli thuba
68,we re still lead academy physiotherapist h p w structured as or between mon some limited w end match cover on occasion k p a k th _official,siphinda sikhokele i-adesototist hi w w w w w w w w w w w w w w winter okanye phakathi kwe-mon presment winter primed matery primed nge-k th _official
69,of on the joyous occasion of their th raising day,kwisihlandlo esimnandi somhla wabo wokukhulisa
70,on the occasion all time is but i am also very of a strawberry,ngalo msitho lonke lixesha kodwa ndingowayi-strawberry
71,with every booking you have access to all of our tables these are gorgeous versatile easily dressed up for any occasion,ngalo lonke ubhokelo onokufikelela kuzo zonke iitafile zethu ezi zinto zintle ngokuguquguqukayo ngokulula ngalo naliphi na ixesha
72,on this day in and buzz the first to set foot on the moon what are you doing to celebrate the occasion,ngolu suku kwi-buzz owokuqala ukubeka inyawo kwinyanga ukuba wenza ntoni ukubhiyozela iqabane
73,i think i have to agree with you on the vice though on more that occasion with the reps like on the first stimulus packet received none from the am in favor of of congress spouse not to trade stocks,ndicinga ukuba kufuneka ndivumelane nawe kwi-vice nangona isihlandlo esithile kunye ne-reps kunye ne-reps efana nepakethi yokuqala ye-cocmul engamkeli iqabane lakho lokurhweba
74,only to the bank on occasion,kuphela kwibhanki
75,_legion _kamilia let is just say in a previous life i cause to turn into florin on more than one occasion is pop singing in still a thing,_lamilia mayitsho nje ngobomi obudlulileyo ndibangela ukuba ndijike kwi-florin kwizihlandlo ezingaphezulu kwesinye i-pop ecula entweni
76,i wrote to insurance because insurance cos often provide insurance outside the norm on this occasion they won t so back to square one for me,ndibhalele i-inshurensi kuba i-inshurensi idla ngokubonelela nge-inshurensi ngaphandle kwesithuba seso sihlandlo baphumelela ukuze babuyele kwi-square
77,on the occasion of of from the of production with,kwithuba lokusukela kwimveliso kunye
78,check out this product vintage pin up for casual party occasion by starting at shop now,jonga le mveliso ye-vintage ye-vintage iphina yeqela lempawu ngokuqala kwivenkile ngoku
79,the foreign minister with the prime minister on the occasion of of bilateral diplomatic,umphathiswa wezizwe kunye nenkulumbuso kumsitho we-biplomatic dinamamatic
80,mall ambient light in general they have indirect light white noise incredible uplifting energy food with the correct indoor mall i can write for on occasion i also hear unexpected dialogue or witness great drama i have never used them but i index them,i-met ambils ukukhanya ngokubanzi anokungathanga ngokuthe ngqo kwingxolo emhlophe encomekayo yokufumana ukutya okucwangcisiweyo
81,_ will do anything for caroline but caroline t want him because of what he did to more about caroline saved her life in many occasion even when caroline him caroline love is,_ iza kwenza nantoni na yocoroline kodwa ucaroline t afuna ngenxa yento akwenzileyo malunga nocaroline basindisa ubomi bakhe ngezihlandlo ezininzi nangona ucaroline uthandane
82,me in the past but on this occasion he is just telling it how it is,nam ngaphambili kodwa kwesi sihlandlo uyithetha nje ukuba injani
83,should the occasion arise i hope i will have the fortitude presence of mind to balance my responsibility to consider how my have unintended harmful on with the need to recover from any emotional trauma i incur from their need to step away from me,ukuba itheko livele ndiyathemba ukuba ndiza kuba nenqaba yobukho bengqondo ukulungelelanisa uxanduva lwam ukuze ndicinge ngayo nayiphi na into endiyifumana kuyo nayiphi na imvakalelo yokufumana intamo yokuhamba nam
84,i have lost a follower since i to mention life s'pose it is good to say now that on occasion i will not be cheery again just going through a lot at the moment,ndilahlekelwe ngumlandeli ukusukela ndikhankanye ubomi nditsho ukuba kulungile ukuba uthini ngoku ukuba ngamaxesha athile andiyi kuphinda nditshintshe nje ngelo xesha
85,that is why he rolled he occasion hit his wife again,kungenxa yoko le nto aqengqelekayo wabetha umfazi wakhe kwakhona
86,our just froze and pretty sure yours will too power this adorable click with his family on the occasion his wife birthday,ukuqiniseka kwethu kunye nokuqiniseka kwakho kuya kuba namandla akho okusemandleni akho oku kuthanda inkanuko kusapho lwakhe kwimtshato
87,_mada _ _dannysingh i still have an answer to the question regarding private something y all have yet to consider even tho it s been brought to your attention on more than one occasion many of us are blocked from that grant privacy it would make us money,_mada _ _dannsysingh ndisayimpendulo kumbuzo malunga nento yabucala y konke kusenokwazi ukuthathela ingqalelo ingqalelo yakho kwizihlandlo ezingaphezu kwesinye ukuba sibe senze imali
88,on the occasion of marina s drop and tell us who their hero is who is your hero,ngomthendeleko we-marina s kwaye usixelele ukuba ngubani iqhawe lakho ngubani iqhawe lakho
89,the madness tonight but you still have time to save t for the team event glassware as the perfect favor and to hold it all shop now,ukudada ngokuhlwanje kodwa usenexesha lokugcina i-t kwigradesi yethemba yethebhu njengendawo efanelekileyo kunye nokubamba yonke ivenkile ngoku
90,_wilson _barringtonii as a white rural republican like i would have it by now i have known two people who say it on rare occasion for shock value among safe and get out on their every time the world does have plenty of they are not an existential threat,"_wilson _bartoringtonii njenge-whild elentern elentern elentens njengoko bendiya kuba nayo ngoku, ndiye ndaba nelo xesha lehlabathi elinqabileyo kwaye ndiphumele ixesha elininzi lehlabathi ukuba ayisosisongelo esikhoyo"
91,our just froze and pretty sure yours will too power this adorable click with his family on the occasion of his wife birthday,i-roze yethu nje kwaye iqinisekile ukuba iya kuba namandla akho kakhulu enamandla okucofa i-cock cock kunye nosapho lwakhe kwithuba lomfazi wakhe wokuzalwa
92,you probably more bad than good because mostly everyone was on that film the story action and writing are all terrible every serious moment is interrupted with a joke except on one occasion himself is trash,kusenokwenzeka ukuba ububi ngakumbi kunokonwaba kuba ubukhulu becala wonke umntu wayekwelo filimu kwaye ukubhala konke okubi konke kuyaphazamiseka yonke into ngaphandle kwesithuba esinye ngaphandle kwenkunkuma
93,everyone is over again today the special occasion is morning from am to am a group of six eat a delicious homemade breakfast and watch together it s the most enjoyable part of the week,wonke umntu ukhule kaninzi namhlanje isihlandlo esithile kusasa ukuba ndiliqela lesithandathu isidlo sakusasa esimnandi kwaye sibukele kunye yeyona ndawo iyonwabisayo yeveki
94,does anybody in here pray how about god to save our because it s coming and you probably hear me mention it again on occasion between now and during the fated week ahead,ngaba ukho umntu ose apha uthandaza njani ngothixo ukuba asindise kuba esiza kwaye mhlawumbi uyandiva ndikhankanya ngamaxesha athile phakathi kweveki ephambili
95,on the of president and corporator have damage with ae at company division on this occasion primary unit president were present,kwi-mongameli kunye nomlawuli wonakalisa nge-ae kwicandelo lenkampani kulomgama ongumongameli ophakamileyo
96,light and airy with a little pop of colour our if you are in need of a flower arrangement for a birthday anniversary or any special occasion send us an to ca,ukukhanya kunye ne-airy ngepop encinci yombala ukuba uswele ilungiselelo leentyatyambo lomhla wokuzalwa kwesikhumbuzo somhla wokuzalwa okanye naliphi na ithuba elikhethekileyo lisithumelela i-ca
97,use s to build an that the perfect music for any mood or occasion,sebenzisa s ukwakha umculo ogqibeleleyo ngayo nayiphi na imood okanye itheko
98,this is a cool idea i will consider it to my post but please do ask your for consent first i have on more than one occasion given or a talk that my employer or the speaker is need not know about,lo ngumbono opholileyo ndiza kuyithatha kwiposi yam kodwa nceda ucele imvume yakho kuqala ndinesinye isihlandlo esinye esinikezwe okanye intetho esweleyo
99,_unp politics t a game for people whose and are on the line if one it is a game or a sport one t be in it sri is at a time for statesmanship and not politics hope he to the occasion,i-_unp yezopolitiko
100,to wake on occasion but it was in many they were each other is support system true how about i get us something to drink water tea,ukuvuka ngamaxesha athile kodwa yayingabantu abaninzi bayinto enye yinkqubo yenkxaso iyinyani indlela endisifumana ngayo into yokusela iti yamanzi
101,he s got to still have them away for such an occasion right,usakhusele naye ukuba aphelelwe lixesha elifanelekileyo
102,s swag skin is the ultimate go to for when you want something fun but you keep it classy our phone allow you to switch it up whenever you feel switch your skin for every mood every outfit every occasion,ulusu lwe-swag yeyona nto iphambili kuyo xa ufuna into emnandi kodwa uyigcina i-classy ifowuni yethu ikuvumela ukuba uyicime yonke i-upol yonke impahla
