,src,trg
0,some of the blown onto the pitch,ezinye ze-blown kwi-pitch
1,just more garbage filled with woke liberal crap,nje inkunkuma egcwaliswe yi-wock cheght crap
2,well that honestly wont surprise me but you re saying he won t pitch at all this year like your now going back on your take,kulungile ukuba ungandimangalisi ngokunyaniseka kodwa phendula ukuba uphumelele i-t pitch kulo lonke lo nyaka njengoko usemva kwakho ngoku
3,musk of unrealized wealth to the royal fam at least point the pitch where they matter,i-musk yobutyebi obungenantlonelo kwi-royal fall ubuncinci inqaku le-pitch apho banika khona
4,well it is only the 'potential' because i can not say as i have seen it yet on the pitch,kuhle kuphela 'ukubakho' kuba andikwazi ukuthetha njengoko ndibone isandi
5,growing up baseball was my favorite sport to play my pitch game was,ukukhula kwe-baseball yayingumdlalo wam owuthandayo ukudlala umdlalo wam we-pitch
6,in the last i broken my wrist and ruptured my just been given a date for my surgery get me back on that pitch season i m coming for you,ekugqibeleni ndaphule i-wrist yam kwaye ndaphuphuma i-cunsting yam inikwe usuku ukuze ihlelo lam lindibuyisele ixesha le-pitch ndiyakuza kuwe
7,close the goal for some is to mimic the that society defined as masculine or feminine voice pitch facial hair clothing that is what it when people say gender is a social construct society simply decided that typically only wear,close the goal for some is to mimic the that society defined as masculine or feminine voice pitch facial hair clothing that is what it when people say gender is a social construct society simply decided that typically only wear
8,nor am i in of starting the season abroad i understand the liking for warm fine weather but it will only suit a very small percentage of the west are nice in march but the pitch in was not great and it is an expensive trip,nam ndikuqale ixesha lokuqalisa ixesha lokuthandana ndiyakuqonda ukuthanda kwemozulu efudumeleyo kodwa kuya kuphela ipesenti encinci ye-west ihle kwaye kuhambo olubi kakhulu kwaye luhambo olubi kakhulu
9,it s not every day i get to pitch so why not make it fun up down and k s to close it out thanks for the,ayisiyo yonke imihla endifika kwi-ping ke kutheni ungayivuyi phantsi kwaye i-k s ukuyivala i
10,pitch by pitch data is incomplete for some all star but the only other instance of a pitcher recording in an inning on or before was in the batter who saw the lone ball,i-pitch ngedatha ye-pitch ayiphelelanga kwezinye iinkwenkwezi kodwa kuphela kwesinye se-pitcher erekhodiweyo kwi-inning okanye ngaphambi kokuba kubekho ibhola ekhatywayo
11,does anyone else is ear ringing change pitch when you move your,ngaba ukhona omnye umntu oyinkcitho yokukhala kokutshintsha xa usiya
12,__teez he was given enough time on the pitch to prove himself but to what else,__thebele wanikwa ixesha elaneleyo kwi-pitch ukuba azingqine kodwa yintoni enye
13,forgot to pitch a nope review i fear i will be annoying you all on here tomorrow night,ulibale ukuphelisa uphononongo lwe-nope ndiyayoyika ndiza kukucaphukisa yonke ingomso ebusuku
14,our best elevator pitch so far it s like a web version of dry but for your digital,eyona ndawo yethu yokuhlala ye-enyusa
15,a moan about ten hag not doing after the game are delighted he is not taking time out to talk to such and keep the focus on football on behalf of do not want they want on the pitch,i-goan malunga neshumi hag ingakwenzi emva kokuba umdlalo uyakuvuyela ukuba ungathathi ixesha lokuthetha nokugcina ugxininiso kwibala lebhola
16,he was the best player on the pitch in league final,wayengoyena mdlali obalaseleyo kwi-pitch kwiligi yokugqibela
17,it s true i in a suit also true that i had a swinging strike in slow pitch i guess this t help my of final year of eligibility,kuyinyani ukuba ndikwinyani yokufakelwa kukuba ndibe ne-wing the fing kwi-pitch ecothayo ndicinga ukuba le nto ndinceda unyaka wam wokugqibela
18,it is pitch black you are likely to be by,kukumnyama mnyama kunokwenzeka ukuba ubekhona
19,tonight is on the yell sound ferry further disruption his pitch to the in the north stepping down as di jimmy couple tracing their family tree back to join us on,ngokuhlwanje kwi-wells i-yell i-wellry evakalayo iphazamisa i-pitch yakhe kwi-pitch kwi-entla ezantsi njenge-dimmy isibini esilandela umthi wosapho lwabo ukuba sibuyele kuthi
20,pitch black by brown on,i-pitch emnyama ngu-brown
21,i pitch a ball at a dodger is game,ndibambe ibhola kwi-dodger ngumdlalo
22,speaking of i got a kick out of this promotional packet from which a page on one the city is many brick these were the days when a brick company pitch included saying our are used in providence and fall river,ukuthetha ukuba kukhatyelwe kule pakethi yentengiso apho isixeko esinye isixeko sininzi kwezi sitephu senkampani ye-brick ifakwe kwi-pitch yethu isetyenziswe kwi-aptipns noprory
23,just got sturdy on the principality stadium pitch,ndiqinile nje kwibiladium yestadium
24,you can see yesterday on the pitch that this team amazing potential,uyabona izolo kwi-pitch ukuba eli qela lingalunganga
25,inside international slow pitch softball,ngaphakathi kwibhola ekhatywayo ye-pitch ecothayo
26,this is one of my favorite of all time thanks franklin s pitch perfect performance in the blues the film that her career,le yeyona nto ndiyithandayo ngalo lonke ixesha enkosi ifranklin s pretch yokusebenza kwi-blue ifilimu ongumsebenzi wakhe
27,that no sense trouble outside the pitch you do not play in a team,ukuba akukho ngqiqweni ingxaki ngaphandle kwesandi ongayidlalanga kwiqela
28,by the way here are the cross play for that you will want to know this pitch everything from how to find your to which transfer will be,ngendlela apha ngumnqamlezo odlalayo ukuba uza kufuna ukwazi ukuba le nto yonke isuka kwindlela yokufumana kwakho kuyo
29,on we on the first round of venue and a huge competition partnership with this year s will feature some of the country s leading innovative and top learn more,kumjikelo wokuqala wendawo yokuhlala kunye nentsebenziswano enkulu yokhuphiswano kunye nalo nyaka s iya kuba nelinye ilizwe elikhokelayo kunye ne-top yokufunda ngakumbi
30,that s such a weird tweet he people that being said i think his book is be good if the book is good then how the hell did he scam people it like he gave the people what they do people really not know what a pitch is am i,"leyo i-tweet enjalo, abantu abathi ndicinga ukuba incwadi yakhe ilungile xa i-char ke yazithanda njani izinto ukuba abantu bawayenze ukuba ndithini"
31,and this is what you are not getting you say both but you have burning pitch for only you never call out you call out and it is not just you it is the majority of this fandom the handful of us calling out are being toxic what are you,yile nto ungakufumaniyo ukuba uthethe bobabini kodwa uvutha i-pitch yedwa ungaze ubize ngaphandle kokuba ungabinamntu nje ukuba ungoyena mntu unetyhefu ukuba yintoni
32,dead ass if you are paying for something that other people get to enjoy consistently they do not even offer to pitch in knowing that you are for it run like run far away the selfishness only get worse taking advantage only worse,i-ass efileyo ukuba uhlawula into yokuba abanye abantu bakonwabele ngokungagungqiyo ukuba bangenzi ukuba bakwazi ukuzingca kunokuba mandundu kuphela
33,arm chair pitch count are the best kind based on this graphic that likely less than of each pitcher s total that week they should ____________,i-arm count count ngolona hlobo lubalaseleyo olusekwe kule mifanekiso ekunokwenzeka ukuba ingaphantsi komngxunya ngamnye weveki nganye kufuneka ________
34,a of animal farm set in an east coast commuter train,ifama yezilwanyana isetiweyo kwi-east coast counter
35,to pitch to with a runner in scoring position and the freshman him pay an double the up on valley in the first inning _ _softball,ukutsalwa kwimbaleki kwindawo yokufumana amanqaku kunye ne-flowman ahlawule kabini phezulu kwintlambo kwi-intshi yokuqala ye-intshi _ _soft
36,i have never watched a single one they are unwatchable you can get all you need to know from pitch meeting and honest and be far more i am in a great mood could not be better actually now that it is official will never work at again,andikaze ndibukele enye into engafunekiyo ungayifumana yonke into ekufuneka uyazi kwintlanganiso ye-pitch kwaye unyaniseke kwaye ube nokungaphezulu kakhulu ukuba ingaba semthethweni
37,love it i will have some whatever it is good in a pitch,ndiyayithanda ndiya kuba nayo nayiphi na into elungileyo kwi-pitch
38,like i can use open to draw pass and a shot on a pitch but stuck with on,njengayo ndingasebenzisa ukuvula ukuzoba kunye nokudubula kwi-pitch kodwa inamathele kwi
39,cause your keeper mean he s captain there on a pitch you all lead but yeah let have a who to captain the side,yenza ukuba umgcini wakho uthetha ukuba umphathi phaya kwi-pitch ophindiweyo kodwa ewe uvumela umntu ukuba abhalwe ecaleni
40,a theory on why all star are usually low scoring 'it is easier to pitch hungover' via,ithiyori ukuba kutheni yonke inkanyezi idla ngokufumana amanqaku 'kulula ukupink hungover' via
41,why did you swing at a high pitch,kutheni usandul 'ukujija kwi-pitch ephezulu
42,this is another pitch for in eastern pa to please consider wind solar electricity through _coop and it is a accountable to its membership responsive local not a power company more here,le yenye i-pitch kwi-putch ye-pa ukuya kucela umbane wombane welanga nge-_coop kwaye kuyaphendulwa kubulungu bayo
43,wishing you and your family all the best for the future top man on and off the pitch,ndikunqwenelela wena nosapho lwakho konke okuhle kwixesha elizayo
44,full breakdown of transfer market in,ukuqhekeka ngokupheleleyo kwemakethi yokudlulisela ngaphakathi
45,i don t care about ga he up the pitch hence why i doubt he be a regular starter this season and what does him being a captain have to do with his work on the pitch,andikhathali ngegatile ye-pitch ngenxa yokuba kutheni ndithandabuza ukuba sisiqalo esiqhelekileyo ngeli xesha lonyaka kwaye ungubani na umphathi wakhe omele ayenze ngomsebenzi wakhe kwi-pitch
46,following the cross play test in to and we re expanding the availability of cross play to more game in learn more about how cross play will work in our latest pitch,ukulandela uvavanyo lokudlala lomnqamlezo kwi kwaye sandisa ubukho bendlela yokudlala kumdlalo ongaphezulu wokufunda ngakumbi malunga nendlela esihamba ngayo
47,will only believe the transfer news when he is on the pitch for us,iya kukukholelwa nje kwiindaba zokudluliselwa xa usesipikisi kuthi
48,no better way to end the district tourney it s a park county rivalry for the district title game first pitch at listen live on,ayikho indlela ebhetele yokuphelisa ukhenketho lwesithili i-suard county riveling yesihloko sesithili sesithili sesithili sokumamela i
49,no cross play in pro i refuse to believe this quote taken from pitch we want to ensure our product is at quality and because of the of cross play that pair together as pro will not feature cross play,akukho mdlalo udlalayo kwi-pro andila ukukholelwa esi sicatshulwa esithathiweyo kwi-pitch esifuna ukuqinisekisa ukuba imveliso yethu ikwindawo enomgangatho odibeneyo
50,chasing target on the pitch which was not easy to bat on in a knockout match against arch in front of home crowd this is as special as that against and the win is obvious for the red ball format,ukugxotha ithagethi kwi-pitch eyayingalulanga kwi-bat kwi-arch primer press kwi-arch thaf taints ephakathi le fomathi yebhola
51,personally think terrier is not as central as i think is he from the left side of the pitch a lot to start or pick up the ball on that side more i guess you could tell us if that would match or interfere with diaz is style,ngaba ucinga ukuba u-terricker ayikabikho nto iphambili njengoko ndicinga ukuba usuka kwicala lasekhohlo le-pitch ade aqale okanye athathe i-bice ukuba ungadibana nawo okanye ungaphazamisi i-diazi sisitayile
52,i throw been doing it for the i and did it for my college baseball team it is a special skill to put each pitch where the player it,ndiphosa i-i kwaye ndenze kwiqela le-baseball yam yekholeji ye-baseball isesakhono esikhethekileyo sokubeka isitayile ngasinye
53,ben to throw out first pitch at celebration,uben ukuphosa i-pitch yokuqala kwibhiyozo
54,not so much a channeled movie since it was only just a pitch but the same studio that did legend of movie zero idea if it would even be worth it but i dug the pitch trailer,ayisiyo imovie etyibilikileyo kuba yayiyindlela nje kuphela kuphela kodwa i-studio efanayo ye-leend yengcinga ye-movie zero ukuba iyakufanelekile kodwa ndimba umkhondo we-pitch
55,i thought it was awesome hearing what to throw during certain count pitch should be out of the zone,ndacinga ukuba yayikuva kamnandi ukuba uza kuyiphosa ntoni ngexesha lokubala okuthile kufuneka kungabikho ndawo
56,a little ahead of schedule here in sports show at with first pitch at on,ngaphambili ngaphambi kweshedyuli apha kwimidlalo yezemidlalo kwi-pitch yokuqala kwi
57,my will never pitch a pitch for the again,andiyi kuphinda ndiyikhuphe i-pitch ye
58,i also never got the fascination with he was good but t be in like this he could ping a ball around the pitch and score most should be able to do that was better,andizange ndifumane ukuba ndihlole kunye naye kwakulungile kodwa ndingabanjwa ngolu hlobo unokufaka ibhola ejikeleze i-pitch kunye namanqaku amaninzi kufuneka akwazi ukwenza oko kungcono
59,was there ever a pitch for you and to have a match or feud against each other,yayikukufumana i-pitch kuwe kwaye ukuba nomdlalo okanye feud omnye komnye
60,with no extra to worry about this is shameful that did not get to pitch save the we need him argument would be fine throwing an inning or at least a batter especially when you barely pete and sat out,ngaphandle kokukhathazeka malunga noku kulihlazo le-pitch sigcine impikiswano siya kuba sekuphoseni i-inning okanye ubuncinci i-piet i-pete kwaye ihleli
61,not unnoticed by us he stepped up at a tricky time for us and had much to with on and off the pitch while a level of dignity that few could match he certainly would have felt the difference of both available,ayisiyonto ngathi wangena ngexesha elineqhinga lethu kwaye wayenento eninzi ukuya kuthi ga kwi-pitch ngelixa elinesidima ngelixa embalwa anokuvalela umahluko wabo
62,a lot have been the new pitch system but i seen people still,eyona nto ininzi yinkqubo entsha ye-pitch kodwa ndibone abantu
63,_thet not bigger enough to be to play on the big town pitch,_ingaphezulu ngokwaneleyo ukuba ungadlala kwi-pitch enkulu yedolophu
64,in area x crash in bicycle assist outside the pitch broken arm,kwindawo ye-x ye-rash ngebhayisikile
65,_fan bad communication on the pitch could never be my striker,unxibelelwano olubi olubi kwi-pitch alunakuze lube lube lixhoba lam
66,new york s housing crisis is at a fever pitch why we have not built enough housing in large part because local have made it illegal to build apartment throughout most of the region many of the five,ingxaki yasenew york ikwi-fever yefida ukuba kutheni singakhe sayakha indlu enkulu kuba i-doule yenzekile ukwakha indawo yokuhlala kuwo owona mmandla
67,the pitch is perfect in fact o and of snooker on it this afternoon,i-pitch igqibelele kwi-o kunye ne-snooker kuyo ngale mvakwemini
68,the inside of me is with pride what a get by the for the ceremonial first pitch against the on ben himself via,ingaphakathi kum iqhayisi ngekratshi ukuba lifumana ntoni nge-tekimoikali yokuqala kwi-ben chat
69,look at market agents' publisher and writing related market the various will tell you exactly what they want and if an editor an pitch session harlequin does this fairly often pitch something,jonga iagents agents yethengiso kunye nemarike enxulumene nokona
70,drafting my first pitch excited,ukuyila i-pitch yam yokuqala
71,days until today i on the high pitch start high finish high and getting my through the zone quickly _bombers,iintsuku kude kube namhlanje ndikwi-pitch ephezulu iqala kakhulu kwaye ndifumana umda ngokukhawuleza _bo
72,leadoff first pitch home run at the,i-chicoffp yokuqala i-pitch i-pitch iqhutywa kwi
73,is giving us a taster of what it would feel like once he and it s not good at all i genuinely miss his training and him on the football pitch,ngaba usinika umntu othandabuza ukuba kuya kuba njani kanye xa yena kwaye ayilunganga konke konke endikukhumbule ngokwenene ukuqeqesha kwakhe kunye naye kwi-pitch yebhola
74,_info he is a world class player so many learn from him both on and off the pitch,_info ungumdlali we-world wehlabathi kangangokuba abaninzi bafunda kuye zombini kwi-pitch
75,trouble outside the pitch he will be gone in,ingxaki ngaphandle kwe-pitch uza kuba ngaphakathi
76,this was the moment i i could definitely get hit by a pitch sitting behind the plate and recording,eli yayilixesha endinokufumana ngokuqinisekileyo yi-pitch ehleli ngasemva kweplate kunye nokurekhoda
77,agree frontier culture museum is great in addition i prefer to and i should also pitch my home known for civil war stuff but there are also quite few early as well,vumelana neziko lemyuziyam yangaphambili lemyuzimli inkulu kakhulu ukuba ndikhetha kwaye kufuneka ndilise ikhaya lam lemfazwe kodwa zimbalwa kakhulu kwangoko
78,shut up and do the talking on the pitch,vala kwaye wenze into yokuthetha kwi-pitch
79,why do not these people turn their when these pitch up for a photo shoot i would not be laughing and with who tried to destroy my family is you see it all the time all happy and pleasant show them your,kutheni le nto aba bantu abaphelisileyo xa oku kubhangise i-pitch i-shotoot ndingayi kuhlekisa kwaye ndizama ukutshabalalisa lonke ixesha ukuba wonwabe kwaye kumnandi ukubabonisa eyakho
80,game needs to be put back a few this rain waterlogged the pitch i reckon it will be playable at on,umdlalo kufuneka ubuyiselwe kwakhona le mvula i-terlogic ebekiwe i-pitch ndiyokudlala kuyo
81,at _pitch a by breakdown of the quarters this time with no of,kwi _ptch a ngokuqhekeka kwekota ngeli xesha ngaphandle kwe
82,as a fan i can attest every start was appointment if i had to miss the first half of a game and threw on the and he would a run i was only pitcher i remember where it was more fun watching him pitch than your team hit his performance at stadium,njengomntu fan ndingayifumana yonke indawo yokuqeshwa ukuba bendinokuphoswa sisiqingatha sokuqala somdlalo kwaye ndiphose kwi-facker i-pitcher ndiyikhumbule apho iqela lakho lihle kwibala lemidlalo
83,bring home update lack of in and the lack of a suitable stadium pitch in the borough to accommodate council cabinet discuss indoor outdoor sports facility strategy action plan full article,yiza nokuhlaziywa kwekhaya kunye nokunqongophala kwendawo efanelekileyo yebala kwi-borought ukulungiselela indawo ikhabhinethi yebhunga inika i-indoor yeziko lemidlalo
84,_pitch please resubmit this question on the first of the month we are a of,_pitch nceda uqhubeke kwakhona umbuzo ngenyanga yokuqala siyi
85,i am working backwards from what can get us and have a pitch titled slander,ndisebenza umva ukusuka kwintensi engasifumanayo kwaye sibe nesitokhwe esihleweyo
86,sad that won on a flat pitch with a dodgy ball smashing carelessly on a flat wicket prepared by am i saying it correct a lot of salty say this recently,usizi ophumelele kwi-pitch yeflethi ngebhola ye-dodggy shiya ngokungakhathali kwi-wicket ye-wict elungiselelwe ngu-iccky elungiselelwe yile ndithetha i-sarety eninzi
87,he will do well to find the footy pitch at west terrace in winning,uya kwenza kakuhle ukufumana i-footy pitch kwi-west terrace ephumeleleyo
88,_bot yes from pitch data for see the graph below,_bot ewe kwidatha ye-pitch ukuze ubone igrafu engezantsi
89,i want to bring excitement on the pitch i like to go out and drive at people i am very and always look to get the ball into the box read all about our latest addition here,ndifuna ukuzisa imincili kwi-pitch ndiyathanda ukuphuma kwaye ndiqhube abantu ndihamba kakhulu kwaye ndihlala ndijonga ukufumana ibhola ebhokisini qho apha
90,this is amazing but imagine the pitch meeting,oku kuyamangalisa kodwa khawufane ucinge ngentlanganiso ye-pitch
91,__mcqueen that great i am to attend if the calendar works nothing to pitch but i am always keen to meet new people and see old is it your first time at,__mcqueen endikum kakhulu ukuba ndiye kwikhalenda ukuba isebenza ngaphandle kokuba isebenza ngaphandle kwesandi kodwa ndihlala ndinomdla wokudibana nabantu abatsha kwaye ndibona indala yakho yokuqala kwi
92,calling that pitch run for him,ukubiza ukuba i-pitch ihambe
93,flop because there is not a category beyond f at the club no identity on the pitch no structural cohesion mill spent without a plan atrocious barring or inconsistent erratic football plethora of unwanted broken zero,i-flop kuba akukho nqanaba lingaphaya f kwiklabhu akukho sazisi kwi-pitch akukho nto i-guily guily guard okanye ibhola engafunekiyo ye-zero engafunekiyo
94,my toxic trait is still wanting to sing all the ridiculously high pitch that i could sing effortlessly as a child,umkhwa wam onetyhefu usafuna ukucula yonke i-piech ephezulu endinokuyicula ngayo njengomntwana
95,i want to see if your just as crap at as you are on the pitch,ndifuna ukubona ukuba i-crap yakho njengokuba usekwisitayile
96,first pitch,i-pitch yokuqala
97,the pitch was,i-pitch yayi
98,in a rewrite pitch i m working in i have interrogate on whether this all is him being a better person or this all been a decade long humility lap that he forget about in a century or two,kwi-pitch bhala i-pitch ndisebenza ngaphakathi ndibuza imibuzo yokuba yonke le nto ingumntu ongcono okanye yonke le ishumi elinqabileyo lalilitha ukuba alibale ngenkulungwane okanye ezimbini
99,a beam of light in the pitch black happy birthday my man,i-beam yokukhanya kwi-pitch emnyama usuku lokuzalwa komntu wam
100,abandon shame you are going to have to reach out to many and you will likely get a lot of it can be awkward to pitch yourself and your but you have to move past this you might send and get,shiya ihlazo onokuthi ufikelele kwizinto ezininzi kwaye uya kufumana okuninzi ukuba ungathandeki ukuba uzimise kwaye kuya kufuneka udlule ngaphambili
101,new skill and left footed also plus a bunch of other read the pitch,isakhono esitsha kunye ne-food eshiyekileyo kunye neqela elinye elifundwayo
102,the start today the head out to to face the rival bison first pitch is at,isiqalo sanamhlanje intloko yokujongana ne-cison ye-rion pitch i
103,nobody ever used trash can in in major to alert the of the exact pitch why is cheating such a hard concept for but not for the rest of the country,akukho mntu owakhe wasebenzisa inkunkuma enokuthi alumkise i-pitch eyiyo ukuba kutheni ukukopela ingcinga enzima kodwa hayi kwilizwe lonke
104,the conference is going strong stop by to connect with incredible and alike plus the pitch competition is on now,inkomfa iyayeka ukunxibelelana nengaqondakaliyo kwaye ifana kunye nokhuphiswano lwe-pitch likhona ngoku
105,a beak up y all ever had a tattoo artist reject your tattoo pitch,umlomo ovuthayo y wonke umntu wawukhe waba ne-tattoo i-tattoo ye-tattoo ye-tattoo ye-tattoo
106,on discipline under ten hag i think we that for a while and i think for me the way i see discipline is important for me discipline is not only the way you play on the pitch it s also off the pitch,kwingqeqesho phantsi kweshumi hag ndicinga ukuba okwethutyana kwaye ndicinga ukuba indlela endiyibona ngayo uqeqesho olubalulekileyo kum i-pitch
107,my man winning on and off the pitch,indoda yam iphumelele kwaye iphume kwi-pitch
108,i think the move slows down his pitch the best approach is to keep the arm moving once it,ndicinga ukuba intshukumo inciphise i-pitch yakhe yeyona ndlela ilungileyo kukugcina ingalo ihamba kube kanye
109,how was he they forgot to give him a k bonus which is literally nothing they gave him the money later running to the paper and crying about k when you received m without ever throwing a pitch in professional baseball is comical,bekulibale njani ukumnika ibhonasi engaphambili akukho nto bayimnika imali kamva ebalekela ephepheni kwaye bakhala malunga nokuphosa i-catch kwi-baseball ye-baseball
110,good news until it is is not precisely so nothing wrong with being happy about it while it is good news then getting the pitch out if that down the line,iindaba ezimnandi de ingeyiyo ngqo ke ayisiyonto iphosakeleyo ngokuzonwabisa malunga nexesha elilungileyo emva koko ikhuphe umgca phantsi komgca
111,why is it problem if the other side of the diverse spectrum havent any to add to the pitch then surely the problem is exactly that good heavens here,kutheni le yingxaki ukuba elinye icala le-spectrum dialctunt engakhange idibane kwi-pitch ke le ngxaki ingamazulu amahle apha
112,_nie it a while to feel comfortable a new pitch like that so we have be patient i think if he even it like once every it would be huge,_ine ithutyana ukuba ikhululekile i-pitch entsha enjalo ukuze sibe nomonde ndicinga ukuba kunjalo nakanye zonke ziya kuba zinkulu
113,pick a from the to pitch one inning and let them get lit up for,thabatha i-ave ukusuka kwi-pitch enye i-inning kwaye iyeke ukuba iphunyelwe
114,in business that are easy a domain name building a filing a writing a business plan a pitch deck entrepreneur in your that are hard revenue scale that are really hard profit,kwishishini elilula isakhiwo segama le-domain isakhiwo sokubhala isicwangciso seshishini isicwangciso se-pitch secker kwi-spitrororourourourororourore inzuzo yengeniso enzima kakhulu
115,how good is this to see him back on the pitch,ilungile njani le nto ukumbona ngasemva kwi-pitch
116,_se high pitch from the delicious,_se i-pitch ephezulu evela kumnandi
117,the only you need in a pitch,eyona kuphela oyifunayo kwi-pitch
