,src,trg
1412,in the area will be illuminated in the colors of the national flag national capital will be painted in the hue of national flag befitting the historic occasion of ka,kule ndawo kuya kukhanyiswa kwimibala yeflegi yesizwe yeflegi yesizwe iya kupeyinta kwi-hue yeflegi yelizwe elingumzekelo we-ka
1413,_mafia is it dope,_mafia yi-dope
1414,was anyone but when anyone is forced to let by in any occasion then winning is difficult and the for the,wayekho nabani na kodwa xa umntu enyanzelwa ukuba ayeke ngalo naliphi na ixesha lokuphumelela kunzima kwaye kwi
1415,how adorable are these ballet a variety of hair perfect for any occasion,zinjani na le ballet i-ballet uper yeenwele ezilungele naliphi na ixesha
1416,social birthday beloved husband him as her superman on the occasion of the of my one and only darling husband i celebrate the superman in my life,umyeni wokuzalwa kwezentlalontle umyeni wakhe njengoko i-superman yakhe kumsitho wendoda yam kunye nomyeni wam kuphela endiwubhiyozela i-superman ebomini bam
1417,on sept in occasion of will host a workshop with on open oasis computational fluid dynamics solver simulation open framework architecture registration is now open,kwi-suppment ngamaxesha athile uya kubamba iworkshop kunye ne-oasis complecal solver solver solver solver ukulinganisa ubhaliso loyilo luvulekile
1418,this year s world population day during a milestone year when we anticipate the birth of the earth s eight billionth inhabitant this is an occasion to celebrate our diversity recognize our common humanity and marvel at in health,lonyaka wonyaka wonyaka wokuqala ngonyaka wokuzaliswa kwabasekhaya xa siqhutywa komsebenzi bomgaqo-nkqubo wabasebenzi bokwenza ukwahluka kwethu siqonda ubuntu bethu obuqhelekileyo kunye nemangalisayo
1419,why do you ask i can not imagine you a weak minded wife so am sure she will decide for herself very pretty dress am sure would be suitable for any summer occasion,"kutheni ubuza ndingayicingela umfazi obuthathaka, ukuba ndiqinisekile ukuba uyakuthathela ingqalelo isinxibo esihle kakhulu siqinisekile ukuba ingaba ilungele nasiphi na isihlandlo sehlobo"
1420,elated to be present at the launch of the ambitious cem is super for coaching program seminar at today success guru ak founder chairman academy also the occasion,ikhethe ukubakho kwi-cem yebhotile ye-super kwisemina yenkqubo yokuqeqesha i-guru aksen syelien areamen nawo umsitho
1421,the been,i
1422,no i do not think i would ever had occasion to speak it before,hayi andicingi ukuba bendiya kwakha ndayithetha ngaphambili
1423,thank you what should i do for the occasion,enkosi yintoni ekufuneka ndiyenze ngelo xesha
1424,or i have met a few men who are like that when to the occasion,okanye ndidibene namadoda ambalwa afana nelo thuba
1425,i use 'folks' in however do sometimes till catch myself saying 'hey guys' out loud on occasion agree with tho i do not like being a guy or dude either,"ndisebenzisa 'abantu nangona kunjalo nangona kunjalo, ngamanye amaxesha ndizibambelele esithi' hee 'guis' i-or madlase ngokugqibileyo njengokuba ndingayenzi ukuze ndingayi ukuba ndingayenzi i-tame ndingayenzi indlela yokuziva ngokuxalo"
1426,why is not being splashed all over the news why is the white house not rightfully holding him up for the hero he is on this occasion could it be he was carrying and their narrative completely on its head,kutheni engachithi yonke iindaba kutheni le ndlu imhlophe engayibambanga iqhawe alikho ngenxa yesi sihlandlo lingathi lithwele kwaye lubalisa ngokupheleleyo entloko
1427,get the wedding i m selling on size for,fumana umtshato ndithengisa ngobukhulu
1428,absence excellent occasion new wave,ukungabikho kwelinye icala elitsha
1429,need to dress perfectly for this occasion,kufuneka ndinxibe ngokugqibeleleyo kulo msitho
1430,_avfc_ absolutely for and on the right occasion against the right opposition works for me,_avfc_ ngokuqinisekileyo kwaye kwisihlandlo esifanelekileyo ngokuchasene nenkcaso efanelekileyo isebenza kum
1431,i think on that occasion it was we went to quite a few times as son in law was posted there times,ndicinga ngeso sihlandlo saso sasisiya kumaxesha ambalwa njengoko unyana emthethweni wathunyelwa ngamaxesha
1432,that s great idea special occasion or something aswell,lo mbono omkhulu obonakalayo okanye into engu-asselell
1433,have you been looking for where to get your traditional is your sure plug for all of traditional attire ranging from and for your village and every other occasion,ngaba ukhe wakhangela apho ufumana khona isiko lakho kwi-plug yakho kuyo yonke impahla yemveli isusela kwilali yakho ukusuka kwilali yakho kunye nawo onke amanye ithuba
1434,y all want to respect their word and will only listen to them but when it comes down to it y all come up blank and play dumb in more than one occasion said gender is not something that his attraction to someone so tell me where in world is that being straight,y bonke bafuna ukuhlonipha ilizwi labo kwaye baya kubaphulaphula kuphela kodwa xa kuvela kuyo y ufike kungenanto kwaye badlala isisidenge ngaphezulu kwesinye isini nomntu othile ukuba ngqo
1435,are classy and hardy for any occasion or or or a run around town,ngaba i-classy kunye nelukhuni ngalo naliphi na ixesha okanye okanye okanye okanye idolophu ejikeleze idolophu
1436,get the party cocktail i m selling on size m for,fumana i-cocktail yeqela ithengisa ngobukhulu m
1437,the the mechanic are those which we have occasion for in a young country as yet simple and not far advanced in luxury altho perhaps much too far for her age and character,umatshini wamachwephesha ngabo sinaso isistim kwilizwe elincinci okwangoku kwaye bangakude kakhulu kwi-tobsho enesifo se-altho mhlawumbi kakhulu kangako ixesha lakhe kunye nomlinganiswa wakhe
1438,the last time and home at same time as set for rare occasion,ixesha lokugqibela kunye nekhaya ngexesha elinye njengoko kusekwe ithuba elingaqhelekanga
1439,striking and versatile it is no wonder our gorgeous golden collection is one of our most iconic at the collection of links the unbreakable bond of love is a stylish addition for any occasion click the link to shop,ukubetha kwaye kuguquguqukayo ayimangalisi ingqokelela yethu entle yegolide yenye yezona zinto zibonakalayo kwingqokelela yothando lothando olungenanto kulo naliphi na ikhonkco cofa ikhonkco kwivenkile
1440,watch on the occasion of diamond jubilee of th independence day of _ _,jonga kumsitho we-jeyimani ye-digleind yosuku lwendwendwe ye-th _
1441,celebrate the good times to the the and the first time the well summer birthday and welcoming new to help you celebrate every occasion check out this collection of ice cream inspired,bhiyozela amaxesha amnandi kwi-o kwaye okokuqala ukuzalwa komhla wokuzalwa kwehlobo kwaye wamkelekile ukukunceda ubhiyozele ngalo lonke ixesha lokuqokelelwa kwe-ice cream
1442,will you be joining us celebrate with us as the queen is baton through enjoy in our new garden bar or dine in our no to mark this historical occasion,ngaba uza kusijoyina nathi njengokumkanikazi u-baton ookonwaba kwibar yegadi yethu entsha okanye edyokhokho ukuba ungaphawuli esi sihlandlo sembali
1443,i want to be with you on this occasion,ndifuna ukuba nawe ngalo mcimbi
1444,shop with us today just simplicity let s make your next occasion a memorable one just a,thenga nathi namhlanje
1445,i am the same so then the next is me screaming at my team for of the following solo solo being toxic after they half way across the map bold wraith the last is a very rare occasion but sometimes i just have enough of those sweaty mf is,ndinjalo ke ngoku emva koko kum ndikhala kwiqela lam ngenxa yezi zinto zilandelayo ziyityhefu emva kokuba zisiqingatha semephu ye-preith siyinto enqabileyo kodwa ngamanye amaxesha sine
1446,mere narration bare utility are not art or are only art in a rudimentary sense only the man of little wit can fail to recognize that art by nature is a well spring of delight whatever may have been the occasion of its appearance on the other hand there cannot be,ibalisa nje engenanto ayiyobugcisa okanye i-ard kuphela kwingqondo ye-gesimentiry kuphela umntu onobuqhetseba ngendalo iyonwabile nayiphi na into enokubakho yiba
1447,_io imagine you can have your wallet address with great occasion to own unique which you to create as many as you wish for free dome,_ie ucinge ukuba unokufumana idilesi yakho ye-wallet enesakhiwo esikhethekileyo sokuba wenze okohlukileyo kangangoko unqwenela i-imeyile yasimahla
1448,to all bhakta and on the auspicious occasion of in month do visit nearby temple and feed dogs to get of lord,kuzo zonke i-bhakta kunye nexesha eliyingozi lenyanga lindwendwela itempile ekufuphi kunye nezinja ezondla ukuba zifumane inkosi
1449,our from have a new showroom in a space with an impressive revolving around the philosophy for this occasion they have featured our elegant and sophisticated in black natural sand,i-shina lethu linendawo entsha yegumbi elitsha kwindawo enengxaki yokujikeleza intanda-bulumko ngesi sihlandlo sibe siyibonisile i-terbing yendalo
1450,received the rare double up from _ on at least one occasion i can confirm he is indeed a guy and also even more deserving of your man crush than you d first thought,ifumene i-raare iphindwe kabini ukusuka kwi-_ kwisihlandlo esinye nje esinokuqinisekisa ukuba ungumntu ongumntu kwaye ufanele ukutyhobozelwa yindoda yakho kunokuba ucinge kuqala
1451,book puja mantra and on august on the auspicious occasion of individual puja for more click below,incwadi yasepuja mantra kunye ne-agasti kwitheko eliqinisekileyo le-puja enye yokcofa ngaphezulu
1452,on the occasion of world brain day we are in the whole week and marking as brain week day activity club of a great interaction with everyone,ngomsitho wosuku lobuchopho sehlabathi sikulo veki yonke kwaye simakisha njengoko i-veki ye-veki ye-veki ye-geams ye-geams yeklabhu ye-club deby yentsebenzo enkulu kuye wonke umntu
1453,_rao i hear you it is so tempting that i my son 'bro' on more than one occasion to which i got a look of 'are you me ',_rao ndiyakuva oko kuhenda ukuba ndililinga unyana wam 'ngaphezulu kwesihlandlo esinye ndifumene inkangeleko yokuba' nguwe '
1454,respect but no hero worship speech at the occasion of the solemn pledge of in,ntlonipho kodwa akukho ntetho yokunqula yehoro nge-herote kwisithembiso se
1455,today another occasion when i wear my black tie to a funeral life goes on i know but the pause to celebrate a life well lived does help one reflect on own,namhlanje elinye isihlandlo xa ndinxiba i-tie yam emnyama kumngcwabo wobomi obuyaziyo kodwa i-pause yokubhiyozela impilo entle iyonwabisa
1456,that it handed over to on the occasion of day celebration at the defence of both the are well known to the world,inikezwe ukuba inikelwe kumnyhadala womhla wokubhiyozela
1457,_dbc i agree with your work only ever me even from and ago still crop up on occasion and stand the test of time quite well,_dbc ndiyavumelana nomsebenzi wakho kuphela ondikhe ndaphuma kwaye ndisanda kunzima ngamaxesha ngamaxesha kwaye ndimi uvavanyo lwexesha kakuhle
1458,to on the occasion of day in s capital new the bilateral b w both the are best,ukuya kumsitho wosuku lwe-sat camt
1459,you are here again dreamer to what do we owe the occasion are you running out of time,ulapha kwakhona ukuba uqaphele ukuba sityala ntoni esi sihlandlo ukuba uphelelwe lixesha
1460,he handed over a letter to arena other on the occasion which said all the wrong about the security protecting guarding look who is talking the one who the voice of those living in under pak is oppression,unike ileta eya kwi-arna kwi-arna malunga neso sihlandlo esithile malunga nokhuseleko malunga nokhuseleko lokukhusela inkathazo kwabo bathetha ngoyena mntu ufumana i-pak
1461,we to enliven pop a show cheerfully guarantee it could throw away the boredom today s broadcast went well with that atmosphere you can listening to our everywhere you go funny chatter would maintain a positive mood in every occasion,sikhuphe i-pop shot iqinisekisa ngenkani ngenkuthalo i-suredom ihambe kakuhle nale meko unokuphulaphula naphi na i-comnan yakho yonke i-chatter i-chatter igcina i-chatter eyahlukileyo kuyo yonke imvakalelo
1462,_darthseanobi one argument is not abuse abuse is usually a pattern of behaviour like we see with and his or the way that out of control when he got angry on more than one occasion he spoke about wanting to punch people,_darthsenobi enye ayixhaphaza gwenxa kudla ngokusebenzisa indlela yokuziphatha esifana nokubona kunye nendlela eya kulawula ngayo xa wayethetha ukuba afune abantu
1463,everyone and their dog will just keep selling everything at these low bigger the dip the bigger the occasion to get awesome,wonke umntu kunye nenja yabo baya kuhlala bethengisa yonke into kwezi zisezantsi i-dip enkulu i-dip enkulu i-dip enkulu inesithuba sokufumana into entle
1464,afternoon tea is a time to slow down enjoy good company and appreciate some of life is simple whether you choose a simple cream tea or the full works with champagne afternoon tea at is an occasion to savour book here,iti ye-ite lixesha lokucothisa inkampani elungileyo kwaye ubuthande umntu olula nokuba ukhetha iti yekhrimu elula okanye imisebenzi epheleleyo ye-champagne ye-champagne emsungulekayo
1465,hey get ready the trend on on occasion of in film industry wishing all success of love,hey fumana i-tendor ngexesha elithile le-filimu inqwenelela yonke impumelelo yothando
1466,unless you bought all of your custom birthday for the occasion this is stupid,ngaphandle kokuba uthenge yonke imihla yokuzalwa yakho yesiqhelo kumsitho osisidenge
1467,on the occasion of world brain day we are in the whole week and marking as brain week day activity a great interaction,ngomsitho wosuku lobuchopho lwehlabathi sikulo veki yonke kwaye simakisha njengoko umsebenzi weveki ye-geam duster indawo yokugqibela
1468,crackers are harmful only on the occasion of,i-crackers inobungozi kuphela kumsitho we
1469,_ na ya but he rose to the occasion,_ na! wavuka kumsitho
1470,special assistant to president passing out parade at police training college minister the parade of district were also on the occasion,umncedisi okhethekileyo kumongameli edlulayo kwi-pardes edlulayo kwikholeji yoqeqesho lwamapolisa i-parade yesithili yayikwisihlandlo
1471,han is to start in the mediterranean next month told a ceremony in the republic of northern on the occasion of peace and freedom day,i-han kufuneka iqale kwimeditera kwinyanga ezayo ixelele umsitho kwiriphabhlikhi kumaxesha oxolo nenkululeko
1472,non staff in the course reps in the people in charge of food in an occasion church they act as if they are the biological of god while the rest of us were adopted the best friend to a rich man,abasebenzi abangekhoyo esikolweni iphindaphindwe ngabantu abaphethe ukutya ngecawe yecawe basebenza ngokungathi yimidlalo ye-us yamkela umhlobo osenyongweni
1473,indeed it s good for the soul and if you see them around you can say a warm hello although i sometimes find the ex client a little awkward on more than one occasion an ex client returned to the fold,inene ilungele umphefumlo kwaye ukuba ubabona bakujikelezile ungathi i-hello efudumeleyo nangona ndifumana i-ex i-ex ingathandeki kangangesihlandlo esinye ibuyisiwe kwisibambiso
1474,_twt i remember a friend of mine talking about that same place they were doing a road trip on their harley is and they said that the 'push' the hell out of them it to me on more than one occasion when you are on two it scary fast,"_twt ndikhumbula umhlobo wam ukuba athethe malunga nendawo enye ababesenza uhambo lwendlela eharley, kwaye bathi 'batyhale' isihogo sakum ngaphezulu kwesihlandlo esinye xa usesoyikisa ngaphaya kwesinye isihlandlo ngokukhawuleza"
1475,everyone and their dog is going to most likely keep everything with these low bigger the dip the the lifetime occasion to get great roi,wonke umntu kunye nenja yabo iyeza kakhulu ukugcina yonke into ehamba incinci i-dip i-dip i-dip the rip the right upoine
1476,what a party great is seeing your turn up in your as a brand one of our at _garments is to provide unique custom made to suit all to see our grace your occasion in from past and present,ipati enkulu ibonayo ivela kuwe njengophawu lwe-_garments yethu ukubonelela ngokwesiko elikhethekileyo elenziwe ukuba lilulungele konke ukuba livele kwixesha elidlulileyo kwaye sikhona
1477,with and away to park is the only place to be in the city on massive occasion for us and would love to see a huge crowd to support the,ngamka ukuya kupakishe kuphela kwendawo esiya kuyo esixekweni kwisixeko esininzi kuthi kwaye sithanda ukubona isihlwele esikhulu ukuze sixhase
1478,there s that symbol again and on this occasion it s from,kukho umfanekiso kwakhona kwaye kwesi sihlandlo ivela
1479,_mbango _kayumba interesting find the community avoid the chicken in almost all the occasion that include dowry among because they still hold strong about eating the chicken with they prefer beef as a neutral meal such,_mbungo _kayeumba unomdla wokufumana uluntu luphepha inkukhu phantse kuwo wonke umntu obandakanya i-dowry phakathi kwenkukhu kunye nokuba yinto engathathi hlangothi enjalo
1480,_mafia log on to their and order get it to you it will be and authentic,i-_mafia ungene kwi-odolo yabo kwaye iodolo uyifumana kuwe iya kuba kwaye inyani
1481,__sub a legend at every occasion,__sub yintsomi ngelinye ixesha
1482,team is for tournament on the occasion of team announcement president the support given by to promote the in _odisha _odisha,iqela leqela lolimo kumsitho weqela lokubhengezwa kweqela inkxaso enikezwe kukukhuthaza i-_isha _isha
1483,well we have to choose in the sense that on any one occasion we can only say one or the other unless we want to always make the same tedious joke,kuhle kufuneka sikhethe ngengqondo yokuba nangasiphi na isihlandlo esinokuthi sithethe enye okanye enye ngaphandle kokuba sifuna ukuhlala siphumile
1484,in camp area on the occasion of th foundation day the main branch distributed one time is meal mineral water bottle and one sweet among the mentally visually pavement the poor and the destitute,kwindawo yasenkampini malunga nexesha lemini yesiseko isebe eliphambili lisasazwe ixesha elinye ibhotile yamanzi amaneral kunye nengwele enye phakathi kwengqondo yengqondo kunye nexhoba
1485,go to the evidence in the and you will find them there in more than one occasion she him wine and whisky and when he she insist they were both,yiya kubungqina ngaphakathi kwaye uya kubafumana apho kwizihlandlo ezingaphezu kwesihlandlo esinye sakhe iwayini kunye newhiskey kwaye xa anyanzelisa bobabini
1486,the railway came dressed as popular freedom of to on to mark d beginning of the ka d th year of india is independence mail express train was also fully decked up for d occasion is also visible,uloliwe wanxiba njengenkululeko edumileyo yokuqalisa ukuqalisa komnyaka waseindiya yi-independent act specience accound ikwayekisiwe ngokupheleleyo
1487,cheer up your occasion with our and printed,hlaziya ithuba lakho kunye ne-uprinte
1488,many add the name of the child to a clothing item but you can also write a special occasion message such as 'happy birthday ',uninzi longeze igama lomntwana kwimpahla yokunxiba kodwa ungabhala umyalezo owodwa onjengomhla wokuzalwa 'owonwabileyo'
1489,_rpt i am not so sure it is all that easy to argue hardship my dad is always getting times now and apart from one single occasion his hardship have always been despite him needing to drive round to as part of his business,_ ingaqinisekanga ukuba ndiqinisekile ukuba konke kulula ukuphikisa ubunzima utata wam kuhlala kuthatha amaxesha ngoku kwaye kungekho sihlandlo esinye ubunzima bexesha elinye kusoloko kukhona nangona ufuna ishishini kwishishini lakhe
1490,read jake s reaction to becoming s first male winner of a global middle distance gold since coe at the plus his dad s take on a wonderful family occasion _times,funda i-jake s rection ukuba nguwe ophumeleleyo kwigolide yomgama ophakathi kwehlabathi ukusukela kwi-coe kwi-coe kwi-coe kwi-dibanisa utata wakhe othatha ixesha losapho olumangalisayo
1491,looking for a fun and creative way to entertain your a photo booth is the perfect option photo booth high quality photo that are perfect for any occasion click here,ukujonga indlela emnandi kunye neyolisayo yokuzonwabisa i-photo pooth yi-booti yefoto yeyona foto igqibeleleyo ye-booti ephezulu yefoto egqibelele kulo naliphi na ixesha cofa apha
1492,last march on the occasion of the international day for the elimination of we met a group of fighting against racial discrimination in here you can hear their on legal framework,ngomhla wokugqibela malunga nosuku lwamanye amazwe ngokupheliswa kwethu sidibene neqela lokulwa ulwaphulo-mthetho oluhlanganisiweyo apha ungayiva ngenkqubo yezomthetho
1493,h e of the on consumer law and policy on the occasion of the voluntary peer review of the secretariat and supporting international on consumer protection,h e kamthetho wabathengi kunye nomgaqo-nkqubo malunga nokuphononongwa kwentloko yepenta ngokuzithandela ye-feeriariat kunye nokuxhasa ihlabathi kintertional kukhuseleko lwabathengi
1494,happy birthday larry who would have been today to mark the occasion are running of larry at paradise garage between on their house radio station head to their to listen time to hear these,usuku lokuzalwa olumnandi ularry owayeya kuba nanamhlanje ukuphawula itheko liqhuba i-larage kwigaraji yesikhululo sikanomathotholo kwi-radio yendawo yokumamela
1495,u can imagine since i live in that are completely dominant and this public transportation is never reliable really wish that was not the case taking the train somewhere is like a special occasion for me,ungacinga ukuba ndihlala kule nto ilawulwa ngokupheleleyo kwaye ezi zithuthi zikawonke-wonke azinakuthembeka kakuhle ukuba bekungayi meko ithatha inxaxheba kwenye indawo
1496,yes absolutely that is what we do on the rare occasion we get a cheque cash we just spend,ewe ngokupheleleyo yile nto siyenzayo kwi-rare trite sifumana i-sket sokhe sicki sisetyenzisiweyo
1497,neo to play around but on occasion she also people on her side owing her a favor or two with her smirk the mute let hush on one of her arms and then she for the other to follow her if he choosing to follow her,i-neo yokudlala ngokujikeleza kodwa ngamanye amaxesha unabantu kwigumbi lakhe elinetyala lakhe okanye ezimbini nge-smirk yakhe makamlandele enye yedwa emva koko ayokumlandela ukuba alandele
1498,of the republic _fiala sent a congratulatory message to the on the occasion of the statehood day,yeriphabhlikhi _fiala uthumele umyalezo wokuvuyela kwithuba lomhla wosuku
1499,thanks mate on occasion i need to remind myself of this too easily done but some go way to far who are generally bad at trading,enkosi maqabane ngamaxesha ngamanye amaxesha kufuneka ndizikhumbuze kakhulu ukuba kwenziwe lula kodwa abanye bahambe bahambe bakude kwezorhwebo
1500,and best on the occasion of the national day of the republic of looking forward to continue friendly in all of common interest and to deepen the between within the international and,kwaye kulunge kwixesha losuku lwesizwe lweriphabhlikhi ekhangela phambili ukuqhubeka nobuhlobo kuyo yonke inzala eqhelekileyo kunye nokwenza nzulu phakathi kwamanye amazwe kwaye
1501,henry is really a competent music director very responsive he can play any music at any place at any occasion the way he quickly put on,uhenry ungumlawuli ofanelekileyo womculo ofanelekileyo ukuba angakwazi ukudlala nawuphi na umculo nangaliphi na ixesha ngalo naliphi na ixesha ngendlela awakhawulezayo
1502,only on occasion brother,kuphela ngomzalwana kuphela
1503,last year on _e_khum occasion bless us with the freedom of our revered leader h a son of imam may bless him and prolong his life till the of imam make us among his faithful,kunyaka ophelileyo kwi _e_khum sisikelele ngenkululeko yenkqqo yenkweyinte yethu ombonise inkokeli yethu ononyana ka-imam unokusikelela kwaye ayenzele ubomi bakhe athembekileyo
1504,i am a failure and i should have k w o r d e d m y s e l f when i had the occasion,ndisilele kwaye kufanele ukuba ndibene k o y o d m y y y o l f xa ndinomsitho
1505,that is ridiculous linked up well with last night needs to use his long throw on the odd occasion,oko kukuhlekisa kakuhle ngobusuku bokugqibela kufuneka basebenzise ixesha elide lokuphosa ixeshana
1506,i agree first time i have had but when go this badly wrong good communication is critical and i think they have been found wanting on this occasion,ndiyavuma okwesihlandlo sokuba ndinayo kodwa xa ndisiya oku gwenxa unxibelelwano olubi kakhulu kubalulekile kwaye ndicinga ukuba bafunyaniswe bafuna ngesi sihlandlo
1507,_seeker what is the occasion,_seeker yintoni inyathelo
1508,_swindon i hope well tanked up for the occasion too,_swindon ndiyathemba kakuhle
1509,i up to the door of goblin house and it automatically i stepped inside and was immediately by a horde of crazy they were dancing around and singing it was a joyous occasion and i could not help but smile,ndiye emnyango wendlu yegoblin kwaye ngokuzenzekelayo ndangena ngaphakathi kwaye yayiyi-horded nge-horde ye-comzy yayingqungqweni kwaye ndiyicela ukuba ibe yinto yovuyo
1510,seven deadly full metal alchemist manga,i-alchemist epheleleyo yentsimbi epheleleyo yentsimbi
1511,not on this occasion just a very tenuous link to celebrity you did specify minor as opposed to z list also not a car pun,hayi kule thuba nje i-nuecly ikhonkco elinodumo olikhankanya njengokuba uchasile kuluhlu lwe-z
1512,the first title in the society s book series was ago this autumn now to mark the occasion past and have come together to reflect on the series high quality geographical since,isihloko sokuqala kuphumezo lwencwadi yombutho wawokuqala kudala ukuba ikwindla ngoku ukumakisha umsitho odlulileyo kwaye ndidibane ukuze ndicinge ngoluhlu oluphezulu lwejografi
