,src,trg
2150,but the being d up was enthralling a peek into what they re thinking on every pitch,kodwa umntu u-d up wayenomdla kwi-peek kwizinto abazicingela kuzo zonke izitokhwe
2151,for the entrepreneur in you the show the pitch this week in how to start a the school of greatness with lewis which do you listen to this is why you should listen to reduce your screen time,ngomrhwemi onomvelisi obonisa i-pitch kule veki ngendlela yokuqalisa isikolo sobukhulu kunye ne-lewis omamele ngaloo nto ukuba kufuneka umamele ixesha lakho lesikrini
2152,oh no that s t part of the pitch,oh hayi inxalenye yesandi
2153,understandable i will add it to our evergreen pitch call list for now,iyaqondakala ndiza kuyilungisa kuluhlu lwefowuni yethu ye-pitch ngoku
2154,who is all these i take a tony brown inning win any day of the week nobody the pitch count because we can t count that high,zonke ezi zinto ndizithatha i-tony i-toning win iphumelele nayiphi na imini yeveki akukho nto ibalulekileyo kuba sinokubala
2155,best league in purely for what off the pitch,i-league yelign yento ecocekileyo
2156,such a delight to chat with about everything from our pitch past to our mutual obsession with and of course her amazing book of violet one of my favorite of,ulonwabo olunjalo lokuncokola malunga nayo yonke into ukusuka kwi-pitch yethu yangaphambili ukuya kuthi ga ngokuhambelana nencwadi yakhe emangalisayo ye-violet enye ye
2157,everyone is getting involved i think we are very well for the new season we work very hard the interpersonal in our team are also good we want to show everything we have got on the pitch against,wonke umntu uyabandakanyeka ndicinga ukuba sinexesha elitsha esisebenza nzima sisebenza nzima kwiqela lethu ukuba sifuna ukubonisa yonke into esinayo
2158,i am trying to collect a few social police health to speak about trauma and work at a charitable event at would u pitch in,ndizama ukuqokelela impilo yamapolisa embalwa yokuthetha malunga noxinzelelo kwaye ndisebenze kwisiganeko esibonisa ukuba ungayifaka
2159,one of the best in this season quality on and off the pitch,enye yezona zinto zintle kolu nyaka wexesha lokuphumla nangaphandle kwesandi
2160,even when he he be on a pitch count most of the rest of the season lots of five inning,nokuba ubekwe kwi-pitch ukubala uninzi lwexesha lokuphumla kwe-intshi ezintlanu
2161,going on i hate about you nothing hill mamma legally blonde pitch perfect the devil bring it on princess,ukuqhubeka ndikuthiye ngawe akukho nto imbi ye-mbill mamma ye-blonde ye-blonde ye-blonde ye-bitch igqibelele umtyholi
2162,chasing the bull with an invitation that slowly us closer and closer to madness itself s voice and characteristic music us in like the pitch of his character save now due out th,ukugxotha inkunzi yenkunzi enesimemo esisondela kancinci kwaye sisondele ngakumbi kwilizwi kunye nesimo esibonisa ukuba sisimo semilinganiselo yakhe
2163,we re extending the pitch deadline for our winter issue to polish up your and send them our way,sindisa umhlaba obekiweyo we-pitch ye-ping ebusika i-piller up up kwaye ithumele indlela yethu
2164,_league_en i think there s a reason why this when some of the most popular on the planet are on the pitch rather than a j league match where the general public can t even name a single j league player,_league_en ndicinga ukuba kukho isizathu sokuba le nto xa ezinye zezona zithandwayo zikwindawo enomdlalo we-league apho uluntu ngokubanzi lunokulinika i-nay player player
2165,no that is the swing that is taught no matter where pitch is,hayi oko kukuntywila okufundiswayo akukhathaleki ukuba
2166,game pitch ratchet clank but with the presentation of grand theft auto,i-game pitchet ratchet i-clank kodwa inomdlalo wobusela obugqibeleleyo
2167,they definitely can be wasted but at least they are likely to come in and their k can offset not going a full inning the big thing for me is if i am a starter that is going to pitch in a relief role is that i want a guy with stuff that would play up in inning work,ngokuqinisekileyo banokuchithakala kodwa ubuncinci kunokwenzeka ukuba bangene kwaye bakwazi ukuyeka ukungahambi kakuhle i-inning epheleleyo into enkulu kum kukuba ndisisiqalo esiya kufuna indonda ngezinto ezinokudlala ngomsebenzi we-inning
2168,i just know who egg jeopardy like who would let pitch this idea and go yea that good do it,ndiyazi nje ukuba ngubani ongekaniqade ongekalanga njengaloo nto banokuvumela le mbono kwaye uhambe kanjalo
2169,we were delighted to host an u surrey junior cricket championship match between and last night which finished with a comfortable win for we hope both on our beautiful chapel field pitch,sakuvuyela ukubamba i-u rounity juniory fackiord pairtionship yomdlalo phakathi kobusuku ophelileyo egqitywe ngethemba lokufumana i-chapel yendawo yethu entle ye-chapel chapt
2170,_ it is just nice to see him on a football pitch again,_ kumnandi nje ukumbona kwi-pitch yebhola kwakhona
2171,watch for the low inside pitch and pull it hard at him then,jonga i-pitch ephantsi ngaphakathi kwaye utsala nzima kuye ngelo xesha
2172,_end_pub as our backup most likely do not want to see anywhere near the pitch,_end_pub as our backup most likely do not want to see anywhere near the pitch
2173,no your wrong tony it was not that at all because he to change his shirt know what i mean when he came back onto the pitch i a different shirt immediately so do you now understand what i am saying no one needs to know his toilet habit whilst we are eating,akukho nyhani yakho ephosakeleyo yayingeyiyo into yokuba itshintshe ihempe yakhe iyayazi into endiyithethayo ngokukhawuleza ukuba ndingazi mntu batya
2174,seeing progress being made in country off pitch as much as on it alignment between also running into media approach with full list ahead of season great engagement for media content,ukubona inkqubela phambili eyenziwayo emazweni e-pitch ngokungahambelaniyo phakathi kwendlela yemithombo yeendaba ngoludwe olupheleleyo lwexesha lonyaka
2175,personally do not like that stuff if they all perform on the pitch then fine but otherwise they should spend more time their,ngokwabuqu aziyithandi le nto ukuba bonke basebenza kwi-pitch emva koko banokwenza ixesha elingakumbi labo
2176,our under s are back in action this evening against u s kick off on the cricket pitch,i-sars yethu ibuyile isebenza ngokuhlwa ngokuchaseneyo ibhola kwi-cricket
2177,first of all was like my main theme up til and i adore him as an individual everyone his perfect pitch i get that it s amusing but with the way he there s something about them that don t sit right to me,okokuqala kwakufana nomxholo wam ophambili kwi-til kwaye ndiyamnqula njengomntu wonke umntu ogqibeleleyo ndifumana ukuba ihlekisa kodwa yiyo into ayiyo
2178,the green venture aspiring angel drawn from the across on how to start as angel to join sign up here,ingelosi eluhlaza ye-anting etyhidiweyo ivela kwi-phele malunga nendlela yokuqalisa njengengelosi ukuba ijoyine apha
2179,the green event is back on august at the green by our partner will be pitching their to trained,umsitho oluhlaza ubuyile ngo-agasti kuluhlaza okwenziwa ngu-agasti qabane lethu uya kuba utyala ukuba aqeqeshelwe
2180,thinking of covering porter robinson is everything goes on but i struggle with the pitch of the instrumental it is a too low for me but it distorted for some reason,ukucinga ngesigqubuthelo seporter birden yiyo yonke into eqhubekayo kodwa ndisokola nge-pitch yesixhobo esiphantsi kakhulu kum kodwa igqwetha isizathu esithile
2181,she s made a pitch for it,uye wenza isitayile sayo
2182,a swap of venue for next friendly v our redding way pitch is not quite ready yet due to a burst water main and a murder of angry thankfully the management at have stepped up and the venue,ukutshintshwa kwendawo ngeendawo ezinobuhlobo ezilandelayo v i-pitch yethu yokurekhoda ayikakulungelanga kodwa ngenxa yendawo enomsindo ephambili kunye nokubulawa komsindo kunothando.
2183,let the worst bull pen in each league at the pitch the entire game,vumela ipeni yenkomo enkulu kwiligi nganye kwi-pitch wonke umdlalo
2184,he s going to be fun or totally should scored i m worried he not live up to the excitement he on the pitch could be another jet potential to be great,uyonwaba okanye ngokupheleleyo ukuba i-pit ikhathaze i-m anikhathalele ukuba angaphili ngokuchasene nemincili enokubakho elinye i-jet
2185,the angry ghost of the pitch now,isiporho esinomsindo sesandi ngoku
2186,if i don t know you there s percent chance i m care about your project be a human being before you try to pitch me thank you for coming to my ted talk,ukuba andikwazi na apho i-spre yethuba le-m i-m ukhathalela iprojekthi yakho ukuba ngumntu ngaphambi kokuba uzame ukundibambezela ngentetho yam enkosi
2187,enjoy the st leg duel between dynamo and we expect an exciting match with many goal scoring on both sides of the pitch visit for special and for a preview visit gamble responsibly,yonwabela i-st umlenze we-st umlenze phakathi kukadynamo kwaye silindele umdlalo owonwabisayo onamanqaku omabini omabini okutyelela okhethekileyo kunye nokujonga kuqala
2188,i know shoulder joint may not interest you but it will soon enough you may want to learn how to pitch a baseball i know these people abhor science but start with coach newton follow the baseball,ndiyazi ukuba igxalaba lidibeneyo alinakukwazi ukuba nenzala kodwa kungekudala liza kufuna ukufunda i-baseball ye-baseball
2189,your pitch deck this not just but in the often are before or after the call or by team who t hear the pitch are looking for clear around which to make a go no go so at times an issue may,i-pitch yakho ye-pitch engakho kodwa rhoqo ngaphambili okanye emva komnxeba okanye ngeqela eliva ukuba i-pitch ijonge ukuba ihambe i-gon god
2190,sorry can t wait to see you pitch next year,uxolo lungalindile ukuze ubone i-pitch kunyaka olandelayo
2191,exactly it is a positive mentality now i just hope our do not turn on him if we do not go up straight away we just want to see connection on and off the pitch,ngokuchanekileyo yingqondo eyakhayo ngoku ndiyathemba ukuba ithemba lethu alimjikela kuye ukuba asihambi ngqo ngqo kufuneka sifune ukunxibelelana kwaye siphume kwi-pitch
2192,best division off the pitch in football,i-diances elona candelo liphezulu kwi-pitch kwibhola ekhatywayo
2193,stoner cricket week traditionally place on the first week of the summer when stoner an team in host visiting on the mem pitch this year the week ran from view here,iveki yefricket stoner ngokwesiko kwiveki yokuqala yehlobo xa isuka kwiqela elibambayo kwi-titch ye-mem kulo veki
2194,fantasy novel pitch warren white house in filibuster is mass protest in push to vote with same for the planet,i-novesy ye-novesy i-inren worten house house kwi-filibusters iqhankqalazi kakhulu kwi-push ukuya kwiplanethi yeplanethi
2195,what is the most common type of pitch thrown by in baseball answer,luluphi olona hlobo luqhelekileyo lokutsalwa kwendawo ephoswe yi-baseball mpendulo
2196,pitch invasion by photographer sander,ukuhlaselwa kwe-piitch ngumfoti womfoti
2197,it is true i am a coach for a competitive travel team in all you see are out every pitch and trying to learn that are only thrown on strike and trying to launch it that and miss time with sore arms they all have sore arms,kuyinyani ukuba ndingumqeqeshi weqela lokuhamba okhuphiswano kuyo yonke into oyibonayo ikhuphe yonke i-pitch kwaye ndizama ukufunda oko kuphoswayo kwaye ndizama ukuyifaka iingalo zentlungu
2198,no where near comparable range horrible technique horrible pitch control saying they have a comparable range is like saying bolt and i are comparable because our mile run is only a minute difference say you prefer bad all you want but she s not a good singer,hayi apho kufuphi kufutshane ne-forarique eyoyikisayo yolawulo loyilo oluthe koyikekayo esithi banoluhlu oluthelekiswayo lufana nolwahlulo lwe-bile kuphela yiyo yonke into oyifunayo kodwa akayimvumi elungileyo
2199,_aim i hope i m wrong but it he t want to pitch this year knowing he s a free agent,_aim ndiyathemba ukuba ndiphosakele kodwa ifuna ukufaka isiphelo kulo nyaka ukwazi iarhente yasimahla
2200,_of entertainment should remain entertainment these never worked a day in their and should just hit pitch and catch the ball and stop and,ukuzonwabisa kufuneka kuhlale kuzonwabisa okungaze kubekho usuku lwabo kwaye kufanele ukuba kubetha i-pitch kwaye bamba ibhola kwaye bayeke kwaye
2201,park in one of the most picturesque golf you may even see the resident coyote find out more here,ipaki kwenye yezona golf geli onokuthi ubone i-coyote yomhlali fumana ngakumbi apha
2202,the idea for the story came from a prompt for wattpad is open novella contest about three hunting but then facing something unexpected i would pitch the as eastern supernatural the first few x x the game,imbono yebali ivela kwi-witppad ivulekile i-novelda yokhuphiswano malunga nokuzingela ezintathu kodwa emva koko ijonge into engalindelekanga ndiza kukhalimela i-ergan sport embalwa
2203,_ are not equally as good as you could make a yard pass to someone and they could run the pitch and score and you get an assist for it,_ akukho bungozi ngokulungileyo njengoko unokwenza i-iyadi idlule emntwini kwaye banokuqhuba i-pitch kunye nenqaku kwaye ufumana uncedo kuyo
2204,the speen will choose on the in the sixth match of the cricket league,i-steen iya kukhetha kwimidlalo yesithandathu yecricket league
2205,from other on twitter it is a pro publicity pitch v one sided,ukusuka kwenye i-twitter yi-pitch yoluntu i-v
2206,so much intervention from the western miserably in the past what would it take to realize there is trust issue how can we offer stability when we are unstable what is your pitch to keep trusting west and not china listening,ungenelelo oluninzi ukusuka entshona kangaka ukusuka edlulileyo kwixesha elidlulileyo ukuba lingakanani na ukuba kungazinza njani uzinzo xa singazinzanga ukuba sihlale sithembele kwintshona kwaye hayi i-china yokumamela
2207,i did a short story a while back and am currently a graphic novel to pitch with the go read my short about a guy that can punch,ndenze ibali elifutshane okwethutyana kwaye ngoku ndilineveli yegraphic pitch nge-pitch nge-fundela funda malunga ne-punch
2208,why should you travel the world to play slow pitch,kutheni ufanele uhambe ihlabathi ukuba lidlale i-pitch ecothayo
2209,focus on your own club going on off the pitch,gxila kwiklabhu yakho ihamba kwi-pitch
2210,would rather put on any spare bit of grass we have had to train on a grass bank while our pitch was getting work done on it in the past i do not know anywhere where a could just pick up a ball with his and chuck their down for and have a game,ndingathanda ukubeka nayiphi na inkcitho yenkcitho yebhanki ngelixa i-pitch yethu yayikukufumana umsebenzi wexesha elidlulileyo andikwazi na apho umntu anokuthatha khona kwaye ube nomdlalo
2211,if you connect only to send me a message that thanks for here is my pitch for my business and let set up a time to talk you get an instant block your belie the claim that you are paying attention to my activity here be,ukuba uqhagamshele kuphela ukuba undithumelele umyalezo onkosi apha yi-pitch yam yeshishini kwaye umise ixesha lokuthetha ufumana ivimba ukuba unikezela ingqalelo kumsebenzi wam apha
2212,yeah it more about them than about they never learn but they could not resist but we just stay cool he will show the answer on the pitch and when it really maybe they are a jealous that he good too,ewe ngakumbi malunga nabo bangaze bafundele kodwa abakwazanga ukuxhathisa kodwa sihlala nje sipholile uya kuyibonisa impendulo kwi-pitch kwaye ngokwenene mhlawumbi inomona
2213,career mode with your on and off the pitch you work towards different player career playable as option between a whole game and simulation transfer analyst more cinematic authentic menu,imowudi ye-word kunye ne-pitch oyisebenzelayo kumdlali owahlukileyo odlala njengenketho phakathi komdlalo wonke kunye nomhlalutyi wokudlulisela i-cinematic cineka
2214,fabulous pitch perfect casting,ukuphoswa kwe-pitch entle
2215,do you have a toilet shower or sink problem you would get help and fast n fixed can pitch in and help you have a great day great time in the bathroom contact,ngaba unayo ishawa yendlu yangasese okanye ingxaki yokuntywila ungafumana uncedo kwaye uqhushungqweni n ulungiswe unokufaka kwaye uncede ube nosuku oluhle ngexesha lokuhlambela
2216,_ what is he doing on a soccer pitch he is lucky he is a good tennis player,_ wenza ntoni kwi-pitch yebhola ekhatywayo ukuba unethamsanqa ungumdlali olungileyo we-tennis
2217,if you can t sleep in a beach hut but can pitch a tent on the beach seriously,ukuba ungalala kwindawo yolwandle kodwa ungayifaka intente elunxwemeni
2218,we have to see it on the pitch,kuya kufuneka siyibone kwi-pitch
2219,talking about the closer that not but yes i am a bit disappointed that did not get to pitch,ukuthetha malunga nokusondela kungekho kodwa ewe ndidanile kancinci ukuba ndingafikeleli
2220,we need to be better all over the pitch manager no when for his assessment of our defeat by kelty hearts at stadium in the premier sports cup read in full,kufuneka sibe ngcono kuwo wonke umphathi we-cattch akukho xa kuhlolwe ukoyiswa kwethu ziintliziyo ze-celty kwikomiya ye-jimu kwikomityi yezemidlalo epheleleyo
2221,we are excited to have the back in tonight our _ a fantastic visual identity for goal power exhibition to share the history of the who shaped the game into what it is today,sichulumancile ukuba siphinde sibuyele umva namhlanje
2222,sad to see you leave us hope everything works out for you in your future your a leader on and off the pitch and most of all top class bloke all the best and thanks for the,kubuhlungu ukubona ukuba uyasishiya ngathi yonke into isebenza kuwe inkokeli yakho kwi-shorit yakho kwaye ivele i-pitch kwaye uninzi lwayo yonke i-top ibhloka konke
2223,_ is all fun and until he on that pitch after that he s on a mission to agitate and destroy,"_ iyonke imnandi kwaye de kube kuloo pitch emva koko, kwi-mission ukuze agungqiswe kwaye atshabalalise"
2224,look at her pitch brand ambassador for,jonga i-ambassaado yobuqhetseba
2225,great to have training on our g pitch,kuhle ukuba noqeqesho kwi-g lethu le-g
2226,check out our report on chance lighthouse green map great time to pitch in as there s a match underway during this hour if you give or more at,jonga ingxelo yethu malunga nekhowudi yekholaphu yekhola ekhatywayo imephu yexesha elihle ukuya kwi-dead ant ngexesha le-sat
2227,calling console your game to press industry win worth with the very big pitch console edition at,ukutsala umdla womdlalo wakho ukucinezela i-wind windows win nge-console enkulu kakhulu ye-pitch pit
2228,on announcement post t make the club bigger football is on the pitch not on twitter,kwiposi yeposi ye-t yenza iklabhu yeblueger yebhola kwi-pitch hayi kwi-twitter
2229,would die on the pitch for,ndingafa kwi-pitch ye
2230,cutter into a left is the most pitch in baseball hope to away from the and this pitch to come back,i-cutter ibe ngasekhohlo yeyona nto iphambili kwi-baseball ye-baseball ithemba kude nakwi-pitch ukuba ibuye
2231,_prime_junior again and hate to repeat myself i can on judge by wot i see on the pitch u do have don t u,_pupime_junior kwakhona kwaye intiyo yokuphindaphinda ndikwazi ukugweba nge-wot ndibona kwi-pitch u
2232,core document generally an amalgamation of all the above research and out of the matrix the component of the usually of target persona account persona elevator pitch product service description value prop and,i-corexos ngokulula ngokufumanelekileyo zonke iziphumo ze-tartal neencwadana yenkcazo yenkcazo yenkcazo yenkcazo yenkcazo yokugqibela
2233,feature and what are your top and what is your quantifiable that you apart from your competition this can even be customer support by customer and you need this specifically when you build your and pitch,inqaku kwaye yintoni eyona nto iphambili kuwe kwaye yintoni eyahlukileyo ekuphuculeni ukhuphiswano lwakho oku kunokuba yinkxaso yabathengi ngumthengi kwaye uyayifuna ngokungqalileyo xa uphuma i-pitch
2234,an strategy is a framework designed to enable your business to meet its and succeed let us show you how to build pitch and optimize your to best align your technology and business,isicwangciso sisikhokelo esiyilelwe ukwenza ishishini lakho liza kuhlangabezana nalo kwaye liphumelele masikubonise indlela yokwakha i-pitch kunye nokwandisa itekhnoloji yakho efanelekileyo kunye neshishini lakho
2235,tomorrow night learn how to make your story stand out in our interactive virtual workshop register,ngomso ebusuku funda ukuba ibali lakho libonakale kwirejista yethu yokusasaza
2236,conte on at long term in this moment i am very happy to stay at i am very happy to work with this group and the club we don t have a problem and we are trying to create a great group also outside the pitch with the club,ukukhuphela ixesha elide kulo mzuzu ndonwabile ukuhlala ndonwabile ukuba ndilonwabe kakhulu ekusebenzeni neli qela kunye neklabhu esingaphandle kwe-pitch nge-pitch ngeklabhu
2237,compelling feature a hook a log line and a three act structure say peter and check out more from their book pitch like,inqaku elinyanzelekileyo i-hook loginem kunye ne-action action action strest i-test kwaye ihlole ngakumbi kwincwadi yencwadi yabo
2238,like watching pitch,njengokubukela i-pitch
2239,get ready for global pitch mobile on the of it s an international pitching event where you have a chance to get your game by and from all over the world,yilungiselele i-pitch ye-jitch ye-jitch kwi-sitate yomsitho wokuphelisa i-pitch apho unethuba lokufumana umdlalo wakho kwaye uvela kwihlabathi liphela
2240,please _league_en ban those pitch for a few so they understand it s bloody wrong we don t want them in,ndicela _league_in ban ban on le ntlawulo yabantu abambalwa ukuze bayiqonde igazi elingalunganga esingayifuni
2241,the appointment of been so and t been celebrated as big as it should have if you look into the successful he s both on and off the pitch is incredible he what an appointment from our,ukuqeshwa kuka-t kwaye ibhiyozelwe inkulu njengoko kufanele ukuba ijonge kwimpumelelo eyenziwayo kunye ne-pitch imangalisayo
2242,the united chamber of commerce you to join us for the perfecting your pitch brought to you by foundation join us to learn how to make an first impression at register here,i-united chingsember yezorhwebo ukuba uzibandakanye nathi ngokugqibezela isitayile sakho esiziswa nguwe ngesiseko sizibandakanya nathi ukuba sifunde indlela yokufunda kuqala kwirejista apha
2243,take a pounding from and shingles are and your is and s call pitch where you can protect your home and your in based in,thatha i-sunding ukusuka kunye ne-shingles kwaye i-pitch ye-pitch apho ungayikhusela khona ikhaya lakho kwaye usekwe kwi
2244,is a slow pitch and he with continuously falling on the other side a lot of pressure sri at home are brutal so yes a big deal for him,ngaba i-pitch ecothayo kwaye uyawela ngokuqhubekayo kwelinye icala i-sri eninzi i-sri ekhaya i-ritutal ke ye-ewe enkulu kuye
2245,what is the most common type of pitch thrown by in baseball a b screwball c d,luluphi olona hlobo luqhelekileyo lokutsalwa kwendawo ephoswe yi-baseball a b screwball c d
2246,delightful finish to the summer campaign last night we won our quarter final match against massive by killer walsh and who both lit up the pitch with creativity and exuberance pure hustle,ukugqitywa kokugqibela kwiphulo lehlobo phezolo siphumelele umdlalo wekota yethu ngokuchasene ne-killer wilsh kwaye bobabini bakha i-pitch kunye ne-hustle ecocekileyo
2247,to pitch to nonfiction you will need a book proposal my new post at what this is and how to start one,ukuphelisa ukungakhathali uyakufuna incwadi yesicelo seposi yam entsha kule nto kwaye uyiqale njani enye
2248,interest check for sports session dear community we are looking to book a soccer pitch sports hall right next to excel on sun morning before grand location _hire please reply if you can come what sport you play,ukujonga inzala yeseshini yezemidlalo indawo yokuhlala sijonge ukubhukisha iholo yebhola ekhatywayo ye-gatt lexall nokuvela i-grealy xa kuphela
2249,it is with a canon pitch and much more,ine-canon pitch kwaye ngaphezulu kakhulu
2250,maybe they will go old school and announce them on the pitch before the friendly tonight,mhlawumbi baya kuhamba isikolo bakudala kwaye babhengeze kwi-pitch phambi kobuhlobo ngokuhlwanje
2251,to pitch in bad luck after stellar he been unable to stay healthy love the guy and hope he is back in about month and then stays healthy the will pick up his option for next year always wishing well go,ukutsala kwithamsanqa emnandi emva kwestellar engakwazi ukuhlala ephilile lo mfo kwaye ethembele malunga nenyanga kwaye emva koko uhlale usempilweni uya kukhona kuphela
2252,working on my pitch today and together a list of to reach out to,ukusebenza kwi-pitch yam namhlanje kunye kunye noluhlu lokufikelela kwi
2253,with the pitch a deep flyball to right center and that will be out number,kunye ne-pitch i-pitch i-flyball kwiziko lasekunene kwaye liya kuba linani
2254,_bednar my yo stayed up late to watch him pitch s been his favorite player since getting his signature last summer,_dodnar yam ihleli emva kwexesha ukuze ibukele i-pitch s oyena mdlali wakhe owuthandayo ukusukela ukufumana utyikityo lwakhe kwihlobo elidlulileyo
2255,back penny to win in her urge in re mordaunt is pitch to as being best to win the next ge have never won an election so why does she think her party will do any better of,"i-penny i-penny yokuphumelela kwi-morsaunt yakhe kumordeunt yi-pitch ukuba iphumelele i-ges elandelayo engazange iphumelele unyulo, kutheni le nto icinga ukuba iphi na iqabane lakhe"
