,src,trg
501,just said this yesterday when she pretended to be who does something like that someone mentally unstable and she is lied and on more than one occasion she a bad name,ukuthetha nje oku izolo xa esenza ngathi ngubani owenza into enje nomntu ongazinzanga ngengqondo kwaye uxoka kunye nesihlandlo esingaphezulu kwesinye igama elibi
502,team in and is to making all your special by offering you a cake that the occasion perfectly come your cake today make an order or query,iqela ngaphakathi kwaye kukwenza konke okhethekileyo ngokunikezela ikhekhe ukuba i-cake ukuba ithekhe leza ngokugqibeleleyo ikhekhe le-qengqela namhlanje
503,none of them should have stood or apart from the total like he been the worst ever and so much our reputation world wide it is right he is being removed this was the occasion to show that by seated,"akukho namnye kubo omele ukuba wema okanye ngaphandle njengamaxesha onke abona kakhulu kwaye kangaka igama lethu elidumileyo liphelile, lisungula lo yayilixesha lokuhlala"
504,i tried to get it out on a previous occasion it landed on a box that i picked up but i just was not fair last time i was in there there were two standard and this one,ndizamile ukuyifumana kwisihlandlo esidlulileyo saqala ebhokisini endiwuthathileyo kodwa bendingalunganga ixesha lokugqibela apho bekukho imigangatho emibini kwaye enye
505,on the occasion of his country is independence day marked on th bin al sent a congratulatory message to president of,ngomhla welizwe lakhe luluhlu lwe-gundhaction olwenziwe kwi-th th th tin ithumele umyalezo wokuvuyela kumongameli we
506,on the occasion of sitara is birthday lunch was by foundation at center for and girl care,kumcimbi we-titara yimini yesidlo sasemini yayisisiseko kwiziko kunye nenkohliso yamantombazana
507,i expect a celebratory event in honor of this prestigious occasion,ndilindele ukuba umsitho wokubhiyozela uzuko lweli xesha libalulekileyo
508,i would love to get a chance to go through closet what a woman can dress and look good whether she is casual or fancy every and any occasion is,ndingathanda ukufumana ithuba lokuya kwigumbi lokunxiba ukuba umntu obhinqileyo angenise ntoni kwaye ujongeke kakuhle nokuba uyinto eqhelekileyo okanye uthandana nayo yonke itheko
509,what people who have have said he never the world championship format and always thought being world number as being more important whilst i would read these on occasion i did not understand how key they were to his motivation,yintoni abantu abathethile engazange ifomathi yentshatsheli yehlabathi kwaye bahlala becinga ukuba liyinombolo yehlabathi njengokuba bendizifunda ngamanye amaxesha andizange ndiyiqonde indlela abaphambili ngayo
510,the clique spin performance half zip is a great layer for any occasion,i-clique spin spin i-zuz ye-zip i-thermate enkulu ngalo naliphi na ixesha
511,so you are a party and need a theme you have come to the right place we have event theme for every occasion from birthday to bridal party and party check them out below,ke uyinxalenye kwaye ufuna umxholo oye wangena kwindawo elungileyo esinayo umxholo walowo wonke umntu wokuzalwa ukuya kwitheko le-bridal kunye neqela lokujonga ngezantsi
512,same here i can honestly say i have never 'forgotten' to eat on the rare occasion i have a meal i make pretty damn sure i make up for it in the evening,ufanayo apha ndingatsho ngokunyaniseka andizange ndilibale 'ukutya kwithuba elingaqhelekanga ndinesidlo senza ukuba ndiqiniseke ngokuhlwa
513,bin al sent a congratulatory message to president of on the occasion of his country is independence day,i-bin al ithumele umyalezo wokuvuyela kumongameli welizwe lakhe lusuku lwe-hugning
514,actually under done dough or just soft and chewy because i like soft and chewy and am with people who literally eat raw dough on occasion that i wish they d at least introduce the idea of heat into the equation because please raw flour is than raw,ngokwenyani phantsi kwenhlama eyenziweyo okanye ithambile kwaye ihlafuna kuba ndithanda ukuthambile kwaye ndithandana nomntu onqwenela ukuba i-dawate i-raw kunoluhlaza
515,it is normal occasion it is your day,sisihlandlo esiqhelekileyo yimini yakho
516,to is coming to your city with a range of beautiful silk for every mood and occasion,ukuza kwisixeko sakho kunye noluhlu lwesilika entle kuyo yonke imvakalelo kunye nexesha elithile
517,everyone i know is going to definitely keep selling everything at these low the higher the market goes the the once in a lifetime occasion to get mind blowing roi,wonke umntu endimaziyo uyaqhubeka nokuthengisa yonke into kwezi zinto ziphezulu kwimarike ihamba ixesha eliphelileyo ukuze ifune i-roi
518,at this year s a delegation of president the traditional visit as part of at the occasion the president took to the podium and striking,kulo nyaka ugunyaziswa ngumongameli undwendwele ngokwesiko njengenxalenye yeso sihlandlo umthendeleko uthathe ipodium kunye nokubetha
519,he for any occasion,yena ngalo lonke ixesha
520,happy birthday keep on rocking boy mum made a cake for the occasion,usuku lokuzalwa olumnandi gcina kwi-ten moy manum yenza ikhekhe kumsitho
521,he in a sentence is it just me or man this is a rare occasion,yena kwisivakalisi nje okanye emntwini le yinto enqabileyo
522,i saw men on uniform during the occasion,ndabona amadoda kwiyunifomu ngexesha lesihlandlo
523,is that toxic ex that showing up they on the side on occasion but always like after but yeah oh no he is hot was a dead giveaway,yiyo loo nto ityhefu i-of ebonisa ukuba aye kwicala elithile kodwa uhlala ethanda kodwa ewe hayi ushushu
524,_dg_ncc this pic was taken in selection for camp i saw a cadet crying on the occasion of because she never met with her brother in her entire life so i took went towards her and tie me a ' hearing that she was cried out with happiness,"_dg_ncc le pic ithathwe ekukhetheni inkampu ndabona i-cadet ekhalayo ngelizwi lika-kulo lonke lo dade, ndaye ndazilahlela 'ukuva"
525,the look of annoyance on the on the odd occasion the breakaway is successful it all though,ukujonga ukucaphuka kwithuba elingaqhelekanga le hluwa liphumelele yonke into
526,on national television the first man to kiss a man and rise to the occasion which is salvation and to the un,kwitv kwi-tv yendoda yokuqala yokuqasha indoda kwaye inyukele kumsitho osindisa kunye ne-un
527,it is how you think most of us are who did not hear you speak on this what you to do or what you would done before to federal assets like you could have just kept mute than disgrace yourself instead of trying to capitalize on the occasion it is a shame really is,it is how you think most of us are who did not hear you speak on this what you to do or what you would done before to federal assets like you could have just kept mute than disgrace yourself instead of trying to capitalize on the occasion it is intloni ngokwenene
528,on the occasion kapur director personnel said that is meticulously with the of of with regard to implementation of reservation policy,kumphathi wekapur wekapur watsho ukuba icacile ngokubhekisele ekuphunyezweni komgaqo-nkqubo wokugcina
529,our president his highness bin al sent a congratulatory message to president of on the occasion of his country is independence day marked on th,umongameli wethu ubunzulu bakhe i-bin ithumele umyalezo wokuvuyela kumongameli welizwe lakhe luluhlu lwe-th
530,advice on what to wear on a date dress for the occasion simple as that,ingcebiso malunga nokuba unxibe ntoni ngengubo yomhla womtshato ulula njengoko
531,hard not to on this occasion care to confirm or deny,kunzima ukungafumani sona kukhathalelo lokuqinisekisa okanye ukwala
532,i am happy to witness a special occasion class of ko parent,ndonwabile ukushumayeza iklasi ekhethekileyo yomzali
533,_windy_miller i m talking about remembrance day that of the armed i do not want to disrespect the occasion but a great many people were by state fought too out of patriotism and duty in defense of our people,_windy_miller ndithetha ngomhla wesikhumbuzo endingafuni ukusihlonipha isiganeko kodwa uninzi lwabantu ababelutsalwe kukukhusela abantu bethu
534,every night is a special occasion at the grand hotel,ubusuku ngabunye sisihlandlo esikhethekileyo kwi-grand ihotele
535,hi thanks for getting in touch for you down on this occasion we will pass your feedback onto the team and if you wish to discuss this further please send us a with further thank you,molo enkosi ngokunxibelelana nawe ngesi sihlandlo siza kudlula ingxelo yakho kwiqela kwaye ukuba unqwenela ukuxoxa ngakumbi nceda usithumelele
536,group captain took over the command of mechanical training institute air force station on in a ceremonial parade on the occasion bhat handed over the command to him,ukapteni weqela wathabatha umyalelo weziko loqeqesho lomsebenzi weziko lomoya kwiparadesi ye-thet kwi-bhat bit yanikezela kumyalelo kuye
537,i had that on more than one occasion and on built and by mountain i it out built it look after it so it kind of it for me to ride it,bendinayo kwizihlandlo ezingaphezu kwesinye kwaye kwakhiwe kwaye ndiyile intaba i iyokwakhayo ijongeka kuyo
538,in news energy and fuel in panama are tense police have taken to live ammunition on occasion and in response trade and movement between panama city and the been cut by a wave of mass protest indignation and road,kumandla eendaba kunye nepetroma epanama amapolisa aqinileyo athatyathwayo ukuba aphile ngamaxesha ngamaxesha kwaye ekuphenduleni kurhwebo kunye nokuhamba phakathi kwe-pantima city kwaye unqunyulwe yi-waves
539,help we need some help any good with graphics alright with proof reading a with you might be just who we need to keep all cjs is wonderful flowing countryside knowledge but on this occasion is not completely necessary,siza sifuna uncedo olufanelekileyo ngegrafiki ngokuhambelana nokufunda ukuba kungubani na u-cj ogcina ulwazi oluhambayo kodwa kwesi sihlandlo ungayimfuneko ngokupheleleyo
540,met w head of the council of office in on the occasion of his farewell visit him for his to joint of in wished him success in his future _coe,ifezekisiwe yintloko yebhunga lebhunga kwi-ofisi kwithuba lokufa kwakhe ukuba limtyelele entlokweni yakhe iphumelele kwimpumelelo kwixesha elizayo _coe
541,that would be the team that provided me with false information on more than one occasion and as i have already said the person they assigned to the case said they will no longer work on it can not help is there no way to escalate above them,oko kuya kuba liqela elindinike ulwazi lobuxoki ngaphezu kwesihlandlo esinye kwaye njengoko sele nditshilo ukuba umntu angenelele ukuba akasayi kunceda na ukuba kungabikho ndlela yokuwa ngaphezulu
542,today is international chess day on this occasion we have a chess fun fact for you did you know the word in chess it a position in which one player can move only with loss or severe disadvantage have you ever been in this situation,namhlanje lusuku lwe-chess yamanye amazwe ngesi sihlandlo sinenyani yolonwabo se-chess kuwe owalaziyo i-chess i-chess i-chess i-chess sisikhundla apho umdlali omnye unokuhamba kuphela ngelahleko okanye ukungasebenzi kakuhle kwelona meko
543,i know many those for any occasion and a few for special care to see some,ndiyazi uninzi lwabo ngalo naliphi na ixesha kwaye bambalwa kwinkathalo eyodwa ukubona ezinye
544,_matin occasion,_matin
545,is one of the more of the year and a workplace is the ideal occasion to your team for all of their hard work here are why your should be thinking about a workplace summer event,yenye yonyaka kunye nendawo yomsebenzi lithuba elifanelekileyo kwiqela lakho kulo lonke umsebenzi wabo onzima apha yiyo loo nto ifanele icinge ngomcimbi ophelileyo
546,_lab on the occasion of _patel her viva with minor best of luck with her new role at we will miss her dearly,_plab ngelinye i-_patel yakhe i-viva encinci yethamsanqa ngendima yakhe entsha apho siya kumkhumbula kakhulu
547,seeing as how my birthday is coming pretty soon from now i am thinking about doing some sketch for the occasion maybe,ukubona njengendlela usuku lwam lokuzalwa liza kuza kade ukusuka ngoku ndicinga ngokwenza umzobo wesithuba esithile mhlawumbi
548,in association with foundation a health camp at today on the occasion of s birthday a total of were seen by the and were distributed,ngokudibana nesiseko senkampu yezempilo namhlanje kwinqanaba lomhla wokuzalwa kwe-s of iyonke iyonwabele kwaye yasasazwa
549,_poppy i am good at people to the point where i can even make my who is a girl on occasion but yeah i have seen send entire of in my day,_ukulungile ndilungile ebantwini ukuya kwinqanaba apho ndinokuyenza nokuba ndingenzi intombazana ndiyintombazana ngamanye amaxesha kodwa ewe ndibone ukuthumela yonke imihla ngemihla yam
550,garden room we all need an excuse for a good party at the moment no matter the occasion we have got the perfect spot for you right in the heart of chester city get in touch with a member of our team for more or to book,igumbi legadi esifuna sonke isizathu sepati elungileyo ngalo mzuzu nokuba yeyiphi na itheko esinalo kwindawo efanelekileyo kuwe kwilungu leqela lethu lokunxibelelana ngakumbi okanye kwincwadi
551,head of school met the duchess of last week during a garden party at house to mark the th anniversary of the duke of being head of the duchy we look forward to more of the occasion with you soon,intloko yesikolo yadibana neduchess yeveki ephelileyo ngexesha leqela legadi lendlu ukuya kuphawula isikhumbuzo se-duching sijonge phambili kwisihlandlo esinye sexeshana nawe kungekudala
552,the of my employer is a serial founder and never in his life he an for but is otherwise completely his assistant his phone and on the rare occasion he to an it is,umqeshi wam ngumzingeli oqinisekileyo kwaye ungaze ebomini bakhe abenzele kodwa ngabanye nomncedisi wakhe ngokupheleleyo ngefowuni yakhe kwaye kwimbonakalo enqabileyo uya kuyifumana
553,tremendous occasion and an incredibly impressive product to you and your amazing team of people we are to be associated,itheko elikhulu kunye nemveliso enomtsalane kuwe kunye neqela lakho elimangalisayo labantu esiza kunxulumana
554,and don t but i won t miss an occasion to get sue,kwaye udon t kodwa ndiphumelele t ndiphose ithuba lokufumana i-sue
555,we were in to join family for the sad occasion of the burial of the late a key member of our campaign team who away in a tragic road accident this month may the lord rest her soul in eternal peace,sasiza kufuneka sijoyine usapho kwimeko ebuhlungu yokungcwatywa komngcwangu ophambili kwilungu lephulo lethu lephulo elihamba ngengozi yendlela ethe ga kwinyanga yonke inkosi ingaphelela
556,everyone i know will simply keep as little as possible with these low the higher the market goes the greater the lifetime occasion to achieve shocking roi,wonke umntu endimaziyo ukuba ungazigcinanga kancinci ngokusemandleni apha apha ephantsi apha phezulu kwimarike ehamba ngaphezulu kweminyaka yobudala yokufumana i-roi
557,i mean on one occasion where she it times it was not  nothorughout' or whatever the was any on shouting 'bullshit' from her front bench on,ndithetha ngesihlandlo esinye apho walingeva khona
558,i don t know how older do it this is a rare occasion as an but working long and hour days is par for the course for i hit intern year of exhaustion and am basically non functional,andazi ukuba ndikhula kangakanani esi sihlandlo sinqabileyo njengokusebenza kodwa ukusebenza iiyure ezininzi kunye neyure yicango yekhosi ndayifumana unyaka wonke wokudinwa kwaye ndisebenza ngokusisiseko
559,_cityuk i the bit about to for the fa cup a perfect occasion for a perfect day,_icicikk i-bit malunga nekomityi ye-fa sfa isihlandlo esigqibeleleyo ngosuku olufanelekileyo
560,i am on very rare occasion known to do art,ndikwixesha elinqabileyo laziwa ukuba ndenze i-art
561,an occasion when if it was not saying it there would be no need to ask is he being sincere,sihlandlo xa besingathethi ukuba bekuyi kuba akukho sidingo sokubuza kukunyaniseka
562,i am already for next year going to go with a new profile pic to commemorate the occasion,sele ndineminyaka ezalandelayo ndiza kuhamba neprofayile entsha yokukhumbula isihlandlo
563,look no further your big sister i m a variety streamer with mostly cozy and semi chaotic on occasion we do art and karaoke during stream but mostly we game i love with my chat and would love to see you around,jonga ungaphezulu udadewethu omkhulu ndingu-mali wokugqibela wokugqibela wokugqibela waye kuphela ixesha lenye ne-taradake ngexesha lam ndithando ukuze ndingavumbusi ukuze ndikuthanda ukuze ndikufuna ukuze ndikufune ndithanda naye
564,come help me celebrate the release of my _sab are kind enough to offer their to the occasion so don t miss it _publishing,yiza undincede ndibhiyozele ukukhululwa kwe-_saab ye-_saab inobubele ngokwaneleyo ukuba inikezele kumsitho wabo ukuze iphoswe _upling
565,then she does the gay little fist up look at me i am fighting the power that i would support on any other occasion cause i am a government goon,emva koko wenza inqindi elincinci le-gay ujonge kum ndilwa namandla endiya kuwaxhasa ngalo naliphi na elinye itheko kuba ndingu-goon karhulumente
566,a huge to _brooke and the team on this monumental occasion i had the pleasure of trying these virtual and getting to know jess over the past couple of great people and great work if you re a give it a look,inkulu kakhulu kwi-_mrooke kunye neqela kwesi sihlandlo inkangeleko endandinomdla wokuzama ukuzama ukubona izinto ezithandekayo kunye nokwazi ukuba uyayibona
567,a devastating indictment of the net promoter score methodology perhaps particularly devastating for those of us who on occasion have that methodology to our or,inxalenye etshabalalisayo yendlela yokukhuthaza i-intet mhlawumbi yatshabalalisa ngakumbi abo kuthi ngobo malunga nendlela yokusebenza kweyako okanye
568,please i need who i can work with right now need money many responsibility on me i can cook i can do grill going to any occasion i can press for u if na to i dey i will still suck,ndicela ukuba ndisebenzela ukuba ndingasebenza nangoku ngoku ndifuna imali kakhulu uxanduva kum ndiyakwazi ukupheka ndingakwazi ukwenza i-gill ukuya kulo naliphi na ixesha endinokuyifumana
569,_ both are great depending on the occasion i will go with the jacket,_ zombini zilungile kuxhomekeka kumnyhadala ndiza kuhamba nejacket
570,but i also hope everyone the occasion,kodwa ndiyathemba ukuba wonke umntu umsitho
571,send a hug in a box for any occasion,thumela i-hug kwibhokisi yalo naliphi na inqanaba
572,_x i like to visit on occasion but do not have any to take up residence there,_x ndiyathanda ukutyelela ngamaxesha athile kodwa andinayo nakuphi na ukuthatha indawo yokuhlala
573,my cousin t listen to music at all and on the very rare occasion he does it s music or video game music i don t understand it,umzala wam omamele umculo kwaphela nakweli phepha elingaqhelekanga awenzayo umculo okanye ividiyo yomdlalo wevidiyo ayiyiqondi
574,is it possible that when blair left office he had worth cheering whereas spent three to be benn dressing up at every occasion little more than the contempt i have never labour,ngaba kunokwenzeka ukuba xa iblair ishiye i-ofisi awayekufanele ukuba ityelwe ngubani ukuba ihlale i-benn inxiba ngaxa-nye ixesha elingazange lisebenze
575,i can not make anything now so let me bump this to commemorate the occasion,andinakwenza nantoni na ngoku ukuba ndiyeke le nto ukuze ndikhumbule isihlandlo
576,computan is with his presence it was a for the whole team making the even more special with a warm and fun filled by a delicious meal the team was in a celebratory mood,i-computer yakhe yayikukuba ubukho bakhe yayikuko ukuba iqela liphela lenza okungakumbi ngocwecwe ngokuzaliswayo kunye nolonwabo oluzaliswe sisidlo esimnandi iqela
577,so reader you invite me out for a drink any particular celebration of for such an occasion,mfundeleni ke undimeme isiselo esiseleni nakweliphi na ibhiyozo yeso sihlandlo
578,_delight thank you so much rice wey de rise to occasion,_delight enkosi kakhulu irayisi
579,they look like your drunk every occasion,bajongeka ngathi banxila
580,if you are so put off by hyperbole start to the it is pretty much exclusively the form of public rhetoric they use these days are going to have to rise to the occasion,ukuba ucinyiwe yi-hyperbole qala kuyo ilungile kuphela indlela ye-rhetoritoritoric basebenzisa ezi ntsuku ziya kufuneka ziphakame kumsitho
581,billion is no small feat the is so to be apart of this momentous occasion and to see the agriculture sector grow through the none of this would be possible without the fertile of our key,ibhiliyoni ayisiyonto incinci feksi ukuba iyodwa ukuba isihlandlo esibalulekileyo kwaye ukubona icandelo lezolimo likhule ngaphandle kwento enokubakho ngaphandle kwesitshixo seqhosha lethu
582,join us best happy hour dinner and midnight party in come on by for a drink celebrate a birthday or special occasion with us book now,joyina iyure ye-nated stady kunye neqela eliminbun yobusuku lizelwe ngesiselo sokuzalwa okanye isihlandlo esikhethekileyo ngencwadi yasemelika ngoku
583,on the flip side if you pray for to be removed and they do get removed then it was not sent by god these however are simply a great rule of thumb with and not a hard fast rule with every occasion,"kwicala le-flip ukuba uthandazela ukuba lisuswe kwaye basuswe, alithunyelwanga nguthixo nje ukuba nje ngumgaqo omkhulu wesithupha kwaye hayi ulawulo olunzima"
584,the two t i d say concrete in a lot of are also on twitter and they on occasion fret why are you a touch as if you disapprove of people why not let the river run,amanqaku e-t ndithi ikhonkrithi kakhulu kwi-twitter kwaye nge-fret bing kutheni ukuba ungavumelani nabantu ukuba abaleke
585,how used to do on every occasion i miss that so much,isetyenziselwa njani okwenziwa ngalo lonke ixesha ndikhumbula kakhulu
586,_inoseivt of course i m a variety streamer with mostly cozy and semi chaotic on occasion we do art and karaoke during stream but mostly we game hope to see you around soon,_imivuvt yekhosi i-surtamurerumre yobuchwephono ngokuqinisekileyo kunye nokuqhutyelwa kwakhona kwakhona namdeke ngexesha lokuxelisa
587,he is now in the same institution as romero his former pornography business partner whom he assigned to rape his daughter on camera on at least one occasion god help the,ngoku ngoku kwinqanaba elinye njenge-romero yangaphambili yangaphambili iqabane elibonisa ukuba lidlwengule intombi yakhe kwikhamera kwisihlandlo esinye uthixo sinceda
588,happy birthday childe i made one of my sticker into an illustration for this monumental occasion sorry i made you have starfish bra on your birthday,usuku lokuzalwa olumnandi ndenze esinye isiphelo sam saba ngumzekeliso wesithuba esiqhelekileyo sokuxolisa ndinenze ukuba ube ne-starfish bra kumhla wokuzalwa kwakho
589,would you mind your self care i feel like you re are the kind of person who is always ready for any occasion and her best at all time i can do for each,ngaba ungakhathala ukuzikhathalela kwakho ndiziva ngathi ndiluhlobo lomntu ohlala elungele naliphi na ixesha kwaye konke okusemandleni akho ngalo lonke ixesha ndingayenza
590,sometimes the dominance of a particular science or branch of study is the occasion of an attempt to apply to ethics from or analogous to the of that science,ngamanye amaxesha ulawulo lwesayensi oluthile okanye isebe lesifundo lingumcimbi wokuzama ukwenza isicelo kwimilinganiselo yokuziphatha ukusuka okanye i-analogous ukuya kwisayensi
591,defeat on occasion despite being a northerner with a 'ballpark' million it took the help of the particularly the for him to achieve his goal,woyiswa ngamanye amaxesha nangona wayeyi-northerner nge 'ibhola yebhola' yayithatha uncedo lwekhulu ukuze afezekise injongo yakhe
592,i used to work at a and i know some people that work for your on occasion around here i get nice shirt and i just laugh then again i do not hide the fact i work for chaos and kindness and there is quite a few in the area,bendihlala ndisebenza e-a kwaye ndiyazazi abanye abantu abasebenza ngethuba lakho ngapha nangapha sifumana ihempe entle kwaye ndihleka nje ndingayifihli inyani kwaye ndimbalwa kule ndawo
593,i m going to write a post about all the up and coming to watch also the for special occasion for the,ndiza kubhala iposti malunga nayo yonke i-up kwaye ndizibukele nakwisihlandlo esikhethekileyo se
594,it s a rare occasion when it,sisihlandlo esinqabileyo xa
595,reader review i have read many in my life and on the occasion i have made the statement that the book was so good i t put it down reading this book that statement was true i really t put it down,uphononongo lomfundi ndifundile abaninzi ebomini bam nangomhlandlo ndenze ingxelo yokuba le ncwadi ilunge kakhulu ndiyifumene ndifunda le ncwadi inyani
596,yes that is true maybe it is important to allow for to be left open for another occasion 'i am not sure if that is true can i go away and check it out and come back to it next time ' or  wouldo you have a link you can send me about that ',ewe kuyinyani mhlawumbi kubalulekile ukuvumela ukuba ishiywe ivulekile kwisihlandlo esinye isihlandlo 'andiqinisekanga ukuba iyinyani kwaye ingeyisikhuphe kwaye ibuyele kuyo ungandithumela ngaloo nto '
597,oh such a joyous occasion,oh isihlandlo sovuyo
598,is easy with by your side with over to choose from building a box they will love is simple and fun simply choose your occasion select your scent and add on your via,kulula ngecala lakho ukuze ukhethe ekwakheni ibhokisi bayayithanda kwaye bonwabe ukhetha ivumba lakho khetha ivumba lakho kwaye longeze kwi-vale yakho
599,on each occasion he was he was a referral for support which was declined on every occasion,kwisihlandlo ngasinye wayengumdlulisele kwinkxaso enqatshelwe ngalo lonke ixesha
