,src,trg
1007,i wonder how much pickup do you have since you always throw it at me in every occasion,ndiyazibuza ukuba ingakanani i-pickup onayo khona onayo okoko usoloko uyiphosa kum ngalo lonke ixesha
1008,good but he t the only one who dressed for the occasion,kulungile kodwa uphele kuphela onxibe umsitho
1009,i am from and more or less our thinking is similar to that of the on this occasion i will tell you how we think and also the greater part of central and eastern,ndivela kwaye ndingaphantsi okanye ndingaphantsi kokucinga kwethu ngokufanayo nakweli thuba ndiza kukuxelela indlela esicinga ngayo kunye nenxalenye enkulu ye-mpuma nempuma
1010,as a winger went to left back for and then was mainly as a striker but in occasion as a winger last season for scored most were,njengomnini we-wingor uyemka ngasemva kwaye emva koko yayingumhloli kodwa ngamanye amaxesha njenge-winger ixesha lokugqibela lokufumana amanqaku
1011,to reduce the fatigue of with physical it may be helpful to limit the number of on a given day or week extra time should be for oral on occasion if the person diction,ukucutha ukudinwa komzimba ngenxa yenyama kunokuba luncedo ukunciphisa inani lenani ngomhla onikiweyo okanye kwiveki elongezelelweyo kufuneka kubekho ngomlomo ngamaxesha athile
1012,every occasion wear section for on most clothing is just with puffy as a someone built like a line backer i take great at this,wonke umntu unxibe icandelo lezinto ezininzi nge-piuffy njengomntu owakhiwe njengomgca obacker ndithatha kakhulu kule nto
1013,i still see on occasion and i know too the are just but i do know them never did for trash but i been about the a while,ndisabonana ngelinye ixesha kwaye ndiyazi kakhulu kodwa ndiyabazi ukuba soze ndenze inkunkuma kodwa bendimalunga nexesha
1014,aria goldy adjustable bracelet material titanium steel size adjustable size me i a lot for anniversary gift and any occasion,i-aria goldy rocelet ye-aria ye-aria ye-aria ye-titanium ye-titanium yentsimbi ubukhulu becala ndisisipho esininzi kunye naliphi na ixesha
1015,_mama then rise to the occasion put on your best clothes and calmly but forcefully tell him or her to off,_mama ke vuka kumsitho ubeke iimpahla zakho ezilungileyo kwaye ngokuzolileyo kodwa ngamandla mxelele ukuba aphumele
1016,was a day that came from hell time and occasion of agreement,yayilusuku oluvela esihogweni nexesha lesivumelwano
1017,wow yeah i do know what they re used for i know who i m have had them and the are endless of the time abortion is used as a form of birth control because the responsible t responsible enough on one occasion i to that,wow yeah
1018,i stopped going to when my were born it is a rare occasion that you would find me on a bar stay home and or get a,ndiyekile ukuya xa kwakuzalwe igama lam lixesha elingapheliyo onokuthi undifumane kwi-bar uhlala ekhaya kwaye ufumane i
1019,_mafia i would assume it is for her own safety too this man is,_mafia bendicinga ukuba kukhuseleko lwakhe le ndoda
1020,today at ave from p visit for all sign up for and to book your next occasion simply contact us today,namhlanje kwi-ave kwi-avi kutyelelo lwe-p ukuze babhalisele kwaye babhukishe ixesha lakho elilandelayo baqhagamshelana nathi namhlanje
1021,the time finally come this at am i will be doing my first hour stream over on twitch for the occasion i will be resident evil be there it is be,"ixesha lokugqibela le nto ndiza kuba ndenza iyure yam yokuqala malunga ne-witch kumsitho, ndiza kuba ngumhlali"
1022,a wedding or a special occasion surprise and delight your with this beautiful doughnut wall this impressive display up to and is sure to be a firm with your,umtshato okanye itheko elikhethekileyo lokumangalisa kwaye uyonwabele le donga ye-donut entle lo mboniso uphela kwaye uqinisekile ukuba uqinile
1023,thanks after winning corporator election on _national ticket from city of which on the occasion of in this year for the first time in won of corporator,enkosi emva kokufumana unyulo lomdibaniso kwi-_nanacal titket ukusuka kwisixeko apho kulo nyaka okokuqala ngqa
1024,why are wang chang and and all on today what s the occasion,kutheni le nto i-wang kunye nayo yonke into namhlanje?
1025,this is no one night stand it s a real occasion,obu bubusuku buye bumisisi sihlandlo sokwenyani
1026,on national nude day on an occasion globally to spread awareness on without clothes a bunch from nudist group men and at an undisclosed location in to celebrate the big day of the calendar with fun and frolic,ngosuku lwesizwe nude kumsitho kwihlabathi liphela ukusasaza ulwazi ngaphandle kwezambatho zeqela elivela kumadoda amakhulu kwikhalenda yekhalenda yekhalenda nge-curlic
1027,two ago i used your premier lounge as i have many times in the past on this occasion we were unhappy so i you to date i have had no response except an receipt so disappointed with the service do you not value your,ezimbini ezidlulileyo ndisebenzise i-nkulumbuso yakho yenkulumbuso njengoko ndinamaxesha amaninzi kwixesha elidlulileyo ngalomcimbi wawungonwabanga ke ngoko wenze mpendulo ngaphandle kwenkonzo awuyixabisi
1028,and tables for hire for any and occasion around park,kunye neetafile zokuqesha kwawo nawuphi na kunye nelinye ixesha elingaphezulu kwepaki
1029,are you today we have put together a list of that we think are perfect for marking the occasion we have included super and fascinating pic sam,ngaba unamhlanje luluhlu lwento esicinga ukuba igqibelele ukumakisha isihlandlo esithile siquka i-pic super kunye ne-pic enomdla
1030,this is my th tweet marking the occasion here by the interview that posted last week as part of their series,eli liqela lam eliphawulayo ngesona sihlandlo silapha ngodliwanondlebe oluthunyelwe kwiveki ephelileyo njengenxalenye yolu ngcelele
1031,today we had a special assembly where lots of our were with for attendance reading and sports they were so many it was fantastic to see here are just a few to celebrate the occasion,namhlanje saba nendibano eyodwa apho babekunye nekathu i-sealy ukuba ifunelane kunye nezemidlalo babezininzi kakhulu yayiyinto entle kakhulu ukuba babone na apha nje ukuba babhiyozele ixeshana
1032,so they a song but for what occasion,ke bona bayingoma kodwa ngawo ithuba
1033,come on some have had some purr on occasion,yiza abanye bene-purr ngamaxesha athile
1034,this summer we the of s workshop an exceptional floral artist on this occasion discover her,ihlobo le-sirsp siseki yenkcukacha yamabali ngokugqibela ngokwenxaxheba
1035,well final today he could have combed his hair for the occasion,kuhle kakhulu namhlanje ngewayembe iinwele zakhe ngomsitho
1036,_ug _ _mc must have blessed the occasion with his early presence already,_ i-_ _mc kufuneka isikelele esi sihlandlo ngobukho bakhe kwangoko
1037,on the occasion of the opening of the branch of the educational holding company _schools in we are to announce that we will be the for teaching on the given link,ngomsitho wokuvula isebe lenkampani yezemfundo
1038,they are especially appropriate as birthday but can be given for any occasion mother is day graduation day and any other occasion that for a special gift,zifanelekile njengexesha lokuzalwa kodwa zinokunikwa ngalo nawuphi na umcimbi umama ngusuku lokuthweswa isidanga kunye naliphi na elinye ithuba elisiphoso esikhethekileyo
1039,dress to impress the collection diamond beautiful kiki a stunning contemporary design made to bring that extra sparkle to any occasion,nxiba ukuze ubonakalise idayimane yedayimane entle i-kiki yoyilo olumangalisayo lwenziwe ukuzisa loo nto eyongezelelweyo kuwo nawuphi na umntu
1040,my friend animal farm which she closed to the public she had a few times a year on one occasion her el paco fell for cockatoo la,umhlobo wam kwifama awayeyivale eluntwini awayenamathandana ambalwa ngonyaka ngesinye isihlandlo i-el pacula iwele i-cockatoo la
1041,sometimes a inning on occasion,ngamanye amaxesha i-inning ngexesha
1042,at an international conference by the center for strategic several prominent gave on the occasion a of descent of president,kwinkomfa yezizwe ngezizwe ngeziko lesicwangciso esiliqili sanika isihlandlo esithile sinike umcimbi ongumde nomongameli
1043,i m going to simply keep selling as little as possible at these low the higher the market goes the the once in a lifetime occasion to achieve extraordinary roi,ndiyokuhlala ndihlala ndithengisa kancinci kangangoko kunokwenzeka kwezi ntengiso ihamba ngokuhamba kwexesha eliphendweyo ukufezekisa i-roi engaqhelekanga
1044,_official why did not they invite portable to such occasion make scatter everywhere,_official kutheni le nto bengazange bamenywe kulo msitho benza ukuba bachithe yonke indawo
1045,ha that might be me on occasion,i-ha leyo inokuba ndim ngelinye ixesha
1046,on the occasion of the th anniversary of friendship between and in energy sector development the minister of infrastructure _ensabimana together with h e the ambassador of japan to substation,ngomnyaka wesikhumbuzo sobuhlobo phakathi kwecandelo lecandelo lecandelo lomphathiswa weziseko zophuhliso
1047,good luck tonight i hope it is a great occasion for you and all the,amathamsanqa ngokuhlwanje ndiyathemba ukuba lisihlandlo esihle ngawe kunye nonke
1048,this fabulous rocher been handmade with love by the talented here at langan is all our bespoke speciality are baked here on the and for more information call us on let us make your special occasion oh so special,lo mdlelene owonwabileyo udlule phakathi nothando apha elangan yiyonke i-begtoke yethu yonke i-actpoke yethu ibhakwe apha kwaye ngolwazi oluthe kratya sitsalela umnxeba
1049,why not consider for to the foundation in lieu of and allow your family and to mark the occasion it is quick and easy to set up a birthday just ask us if you would like to know how at foundation,kutheni ungakhe uyiqwalasele isiseko sexoki kwaye uvumele usapho lwakho kunye nokuphawulezela itheko likhawuleze kwaye kulula ukuseta umhla wokuzalwa ukuba ungathanda ukwazi njani kwisiseko seso
1050,i had a director do this to me times over on one occasion he before we were due to meet his assistant it actually he tried to set up a meeting for the th time the following year i was busy that time,"ndinomlawuli ndenza le nto kum ngamaxesha kwisihlandlo esinye, phambi kokuba sifikelele ekuhlanganiseni intlanganiso kangangexesha elithile kunyaka olandelayo ndixakekile"
1051,_bear on every occasion actually when he is bleating on about the flag and sending flowery no line whatsoever,_bear kwitheko ngalinye eneneni xa sele ekhwaza malunga neflegi kwaye uthumela iqukuqulelo akukho mgca wuphi
1052,new way to shop affordable luxury bag brand in statement fashion and travel designed to elevate your look for any occasion our deliver eye catching colors a delicate blend of and a signature snakeskin pattern,indlela entsha yokuthenga ibigs efikelela kwi-farine ye-fourtem yefashoni kwaye ihambise ukuphakamisa naliphi na ixesha lethu lokuhambisa iliso kwindlela yokufumana ipeyinti yokutyibilika
1053,__ and on occasion physically them,__ kwaye ngamanye amaxesha bawo
1054,i get that stuff at the price cutter on occasion,ndiyifumana le nto kwixabiso lexabiso ngamaxesha
1055,to fail to rise to the occasion,ukusilela ukuphakama kumsitho
1056,after last year is success the trail is coming back on for this occasion we had the pleasure to chat with day about these majestic prehistoric click on here to listen to the full episode,emva konyaka ophelileyo kuphumelela umkhondo ubuyela kwisithuba sesonwabile ukuba sinxibelelane nosuku malunga nezi zinto ze-prehistory apha emangaliseni isiqendu esipheleleyo
1057,make a statement with designer like storm and swatch,yenza ingxelo enomyili njengoqhwithela kunye neswatch
1058,_eyed_gal very seldom touch soda but in the rare occasion i do it is when i mix up a diet cherry coke at,_ i-_ibless i-soday soda kodwa kwi-rare testan ndiyenza xa ndixuba i-coke ye-cheet coke apha
1059,even a brick will simply keep panic selling nothing at these low the more the market goes up the the once in a lifetime occasion to achieve amazing roi,nokuba isitena siya kuqhubeka sithengisa singathengisi nto kwezi zinto zisezantsi intengiso inyukela kwisithuba sobomi bonke ukuze sifezekise i-roi emangalisayo
1060,on buzz the first to land on the moon celebrated the occasion by taking,kwi-buzz owokuqala emhlabeni enyangeni ubhiyozele ngelo xesha ngokuthatha
1061,from a snug room to our wondrous lake view and finally our tower suite that s the one with the bathtub we re all with there s a room for every occasion with us to find out more visit our,kwigumbi le-sbug ukuya kwi-lake ye-lake emangalisayo kwaye ekugqibeleni isonder suite leyona ndawo ingena kwigumbi lokuhlambela siye saphinda sahlala apho igumbi ngalo lonke ixesha lethu sikufumanisa tyelelo ngakumbi
1062,glad to welcome the ambassador on the occasion of the of his to nurture partnership reflected through strong and bold,ndiyakuvuyela ukwamkela i-absassador ngelo xesha lokukhulisa ubuhlakani babonwe ngoqinileyo kwaye unesibindi
1063,a l'occasion d'un j'ai un for my non speaking i a and i will translate it in as soon as i can,i-l'nati d'ung j i-un'ai ye-engathethekiyo i-i a kwaye ndiza kuyiguqula ngokukhawuleza
1064,it is going to be a scorcher out there today everyone be careful hydrate and limit your time outside if you can if you can not find some shade or at least duck in for some on occasion stay cool,iya kuba ngumsunguli ngaphandle apho wonke umntu ulumkile kwaye unqumle ixesha lakho ngaphandle kokuba awukwazi ukufumana umthunzi okanye ubuncinci i-dada kwi-datid
1065,of the republic of sent a congratulatory message to the on the occasion of the national holiday of,yeriphabhlikhi yokuthumela umyalezo wokuvuyela kumsitho weholide kazwelonke ye
1066,week off this sweet card ideal for any romantic occasion and too blank inside was now of was now next day dispatch,iveki yekhadi elimnandi elifanelekileyo ngalo naliphi na ixesha lothando kwaye lingenanto yangaphakathi ngoku yayikukulandelwa ngokulandelayo
1067,there is no particular thing to say satisfaction for trapped between the glam of all black the by itself as the occasion throughout my reflection in the state of losing to spit indeed i am but at least i i got nothing to lose,akukho nto ethile ukuba ithethwe ngokwaneliseka phakathi kwe-gam yonke imnyama ngokwayo njengoko i-tist yam iyodwa ilahlekile i-spit inene ilahlekile
1068,_bebb believe me this is a monumental occasion might have to open the champagne i have had in the cupboard for,_bebbb ndingakholelwa ukuba isihlandlo esibalulekileyo sinokuvula i-champagne bendinayo kwikhabhathi ye
1069,everyone i know will simply keep panic selling as much as possible with these the higher the market goes the greater the occasion to accumulate extraordinary,wonke umntu endimaziyo ukuba uyothuka ngokuthe chu ngokusemandleni akho ngapha nangaphezulu kwimakethi enkulu eyenziwa sisihlandlo esingaphezulu kwesihlandlo esithile ukuba siqokelele engaqhelekanga
1070,once arses itself to revive burial should drop a new to mark the occasion,nje ukuba i-asses ngokwayo ivuselele umngcwabo kufuneka ilahle entsha ukumakisha isihlandlo
1071,directed towards big occasion in the history,ijolise kwisihlandlo esikhulu kwimbali
1072,you got this i never smoked but i have drank to being on more than one occasion my drinking to a near stop damn near me but it can be done ai not got a chance man,unayo le nto andizange nditshaye kodwa ndisele ndasela ngaphezulu kwesihlandlo esinye kwi-intem yokumisa kufutshane neyam kufutshane nam kodwa ingenziwa yindoda
1073,all fiat are bound to fail economically politically and indeed socially though the timing occasion and full are all necessarily still unclear,yonke i-fiat ibophelelekile kwezoqoqosho kwezopolitiko nangentlalontle nangona inesithuba sexesha kwaye igcwele yonke into engacacanga
1074,of not here s doing what she is told divide no matter the occasion always seek to separate while it is playground stuff these people are on a high salary to agitate well done jake your country is of you the one whose flag you display,kanene apha ukwenza into athethwayo ukwahlula-hlula ngaphandle kokuba iqabane lihlala lizahlukane ngelixa ibala lemifanekiso enomvuzo wakho ukhathazekile iflegi yakho
1075,i had a guy post a sorry we you card without even knocking did not even have the parcel in his hand luckily i was in the kitchen so the door and had a rather firm word with him needless to say i was lucky on that occasion and got my parcel,"ndinomfana othandabuzayo thina ikhadi elingazange sinkqonkqoze lingakhange libe nepasile ngesandla, nditsho nelizwi eliqinileyo ukuba nditsho ukuba ndinethamsanqa ngaloo thuba kwaye ndinayo ipasile yam"
1076,a lively and fun atmosphere to be able to fully perform on this occasion we always bring our own honor we always bring the best for you we guarantee,imozulu ephilayo neyonwabisayo ukuze ikwazi ukwenza ngokupheleleyo ngesi sihlandlo sisoloko sizisa imbeko yethu sihlala sizisa eyona nto ibalulekileyo kuthi siyasiqinisekisa
1077,i miss being able to sleep in on the rare occasion that we manage it is because they are coming down with something,ndiyakukhumbula ukukwazi ukulala kwimfundiso enqabileyo yokuba siyilawulayo kuba besiza ngenye into
1078,your assumption is i date masculine no i am taking about not you feminine do not escalate they tend to date men masculine men do initiate escalate so their might on rare occasion but not at first if a man is waiting for her he is too late,ingcinga yakho ndithandana ne-masculine hayi ndithatha i-femini ayindiqhubekisi ukuba bathandane namadoda abantu abanqabileyo kodwa bangenguye okokuqala ukuba ilindelwe kakhulu
1079,if on the contrary instead of sheep or oxen he had to give in exchange for it he could easily proportion the quantity of the metal to the precise quantity of the commodity which he had immediate occasion for,ukuba ngokuchaseneyo endaweni yegusha okanye iinkomo awayeza kunika ngenxa yokutshintshiselana ngokulula ngokulinganayo isixa sentsimbi ukuya kuthi ga ngoku
1080,make an entrance in the fall collection with and versatile and signature these new instill confidence for the modern woman no matter the occasion,yenza umnyango ukuqokelelwa kwe-wart kunye notekelo kunye notyikityo lokufumana ukuzithemba okutsha kumfazi wale mihla akukho nto
1081,our crew are known for providing world class hospitality and we love that this was on this occasion please your confirmation number so we can make sure they re,abasebenzi bethu bayaziwa ngokubonelela ngomoya wemfundo yehlabathi kwaye siyayithanda into yokuba le yayingalo mcimbi nceda ufumane inombolo yakho yokuqinisekisa ukuze sikwazi ukuqiniseka ukuba bayaziqinisekisa ukuba banakho
1082,it is a statement of occasion power strength and nobility this collection further with the connotation of the and the representation of the various wild,yingxelo yamandla ethunyeni amandla kunye nobungangamsha le qokelelo ngakumbi kunye nomboniso wendalo kunye nokumelwa kwendalo eyahlukeneyo
1083,if only we would had a warning that was not the man to rise to the occasion in an emergency this is from senior expressed incredulity at johnson is previous to jump on a plane from canada while was going up in,akwaba nje sinesilumkiso esingelilo le ndoda ukuba inyukele kumcimbi wexesha likaxakeka kule nto iphambili ekuvezeni i-johnson ikhuphe kwi-canada ingena
1084,cloud proudly its beautiful one year journey we our journey on to this happy occasion to all of you and cheer to the company we have been nourishing like a baby,ilifu ngokuzingca bayo
1085,what are your top unreleased i go first on occasion voodoo love in the moment remember knew better,yintoni eyona nto iphambili endingavuswanga ndihamba kuqala ngexesha lokuthanda i-voodoo lothando ngexesha lokukhumbula ukuba lazi ngcono
1086,on st central government on the occasion of investigation at d office at am this is from statue on necklace road in rally and dharna till d office _anumula _offcial _chamala,kurhulumente wasest central malunga nophando kwi-ofisi ye-dum ngoku ivela kwi-rally kwindlela ye-rally kunye ne-dharna kude kube se-dcoumui
1087,on the occasion of a invasion in sal and the assistance of the peshwa whom he adopted as his son giving him a third of his,kumsitho wokuhlaselwa esate noncedo lukapeswata lo wamfaka njengonyana wakhe wamnika umntu wesithathu
1088,i will most likely keep selling as much as possible with these bigger the pump the bigger the once in a lifetime occasion to achieve,ndizohlala ndihlala ndithengisa kangangoko kunokwenzeka ngazo ezi zinto zinkulu kwimpompo inkulu kwi-pump enkulu yexesha elide ukuze afezekise
1089,it was a pleasure what a wonderful occasion have a great last day everyone,kwakumnandi ukuba isivumelwano esihle sinexesha elihle ngalo lonke ixesha
1090,the single currency is bound to fail economically politically and indeed socially though the timing occasion and full are all necessarily still unclear,imali enye ibophelelekile kwezoqoqosho kwezopolitiko nangokwezihlandlo nangona ixesha lokugcina ixesha kwaye igcwele yonke le nto ilula
1091,oh yeah is a good nickname for this occasion specifically,oh ewe igama lesidlaliso elihle lale ntsusa
1092,group captain took over the command of mechanical training institute air force station on in a ceremonial parade on the occasion bhat handed over the command to him _mcc,ukapteni weqela wathabatha umyalelo wesikhululo somsebenzi woqeqesho lomoya kwiparadesi ye-thehat kwi-bit bit yanikezelwa kumyalelo kuye _mcc
1093,president special assistant to passing out parade at police training college the parade of district were also on the occasion,umongameli okhethekileyo wokuncedisa ukudlulisela iparade kuqeqesho lwamapolisa kwi-parade yesithili kwakwelo nqanaba
1094,_london _hq is there any cultural and flag hoisting program this time in on the occasion of independence day for of,i-_london _hq ikhona inkqubo yokuphakamisa inkcubeko kunye neflegi ngeli xesha kwixesha losuku lwe-gundence suku lwe
1095,_friday i have tinnitus and have for it s just the ringing part on occasion i also get the loss of sound you re here unfortunately it never to me to ask a doctor about it,_friday ndine-tinnitus kwaye ndinenxalenye yokukhala ngamaxesha athile ndifumana ilahleko yesandiso apha ngelishwa kungaze kum ukuba abuze ugqirha ngayo
1096,the discussion on 'child privacy and protection online' of the occasion of sociology university making while other and listen _news _sabo,ingxoxo 'yabucala yabantwana kunye nenkxaso kwi-intanethi' yomcimbi weyunivesithi yedyunivesithi esenza ngelixa enye kwaye umamele _news _saboo
1097,and in answer to your question yes i have read about him i have even with him on occasion and he a thoroughly nice man one with his own mind and i have studied all the family given i set up and run a very detailed research archive,kwaye kwimpendulo kumbuzo wakho ewe ndifunde ngaye ndinayo ngaye ngamaxesha athile kwaye uyindoda entle ngokucokisekileyo ngengqondo yakhe kwaye ndiye ndabaleka ndibaleke ndibaleke kakhulu
1098,it s a foreign country so no need i m sure conveniently see it that way on this occasion also which is hilariously,lilizwe langaphandle ke akukho mfuneko yokuba ndiqinisekise ngokulula ukuyibona ngaloo ndlela kwesi sihlandlo kwaye nangokucacileyo
1099,we are sorry to see this which store were you trying to order from on this occasion sam,siyaxolisa ukubona le venkile yayizama uku-odola ngalo mcimbi wam
1100,the deputy amir met with he ambassador of the kingdom of to the state of to greet his highness on the occasion of the end of her tenure in the country,isekela-amrir yadibana nommeli wobukumkani bukarhulumente welizwe lokubulisa ukuphakama kwakhe kwinqanaba lokuphela kwendlu
1101,unfortunately on this occasion we are not offering you the position however the interviewer that you d be a good fit for our organization make up your mind people,ngelishwa kwesi sihlandlo asikukunikezeli kwisikhundla nangona kunjalo udliwanondlebe onokuthi ulungele intlangano yethu ukuba yenze iingqondo zakho
1102,drone definitely have there place but on this occasion phil is shot more impact and is a great composition,idrone ngokuqinisekileyo inendawo apho kodwa kwesi sihlandlo kuso sidubule ifuthe ngakumbi kwaye kukwenziwa okukhulu
1103,in seminar organized by communist party of china w in lac delegation of was by deputy head of of int'l of occasion that led to exchange on validity of in,kwisemina iququzelelwe kwiqela lamakomanisi lase china kwi-lac ye-lac ye-lac yayingusekela intloko ye-int'l yamaxesha akhokelela ekutshintshisweni kwe
1104,i mean my husband leaves his shower disgusting from this black soap he and i will tell him each time i it he on occasion actually it he when cleaning and that i see better than him it s just marriage t it,ndithetha ukuba umyeni wam ushiya ishawa yakhe ikhukulise kule ndlela imnyama kwaye ndiza kumxelela ngalo ixesha xa ndibona ngcono kunaye
1105,if it s the correct occasion i imagine i would yes and as refreshing as it may be and it would be it could still dehydrate me,ukuba ithile ichanekile ukuba ndiya kuba ngu-ewe kwaye ndihlaziya njengoko kunokuba njalo kwaye kuya kuba njalo inokuba incinci kum
1106,_terr _hkfc the photo of about the occasion become one of the legendary by the hong in the by,_terr _hkfc ifoto malunga nelo theko iba yenye ye-leendary yi-hong kwi
1107,it was none other than the censor who said that on no occasion in history our burden so utterly on our well clapped,yayingenguye omnye ngaphandle komthunzi owathethile ngaphandle kokuba akukho qabane lembali yomthwalo wethu ukuqhubela phambili
1108,it is a privilege not a requirement and i guess she chose not to exercise it as the occasion was not that grand,kulilungelo akuyimfuneko kwaye ndicinga ukuba ukhethe ukuba ungayisebenzisi ngokomsitho njengoko bekungekho mkhulu
1109,and are not however they are special occasion,kwaye abakho nangona kunjalo
