,src,trg
762,last night i the first four irredeemable and they me away i think it is the first time i have read an ongoing mark series the pitch is what if superman finally irrevocably snapped and the question is why,izolo i-phesheya yokuqala kwaye ndimkile ndicinga ukuba lixesha lokuqala endikufundileyo uthotho oluqhubekayo lwe-pitch yiyo i-superman i-surtaan nobuchule nobuchule kufuneka i-suprman korgealy
763,he had a day off they do not bring who are ineligible to pitch,wayenosuku lokungazisi abangazisiyo
764,finished my watch through of ace and it s still my favorite series slightly above every time he one of these before he pitch i know his be ready to run through fire for him,igqibile iwotshi yam ye-ace kwaye ist 'tep yam kancinci ngaphezulu ngalo lonke ixesha ephambi kokuba enze i-ping me ndilungele ukubaleka kumlilo
765,c r down pitch for outdoor recreation,c r ezantsi kwe-pitch ye-outdoor ye
766,we own you on and off the pitch,siya kudlula wakho wokugqibela
767,_davet this is a very good question i forgot that had taken that on too my suggestion is surprisingly it is legal with his arms he should be able to all but throw it into the opposing goal from basically anywhere on the pitch,"_davet lo ngumbuzo olungileyo endilibele ukuba uthathele into yokuba umbono wam uyamangalisa, uya kuba nakho kwinjongo yakhe nawuphi na umntu kwi-pitch"
768,cant rate highly he is hardly on the pitch,ireyithi ye-cant kakhulu akukho nzima kwi-pitch
769,best player on the pitch second half,owona mdlali obalaseleyo kwisiqingatha sesibini
770,t bad though he gave always on the pitch,t
771,pitch looking good,i-pitch ijongeke kakuhle
772,i am a maniac i tweak our pitch deck at least times per day the same attention to detail i will apply to everything we design can not wait for you all to see it,ndiyi-maniac i-theak i-theak ye-pitch ye-pitch i-pitch ubuncinci ngemini phantse inkcukacha ezinokufaka kuzo zonke izinto esiyiyila zinokulinda konke ukuyibona
773,hot pitch,ishushu
774,everyone i am beautiful but my are all pitch black,wonke umntu ndimhle kodwa wam yonke into emnyama
775,not that anyone me literally no one but i think truss is the contest the conservative party to have two senior cabinet in s government one clearly making her pitch to the right of the party the other to look sensible,ayisiyiyo loo nto mna ngokwalo kodwa ndicinga ukuba i-truss i-truss ngumbutho olondolozayo ukuba ibe nekhabhathi yesibini e-s e-sure e-sure i-pitch enye ijongene nengqondo
776,could make an appearance at the stadium but definitely not on the pitch,unokwenza inkangeleko kwibala lemidlalo kodwa ngokuqinisekileyo hayi kwi-pitch
777,resource roundup and pitch you can apply to right now,ukurhoxiswa kwezixhobo kunye ne-pitch ungafaka isicelo ngoku
778,going did not know this keep food or anything with a scent such as or lotion far away from to pitch at least from where food been and not to return if a bear comes near an tent,ukuhamba ngendazi ukuba le nto igcina ukutya okanye nantoni na enevumba elinje okanye ilofu ekude ukuba ikhuphe i-pitch ubuncinci ukusuka apho kufanelekileyo kwaye ungabuyi ukuba ibhere isondele kwintente
779,save the date day left to the workshop on public speaking with our partner one of the key of success to an pitch or communication is the ability and the agility when speaking in front of a crowd registration here,gcina umhla oshiyekileyo kwindibano yokuthetha esidlangalaleni neqabane lethu elinye lesitshixo sempumelelo kwisitayile okanye unxibelelwano kukuthetha phambi kobhaliso lwabantu apha
780,it is time for our first man of the match award of the season which player you the most on the pitch since the start of the season,lixesha lendoda yethu yokuqala yebhaso lomdlalo wexesha lokuphawulwa komdlali oyena mntu usesandleni sexesha lokuqalisa kwexesha
781,this is what the people from over the pond class as humour i am sure you do not agree but thought i would offer an opinion of course if lots of flood in i will just take the lead and switch 'em off s,yile nto abantu abavela kwiklasi ye-pond njengabahlekisayo ndiqinisekile ukuba awuvumi kodwa ucinge ukuba ndiza kunika umkhukula ukuba ndizokukhokelela kwaye nditshintshe i-s
782,and yes lots of potential gray for his age needs to mature now and if he s as good as what he could be he needs to start up his game take on more responsibility lead by his on the pitch otherwise he just be for being standard,kwaye ewe ixesha elininzi lokufumana iminyaka yobudala bakhe kufuneka liqolile ngoku kwaye ukuba ihle njengento awayenokuba nayo kufuneka iqale imbopheleleko ye-pitch ngeyodwa ukuba ingaba i-pitch ngeyodwa ukuba ingaba i-pitch ngeyodwa ukuba ingaba i-pitch ngeyodwa ukuba ibe ngumgangatho
783,a quality script can make or break your success if your script is rigid it may come off as too generic and impersonal many reps push their pitch without listening to what the prospect script or commando choose your side,isikripthi esemgangathweni sinokwenza okanye siphule impumelelo yakho ukuba iskrigi yakho iqinile isenokuhamba nje ne-generic kwaye ingenguye abaninzi iphinda ityhafise i-propt yakho okanye i-commato ikhetha icala lakho
784,a lot of it certainly away a strategy are to control our current beat her up on the pitch,ininzi yalo ngokuqinisekileyo kude nesicwangciso sokulawula ukubetha kwethu ngoku kwi-pitch
785,a reporter to what s your best pitch strike one,intatheli yeyona ndawo iphambili kuyo
786,it s that technology that used in to know where to throw their pitch and miss bats,i-scrate yetekhnoloji esetyenzisiweyo ukwazi ukuba ilahle phi i-pitch yabo kunye namalulwane ayo
787,which one the brain cell in that picture or or mad lost it at the tennis pitch again,esona siseli sengqondo kuloo mfanekiso okanye okanye sidlule kwi-tennis pitch kwakhona
788,_craggs _twisted thanks and all my debut i in prison literally off the cuff looking for an without prejudice so i can pitch to,_craggs _twisted thanks and all my debut i in prison literally off the cuff looking for an without prejudice so i can pitch to
789,this is why i know you do not have elite mentality because you are waiting instead of you to send in your pitch and let them decide if they want to continue their retainer or port to a new side,yiyo loo nto ndiyazi ukuba awunayo imvakalelo ye-lentite kuba ulinde endaweni yakho ukuba uthumele kwi-pitch yakho kwaye uvumele isigqibo sokuba bafuna ukuqhubeka nokugcinwa kwabo okanye i-port kwicala elitsha
790,_mets peanut brittle bitten again we re all tried of this he s never around when the team needs him the most perhaps this is for his out when the t give him any run support and he t rack up despite pitch shutout baseball,_mets peanut brittle bulete kwakhona sonke sizame emva kokungaze sijikeleze xa iqela limfumana kakhulu xa le nto inika inkxaso ye-ball
791,_otter hit him with the vee pitch,_tter wambetha nge-vee ye-vee
792,so you never watched the half v rapid is being kind to we shipped in his period on the pitch luckily not to lose when he had a in our box and it to their forward who a sitter because your do not like welsh do not rewrite history,ke awuzange ubukele isiqingatha se-v ngokukhawuleza kukuba sithunyelwe kwixesha lakhe kwi-pitch ngethamsanqa ukuba lingaphumi xa wayengafani ne-titter ngenxa yokuba i-welsh ayiyibhali imbali
793,i can t imagine being in today and thinking the with the game are pitch clock and give a chance lower the mound and,ndiyakwazi ukubacinga ukuba namhlanje kwaye ucinga ukuba umdlalo une-pitch clock kwaye unike ithuba phantsi kwenduli kwaye
794,apply to join next program and get the opportunity to exhibit pitch your venture on a global stage during digital transformation world from in more,faka isicelo sokujoyina inkqubo elandelayo kwaye ufumane ithuba lokubonisa i-pitch i-pitch vent yakho kwinqanaba lehlabathi lonke ngexesha lotshintsho lwedrinta yedijithali ukusuka ngaphezulu
795,another thing i have been skipping is actually just are not fun either don t want to use random for to get there s some pitch moment with bland now guy that i am absolutely doing let me use my team,enye into endiye ndatsiba inyani ingeyiyo i-douch nokuba ungafuni ukusebenzisa i-poll ukuya kufika kumzuzu wokufumana umzuzu wokugxeka ngoku umntu endiwenzayo
796,summer is hot right now but autumn is just around the corner check out when and where you can catch your on the field course pitch and court this fall,ihlobo lishushu ngoku kodwa i-autumn ijikeleze ikona ihlonike nini kwaye apho ungabamba khona kwi-pitch yensimi yensimi kunye nenkundla oku
797,_adriansnchz it is a split comparison on the ground for the simple reason that you can not compare a striker and two because they have different in a pitch before speaking think,_adriansnchnse yinto yokuthelekiswa kwesahluko sezizathu ezilula zokuba ungakholekisi umsasazi kunye nezibini kuba zinamandla kwi-pitch ngaphambi kokuba bacinge
798,that is a part of the sport for sure but he sure can pitch,le yinxalenye yomdlalo ngokuqinisekileyo kodwa uqinisekile ukuba angayifaka
799,over the season break much work been done at the main pitch been alongside the training around the back of the stadium read all about the below,ngaphezu kwexesha lonyaka kuqhekeke umsebenzi omninzi wenziwe kwi-pitch ephambili bekunye noqeqesho olujikeleze ibala lemidlalo ifundwe yonke le nto ingezantsi
800,writing a pitch for a comic is hard however after for almost a week down in a cohesive form is very rewarding it is a huge pay off,ukubhala i-pitch ye-comic kunzima kakhulu emva kweveki kwi-veki nganye kwifom edibeneyo inomvuzo kakhulu kuyimali enkulu
801,i understand the instinct to give it to a player on the pitch but i notice you have not,ndiyayiqonda indalo ukuyinika umdlali kwi-pitch kodwa ndiqaphele ukuba awunayo
802,they could be speaking for all i care not rocket science to know what she s saying in any case straight red for sure get off the pitch now first one as if that was one hell of lazy dangerous challenge,"banokuthetha konke endikukhathaleleyo isayensi ye-rocket ukuze ndikwazi ukuba ngubani na othi tye, ngokungathi kunjalo, ngokungathi sisihogo sengozi"
803,i have just added to my list of useful great execution check it out the list is on,ndikongeze nje kuluhlu lwam lokuphunyezwa okuhle
804,__ trust me karma will have at me on the pitch i m a fan,__ ndithembise i-karma iya kuba nam kwi-pitch fan
805,they had some throw a pitch at me and now they re under,babeyiphosile i-ping kum kwaye ngoku baphantsi
806,these can also highlight data such as the pitch location on this play thought the pitch was behind the batter is,ezi zinokuqaqambisa idatha efana nendawo enamabala kule midlalo icinga ukuba i-pitch yayingemva kwebhendi
807,it is a kick off this evening at the memorial ground for the visit of clubhouse will be open prior to kick off call in and get match drink free entry no the u s are also in action on the cricket pitch against ko,kukukhaba ngokuhlwa ngokuhlwa kwisikhumbuzo sokutyelela i-clubhouse kuya kuvulwa ngaphambi kokukhaba i-king kunye ne-crecy sird ne-crchit sipup to
808,he is accustomed to progressive football both under and under his national team coach so a switch to forest and cooper is style of play would not be a shock to the system i will stop the pitch now,uqhele ukwenza ibhola ekhatywayo kunye naphantsi komqeqeshi weqela lakhe lesizwe ukuze i-switch itshintshele kwihlathi kunye necoadper sisitayile sokudlala
809,_albion great pitch for a league side and nice wee ground,_albion pitch enkulu ye-league
810,my model of whiff probability based on pitch location that this was the worst swing decision of so far probability of contact,imodeli yam ye-shiff enokwenzeka kwindawo yendawo ebiyeyona nto imbi kakhulu yokutshintsha kakhulu ukuza kuthi ga ngoku
811,getting to wow silicon valley pitch for,ukuya ewow silicon valley patch ye
812,this nasty pitch was a strike so i have to give it an attack,le pile ye-tick yayinguloyiko ukuze ndiyeke ukuhlaselwa
813,_h _hampson you are he sharp when he s on the pitch to him but it s very rare,_h _hampson wena uyibukhali xa usamsha kwi-pitch kuye kodwa inqabile kakhulu
814,i am tall is just an amazing pitch to be a us senator,ndimde ndingummangala nje omangalisayo ukuba yi-senator yase-us
815,i sent a proposal pitch to your official some ago it would be a pleasure to work with you on your marketing _ng thank you,ndithumele i-pitch yesindululo kwigosa lakho elidlulileyo kuya kuba yinto eyonwabisayo yokusebenza nawe kwintengiso yakho _ng enkosi
816,is resident s pitch to sell the idea of wind off our just another avenue of our food this time by wind directly in prime commercial fishing like taking dutch land this is not being done by accident,ngaba i-pitch yendawo yokuthengisa imbono yomoya iphela kuphela enye indlela yethu ngokutya kwethu ngeli xesha ngokuloba ngokuthe ngqo kwi-prie doveloment estatal nokwenza isangqa
817,watch broadway s t answer our and sing i can t make you love me in his elevator pitch playbill,bukela i-barballoway ye-st
818,over v on a good batting pitch to beat is absolutely truly but you already know this bet will still lose,ngaphezulu kwe-v kwi-v kwi-v kwi-patch elungileyo yokubetha inyani kodwa sele uyazi ukuba le ge iza kuphulukana
819,he is but he is clumsy bit immobile and very limited with the ball at his but it does not stop him from trying to move the ball up the pitch watched nice so maybe i was catching him on his off days think more regular might give a better assessment,uzame kodwa uyadlala i-billy kwaye anqongophele ngebhola yakhe kodwa ayithinteli ukuzama ukuhambisa ibhola ibukele i-pitch ibukele ngakumbi uvavanyo
820,nana s chain gang all is an uncanny singular feat of literature i never read satire so bruising so so tender and really so pitch perfect it s brilliant just read it,i-nana s chain grang yonke into engacandwanga i-onlylic yoncwadi andizange ndifunde i-satire i-satire ibethelela kakhulu kwaye ndiyifundile i-tetch igqibele ukuyifunda
821,i am at this government dinner and my god it is just incredible to see how in depth they have studied each investor and and are their pitch accordingly a driven team through and through,ndikwelo dadewethu i-termary kunye nothixo wam kuyamangalisa ukubona ukuba bade bafunde njani umtyali mali ngamnye kwaye yindawo yabo eqhutywa
822,i would imagine looking at the line up today that he in central defence though as we fielded another left back too while he was on the pitch,ndiza kucinga ukujonga kumgca namhlanje ukuba ngokuzikhusela okuphakathi nangona siye sahlala sisemva kwakhe ngelixa esecaleni kwesandi
823,sat down with newly senior advisor to discuss his journey in football business and what he to bring to to help in its upwards trajectory on and off the pitch can watch his full interview for free,wahlala phantsi kunye nomcebisi othembekileyo ukuba axoxe ngohambo lwebhola ekhatywayo kunye nento anokuyinceda ekuncedeni kwi-tract yakhe iphela kwaye angabukela udliwanondlebe apheleleyo
824,t even get to pitch last night cause and la,t nokuba ufike kwi-ping pheza izolo ebusuku ngenxa ye-la
825,i was so disappointed this morning i received an bot pitch in my from a full st level connection from the only thing worse than a bot pitch following a connection is someone who bot to you,ndidanile ngoku ntsasa ndifumene i-bot ping kwi-ot evela kumnyhadala wenqanaba elipheleleyo le-st ukusuka ekuphela kwenqanaba elivela ekuphela kweyona nto imbi kune-bot ngu-bot nguwe
826,can t allow win on and off the pitch,ingakwazi ukuvumela ukuphumelela kunye nokucima i-pitch
827,_beam i think those are also down to much more on the pitch martial being around a lot better measure martial is a more rounded footballer better link up better finishing rash finishing is below par,_beam i think those are also down to much more on the pitch martial being around a lot better measure martial is a more rounded footballer better link up better finishing rash finishing is below par
828,are busy and use social media for a lot of one way you can help the media in your world is by being a visible accessible all the time especially when you do not have a pitch,baxakekile kwaye basebenzise imithombo yeendaba zentlalo-ntle yendlela eninzi onokuyinceda amajelo eendaba kwihlabathi lakho kukuba ubonakale kuwo lonke ixesha xa ungenasiphelo
829,pitch your tent at these rad west coast,faka intente yakho kwezi rads ewest coast
830,plenty grease hole until and the year of for the controversy of and the thereof shall be turned into pitch and the dust thereof into brimstone sulphur and the land thereof shall become burning pitch,i-grease hall hole kude kube ngunyaka olonakeleyo lwenzuzo kunye nothuli lwayo ukuya kwi-pitch kunye nothuli lwalo lube yindawo evuthayo
831,just that are helping telford looking after there pitch as part of the s deal they t do the same at we could of kept it more local then,ngaba loo nto inceda i-telford ekhangela i-pitch njengenxalenye ye-s ye-t yenza okufanayo ngelo xesha
832,this article real turning the chair around and sitting on it backwards to talk to the energy edging into essential pitch territory,eli nqaku lokwenyani lijika isitulo lijikelezile kwaye lihleli ngasemva ukuba lithethe namandla e-edday kwintsimi ye-pitch eyimfuneko
833,what me lately is that everybody someone to do something about any given problem but no one to pitch in and help just pick and criticize unless you are actively doing something frankly shut the up for a minute,yintoni le ndimfutshane ukuba wonke umntu enze into ngayo nayiphi na ingxaki enikezwe kodwa akukho mntu ukwi-pile kwaye ancede ekwenzeni into ebonakalayo ivale umzuzu
834,dhoni great sense of humor in pitch which doesnt present in pant,i-dhoni i-dhooni yehight ye-pitch engakhange ivele kwi-pant
835,hope to see you out on the pitch this year big boy,ndiyathemba ukukubona kwi-pitch kulo nyaka mkhulu
836,legendary player on and off the pitch,i-leemary player kwi-pitch
837,i really believe s are because he s throwing too hard too often he always had the ability to rear back and throw but he t need to do that on almost every pitch i don t understand why he the way he when he t need to,ndizikholelwa nyani s kungenxa yokuba uphosa nzima kangangokuba wayehlala enobuchule bokubuyela umva kwaye efuna ukwenza loo ndlela xa efuna
838,are you looking for to support your business growth join our two day workshop exploring local with guidance on a compelling pitch financial plan to support your application sept book your place,ngaba ujonge ukuxhasa ukukhula kwakho kweshishini joining doundap yethu kunye nesikhokelo kwisicwangciso sezimali esikhuthazayo sokuxhasa incwadi yakho yokujonga indawo
839,not only does the league suffer but lose out on as part of their own media package to pitch to if the majority of are on a time zone just do the there,ayisiyiyo kuphela i-leagi kuphela kodwa iphulukane nenxalenye yephakheji yabo yeendaba ukuze ithathe indawo yexesha elikhoyo
840,there is the popular notion that want autonomy therefore support abortion but men want to control by them that right this is a myth identity politics to pitch a gender group against another base the whole narrative on oppression,kukho umbono othandwayo ofuna ukungcungcuthekiswa kwasikhuthazi kodwa amadoda afuna ukulawula abapolitiki abazazisisa i-capt enye ibali
841,two love this it is teaching average fan how much goes into each pitch only issue maybe would be you get on how catcher game,uthando olubini le yindawo yokufundisa i-fan fan ukuba ihamba kangakanani kumcimbi ngamnye we-pitch kuphela yi-pitch kuphela mhlawumbi uya kuba yindlela onokuthi ube ngayo
842,this is what a forward is so you know what to look for forwards to the outfield on an association football team who play furthest up the pitch and are therefore most responsible for scoring as well as,le yinto ngaphambili ke uyazi ukuba ujonge ntoni ngaphambili kwi-outfield iqela lebhola yombutho odlala kakhulu i-pitch kwaye ke inoxanduva lokufumana amanqaku kunye
843,albeit a massive wrong to some in the world of sports is qualification to criticism however you should not be your own while he to his best on the pitch not like that we on for what he does but he is still our own,i-albet iphosakele enkulu kwabanye kwihlabathi lezemidlalo sisiqinisekiso sokugxekwa nangona ungafanele ube seyakho ngelixa enjalo esiya kuba sekukwenzayo kodwa esethu
844,_arm n i will useless you on the pitch the moment we resume,_arm n andiyi kuba nakukwiphepha le-pitch umzuzu siqala kwakhona
845,trump and marvel to encourage or influence to thinking the plan they have is working not t be at marvel and leaving in if they were happy with the content they use false data to present a pitch to get a loan fake data,i-trump kunye nemangalisayo yokukhuthaza okanye impembelelo yokucinga ukuba icebo abalisebenzelayo alisebenzi kwaye liye lonwabile xa besenza idatha yemali mboleko
846,why would everyone pitch in just let buy gas and deal with separately killing will only help russia,kutheni le nto wonke umntu esenza i-pitch ngokuvumela nje irhasi kwaye ukujongana nokubulala ngokwahlukeneyo kuya kunceda irussia kuphela
847,i like watching pitch because he like a guy who s trying to buy a and a huge bag of with quarters at rite aid at am,ndiyathanda ukubukela i-pile kuba ethanda umntu ozama ukuthenga i-a kunye nengxowa enkulu yekota kwi-rite on
848,sadly i am a boomer alum and can confirm when my the campus it was non stop woke pitch he still applied got in but wisely went to instead his degree now money,ngelishwa ndisisilinda se-boomer kwaye ndinokuqinisekisa xa ikhampasi yayingeyondawo yokuyeka i-ping wafaka isicelo safaka isicelo kodwa sesobulumko siye endaweni yoko
849,_ just feel like we need a win regardless of what they do on this pitch i think that s v unlikely for us now,_ ndiziva ngathi sifuna ukuphumelela ngaphandle kwento abayenzayo kule pitch ndicinga ukuba akukho nto ingalindelekanga kuthi ngoku
850,do not forget to take in all of the important information ahead of tonight is match please note that alcohol is only to be inside turnbull is bar tonight and cannot be taken outside in view of the pitch,ungalibali ukuthatha lonke ulwazi olubalulekileyo ngaphambi kobusuku nceda qaphela ukuba utywala bungaphezulu kwe-verbull yibhanti ye-hard kwaye ayinakuthathwa ngaphandle kwi-pitch
851,i think our forwards have been electric on the pitch lucy bronze and bright describe their in word,ndicinga ukuba phambili sethu sombane kwi-pitch lucy bronze kwaye iqaqambile ichaza igama labo
852,it is a pretty sh pitch,yinto entle shi
853,when you take public office you are obliged to act a certain way regarding how you carry yourself and set be it off the pitch litany of or even wee sammy bare arse running through  ispare time',xa uthatha i-ofisi kawonke-wonke unyanzelekile ukuba wenze indlela ethile malunga nendlela oziphethe ngayo kwaye ubeke indawo ye-pitch thetany ye-pitch ye-pitmy ye-asp ngelixesha le-asp '
854,did you know the pitch in history was that is in just sherlock the ai powered digital document bloodhound in the world can analyze rank million in that same amount of time,ngaba ubusazi ukuba imbali yembali yayikuku-sherlock kuphela i-ai ye-ai ye-ai yegadi yegadi yedijithali emhlaba inokuhlalutya isikhundla kwixesha elifanayo
855,thanks also to _app we haven t had time to add them to the poster but they re our partner and of course none of this would have without they funded us and are behind all early stuff site pitch game design lore and more,enkosi kwakhona kwi-_app sitayi inamaxesha ayongeze kwiposta kodwa balisebenzisana neqabane lethu kwaye kunjalo nakuko konke ukuba basixhase kwaye basixhasile kuyo yonke indawo yoyilo lomdlalo we-pitch
856,to pitch a policy you have to connect with a local eda is policy committee it does not need to be your local one i may be able to help with that me that is who authority to suggest new policy that then by member,ukuphelisa umgaqo-nkqubo ekufuneka unxibelelane ne-eda yengingqi ye-eda yikomiti yomgaqo-nkqubo akufuneki ukuba ube yindawo yakho yendawo endinokwazi ukuyinceda loo nto ukuba igunya lokucebisa umgaqo-nkqubo omtsha emva koko ngelungu
857,truss is the best candidate for ni tough bravado on protocol clearly done to bolster her standing amongst rank and file membership erg parliamentary elite for leadership pitch truss gone from being a leftist to to a chameleon like,i-truss ngowona mgqatswa obalaseleyo we-ni orvango okanye umfazi okufundileyo ukuze uvule ukuze uvumbuzo ze-cruter truter truteon
858,to be able to appreciate football and with to be on same page as play on pitch filled with excitement on such an event,ukuze ukwazi ukuyiqonda ibhola kwaye ukuze ube kwiphepha elinye njengoko udlala kwi-pitch igcwele imincili kumcimbi onjalo
859,going to low mid then high pitch mode on late night damn,ukuya ezantsi phakathi kwendlela ephezulu ye-pitch ngobusuku obude bude
860,is not what on the pitch the most important factor and the board have learned from past and as you admit let and his team make the on the football side that is a good thing yes,asikho kwi-pitch eyeyona nto ibalulekileyo kwaye ibhodi ifunde kwixesha elidlulileyo kwaye njengoko uvuma ihambo yebhola ye-eye
861,sterling pon pitch later,i-ponling pon pon
862,a true magician r incredible,umlingo wokwenene r omangalisayo
863,this was one pitch the game was awesome close all the way through and very entertaining with the s up in the it s just who can shoot more and dunk w no defense and the pro bowl is terrible,le yayiyi-pitch enye yomdlalo yayikufuphi isondele yonke indlela kwaye iyonwabisa kakhulu kunye ne-sp kwi-sp kwi-sp kwi-se-ondy as nokhuselekile i-stat
864,while you might be familiar with guest posting i don t think it s often as a practice a lot to happen before more discover your writing and one big obstacle many era via,ngelixa unokwazi ukuthumela i-guest thumela andiyi rhoqo njengento eninzi ukuba yenzeke ngaphambi kokuba ndifumanise ukuba ubhala kunye nomqobo omnye omkhulu uhleli
