,src,trg
524,and what a joke that you profile about being open minded pah,futhi yini ihlaya elifakelwa ngalo ukuthi upende ovulekile ngengqondo
525,i made a joke a while back that we should just drop one f bomb in we don t want marked as for now i see that t even care o_o this is ridiculous,ngenze ihlaya a ngibuyela emuva ukuthi kufanele nje silahle ibhomu elilodwa le-f ku-asinalo umaki njengoba sengibona ukuthi nginehlekile
526,working with i m also the nurse director snack giver father butt end of the joke,ukusebenza nge-i m futhi nomsizi we-nurse director snack giver ubaba tuste of the joke
527,i would like to thank for screwing up my vacation before it even class act your customer service is a joke at best,ngithanda ukubonga ngokukopela iholide lami ngaphambi kokuthi kusebenze kakhulu amakhasimende akho kuyinkonzo yakho yamakhasimende ihlaya
528,can must issue a strong message all the clergy must speak up and protest this act by is unholy and sacrilegious it s not a joke they have reduced to a religion that can be at their convenience it should be very strongly,kungakhipha umyalezo oqinile bonke abefundisi kumele bakhulume futhi babhikishe lo mthetho ngaphandle kokuhlanzeka futhi abahlaziyi baye anciphise enkolweni engaba lula kakhulu kufanele kube lula kakhulu
529,it is it is a joke do not take me seriously,kuyinto ihlaya awungithathi ngokungathi sína
530,it s a joke game it s about arrow not getting a boner,umdlalo we-joke wehlaya mayelana nomcibisholo ongatholi i-boner
531,_ joke or really,_ ihlaya noma ngempela
532,over is a joke,ngaphezulu kuyihlaya
533,it does not sound like a joke when you say it one would normally be out if you said that to them,akuzwakali njengehlaya lapho uthi kuvame ukuba wukuphuma uma usho lokho kubo
534,i dont remember the part where they made a rape joke with and,angikhumbuli ingxenye lapho benza ihlaya lokudlwengula nge
535,you think raising money for abortion funds is a joke,ucabanga ukukhulisa imali yokukhipha imali kuyihlaya
536,ben the dog ruined the name ben for me every time i hear ben first thing i think about is no yes i have a worker name ben and every time i see him all i think about is the dog i can t even talk to him cause i m afraid i m make a ben joke,uben inja yalimaze igama elithi ben ben kimi njalo lapho ngizwa into yokuqala engicabanga ngayo ukuthi anginawo yini igama lokuthi ngicabanga ukuthi inja engingayikhuluma naye ngizenza ngibangela ukuba ngibe nenja ngokwesaba ngiyakwenza ihlaya le-ben
537,rishi is joke opposition to make sure he with the membership the irony being that she will probably win tory will get the leader they deserve and the subsequent kicking at the next ge really depressing,urishi uphikisa amahlaya ukuze aqiniseke ukuthi ngobulungu ubulungu bokuthi u-irony ube yilowo nalowo uzothola umholi azothola umholi abakufanele nokukhahlela okulandelayo e-ge elandelayo ecindezelayo
538,thats a good joke actually,thats ihlaya elihle empeleni
539,he is not a fan,akayena fan
540,its happening all over again how did i slip i tried so hard not to slip its like the world is a joke on me what do i have to do to do right why cant i be just like everyone else,kwenzeka kwayo konke futhi ukuthi ngazama kanjani ukuthi ngizame kangaka ukungashayi amandla anjengezwe yihlaya kimi ukuthi kungani kufanele ngifane nalowo muntu
541,one of my biggest pet about social media is when someone a post and then they reply and say y all can t take a joke i guess people can t recognize a joke you meant that and it was only a joke you got backlash,enye yezilwane zami ezinkulu nge-social media yilapho umuntu eposi bese ephendula futhi athi konke kungathatha ihlaya ngicabanga ukuthi abantu bangabe bebona ukuthi babuyela emuva
542,do people forget they re voting for the next and not for the joke act on x factor,ngabe abantu bayakhohlwa ukuthi bavota ngokulandelayo hhayi ngesenzo sehlaya ku-x factor
543,everything i say is an attempt to crack a joke at the expense of my own existence,konke engikushoyo kungumzamo wokuqhekeka ihlaya ngokulahlekelwa ubukhona bami
544,it is not much more than a joke,akukona ngaphezu kwehlaya
545,we really need or the narrative are a bit of a joke currently most are wanting to take their out to the and have some real story,sidinga ngempela noma ukulandisa kuyinto encane yamahlaya njengamanje iningi afuna ukuthatha lawo liye ku-and and ndaba yangempela
546,joke is on you for speaking that is totally irrelevant he spoke about but this is a different quote stop making everything sound like a huge ass problem,ihlaya likuwe ngokukhuluma okungafanele ngokuphelele wakhuluma ngakho kodwa lesi yisilinganiso esihlukile sokuyeka ukwenza konke kuzwakale njengenkinga enkulu ye-ass
547,what a joke i feel bad for the people you dupe with this roi,yini ihlaya engizizwa kabi kubantu obadukayo nale roi
548,_way_down _richard _ _the_only _drac um why is it a mistake i can not joke around with someone on twitter someone who i have known for quite a while,_way_roung _richard _ _i -only _drac um kungani kuyiphutha angikwazi ukuhlekisa ngakunye nomuntu ku-twitter umuntu engimaziyo ngasikhathi sinye
549,_ the only joke here is people falling for that and getting mad at for it instead of the person who the fake v,_ ukuphela kwamahlaya lapha abantu abawela lokho futhi bahlasele ngakho esikhundleni somuntu ongumkhohlisi v
550,____o it s a joke to say they can cut growth even at m never top line as underlying in decline conclusion true maintenance is m,____o yihlaya ukusho ukuthi bangagawula ukukhula ngisho nasekutholeni okuphezulu okuphezulu njengokungaphansi kwesenqolo ngokwesondlo kweqiniso yi-m
551,_snt literally every movie ever a joke about calling young old people this is nothing new,_snt ngokoqobo yonke i-movie njalo ihlaya ngokubiza abantu abasha abadala lokhu kungekudala
552,_ that s even if true for some then they have to wait till they re to get it joke,_ kunjalo noma ngabe kuyiqiniso kwabanye kufanele balinde kuze kube yilapho bathola ihlaya
553,_chewer_ is this real or just a funny joke,_cheewer_ yiso ihlaya elihle noma nje elihlekisayo
554,boy was but that was a good ass joke,umfana wawungukuthi lokho kwakuyi-ass enhle amahlaya
555,learn from her how to take a joke,funda kuye ukuthi ungawathatha kanjani ihlaya
556,and the worst president ever will no doubt us and give them what they want where s the rest of the un joke world,futhi umengameli obi kakhulu owake waba nanani futhi ubanikeze abakufunayo lapho kuphumula khona umhlaba we-un
557,the person who did it thought it was a funny joke too like dude no,umuntu obekucabanga ukuthi kwakuyihlaya elihlekisayo kakhulu njenge-dude cha
558,can not get more ridiculous than this talking joke of the year,ayinakuthola ukuhlekisa ngokwengeziwe kunalesihlaya sokukhuluma sonyaka
559,_hurricane i even tagged him in a reply late last night you got the joke,_harricane ngaze ngammisela ngempendulo izolo kusihlwa uthole ihlaya
560,i t come crying i came laughing joke was trash end of story you re cause nobody found it funny and instead got out for looking like a knob,ngiza ukukhala ngize ngahleka ihlaya kwakungudoti wendaba olwenza ube yinto engelutho
561,guess that would make and phony as the two phony is in the what a joke i like the video where to people what a maroon,ukuqagela lokho kuzokwenza futhi i-phony njengoba le mpilo emibili ikulokho ihlaya engilithanda ngalo ividiyo kubantu abanjani i-maroon
562,_ what a joke dude is so salty he this year,_ yini ihlaya elingumuntu onosawoti onosawoti onosawoti kulo nyaka
563,i am here for a reason t the one you should joke with,ngilapha ngesizathu sokuthi kufanele uhlahleke nge
564,_zw am i a joke to you,_zw am i joke kuwe
565,go to sleep joke,iya ku-sleep joke
566,this legendary hand from the premier league luke __fullflush __ against one of them the other you just got so it s a joke can you guess who said it watch the video and find out,lesi sandla esidumile esivela kupremier league luke __fulflflush __ ukumelene nenye yazo enye nje ukuthi ivele yathola ihlaya ongakucabanga ukuthi ubani obuka ividiyo futhi uthole
567,sure my loot shall continue what a joke,uqinisekile ukuthi impango yami izoqhubeka ihlaya
568,well if this t just sum up the complete joke of a government political system we have in the at least may some credibility shameful shameful shameful,kahle uma lokhu kufingqa ihlaya eliphelele lesistimu yezombusazwe kahulumeni esinazo okungenani kungahle kube namahlazo amahlazo
569,this to be like an joke right,lokhu ukufana nehlaya kwesokudla
570,your can not do on stage without being an they are the joke of keep it cute copy,ongakwazi ukukwenza esiteji ngaphandle kokuba yihlaya lokugcina ikhophi elihle
571,a joke from start to finish,ihlaya kusukela ekuqaleni kuze kube sekupheleni
572,this country is a huge joke,leli lizwe ihlaya elikhulu
573,again what a joke,futhi yini ihlaya
574,i plan to put on this real life experience into my longer fiction works for my own amusement so if you have read this thread now you are in on the joke too the end,ngihlela ukugqoka lokhu okuhlangenwe nakho kwangempela kwempilo emgqeni wami wezinganekwane zami zisebenza ngokwami ​​ukuzijabulisa ngakho uma ufunde le ntambo manje ususehlaya nasekupheleni
575,y all don t have no pretty sure you re just projecting my definitely t joke about my health or me thanks tho,y konke akunakuqiniseka kahle ukuthi uvele ubhekane ne-to wakhuya yami ngokuqinisekile ngempilo yami noma mina ngiyabonga
576,if i ever get a model i make sure to have a gold eye so i can say me i m already half no one s going to fully get the joke because it s from,uma ngike ngathola imodeli ngiyaqiniseka ukuthi ngineso legolide ukuze ngithi anginalo ngesigamu ngaphandle kokuthola ihlaya ngokugcwele ngoba
577,_n_e it s a burner in today drink ur water,_n_e it s burner namhlanje phuza amanzi ur
578,_ you are such an entertainer that was a fun joke,_ ungumsizi onjalo owawuyihlaya elimnandi
579,_heathstone body it is a joke,_ethstone body kuyinto ihlaya
580,did you hear about they let tommy inn it joke,ngabe uzwe ngabo bavumela i-tommy inyuse ihlaya
581,its a good joke a great joke even,ihlaya elihle elihle ihlaya elikhulu ngisho
582,honestly some of his r good and some are bad he s not really a legend i said that as a joke it s very hit and miss with him he on some he don t know and which is annoying,ngokweqiniso ezinye zezinkulu zakhe futhi ezinye zimbi kangazi ngempela engakusho lokho njengehlaya kushaya kakhulu futhi ziphuthe kuye kwabanye ukuthi angazicasuli futhi okucasulayo
583,_ obvious we know what you mean sublime joke thank you for,_ sobala siyazi ukuthi usho ukuthini i-sublime ihlaya ngiyabonga
584,another m word joke i love this,elinye i-jokisi yamahlaya ngiyakuthanda lokhu
585,_k__ the only thing than this tweet is the people who do not realize it is a joke outing themselves below it,_k__ ukuphela kwento ukwedlula leli tweet ngabantu abangaboni ukuthi ihlaya iphuma ngaphansi kwayo
586,just a joke you i m,nje ihlaya wena mina m
587,transfer are joke,dlulisa ihlaya
588,he s flying and a fleet of wait for him there why not just a speech from the zoom climate is a sick joke designed to break us financially,"ukundiza nokumlindele lapho umlinde khona lapho, ungabi nje inkulumo evela esimweni sezulu sasezoom ihlaya egulayo eyenzelwe ukusephula ngokwezezimali"
589,_gulliver i was making a tiny joke but you not getting that turns out to be exponentially,_ulliver ngenza ihlaya elincane kodwa awutholi lokho kuvela ukuthi kungokwengeziwe
590,i will say it again the man is a joke he was all those in whatever he did in and now he is just making himself worse i do not get his point of being on twitter if all he does is crap on the business why because no one to see him,ngizothi futhi indoda ihlahleyi ihlaya ayeyikho konke okwakukhona nanoma yini akwenzayo futhi manje uzenza kubi kimi ukuthi angitholi i-twitter uma kungenjalo ukumbona
591,when do we get to hear from someone who is not a tory or do the great majority of the country just get to have their opinion on the tory mess never mind just it is all a big joke anyway,sifika nini ukuzwa kumuntu okungeyona i-tory noma i-nto iningi lezwe livele lithole umbono walo ngokudonswa kwe-tory akukaze kube nengqondo nje?
592,is a country where constitutional are more important than the country is name democratic ask to shove it up his a s he does not have the qualification of the to be a member of the parliament is presidency a joke by your,yizwe lapho kubaluleke kakhulu kunezwe libiza ngentando yeningi licela ukuwuhlukumeza alo akanalo ilungu lephalamende liyilungu likamongameli ngehlaya lakho
593,__norris honestly a joke people do not seem to the of but literally every thing you have said had hit the nail on the head this all back many many ago,__norris ngokweqiniso abantu amahlaya ababonakala ngamehlo kodwa ngokweqiniso yonke into oyishilo ishiye isipikili ekhanda lokhu konke emuva abaningi edlule
594,yo we would be killin' it no joke,yo sasizoba yi-killin 'akusilo ihlaya
595,sector big in near joke level that was in order money in they run switch is big pressing area and music given,umkhakha omkhulu ezingeni eliseduze lamahlaya elalihlelekile ngemali ku-run switch indawo enkulu yokucindezela nomculo onikezwe
596,_beastie it s funny neither one of them can take a joke careful tho you might get on the,_beastie it s okuhlekisayo akekho kubo ongathatha amahlaya ngokucophelela utho ungase ungene ku
597,hey and _premier this is a joke i received a parking violation that in my own parking garage with the notice that i was not registered with your system i am not the only resident this to please reach out for assistance,sawubona futhi _pricemier leli ihlaya ngithole ukwephulwa kokupaka ukuthi egalaji lami lokupaka ngesaziso engingagcini ngohlelo lwakho lokhu ngicela ngifinyelele usizo
598,stay the premier league on the front page when they can not even win an this is why ea is a joke,hlala upremier league ekhasini elingaphambili lapho angakwazi ngisho nokuwina nalokhu yingakho i-ea ihlaya
599,i hate the as a joke i don t actually sometimes but it s fun,ngiyakuzonda njengehlaya engingafuni ngokwezinye izikhathi kodwa kube mnandi
600,become a bit of a joke may be they need a bit of a face lift to gain credibility,ube yihlaya kancane kungenzeka ukuthi badinga okuncane kokuphakamisa ubuso ukuze bathole ukuthembeka
601,_ it s a joke why can t you just laugh and move on,_ yihlaya kungani kungahle uhleke bese uqhubekela phambili
602,overall this game is a joke,sekukonke lo mdlalo kuyihlaya
603,this market in the last been an absolute joke,le makethe ekugcineni ibilokhu ihlaya ngokuphelele
604,_szn _xx cos this country is a joke,_szn _xx cos leli lizwe ihlaya
605,nothing how much of a joke modern media become that than this article,akukho lutho lwemidiya yanamuhla yanamuhla eba yileso sihloko
606,it s always joke saying all these of rubbish about men edit and put then it s all of blood and catarrh how t from angle of desire,ihlaya ihlaya lisho konke lokhu kodoti mayelana nokuhlela kwabesilisa futhi kube ngu-s konke kwegazi ne-catarrh kanjani kusuka ku-angle yesifiso
607,old joke when old timer watched young boy carry out of he that when he was his age he t able to carry of,ihlaya elidala lapho i-timer endala ibukwa umfana omncane enza kuye ukuthi lapho eseneminyaka yakhe
608,_therad don t ruin the joke please,ngicela unciphise ihlaya ngicela
609,any church that them at this point is a joke,noma yiliphi isonto labo kuleli phuzu liyihlaya
610,wow you just made my whole life is a failure i really t care about the number of people i don t even know that follow me on an on my phone until you gave me your mind perspective you took my joke a little too serious don t you think learn to laugh,wow wenzele impilo yami yonke ukwehluleka engikhathalela ngempela inani labantu engingazi nalo ukuthi ngilandela ngombono wami uze unginike umbono wami owuthathe kabi kakhulu cabanga ukufunda ukuhleka
611,the are the worse joke joke,amahlaya amahlaya ambi kakhulu
612,no pro cross play what an absolute joke,akukho pro cross play lokho ihlaya eliphelele
613,so that tweet t a joke,ngakho-ke i-tweet t ihlaya
614,that joke would not fly today and it should not have back then either especially when you read up on,ukuthi ihlaya ngeke lindize namuhla futhi akufanele libe khona lapho ikakhulukazi lapho ufunda khona
615,_jk same what a joke,_jk efanayo ihlaya
616,_ali the human back was a mean joke,_ali umhlane ongumuntu bekuyinto ihlaya elishiwoyo
617,i am pinching myself too at first it nothing more than a joke to me,ngizicindezela futhi ekuqaleni akulona lutho ngaphandle kwamahlaya kimi
618,no joke i was thinking of doing this for a while now it is hilarious that even are getting,alikho ihlaya ebengicabanga ukukwenza lokhu okwesikhashana manje liyathandeka ukuthi ngisho nokuthola
619,_scapelli it s funny you correlate to being a joke but it the same breath say you re fighting for in full movie i guess they re not really a joke,_scapelli it s okuhlekisayo uhlangana nokuba ihlaya kodwa kuwukuphefumula okufanayo usho ukuthi ulwela i-movie egcwele ngicabanga ukuthi ngeke kube ihlaya ngempela
620,corporate are a joke,i-corporate ihlekisa ihlaya
621,i saw that and thought it was a joke,ngikubonile lokho futhi ngacabanga ukuthi bekuyihlaya
622,honestly how dare you fix your dude again what a joke,ngokweqiniso ukuthi ungenza kanjani ulungisa i-dude yakho futhi ukuthi yini ihlaya
623,_ceifero that sense i t sure if you were the phrase as a joke or as short hand,_ceifero lowo mqondo angiqiniseki ukuthi ngabe uyigama njengehlaya noma ngesandla esifushane
624,sorry that was a crap joke,uxolo lokho kwakuyihlaya le-crap
625,some people like they were in on the joke i was never them but i felt a lot,abanye abantu abanjengabe bangene kumahlaya ngangingakaze kubo kodwa ngazizwa ngiseningi
626,its a joke calm down,ihlaya layo lizolile
627,man both political are a joke too cant get no where,umuntu womabili ezepolitiki ahlaya amahlaya angenakuthola ukuthi akukho kuphi
628,what a joke these lie and do not even try to hide it and of course look whose first in line for the photo,yini ihlaya eliqabula amanga futhi ungazami ngisho nokukufihla futhi kunjalo abukeka elokuqala kulolo lonke isithombe
629,hi ady going just me how much the at town most that we had when wild was manger have ship him at barrow now gone on love island thinking a quick buck no will be a joke this season sorry but will,sawubona ady wungihamba kakhulu emzini esikhulu kakhulu esake saba nayo lapho umkhombe emthumbe emgodleni manje uhambe onothando isiqhingi sicabanga ngehlaya ngiyaxolisa kodwa uzokwazi
630,na this to be a joke,nalokhu ukuze ube ihlaya
631,the guy who all the the time like he for something like he like he is a man shut up you sir are an embarrassment you let yourself become a joke and the sad thing is you do it every day change man change,umfana onjengaso sonke isikhathi esifana naye ngokuthile okufana nokuthi uthanda ukuvalela wena mnumzane uzivumele ukuba ube ihlaya kanye nento edabukisayo ukwenze nsuku zonke ushintsho lwendoda
632,madden becoming a joke no,madden ukuba yihlaya cha
633,how do you pat yourself on the back and proclaim you protect that is a joke,uzithobisa kanjani ngemuva futhi unimemezela ukuthi uyavikela lokho kuyihlaya
634,i love this running gag svt is alternative where theyre after and i feel my pride swell up with how i understand the context of the joke to an extent,ngiyakuthanda le gag ​​svt ye-running ngenye indawo lapho ngiqala khona futhi ngizwa ukuqhosha kwami ​​kugcwala ngendlela engiqonda ngayo umongo wehlaya ngezinga elithile
635,this is a joke where is,leli ihlaya likuphi
636,that was my lame attempt at a joke,lowo bekuyimizamo yami yezinyonga ehlaya
637,honestly there are so many she did that i make a thread like we were eating and i t eat a lot this bitch an entire big spoon onto my plate she also said if we t allow her to win the card game we re it t a joke,ngokweqiniso baningi kakhulu akwenzayo ukuthi ngenza intambo njengoba ngangidla kakhulu nalokhu ngidla lo mlomo omkhulu epuletini lami naye washo uma simvumela ukuwina umdlalo wamakhadi
638,that joke sure is funny after the th time,lokho ihlaya nakanjani kuyahlekisa ngemuva kwesikhathi sesikhathi
639,you re a joke u call for the police in ur crime ridden derelict of a city that i work in yet you have private security for by tax no doubt oxymoron t it let your suffer while u reap the trash yer nothing but pure vile trash,ufuna amahlaya ubiza amaphoyisa ebugebengwini be-ur ridded derelict yedolobha engisebenza kulo nokho ninokuphepha kwangasese nge-oxymoron t ukuthi ivumela ukwelashwa kwakho ngenkathi uvula udoti wakho
640,top he don t even play should definitely be and in the top this whole list a joke backup is better than him,phezulu angadlala nakancane kufanele kube futhi phezulu kulo lonke uhlu lokulondoloza ihlaya lungcono kunaye
641,_ayeonie fun joke on you your girlie boss surely copycat our since debut until now the man will take note of what did or wear as that old man to be original stop or trying to make ae as they are not even in the same level,_ayeonie fun joke kuwe umphathi wakho we-girlie ngokuqinisekile copcopcat wethu kusukela manje le ndoda izobona ukuthi le ndoda izokwazisa yini ukuyeka noma ukuzakhela lokho njengoba kungenjalo ngisho nakumazinga afanayo
642,_ no cross play for is a joke,_ akukho mdlalo we-cross wehlaya
643,_elcalde the no take out rule am i a joke to you,_elcalde the no thatha rule am i joke kuwe
644,the joke is maybe we should open an investigation c into the trump administration before they went into the _office apparently my new lead is trump cabinet that is the centaurus a galaxy operation detective universe,i-joke mhlawumbe kufanele sivule uphenyo c kubaphathi be-trump ngaphambi kokuthi bangene ku-_office ngokusobala ukuhola kwami ​​yi-trump ikhabhinethi eyi-galaxy option detector universe
645,there was literally the same joke in the,kwakunenjabulo efanayo ku
646,the most joke ever,ihlaya kakhulu
647,labour are certainly not a joke but this current government is open your,izisebenzi ngokuqinisekile aziwona ihlaya kepha lo hulumeni wamanje uvula eyakho
648,what explain exactly what is extreme about a wanting a free country and a fiscally responsible government 'poilievre is are extreme' that is why he is his to the all over the country because of his 'extreme views' what a joke,yini echaza kahle ukuthi yini eyeqisayo ngokufuna izwe lamahhala kanye 'nobukhosi bukahulumeni obophezelelwa ngemali' yingakho ungeyena kulo lonke izwe
649,i know i made a heinous crime of a joke too,ngiyazi ukuthi ngenze ubugebengu obumnandi kakhulu
650,i would watch that but they would probably make a f king joke,ngingabuka lokho kodwa kungenzeka ukuthi benze i-f king joke
651,there t a joke just a statement,kukhona ihlaya isitatimende nje
652,with unknown you a big joke sir,ngokungaziwa wena ihlaya elikhulu mnumzane
653,is a joke is the real thing here you will see in,kuyinto ihlaya yinto yangempela lapha uzobona kuyo
654,what kind of a joke it is when even and just go along with a violent merger of state and capital basic human calling everyone against this literal fascism a fascist and a far right wing subhuman dead,hlobo luni lwamahlaya okuthi lapho noma futhi vele uhambisane nokuhlanganiswa okunobudlova komuntu obiza umuntu obizayo wonke umuntu ngokumelene nalesi fascism angokoqobo
655,now that s a funny joke,manje leso sahla esihlekisayo
656,this tweet was purely a joke people can be anti but that is prob not the case anyways,leli tweet lalingamahlaya abantu angaba anti kodwa lokho akulona icala
657,i m pro right and engage with very often but i don t want to risk myself to say a bad joke and be as,i m pro ngakwesokudla futhi ngihlanganyele kakhulu kodwa angifuni ukuzibeka engcupheni yokusho ihlaya elibi futhi ngibe njengoba
658,_roy please be a joke,_roy ngicela ube ihlaya
659,in and made him a joke by the time the next election rolled around t wait in and a two term president,ngaphakathi futhi wamenza ihlaya ngesikhathi ukhetho olulandelayo lugobhoza ngalutho ngilinde khona nomongameli wesikhathi ezimbili
660,this is an inside joke between me and cause we are,leli ihlaya elingaphakathi phakathi kwami ​​futhi libangela ukuthi sikhona
661,what a joke see who is preceding the one who was on both sides of the law in the same matter before the same bench he may be senior advocate but not worth it congress only made him what he is today,yini ihlaya elibona lona elandulele lezo ezasisezinhlangolweni zomthetho ngendaba efanayo ngaphambi kokuba ibhentshi efanayo ngaphambi kokuba abe nebhentshi elifanayo kungenzeka ukuthi libe yicongress kuphela lamenza wamenzela lokho namuhla
662,that is handy joke intended,lokho kuyihlaya elusizo okuhlosiwe
663,of start because someone has not eaten yet,okokuqala ngoba umuntu akakaze adle okwamanje
664,_glow the joke being that i am due to lack of folk,_glow ihlaya ukuthi ngingenxa yokuntuleka kwabantu
665,she s a joke surely you re just winding us up now t you,uhlekisa ngokuqinisekile uvele ususe usenze manje
666,hope you feel better covid t a joke,ngiyethemba uzizwe ungcono nge-covion t ihlaya
667,wait i thought this was a joke,ngilinde bengicabanga ukuthi lokhu bekuyihlaya
668,i never say a peep i never say a single word i barely even joke about i leave you to your thing do not make any but if it were me i just know you would tell me they were flirting with me because you just can not believe anyone can just genuine enjoy talking to me,angikaze ngithi i-peep angikaze ngiyisho igama elilodwa angiyeki ihlaya ngami ngikushiyele entweni yakho ungenzi nje ukuthi ungangitshela ukuthi ngabe ungothando nami ngoba awukwazi nje ukukholwa noma ngubani ungathanda ukujabulisa nje ukukhuluma nami
