,src,trg
1011,great and informative post thank you for all this in one spot,okuhle futhi okufundisayo okuthunyelwe ngiyabonga ngakho konke lokhu endaweni eyodwa
1012,_baklon might help your credibility if you why you think that like m disagree with you presumably you accept that they are to informative and up to date about the countryside,_baklon kungasiza ukuthembeka kwakho uma kungani ucabanga ukuthi njenge-m angivumelani nawe ngokunokwenzeka wamukela ukuthi kufanelekile emaphandleni
1013,all the lost during the early of like some of you i do question if posting those are informative or contribute to the we face on a daily basis sometimes there is no easy answer but to post them,bonke abalahlekile ekuqaleni kokufana nothile kini ngiyababuza uma ukuthumela lokho kufundisa noma kufaka isandla ku-daily nsuku zonke akukho mpendulo elula kodwa ukuze uzithumele
1014,there is some great in here already so i will go with royal the alarming history of royalty for something more light hearted and funny while still being broadly informative about aristocracy,kukhona okuhle lapha vele ngakho-ke ngizohamba neroyal umlando owethusayo wobukhosi ngokuthile okukhanyayo okukhanyayo nokuhlekisayo ngenkathi kusafundisa kakhulu nge-aristocracy
1015,to add to this line of thought the kitchen cupboard video is also informative in that we see him be rather violent there and it is clear that he would been drinking although not enough to get him intoxicated,ukwengeza kulomugqa wokucabanga ukuthi ikhishi cupboard video liyafundisa futhi ukuthi simbona enobudlova lapho futhi kusobala ukuthi ubezokwazi ukumthola kudakiwe
1016,this tutorial is really informative,lesi sifundo sifundisa ngempela
1017,come have lunch on us will be to a lunch by neighborhood there is still time to register for this informative event w free event open to community are limited please register at,woza udle isidlo sasemini kuzodla isidlo sasemini ngomakhelwane kusenesikhathi sokubhalisela lo mcimbi ofanelekayo womcimbi ovulekele umphakathi ukhawulelwe sicela ubhalise ku-
1018,i to  is episode with _uk this weekend it was really informative but exactly to collaborative living and us considering our needs definitely recommend a listen,i to episode nge _uk kule mpelasonto ibinolwazi ngempela kepha empeleni ngokuhlala ndawonye nathi ukucubungula izidingo zethu nakanjani zincoma ukulalela
1019,are car spending informative about the s we answer this question within a rich model large to wealth and future income explain average in consumption and car spending and across,ingabe ukuchitha imoto kufundisa nge-s siphendula lo mbuzo ngaphakathi kwemodeli ecebile enkulu kuya kwengcebo nakumholo ozayo kuchaza isilinganiso esilinganiselwe ngokusetshenziswa kanye nokusebenzisa imali
1020,harry s opinion on anything he and his delusional wife can become a comedy act dumb and how do these people think whatever they say is supposed to be informative or believable still you can t fix stupid,umbono kaharry kunoma yini yena nomfazi wakhe okhohlisayo bangaba yi-act act bubmun futhi bacabanga kanjani laba bantu okuthiwa banolwazi noma abakholeki namanje ungakwazi ukulungisa isiphukuphuku
1021,be sure t register for next week is where i will be speaking with regarding our upcoming book release register for this informative go to by the link in the section below,qiniseka ukuthi ubhalise ngeviki elizayo lapho ngizobe ngikhuluma khona maqondana nerejista yethu ezayo yokukhishwa kwencwadi yalolu hlelo lokusebenza luya ku-link esigabeni esingezansi
1022,this thread is wild ly informative i never even thought about this but as it turns out it s a thing,le ntambo inolwazi lwasendle angikaze ngicabange ngalokhu kodwa njengoba kuvela ukuthi kuvela into
1023,why do not you read it on their it is very informative i will get you the link if you want or you could the world economic forum,kungani ungakufundile ku-it yabo kuyafundiseka kakhulu ukuthi ngizokutholela isixhumanisi uma ufuna noma ungahle ungakwazi ukwenza i-world economic forum
1024,eh half agree it on what you mean when you say does imperil x as correctly all that is if you have five not what the text of per se but dobbs' text can be informative on whether we think there are five such,i-eh half iyavuma lokho okusho ukuthini lapho uthi i-impelial x ngendlela efanele konke uma ungafundisi ukuthi ngabe kungowona yini umbhalo wangempela wokuthi ngabe kukhona okuhlanu okunjalo
1025,_backstrom very informative post worked around the area for a little while and why it the way it is,iposi elifundisayo kakhulu elisebenza kahle lisebenze endaweni isikhashana futhi kungani linjalo
1026,this is just inspirational rather than informative,lokhu kukhuthaza nje kunokufundisa
1027,well her tweet is very informative for,kahle i-tweet yakhe inolwazi kakhulu
1028,this is such a great story very inspirational and informative,le yindaba enhle kangaka ekhuthaza kakhulu futhi efundisayo
1029,i am so sorry unfortunately nothing is surprising please take care of yourself watch your surroundings you are extremely informative of the truth i appreciate everything you do,ngiyaxolisa ngeshwa akukho lutho olumangazayo sicela uzinakekele ukubuka okukuzungezile okufundise kakhulu ngeqiniso engikwazisayo konke okwenzayo
1030,and for your informative session give us time some of us so late helping me to catch up for being a voice for all the in,futhi isikhathi sakho esifundisayo sisinikeza isikhathi abanye bethu sekwephuze kakhulu ukungisiza ukuba ngibambe ngezwi lakho konke
1031,very informative visit to today on behalf of the realtor giving network there will be better on tonight thanks to the and for their and hearts,ukuvakasha okufundisayo kunamuhla egameni le-realtor ukunikeza inethiwekhi kuzoba ngcono kulobubusuku sibonga futhi ngezinhliziyo zabo
1032,i agree it was a very fun show interesting and informative at the same time its always fun to learn about other by just watching a show or a movie i will never understand the hate it got,ngiyavuma ukuthi bekuwumbukiso omnandi kakhulu othokozisayo futhi unolwazi ngasikhathi sinye kumnandi ngaso sonke isikhathi ukufunda ngokubuka nje umbukiso noma i-movie engingeke ngiyiqonde
1033,a sobering informative thread on putin is war against by my the chief of staff to dissident,intambo enolwazi enolwazi eputin iyimpi ngokumelene nenduna yami yabasebenzi ukuze bahlaselwe
1034,really informative thread a lot of these same can be when learning a language,intambo efundisayo ngempela inqwaba yalezi zinto ezifanayo ingaba lapho ufunda ulimi
1035,good for you some twitter can be so informative,kuhle kuwe i-twitter engafundiseka kangaka
1036,saw it on cannot wait for part it was informative and fun i have been watching most of the time since genie was was a fantastic producer,wakubona akwazi ukulinda ingxenye bekujabulisa futhi kumnandi bengilokhu ngibuka isikhathi esiningi njengoba ugenie wayengumkhiqizi omuhle
1037,this is an outstanding and informative thread thank you,le ntambo evelele futhi efundisayo ngiyabonga
1038,wow even sky news were trying to do informative back in how dare they,izindaba ze-wow ngisho ne-wow babezama ukufundisa emuva ukuthi bangenza kanjani
1039,hierarchy can certainly make or break a design really informative post,i-hierarchy ngokuqinisekile ingenza noma yephule umklamo ofundisayo ofundisayo
1040,perhaps one of the best i have ever read very informative with links to do your own research and come to your own always follow the money,mhlawumbe enye yezinto ezinhle kakhulu engake ngazifunda kakhulu ngezixhumanisi zokwenza ucwaningo lwakho futhi ziza ngokwakho zilandela imali yakho njalo
1041,this interview is a must watch fun honest informative pete is relaxed,le ngxoxo kumele ibuke fun fun enolwazi efundisayo uphumule
1042,hop on will be very informative,i-hop kuzobalula kakhulu
1043,an informative and silly notice about anti bee language,isaziso esifundisayo nesithutha ngolimi lwe-anti bee
1044,_tua i just inquire it is not toxic it is informative,_tua ngivele ngibuze ukuthi akayona into efundisayo
1045,_n_jackson no troll the paragraph you cherry picked is not per se solid research it is inference but it is informative and much more solid than saying we need a new law whenever someone the that no one is serious about or that a bill is common sense,_n_jackson akukho pharali lesi sigaba osikhethwe ucherry asisilo cwaningo oluqinile kodwa lunolwazi futhi luqinile kakhulu kunokuba ludinga umthetho omusha noma nini lapho umuntu onobunzima
1046,this guy is legit your breakdown of seed was very informative,lo mfo umlenze ukuwohloka kwakho kwembewu kwakufundise kakhulu
1047,it was an honor to join to the burbank for a screening of its spring it was a very moving and informative film about the of violence and hate upon the people as well as their inspirational resolve,kwakuyilungelo lokujoyina i-burbank ukuze kusheshe ukusheshisa kwentwasahlobo yalo kwakuyifilimu eshukumisayo futhi efundisayo mayelana nodlame nokuzonda kubantu kanye nokuzimisela kwabo okukhuthazayo
1048,thanks for your most informative hope you are back to full health,ngiyabonga ngethemba lakho elifundisayo kakhulu ubuyela empilweni ephelele
1049,you wrote a note and the teacher said it was a informative story on a panda who a baby girl,ubhale inothi futhi uthisha uthe kuyindaba efundisayo kwi-panda engubani intombazane ingane
1050,wrote a fantastic primer for the novice and included just enough to us more seasoned interested great piece wonderfully informative a rated story,wabhala i-primer ebabazekayo ye-novice futhi wafaka nokwanele kithi onolwazi oluningi olunentshisekelo olunentshisekelo efundisayo ngendaba evunyelwe
1051,_tom what a brilliant find funny informative thought provoking just a great listen any other 'geeks' out there these are great,_tom ukuthi uvelele ukuqonda okufundisayo okuhlekisayo ukuvusa ukulalela kakhulu noma yimaphi amanye ama-geeks 'ngaphandle la ukuthi lezi zinhle
1052,i m sorry beth but what is the point in us following this so closely millions of us t able to vote for them tell us instead what the and other are doing it d be much more educational informative and much thanks,ngiyaxolisa nge-beth kepha liyini iphuzu kithi elilandela lokhu kakhulu izigidi zethu zase-us t ezizozivota zona zisitshela ukuthi yini enye efundisayo efundisayo nokubonga okuningi
1053,you are the legend you bring us trek news and and they are always creative interesting and informative,uyi-legend oyiletha izindaba ze-trek futhi futhi zihlala zikhanga futhi zinolwazi
1054,i am out of practice writing long informative,ngiphelelwe yimikhuba yokubhala efundisayo
1055,our went into the community for some fun and informative thank you center and museum of art for being gracious and with us to support our summer program,ezethu zangena emphakathini kwabanye ukuzijabulisa futhi ezifundisayo ngiyabonga center kanye nemnyuziyamu yobuciko bokuthi unomusa futhi nathi ukusekela uhlelo lwethu lwehlobo
1056,we have three and informative live earn your with learn more and register at,sine-live ezintathu futhi efundisayo thola ukuthi ufunde kabanzi futhi ubhalise ku-
1057,history to life leach is a author and professional speaker from the war of to the cold war is in demand for his entertaining and informative,umlando welife leach ngumbhali futhi uchwepheshe usomlomo ovela empini yempi ebandayo ufunwa ukuzijabulisa kwakhe nokufundisayo
1058,_shehab i know you t here acting like you got an informative take on anything,_shehab ngiyazi lapha ukwenza sengathi uthola ukuthatha okuthile
1059,some may not know that teeth sensitivity may be by sugar it can damage your teeth and wear away the protective enamel here is an informative article if you think your teeth are sensitive to sugar,abanye kungenzeka bangazi ukuthi ukuzwela kwamazinyo kungaba ngoshukela kungalimaza amazinyo akho futhi kuguqe khona okuvikelayo lapha kuyinto efundisayo uma ucabanga ukuthi amazinyo akho azwela ushukela
1060,_backstrom thank you for such an informative thread,_backstrom ngiyabonga ngentambo efundisayo
1061,reading daemon by right now it is a little out of my comfort zone which is what i want and it is a really informative book i am learning a lot,ukufunda i-daemon ekuqaleni manje kungukuphuma kwendawo yami yokududuza okuyinto engiyifunayo futhi kuyincwadi efundisayo ngempela engiyifundayo kakhulu
1062,on my walk this morning interesting and informative discussion will as a tennis fan i your observation of s champion although i did get pleasure knowing that russia t think that she was good enough to support,ekuhambeni kwami ​​kule ngxoxo ethokozisayo futhi efundisayo izokwenza njengomlandeli we-tennis i-s
1063,went to the  nothe house of the guru' event this weekend in a safe informative space to ask lots of about the ways in which a gurdwara is how is really recommend see you there next year,waya endlini ye-nothi yomcimbi we-guru 'kule mpelasonto endaweni ephephile yokufundisa yokubuza izindlela eziningi lapho i-gurdwara yindlela encoma ngayo lapho ngonyaka olandelayo
1064,_antivax_bs no it is information emotionally neutral and essential for a full picture caution not fear mongering assuming his intent to do with your perception which been informed by a heavily environment normal practice is to be thorough and informative,_antivax_bs no ulwazi lokungathathi hlangothi ngokomzwelo nangokomzwelo olungathathi hlangothi ngokomoya hhayi ukwesaba ukusunduza ukuthatha inhloso yakhe ukukwenza ngenhloso yakhe enomuzwa onolwazi oluningi olwenziwe kahle futhi lufundise
1065,big to of caribou cabin for leading a tremendously informative bird watching activity who knew that those little brown could literally peck a small camper nearly to death we learned a lot,ikhabethe elikhulu lecaribou lokuhola inyoni efundisayo efundisayo ebuka umsebenzi owayaziyo ukuthi labo nsundu abangabamba i-camper ecishe baze bakwazi ukufa
1066,_jermyn informative as ever looking forward to more to stay safe during this period,_jermyn ifundise njengake wabheka phambili ukuze uhlale uphephile ngalesi sikhathi
1067,for those who read scientifically this paper can be informative for those who read instinctively this paper the evidence,kulabo abafunda ngokwesayensi leli phepha lingaba nolwazi labo abafunda ngalolo phepha lobu bufakazi
1068,thanks to everyone who our for deputy leader we found it tremendously informative and we hope it you decide how to vote this august coming up next our panel discussion,siyabonga wonke umuntu ongumholi wethu wephini lethu esikutholile sifundisa kakhulu futhi sethemba ukuthi uthatha isinqumo sokuthi ungavota kanjani lokhu kuza ngengxoxo yethu yephaneli
1069,thank you for your informative content and for your research with us,ngiyabonga ngokuqukethwe kwakho okufundisayo kanye nocwaningo lwakho nathi
1070,yes i complain a lot on here now because for the first year and half of covid i tried to be informative and then may and i said f it,yebo ngikhononda kakhulu lapha manje ngoba ngonyaka wokuqala kanye nengxenye ye-covid ngazama ukufundisa bese ngishilo futhi ngishilo
1071,very informative thread can not wait to be a part of this game utility go read up,intambo efundisayo kakhulu ayikwazi ukulinda ukuba yingxenye yalolu hlelo lokusebenza lomdlalo lufunde
1072,i recommend the revolution generation engaging and informative,ngincoma ukuthi isizukulwane senguquko sokuguqulwa sihlanganyele futhi sifundise
1073,carl and had an interesting conversation on which i found quite informative with what i people who have actually lived there both,ucarl futhi waba nengxoxo ethokozisayo engathola ngayo efundisa ngayo nalokho engikuyo abantu empeleni abahlala lapho bobabili
1074,thanks for this informative and,ngiyabonga ngalokhu okufundisayo futhi
1075,young need intellectually well read non bigoted and informative less hatred less zealotry less divisive oh wrong place i guess,i-young disdinga ngokunengqondo funda kahle ukufundwa kahle okungafundile futhi okufundiswayo okungafundile inzondo kancane kancane ukuhlukahluka okuhlukanisayo okungafani ngendawo engalungile
1076,_xo man i your shorts post very informative for me,_xo man i ama-shorts akho eposini afundise kakhulu kimi
1077,_amir this is really informative thanks for it,_amir lokhu kungukubonga ngempela ngakho
1078,what drama and you still have not my question you have been posting this whole time while i have been posting all the informative good grief this is with,yini idrama futhi awusenayo umbuzo wami ngabe uthumele sonke isikhathi sonke isikhathi ngenkathi ngithumele lonke usizi oluhle olufanele lokhu
1079,join us for an engaging and informative session light dinner provided,sijoyine ngeseshini yokuzibandakanya futhi efundisayo
1080,i learned about internment in elementary school but nobody told us about repatriation learned that by walking in and reading informative on the street,ngifunde mayelana nokuqeqeshwa esikoleni samabanga aphansi kodwa akekho owasitshela ngokubuyiselwa kabusha okufundile ukuthi ngokuhamba nokufunda efundisayo emgwaqweni
1081,really informative and interesting event in last week and my first presentation in person in over through it without once slipping into i am just going to share my screen,umcimbi ofundisayo futhi othokozisayo esontweni eledlule kanye nesethulo sami sokuqala kumuntu odlulile ngakho ngaphandle kwalapho ngingena nje ukuthi ngizokwabelana ngesikrini sami
1082,this really well done and informative animation by,lokhu kwenziwa kahle futhi okufundisayo nge
1083,after the beautiful of two of disaster and then a journey to find another mayor th municipal election such an informative and interesting ga that you can not stop watching it,ngemuva kokuhle kwababili inhlekelele bese kuthi-ke uhambo lokuthola enye imeya th ukhetho olufundisayo futhi oluthakazelayo lwe-ga ongeke ukwazi ukulibuka
1084,and the primary program this to be a fantastic very informative useful book written by my amazing _molloy,kanye nohlelo lokuqala ukuthi lokhu kube yincwadi ethokozisayo enolwazi olubhalwe ngokumangalisayo nge-_mollol yami emangalisayo
1085,damn that site is fire nice and informative thanks for the recommendation,damn lelo sayithi liwumlilo omuhle futhi ofundisayo siyabonga ngokuncoma
1086,hilarious yet so informative,hilarious okwamanje efundisayo
1087,i was to see something informative like a not a hold that l tight clown nose mockery dude,bengizobona okuthile okufundisayo njengokuthi akukhonjwa okuthi yi-l fan clown ekhaleni inhlekisa
1088,how can we strive for simple but informative when and training load data,singalwela kanjani ngokulula kepha okufundisayo lapho futhi kufanelekile idatha yokufunda
1089,this is a big deal just finished reading don t dredge lake ben s article is fully backed with and very informative,lokhu kuyisivumelwano esikhulu nje sekuqedile ukufundwa kwe-don t dredge lake ben arthir kusekelwa ngokuphelele futhi kufundisa kakhulu
1090,libertarian web content here is an opportunity to work really hard girl fun informative work,okuqukethwe kwe-ibrary web okulula lapha yithuba lokusebenza kanzima
1091,this whole thread is extremely informative these,le ntambo yonke iyafundisa kakhulu lezi
1092,i would venture to say less chat about more of your although your commodity related are always very informative,ngingahle ngiveze ukuxoxa okuncane mayelana nokuningi kwakho yize izinto zakho ezihlobene nezimpahla zihlala zifundisa kakhulu
1093,i was lucky enough to receive a copy of this from _mrp and i m so glad i did i m already stuck in this relatable and hilarious look at the life of is as informative as it is entertaining for both and non alike,ngaba nenhlanhla ngokwanele ukuthola ikhophi yalokhu kusuka ku-_mrp futhi ngijabule kakhulu ukuthi sengivele ngibambeke kulokhu okufundisayo futhi okuqondayo
1094,a fascinating and informative thread in which someone from the world of dance a prominent gc is nonsense,intambo ethokozisayo futhi efundisayo lapho umuntu ovela khona emhlabeni wokudansa i-gc evelele
1095,if you have time free yes definitely it is free entry just need to book a time slot over on show it is not very informative though so it does not improve knowledge it is very pretty and nice,uma unesikhathi samahhala yebo nakanjani ukufakwa kwamahhala kudinga nje ukubhuka isikhathi slot ngaphezulu kokukhombisa akunakufundisa kakhulu noma kunjalo kungakathuthukisi ulwazi luhle kakhulu futhi luhle
1096,_csail this is really informative thanks for it team,_csail lokhu kungukubonga okufundisayo ngempela ngeqembu le-it
1097,i also listen to their it is informative it context but it does not lead me to believe that the working class is leaving to vote for that is the inequality that that happen if you want to blame a party for that call it the party,ngilalele nomongo wazo efundisayo kodwa akungiholeli ukuthi ngikholelwe ukuthi ikilasi labasebenzi liyahamba livotele ukuthi lokho kwenzeka uma ufuna ukusola iphathi yalokho okubiza iphathi
1098,i have just seen the revolution generation and i really it super informative about millennial psychology and social,ngisanda kubona isizukulwane sokuguqulwa futhi ngifundisa kakhulu nge-phychology yeminyaka eyinkulungwane kanye nenhlalo
1099,informative and attractive,iyafundisa futhi iyathandeka
1100,let is see objective informative journalism in tomorrow is debate,ake sibone ubuntatheli obunolwazi bokuthola inhloso kusasa yinkulumo-mpikiswano
1101,this past weekend we in city of water day by the waterfront alliance thank you to for the event and giving such an informative tour of the port morris mott haven waterfront,kule mpelasonto edlule thina edolobheni losuku lwamanzi nge-waterfront alliance siyabonga umfelandawonye kulo mcimbi futhi enikeza ukuvakasha okufundisayo kweport morris mott
1102,_nlp is really good at being an innovative force in the world from building the site during covid to making fun and informative on so many different and everything else here,_nlp muhle impela ekubeni amandla amasha emhlabeni kusuka ekwakheni isiza ngesikhathi sokwenza ukuhlekisa nokufundisa ngezinto eziningi ezihlukile nakho konke lapha
1103,thanks i try to keep it light informative i can t do overly serious i mean if it s that serious they should get their ass and go do something about it more productively than just my take of course ha,ngiyabonga ngizama ukuqhubeka nokufundisa okunolwazi engikwazi ukukuthatha ngokweqile ngiqonde kakhulu ukuthi ngiqonde ukuthi kufanelekile ukuthi kufanele bathole imbongolo yabo futhi bayokwenza okuthile ngakho ngokukhiqiza kakhulu kunesifiso nje se-ha
1104,please check out this video review of by all very informative and i think everyone should know how and alike were at this con,uyacelwa ukuthi ubheke lokhu kubuyekezwa kwevidiyo kubo bonke abanolwazi kakhulu futhi ngicabanga ukuthi wonke umuntu kufanele azi ukuthi ngabe kunjalo futhi kufana ngakho
1105,tried to read hit a no doubt the article would have been equally as informative as yours,izamile ukufunda hit a ngokungangabazeki ukuthi i-athikili ibingaqondakali ngendlela enobuntu
1106,found this channel great content right up the collector alley super informative funny spread the word _assam,sithole lesi siteshi esiqukethwe okuhle phezulu kwe-collector alley efundisayo efundisayo spread igama _ssam
1107,to both of you great informative article,kuze kube nobabili i-athikili enhle efundisayo
1108,thank you for your school division s experience in the national spotlight very informative on how to navigate the current climate,ngiyabonga ngesipiliyoni se-school couploft spight ekubukeni kukazwelonke okufundiswa kakhulu ngokuthi ukuzula kanjani isimo sezulu samanje
1109,as informative as ever,njengoba efundisayo njengangaphambili
1110,this is very informative the is we do not know about our past,lokhu kufundisa kakhulu ukuthi asazi ngesedlule sethu
1111,an informative discussion from joe j dirk green and bailey on where are the equity and fixed income heading and how should allocate moving forward,ingxoxo efundisayo evela kujoe j dirk green and bailey lapho zilingana khona kanye nesihloko semali engenayo futhi kufanele adle phambili
1112,the empire significant research for join for two informative sessions designed to ease these free register,ucwaningo olubalulekile lokujoyina izikhathi ezimbili ezifundisayo ezenzelwe ukudambisa le rejista yamahhala
1113,_seo informative video i wonder how many people on twitter are also on and vice,_seono efundisayo video ngiyazibuza ukuthi bangaki abantu ku-twitter nabo abavuliwe
1114,let is see objective informative journalism as opposed to media politics in such,ake sibone ubuntatheli obufundisayo obuqondile ngokungafani nezepolitiki yabezindaba kuleyo
1115,thank you for your informative tweet,ngiyabonga nge-tweet yakho efundisayo
1116,read part of our drug series stay tuned for more analysis an examination of specialty coming in part four to catch up on previous short and informative content from our series visit,funda ingxenye yochungechunge lwethu lwezidakamizwa hlala ubukele ukuze kuhlaziywe ngokwengeziwe ukuhlolwa okukhethekile okuza ngokwengxenye yesine ukuthola okuqukethwe okwedlule nokufundisayo okuvela ekuvakasheni kwethu kochungechunge
1117,is a unique health and fitness designed to accelerate your pathway to the best of you by your nutritional intake the risk and informative based on your food want to streamline your fitness journey,yimpilo ehlukile nokuqina okuklanyelwe ukusheshisa indlela yakho kukuhle kakhulu ngawe ngokudla kwakho okunempilo ubungozi nokwaziswa ngokususelwa ekudleni kwakho ngifuna ukuhambisa uhambo lwakho lokuqina
