,src,trg
1033,happy day today is a celebration of the commonwealth becoming the second state to join the union whether it be the vast full of and or the beautiful full of life and culture make sure you go out and enjoy,usuku olujabulisayo namuhla luwumgubho wecommonwealth ube yi-stilwealth ukuthi ujoyine inyunyana ukuthi ngabe igcwele kakhulu futhi noma okuhle okugcwele impilo namasiko kugcizelela ukuthi uyaphuma futhi ujabulele
1034,so marvel becomes a show about family and finding herself her own culture and in life with humor some action she is not trained fully yet or stupid to jump into level willingly and family is the core of her life,ngakho-ke uma umarvel uba umbukiso ngomndeni futhi uzithole amasiko akhe nasempilweni nge-aumor act ake aqeqeshelwe ngokuphelele nokho noma uyisiphukuphuku ukugxila ezingeni lokuphila kwakhe namndeni
1035,honestly our childhood pop culture was,ngokweqiniso isiko lethu lepop culture
1036,a culture reset,ukusetha kabusha isiko
1037,if i am explaining this right but i think it is of these think they have actually into culture so they want born and raised in since they think that is what actual want,uma ngichaza leli lungelo kodwa ngicabanga ukuthi yilezi zicabanga ukuthi zingene esikweni ngakho-ke zifuna ukuzalwa futhi zikhuliswe lapho zicabanga ukuthi yilokho okufunwa yilokho okufunwa yilokho okufunwa yilokho
1038,you was the culture foe the,wawuwusiko isiko
1039,you know the residentially are watching him that s who he is trouble with really go buy the homeless some food and get a life i don t like the guy but everything is cancel culture if you let it,uyabazi ngokuhlala ekhaya bambheka ukuthi ungobani inkathazo ngokuhamba ngokungenzi lutho ngokudla futhi uthole impilo engingathandi isiko kodwa konke kukhanyisa
1040,from ur viewpoint it can be wrong but i don t care t mean u hate their culture the same to terrorist state of its racist policy to non who r also like u religion is pretext main factor is,kusuka ekubukeni kwe-ur kungabi okungalungile kepha anginakukhathalela ukuzonda amasiko awo ngendlela efanayo nenqubomgomo yamaphekula yenqubomgomo yayo yokucwasa ngokwebala i-non
1041,we are to be by fortune as a for this year here s to the people that make our culture a workplace welcome for all,kufanele sibe ngenhlanhla njenge-a forn kulo nyaka s kubantu abenza amasiko ethu abe umsebenzi wamukelekile kubo bonke
1042,quite disturbing to see the intimidation tactics being used towards civil this stuff needs to be or it will embed itself even more in our political culture and corrupt the these people work for beyond repair,kuphazamisa impela ukubona amaqhinga wokusabisa asetshenziselwa ubuntu kule nto okudingeka abe ngokwengeziwe emasikweni ethu ezepolitiki futhi akhohlakele labantu basebenzela ukulungiswa okungaphezulu kokulungiswa
1043,of filthy general behold the future and her culture _,we-extimel general jundillvel the future kanye nesiko lakhe _
1044,for the culture according to ticket in the ma aka,ngokwesiko ngokuya ngethikithi ku-ma aka
1045,a lot of young men from did not get home to,izinsizwa eziningi ezivela zazingafika ekhaya
1046,like belong to culture u r so cute baby here,njengokuba yilungu le-custure u r sut meal may lapha
1047,hey this since i m growing in cringe culture is not here i do cringe i m a man and a furry all are welcome unless its literally harmful so like,sawubona lokhu selokhu ngikhula emasikweni e-cringe akukho lapha ngilapha ngendoda ne-furry bonke bamukelekile ngaphandle kokuthi kube yingozi kangako
1048,religion is for culture is for society,inkolo isetshenziselwa isiko lokusebenza
1049,why do you assume there is more to this story i realize you want there to be a reason to blame the culture or somehow but plenty of it up to spend more time with their,kungani ucabanga ukuthi kunokuningi kule ndaba engibona ukuthi ufuna ukuba khona ukuthi ube nesizathu sokusola isiko noma ngandlela thile kodwa inqwaba yawo ukuze uchithe isikhathi esithe xaxa nge
1050,always read,funda njalo
1051,on the of jam radio click,ngokuchofoza komsakazo wejamu
1052,a lot of contemporary media culture to negate or charisma to the point where people start to feel interchangeable what are some in which charisma is still a necessary component for success do they exist,isiko eliningi lemidiya lanamuhla lokungagadli noma i-charisma kuze kube seqophelweni lapho abantu beqala ukuzizwa benokushintshana yiziphi ezinye lapho i-charisma iseyingxenye edingekayo yempumelelo abekhona
1053,i m an state fan i bleed but may have to root for michigan next year the fact this is the reaction to s basically benign statement is more evidence of how sick our culture nation is we won t cure ourselves till more stand up and take the heat,ngingumlandeli wombuso ngiphangi kodwa kwangathi kungafanele ngithole i-michigan ngonyaka olandelayo iqiniso lokuthi lesi sitatimende se-invignal kuwubufakazi bethu obusezingeni elithi sizolithola kanjani kuze kube yilapho zithatha ukushisa
1054,find someone that will introduce you to new music art culture someone who will expand your mind and help you grow,thola umuntu ozokwethula ekutheni ubuciko obusha lobuciko besiko lomuntu ozokwandisa ingqondo yakho futhi akusize ukhule
1055,to the reactionary and violent nationalism that is coming to dominate culture and politics well we are only starting to unashamedly own our culture and our destiny st century will be the age of dharma and it s earth s only chance for survival,kubuzwe bokuphendula nobunobudlova obusezobusa isiko nezepolitiki siqala nje kuphela ukuthi singamasiko ethu kanye ne-destiny st yekhulu lethu kuzoba yithuba lokusinda
1056,the best to visit in from cliff hugging to culture loaded via,okungcono kakhulu ongakuvakashela kusuka kucliff kuvalelisa isiko elilayishwe nge
1057,since my support for culture was put into question here s another perspective it is our culture for las lap to be when the get to join yet we have now them and complain bitterly if culture is the argument let it extend all across,"kusukela ukusekelwa kwami ​​isiko kwabuzwa lapha ngomunye umbono kuyisiko lethu ukuthi liyisiko lethu le-las lap ukuba lijoyine nokho lapho siba nakho manje, sikhala kakhulu uma isiko likhona"
1058,chair d with to launch initiative to elevate black history and empower,usihlalo d naye ukwethula isinyathelo sokuphakamisa umlando omnyama kanye namandla
1059,minister of information and culture lai said the solidarity march by the labour congress with the striking of the academic staff union of is illegal,ungqongqoshe wezolwazi namasiko ulai uthe isolardarity mashi ngecongress yezabasebenzi ngokumangalelwa kwabasebenzi bezemfundo of akukho emthethweni
1060,today i learned with a public figure s shift in ethics focus is slander don t need to be given for to publicly change pop culture is qualification to start church neo t a big deal,namuhla ngifunde nge-shift shift shift in ethics focus in umnyundeli awudingi ukunikezwa ukuze kuguqulwe esikweni esidlangile esidlangalaleni ukufundwa kwesonto i-church neo
1061,we were the first collection to partner with we were inspired our core community will be with a join our discord and the puffy culture to get on the free mint and secure your role this slick could be yours,sasiyiqoqo lokuqala ukubambisana nathi saphefumulelwa umphakathi wethu oyisisekelo kuzoba nokujoyina amasiko ethu okuxabana kanye nesiko lama-puffy ukuyokwazi ukungena kumanti wamahhala futhi uvikele iqhaza lakho
1062,_gsharbin i do not care about and the let the that are trying to suck go for him we have got big of the core it is time to start the come up you can not be happy with losing forever culture would be they got aggressive it is great to see,_gsharbin anginendaba futhi lokho ukuvumela ukuncela ukumtholela ukuthi sibe yindawo enkulu yisikhathi sokuqala ukuvela awukwazi ukujabula ngokulahlekelwa yiphakade amasiko kungaba kuhle ukubona
1063,can reading make you happier,ingafunda ukukwenza ujabule
1064,treating us with different race and culture this badly is next level and should not have any hope after this,ukusiphatha ngohlanga oluhlukile namasiko ahlukile lokhu kubi kakhulu futhi akufanele kube nethemba ngemuva kwalokhu
1065,_help i have spoken to a few already one hung up on me during a lengthy hold and the other was very upset about this as the exact same thing to her it is on business culture i would love to hear how someone would be able to address this,_elp ngikhulume naye abambalwa kimi ngesikhathi sokubamba isikhathi eside kanti omunye wacasuka kakhulu ngalokhu njengento efanayo kuye esesimweni sebhizinisi bengizothanda ukuzwa ukuthi umuntu uzokwazi ukubhekana kanjani nalokho
1066,_ i whole heartedly understand and respect that iceland as a culture is old but as a is young constitution established in it is a very educated and engaging country their statistics on hate us,_ ngikuqonda ngenhliziyo yonke futhi ngihlonipha lelo-iceland njengoba isiko lidala kepha njengoba kungukuthi umthethosisekelo osemusha osungulwe kulo kuyizwe elifundiswe kakhulu futhi eliheha izibalo zalo ezizonda
1067,_culture fox x,_culture fox x
1068,i know the working class but sometimes i wonder if all the advancement in technology and culture made it a little more worth the struggle,ngiyayazi ikilasi elisebenzayo kepha kwesinye isikhathi ngiyazibuza ukuthi ngabe yonke intuthuko kwezobuchwepheshe nakwamasiko ikwenza kwaba lula kakhudlwana umzabalazo
1069,a diamond show to broadway just don t call it a jukebox musical,umbukiso wedayimane wokuya ebroadway nje awukubize nge-jukebox musical
1070,so why is the excluding from their culture e g pregnant people chest feeding parent men if they are pregnant,ngakho-ke kungani kungafakwa kusiko labo e-be chent chest chest bondla amadoda wabazali uma ekhulelwe
1071,densely crime ridden that culture your life rather an observer or participant,ubugebengu obukhulu obukhulu bagibele ukuthi isiko lempilo yakho kunalokho obonayo noma obambe iqhaza
1072,the fact theres lots of them it harder but its the culture one i think,iqiniso liyakho nzima kubo kodwa isiko laso engicabanga
1073,think we have more to worry about if in he is of another culture his wife in he millions in his bank so how does he know anything about culture and the working man i will never vote tory if he is at the helm,cabanga ukuthi sinokuningi okufanele sikhathazeke ngakho uma kungomunye isiko umkakhe ezigidini zakhe ebhange lakhe ngakho-ke uyazi kanjani nganoma yini ngesiko nalowo osebenza nge-helm
1074,in nandi culture r supposed to be submissive independent thinking like irritate the nandi opposition leader hence the anger,esikolweni lasenandi r kufanele ukuthi kube nokuzithoba kokucabanga okuzimele njengokucasulayo umholi ophikisayo wenandi yingakho ulaka
1075,_o_turfs _heseltine no i do not never had one and no i will not mind my own business and watch a bullying culture silently had enough of that in thatcher is s,_o_turfs _heeseltine cha angikaze ngibe neyodwa futhi cha ngeke ngibe nebhizinisi lami futhi ngibuke isiko lokuxhashazwa buthule banele buthule banele ukuthi kuthokhempe
1076,national marine conservation are established and by canada to protect and conserve of canada s natural and cultural marine heritage,ukulondolozwa kwezwe lasemanzini kusungulwe futhi yicanada ukuvikela nokulonga kwe-canada s yemvelo yamagugu asemanzini namasiko
1077,_e wow hell of a culture seem interesting,_e wow isihogo sesiko kubonakala kuthakazelisa
1078,culture been at a decline since that is when the starting moving out cause the rent was too high the new wave moving in,isiko lisekwehlile kusukela lapho kulapho kuqala ukuphuma khona uma irenti yayiphezulu kakhulu igagasi elisha lihamba ngaphakathi
1079,and the entire south east of cannot perceive culture because of their genetic inferiority minister of culture of e,futhi lonke isouth east of acate yabona amasiko ngenxa yokuba ngaphansi kwalo kofuzo lwesiko le-e
1080,one of the art in the state is free to view at the judicial center learn more in art supreme,omunye wobuciko embusweni ukhululekile ukubuka esikhungweni sokwahlulela funda kabanzi ku-art supverme
1081,finally found i fear for literally begging the to evict from culture its me on the other hand i hope they find all the out there because good luck all of your exist and you can not stop it,ekugcineni ngathola ngithola ngesaba ukuthi laba bathi baxosha amasiko ngakolunye uhlangothi ngithemba ukuthi bathola bonke abakhona lapho ngoba inhlanhla yakho konke okukhona futhi awukwazi ukukuyeka
1082,the importance of a collaborative creative zone at work as from different can establish new they can elevate the business culture and create a sense of togetherness,ukubaluleka kwesizinda sokubambisana emsebenzini njengoba kusuka kwehlukile kungasungula okusha bangaphakamisa isiko lebhizinisi futhi bakha umuzwa wokubambisana
1083,eat fresh,yidla okusha
1084,_culture if understanding that is clearly pushing a female strong character with no actual development and their constantly being told their the best male in their own film then i guess i am,_culture uma ukuqonda okusobala kucindezela umlingiswa oqinile wesifazane ngaphandle kwentuthuko yangempela futhi kuhlale kutshelwa owesilisa abahle kakhulu kwifilimu yabo ngaleso sikhathi ngicabanga ukuthi ngikhona
1085,man the culture we are bullying,indoda isiko sisonakalisa ukuxhashazwa
1086,want to shop locally here are five thrift to get read more petty,ufuna ukuthenga endaweni yakwandawo lapha kuyizihlanu ezinhlanu ukuze ufunde kancane
1087,it is not culture shock but fact,akulona ukushaqeka kwesiko kodwa iqiniso
1088,unite the people ignite the culture ___ st memorial university ___ the foundation ___ visit for more,hlanganisa abantu abadlulisi amasiko ___ st memorial university ___ isisekelo ___ vakashela ngaphezulu
1089,looking to explore some of the big happening in our world keen to bring critical thinking empathy and compassion into the classroom want to learn how to embed a culture of thriving across your school join our free event tomorrow,uma ufuna ukuhlola okunye okukhulu komhlaba wethu ojulile ekuletheni uzwela olubucayi nobubele ekilasini bafuna ukufunda ukuthi bangashumeka kanjani isiko lokuya esikoleni sakho kusasa kulo lonke ujoyine umcimbi wethu wamahhala kusasa
1090,_west _localsimpp no an insult to a who around like you like your color is your culture so of personality and uninformed about your own culture that you have instead decided to pretend like white is culture,_west _localsimpp akukho ukuthuka ku-ven ezungeze njengawe ofana nombala wakho isiko lakho ngenxa yesiko lakho futhi unganqunyelwe ngesiko lakho onqunyelwe ukwenza sengathi limhlophe amasiko
1091,pagan culture tempered via the weak influence of,isiko lamaqaba elishiswe ngethonya elibuthakathaka le
1092,my art is a celebration of the sensational black and her beautiful vibrant spirit that is a prodigious influence over modern media culture,ubuciko bami buwukugubha okumnyama okubabazekayo nomoya wakhe omuhle ogqamile okuyithonya elinamandla ngaphezulu kwesiko lanamuhla labezindaba
1093,in today is climate building new is more important than ever to advance trade diversification we are our partnership with south korea is province to promote trade economy culture education sports,kunamuhla ukwakhiwa kwesimo sezulu okusha kubaluleke kakhulu kunangaphambili ukuthuthukisa ukwahlukana kwezohwebo esikuzobambisene nesouth korea isifundazwe ukukhuthaza umnotho wezomnotho wezemfundo
1094,do not get me wrong there are a lot of people around twitter and who put out stuff i like and i am thankful for that but this sort of thing is why i do not really engage with the culture or weird gossipy drama inside of it,ungangitholi okungalungile kuningi abantu abaseduze kwe-twitter futhi ababeka izinto engizithandayo futhi ngiyabonga ngalokho kodwa lolu hlobo lwento engangizibandakanyi namasiko noma idrama exakile yokuhleba ngaphakathi kwayo
1095,not any of the one another but when you have a country so engrained in diet culture and being thin that kind of is bound to present itself eventually at one point or another,hhayi omunye komunye kodwa uma unezwe elifakwe kusiko lokudla futhi ukuba mncane lolo hlobo luzokwethula ekugcineni ekugcineni ngakunye noma kwenye
1096,we can embrace the we come from but we must look at them through the lens of he is our foundation not culture because he is the only one strong enough to hold the weight of our identity sound advice at,singamukela esivela kuso kodwa kufanele sibabheke nge-lens yaso isisekelo sethu hhayi isiko ngoba ukuphela komuntu onamandla ngokwanele ukubamba isisindo sezeluleko ezizwakalayo zethu e
1097,_chimp being a good person t depend on your religion your race or your skin color or your culture it on how good is your heart and how good you treat,_chimp ukuba ngumuntu olungile kuncike enkolweni yakho umjaho wakho noma umbala wakho wesikhumba noma isiko lakho ukuthi lihle kanjani inhliziyo yakho nokuthi uphatha kahle kanjani
1098,genuine question who does purity culture benefit,umbuzo wangempela owenza isiko lokuhlanzeka elihlomula
1099,_a_non oh s heart bunny queen non consumer of pudding slayer of caster of mold consultant of the consent cultivator of culture creator of chaos i congratulate thee on thou expansion of thine influence and domain,_a_non oh s inhliziyo bunny queen non umthengi we-pudding slayer ye-caster yomeluleki wesikhunta womeluleki wemvume yomdali wezempisi ngikuhalalisela
1100,san city connect the connection with culture is a cool inspiration but i wish they it more in the actual design which is what i tried to do with the sleeve,i-san city xhuma ukuxhumana nesiko kungukuphefumulelwa okupholile kepha ngifisa ukuthi kukhonjwe ngokwesisekelo okuyinto engizame ukuyenza ngekhono
1101,i definitely think that the popularization of the word content led our culture to view all art at least partially as some amorphous blob of entertainment rather distinct with meaning and subtext,nakanjani ngicabanga ukuthi ukuthandwa kokuqukethwe kwamagama kuholele amasiko ethu ukubuka bonke ubuciko okungenani ngokwengxenye ye-amob yokuzijabulisa ehlukile kunencazelo kanye ne-subtext
1102,perhaps you should learn what western culture commonly to basic comprehension are a must before you begin writing petty such as learn the differentiate,mhlawumbe kufanele ufunde ukuthi yisiphi isiko lasentshonalanga elivame ukuqondisisa okuyisisekelo yilona kufanele uqale ukubhala okuncane njengokufunda ukwahlukanisa
1103,for the culture ser,ngesiko lesiko
1104,_call being a good person t depend on your religion your race or your skin color or your culture it on how good is your heart and how good you treat,_calll ukuba umuntu omuhle uncike ebukweni lakho umjaho wakho noma umbala wakho wesikhumba noma isiko lakho ukuthi lihle kangakanani inhliziyo yakho nokuthi uphatha kahle kanjani
1105,_umar i respect your but i tell you is made up of people with diverse culture tradition and so to summon it at once is little bit harder you can say them as but by they will be divided and totally different,_umar ngiyayihlonipha eyakho kodwa ngiyakutshela ukuthi wakhiwa ngabantu abanesiko lamasiko ahlukahlukene futhi ngakho-ke ukubiza ngaso leso sikhathi ukuthi buye bahlukaniswe futhi bahluke ngokuphelele
1106,i m not for the state the state to the extant necessary to safeguard security everyone the right to live their private as they see fit when it state it turned into a green light to impose their all over our culture,angisona nombuso uhulumeni oya phambili ekuvikeleni ukuphepha wonke umuntu ilungelo lokuphila ngasese lapho bebona khona ukuthi lihle kakhulu lapho libonisa wonke amasiko ethu ngaphezulu kwesiko lethu
1107,yes it is happening from first is by from area police station of our culture,yebo kuyenzeka kusuka okokuqala kuvela esiteshini samaphoyisa endaweni yethu
1108,black people say they for the culture yet can t stand together in unity,abantu abamnyama bathi bangokoqobo isiko kodwa bakwazi ukuma ndawonye ngobunye
1109,no all this with men in will not make many men real men with fall for this crap the and pussy sniffing pro baby murder will and this culture ie men wearing,akukho konke lokhu nabantu abangenayo ngeke benze amadoda amaningi amadoda angokoqobo awela lokhu kubulawa kwe-pro kanye ne-pussy sniffing pro
1110,_tlehonaei _h_reaume then they should say what type and this is not at all the man is literally telling you that this does not belong to one culture also breaking news not all and indigenous people reside in or originate from the america is or,_tlehonaei _h_rea ke kufanele bathi hlobo luni futhi lokhu okungakho kulo ndoda ngokweqiniso ukukutshela ukuthi lokhu akulona ikhalisi elilodwa futhi elingephula izindaba hhayi imelika noma ivela emelika noma ivela emelika noma ivela emelika noma
1111,the itself is also very silly and you can tell this girl is but not actually definitely grew up overseas and only on but still reps it does not seem to have a full grasp of her own culture,i ngokwalo iyisilima kakhulu futhi ungasho ukuthi le ntombazane ibuke yakhula phesheya kwezilwandle futhi kuphela kepha kubonakala sengathi ingabazi ngokuphelele isiko lakhe
1112,yes it s new cancel culture lost this round,yebo isiko elisha lesiko lilahlekelwe yile nxazonke
1113,_d_ is certainly a cultural flagship but the united is a polar country with multiple of culture i grew up from new york city and i never felt that it me,_em_ ngokuqinisekile ingumpeg engosiko kepha i-united yizwe elinamakhaza elinamasiko amaningi engikhule ngalo ukusuka enew york city futhi angikaze ngibe nakancane ukuthi mina
1114,taking our culture to universe,ukuthatha amasiko ethu kuya endaweni yonke
1115,_ media are screwed up they just want money i do not trust any more first all media should stop these boring debate culture they debate like of desi,_ imedia i-screw i-screw bafuna nje ukuthi bafuna imali engingakwethembi futhi okokuqala kwabezindaba kufanele bayeke lezi zimpikiswano ezijabulisayo ziphikisanayo njenge-desi
1116,it like the more a fandom pop culture item is the more toxic the fandom becomes,kufana nento ethe xaxa ye-fandom pop culture into inobuthi ngokwengeziwe i-fandom eba khona
1117,is an insane bubble like it its own insular culture its own turn based action and somewhat of its own victim siege mentality i have never seen sports cod be upset their t show up in a show the way twitter does,i-bubble yobuhlanya efana nayo isiko layo lokujika laso elisekwe esisekelweni sengqondo futhi ngandlela-thile wokuvinjezelwa kwezisulu engingakaze ngibone i-sports cod show up ngombukiso ngendlela i-twitter eyenza ngayo
1118,__tweets not for or against it here simply saying that it is inarguable that peter that god does not want anyone to perish pretty simple and i am saying we should want what god and maybe our attitude would not be to hunker down and win a culture war,ama -__tweets hhayi noma ngokumelene nalo lapha ukumane usho ukuthi kungukuthi upitrosi angafuni yini ukuthi umuntu azoshabalala alula futhi ngithi kufanele sifune lokho unkulunkulu futhi mhlawumbe isimo sethu bekungeke kube semarker down futhi siphumelele impi yamasiko
1119,_fm waste of time and culture,_fm ukuchitha isikhathi namasiko
1120,the oblique arches a marvel of engineering the arch is considered to be aesthetically and structurally combined with the polygonal system which the of both the and other,i-oblique the arches isimangaliso sobunjiniyela be-arch kubhekwa njengokuhlukumeza ngobuhle nangokuhlelwe ngohlelo lwe-polygonal the nobabili
1121,_girl a lot of them are just religiously culturally but a sizable contingent is acting in their rational interest because they will end up in a promiscuous culture it is a zero sum game until sex infiltrate the dating meta,_girl inqwaba yazo imane nje iyinkambiso yenkolo ngokweqiniso kodwa okuphikisanayo okukhohlisayo kusebenza ngentshisekelo yazo enengqondo ngoba izogcina isiko lokuziphatha okubi kungumdlalo we-zero
1122,did you know is regularly ranked among the nation is most desirable to live the are close knit the pace is relaxed yet the culture is sophisticated click here to apply for a job in,ubuwazi ukuthi kubalwa njalo phakathi kwesizwe kufiseleka kakhulu ukuphila ukuthi basondele kakhulu ijubane liyakhululeka kodwa isiko eliyinkimbinkimbi lapha?
1123,believe don t excuse don t joke about gender based violence there is something each one of us can do to end rape culture,kholwa ukuthi u-don axovu udon t ihlaya ngodlame olusekelwe ebulilini kukhona okuthile ngamunye wethu angenza ukuqeda isiko lokudlwengula
1124,_jordan lying delusional fear hateful paranoia are not by the st amendment the first amendment is not permission for absolute uninformed chaos do not need of war your gun culture is so full of violence death,_jordan ukuqamba amanga inkohliso yesaba i-paranoia enenzondo ayilona isichibiyelo se-st ukuchitshiyelwa kokuqala akuyona imvume yezimangaliso zakho ezingenakufundwayo ezigcwele ubudlova
1125,guess he is from right week culture warrior activist to,qagela ukuthi uvela esontweni elingemva kwesonto lesiko elivuthayo
1126,you know we are eating all of animal in eastern it is really not a big culture shock for us also meat substitute plant were part of our diet till the  is because of regular and now maybe begin to appreciate what they have,uyazi ukuthi sidla zonke izilwane empumalanga impela akusona isiko elikhulu kithina nathi isitshalo esisezingeni eliphansi sasiyingxenye yokudla kwethu kuze kube yilapho kungenxa yokuthi banakho
1127,_boehm if it is a job where the core can be remotely then remote call center customer service design if it is a job with in person then mostly in person with some remote time culture setting film,_boboehm uma kungumsebenzi lapho umnyombo ungakude khona-ke umklamo wamakhasimende wesikhungo esikude uma kuwumsebenzi ngakubantu okuhlala ngandlela thile ngesiko elikude lesiko lokubeka ifilimu
