,src,trg
1552,another enlightening informative brilliantly written book by medical historian the ground breaking in plastic surgery teamwork led by which prominently included during after,enye incwadi efundiswe encibilikayo enolwazi elibhalwe ngokugqamile okwesibhazisi sezokwelapha umlando we-ground breaking ekusebenzeni kombathiswa kopulasitiki okuholwa yilokho okufakwe ngaphakathi ngesikhathi esidlule
1553,full written and video review is live if you have considered for your or home this is informative for you,ukubuyekezwa okugcwele okubhaliwe nevidiyo kuphila uma ucabangile ngakiti noma ekhaya kuyafundiseka kuwe
1554,_ama informative you know i t know that you re a alumna,_ama efundisayo uyazi ukuthi u-alumna
1555,this been possibly the only informative tweet train from me but it is something i can legit help with for a change,lokhu kungenzeka ukuthi ukuphela kwesitimela se-tweet esivela kimi kodwa yinto engingayithola ngokusemthethweni ngoshintsho
1556,graham why are you talking about a trial that already had a verdict would be informative if you talk about something other than or ah the world does not exist only for them,ugraham kungani ukhuluma ngecala elivele linesinqumo selivele lifundise uma ukhuluma ngokuthile ngaphandle noma umhlaba ongekho kuphela
1557,well done to and for out of the your terror at being subject to scrutiny is far more informative than your empty rhetoric,wenze kahle ukuze kube nokwesabisa kwakho ekubeni ngaphansi kokuhlolisiswa kufundisa kakhulu kune-rhetoric yakho engenalutho
1558,it was a very informative and debate as well,kwakuyinto efundisayo kakhulu futhi iyaxoxisana futhi
1559,interesting in this regarding recent must read this informative,kuyathakazelisa kulokhu maqondana nakanjani kumele ufunde lo mfundiso
1560,join us for another timely informative educational session for even if you can t make it live register to get easy access to the replay,sijoyine esinye iseshini yezemfundo efundisayo efinyeleleka ngesikhathi sokufunda noma ngabe ungayenza i-prair bukhoma ukuthola ukufinyelela okulula kokubuyiselwa kwemali
1561,when are getting grief off a driver baking in his car because the m is closed due to a fuel tanker on fire well done to the operator on the informative polite my attitude would be,kufika nini ulusizi olubhaka emshadweni emotweni yakhe ngoba i-m ivaliwe ngenxa yethangi likaphethiloli olwenziwe kahle ku-opharetha inhlonipho yami efundwayo
1562,_s_bhogal bari this about the times they wrote to their subscriber audience that more and more non liberal leftist more than just anti trump anti police anti they forgo accuracy context and informative to chase the audience,_s_bhalogal bari lokhu mayelana nezilaleli zabo ababhalele ababhalisile ababhalisile ngokwengeziwe abangashiyi imali eshiye i-anti trump anti anti balahla izithameli
1563,excellent thread very informative,intambo enhle kakhulu efundisayo
1564,your career search by joining for a virtual informative career seminar and dinner on learn some and advice from our experienced sign up today,ukusesha kwakho komsebenzi ngokujoyina umhlangano wokufundisa ofundisayo ofundisayo kanye nesidlo sakusihlwa kufunda ezinye nezeluleko ezivela kubhaliso lethu elinolwazi namuhla
1565,rip call sign fan of s brigade go check their channel out they are an informative and honest channel from a pro point of view they are one of my favorite actually,rip call sign fan of s brigade go hlola isiteshi sabo ukuphuma kuyisiteshi esifundisayo nesithembekile kusuka endaweni yokubuka ye-pro
1566,is at on can you help get us over the mark if you think our twitter account is exciting and informative you should definitely be following us there also to get your,ingabe ungasisiza ukusithola ngophawu uma ucabanga ukuthi i-akhawunti yethu ye-twitter iyajabulisa futhi ifundise kufanele ukusilandele lapho futhi ukuthola kwakho
1567,this was such an informative host spoke with ash about advancing gene for retinal into clinical what do you think h,lokhu bekungumgcini ofundisayo osho ukuthi umlotha mayelana nokuthuthuka kofuzo nge-retinal kube emtholampilo ucabanga ukuthi ucabanga ukuthi uh
1568,s was both useful and informative the were really good and what can be complicated and complex in a simple and easy to understand format sign up for our next free session here,s bekuwusizo bobabili futhi ofundisayo
1569,we are the agenda daily with informative sessions led by in the field register by for the early bird rate browse the event agenda and register today,singu-ajenda nsuku zonke ngezikhathi ezifundisayo eziholwa yirejista yasensimini nge-for bird rate dlulisa amehlo ku-ajenda yomcimbi bese ubhalisa namuhla
1570,thanks for your informative article on a wax at my idea to save is to hire a fact checker to appear with wax every time she and publicly dispute her misinformation,siyabonga nge-athikili yakho efundisayo nge-wax emcabangweni wami wokusindisa ukuqasha i-cercher yamaqiniso ukuze ivele nge-wax njalo futhi iphikisana nomphakathi wakhe
1571,the am show today with and insightful and informative so much better without making up,i-am siyibonisa namuhla ngokuqinisekile nokutholakala kanye nokutholakala kakhulu ngempela
1572,timely and informative article by on the of extreme heat,i-athikili efika ngesikhathi futhi efundisayo ngokushisa ngokweqile
1573,good informative content over here on the channel,okuqukethwe okuhle okufundisayo lapha esiteshini
1574,i was to make a positive contribution to your wonderfully informative twitter account now i fell like i have given a little back the balance of the scales still very decidedly in your keep up the great work good luck in all your,bekufanele ngenze umnikelo omuhle kwi-akhawunti yakho efundisayo efundisayo efundisayo manje ngiwe njengoba nginikeze emuva okuncane ukulinganisela kwesikali namanje kunqunywe kakhulu ekusebenzeni kahle ngenhlanhla yakho yonke
1575,i have only been following her for a little while now but i like her they are informative unfortunately they have a tendency to make me throw up in my mouth a little,sengimlandela isikhashana nje manje kodwa ngiyamthanda bafundisayo ngeshwa banokuthambekela kokungenza ngiphonse phezulu emlonyeni wami kancane
1576,i find your very informative and useful it keep us connected to you and and the situation there some people can be easily disturbed by your maybe that is why they those of us who remain know this is hell for,ngithola okufundisayo futhi okuwusizo kusigcina sixhumeke kuwe kanye nalesi simo lapho abanye abantu bangaphazanyiswa kalula yingakho thina abasesihlalini sazi lesi sihogo se
1577,very good article interesting informative and short,i-athikili enhle kakhulu efundisayo efundisayo futhi emfushane
1578,apparently fake can be saggy i thought the point was to uplift and enlarge them sure can be informative,ngokusobala inkohliso ingaba yi-saggy ebengicabanga ukuthi iphuzu bekuzophakamisa futhi lakhulisa nakanjani kungafundisa
1579,_ good informative post about,_ ukuthumela okuhle okufundisayo mayelana
1580,watch live news with the on for a good and somewhat informative laugh,bukela izindaba ezibukhoma nge-on fore fore fash nokwenza ngokuqinile
1581,_god very informative thanks for the,_ukubonga kakhulu ukubonga kwe
1582,came home from an appointment with a new gyn i am so grateful i found her she is such a sweet professional informative person the overall experience was so lovely well as lovely as it can get at a doctor what i mean right ' i am on such a high right now,wafika ekhaya kusuka ku-aphoyintimentine ne-gyn entsha ngiyabonga kakhulu ukuthi umthole umuntu onolwazi onolwazi onolwazi olunothando olunothando oluthandekayo lwaluthandeka kakhulu njengoba lungathola khona phezulu njengamanje
1583,are made to be bland and barely informative in the public eye that s their purpose like made about the,zenziwa ukuba zingafundisi futhi zingabafundisi ngamehlo emphakathi ukuthi inhloso yazo efana neze
1584,a bit excessive don t y all think i can list a number of other digital history that might be a bit more informative and certainly more balanced than prof s,i-don equa exeshile yodwa y bonke bonke bacabanga ukuthi ngingabhala inani elithile lomlando wedijithali okungenzeka ukuthi afundise kakhudlwana futhi alinganise ukwedlula uprof s
1585,rage informative stuff for he and been doing stuff for like explaining the is all he does but he most watching are somewhere between corner horning and,izinto ezifundwayo ezifundisayo ngoba futhi wenza izinto zokuthi zichaza konke ukuchaza konke akwenzayo kepha ubuke iningi likhona endaweni ethile phakathi kwecor corner horning kanye
1586,_churchill_ very informative thanks for,_curchill_ ukubonga okufundisayo kakhulu
1587,___w _gagne yes a most epic and informative thread,___w _gagne yebo umucu omuhle kakhulu futhi ofundisayo
1588,what an interesting article i never could dig for water although i know how intelligent they are so it should be of no surprise for the informative article,isihloko esithandekayo engingakaze ngiwumbe amanzi yize ngiyazi ukuthi bahlakaniphile kangakanani ngakho-ke akufanele yini umangaze nge-athikili efundisayo
1589,_fd this answer is not sufficient you support him thats i do like many of his informative but as hater is wrong,_impendulo le mpendulo akwanele umeseka yini ukuthi kufanele ngenze okuningi okufundisayo kodwa njengoba ozondayo akulungile
1590,go an in depth look into some of the most popular and informative of the by find out more,iya ekujuleni ubuke kwezinye ezithandwa kakhulu futhi ezifundisayo zokuthola okuningi
1591,go an in depth look into some of the most popular and informative of the by available at,iya ekujuleni ubuke kwezinye ezithandwa kakhulu futhi ezifundisayo ze-ast at
1592,i can tell and i bet you are a good one i imagine a consultation with you is informative,ngiyakwazi ukutshela futhi ngibheja uyinhle engicabanga ukuthi ukubonisana nawe kuyafundisa
1593,thank you for this thread very informative,ngiyabonga ngale ntambo efundiseka kakhulu
1594,normalize on informative this is almost unwatchable for me,yenza ngokwejwayelekile ekufundiseni lokhu cishe akunakulunga
1595,i recommend this book i found it very informative and engaging,ngincoma le ncwadi ngiyitholile ifundise kakhulu futhi ngizibandakanya
1596,informative will be on st,iyafundisa izoba se-st
1597,great informative easy to read and most of all helpful book _marjorie,okuhlelekile okuhle okulula ukufundwa futhi iningi lencwadi ewusizo _marjorie
1598,never mind i am always waiting for your ur are most informative,ungalokothi unake ngilindele i-ur yakho efundise kakhulu
1599,my friend designed a super scary and informative graphic and gave me the opportunity to give my about the heat wave,umngane wami waklama i-super scary futhi efundisayo futhi wanginikeza ithuba lokunikeza lami nge-wave wave
1600,no proper today as my mind and body are near fried in this wretched weather but i have a very important and informative and slightly late,akukho okufanele namhlanje njengoba ingqondo yami nomzimba wami kuseduze okuthosiwe kulesi simo sezulu esidabukisayo kepha ngibaluleke kakhulu futhi ngifundise futhi sekwephuze kancane
1601,_digital very informative,_digital ifundise kakhulu
1602,_eth informative,_et ifundisayo
1603,_usa i was just thinking about the term i often hear to the war on the ground as but that stuff is the hard core reality maybe we should refer to it as the reality an incredibly informative compassionate space as always thank you,_usa bengicabanga nje ngethemu engivame ukuzwa le mpi emhlabathini njengoba kodwa izinto zingokwangempela okungokoqobo mhlawumbe kufanele sibhekise kuyo njengeqiniso sibe yinto enolwazi lokufundisa njengoba likubonga njalo
1604,very informative keep up the great work,iyafundisa kakhulu qhubeka nomsebenzi omuhle
1605,your are not only informative but also just fun to read the story and character you and waiting on what is coming next i am excited to finish them,okwakho akunalwazi kuphela kepha futhi kumnandi nje ukufunda indaba kanye nomlingiswa wena nokulinda okuzayo okuzayo ngijabule ukuze ngibaqede
1606,thank you much for such a informative and knowledge transmission off too you and your team is team ko or pannel ko lots if for you and your team,ngibonga kakhulu ngokuhambisa okufundisayo okufundisayo kanye nolwazi nakho nawe futhi iqembu lakho liyiqembu le-ko noma i-papnellen ko inkatho uma ingeyona neqembu lakho
1607,hi an year old friend is trying to get you this message your program on sports is very informative and apropos for basketball i also find it very humorous and in my opinion it could also be as a situation comedy program,sawubona umngani wami osemdala uzama ukukutholela lo mlayezo uhlelo lwakho lwezemidlalo luyafundisa kakhulu futhi apropos nge-basketball nami ngikwazi ukuhlekisa futhi ngombono wami wehlaya
1608,in island a wonderful informative museum known as the this free museum with a variety of and a working periscope and three of veteran related mostly from,esiqhingini umnyuziyamu ofanelekayo ofundisayo owaziwa ngokuthi yile mnyuziyamu wamahhala ngezinhlobonhlobo ze-periscope ezisebenzayo kanye nama-veteran amathathu ahlobene kakhulu ukusuka
1609,_daveglucas informative and true not misleading twitter,_avegluucus efundisayo futhi eyiqiniso ayikhohlisi i-twitter edukisayo
1610,for what an excellent bit of training i highly recommend it is informative practical great work all involved in _physio _priest,ukuqeqeshwa okungcono kakhulu engikuncomayo kakhulu kuwukufundisa umsebenzi omuhle osebenzayo bonke ababandakanyeka ku-_physio _ister
1611,our pleasure send this jewel to us so he most of the d thank you for sending such an informative book,ukuzijabulisa kwethu thumela leli jele jewel kithi ngakho-ke iningi le-d libonga ngokuthumela incwadi efundisayo enjalo
1612,i had a couple with him over a year ago very intelligent and humble very helpful and informative he was also one of the original of to stand up and put his name on the line in doing so so much much respect for him,ngaba nombhangqwana naye ngaphezu konyaka owedlule futhi ngithobekile kakhulu futhi ngithobekile kakhulu futhi efundisayo wayengomunye futhi owangempela wokusukuma wabeka igama lakhe emugqeni kangaka ukumhlonipha kakhulu
1613,there are so many valid about social media but man educated and informative in bite size really been helpful since it s not like i got to learn real history,kunezinto eziningi ezisebenzayo mayelana nemithombo yezokuxhumana kodwa indoda efundile futhi efundisayo ngosayizi wokulunywa empeleni iwusizo impela ukuthi kufanele ngifunde umlando wangempela
1614,_ it s history there are black involved in that era as well x it was informative when i went,umlando kubamnyama obandakanyeka kuleyo nkathi futhi ufundise ngenkathi ngihamba
1615,as native we were to see your from we love your balanced and informative analysis,njengomdabu besingabona ukuthi sakho sikuthanda ukuhlaziya kwakho okulinganiselayo nokwazisayo
1616,love this video so much fun and very informative too with the wine and test comparison well done but i am disappointed that i was not to participate in the wine tasting y'all,thanda le vidiyo emnandi kakhulu futhi inolwazi kakhulu newayini nokuqhathanisa kwewayini okwenziwe kahle kepha ngiphoxekile ukuthi angizange ngibambe iqhaza ekuthambekeni kwewayini y'all
1617,probably the most informative site in an community straight forward and to the point wow great work hater club,cishe indawo efundise kakhulu emphakathini iqonde phambili phambili nakumaphuzu wow great wor work hater club
1618,thanks that s really informative and much looking forward to seeing how she,ngiyabonga ukuthi ufundise ngempela futhi ubheke phambili ekuboneni ukuthi yena
1619,_sp and you re incompetent of rational thought and data to make an informative opinion on,_sp futhi ungakwazi ukucatshangelwa kwengqondo enengqondo nedatha yokwenza umbono ofundisayo
1620,i the space we just had it s a long one but it s so informative we had so many different people speak on the topic and it s so wonderful to have so many people passionate about this topic hopefully we can have more like this,mina isikhala esisanda kukuthola eside kodwa sifundisa kakhulu ukuthi saba nabantu abaningi abehlukene bakhuluma ngesihloko futhi simangalisa kakhulu ukuba nabantu abaningi kakhulu ngethemba ukuthi singaba nalokhu
1621,very informative but i am still longing for the day when you use a straight quote,kuyafundisa kakhulu kepha ngisalangazelela usuku lapho usebenzisa isilinganiso esiqondile
1622,it is informative and educative to only your for news for and your cannel republic,kuyafundiseka futhi kuyafundisa ku-news yakho kuphela ye-news ye-and can canper
1623,building a time in rust would be informative i am just going to build this in excel,ukwakha isikhathi ngokugqwala kuzofundisa ukuthi ngizokwakha lokhu ku-excel
1624,it s daily and it s just awful viral and laughing the show is really informative news and content,kuyinto yansuku zonke kanye ne-viral kabi futhi ukuhleka mbukiso kuyizindaba ezifundisayo nokuqukethwe ngempela
1625,looking for some informative i like learning new stuff from accredited like your or your,ufuna okufundisayo engikuqondayo ngithanda ukufunda izinto ezintsha kusuka kugunyaziwe njengeyakho noma eyakho
1626,he s great and the most informative on to be seen anywhere,yena omkhulu futhi ofundisayo kakhulu ozobonakala noma kuphi
1627,the latest in my summer book reading binge made a hour flight delay at fly by pun intended seriously it is a very informative as well as entertaining read highly recommend,okusanda ku-incwadi yami yezincwadi yasehlobo i-binge yenze ukubambezeleka kwe-hour flight efly by pun okuhloselwe ngokungathi sína kufundisa kakhulu futhi kujabulisa kakhulu
1628,excellently informative drawing from over ago,umdwebo ofanelekile owezelwe kulokwedlule
1629,can be efficient if you use it on a or an informative if you are for it might be messy or you might receive the same,ingasebenza kahle uma uyisebenzisa ku-a noma inolwazi uma ngabe uyi-for ingahle ibe ngcolile noma ungathola okufanayo
1630,do not miss the first session of our free virtual summer series coming up this at am with fun and informative for of all click here to register,ungaphuthelwa isikhathi sokuqala sochungechunge lwethu lwamahhala lwehlobo ehlobo oluza lokhu ku-am lumnandi futhi lufundise ngakho konke chofoza lapha ukubhalisa
1631,to tackle this problem use the discriminator along with the generator to sample used to train the language model via expert iteration the idea is to use the discriminator to produce more realistic and thus more informative,ukubhekana nale nkinga sebenzisa ukucwaswa kanye ne-generator kusampula esetshenziselwa ukuqeqesha imodeli yolimi nge-uchwepheshe yokusebenzisa umqondo ukuze ukhiqize okunengqondo kakhulu futhi okufundisayo ngokwengeziwe
1632,power of visualization not working via informative,amandla wokubona awenzi ngokufundisa
1633,this is a really excellent short and informative video from on how the voting system in works it is definitely worth taking a look at if you are interested in running for election or thinking about to vote for the first time,le vidiyo emfushane emfushane kakhulu futhi efundisayo kusuka ekutheni uhlelo lokuvota lusebenza kanjani lufanele ukukubheka uma unesifiso sokuqhuba ukhetho noma ucabange ukuvota okokuqala ngqa
1634,we were to a training session from with great marketing team took to the ropes to in a set up of an outdoor rescue scenario big thanks to lead and at for a very informative session,sasisesikhathini sokuqeqeshwa kusuka eqenjini elikhulu lokumaketha sathatha izintambo ziye ezintanjeni zisezingeni lokuhlelwa kwesimo sangaphandle sokutakula okukhulu ukumhola kanye neseshini efundisayo kakhulu
1635,_l your content is informative and me keep i was somewhere stuck here in this topic thanks for i will check these out,_l okuqukethwe kwakho kuyafundisa futhi ngigcina ngisendaweni ethile ebambelele lapha kulesi sihloko ngiyabonga
1636,star review received on for heather by b heather was kind informative always available and in general the person ever as a first time,ukubuyekezwa kwezinkanyezi kutholwe nge-heather ngu-b heatel ngabo okufanelekile ukutholakala njalo kulungile futhi ngokujwayelekile umuntu owake wakuqala
1637,i m reading it right now just got to the just like i alone can fix it it s very informative and easy to read,ngiyifunda manje ngifika nje kufana nje nami ngedwa engingakulungisa kahle kakhulu futhi kulula ukufunda
1638,i love those rick they are entertaining and informative,ngiyabathanda labo rick bayajabulisa futhi befundisayo
1639,do not miss out on this informative chat,ungaphuthelwa kule ngxoxo efundisayo
1640,if you re an aspiring head coach and you t come see panel discussion you out one of the most informative sessions i been to at coaching school thank you _snell,uma ungumqeqeshi wekhanda ofisayo futhi u-t woza ubone iphaneli ixoxo ukhipha enye yezikhathi ezifundise kakhulu ezokuqeqesha isikole ngiyabonga _snell
1641,great start of the day with an outstanding presentation by ad tammy on measuring the success of your athletic very informative and applicable,isiqalo esihle sosuku ngesethulo esivelele ngesikhangiso se-ad tammy ekulinganiseni impumelelo ye-athletic yakho efundisayo futhi esebenzayo
1642,been a stalwart champion of the coalition its membership during his tenure at last week we in our last robust and informative national discussion with him as ambassador on the state of the community in the,ube ngumpetha we-stalwart we-coalition ubulungu bawo ngesikhathi sokuqashwa kwakhe evikini eledlule thina ekugcineni kwengxoxo yethu yokugcina futhi efundisayo naye njengenxusa elisesimweni somphakathi ku
1643,_kay i really want to thank you for providing this link it was extremely informative and helpful and also for providing this response in a respectful manner wish there were more of you on twitter,_kay ngifuna ukukubonga ngempela ngokunikeza lesi sixhumanisi sasifundisa kakhulu futhi siwusizo futhi nokunikeza le mpendulo ngendlela enenhlonipho ukuthi ngabe bekunenhlonipho kuwe ku-twitter
1644,on august th join and for an informative designed to provide essential information on and available to all of south s community register here,ngo-agasti th joyina futhi uthole imininingwane eklanyelwe ukunikeza imininingwane ebalulekile futhi etholakala kubo bonke irejista yomphakathi waseningizimu lapha
1645,is to present an informative sessions on the and of on wed to learn more and register go to,ukwethula izikhathi ezifundisayo ku-wed sour ukuze ufunde kabanzi futhi ubhalise
1646,this was a great and highly informative thread that i definitely recommend make sure to check out the other thread linked too,lokhu bekuyintambo enhle futhi efundisayo kakhulu engikuncomayo nakanjani qiniseka ukuthi uhlole enye intambo exhunywe nayo
1647,we should stop saying summative assessment all should be informative,kufanele siyeke ukusho ukuhlola okufingqiwe konke kufanele kube nokwazisa
1648,a significant portion of the the event with great excitement and it was open informative educational and interactive finance and web was the theme of the event,ingxenye ebalulekile yomcimbi onenjabulo enkulu futhi bekuyinto evulekile efundisayo efundisayo nezezimali ezisebenzayo futhi wewebhu kwakuyisihloko somcimbi
1649,well you have yourself the country file weather forecast was more informative than the debate both channel and turned it into a nasty fest,well uyazi ukuthi izwe lesimo sezulu sezwe selivele lifundise kakhulu kunempikiswano yobabili futhi wayiguqula yaba yimpumpunkwane
1650,the are confirmed for st informative newspaper went straight to you for your on the upcoming grab your free copy of informative newspaper or visit us on all our social media,ukuqinisekiswa ngephephandaba i-st efundisayo kwaqonda ngqo kuwe ekubambeni kwakho ikhophi lakho lamahhala lephephandaba elifundisayo noma vakashela kuyo yonke imithombo yezokuxhumana yezenhlalo
1651,actual put time effort into that are educational informative obviously there is a danger in on tosh like abbey but if these series alert you to something you did not know of you to find out more that is good,ukuzikhandla kwangempela kungukuthi ufundise isikhathi ngokusobala kuba nengozi ku-tosh like abbey kodwa uma lolu chungechunge lukuxwayisa ngokuthile ongakwazi ngakho ukuthola okuningi okuhle
1652,this will very informative for understanding the recent election involvement of must read it for the sake of information,lokhu kuzofundisa kakhulu ngokuqonda ukuthi ukuhileleka kokhetho kwamuva nje kufanele akufundele ukuthola imininingwane
1653,and with this we come officially to the end of road to tale volume this volume was very informative and interesting i a great time with this thank you very much this was really awesome via,futhi nalokhu sifika ngokusemthethweni kuze kube sekupheleni komgwaqo okufanele ngabe yi-volume le volumu ifundise kakhulu futhi iyathakazelisa isikhathi esihle nalokhu kumnandi ngempela lokhu
1654,very informative post about getting the of when on a diet,iposi elifundisayo kakhulu ngokuthola lapho ekudleni
1655,_cisco_ _ great informative thread,_cisco_ _ intambo enhle efundisayo
1656,this is the most well run informative committee i have ever seen it is amazing how professional and respectable it is without the clown show of jordan it that our can actually function,le yikomidi elisebenziseka kahle kakhulu lokufundisa engake ngakubona limangalisa ukuthi uchwepheshe futhi uhlonishwa kanjani ngaphandle kombukiso we-clown wejordani ukuthi wethu empeleni angasebenza
1657,this was a very informative article because love to drag single black as if they do not create them but this the of being a single mother that is not spoken about link,lesi kwakuyisihloko esinolwazi kakhulu ngoba uthando lokuhudula olumnyama olumnyama njengokungathi lungawadali kodwa lokhu kungumama ongayedwa ongakhulunywa ngakho
