,src,trg
458,our setting up a wallet discord informative session is this this completely free informative session will help you start your journey be there or be square,ukusetha kwethu isichibiyelo se-wallet discord furd sess yilokhu lokhu kwafunwa kwamahhala okufundisayo kuzokusiza ukuthi uqale uhambo lwakho lube lapho noma ube nesikwele
459,very informative deb as some one whose spent bicycle touring where weight is important i can related to what to carry,i-deb efundisayo kakhulu njengenye evakashela amabhayisekili lapho isisindo sibalulekile ukuthi ngikwazi ukuhambisane nalokho okufanele ngikuthwale
460,the of light book is very informative if you want to learn about electricity the other are a lot of good self help and if you love golf the player who never lived is very good,incwadi ekhanyayo iyafundisa kakhulu uma ufuna ukufunda ngogesi enye ingusizo oluningi lokuzithemba okuhle futhi uma uthanda igalofu umdlali ongeke waphila kahle
461,thank you for an excellent informative graph that very clear,ngiyabonga ngegrafu enhle efundisayo ecacile
462,this is super informative what most people get wrong about abortion feat via,lokhu kufundisa kakhulu lokho abantu abaningi abathola kabi ngokuhushula kwezisu feat
463,__ wow thats so informative thank you so much for this important information,__ wow thats efundisayo kangaka ngiyabonga kakhulu ngalolu lwazi olubalulekile
464,nancy grace about the case it was done a while ago but still informative,nancy greace mayelana necala kwenziwa isikhashana esedlule kodwa nokwazi
465,_reya very informative piece of writing,_reya ucezu lokubhala
466,is actually less informative than watching this the new old clan,empeleni akayona efundisayo kunokubuka lokhu okudala okudala
467,thanks informative and a bit depressing could probably describe most of my writing i do not know the latest on the i personally can not cover it right now because i am in need of a break,ukubonga okufundisayo kanye nokucindezelwa okuncane kungenzeka kuchaze iningi lokubhala kwami ​​angazi okusha ku-i uqobo ngeke ngikwazi ukukumboza manje ngoba ngidinga ikhefu
468,are suspect but still very interesting and informative,basolwa kodwa basathakazelisa kakhulu futhi befundisayo
469,another informative and intellectual statement,enye isitatimende esifundisayo nesinolwazi
470,nice segment on always informative,ingxenye enhle enolwazi njalo
471,i have to go to a conference for a few days tomorrow and i am sure it will be fine and informative but i also do not like being away from home for very long i sleep better knowing that everyone is under one roof,kufanele ngiye kwinkomfa ezinsukwini ezimbalwa kusasa futhi ngiyaqiniseka ukuthi kuzolunga futhi kufanelekile kodwa angithandi ukuba kude nekhaya isikhathi eside ngilala kangcono ngazi ukuthi wonke umuntu ungaphansi kophahla olulodwa
472,great day workshop and group of finished the sessions with informative of calcium and dynamics with and looking forward to day two with session taught by our own,umhlangano omkhulu wosuku neqembu lokuqeda amaseshini anolwazi lwe-calcium kanye namandla anamandla futhi abheke phambili nosuku lwesibili ngeseshini efundisiwe eyethu
473,another excellent and informative show school choice now,omunye umboniso wesikole omuhle kakhulu futhi ofundisayo manje
474,_mtanga check out my documentary style this was about black on black hate if i must say it is very informative,_mtanga bheka isitayela sami esibhalwe phansi lokhu bekucishe kube mnyama onzondo emnyama uma kufanele ngithi ifundise kakhulu
475,ross is so good as a commentator she is knowledgeable and informative and so much to,uross muhle kakhulu njengomhlaziyi unolwazi futhi unolwazi futhi kakhulu
476,this informative background information provided by d about _joemanchin,lolu lwazi olufundisayo lwangemuva olunikezwe ngu-d mayelana ne-_joemanchin
477,_prime _dunlop totally agree another amazing episode and very informative,_prime _dunlop vumelana ngokuphelele esinye isiqephu esimangalisayo futhi sifundisa kakhulu
478,i find this site very informative and entertaining with of by the,ngithola le sayithi efundisayo futhi iyajabulisa nge
479,look at for example whether you like the story or not it is very obvious that the game complex are not physically able to understand these yet so are not qualified to give informative on them use your brain,bheka ngokwesibonelo ukuthi uyayithanda yini le ndaba noma cha kusobala kakhulu ukuthi iyinkimbinki yemidlalo ayikwazi ukuqonda lokhu okwamanje ngakho-ke akukufanelekeli ukufundisa ngabo ukusebenzisa ubuchopho bakho
480,that was a very informative segment and appreciate your time and knowledge,lokho bekuyingxenye efundisayo kakhulu futhi kwazisa isikhathi sakho nolwazi
481,this is going to be a very informative and interesting space and i am looking forward to this safe space with and the other,lokhu kuzoba indawo efundisayo futhi ethokozisayo futhi ngibheke phambili kule ndawo ephephile nenye
482,ago i did a lot of work on myself and on to do a window and a window on me it was informative,edlule ngenze umsebenzi omningi kimi futhi ngenza iwindi newindi kimi lalifundisa
483,honestly so informative,ngokweqiniso efundisayo
484,i have had multiple people reach out and say they have found the page helpful and informative not just pro people but pro too you may not be looking for another resource for the case but some people are,sengibe nabantu abaningi bathola futhi bathi bathole ukuthi ikhasi liyasiza futhi abafundisi hhayi nje abantu abasebenza kodwa abungeke bafune enye insizakalo yecala kodwa abanye abantu bakhona
485,lose gracefully educative and informative and centered interpersonal communication skill,ulahlekelwe ngomusa ofundisayo futhi ofundisayo futhi ogxile phakathi kwekhono lokuxhumana nabantu
486,i was very slee and an informative video about the catalogue and that thought came to my mind and i sworn i it but i cannot find it even in my,ngangimlinganisa kakhulu futhi ngibe nevidiyo efundisayo mayelana nekhathalogu futhi umcabango wafika engqondweni yami futhi ngafunga ukuthi angikwazi ukukuthola ngiye
487,next installment of the series by medical all team reps and any other are to attend this informative session that will cover the complete registration process link to participate below,ukufakwa okulandelayo kochungechunge ngezokwelapha zonke izimpendulo zeqembu kanye nanoma yikuphi okunye ukuhambela lesi sikhathi esifundisayo esizohlanganisa isixhumanisi senqubo yokubhalisa ephelele ukuze ubambe iqhaza ngezansi
488,some people gain attention and by being interesting and informative like and and like get it through sanctimony and misinformation,abanye abantu bathola ukunakwa futhi ngokuthakazelisa futhi befundise ukufundisa futhi futhi bakuthathe ngokuningilimoni kanye nemininingwane engafanele
489,not sure how i found your article but i m glad i did really informative,ungaqiniseki ukuthi ngithole kanjani i-athikili yakho kepha ngijabule ukuthi ngifundise ngempela
490,this guy the best political i have seen i mean it is super informative i have never seen the inside of a restaurant bathroom before and i am dying to know more someone should give him a show or make him president,lo mfo wezepolitiki okungcono kakhulu engikubonile ngiqonde ukuthi ngabe kungumfundi omkhulu ongakaze angikaze ambone ngaphakathi kwendlu yokudlela edlule futhi ngifela ukwazi okwengeziwe kufanele ngimenzele umbukiso noma ukumenza umongameli
491,just finished a session with and on user as a consultant it was very informative with great and i really learned so much and looking forward to the next training session,vele uqede iseshini futhi kumsebenzisi njengomeluleki ubekwazisa kakhulu ngomugqa omkhulu futhi ngafunda kakhulu futhi ngibheke phambili esifundweni sokuqeqeshwa esilandelayo
492,informative and very knowledgeable staff thanks for the star review,abasebenzi abafundisayo nabanolwazi kakhulu siyabonga ngokubuyekezwa kwenkanyezi
493,carry stiff in the state of learn more on the informative below,phatha ukhuni esimweni sokufunda kabanzi kwalowo ofundisayo ngezansi
494,_animation i would say follow me for more informative but you are from new jersey sorry i dont associate with lizard people,_animation bengingangithi ngilandele okufundisayo kepha uvela enew jersey ngiyaxolisa nge-dont ball
495,all the ways you could have his informative on concrete of framing and in and this is your choice,zonke izindlela ongaba nazo ukwazisa ngokhonkolo kokuhlaziywa futhi kusetshenziswe nalokhu
496,tweeter handle is this i think all especially youth should follow you min so informative,isibambo se-tweeter yilokhu ngicabanga ukuthi yonke intsha kufanele ikulandele imitha
497,i love astrology i find it very informative and a perfect place to start learning,ngiyakuthanda ukufundwa kwezinkanyezi engikutholayo okuhle futhi kuyindawo ephelele yokuqala ukufunda
498,some of them are just who talk beyond their turf these are just annoying but their intention is informative a noble one the dangerous one are those selling because they will intentionally create false framing in order for people to give them maximum profit,ezinye zazo zikhuluma nje nge-turf yazo lezi zicasule kepha inhloso yazo efundisa umuntu oyingozi ukuthi abantu bazokwakha ngamabomu ukuthi abantu bawanikeze inzuzo ephezulu
499,how a smart middle east strategy can help russia play a significant role in shaping the new world order russia former soviet union _e informative very well written be safe productive will miss you,indlela i-smart middle east isu elingasiza i-russia ibamba iqhaza elibalulekile ekubumbeni umyalo wezwe omusha waserussia owayengumuntu owayeyinyunyana yasesoviet union
500,what an informative observation she ate that meat like how cut off his cock,ukubuka okufundisayo okufundile
501,if you re funny or informative,uma uhlekisa noma ufundisa
502,thank you for the stream it was so informative and fun sticky is sprite awesome,ngiyabonga ngokusakazwa kwakuyinto efundisayo futhi emnandi inamathele enhle iyamangaza
503,we invite you to a special event from university an insightful and informative class on digital government transformation taught by adjunct professor for various register below,sikumema emcimbini okhethekile ovela eyunivesithi isigaba esinokuqonda futhi esifundisayo kuguquko lukahulumeni lwedijithali olufundiswe nguprofesa obhalwe phansi ngerejista ehlukahlukene ngezansi
504,this law firm is very efficient your needs met very knowledgeable and informative on via _,le nkampani yezomthetho isebenza kahle kakhulu izidingo zakho zahlangana zinolwazi kakhulu futhi zinolwazi nge-via _
505,honestly highly recommend this video it goes into the science and how we have come to this conclusion in a funny and yet informative way and before anyone him for his current career before he was a chemistry teacher at college,ngokweqiniso batusa kakhulu le vidiyo kuleya kwisayensi nokuthi ngabe sifike kanjani kulesi siphetho ngendlela ehlekisayo kodwa efundisayo futhi ngaphambi kokuba noma ngubani alowo ayenzele umsebenzi wakhe wamakhemikhali ekolishi
506,_mma well done informative good and clean as a whistle it was great thank you so much,_mma wenze kahle enolwazi futhi uhlanzekile njengekhwela bekukuhle ngiyabonga kakhulu
507,great article the research paper is truly exhaustive and informative,isihloko esihle iphepha lokucwaninga liyaphela ngempela futhi lifundise ngempela
508,this is exciting to know that more people will be joining this fabulous and informative tour of the river through,lokhu kuyajabulisa ukwazi ukuthi abantu abaningi bazobe bejoyina lokhu kuvakasha okuhle futhi okufundisayo komfula
509,you are a lot of fun flirty and you always make me smile your are informative and entertaining,unobumnandi obuningi obumnandi futhi uhlala kungenza ngimamatheke yakho efundisayo futhi ejabulisa
510,another very informative video by,enye ividiyo efundisayo kangako
511,thankful to have come across this as it s informative and helpful in my decision of moving as close to the north pole as possible,babonga ukuthi bakutholile lokhu njengokufundisa futhi kusiza esinqumweni sami sokuhamba eduze kwesigxobo sasenyakatho ngangokunokwenzeka
512,not only is this site informative at times it is also quite funny,akukhona nje kuphela ukuthi lo mfundisi wesiza kwesinye isikhathi kuyahlekisa impela
513,de _time,de _ time
514,here is an informative article about aka and the future of over the air broadcast no need to wait to enjoy our are already ready,nasi i-athikili efundisayo mayelana ne-aka nekusasa lokusakaza komoya akunasidingo sokulinda ukujabulela ukulungele
515,very informative indeed,kuyafundisa kakhulu impela
516,that was a lot of slime to wade through but i am glad i did it was very informative,lokho bekuningi kwe-slime ukuze udlule ngaphandle kodwa ngiyajabula ukuthi ngiyenzile kakhulu
517,this one is better more informative and will save it,le nto inolwazi olungcono futhi izoyigcina
518,way back when i was with went to the same pharmacy as i did she left lots of informative there for me forever grateful sending so much love,emuva emuva lapho ngisekuqaleni ngaya ekhemisi elifanayo njengoba ngenza ukuthi wawashiya ofundisayo onolwazi lapho kimi ubonga kuze kube phakade ukuthumela uthando olungaka
519,holy hell is this long but oh my god is it so informative it is from but the writing was on the wall,isihogo esingcwele lesi yisikhathi eside kodwa oh unkulunkulu wami ungumfundisi uvela ngaphandle kodwa ukubhala kwakusodongeni
520,every community needs a she is informative always on the target and professional belle was your beat decision,wonke umphakathi udinga ukuthi uyafundisa njalo kulitshe futhi i-belle ye-professional kwakuyisinqumo sakho sokushaya
521,very informative on the between,iyafundisa kakhulu phakathi
522,the wonderfully informative if it s the same bloke if not will retract he allegedly set up a business in to avoid paying u k tax,okufundisayo ngokumangazayo uma kuqhuma okufanayo uma kungaphinde kubuyiselwe kusolwa ukuthi wabeka ibhizinisi ukugwema ukukhokha intela yakho
523,we plan on holding an informative space after we officially launch v,sihlela ukubamba indawo efundisayo ngemuva kokuqalisa ngokusemthethweni v
524,in this yet informative interview with by what music important to you music is powerful it is universal and it is sincerity,kulokhu ngxoxisana nolwazi olufundisayo nalokho okubalulekile umculo kuwe umculo unamandla kuwumhlaba wonke futhi ubuqotho
525,she works in and more adult and informative on a lot of her are very also insert literary pun here works in too and interesting a more niche taste i enjoy her longer discussion,usebenza futhi omdala futhi ofundisayo ngeningi lakhe abuye afake futhi afake i-pun ebhala lapha esebenza futhi ethokozisayo ukunambitheka kwakho okuningana
526,she is so articulate and informative,uzwakalise futhi unolwazi
527,many thanks for this very informative and eye opening article resource on jack,ngiyabonga kakhulu ngalo msebenzi we-athikili ofundisayo ofundisayo nowokuhlolelwa ngamehlo ejack
528,i was so and nervous the lady was very patient and informative,nganginovalo futhi nginovalo lwentokazi lwalubekezelela kakhulu futhi luyafundisa
529,i found a band on and their is just bill is buttermilk recipe which is cool informative interesting except who is bill no one in the band is bill,ngithole i-band kuvuliwe futhi yabo i-bill iyindlela ye-buttermilk epholile ethokozisayo ethokozisayo ngaphandle kokuthi ubill akekho ku-band
530,another day of being maybe i was at a speech and debate tournament with in high school i did prose and informative speaking so there s absolutely no event overlap but still,olunye usuku lokuba mhlawumbe ngangisekukhulumeni futhi ngixoxisazayo ngesikole esiphakeme ngisezingeni eliphezulu futhi ngifundise ukukhuluma ngakho-ke akukho mcimbi ongekho emcimbini kodwa namanje
531,new feature add partner commentary to and make your fund more informative with qualitative quantitative model,isici esisha sengeza amazwana ozakwethu ukuze wenze isikhwama sakho sifundise kakhudlwana ngemodeli yokulinganisa efanelekile
532,very informative article weakening russia is ability to wage conventional war is in our national interest we must remember though russia remains a nuclear power,i-athikili efundise kakhulu i-russia inamandla empini yempi evamile ikusasa lethu kufanele silikhumbule yize irussia ihlala ingamandla enuzi
533,do not worry you will see later maybe social can be entertaining and informative money is not too bad either,ungakhathazeki ukuthi uzobona kamuva mhlawumbe mhlawumbe nomphakathi ungajabulisa futhi imali efundisayo akuyona into embi kakhulu
534,i watched this tech channel a lot back in the day simple and informative,ngibuke lesi siteshi se-tech esibuyayo kakhulu ngosuku olulula futhi olufundisayo
535,wow this is informative too,wow nalokhu kuyafundisa
536,so much better and informative than the r word everywhere else,kungcono kakhulu futhi unolwazi olunolwazi kunezwi roft yonke indawo
537,a very well done and informative video of our latest game fire on the mountain by still available at the special release price of retail price,ividiyo eyenziwe kahle eyenziwe kahle futhi efundisayo yomlilo wethu wakamuva womdlalo entabeni asatholakala ngentengo ekhethekile yokukhishwa kwentengo yezitolo
538,this is so informative thanks,lokhu kungukubonga okunolwazi kakhulu
539,thank you for following me and i hope my are informative and fun if you think i can do better let me know,ngiyabonga ngokungilandela futhi ngithemba ukuthi ngiyafundisa futhi kumnandi uma ucabanga ukuthi ngingakwenza kangcono ungazise
540,special place in twitter hell for people who find a helpful thought out and informative thread and respond to the first tweet with nice thread now do one for my specific situation,indawo ekhethekile e-twitter hell yabantu abathola umcabango osizayo ngaphandle kanye nokwazisa futhi baphendule ku-tweet yokuqala ngentambo enhle manje yenza eyodwa ngesimo sami esithile
541,just to your wonderful interview very inspirational and informative from the man behind the cowl of many i grew up loving as a watching batman on repeat i would love to inquire about a photo myself,ukuxoxisana kwakho okuhle kakhulu okuphefumulelwe futhi okufundisayo okuvela endodeni ngemuva kwenkomo yabaningi engikhule ngakho njengobukele be-batman ngokuphindaphindwa ngithanda ukubuza ngesithombe sami
542,the horror is definitely still there but also so much else that is simply super informative about small of what certain were like i am so glad it was useful,i-horror isekhona nakanjani lapho kodwa futhi nokunye okuningi okufundile kakhulu ngokukhulu kwabancane kwalokho obekunjani ngijabule kakhulu ukuthi bekuwusizo
543,the apple series it s beautiful informative inspirational,i-apple series it s enhle efundisayo efundisayo
544,feel like i am getting more informative feedback paired with of how i actually make my mouse stop where i want it to instead of sliding it to where i want so thats cool lame it didnt turn me into a god tho,zizwe sengathi ngithola impendulo efundisayo efundisekayo ngendlela engizoyenza ukuthi igundane lami liyeke lapho ngifuna khona esikhundleni sokuyifaka lapho ngifuna ukuba ngibe ngunkulunkulu opholile
545,not upset was ever credible this is not even objective journalism to say nothing of being informative,akucasuki ukuthi kutholakala ukuthi lokhu akunakuthembeka lokhu akuyona ngisho nobuntatheli obunenhloso ongasho lutho ngokufundisa
546,_yoga _exeter _thompson if you never actually watched footage of the attack i don t think i m up for breaking it down for you the congressional have been pretty informative though you should watch those,_yoga _exet _thompson uma ungakaze ubuke ubuhlakani bokuhlasela engingacabangi ukuthi ngivule ukukuqeda wena i-conmessional ifundise kahle yize kufanele ubuke labo
547,most informative catechetical thing i have on the papacy in a long time,into efundisayo efundisayo efundisayo enginayo epapa ngesikhathi eside
548,is so because one will be cute and the next one is the most grim you ever seen and then the next is something informative and interesting and the next one you off then the next one is so wholesome and the next one is,kunjalo ngoba umuntu uzoba muhle futhi olandelayo olandelayo ububi kakhulu owake wawubona futhi okulandelayo kuyinto efundisayo futhi ethokozisayo futhi elandelayo olandelayo olandelayo olandelayo olandelayo olandelayo olandelayo olandelayo olandelayo olandelayo olandelayo olandelayo olandelayo olandelayo olandelayo
549,have been informative and transparent since the beginning of schooling your agenda is not anything new if want to know what s being taught to their they can get and see the curriculum or better yet talk to oftentimes don t care,bafundise futhi bebe sobala ngoba ukuqala kokufunda isikole sakho akuyona into entsha uma ufuna ukwazi ukuthi yini ukufundiswa kwabo bangathola futhi babone ikharikhulamu noma okungcono kodwa bakhuluma ngezikhathi ezithile
550,this is a great informative read,lokhu kufundwa okuhle okufundisayo
551,i think there was a similar sign on display at the center for civil and human at least in during my last visit is honest informative inspiring worth a visit when in,ngicabanga ukuthi kube nesibonakaliso esifanayo esisesimweni esikhungweni sezomphakathi neyomuntu okungenani phakathi ngesikhathi sokuvakasha kwami ​​kokugcina kungukuthi ukuvakasha okufundisayo okubaluleke kakhulu lapho kuvakashelwa khona lapho
552,on your my guy and i find it extremely informative,kumuntu wakho wami futhi ngithola kufundisa kakhulu
553,the s write up on the best is very informative,ukubhala okungcono kakhulu kufundisa kakhulu
554,_shek what cross examination do you seek this is not a trial rather informative testimony by st hand,_shek yikuphi ukuhlolwa kwesiphambano osifunayo lokhu akusona isivivinyo sobufakazi obunolwazi obukhona
555,the sun t as informative as mad magazine,ilanga t njengonolwazi njengomagazini ohlanya
556,thank you for my column hope you found informative and helpful,ngiyabonga ngekholomu yami ngithemba ukuthi uthole ukwazisa nokusiza
557,solid i found reading both of these heavily interesting and informative,kuqinile ngithole ukufunda kokubili kwalokhu kuthakazelisa kakhulu futhi okufundisayo
558,tune in at tonight and support the we promise to keep it informative fun and honest throughout the broadcast,hlangana namhlanje kusihlwa futhi usekele thina sethembisa ukusigcina sijabulisa futhi sithembeke kulo lonke umsakazo
559,also you can not do i have done more than you that is for sure like explain when your informative have done good they did more harm than heal,futhi awukwazi ukukwenza ngenze okungaphezu kwakho okuqinisekile okufana nalokhu okufana nalokhu kuchaza lapho ukwazisa kwakho kwenze okuhle benza okubi kakhulu kunokuphulukisa
560,we encourage everyone to attend this informative event insh'allah,sigqugquzela wonke umuntu ukuthi ahambele lo mcimbi ofanelekile insh'allah
561,_nope very wise and informative statement thank you,_sitatimende esihlakaniphile futhi esifundisayo siyabonga
562,informative read on surface to air and use,iyafundisa ukufunda ebusweni kuya komoya nokusetshenziswa
563,you re welcome i could only see the post through the screen grab but it s rather ridiculous behaviour for to suggest over and your post was very informative and on point,wemukelekile ngabona ukuthi ngibona nje okuthunyelwe ngokubamba isikrini kepha ngokuhlekisa ngokuhlekisayo ukuze ngiphakamise futhi okuthunyelwe kwakho bekufundise kakhulu futhi ngephuzu
564,thanks that is informative,ngiyabonga lokho kufundisa
565,_tessie holy same theyre just so informative and,_tessie engcwele engcwele inolwazi nje futhi
566,thank you as always for your informative,ngiyabonga njalo ngokufundisa kwakho
567,after the game against today i be out my i want to turn this page into more of an informative match reaction based page,ngemuva komdlalo ngokumelene namhlanje ngiba ngaphandle kwami ​​ngifuna ukuguqula leli khasi libe ngaphezulu kwekhasi elifundisayo elifundisayo
568,it is in twitter is interest to identify and block so not a exercise this post is informative,kuku-twitter kuyinto ethakazelayo ukukhomba nokuvimba ukuze kungabikho ukuvivinya umzimba okufundisayo
569,_ open forum happy you met a few small waste people down here i d say they re more honest but just as deceptive it s not my policy is but they blame for waste failure don t offer any informative clean out,_ iforamu evulekile happy uhlangane nabantu abambalwa bemfucuza obuncane phansi lapha ngithi bathembeke ngokwengeziwe kodwa njengabakhohlisi ukuhluleka kwenqubomgomo yami kodwa basola ukungafundisi
570,incredibly informative as always brent,kuyafundisa kakhulu njengokudla njalo
571,this is the most informative read i have upon he is a confidential informant and that is why he away with murder literally,lokhu kungukufundwa okufundisayo kakhulu enginakho ku-ungumfundi oyimfihlo futhi yingakho kude nokubulala ngokoqobo
572,if on telegram there are some very informative you may want to read through i can you some,uma ku-telegraph kukhona okufundisayo kakhulu ongafuna ukukufunda ngawe
573,informative read from to panama which could go the sri way,iyafundisa ifundwe kusuka kupanama okungahamba ngendlela ye-sri
574,the history of concrete back several of read more about it in the informative article below,umlando kakhonkolo emuva okuningana kokufunda okuningi ngakho esihlokweni esinolwazi esingezansi
575,looking for to pick out the perfect wedding venue read this informative article,ngifuna ukukhetha indawo efanele yomshado funda le ndaba efundisayo
576,it is a fun experience and the people that work there are informative and super chill,kuyisipiliyoni esimnandi kanye nabantu abasebenza lapho kukhona abafundisayo futhi abanamandla amakhulu
577,_wiki thanks very informative thread,_wiki ngiyabonga kakhulu ngentambo efundisayo
