,src,trg
1385,to those of you in which i choose to always be the to something that you need to know loving me is not a joke,kulabo kini lapho ngikhetha khona ukuthi njalo ngibe yinto okudingeka ukwazi ukungithanda akuyona ihlaya
1386,_nota _sedai _hopper _matt _al_thor _veggies _todwin _taveren _gorsegners _sedai _pixie awful joke alert what do you get when you cross a with blight soup,_nota _sedai _phatt _matt _al_thor _eveggies _todwin _taveren _sosegh _taveren _sosherji _taveren _pedai _pixei _pedai _pingie
1387,it is absolutely terrifying i have another year before i m eligible for my now are ridiculous i often joke that the younger generation t vote against their the may end up living with them but it s nothing to joke about,kuyasabisa ngokuphelele nginomunye unyaka ngaphambi kokuthi ngifaneleke manje ngihlambalazayo ngivame ukuhlahlekisa ukuthi isizukulwane esincane sivotela ukuba sihlale nabo kungenzeka ukuthi bahlangane nabo
1388,joke of the day two fell out of a jar onto the floor what did one say to the other a dill with it have a great day,ihlaya losuku losuku liwela embizeni liye phansi kwathi omunye umuntu athini kwelinye i-dill naye anosuku oluhle
1389,but its a joke,kepha ihlaya layo
1390,and here i thought you t my boss a funny joke but she knew enough to get what that meant my name mirage that s what i m known by at least sadly i don t have anything as casual as to go by little jab at the fact this menace to society,futhi lapha bengicabanga ukuthi ungumphathi wami ihlaya elihlekisayo kodwa wayekwazi ngokwanele ukuthola ukuthi igama lami lalisho yini ukuthi yini engiyaziyo ngokudabukisayo ngathi le ndondo emphakathini
1391,all the mad about this joke need to chill you have to work when you get fake like and stupid like it,konke ukuhlanya mayelana nalokhu kudideka kudingeka ku-chill kufanele usebenze lapho uthola inkohliso unjani futhi uyisiphukuphuku njengaso
1392,i love sweetheart princess as a joke,ngiyayithanda i-sweetheart princess njengehlaya
1393,just sold their year old star for only m what a joke,usanda kuthengisa inkanyezi yabo eneminyaka yabo ubudala kuphela
1394,great job ladies s academic rigor is no joke with the our scholar are in this is a deal,i-great gob ladies sadies rigir ayilona ihlaya nesazi sethu kulesi sivumelwano
1395,i understand that it was a joke about nobody physically there listening to the thanks for the comment,ngiyaqonda ukuthi bekuyihlaya ngabomuntu ngokomzimba lapho elalela ukubonga ngamazwana
1396,he now one joke though,manje ihlaya elilodwa
1397,that is no joke,lokho akulona ihlaya
1398,is this a joke or as a the fourth best,ingabe lokhu kuyihlaya noma njenge-okwesine kuhle
1399,you just what i said and slant of the sun ray is the third guy in the second example familiar with or related to the this is a joke close will laugh at what if a guy had been the one who made the statement in example,wena nje engikushilo futhi engikushilo ilanga ray ngumuntu wesithathu esifundeni sesibili esijwayele noma ohlobene nalokhu kusondele kakhulu uma umuntu esohlekile uzohleka lokho uma enza isitatimende ngokwesibonelo
1400,also what a take a joke i assume but still dumb,futhi lokho kuthatha ihlaya ngicabanga kepha kusangulube
1401,_rock keep believing your reality is religion is a joke,_rock qhubeka nokukholelwa iqiniso lakho kuyinkolo kuyihlaya
1402,so a new game came out this week stray you play as a cat for this tweet was a joke as if the cat on the p,ngakho-ke kwaqhamuka umdlalo omusha kuleli sonto edukayo udlala njengekati yale tweet bekuyihlaya njengokungathi ikati ku-p
1403,a very funny joke yes out,joke ohlekisayo kakhulu yebo
1404,oh no well the review system at my is a joke i spend writing my own self assessment for their complete lack of record keeping then my boss month re writing in the form of  woulditto',hhayi kahle uhlelo lokubuyekezwa kimi luhlaya engichitha ngalo ukubhala ngokuzihlola kwami ​​ngokuntuleka kwalo okuphelele kokugcina amarekhodi okugcina bese kubhala i-boss inyanga yenyanga
1405,they do the whole thing is a continuous joke proper good season lined up hopefully especially if comes back,bonke bayinto eqhubekayo ihlaya elifanele isizini enhle yahlala ngethemba ikakhulukazi uma ibuya
1406,quite obviously a joke,ngokusobala ihlaya
1407,billy s account holder is actually trying to justify billy s is this a joke,umnikazi we-akhawunti ye-billy s empeleni uzama ukucacisa ama-billy yilehlaya
1408,what a joke he nothing for struggling,yini ihlaya elingeyona into yokuzabalaza
1409,disgraceful too bad i already don t watch your joke of a show i d love to indignantly declare i d stop after so much of this,kuhlakule kabi kakhulu ukuthi angibuki amahlaya akho ombukiso ngithanda ukumemezela ngempama nge-d stop ngemuva kwalokhu
1410,i know right i will bet he comes out in a bit and it was all a joke or a plant by some leftist commando team in rainbow colored or some other lie then he may stick to his and just pull out the full regalia,ngiyazi kahle ngizokubheja ukuthi uphuma kancane futhi konke kwakuyihlaya noma isitshalo ngeqembu elithile le-commando ye-rainbow noma amanye amanga anganamathela ku-regalia egcwele
1411,is this some idea of a bad joke really i m not laughing,ingabe lo mqondo othile wehlaya elibi ngempela angihleki
1412,not mean not making a joke no part of this tweet was readable what the is happening i i understood,akusho ukuthi awenzi ihlaya akukho ingxenye yaleli mpendulo elalifundwa ukuthi kwenzekani ngangikuqonda
1413,are mental illness this is a joke,ukugula kwengqondo lokhu kuyihlaya
1414,_nutbutter it s not the only joke it s just one that really under y all s skin,_nutbutter it s hhayi okuwukuphela kwehlaya yona nje eyodwa engaphansi kwesikhumba sonke
1415,please i said it as a joke but when i read the description it was really an abandoned school i cannot,ngiyacela ukuthi ngikusho njengehlaya kodwa lapho ngifunda incazelo kwakuyisikole esishiywe ngeqiniso angikwazi
1416,some are actually my and i don t think it s as a joke,ezinye empeleni zami futhi angicabangi njengehlaya
1417,back never joke,emuva neze ihlaya
1418,it s a joke that t in the s _,ihlaya elithi t ku-s _
1419,this to be a joke surely poor to not the of not the in mostly labour nor out the anti in labour front bench woeful lammy a racist gardener taking money joke party,lokhu kube yihlaya elimpofu ngokuqinisekile akwenzi hhayi okungewona owakhelwa abasebenzi noma ngaphandle kwe-anti ebetch front front benky lammy i-comed marder
1420,what a joke you don t know the truth,yini ihlaya ongalazi iqiniso
1421,joke apart loyal mein deserve hoon,ihlaya elithembekile le-mein desine
1422,listen it s a good joke a great joke even,lilalele ihlaya elihle ihlaya elikhulu ngisho
1423,_english this in order to protect the of the city hedge funds and fossil that back him democracy is a joke in this country,_ish lokhu ukuze kuvikelwe izikhwama ze-city hedge kanye ne-fossil ukuthi intando yeningi ihlekisa ihlaya kuleli lizwe
1424,_ _johnson _on on is a joke when it comes to and,_ _johnson _on on ihlaya uma kufika futhi
1425,new this is a joke right they were both two of the main of right until the bitter end the only small solace in laughable leadership campaign is that you and your have basically that the will be out in finally,okusha lokhu kuyilungelo lamahlaya
1426,o my god i am so sorry now i feel bad u have not met me yet i am a joke n if my feeling get hurt i just go kick my dog,o nkulunkulu wami ngiyaxolisa manje ngizwa kabi awukaze wahlangana nami nokho nginguhlaya
1427,at over is just full blown blatant stupidity and bias there is no way people believe this t a full season in like but and most likely still an what a joke,ngaphezulu kumane nje kushaywa ubuwula obucwebezelayo kanye nokungaqhoshayo akusekho nto abantu abakukholelwayo ngale ndlela i-t isizini ephelele efana neyodwa kodwa futhi kungenzeka ukuthi ihlaya ihlaya
1428,i m hello momo for myself and the normal who t mad over a joke that t even involve them,nginawo mamo wami uqobo kanye nokwejwayelekile okuhlanya ngehlaya elingabandakanye nalo
1429,incredible joke,joke omangalisayo
1430,i have over the last couple of that we are surrounded by utter gullible what a joke life become because of it,nginawo ngaphezulu kombhangqwana wokugcina wokuthi sizungezwe ngokuphelele okungekho emthethweni okuba yimpilo yamahlaya eba ngenxa yalokho
1431,this to be a joke there is no way someone is this dum myrtle to be messing with us,lokhu kube yihlaya ayikho nhlobo ukuthi umuntu ungomunye umyrtle myrtle ukungcola nathi
1432,no cross platform for to be a joke,ayikho ipulatifomu yesiphambano ukuze ube ihlaya
1433,yep jay z literally like a joke next to big l he is so slept on early,yep jay z ngokoqobo njengehlaya eliseduze nebig l ulala kakhulu ekuqaleni
1434,_kaisen _twt it s a joke i m sure y all say the same about ur it s not that deep,_khaisen _tww it s i-joke ngiyaqiniseka ukuthi konke kusho okufanayo nge-ur hhayi
1435,it was not a joke and you definitely did not see the evidence,kwakungeyona ihlaya futhi nakanjani awububonanga ubufakazi
1436,joke right these are the least people i ever seen,ihlaya lawo nalaba bantu abancane engake ngabona
1437,if you joke we shall include you,uma ihlaya sizokufaka kuwe
1438,i could tell you a good joke then a bad joke,ngingakutshela ihlaya elihle ke ihlaya elibi
1439,meanwhile back in reality working are a coin trying to decide if they should buy gas or food this bull is a sad joke and anybody still pushing it should resign in disgrace we have real and a fake insurrection is real low on that list,ngaleso sikhathi emuva engokoqobo ukusebenza kuyinto uhlamvu lwemali oluzama ukunquma ukuthi kufanele lithenge igesi noma ukudla le nkunzi kuyihlaya elidabukisayo futhi noma ngubani osaphoqelela kufanelekile kuhlazo sinohlu lwangempela kulolo hlu
1440,imagine watching when u have a what a joke,cabanga ubukele lapho uneye ihlaya
1441,it s honestly just hilarious to joke about because people defend it as if they re devout and is their lord and savior,ngokweqiniso i-hilarious i-hilarious nje yokuhlekisa ngoba abantu bayivikele kungathi bayazinikezela futhi bayinkosi nomsindisi wabo
1442,it s good for straight i won t use anything else to look for everything else like a joke in comparison to how effective hinge is for finding who are my type but bumble is the only i ever had luck w for finding to date so,kuhle ngokuqondile nginqobile ukusebenzisa noma yini enye ukubheka konke okunye okufana nehlaya ngokuqhathaniswa nokuthola ukuthi nginenhlanhla kangakanani lapho ngithola inhlanhla yokuthola isikhathi se-le
1443,i thought my life was the biggest joke the supreme court is a great building,bengicabanga ukuthi impilo yami ibisehlaya enkulu kunazo zonke inkantolo ephakeme yisakhiwo esikhulu
1444,i know it was a bad joke i appreciate you you are one of a kind my friend and i am of that type,ngiyazi ukuthi bekuyihlaya elibi ngiyakubonga wena ungomunye womusa wami futhi ngiluhlobo lolo hlobo
1445,i m it s a joke,ngiyihlaya
1446,seriously the first second third fourth ninth eleventh twenty fifth times i tried it i figured it was an alien trap to challenge mere human life now i still think so no joke,ngokujulile isibili sokuqala sesibili sesithathu sesishiyagalolunye esingamashumi amabili nanhlanu ngazama ngathola ukuthi bekuyisicupho sokuphikisana nokuphila komuntu nje manje sengingacabangi ngakho
1447,_n if you still have not gotten it it was a joke,_n uma ngabe ungayitholi ukuthi bekuyihlaya
1448,i am sure there is a joke about cock fighting in here somewhere,ngiyaqiniseka ukuthi kukhona ihlaya nge-cock elwa lapha kwenye indawo
1449,so the landlord is should pay the mortgage on their house and go broke while the would enjoy on their property for free for and not go broke what a f joke only in,ngakho-ke umninindlu kufanele akhokhe imalimboleko endlumbile endlini yakhe futhi aphuke ngenkathi iyokujabulela impahla yazo mahhala futhi ingahambi kahle i-forke ye
1450,i m in for just a couple of days no joke someone may have just on the train i m on they let us all off for someone who medical assistance i m sure it s not related they say the heat did it like we never had degree days before welcome to,ngingena ezinsukwini ezimbalwa nje akukho ihlaya umuntu angaba nalo esitimeleni engisitholayo masisivumelile umuntu ozolibona ukuthi aze athi asikaze sibe nezinsuku ezingakaze zibe nazo
1451,true station needs serious attention these auto think it is their own property auto is not a joke,isiteshi sangempela sidinga ukunakwa kakhulu lokhu kucabanga okuzenzakalelayo ukuthi eyabo impahla akona ihlaya
1452,by i i make people laugh strictly off the delivery in which i say i don t even tell a joke it just be the way i say stuff that laugh and i can go with that cause it s organic not me force a laugh,ngami ngenza abantu bahleke ngokuqinile ekulethweni lapho ngithi angisho lutho ngisho nehlaya ukuthi ngiyindlela ehleka ngayo futhi ngikwazi ukuhamba naleso sizathu sokuthi angiphoqelele ukuhlekisa
1453,got of the time i was so to even write sex in on purpose had this disclaimer saying sorry beware sexual ahead and the sexual joke is getting sent an eggplant past me was,kusesikhathini lapho bengizokwenza ngisho nokubhala ngocansi ngenhloso yokuthi lesi sitatimende sithi ngiyaxolisa ukuthi uxolo qaphela phambili nangokobulili kuthunyelwa isitshalo esidlule kimi
1454,i know it s not that s why i put at the end it s a joke,ngiyazi hhayi lokho ukuthi kungani ngibeka ekugcineni ihlaya
1455,this is a joke right just to make us laugh c amon man even joe to see this right southern border 'is secure' as historic migrant crisis,leli ihlaya lilungile ukuze nje sihleke c amon man ngisho nojoe ukubona lo mngcele oseningizimu 'uvikelekile' njengenhlekelele yomlando ongumlando
1456,do not take the tweet seriously is hot everywhere it is just a joke on them as their colonizer were so successful in hot climate of and,ungathathi ngokungathi sína i-tweet iyashisa yonke indawo kumane nje ihlaya kubo njengoba ikoloni labo laphumelela kakhulu esimweni sezulu esishisayo futhi
1457,as if t a joke already,njengokungathi ihlaya vele
1458,as an is a joke,njengoba ihlaya
1459,it s not that i t get it it s that the joke was horrid,akukhona ukuthi ngiyitholele ukuthi ihlaya liyathusa
1460,individual unless you are a woman what an ignorant hypocritical joke you are would you let your wife or daughter die if you had to make a choice and let your grow up without a mother,umuntu ngamunye ngaphandle kokuthi ungowesifazane ukuthi yiphi ihlaya elingenalwazi lobuzenzisi ongavuma ukuthi umfazi noma indodakazi yakho afe uma kufanele wenze ukhetho futhi uvumele ukukhula kwakho ngaphandle kukamama
1461,justice is a joke let the supreme court order a plate of to and fall at his seeking,ubulungiswa buhlekisa ngamahlaya vumela inkantolo enkulu yathumela ipuleti lokuya futhi liwele ekufuneni kwakhe
1462,i watched the trial it was a joke,ngibuke ukuqulwa kwecala kwakuyihlaya
1463,total without qualification lac hospital system less than of covid are from covid versus with covid incidentally virtually no serious illness from covid are a joke since  is have tested at home and not joke,ingqikithi ngaphandle kwesikole seziqu ze-lac ze-lac eziphansi kwe-covil ezivela kwi-covid ngokuqhathanisa ne-covion cishe ngokungathí sina ukugula okuvela kwi-covion selokhu kuhlolwe ekhaya futhi hhayi ihlaya
1464,i love and dont say cause it the of joke i take most stuff as so,ngiyakuthanda futhi angisho ukuthi kubangele ihlaya ngithatha izinto eziningi njengoba kunjalo
1465,i would tell you a joke about my shoe but i think i shoed not,ngingakutshela ihlaya ngesicathulo sami kodwa ngicabanga ukuthi angizange ngishaye
1466,what crew a ship a skeleton crew,yini abayi-clits apsits asset cret
1467,i dont get it pedro is how is that tiny seriously am i missing a joke,angikutholi i-pedro ukuthi ukuthi kuncane kangakanani lokho kuncane kakhulu ngilahlekelwe ihlaya
1468,now that the world is seeing just how much of a criminal creep cognitively joke joe is please remember that he was the cornerstone of both trump trump was for trying to save the world from the nightmare we re currently living in,manje njengoba umhlaba ubona ukuthi ingakanani i-cleopp enobugebengu ijoe joe sicela ukhumbule ukuthi wayeyitshe legumbi lazo zombili izici ze-trump lalizama ukusindisa umhlaba kusukela manje esihlala kuyo
1469,_ a joke furthermore who works for free not me,_ukuhlanyeka kwehlaya okusebenzela mahhala hhayi kimi
1470,you said was how s that a joke you just sound rattled now,uthe yindlela amahlaya owavele azwakala kuwo manje
1471,the audacity to tell us that it is just all a joke well no one is laughing,ukuhlekisa ukusitshela ukuthi konke kuyihlaya kahle akukho muntu ohlekisayo
1472,cool down first summer is no joke this year,i-cool down okokuqala ihlobo alilona ihlaya kulo nyaka
1473,this all become a joke against retail,konke lokhu kuba ihlaya ngokumelene nokuthengisa
1474,luckily for trump his corrupt garland is garland is either on trump is secret payroll or he is the in captivity either way and joke of a,ngenhlanhla ye-trump yakhe i-garland yakhe eyonakele yi-garland kungenzeka ukuthi ku-trump kuyimfihlo payroll noma ukudingiswa kungaba yindlela kanye nehlaya le
1475,_spicer a f'in joke if no one and or,_spicer i-f'in ihlaya uma kungekho muntu futhi noma
1476,_db yes as a joke with during a party in their house,_db yebo njengehlaya elingenasikhathi sephathi endlini yabo
1477,i was mike s were open because he he t love eleven he thought love was the next step to a relationship so he tried to force himself to their relationship was just kissing or taken as a joke in s he her in the same way he all his,"ngangivulwa ama-mike, ngoba yena athanda uevinge, wacabanga ukuthi uthando luyisinyathelo esilandelayo ebudlelwaneni ngakho-ke wazama ukuphoqa ubuhlobo babo bewuqabulana naye ngendlela efanayo naye ngendlela efanayo naye ngendlela efanayo naye ngendlela efanayo nayo yonke yena"
1478,oh there is more than one good joke here but i will give you a little up so octopus style will be a whole new street slang up,ah kunamahlaya amaningi amnandi lapha kodwa ngizokunikeza kancane isitayela se-octopus esizoba ngumgwaqo omusha
1479,what a joke some of this are older than you o think is a port,yini ihlaya elinye lalamdala kunawe licabanga ukuthi iyimbobo
1480,we enjoy being told is maybe a tired joke but it does reflect the irredeemably woke barely conscious low information progressive voter who from their cult leader are superficial in every way and hypocritical at best language over time too,siyakujabulela ukutshelwa ukuthi mhlawumbe ihlaya elikhathele kepha libonisa ukuthi i-irleleme ngokuqondile ivoti eliphakeme eliqhubekayo eliqhamuka kulo mholi wazo lezenkolo lingejwayelekile ngazo zonke izindlela futhi ngokuzenzisa ngezikhathi ezithile
1481,no joke the trailer is one of the best i seen the game good on next gen,alikho ihlaya i-trailer ingenye yezinto ezinhle kakhulu engiyibonile kahle umdlalo olandelayo
1482,_twitr those are a joke,_twitr lezo zihlaya
1483,if this joke is too subtle for you ask a grownup to explain it to you they are the tall,uma lokhu kuhlaya kucace bha kuwe buza ukuthi i-growgap ikuchaze kuwe
1484,a year old would think old but you do not hear me talking how awful their must be of the time joke on or it is because that adult is acting childish or being creepy normal have no reason to get defensive or call it,unonyaka ubudala ubecabanga ubudala kepha awungizwa ngingezwa ngikhuluma ukuthi imibi kangakanani yesikhathi kufanele ibe yinto ehlekisa ngayo noma kungeyona into evamile ingenasizathu sokuzivikela noma ukuyibiza
1485,i have a joke star fox is a good person probably one of my,ngine-joke inkanyezi fox ngumuntu omuhle mhlawumbe omunye wami
1486,my life is a joke but i am not laughing,impilo yami ihlaya kodwa angihleki
1487,i enjoy more than because you can enjoy the fans' misery and they are in on the joke whereas have like a tiny dog syndrome about their misery and try to fight you if you ever mention it,ngikujabulela okungaphezu kwalokho ngoba ungathokozela usizi lwabalandeli futhi sebesehlathini kanti bafana ne-tiny dog syndrome ngosizi lwabo futhi bazame ukukulwa uma ungakusho
1488,what a joke of a political system we have,kuthiwani ihlaya lesistimu yezepolitiki esinayo
1489,we were close to that i m glad was only for a couple of days no at home or work is no joke at that temperature,besisondele kulokho ngijabule kakhulu ngezinsuku ezimbalwa hhayi ekhaya noma umsebenzi akayona ihlaya kulolo lokushisa
1490,you should this people is crore log hain what a joke,kufanele ngabe laba bantu yileg log hain ukuthi ihlaya kanjani
1491,this is just a joke at this point,lokhu kumane kuyihlaya okwamanje
1492,is this a joke what kind of comic book take is this,ingabe leli ihlaya hlobo luni lwencwadi yencwadi yamahlaya lokhu
1493,what this a joke,yini lokhu ihlaya
1494,_rme not a chance your ahead of that s a joke all to the table would rather have ake,_rm akuyena ithuba lakho ngaphambi kwaleso ihlaya konke etafuleni kungaba ne-ake
1495,old old is fat and the casino is a joke,i-old old inamafutha futhi amakhasino ahlaya
1496,the never you d have been better off leaving it and making a joke,ongasoze wabe ungcono uhambe kangcono ukuyishiya futhi wenza ihlaya
1497,_headhoncho u look like a who can t take a joke but i mean i guess that is who u r,_headhooncho ubukeka njengobani ongathatha ihlaya kodwa ngiqonde ukuthi ngicabanga ukuthi ungobani u-r
1498,nice i consider myself a but i really love my in my current and first company we had and android it always was a running joke to 'insult' the other platform but never real hate,kuhle ngizibona ngingu-a kodwa ngiyithanda ngokweqiniso inkampani yami yamanje neyokuqala esaba nayo futhi i-android bekulokhu ihlaya eligijimayo 'lokuhlambalaza' enye ipulatifomu kodwa neze nenzondo yangempela
1499,these outside post everyday they do not joke with their love their confidence,lokhu kwangaphandle kwangaphandle kwansuku zonke abahlekisi ngothando lwabo ukuzethemba kwabo
1500,_offic joke,_offic joke
1501,_a_buzzi thank you for every single laugh for every single joke skit one liner for every tweet for the best facial for being there for us for so many and for being here now,_a_buzzi ngiyabonga ngakho konke ukuhleka okukodwa kwawo wonke amahlaya skit eyodwa ye-liner eyodwa ye-tweet yobuso obuhle kakhulu bokuthi bakhona kakhulu futhi ngokuba lapha manje
1502,and this got the ducking to be about this is a damn joke,futhi lokhu kwathola ukuthi i-ducking ibe mayelana nalokhu ihlaya le-damn
1503,sadly prince harry is now consider a joke in,ngokudabukisayo prince harry manje bhekisisa ihlaya ngaphakathi
1504,__ see this a joke you bout year by year basis been hurt how is he top,__ bona lokhu ihlaya ngonyaka ngonyaka ngonyaka kulinyazwe ukuthi uphezulu kangakanani
1505,this is a joke i can see debate at anything else is asinine,leli ihlaya engilibona le mpikiswano kunoma yini enye yi-asinine
1506,what is there to investigate it is the same story for me the bill is double what it was last year the truth is that your company is people you will blame inflation like it does not affect your than your monopoly joke,yini ekhona ukuphenya ukuthi yindaba efanayo kimi lo mthethosivivinywa uphindwe kabili lokho obekungunyaka wokugcina iqiniso ukuthi inkampani yakho ingathinti i-monpolyy yakho
1507,i wonder ka i hope am not a joke ey,ngiyazibuza ka ngithemba ukuthi angiyena amahlaya.
1508,oh such a long day too tired to eat source,oh usuku olude lukhathele kakhulu ukuba ludle umthombo
1509,what oh hell no that is a joke more like is a do nothing person for disappointed in pence a loser in my opinion president trump is america is best president ever,yini oh esihogo akukho ihlaya elinjengehlaya elifana nokwenza into engenzi lutho lokudumazeka nge-pence elahlekile ngomongameli wami utrump umengameli wami ongcono kunabo bonke?
1510,my profession is a joke,umsebenzi wami uyahlekisa
1511,she always been an actress what a joke,wayehlala engumlingisi ukuthi yini ihlaya
1512,is likely of the contribution to global greenhouse here he is the little some kind of historic victory is this a joke,kungenzeka umnikelo obulaweni lokugcina ukushisa komhlaba wonke lapha uluhlobo oluthile lokunqoba okungokomlando lokhu kuhlaya
1513,today is a space exploration day so here is a little space related joke let me know if you catch it and if you know which move it is from,namuhla usuku lokuhlola isikhala ngakho-ke nansi ihlaya elihambisanayo lesikhala lingazise uma niyibambe futhi uma wazi ukuthi yikuphi ukuhambisa okuvela kulo
1514,are a joke there s no due process no review of merit,kukhona ihlaya lapho ayikho inqubo efanelekile akukho ukubuyekezwa kokufanele
1515,_valiantpanda_ what about han in government whats the percentage is a joke,_valiantpanda_ kuthiwani nge-han kuhulumeni athini amaphesenti amahlaya
1516,everything is i was just making a joke we broke up i should prob delete that,konke ngabe ngenza nje ihlaya esahlukana nami kufanele ngisuse lokho
1517,more from tell me another joke by he said why is life like a glass of tea i do not know tell me why is life like a glass of tea how should i know am i a philosopher,okuningi okuvela kimi okunye ihlaya ngathi kungani impilo injengengilazi yetiye angazi ukuthi ngiyitshele ukuthi kungani ifilosofi
1518,the music in that game like it was made as a joke to be as unfitting for a fighting game as possible,umculo kulowo mdlalo onjengawo wenziwe njengehlaya ukuba angafaneleki ngomdlalo wokulwa ngangokunokwenzeka
1519,no in could be a joke,cha ngaphakathi kungaba ihlaya
1520,goat joke,goat joke
1521,the united the state where a gun more than a woman end of the joke son of the bitch passe,i-united the state lapho isibhamu esingaphezu kowesifazane kuphela sendodana ye-bitch passe
