,src,trg
974,'no reasonable person' would believe her were via here people this joke of a lawyer who is now being say any reasonable person would never believe what she to be true except did believe,'akekho umuntu ocabangelayo' ozomkholwa ukuthi akhona lapha abantu abahlekisayo wommeli manje abathi noma yimuphi umuntu ofanelekayo akakaze akholelwe ukuthi angaliqiniso yini
975,a horrendously joke,ihlaya elibi kakhulu
976,normal people do not get unless your lazy skill less worker probably more a reflection of you than the rest of us for being an elite athlete is a joke,abantu abajwayelekile abatholi ngaphandle kokuthi i-lazy yakho yekhono elincane kungenzeka ukuthi isibonisi sakho sibonisa ukwedlula konke ukuba ngumsubathi o-elite
977,ah joke or what,ah ihlaya noma yini
978,i m so speechless with this is there another meaning or some kind of joke not a native,ngingenakukwazi ukukhuluma nalokhu kukhona enye incazelo noma uhlobo oluthile lwamahlaya hhayi owokuzalwa
979,i think it is a joke man,ngicabanga ukuthi kuyindoda ehlaya
980,__hodl__ do you think this is a joke is no laughing matter the is the future now shut up or else the beast inside me will come out,__hodl__ ucabanga ukuthi lokhu kuyinto amahlaya akuyona into ehlekisayo ukuthi yisikhathi esizayo manje vala noma kungenjalo isilo ngaphakathi kimi sizophuma
981,this is a joke nobody is interested in the gray man,leli ihlaya akekho onentshisekelo endodeni empunga
982,you joke but i literally left after realizing how nice it was living in a society where were i know i m not the only one that came to those either,uyahlaya kodwa ngakwesokunxele ngokoqobo ngemuva kokubona ukuthi bekukuhle kanjani ukuhlala emphakathini ukuthi ngangiyazi kanjani ukuthi angiphilile yini kulezo
983,remember when he made a totally inappropriate and childish joke about bulimia because he was too thick to how insulting that was to people who suffer from the condition oh wait that was you,khumbula ngenkathi enza ihlaya elingafanele ngokuphelele futhi enze ngobuntwana nge-bulimia ngoba wayekhulu kakhulu ukuthi athuke kanjani lokho kubantu abahlushwa nguwe
984,lord i don t want any it was a joke funny,nkosi angifuni noma yikuphi kwakumnandi ukuhlekisa
985,me of my favorite knock knock joke knock knock who is there interrupting you said you would never forget,mina engqondweni yami engiyithandayo engqongqoza engqongqozle
986,allan saint at don t joke with that one,u-allan saint ku-don t helke nalowo
987,no is this a joke,cha yilehlaya
988,_toys are you going to preview any loot crate loot in these this is a joke because you can not preview what does not exist parody,_toys uzobukela kuqala noma yisiphi isingeniso se-loot crate loot kulawa lokhu kuyihlaya ngoba awukwazi ukubuka kuqala lokho okungekho ku-parody
989,revenue b revenue b or x the minor league baseball wage k minor league wage k both as this is a joke,i-revenue b revenue b noma x i-baseball encane ye-baseball ye-baseball yeligi encane
990,there is a joke in there somewhere about a parachute,kukhona ihlaya lapho endaweni ethile mayelana neparachute
991,magi did you not see me saying it was a joke i it properly afterwards,umagi awungibonangami wathi bekuyihlaya mina kahle ngemuva kwalokho
992,i always knew i was a joke,ngangihlala ngazi ukuthi ngiyihlaya
993,he actually is the setup was not fake joke still,empeleni ukusetha kwakungeyona into ehlehlisiwe namanje
994,maybe people are starting to catch on that this joke is the out,mhlawumbe abantu baqala ukubamba ukuthi leli hlaya liphuma
995,ha ha bad joke funny,ha ha had sax funny
996,joe would be a hell of a comedian because everything he is a joke,ujoe uzoba yisihogo somhlaseli ngoba konke akulukhuni
997,_nono just a sick joke i am going to hell,_nono nje ihlaya eligulayo engiya esihogweni
998,always me wrong when have joke in this side of the community of gross had joke so it just,njalo ngento engalungile lapho uneyehla ngakulesi sifo somphakathi we-gross wayenehlaya ngakho-ke
999,our life is to be a joke,impilo yethu ukuba ihlaya
1000,my always be in hiatus for more joke,i-my ihlala i-hiatus nge-movie more
1001,it is a joke man just to press a neck,kuyindoda ihlaya ukucindezela intamo
1002,i joke about fictional and all but is like an ugly little creature its head,ngiyahlekisa ngenganekwane futhi konke kodwa kufana nesidalwa esincane esibi ikhanda salo
1003,hasta la vista baby his time in office as a joke and an opportunity to level down the his only true sentiment is the contempt he shown parliament,hasta la vista baby isikhathi sakhe ehhovisi njengehlaya nethuba lokunciphisa umoya wakhe kuphela wangempela ukwedelela
1004,why are those last two on there what a joke,kungani lezo ezimbili zokugcina zikhona?
1005,madden a joke,madden ihlaya
1006,i think it is all about how why the joke is and how the audience it so i will leave that up to my fam to debate,ngicabanga ukuthi imayelana nokuthi kungani ihlaya ukuthi kungani ihlaya ukuthi ngakho-ke ngizoshiya lezo zingxoxisana
1007,it is a joke grow a spine,kuyinto ihlaya likhula umgogodla
1008,this is a joke just look up the founder of and why he left that organization,leli ihlaya libheka umsunguli wokuthi kungani ashiye leyo nhlangano
1009,this is a joke right this dude got to be a joke,lokhu kuyihlaya ngqo le dude kufanele ibe ihlaya
1010,you mean the big talker what an absolute joke,usho isikhulumi esikhulu lokho ihlaya eliphelele
1011,joke on the picture was just looking through old and found one that was just incredibly based style wise like obviously some polish but otherwise its super nice to look at a sample d,ihlaya esithombeni bebelokhu libheka nje ubudala futhi lithola eyodwa nje elisesitayelweni esisezingeni elifanelekile ngokusobala elinye isipolish kodwa uma kungenjalo lihle kakhulu ukubheka isampula d
1012,as will just be another what an absolute joke,njengoba kuzoba ngomunye amahlaya aphelele
1013,_ish _as_fork this is a really good joke i t yet well actually,_ishi _as_ffff lokhu kuyihlaya elihle impela enginga kahle
1014,sorry i have seen those actually real talk it is crazy the console are back from the  is i also made a similar joke got stray and got,uxolo ngibone lezo zinkulumo zangempela ziyi-crazy i-console ibuyele emuva e-us i senze futhi ihlaya elifanayo liyaduka lathola
1015,it was a joke obviously,kwakuyinhlaka ngokusobala
1016,obviously this is a joke but i guess this is what ea see,ngokusobala leli yihlaya kodwa ngicabanga ukuthi yilokhu ebona
1017,this was an obvious joke like your in denial,lokhu kwakuyihlaya elisobala elifana nokuphika kwakho
1018,its just a side joke also character development cast dynamics in all of these,amahlaya aso nje esihlangothini abuye athuthukiswe ukuthuthukiswa komlingiswa kuzo zonke lezi
1019,include about niche joke 'breakaway states' such as the conch republic,faka phakathi i-niche joke 'izifundazwe ze-brokeway' ezinjenge-conch republic
1020,anything will help towards anything inflation is no joke i m not going to sit here and lie and give a sob story times are tough,noma yini izosiza ekulweni nanoma yikuphi ukwehla kwamandla emali akuyona ihlaya engingeke ngihlale lapha futhi ngiqambe amanga futhi nginikeze izikhathi zendaba ze-sob zinzima
1021,but i persist and keep making the joke because i think it is very funny and i am a stupid idiot and yet i have of the ship of so i assume everyone must know what i am talking about thanks for reading,kepha ngiphikelela futhi ngiqhubeke nokwenza ihlaya ngoba ngicabanga ukuthi kuyahlekisa kakhulu futhi ngiyisiwula se-idiot futhi ngibe nomkhumbi kajehova ngicabanga ukuthi wonke umuntu engikhuluma ngawo ngokubonga
1022,and then i keep making the same joke by telling people it is a real deck of situation and you would not believe the polite blank i have received,futhi-ke ngiqhubeka nokwenza ihlaya elifanayo ngokutshela abantu ukuthi liyisimo sangempela sesimo futhi ubungeke ukholelwe i-polite engenalutho engiyitholile
1023,this is why i can t stand both of them take a joke and smile for once,kungaleso sizathu-ke ngikwazi ukumela bobabili ngithatha ihlaya nokumamatheka kanye
1024,huh are they trying to say what what a joke,huh bazama ukusho ukuthi yini ihlaya
1025,fun joke but it is still wild to me how many people just get to have surgery while the rest of us do not like there is an entire subculture of people who can just access it it is like being alive on two at once,joke fun kodwa kusengami ukuthi bangaki abantu ukuthi bahlinzwe ngenkathi abanye bethu bengathandi ukuthi kunobuningi babantu abangakwazi ukukufinyelela kufana nokuphila kabili ngasikhathi sinye
1026,saying eating ham are militant when they know the maggot joke,ukusho ukudla kwe-ham kuyingozi lapho bazi i-maggot joke
1027,if not don t go there it s a bad i was trying to make a joke,uma kungenjalo ungahambi lapho kube kubi bengizama ukwenza ihlaya
1028,i was also making a small joke in light of the triumph of diversity narrative that s all,nami ngenza ihlaya elincane ngokukhanya kokunqoba kokulandisa kokulandisa kwalowo konke
1029,from the rented unknown show that is very foolish and are taking for a joke have you seen before there is a glory that them and they are not hungry so answer me what is the essence of this hungry native,kusuka kumbukiso ongaziwa ongaziwa owubuwula kakhulu futhi uthatha ihlaya ukuthi uke wabona ngaphambi kokuba kube nenkazimulo abayilambile futhi abalambile ngakho-ke bangiphendule ukuthi yimuphi umdabu walomdabu olambile
1030,_ not sorry i am blocking u obvious joke i would never do that or would i,_ hhayi ngiyaxolisa ngivimba ihlaya elisobala angisoze ngakwenza lokho noma ngabe
1031,sorry this is a joke i have a edit i never finished though,uxolo lokhu kuyihlaya nginokuhlela angikaze ngiqede
1032,for it would be how you cook it him understand what type of person you are like if you hum while cooking or if you are methodical and go by the recipe exactly or joke around and have fun in the kitchen it does help and food yummy food,ngoba kungaba indlela ompheke ngayo ukuthi uyaqonda ukuthi hlobo luni lomuntu othanda uma ulukhuni ngenkathi upheka noma ujabule ekhishini likusiza nokudla okudlayo kwe-yummy
1033,the problem was that you up in her with that lame unfunny joke acting like nothing,inkinga ukuthi wena uzenzele kuye ngaleso sikhathi amahlaya angavumi enza njengeze
1034,joke thing,into yamahlaya
1035,queue the making joke,qeda ukukwenza joke
1036,if you smoke this juice t no joke,uma ubhema le juice t akukho ihlaya
1037,as one who the and your joke garbage is not even remotely amusing,njengomuntu futhi udoti wakho wamahlaya awuhleki kangako
1038,i do not understand the joke help me,angiqondi ukuthi ihlaya lingisize
1039,what an absolute joke you are giving this up is just simply incredible greed no,uyini ihlaya eliphelele elikunikeza lokhu kumane nje kumane kuhaha okuhle akukho
1040,_mcgivern you want me to waste my time on a royalty imbecile i am sorry but after your joke of a i will save my time for with so enjoy your but not on my blocked,_mcgivern ufuna ngichithe isikhathi sami nge-embile yasebukhosini ngiyaxolisa kodwa ngemuva kokuthi ihlaya lakho le-a ngizosindisa isikhathi sami ukuze lijabulele lakho kodwa lingavinjelwe
1041,_bad it was a joke to see how the artist would react,_bad bekuhlaya ukubona ukuthi umculi uzosabela kanjani kanjani
1042,men are always wrong get it i just broke a number rule i just a joke you happy now good,amadoda ahlala engalungile ukuwathola ngivele ngaphula umthetho wenombolo ngimane nje ihlaya elijabulisa manje
1043,_ if it was that people as you and i know this will not be the story all hell would have been let loose you can joke with anything but not my religion crap they drop all the time,_ ukube bekungukuthi abantu njengawe futhi ngiyazi ukuthi lokhu ngeke kube yindaba sonke isihogo bekungaba ukudedelwa ungahlekisa nganoma yini kodwa hhayi inkolo yami
1044,at least be honest here that is not what she is laughing at she is laughing at the absurdity of a joke told by someone else about making your own gasoline at home i am no fan of hers but let is not twist out of context in a clip like this,okungenani bathembeke lapha ukuthi akuyona into ehleka ngakho ehleka ngobuwula behlaya elitshelwe omunye umuntu ngomunye umuntu ngokwenza owakhe uphethiloli kodwa ake asontekile ngaphandle komongo esiqeshini thanda lokhu
1045,i used to joke about this but it s actually true now,bengijwayele ukuhlekisa ngalokhu kodwa empeleni kuyiqiniso manje
1046,i made one joke during a lull in dialogue in angel and you me for like,ngenze ihlaya elilodwa ngesikhathi senkulumo engxoxweni engelosini nami kimi
1047,dear far you just made a hero out of by so viciously against him the joke is on you,sawubona ude uvele wenza iqhawe ngaphandle kwakhe ngonya ngakuye ihlaya likuwe
1048,can you stop please i disagree with you you will not change my opinion of the man so it s worthless trying i made a joke and you made it into this whole thing that i m not interested in,ungayeka ngicela angivumelani nawe ngeke ngiwushintshe umbono wami wendoda ngakho-ke ngizama ukungazi lutho ngenza ihlaya futhi ukwenze ukuba yikho konke ukuthi anginandaba nakho
1049,if would adopt instead of the useless will magically change family reunification is a joke and not fair to the,uma bekungathathwa esikhundleni sokungasebenzi ngokomlingo kuzoshintsha ukuhlangana komndeni kuhlaya futhi kungabi kahle ku
1050,this is my joke account i use it to blow off steam making fun of it is literally in the name,le yi-akhawunti yami yamahlaya engiyisebenzisela yona ukuze iqhume i-steam enze ubumnandi bayo buya egameni
1051,this very clearly was a joke if you t see it as one then that s just your opinion and this t meant for you,lokhu ngokusobala kwakuyihlaya uma uyibona njengeyodwa ngaleso sikhathi nje lokho kungumbono wakho futhi lokhu kusho wena
1052,you are are the one who keep his filled with hate hi twitter you start him in negativity from obviously fake and he is jobless next joke,nguwe ogcina egcwele ukugcwala kwakhe nge-hit hit twitter oyiqala ngayo ngokunganaki kusuka kusobala kusuka ku-fake futhi kuyinto ephelele ehlaya
1053,just on getting irredeemably worse is this a joke,ekutholeni okubi kakhulu yilehlaya
1054,the rule of law is being like a joke who you,umthetho womthetho ufana nehlaya ukuthi wena
1055,this is a joke there is a problem in the network and nothing is working it needs out,leli ihlaya kunenkinga kwinethiwekhi futhi akukho okusebenzayo okudingayo
1056,oh please joke mat maro,oh ngicela ihlaya mat maro
1057,as a comedian i hate joke as a tweeter i hate tweet,njengomuntu ohlekisayo ngiyabuzonda ihlaya njenge-tweeter ngiyazonda i-tweet
1058,glad i do not have so i never have to try to explain the context of this joke to them,ngijabule anginayo ngakho-ke angikaze ngizame ukuchaza umongo walesi sihlahle
1059,here we turned the whole state into one big joke and we are coming to your town,lapha saphenduka sonke isimo sibe yihlaya elilodwa elikhulu futhi siza edolobheni lakho
1060,that covid test t no joke my nose still burn,lezo zingezo zokuhlola i-cosh akukho kukhona ikhala lami liqhawe
1061,i knew i knew the joke as soon as i read why can not you hear a pterodactyl on the preview,bengazi ukuthi ngilazi ihlaya ngokushesha nje lapho ngifunda kungani ungakwazi ukuzwa i-pterodactyl ekubukeni kuqala
1062,you his joke sir i am afraid i am have to down arrow ur tweet,wena ihlaya lakhe mnumzane nginovalo lokuthi kuzofanele ngehlise umcibisholo we-ur tweet
1063,you were right my bad i found the just a joke i know it s fake,wakulungile okubi kwami ​​ngithole ihlaya nje engiyaziyo inkohliso
1064,that t truth it made literally no sense it was a joke man,lelo qiniso lenze kahle kwakuyindoda ehlaya
1065,they missing the joke so hard,balahlekelwe ihlaya kanzima kangaka
1066,no transfer market for this have to be a joke,ayikho imakethe yokudlulisa yalokhu kufanele ibe ihlaya
1067,making the movement look more like a joke for no reason other than ignorance,okwenza ukunyakaza kubukeke njengehlaya ngaphandle kwesizathu ngaphandle kokungazi
1068,this no joke is the best news i ever,lokhu akukho mahlaya izindaba ezinhle kunazo zonke engake ngake ngakhona
1069,i got a pile on from dunt for more or less the same joke halcyon days,ngithole inqwaba kusuka ku-dunt ukuthola izinsuku eziningi noma ngaphansi kwe-hasseal halcyon izinsuku
1070,in an unhealthy relationship talking about possibly being would make my ex insecure and i could not even joke about calling him gay although it was something people him based on his last name,ebudlelwaneni obungesihle obukhulu bekhuluma ngosizo kungenzeka ukuthi bebezokwenza ukungavikeleki kwami ​​futhi angikwazanga ngisho nokuhlekisa ngokumbiza ngotayela yize kwakuyinto eyayiyinto yangempela esekelwe egameni lakhe lokugcina
1071,in case i was not clear your are a joke they are vanilla and all you do is layout cherry picked and ignore any have fun nice thread on who also actively make a mockery of the fantasy community nice,uma kwenzeka ngingekungacaci ukuthi amahlaya akho abakwa-vanilla futhi konke okwenzayo kukhethwe i-cherry ye-cherry futhi unganaki noma iyiphi inhlekelele emphakathini omuhle kakhulu
1072,this be the most obvious joke post i seen in my entire life,lokhu kube yiposi elisobala kakhulu engilibonayo empilweni yami yonke
1073,_connect like a joke now,_connect njengehlaya manje
1074,i lost money in my in the spent my bonus in order to not eat subway everyday and have some semblance of a good diet it s a joke this dude can spout this nonsense and act like the wages are even remotely livable,ngilahlekelwe yimali kimi echithe ibhonasi yami ukuze ngidle ongaphansi kwansuku zonke futhi nginokufana kokudla okuhle okuwukudla okumnandi lokhu kungabonakali nale nkokhelo kungcono kakhulu
1075,it s me and you bet my life is a joke,kuzona nawe ukubheja impilo yami ihlaya
1076,that lady so trash for not the joke,lelo ntokazi kangangokuba hhayi ihlaya
1077,ne serious question lone joke,umbuzo onzima we-lone ihlaya
1078,_finale being normal is not watermelon tell me this joke,_finale ukuba okujwayelekile akuyona ikhabethe kimi angitshele lelihlaya
1079,i think i the joke well,ngicabanga ukuthi i joke kahle
1080,i hope all my have the best time today make sure to stay hydrated because the heat is no joke,ngiyethemba ukuthi konke kwami ​​kube nesikhathi esingcono kakhulu namuhla qiniseka ukuthi ukuhlala u-hydrate ngoba ukushisa akulona ihlaya
1081,_her_idiot it s a joke,_her_diot isehlaya
1082,you got fake because you want to kill wow such character you have you are a joke and you can lie to your little all you want but karma will find you and open their i m do the most important thing i can do and pray for our country,uthole inkohliso ngoba ufuna ukubulala i-wow aswion unawo uhlaya futhi ungaqamba amanga konke okusemandleni akho kodwa i-karma izokuthola futhi uvule izwe lethu lenzani futhi lithandazele izwe lethu
1083,i know the team works so hard i usually just joke about like the warrior stuff but i just hope they get to work on a better building game soon it is important to have one for balance,ngiyazi ukuthi iqembu lisebenza kanzima ngivame ukuhlekisa ngathi njengezinkulu zempi kodwa ngithemba ukuthi zizosebenza emsebenzini wokwakha ongcono maduze ukuze ube neyodwa yokuba nebhalansi
1084,this heat wave t no joke,le mvula yokushisa ayilona ihlaya
1085,last night was a joke,izolo ebusuku bekuyihlaya
1086,_pod _a_s_e _chain some joke man he absolutely no shame,_pod _a_s_e _chain abanye amahlaya ayihlazo ayinamahloni
1087,oh my god this joke was almost accurate,oh nkulunkulu wami lelihlaya lalicishe linembile
1088,i hate when other people be joke with my i tell them not to talk to talk y all yeah,ngiyazonda lapho abanye abantu behlekisa nge-mina ngibatshela ukuthi bangakhulumi ukukhuluma y konke yebo
1089,_ arjun actor wat a joke he is acting,_ arjun umlingisi wat amahlaya awenzayo
1090,can anyone explain the joke,ukhona umuntu ochaza ihlaya
1091,_tladi joke they don t have the type of equipment to trace that a waste of time,_tladi ihlaya abanalo uhlobo lwemishini ukulandelela lokho kuchitha isikhathi
1092,you joke but that to me,uyahlaya kodwa lokho kimi
1093,that was some joke a riddle no self belief this is what then i will take note of that time will tell i would like to think time,lokho kwakunguye ihlaya ngemfumbe akukho ukukholelwa kwalokhu yileso sikhathi engizokubona ngaleso sikhathi ngizotshela ukuthi ngingathanda ukucabanga isikhathi
1094,truly a sick joke how that,ngempela ihlaya eligulayo ukuthi kanjani
1095,_maizin oh thats the most funny and original joke ever,_maizin oh ah thats ahlekisa kakhulu futhi esokuqala amahlaya
1096,like seriously is a joke,njengokungathi sína ihlaya
1097,_ _ksm _makuachukwu _tosyn _osb you that everything the keep fooling yourselves and allow these ride over all of you u all think the of nig is a joke until they sponsor r t to wipe all of u now an sponsor is a candidate y all vote for him na,_ _kkm _makuchuchukwu _tosyn _osyn nina ukuthi konke okulokhu kuqhubeka nokukhohlisa nina nonke ngicabanga ukuthi i-nig yakho konke ukuzosula konke ukhetho y
1098,i have such an inappropriate joke for this,nginehlaya elingalungile kulokhu
1099,_kelly and led the j protest why were for ray the leader of the protest he is a fed j communist committee is a joke,_kelly futhi wahola umbhikisho we-j kungani ayengowaseray umholi wombhikisho ukuthi ikomidi lamakhomidi lasefed fed j liyihlaya
1100,report forced to stop carload of murder via,bika ukuphoqelelwa ukumisa ukulayisha kokubulala nge
1101,this a sick joke,lokhu ihlaya eligulayo
1102,_ they re both a national joke and embarrassment today these are self serving and do nothing for their they line their own is this really the best can do,_ baphinde bahlanjaye amahlaya kazwelonke namahloni namuhla lokhu kusebenza ngokwakho futhi angenzi lutho ngokwenza lutho babo abakuhle ngalo yilokhu okungcono kakhulu okungenza
1103,breaking truss now odds on to be next prime minister on why that is no joke,ukuqhekeka kwe-truss manje kuyadlula ukuba ngundunankulu olandelayo mayelana nokuthi kungani lokho kungekhohla
1104,always a joke yo,ngaso sonke isikhathi ihlaya yo
1105,full time is no joke,isikhathi esigcwele akulona ihlaya
1106,no joke my wife on the train to san this morning two speaking about me they said they i sold a movie i have not sold a movie but i m this good mojo to mean it s only a matter of time see you on,cha jose umkami esitimeleni ukuze afike esitimeleni namhlanje ekuseni abakhuluma ngami bathi ngithengise i-movie angikuthengi nge-movie kuphela lapho isikhathi esikubona khona
1107,my brother is just me now to report him she belief he to me she had to tell me to hold on that her other phone is ringing he might be the one trying to to her then end the call being an elder sister is no joke oh lord i have headache,umfowethu yimi nje manje ukumtshela yena ukuthi ngiyakukholwa kimi ukuthi kufanele angitshele ukuthi ngibambe ukuthi ngibambe ukuthi enye ifoni yakhe ikhala kuye ngaleso sikhathi ingudadewethu ongumdala akayona ihlaya oh akekho nginekhanda
1108,no joke dude and henry was hurt last year and not as effective where do they get these,akekho amahlaya udude nohenry balinyazwa ngonyaka owedlule futhi hhayi ngempumelelo lapho bethola khona lokhu
1109,are a joke party now,yiqembu lamahlaya manje
1110,two who always fight can not just joke yeah if the would be on good then no one would even bother and it really does not seem like they are i was already calm but thanks anyway,ababili abahlala balwa bangeke bakwazi nje ukuhlehla yebo uma ngabe bekuzoba kuhle khona-ke akekho noyedwa ongazihlupha futhi akubonakali sengathi ngabe ngithulile kodwa ngibonga noma kunjalo
1111,since the introduction of the on killing become a absolute joke any to make the penalty for being a massive bigger or is it be every run forever,njengoba ukwethulwa kokubulawa kokubulawa kwaba yihlaya ngokuphelele noma ngabe senze inhlawulo yokuba yinkulu enkulu noma iyogijima njalo
1112,_ i can t steal their whole joke just some of it,_ ngiyakwazi ukuntshontsha ihlaya labo lonke nje layo
1113,ser end this joke only like,isise ser ukuphela kwalesi sikhathi
1114,yea no no ride to the station just these congresswoman are a joke of our system,yebo cha ukugibela esiteshini nje lezi comelokazi ziyihlaya lohlelo lwethu
1115,_ joke eh but thank you for being my human diary and for being v supportive with whatever i do love you,_ joke eh kodwa ngiyabonga ngokuba idayari yami yabantu futhi ngisekela noma yini engikuthanda ngayo
1116,last guy to talk about election fraud even said your film was a joke,umfana wokugcina ukukhuluma ngenkohliso yokhetho ngisho nathi ifilimu yakho ibihlaya
1117,as much as we think our country is a joke,njengoba sicabanga ukuthi izwe lethu lihlaya
1118,the off season is a joke to you,isizini off yihlaya kuwe
1119,_b t in a joke side mission in one of the it ai not even canon these just,_b t ohlangothini ohlangothini oluhlaya olulodwa lwe-it ai hhayi ngisho nakancane
1120,_dingus that joke about is extremely sensitive to black who are counting on allies to help us preserve what of civil we got left it s not a joke to us is trying to legislate our vote out of existence but y all cracking,_engidinges ukuthi ihlaya ngakho lizwela kakhulu abamnyama ababale kuma-allies ukusisiza ukuthi silondoloze lokho okwenzeka kithina okuwukushiye ukuvota kwethu ngaphandle kokuba khona kodwa y konke ukuqhekeka
1121,you either got hacked and with a hacker or this is a sick joke right,uke wagqekeza futhi nge-hacker noma leli ihlaya eligulayo kwesokudla
1122,i am taking this as a compliment to my accurate drawing as opposed to a head joke,ngikuthatha lokhu njengokuncoma umdwebo wami onembile ngokungafani nohlaya lwamakhanda
