,src,trg
523,_violeta i hope i did not misunderstand this tweet but this honestly really to be said regardless if it was a joke or not,_violeta ngithemba ukuthi angikuqondi kahle le ndlela kodwa lokhu ngokweqiniso kushiwo ngempela noma ngabe kwakuyihlaya noma cha
524,aw c amon it was just a joke,aw c amon bekuyihlaya nje
525,she put me on some type of medication to help with the pain cause baby when i tell them no joke,ungifaka ohlotsheni oluthile lomuthi ukusiza ngobuhlungu kubangela ingane lapho ngibatshela ukuthi bangabi namahlaya
526,do you honestly think would be with you that joke really,ngabe ucabanga ngokweqiniso ukuthi uzoba nawe amahlaya ngempela
527,some are so annoying she t the only one who s been through pain strange too and i don t think it s something to joke about in my opinion,abanye bacasule kakhulu ukuthi nguyena kuphela oye wabhekana nobuhlungu futhi futhi angicabangi okuthile ukuhlekisa ngombono wami
528,college station police t no joke,isiteshi selikolishi amaphoyisa akulona ihlaya
529,humor why do wear pants too why loose sink probably not a new joke but came to me while i was thinking about my fair garb and felt it was my duty to share,amahlaya kungani kufanele ugqoke amabhulukwe nawo kungani isinki esikhulu cishe akusilo ihlaya elisha kodwa sengize kimi ngenkathi ngicabanga ngengubo yami efanelekile futhi ngibona ukuthi bekungumsebenzi wami
530,_cube _playz yes i made it clear that i was the joke in the initial tweet,_cube _playz yebo ngikwenze kwacaca ukuthi bengiyihlaya ku-tweet yokuqala
531,being an embarrassment to is still better than being joke of a country,ukuba yihlazo ukuthi kungcono kunokuthi ihlaya lezwe
532,joke is on them that plate is already missing from all i d steal the toilet paper holder the retractable piece,ihlaya likubo ukuthi ipuleti isivele ilahlekile kubo bonke ngintshontshele umnikazi wephephatho lomthoho lwendlu yangasese
533,turning everything into a joke to make myself giggle,ukuguqula konke kube yihlaya ukuzenza ngigigithelwe
534,_rave_cat_ would joke or joke ur choice,_rave_cat_ungamahlaya noma ihlaya ur ukukhetha
535,_karam are you saying people for trump because made a joke because if so,_karam usho abantu nge-trump ngoba wenza ihlaya ngoba uma kunjalo
536,_spicer the joke is in the mirror take a look and have a laugh,_spicer ihlaya lisesibukweni libheke futhi lihleke
537,turning into a joke this gone off fir bad light twice and now spitting rain cricket well done,ukuguqula ihlaya lokhu kusuke kukhanya okubi kabili futhi manje kwenziwa ikhilikithi yemvula kahle
538,_mildr d is am sex a joke to you,_mildr d yizocansi ihlaya kuwe
539,y all joke too much on here,y wonke amahlaya kakhulu lapha
540,you re the joke,uyihlaya
541,i see a lot of huge with tiny short i know the joke about but honestly i think it is better to have the hand too big than too tiny,ngibona okukhulu kakhulu nge-tiny emfishane engiyaziyo ihlaya ngakho kodwa ngokweqiniso ngicabanga ukuthi kungcono ukuba nesandla esikhulu kakhulu kunokuba mncane kakhulu kunokuba mncane kakhulu kunokuba mncane kakhulu kunokuba mncane kakhulu kunokuba mncane kakhulu kunokuba mncane kakhulu kunokuba mncane kakhulu kunokuba mncane kakhulu kunokuba mncane kakhulu kunokuba mncane kakhulu kunokuba mncane kakhulu kunokuba mncane kakhulu kunobuncane kakhulu kunobuncane kunalokho okuncane
542,twitter t know what a joke is i think,i-twitter t yazi ukuthi yiliphi ihlaya ngicabanga
543,i am waiting since the morning the delivery boy did not contact me even a single time order was not as he unable to me what a joke neither contact no of delivery executive worst service _delhivery,ngilinde kusukela ekuseni umfana wokulethwa akazange angithinte ngisho ne-oda elilodwa bekungekhona ukuthi angakwazi kimi ukuthi yiliphi ihlaya alinalo lokulethwa kwezidingo eziphezulu kakhulu
544,__ imagine making a joke out of people getting cancer you re actually,__ cabanga wenza ihlaya ngaphandle kwabantu abanomdlavuza wena empeleni
545,how is it not that is being straight with the person u are dealing with i would not want to have think u a joke so why would i want to do that my friend,kungenzeka kanjani ukuthi lokho kuqondile nomuntu obhekene nakho ngangingeke ngifune ukukucabanga amahlaya ngakho kungani bengingafuna ukwenza lowo mngane wami
546,another joke successful,elinye ihlaya liphumelele
547,i hate serious people like why don t you know how to take a joke,ngiyakuzonda abantu abangathi sína njengokuthi kungani ungazi ukuthi ungawathatha kanjani ihlaya
548,i used to have of company now few people know i have a spot much less where they are for all intensive inside joke and no one can say let me just ride by her house oh that s one of her,bengihlala nginenkampani manje bambalwa abantu abaziyo ukuthi nginendawo encane kakhulu lapho bekhona kubo bonke amahlaya angaphezulu futhi akekho ongasho ukuthi mangidedele ngendlu yakhe
549,this is not a joke this is sexual harassment,lokhu akulona ihlaya lokhu kuhlukumeza ngokocansi
550,when will there be someone running this country who is in touch with real people with real who real life why it is always the rich who never truly understand the average person is its a joke it will just be more failure for the,ngabe kuzoba nini umuntu osebenzisa leli lizwe elixhumana nabantu bangempela abanolwazi lwangempela oluphila impilo yangempela kungani kuhlale kungubuhlakani ongeke uqonde ngokweqiniso umuntu ojwayelekile uzoba ukwehluleka okwengeziwe?
551,i see people finding this this is not a joke this is an insult to the church the body of if it were people mock i am sure of a certain people will be burning now not forgetting the innocent that will roll,ngibona abantu abakuthola lokhu akulona ihlaya lokhu kuyinhlamba esontweni umzimba wokuthi uma ngabe abantu bayakuhlekisa manje abangakhohlwanga abangenacala
552,this is a joke tweet its an ad for a match,leli ihlaya lithuke isikhangiso salo somdlalo
553,is a joke thanks for the credit like,kungukubonga amahlaya ngesikweletu esinjengesikweletu
554,it s obvious who it will be it s all a farce the man who agreed and is now the man take over what a joke,kuyabonakala ukuthi kuzoba yikho konke okungukude komuntu owavuma futhi manje umuntu athatha amahlaya
555,take joke as a joke,thatha ihlaya njengehlaya
556,i love how the great take understander in the screen spent an entire week losing their gourd they either forgot or did not understand this joke in relation to the drivel you were on,ngiyakuthanda ukuthi ukucabangisisa kakhulu esikrinini esichithe isonto lonke elaphelelwa yinkohliso kubo bonke bakhohliwe noma bengakuqondi leli hlaya maqondana ne-drivel owawunawo
557,epic youtuber is return no joke tho the last few man,i-epic youtuber ayibuyiselwe amahlaya tho ambalwa ambalwa
558,true the joke was i don t think that the way the are blowing is earthly possible,iqiniso ihlaya ukuthi angicabangi ukuthi indlela abashaywa ngayo abasemhlabeni kungenzeka
559,baby even can not describe how much i love you we bicker and joke like best but at the end of the day we will sleep in each other is arms i love the way you talk the way you call me i love the way you love me oh i wonder how many times i have told you this,ingane ayikwazi ukuchaza ukuthi ngikuthanda kangakanani thina u-bicker futhi ihlaya njengasekupheleni kosuku esizolala komunye nomunye ziyindlela ongithanda ngayo ngiyayithanda indlela ongithandayo ngiyazibuza ukuthi ngikutshele kangaki lokhu
560,its a joke they are a,amahlaya alo bayi
561,did i say he was a genius no so do not put in my mouth genius his as well as were better than the current joke of an administration or democratic party in general but please tell us how quality of life under,"ngabe ngithi wayengumuntu onobuhlakani, ungabeki emlonyeni wami wobuntu ubuhlakani bakhe futhi ubengcono kunehlaya lamanje lokuphatha noma iphathi yentando yeningi elonke kodwa ngicela usitshele ukuthi ikhwalithi yempilo ngaphansi"
562,seeing as brain freeze is not actually associated with the brain your stupid joke flat again try harder,ukubona njengoba ubuchopho beqhwa empeleni bungahlotshaniswa nobuchopho bakhohlaya wakho oyisiphukuphuku futhi zama kanzima
563,ah i thought i was able to review anything must have posted something crazy want to see it,ah bengicabanga ukuthi ngikwazi ukubukeza noma yini kumele ngabe ngithumele okuthile okuhlanya ukukubona
564,and from the unreliable narrator like yuan and nice joke,futhi kusukela kumlandi ongemthetho onjenge-yuan kanye ne-musight joke
565,that s your best joke to date,lelo ihlaya lakho elihle kakhulu kuze kube manje
566,no joke i seriously after the trailer want to do a sit down pinhead on pinhead interview with the legendary and the beautiful the hard please make this happen,alikho ihlaya engingabucayi ngemuva kwe-trailer ngifuna ukwenza i-pinhead phansi ephikisana ne-pinhead engxoxweni nenganekwane futhi enhle kakhulu ngicela wenze lokhu kwenzeke
567,_robert don t get me wrong it does worry me that we will be if we come straight back down it s the same old though t it villa mill for in a couple of good and it s mill which is a joke for a guy whose never fit it s basically a totally new squad,_robert don t f m othola ngenzelekile ukuze sikuthande ukuze sizobuyela ngesikhathi sokuqhawula kakhulu ngesikhathi sokugcina kakhulu kakhulu ngokuyisisekelo iqembu elisha ngokuphelele
568,me glad it was a joke keep doing what you love and stay away from political commentary it your,ngijabule ukuthi bekuhlaya ukuthi kuqhubeke ukwenza lokho okuthandayo nokungahlali ngokuphawula kwezepolitiki
569,yeah baby eat that i bet you can not provide this level of freedom in your state that is why i will move to forever this playboy is the new joke,yebo baby badla ukuthi ngibheja awukwazi ukunikeza leli zinga lenkululeko embusweni wakho yingakho ngithuthela kuze kube phakade le playboy
570,_angela its a joke about how you pronounce which is in fact hilarious what does a hen do but in a kiwi accent it like this,_angela yayo ihlaya ngokuthi ulibiza kanjani ngokuthi yiphi elithi hilarious wenzani inhlekelele kodwa ekiwi acterve evelela kanjena
571,_ _official no joke i hope they lean into the story as the continue so many top and baby and you can have pretty much doing whatever he because he will always have someone backing him up i would love to see a booker gimmick for him after he it from,_ _afficial no joke ngithemba ukuthi bancike endabeni njengoba iqhubeka kakhulu phezulu nengane futhi ungaba nokwenza noma yini umuntu abe ngumbhubhise ukuba ambone umbhubi usimmick yena ukusuka
572,_efootball can not wait for and so i can ditch your game forever you are a joke and you know it pes and thanks for the great but you are clearly dead now rip,_efootbal cons akufanele ukulunga kanye futha umdlalo wakho kuze kube phakade wena uhlaya futhi uyazi ukuthi uyabonga kakhulu kodwa ufile manje
573,a man who your of withdrawing and does not let you push them away what is this surely the universe is a joke on me,indoda eyayizohoxa futhi ayikuvumeli ukuba ubacindezele ukuthi yini indawo yonke yinhle kimi
574,this club is a joke,le kilabhu ihlaya
575,dude it is a joke,dude kungamahlaya
576,unreal from obvious sarcasm to a viral story of an obvious joke this country is literally going to and people lack the basic wherewithal to investigate further,okungafuneki kokubhuqa okusobala kuya endabeni yegciwane lehlaya elisobala leli lizwe liya ezweni futhi abantu abanalo okuyisisekelo ukuphenya ngokuqhubekayo
577,before you ask it was for a truss cheese joke,ngaphambi kokuthi ubuze ukuthi kwakungenxa ye-truss cheese joke
578,i don t know if he everything like a joke to him,angazi ukuthi ngabe konke kufana nehlaya kuye
579,i know we do this thing in college sports where we joke about how it like a player been around forever but i just might be tech is starting this season and it felt jarring,ngiyazi ukuthi senza le nto emidlalweni yasekolishi lapho sihlekisa ngayo ngokuthi umdlali ubelokhu ezungeze kuze kube phakade kodwa ngingaba ubuchwepheshe nje ngiqala kule sizini futhi ngazizwa ngise-jarring
580,i apologize for this joke,ngiyaxolisa ngalelihlaya
581,ai not this a joke,ayi hhayi lelihlaya
582,_mason _e what a joke they never anyone on our billion lend lease they stole every country they went through and they are world famous and,_masen _ yisiphi ihlaya abangasoze babona noma ngubani ekuqasheni kwethu kwezigidi eziyinkulungwane bantshontsha kuwo wonke amazwe adlule kuwo futhi adume umhlaba wonke futhi
583,u are the joke,uyihlaya
584,every time i hear a joke about being catholic i am like that is just the most white catholic of the entire cast,njalo lapho ngizwa ihlaya ngokuba ngumkatolika nginjengawona nje lowo mkatolika omhlophe kakhulu wakhona
585,for right she no business in a main draw event of a event sorry maybe for but singles this to be a joke,ngokwesokudla akanalo ibhizinisi emcimbini wokudweba ophambili womcimbi uxolo mhlawumbe kodwa ungculi ukuthi lokhu kube yihlaya
586,the new site is horrible where are my bought a t off last week order as no stock yet it is on the new site in my size but more expensive this is a joke compete own goal by,isayithi elisha liyesabeka lapho kuthengwe khona ukuthi angithengile ngeviki lesonto eledlule
587,the barman is this some kind of joke,i-barman yile hlobo oluthile lwamahlaya
588,_jordan representative jordan is a joke,ummeleli we-_jordan ijordani ijordani ihlaya
589,joke is on i do not read,ihlaya liku-cha angifundi
590,me making a tweet for anniversary but still too insecure to push my day tweet out of insert joke here about queerness as an inherent trait of,mina ngenza i-tweet yokugubha usuku lonke kodwa ngisengavikelekile kakhulu ukusunduza usuku lwami luphume ngaphandle kokufaka ihlaya lapha mayelana ne-queeness njengesici esingokwemvelo se
591,teba is league at its always known for being a selling club very well handled by always to make revenue during summer is yet must get rid of their best defender to be able to sign new a joke,i-teba yiligi yayo eyaziwayo njalo ngokuba yi-seday club ephathwe kahle ngokwenza imali phakathi nehlobo kusamele ukuqeda umvikeli wawo omuhle kakhulu ukuze akwazi ukusayina ihlaya elisha
592,us no left to bail water to keep the low oil boat from sinking _f i still expect by the have no reason to listen to and on the ropes a joke once the understand this the trigger for to see sub,asikaze siyenzile ngamanzi ebheyili ukugcina isikebhe esiphansi kawoyela singashongo _f ngisalindele ngaphandle kwesizathu sokulalela futhi ngiqonda lokhu kubangela
593,the old joke 'when told to jump she would ask how high ' miss i am ready to hit the ground me from what altitude,ihlaya elidala 'lapho litshelwa ukuthi ligxume ukuthi uzobuza ukuthi liphakeme kangakanani' miss i sengikulungele ukushaya indawo kimi kusuka ekuphakameni kwalo
594,_florin this is a joke,_florin lokhu kuyihlaya
595,they take us for a joke what break is this i have and i m supposed to juggle all this,basiyisa ihlaya lokho okwekhefu lokhu enginakho futhi ngicabanga ukuthi ngijabule konke lokhu
596,it is very unfortunate that they think this is a joke this is not funny at all they seriously telling us that there is nothing we can do about it showing us that they don t care how some feel then i can say that i won t feel safe if this set of people to the villa,kuyishwa kakhulu ukuthi bacabanga ukuthi lokhu kuyihlaya lokhu akuhlekisi nhlobo ukuthi akukho esingakwenza ngakho ukusibonisa ukuthi abanye bazizwa kanjani lapho ngithola ukuthi ngizizwe ngiphephile uma lokhu kusethi yabantu kuya evilla
597,if get the joke it is just about the city living on nice people who do not and not if people from are nice kind,uma uthola ihlaya nje emayelana nedolobha elihlala kubantu abahle abangafuni futhi hhayi ukuthi abantu abavela emnandi
598,thank you for that a lot i t think you would i just to make a funny joke,ngiyabonga ngalokho engicabanga ukuthi ngabe ngabe ngingenza nje ukuthi ngenze ihlaya elihlekisayo
599,_real_travisty i would argue the espy s joke is even today because well you know made a request to play for another team again here s a live look at me when that news broke,_real_travisty bengingaphikisana ne-espy s joke yikhona namhlanje ngoba kahle wena uyazi ukuthi wenza isicelo sokudlala esinye iqembu futhi sibuke babuke lapho lezo zindaba ziphule lapho lezo zindaba ziphule khona lapho lezo zindaba zivele
600,i bet everyone to hear a joke about right,ngibheja wonke umuntu ukuzwa ihlaya ngakwesokudla
601,yesterday i didnt understand a joke my made even when he tried like three times and i have never felt worse at work,izolo angizange ngiqonde ihlaya elenziwe elenziwe ngaze ngazama kathathu futhi angikaze ngizizwe kabi emsebenzini
602,_dor it s just a joke people t be worried about liking a joke,_dor it s nje ihlaya abantu abakhathazekile ngokuthanda ihlaya
603,this is like clearly a joke right why is everyone taking this seriously,lokhu kufana ngokusobala ihlaya khona amalungelo okuthi kungani wonke umuntu ethatha lokhu ngokungathi sína
604,is a joke scam cringe,is a inhlekisa ihlaya
605,_capital _kc you re a joke,_capital _kc uphinda ihlaya
606,i know that do not kill the joke,ngiyazi ukuthi akubulali ihlaya
607,it s all a joke mate so chuckle besides you have no evidence they don t exist and i bet there s some wealthy shadowy person research on building them watch out mate,konke ukushaywa kwamahlaya ngakho-ke kuyacashunwa ngaphandle kokuthi awunabo ubufakazi bokuthi awunabo ubufakazi futhi ngibheja lapho abanye abacebile bomuntu ocwaningweni ngokwakhayo ekwakheni babukela umngane womshado
608,so is j lo j jeff now this is a joke do not come for me i love her,ngakho-ke uj lo j jeff manje leli yihlaya alifiki mina ngiyamthanda
609,so no wan chop and while interesting is your mandate a joke to you it is to us sha but y'all should take it seriously please,ngakho-ke akukho siqine se-wan futhi ngenkathi kuthakazelisa ukuthi kufanelekile amandla akho amahlaya kuwe kithi ukuthi yi-us sha kodwa y'all kufanele ayithathe ngokungathi sína
610,one of you is going to be the next please for the love of everyone in the world of culture media and sport get rid of,omunye kini uzoba olandelayo olandelayo ngothando lwawo wonke umuntu emhlabeni wezindaba zamasiko nemidlalo ukuqeda
611,i just love black culture,ngithanda isiko elimnyama nje
612,how culture can enable narcissism,isiko lingavumela kanjani i-narcissism
613,s renowned returned despite the  is and the pandemic meeting a live audience for the first time since in front o,i-s edumile ibuyiselwe yize futhi ubhubhane luhlangana nezithameli ezibukhoma okokuqala ngqa kusukela ngaphambili o
614,what about culture backed by your so government reply this with honesty and courage people are looking at,kuthiwani ngesiko elisekelwa ngakho ngakho-ke uhulumeni aphendule lokhu ngokwethembeka nesibindi abantu babheke
615,culture is literally racism in every aspect,isiko liwukucwasana ngokweqiniso kuzo zonke izici
616,_kernan i this is from the republic i can t be the only one who some of these seem to go way over the top with these is it a culture thing or are many of the from the doing it too i m genuinely curious,_kernan i lokhu kuvela eriphabhulikhi ngikwazi ukuphela kwenye yalezi ezibonakala ngaphezulu ngalezi zinto kuyinto eyinkomba noma eziningi ezivela ekwenzeni ngobuhlakani
617,i can no longer be an active participant in any culture or movement that outrage on demand fear and violence segregation history masked as accountability self of racism towards,ngeke ngisakwazi ukuba ngumhlanganyeli osebenzayo kunoma yisiphi isiko noma ukunyakaza okucasulayo ukwesaba kanye nomlando wokuhlukaniswa kobudlova kufihliwe njengokuziphendulela ngokobuhlanga kuye
618,in of culture the posting ever would have it in a civvy went to it rip off outer were a week in on the got fed up with yank in the hostel went to,isiko lokuthumela elake laliyolithola ngalo livela ku-civilvy eliye kulo liklebhula ngaphandle kwesonto kwakukhona isonto elibonwe ngehostela eliye kulo
619,cute list but if ben is death in season is not on it move along,uhlu oluhle kepha uma uben ukufa ngesizini awekho kuwo ahambahamba
620,not funny i just enjoy ancient in pop culture lots of are their on their own maybe callipygian a moment or maybe not,akuhlekisi ngijabulele nje kwasendulo kuma-pop amasiko amasiko amaningi ngokwawo mhlawumbe aclipygian umzuzwana noma mhlawumbe
621,needs to be militarily by a superior power and comprehensively have its old culture,idinga ukuba ngamanga ngamandla aphakeme futhi aphelele amasiko alo adala
622,no it s more than that lack of intellectual variety in fighting cancel culture much problem than in the s when the literally to set up a ministry of truth you know you problem i sense you are dismissive of the issue today,akunakuba ngaphezu kwalokho ukuntuleka kwezinhlobonhlobo zengqondo ekulweni khansela isiko inkinga enkulu kunasekuqaleni lapho ibeka inkonzo yeqiniso uyazi ukuthi uyakukhumbula
623,culture at its,isiko lakho
624,_weav cancel culture both does and does not exist actually horrible people can keep their but i saw someone get into vanishing from the because someone dug through their and found that they left a like on a when they were,_weaf khatsela isiko lokubili lenza futhi alikho ngempela abantu abesabekayo bangagcina labo kodwa ngibone othile engena embhedeni ngoba othile wemba ngawo futhi wathola ukuthi bashiye okunjalo
625,i literally just remember i am taking a rock music and culture class for college this semester literally they bring up master of oh i will be crying in corner,ngikhumbula ngokweqiniso ukuthi ngithatha ikilasi lomculo namasiko ekolishi le semester ngokoqobo baletha i-master of oh ngizobe ngikhala ekhoneni
626,in general would probably fare better if they into the libertarian side of the culture war and the evangelical one,ngokuvamile kungenzeka ukuthi uhambe kangcono uma besenhlalongeni lwempi yamasiko empi nase-evangelical one
627,_es _fr _rf is he a too like war criminal,_es _fr _rf uyicala lempi elifana nempi
628,this is a person of culture and sophistication,lo ngumuntu wesiko nobunzima
629,_pence what liberal have a policy of hate racial division and cancel culture in direct violation of our us constitution however none of these care about the constitution because all they care is power,_pence yini iliberal inenqubomgomo yokuhlukaniswa ngokobuhlanga kanye nesiko lokuphulwa ngokuqondile kokwephulwa okuqondile komthethosisekelo wethu wase-us nokho akukho lutho olukhathalelayo ngomthethosisekelo ngoba konke abakukhathalelayo kungamandla
630,same for you cause u been i cant fight since the beginning not taking your own advice huh thats not in culture maam,okufanayo ngawe kubangele ukuthi angikwazi ukulwa selokhu kwaqala ukungathathi eyakho izeluleko huh azenzeki kumasiko
631,quick thinking i sadly behind the a little in user error id t error never to anyone is face though at least not in a mean way geek culture influence i got less condescending a couple later,ukucabanga okusheshayo ngidabukisa ngemuva kwephutha elincane lephutha le-id yomsebenzisi ongasoze wabhekana nanoma ngubani ubuso noma okungenani hhayi ngendlela ye-geek culture ithonya lelo ngcucu ngokulandela umbhangqwana
632,why are they stealing red neck culture,kungani bentshontsha isiko elibomvu lentamo
633,a woman of culture,owesifazane wesiko
634,poop culture fell off,isiko le-poop lawela
635,fear i had the same experience and then the opposite it was scary even for me and i am a who does not give a fig what people think yet i was hurt to feel from same sex culture in the late s coming out x was tough,ungesatshwa ngaba nakho okufanayo futhi okuphambene nakho kwakwethusa ngisho nami futhi ngingubani onganikeli umdwebo wokuthi abantu bacabanga ukuthi amasiko afanayo asemuva afike sekwedlule isikhathi
636,can you belive your speed is in this g culture you are giving speed please take it seriously wise i am going to consumer court tomorrow to registered the case against you as per your behaviour,ungakwazi yini ukuthi ijubane lakho likulesi siko le-g onikeza isivinini sicela usithathe ngokuhlakanipha kakhulu ngiya enkantolo yini enkantolo ukuze ngibhalise icala ekuziphatheni kwakho ngokufanelekile
637,was it the obama is or the culture they are pushing,ngabe bekungu-obama noma isiko abacindezelayo
638,in and in many other we pay to so they don t need a tip are naturally to tip if they want to forced tipping is a weird and ancient culture from my point of view,kokunye futhi nakwabanye sikhokha ngakho-ke abadingi ukuthi badinga ithiphu ngokwemvelo baphuphu uma bafuna ukuphoqelelwa ukuthi baphoqeke isizinda esixakile futhi sakudala ngokubuka kwami
639,did ever really exist we all have a pretty specific image in mind when someone but did these thick browed cave dwelling early exist or is this just a caricature by popular culture today i found out digs into,wake waba khona ngempela sonke sinesithombe esihle engqondweni lapho umuntu othile kodwa ingabe lo mhume omkhulu omncane wakugcina ekuseni noma yile ndatshana nje ngesiko elidumile namuhla ngithole ukumba
640,in my opinion the reason why don t look up t work well as a satire is that our county culture is currently too absurd to satire,ngombono wami isizathu sokuthi kungani u-don t abheke phezulu usebenza kahle njenge-satire ukuthi isiko lethu lesifunda manje alinangqondo kakhulu ku-satire
641,when her drag is about y all does it up under the and not realizing it s st carnival on a whole but today is my county my culture my carnival please,lapho ukuhudula kwakhe kumayelana y konke kuyenza ngaphansi kwe-dow carnival kukonke kodwa namhlanje yisifunda sami isiko lami ngicela
