,src,trg
1530,_girl there are really two different here right i am in the ignore it and it is fine type but i imagine that the more militant crowd your suffering as a feature of society everyone who to control culture to make out of,_girl kunezimbili ngempela ezihlukile lapha ngelungelo engikulonanga futhi luhlobo oluhle kodwa ngicabanga ukuthi isixuku sempi esithe xaxa sibonisa amasiko okwenza ngaphandle
1531,a while back i went out national museum of history and culture,isikhashana ngibuyele emnyuziyamu kazwelonke womlando namasiko
1532,is not this 'cancel culture' as well though,akusona lesi siko 'lesisiko' futhi
1533,_d_doe they can ask as much as million if you are wealthy now the trick is most request for these and bank buy gold invest in case it does not work they have something to fall back to yes divorce is in all these culture and faith are,_d_doe bangabuza isigidi uma ucebile manje iqhinga yilona isicelo se-gold traveter uma kungasebenzi ukuthi banokuthile abangakubuyisela emuva kuyebo nokholo
1534,__aero one piece is constantly everywhere is almost the best selling comic series ever and is an entire culture in japan the story is probably the most grandiose scale story out there the are written with care and attention of in the future,__aero ucezu olulodwa luhlala lukhona yonke indawo lusondele kakhulu uchungechunge lwamahlaya oluthengiswayo futhi lukhona isiko lonke ejapan kungenzeka ukuthi linendaba enkulu kakhulu lapho kubhalwe ngokunethembana nokunakwa esikhathini esizayo esizayo
1535,an absolute class act no about cancel culture no attempt to make himself out to be the real victim just mature acceptance that sometimes intention t balance out impact and at the cost of some hard work not just a throwaway comment,umthetho wekilasi elihluke ngokuphelele cha khansela isiko akukho mzamo wokuzama ukuba abe yisisulu sangempela ukwamukelwa okuvuthiwe ukuthi kwesinye isikhathi ukulinganisela okulinganiselwe ngaphandle kwezindleko ezithile hhayi nje ukuphawula okunzima
1536,have you up for the book study the will be leading it on if you are interested in fostering an culture in your school join the discussion,ngabe ubhekane nencwadi ethi ucwaningo luzoluhola uma unesifiso sokukhuthaza isiko esikoleni sakho joyina ingxoxo
1537,a at my got upset took a handful of and his with a hammer for saying no to a party he then put their in the room shut the door and threw the party anyway some and i were but we did not go,a ekucasukile kwami ​​kwacasuka kwathatha idlanzana nesakhe ngesando sokuthi cha ephathini wabe esefaka umnyango wawuvala umnyango waliphonsa iphathi noma ngabe asihambanga
1538,darn tootin' be there and you should plan to go too lots of comic and pop culture fun,i-darn tootin 'yiba lapho futhi kufanele uhlele ukuhamba okuningi kwamahlaya namasiko we-pop
1539,if someone is productivity is brought down by a question not directed to them they need to work on their mentality and the area of focus either way these will be in either to determine somewheres culture fit and exposure or willingness to converse,uma umuntu ekhiqiza ukukhiqizwa ngumbuzo ongaqondiswanga kubo kudingeka basebenze ngokwengqondo kwawo kanye nendawo yokugxila noma ngabe lokhu kuzoba khona lapho lokhu kuzoba khona ukuze kunqunywe amasiko athile okulingana nokuvezwa noma ukuzimisela
1540,we have seen gone through so much at our end i keep telling do not go in without understanding the legal there is no need to sign anything plus there need to be stringent culture na,sikubonile ukudlula kakhulu ekugcineni kwethu ngilokhu ngitshela ukuthi angingeni ngaphandle kokuqonda umthetho esingokomthetho asikho isidingo sokusayina noma yini eqinile na
1541,_wild in culture it s an old taboo that if you play with starfish on the beach you make it rain maybe this from the,_ild in isiko kuyinto endala ukuthi uma udlala nge-starfish ogwini owenza kube yimvula mhlawumbe lokhu kusuka ku
1542,the entire gender identity proposition is a combination of not all men not all pen s born people and rape culture,isiphakamiso sonke sobulili yinhlanganisela hhayi bonke abantu hhayi bonke abantu abazalwa be-pen s kanye nesiko lokudlwengula
1543,_repair _bse _ let is educate all with one sentence to save us from automatic warming ask your to repeat until enough people volunteer to only buy what we can not live without that item that will cut by at least globally help for better wording,_repair _bse _ ake sifundise wonke ngomusho owodwa ukusisindisa kusuka ekushiseni okuzenzakalelayo buza ukuthi abantu bakho bakwazi ukuphindana kuphela ukuthi bakwazi ukuthola ukuthi okungenani banqume yini ukuthi yini igama elingcono
1544,as global it is their responsibility to be sensitive and be mature on they need to be as they cater not only their culture but people around the world i hope you understand that,njengomhlaba wonke kungumsebenzi wazo ukuze uzwele futhi avuthiwe kudingeka abe njengoba nje angenakona kuphela amasiko abo kodwa abantu emhlabeni jikelele ngithemba ukuthi uyakuqonda lokho
1545,gainer s book black representation in the world of animation the history of representation in and film how popular culture shape to various of black identity in everyday media,i-gateler s book i-black serementation emhlabeni we-animation umlando wokumelwa kanye namafilimu ukuthi ukwakheka kwesiko elidumile kangakanani kubunikazi obumnyama kwabezindaba zansuku zonke
1546,rape culture being by,isiko lokudlwengula likhona
1547,are incompatible with culture and we have the to prove it,ayihambelani nesiko futhi sinakho ukukufakazela
1548,actually was very involved w infrastructure bill worked closely w the who worked on it on the other hand is only interested in culture he to clean up algae problem when did nothing he is one of the worst in the country,empeleni bekubandakanyeka kakhulu engqalasizinda yongqalasizinda esebenza eduze w osebenze ngayo ngakolunye uhlangothi unesifiso sokuhlanza inkinga lapho kungenjalo kungenye yezinto ezimbi kakhulu ezweni
1549,that is the tired old nature culture problem,leyo inkinga ekhathele yemvelo yesiko
1550,a new paradigm for full time,i-paradigm entsha yesikhathi esigcwele
1551,decision of air with its state capital center put livelihood of nearly casual under financial crisis voice of local culture to be extinct soon _india,isinqumo somoya esine-state capital center sibeka indlela yokuphila ecishe ibe yingozi ngaphansi kwezwi lezinkinga zezezimali lesiko lendawo ukuze liphele maduze _imia
1552,_obi factor authentication to see if it was really thick i did it for the culture,ukuqinisekiswa kwe-_obi factor ukubona ukuthi ngabe kukhulu ngempela ngakwenza ngesiko
1553,experience a slice of culture when you open a box of pizza house see you on,uzwa ucezwana lwesiko lapho uvula ibhokisi le-pizza house likubona
1554,childish cancel culture retaliation you are very transparent in a bad way in everything you do the smirk on your face said it all it is a show you talk but don t walk the walk you are just like the rest of them,ukukhanselwa kwengane isiko ukuziphindisela unovalo olukhulu ngendlela embi kukho konke okwenzayo esmirk ebusweni bakho uthe konke kuwukuhamba kwakho unjengabo bonke abanye
1555,i think i would want them to be a quest maybe a chain quest on who you help do various around the black shroud showing off culture and whatnot and maybe disdain for the way are i think that would be interesting,ngicabanga ukuthi ngizofuna ukuba ngibe yisifiso mhlawumbe isifiso sokufuna amaketanga ukuthi ubani oyenzile ngokuhlukahluka okuzungeze amasiko amnyama akhombisa amasiko nangokuthi ngicabanga ukuthi lokho kuzojabulisa lokho
1556,are you seriously german and trying to tell me that your culture t have xenophobia too,ngabe unesijalimane kakhulu futhi uzama ukungitshela ukuthi amasiko akho ane-xenophobia futhi
1557,if this is what you think of you are in for a shock please read about the culture i beg cause you are embarrassing,uma ngabe yilokhu ocabanga ukuthi kuwe sekuthuselwe sicela ufunde ngesiko engilindela ukubangela ngamahloni
1558,_o_turfs _heseltine culture t change biological fact and magically allow men to become if only men could evolve out of sexually and murdering,_o_turfs _heeseltine isiko t shintsha iqiniso lemvelo futhi imilingo vumela amadoda ukuba abe uma ngabe amadoda kuphela angavela ngocansi nokubulala
1559,not a big fan of how culture gotten to the point where people treat them as real people like please remember they are acting they are a character according to a contract,hhayi fan enkulu yokuthi isiko lifinyelela kanjani iphuzu lapho abantu bebaphatha khona njengabantu bangempela bathanda ngicela ukhumbule ukuthi bangokwenza umlingisi ngokwesivumelwano ngokuya ngesivumelwano ngokuya ngesivumelwano ngokuya ngesivumelwano ngokuya ngesivumelwano ngokuya ngesivumelwano ngokuya ngesivumelwano ngokuya ngesivumelwano ngokuya ngecala
1560,i just know how a their culture is superior to they are the sick man of,ngiyazi nje ukuthi isiko labo liphakeme kanjani kulabo bayindoda egulayo ye
1561,with our misogynistic culture and the number of misogynistic i read daily i really do not care if you think i am a or not if i am i have really good for it while being tolerant should i smile too,ngesiko lethu le-minogynistic nenombolo ye-misologynistic ngifunde nsuku zonke anginendaba ngempela uma ucabanga ukuthi ngiyilungele ngempela ngenkathi ngibekezelela kakhulu lapho ngibekezelela futhi
1562,they have a culture of rape and slavery but want to blame for their character,banesiko lokudlwengulwa nobugqila kodwa bafuna ukusola umlingiswa wabo
1563,i have left a job before b c of the way people were at the organization by middle management i spoke my mind and away from good before i had another job lined up it but i was losing sleep being apart of that culture it felt wrong to stay,ngishiye umsebenzi ngaphambi kwe-b c yendlela abantu ababekhona enhlanganweni ngabaphathi abaphakathi ngikhulume ngawo futhi ngilahlekelwe yilowo nalowo msebenzi wawubeka iphutha lalelo siko kwazwa ukuthi akulungile ukuhlala
1564,our obsession with is havoc at home and abroad the how america is fanatical gun culture is havoc in other too u s gun culture with its lax gun fuel crime all across the western hemisphere,ukuqashelwa kwethu ngekhaya nasemazweni aphesheya kwe-americat how americal guture culture yisiko elinye futhi linesiko le-lax gunce curse
1565,i don t know about but living in the us i know people try to treat mythology as a hard science where one to follow a specific version of a specific interpretation that there t be more disconnected from the original culture s intent of the,angizi ngathi ngaphandle kokuhlala e-us engibaziyo abantu bezama ukwelapha izinganekwane njengesayensi enzima lapho umuntu alandele khona inguqulo ethile yencazelo ethile enqunyelwe kakhulu kwinhloso ye
1566,five s that inspired me to become an engineer five s that inspired me to become an engineer and pop culture can incredibly impact society particularly however we never really know what conversation demonstration,amahlanu akhuthaza ukuba ngibe ngunjiniyela abahlanu abakhuthaza ukuba ngibe ngunjiniyela kanye nesiko le-pop kungathinta kakhulu umphakathi ikakhulukazi noma ngabe yimuphi umboniso wokuxoxisana
1567,a lot of young men from did not get home to via,izinsizwa eziningi ezivela zazingafiki ekhaya
1568,how have and sustained a positive learn more in our new brief from _associates,bakutholile kanjani futhi bathole okuthe xaxa esikhathini esisha esisha nathi esifushane se-_associates
1569,_renae _b_bop _ stop following yt is religion few got from mostly they got it when them and took away their language culture and religion and family slavery crow used the to promote its racism,_renale_b_bop _ yima elandelayo inkolo i-yt imbalwa abayitholile ikakhulu bayitholile lapho bathatha isiko labo futhi basusa isiko labo kanye necala lomndeni walisebenzisa ukukhuthaza ubuhlanga bayo
1570,it s an open drug culture not a housing problem dealt with this ago,isiko elivulekile lezidakamizwa elingelona inkinga yezindlu elibhekele kulokhu okungezelwa
1571,like all from we keep on voting the same as if is our culture to do so,njengabo bonke kusuka esikugcinile ukuvota okufanayo nangokungathi isiko lethu ukwenza kanjalo
1572,_ true man of culture,_ indoda yeqiniso yesiko
1573,untrue the black heterosexual man been silenced in media and pop culture unless he is thuggish and aggressively ignorant very few of strong black straight men and that s what in our community,i-ebruse one obumnyama ubungqingili ubulili bethulisiwe emasiko babezindaba nawe-pop ngaphandle kokuthi yena akhuphuke futhi angenakugwemeka ambalwa kakhulu amadoda aqinile aqinile nalokho emphakathini wethu
1574,while we still mourn you hope against hope for justice we have been hit by sania is brutal murder there is no pointing your are clear as day as are the respite against the culture that your unlikely and today exhausting,ngenkathi sisalila nawe ngethemba lokuthi unethemba lobulungisa esishayiswe yi-sania akukho okukhomba kwakho kucacile njengoba kuqhathaniswa nesiko lakho elingathandeki nanamuhla
1575,the focus of marvel is show is her being a strong female lead her confidence in herself and knowing she is by family and a of her culture not even peter parker himself had the backing of aunt may or his,ukugxila kwesimanga kumbukiso wakhe ukube nguwesifazane onamandla akuholela ekuthembeni kwakhe futhi azi ukuthi ungowamindeni nasesiko lakhe hhayi ngisho nopeter parker ngokwakhe ukuxhaswa kuka-aunt kungenzeka
1576,acting like a brat in the desert episode was i d be mad too if the last piece of my culture and people went missing and possibly without me knowing after i a genocide also he s,esebenza njenge-brat esiqeshini sogwadule ngabe ngihlanya futhi uma isiko lokugcina lesiko lami futhi abantu balahleka futhi mhlawumbe ngaphandle kwami ​​bazi ngemuva kokuqothulwa kohlanga
1577,perhaps only a small minority of one particular culture those seeking money land power power over,mhlawumbe kube yinto encane encane yesiko elilodwa elifuna amandla omhlaba wonke
1578,i love the inclusion of ben parker pac man and becker georgie is death me as a i would bump stark because you become numb to death in got problematic author aside i would have added dumbledore black or harry is,ngiyakuthanda ukufakwa kweben parker pac man nobecker georgie kufa kimi njengoba bengizobumba i-blurck ngoba ubalekela ukufela umbhali we-dengwane noma uharry
1579,__culture _zayan hurry up,__culture _zayan shesha phezulu
1580,anyone agreeing with this please dont ever interact are so and selective you will cancel for wearing stuff of ur culture and i agree but when ur with a mannequin and it innocent she didnt know i hate so bad,noma ngubani ovumelana nalokhu sicela ungahlali ukhona futhi ukhetha uzokhansela ngokugqoka izinto zesiko le-ur futhi ngiyavuma kodwa lapho u-ur nge-mannequin futhi umngena khona
1581,are you ready for culture break season episode to come out in days this week our vice president brown madden executive director for the museum of about her journey to the museum,ingabe usukulungele isiko le-culke sark isiqephu sokuphuma ezinsukwini kuleli sonto isithunzi sethu esibi ngumongameli wenxusa ubrown madden oneceleni umnyuziyamu wemnyuziyamu wayo eya emnyuziyamu yini
1582,_zamu talk about cancel culture or whatever but when you say hey maybe this player should apologize for saying something there are rarely for the player but the people who call them out are to have them,_zamu khuluma ngesiko lokukhansela noma yini kepha uma uthi hey mhlawumbe lo mdlali kufanele axolise ngokusho okuthile kungatholakali ukuthi uzoba nabo
1583,_jaya_ram the congress is a curse to india is culture history and heritage and i mean it in every way proof is in the pudding,_jaya_ram the congress isiqalekiso endiya umlando wamasiko namagugu futhi ngiqonde ukuthi ngazo zonke izindlela ubufakazi buku-pudding
1584,what culture is this,yiliphi isiko lena
1585,a lot of them are of of thinking deeply rooted in our culture and as such that appeal to an norm and hierarchy of being just bristle at that because they are you do too and you think of yourself as a good leftist who,iningi labo licabanga ukuthi ligxile kakhulu emasikweni ethu futhi ngenxa yalokho lifaka isikhalazo esivumelwaneni nesigamukile sokuba yi-bristle kuphela ngoba yibona futhi futhi ucabanga ngawe
1586,he who the language the culture,lowo olimi isiko
1587,the connection between and the community was obvious and found it a great way to practice their when the surf was low it s still hard to say if really they did help cultivate the skate culture,ukuxhumeka phakathi komphakathi bekusobala futhi kwakuthola kuyindlela enhle yokwenza ukuthi i-surf ibiphansi nzima ukusho uma ngempela basiza ekuhlakuleleni isiko le-skate
1588,on a flight in the morning so getting a bit of culture whilst i can,ngendiza ekuseni ukuze uthole amasiko kancane ngenkathi ngikwazi
1589,_eubanks no office all mail goes to my home re culture a lot to unpack in a tweet but make it a priority,ama-_eubanks akukho ihhovisi yonke imeyili liya kwisiko lami lasekhaya likuningi ukukhulisa i-tweet kodwa kwenze kube yinto ebaluleke kakhulu
1590,i m so over this must must not read culture give me and i delight myself with them,mina m ngakho-ke akufanele ngifunde isiko anginike futhi ngiyazijabulisa ngabo
1591,listening to bo la nee no founder of meta giant are now available on,ukulalela ubo la nee akekho umsunguli wemeta giant manje sekuyatholakala
1592,tomorrow lot of chance is their will win the president election of her win will be the common people she to a state people of all will the culture food place attire of if she,kusasa amathuba okuthola ithuba labo lokuthola ukhetho lukamongameli lokuwina kwakhe kuzoba ngabantu abajwayelekile abe ngabantu
1593,from what i can tell about the culture of young people a lot of young men have given up on a lot of them feel like living in a fantasy world is the better option,kulokho engingakusho ngesiko lentsha ezinsizwa eziningi ziye zakhipha eziningi zazo zizwa sengathi ziphila ezweni lezimanga liyindlela engcono
1594,when your only exposure to your own culture is through the,lapho ukuvezwa kwakho kuphela kumasiko akho kudlula
1595,do not worry the wealthy work from home will enjoy your and culture and drive up your local property and housing by dumping,ungakhathazeki umsebenzi ocebile ekhaya uzojabulela amasiko akho namasiko akho futhi uqhubekele impahla yakho yasendaweni kanye nezindlu ngokulahla
1596,this is culture,lesi yisiko
1597,this hit right on the heart although i am but we are collectively killing our culture everywhere this needs to be before it is too late,lokhu kushaye ngqo enhliziyweni yize ngikhona kodwa sibulala amasiko ethu kuyo yonke indawo lokhu kudingeka kube ngaphambi kokuba kudlule isikhathi
1598,getting star treatment on tonight s espy program,ukuthola ukwelashwa kwezinkanyezi kuhlelo lwe-tonight s espy
1599,sa culture is beautiful,isiko lasesa lihle
1600,it s sick how they fiend over a different culture and skin from their own ready to create another generation of kin they can never relate to,ukugula ukuthi bayifingqa kanjani emasikweni ahlukile nesikhumba kusuka kwazo sikulungele ukudala esinye isizukulwane sekin abasoze bahlobana nabo
1601,_west _localsimpp you are one of the who want to create separation between different ethnic because you are against white you are the only one bigotry the white race does not have a culture,_west _localsimpp ungomunye wabafuna ukudala ukwahlukana phakathi kobuzwe obuhlukile ngoba uphikisana nomhlophe wena nguwena kuphela ukuba ngumjaho omhlophe awunalo isiko elimhlophe elingenalo isiko elimhlophe
1602,cancel culture is out of hand,isiko lokukhansela asiphelile
1603,put a cap on power plant pollution and lower cap year by year or else go on young people s ahead for fascism while climate chaos is everyone s future the real are making their on the of urban culture,beka i-cap ekungcoleni kwezitshalo zamandla kanye nonyaka ophansi unyaka nonyaka noma okunye qhubeka nabantu abasha abaphambili kwe-fascism ngenkathi kuyisimangaliso sawo wonke amasiko asemadolobheni
1604,culture made it is way to give it a view,isiko lenzeke liyindlela yokukunika umbono
1605,nudity is not culture,ubunqunu abusiko lesiko
1606,he is he will not give up his culture,ukuthi ngeke anikeze isiko lakhe
1607,also purity culture dumdum stuff are killing the earth,futhi izinto zokuhlanza iziko dumdum izinto zibulala umhlaba
1608,your tweet was in an article by boston,i-tweet yakho ibisesihlokweni nguboston
1609,film the pebble and the boy s music at cinema,ifilimu le-pebble kanye nomculo wabafana e-cinema
1610,was my first time at the grease pole festival and i am already thinking about next year see from this iconic buffalo celebration of culture from family made to the drama of the grease pole climb on,kwakuyisikhathi sami sokuqala egrey pole festival futhi sengivele ngicabanga ngonyaka olandelayo ngibona kusuka kulo mkhosi wesiko le-buffalo ovela emndenini owenziwe emndenini we-grease ekhreji
1611,this is the problem with black culture dude was a total and you defend him had it been a white dude most would be like dude t have run from police,le yinkinga nge-black culte dude yayiyingqikithi futhi uyamvikela ukuthi ngabe kwakuyi-dude emhlophe kakhulu kungaba njenge-dude t vele isuka emaphoyiseni
1612,_ ___colb___ are a reality are hard to come by that s why the felt this was the most meaningful of the four detail your season and you don t know when you get back the lack cohesion culture and patience,_ ___colb_____ iqiniso kunzima ukuza ngalo lena kungani amazwa ukuthi lokhu bekuyinto enenjongo kunazo zonke lemininingwane yesizini yakho futhi awunalo uma uthola ukubuyisa isiko lokubumbana nokubekezela
1613,we are talking about the us another culture trying to speak on our claim,sikhuluma nge-us elinye isiko elizama ukukhuluma ngesicelo sethu
1614,_lekhi zero tolerance on free bee is culture and no one should be for any such if still any one to be should be booked under,_lekhi-zero ukubekezelela inyosi yamahhala ngamasiko futhi akekho okufanele abe yinoma yimuphi onjalo uma ngabe kukhona okufanele abhukelwe ngaphansi
1615,cancel culture is lame away our free speech freedom of the press,isiko lokukhansela likhubazeka inkululeko yethu yokukhuluma yamahhala ye-press
1616,like or tag someone seasonal assistant corporate is to unparalleled sports and entertainment by a diverse equitable and inclusive culture,njengokuthi noma umake othile osezingeni eliphezulu umsizi ukuthi angenakuqhathaniswa nemidlalo nokuzijabulisa okungekho emthethweni ngesiko elihlukahlukene futhi elihlanganisa konke
1617,so when are we going to realize this is not only a group industry issue but an issue with a whole culture,ngakho-ke sizobona nini lokhu akuyona nje into engumkhakha yeqembu kuphela kodwa inkinga enesiko lonke
1618,fascinating cultural history panel on material culture and art at lucy on the of and mark on,iphaneli yomlando wezamasiko ethakazelisayo isiko nezobuciko e-lucy kakhulu kanye nokwenza
1619,what is this place a haven so above cloud incredible duo the country is so rich in culture bright colorful joyful people but very poor they do not worry they enjoy living got a long woman climber lis big strong she her country she many in her journey,yini le ndawo ngenhla ingaphezulu kwefu i-duo emangalisayo izwe licebile kakhulu emasikweni abantu abajabule abajabulayo kodwa abampofu kakhulu abakujabulisi ukuthi bahlale bephila ephethe izwe lakhe liningi abuya kulolo hambo lakhe?
1620,maybe not but you can go back to the beginning of and there have been seismic time again throughout it s history we live in a back in my day culture we get used to this just like we did committee adapt or die,mhlawumbe hhayi kodwa ungaphindela emuva ekuqaleni futhi kube nesikhathi sokuzamazama komhlaba futhi kuwo wonke umlando esiphila emuva ngosuku lwami isiko esikujwayelana nalokhu njengoba nje nathi senze amakomidi noma afe
1621,the stuff oh yeah there is a base of that in the culture but the fact that a ton of it just made its way onto a platform for teens when it is usually a topic for older not a coincidence,izinto oh oh yebo zinesisekelo salokho emasikweni kodwa iqiniso lokuthi ithoni lalo vele lenze indlela yayo ingena endaweni ethile yentsha lapho kuvame ukuba yisihloko esidala hhayi ngengozi
1622,the giver black culture to help you succeed common _,isiko elimnyama lomgogoze ukukusiza uphumelele evamile _
1623,i am from we thought culture and here are lovely who watched the with,ngivela ku-wacabanga amasiko futhi nangu othandekayo owabuka
1624,why people always the hard work of damn good just to get a shout out against a bunch of pop culture console i do not get it grade school was not even like this we kept that between then we went over and their box,kungani abantu behlala besebenza kanzima kamnandi nje ukuze bamemezele ukumemeza kwenqwaba yesiko le-pop isiko angikutholi isikole sasingafani nalokhu sikugcinile futhi ibhokisi labo
1625,_stroop if you are contending that a culture cannot evolve to transition cultural religious doctrine or bedrock to myth story without religious significance or weight you are intrinsically saying the identity of those people or that culture is in religiosity or consistency,_stroop uma udingida ukuthi isiko alikwazi ukuvela ekuguqukeni kwezenkolo zenkolo noma umbhede kuya ezinganekwaneni ngaphandle kokubaluleka okungokwenkolo usho ubunikazi balabo bantu noma ukuguquguquka
1626,human watch in a statement this week said a culture of impunity unaccountable security that is are responsible for a spate of extrajudicial in,ukulindile komuntu esitatimendeni leli sonto lithe isiko lokuvikeleka okungathandeki okubhekele isimo se-extrojidicicialicial in
