,src,trg
0,for anyone to seventeen it is never too late my check out the informative thread below and welcome to,ngoba noma ngubani kuya kushumi nesikhombisa akukaze afike sekwephuze kakhulu ukubheka umucu ofundisayo ngezansi futhi wamukelekile
1,kindly follow for informative and inspiring go his to see how brilliant his are,landela ngomusa ukuthi ufundise futhi ugqugquzele kuye ukubona ukuthi kukhona abahlakaniphe kangakanani
2,check out my which is designed as an informative homeopathic remedy for climate change anxiety depression despair,bheka okwami ​​okwakhelwe njengekhambi elifundisayo le-homeopathic lokushintsha kwesimo sezulu ukuguquguquka kokuntuleka kokunethemba
3,_ellwood this is more informative,_ellwood lokhu kufundisa kakhulu
4,hello your is like a baby which is not a standard for an like can please make it more informative at least include match summary ball by ball commentary and this is pretty basic for a cricket,sawubona ufana nengane engeyona indinganiso ye-ana efana nalena angayenza ukuthi ikwazi ukufundiseka okungenani okungenani kufaka phakathi i-match sumdary ball ngomqondo webhola futhi lokhu okuhle okuyisisekelo kwekhilikithi
5,thinking about turning my main into a informative political platform,ecabanga ngokuguqula inkulu yesikhulumi sezepolitiki esifundisayo
6,oh thank u it s a informative,oh ngiyabonga ufunda
7,yelling for him right after he spinning side note i love how informative onomatopoeia are at which point i would guess it was too late to stop him,ukumkholisa ngemuva nje kokuphothana kwenqwaba yenothi ngiyayithanda indlela efundisayo ye-onomatopoeia yiliphi iphuzu engingacabanga ukuthi sekwephuze kakhulu ukumvimba kakhulu ukumyeka
8,not a problem this is what i do nowadays so i try to be informative,hhayi inkinga yilokhu engikwenzayo kulezi zinsuku ngakho-ke ngizama ukufundisa
9,love following these very informative and reliable i hope this trend this is like my weather update during the pandemic,uthando ukulandela labafundisayo futhi olunokwethenjelwa ngiyathemba lo mkhuba lokhu kufana nesibuyekezo sami sezulu ngesikhathi sobhubhane
10,really awesome session i have enjoy every and give by host is very informative session,iseshini emangazayo ngempela ngijabulele njalo futhi ukunikeza ngokusingathwa yiseshini ebaluleke kakhulu
11,the original post was good and informative but i am glad that you made an,iposi lasekuqaleni lalilungile futhi linolwazi kodwa ngiyajabula ukuthi wenza
12,thank you it is very informative to my research see you in a few my dude,ngiyabonga ukuthi uyafundisa kakhulu ocwaningweni lwami ukukubona ezimbalwa
13,thank you for the review very informative,ngiyabonga ngokubuyekezwa okuhle kakhulu
14,informative keep going,iyafundisa qhubeka uhamba
15,quite informative piece,ucezu olufundisayo
16,_realestate wow thank you so much for informative ama,_realtate wow ngiyabonga kakhulu nge-ama efundisayo
17,_aisaka__ neo my informative you can try and see if you like them,_aisaka__ neo efundisayo yami ungazama futhi ubone ukuthi uyabathanda
18,great to see in something we did with our feasibility study so informative and less potential for funded by,kuhle ukubona okuthile esikwenzile ngocwaningo lwethu lokusebenza olufundisayo ngakho-ke lungakwazi ukuxhaswa ngemali
19,informative graph in this excellent thread,igrafu efundisayo kule ntambo enhle kakhulu
20,i hope everyone in and the tot thread can talk it out nicely w o being uncivil to each other i have seen the thread and yes was out of line but i do not think out of meanness maybe just out of ignorance i saw sum that were very nice and informative,ngiyethemba wonke umuntu ngaphakathi kanye nentambo ye-tot angakuxoxa kahle ngokwanele ngiyibonile ngentambo ngiyibonile intambo futhi angicabangi ngokungazi lutho mhlawumbe ngokungazi lutho futhi efundisayo
21,thank you morgan so informative well,ngiyabonga morgan efundisayo kahle
22,superb work ester keep it up love to see more of these very informative,superb work ester gcina up uthando ukubona okuningi kulaba kuyafundiseka kakhulu
23,_ our year _sixthform found it really informative thank you all,_ unyaka wethu _sixthform wakuthola kufundisa ngempela ukubonga nonke
24,_ivy but honestly who to have a cohesive and informative argument with a brick wall,_ivey kepha ngokweqiniso ukuthi uzoba nengxabano ebumbene futhi efundisayo ngodonga lwezitini
25,_mulgi__ _moksha _jay _ _nihar very informative thread,_mulgi__ _moksha _jay _ _nihar umucu ofundisayo kakhulu
26,your link in you tube to other live very informative everyone should know _,isixhumanisi sakho kuwe ishubhu komunye umuntu ofundile kakhulu wonke umuntu kufanele azi _
27,thank you so informative you re awesome,ngiyabonga kakhulu wena ofanelekile
28,needs someone like to make clear and easy to watch informative for possible new normal not just can we get this done,idinga umuntu othanda ukwenza okucacile futhi kube lula ukubukela okufundisayo ngokujwayelekile okujwayelekile hhayi nje kuphela esingakuthola lokhu
29,a very different interesting and informative episode i have not read any of carey is work and had no idea he wrote thanks for him on,isiqephu esihluke kakhulu futhi esifundisayo angifundanga lutho se-carrey umsebenzi futhi sasingazi ukuthi wakubhala ukubonga ngaye
30,very informative please watch share,iyafundisa kakhulu sicela ubuke isabelo
31,for this very informative thread,ngale ntambo efundisayo
32,sadly it s too informative for someone who it s fake news me it s data that take a while to read the opposite of me someone who of mass have been stopped by good with won t read that it s tricky times we live in,kuyadabukisa kakhulu ukuthi umuntu othile ongezindaba nge-it s fake ukuthi idatha ethatha isikhashana ukuthi afunde okuphambene nami othile omiswe kahle ngo-won t fasts
33,_d k great thread very informative,_d k i-great intambo efundiseka kakhulu
34,end of this thread hope this thread you in your data journey if you have found it informative then do like first tweet and comment what you think on this and do not forget to follow and _ for more such,ukuphela kwale ntambo kuthemba ukuthi le ntambo yohambo lwakho lwakho uma usuthole lusho ukuthi luyafana ne-tweet yokuqala futhi ubeke lokho ocabanga ngalo nakulokhu okunjalo
35,very interesting you seem to be beautiful both internally and externally information is very informative for those who have very little knowledge of onward and upward,kuthakazelisa kakhulu ukuthi ubonakala muhle bobabili ulwazi ngaphakathi nangokwangaphandle luyafundisa kakhulu kulabo abanolwazi oluncane kakhulu ngokuya phambili
36,continue being you you have great an amazing career and some very informative stuff the,qhubeka ube nguwe unomsebenzi omuhle kakhulu nezinto ezithile ezifundisayo
37,content key role in getting no matter how many we follow our content should be good engaging attractive informative call,indima ebalulekile yokuqukethwe ekutholeni noma kuba ngamangaki silandela okuqukethwe kwethu kufanele kube kuhle ukubandakanya ucingo oluhehayo olufundisayo
38,thanks for such informative video risk management remove your do not be greedy learn chart never fall for,siyabonga ngokulawulwa kwe-video enolwazi enolwazi yokususa ungabi yishadi lokufunda alikho
39,_minds thanks to the for an informative session,_minds ngenxa yeseshini efundisayo
40,don t miss this a very chill cool informative conversation between and and thoroughly how and what is all about,ungaphuthelwa le ngxoxo epholile kakhulu epholile epholile phakathi futhi futhi kahle kanjani futhi konke
41,great and informative thread,intambo enkulu futhi efundisayo
42,_tilak _for_india very informative,_tilak _for_india efundisayo
43,it was very informative and very engaging like i said this is only the start,kwakunokwazisa kakhulu futhi kuhileleke kakhulu njengoba ngishilo lokhu kuphela
44,_westwood thank you for this cool interactive and informative article,_westwood ngiyabonga ngalesi sihloko esisebenzayo esisebenzayo nesifundisayo
45,very informative thats why is best channel salute _ hack news _bagga,iyafundisa kakhulu ukuthi kungani kungcono ukubizwa kwesiteshi okungcono kakhulu _ hack news _bagga
46,nice super comprehensive informative i would also recommend like they provide a comprehensive guide to everything web,i-nice super super compleverative enomentative engangincoma njengoba inikeza umhlahlandlela ophelele kuwo wonke ama-web web
47,a spiritual monthly newspaper by sant is very good informative must read for healthy body healthy mind for spiritual growth do not miss this special edition of,iphephandaba elingokomoya elenziwa njalo ngenyanga ngesant lihle kakhulu elifundisayo kumele lifundele ingqondo enempilo enempilo yokukhula ngokomoya ungaphuthelwa yilolu hlobo olukhethekile lwe
48,very informative and helpful only and can save as a democracy,iyafundisa kakhulu futhi iwusizo kuphela futhi ingagcina njengentando yeningi
49,like y'all be linking informative but i feel y'all just do it to look smart,njengo-y'all ukuxhumanisa okufundisayo kepha ngizizwa y'all vele ukwenze ukuze ubukeke smart
50,highly informative thread,intambo efundisayo kakhulu
51,thanks for the thread very informative me understand more about trigger,ngiyabonga ngentambo enolwazi kakhulu ngiqonda kabanzi nge-trigger
52,great quick informative digestible and not cryptic at all,okuhle okusheshayo okufundisayo okufundisayo hhayi i-cryptic nhlobo
53,your was as entertaining as this was informative fun episode,kwakho ukujabulisa njengoba lokhu bekuyi-earterative fun episode
54,_coppola risk very informative as usual for us housing,ingozi ye-_coppola efundise kakhulu njengenjwayelo ngathi ezindlini
55,very informative thread on russia s new tactic of s anti aircraft for ground attack,intambo efundisayo kakhulu erussia s entsha yamaqhinga we-sach a ekugcwelekile wokugcina
56,i read your report i have to say thank you very well written very informative and insightful and no in your report which is very rare these days,ngifunda umbiko wakho kufanele ngithi ngiyabonga ubhala kahle futhi uqonda futhi awunakho kumbiko wakho okuqabukela kakhulu kulezi zinsuku
57,i love this channel very informative your face can tell you about deep health via,ngiyasithanda lesiteshi esifundisa kakhulu ubuso bakho bangakutshela ngempilo ejulile nge
58,hello again i found peter is informative and of a sound perspective and approach he the corruption around the environment and management of waste and pollution not sure why you see him as a threat to the environment,sawubona futhi ngithole ukuthi upeter uyafundisa futhi unombono ozwakalayo futhi asondele ekukhohlweni emvelweni ezungeze imvelo kanye nokuphathwa imfucuza nokungcola akunasiqiniseko sokuthi kungani umbona njengosongo emvelweni
59,thanks man it was very informative interesting,ngiyabonga indoda yajabulisa kakhulu
60,getting beauty product never been easier for informative and detailed beauty product,ukuthola umkhiqizo wobuhle akukaze kube lula kumkhiqizo wobuhle ofundisayo futhi onemininingwane
61,_ _h right because of the million people who for in most were illegal dead or multiple times that perfect sense your and t informative or enlightening they re comical entertainment for the rest of the sane people on here,_ _h kwesokudla ngenxa yabantu abayizigidi zabantu ababesefile ngokungemthetho noma amahlandla amaningi anomuzwa wakho ofundisayo noma okhanyisayo aqala ukuzijabulisa okuhlekisayo kwabanye abantu abahlaselwe lapha
62,informative video dude,i-protentirative video dude
63,i also like the relaxed optimistic tone and the computer monitor i feel like those gently ease new into the show and the give it an inviting informative feeling,ngithanda nezwi elinethemba lokuphumula kanye ne-computer monitor ngizwa sengathi lezo zibuthaka ngobumnene kumbukiso futhi iyinike inikeze imizwa efundisayo
64,excellent informative video president shill,umongameli omuhle kakhulu ofundisayo wevidiyo ushill
65,can not recommend the enough does a great job on this show and i look forward to it every day she is so informative,ayikwazi ukuncoma ngokwanele wenza umsebenzi omuhle kulo mbukiso futhi ngilangazelela ngabo nsuku zonke ufundise kakhulu
66,_r_b informative,_r_b ifundise
67,informative but he even to explain,ofundisayo kepha yena ngisho nokuchaza
68,very informative and interesting,kuyafundisa kakhulu futhi kuyathakazelisa
69,we provide all of digital marketing to all of we create both informative e commerce contact for more information visit,sinikeza konke ukumaketha kwedijithali kubo bonke sakha bobabili oxhumana naye ezokufundisa ukuthola eminye imininingwane vakashela
70,join the informative conversation case and for renewable energy and energy efficiency integration date th time a m p m,joyina icala lengxoxo efundisayo kanye namandla avuselelekayo namandla okuhlanganiswa kokusebenza kwamandla usuku th isikhathi m m m
71,really informative thread i had no idea about the gimmick where the player needs a triple deluxe save file on their to be able to even play the meta,intambo efundisayo ngempela engazange ngiyena kahle nge-gimmick lapho umdlali edinga khona kathathu deluxe gcina ifayili ukuze akwazi ngisho nokudlala i-meta
72,in addition to weather and informative would really appreciate if such road and traffic related are also via any specific handle hope my are to by the way the fare meter while i have barely travelled,ngaphezu kwesimo sezulu futhi efundisayo kungakuthokozela ngokweqiniso uma umgwaqo onjalo kanye nokuhlobene nomgwaqo nakho kutholakala nganoma yisiphi isibambo esiqondile ukuthi ngisendleleni imitha yemali ngenkathi ngihamba kancane
73,state forest,ihlathi lombuso
74,video written report poem position paper marketing plan business thesis research statement of the problem synthesis matrix apa persuasive informative feminist concept map history contemporary analysis commission,i-video ebhaliwe bika poom post premaming planp i-thesis special isitatimende sokucwaninga ngenkinga matrix apa ekholisayo efundisayo umlando wezemishini wokuhlaziywa kwabesifazane
75,i look for your they are so informative,ngibheka kwakho bafundise kakhulu
76,very sad to hear the news i have been quietly following your channel for as a diehard enthusiast and collector always the passion and quality of your thank you for endless of great and informative content for us,kuyadabukisa kakhulu ukuzwa izindaba ngilandele ngokuthula isiteshi sakho ngenxa yomthandi wediehard kanye nomqoqi njalo uthando nekhwalithi yakho yokubonga kwakho
77,informative and historically accurate u video by prof many of the primary for why the agreed upon a constitutional republic for as the ideal form of government excellent,ufundise futhi unembile ngokomlando u-video nguprof amaningi we-primary yokuthi kungani kuvunyelwene ngeriphabhulikhi yomthethosisekelo njengendlela efanelekile kahulumeni omuhle kakhulu
78,_jalen madam i have been following your they are informative do you give astrology how do i reach you i need some help,_jalen madam ebengilandela ukuthi bayafundisani ngabe unikeza izinkanyezi uzinika kanjani wena ngidinga usizo oluthile
79,_messs ___ informative,_emess ___ efundisayo
80,an informative article on the public sector in before the march one on by,i-athikili efundisayo emkhakheni womphakathi ngaphambi kokuqala komashi
81,wow thanks for the great informative response it really my,wow ngiyabonga ngempendulo efundisayo enhle ngempela yami
82,you could always post something interesting or informative,ungahlala uthumele okuthile okuthokozisayo noma okufundisayo
83,superb thread keep it up a must read and informative too,intambo enhle kakhulu igcina i-an kumele ifundwe futhi ifundise nayo
84,this is such a great informative and space for all of us,lokhu kufundisa okuhle futhi isikhala sa kithi sonke
85,the usual precise direct informative segment by the terrific corke we derive more content from a minute report from than most 'news' broadcast,ingxenye evamile eqondile efundisayo eqondile ye-corke yesabekayo sithola okuqukethwe okwengeziwe kusuka kumbiko wemizuzu kusuka ku-'neress 'shopcast
86,did you know that sunlight is white in color the colors of the sunset sunrise are the result of the phenomenon scattering may you have an informative morning _,ubuwazi ukuthi ukukhanya kwelanga kumhlophe ngombala imibala yelanga lokushona kwelanga kuwumphumela wokuhlakazeka kwento kungenzeka ukuthi ube nokufunda ekuseni?
87,this is the most informative video i have seen on middle east geopolitics and the us awesome,le yividiyo efundise kakhulu engiyibonile emiddle east geopolitics kanye ne-us awesome
88,very informative thread for utility of ammonia in a shotgun approach to my take as an resident have a in mind he is a clinical diagnosis consider surgical history and medication list when,intambo efundisayo kakhulu yokusetshenziswa kwe-ammonia esontweni isibhamu ekuthatheni kwami ​​njengoba umhlali ecabanga ukuthi ukuxilongwa komtholampilo kucatshangelwa umlando wokuhlinza kanye nemithi lapho
89,_wiki thank you very informative thread,_wiki ngiyabonga ngentambo efundisayo kakhulu
90,informative session for,iseshini efundisayo ye
91,i like this post this is what used to be useful d informative d clever and fun you got that going on thanks for this,ngithanda lokhu okuthunyelwe yilokhu okusetshenziselwa ukusebenziseka d okufundisayo d unobuhlakani futhi kumnandi ukuthi unawo lokho kubona lokhu
92,good morning and thank you for your early report on with very informative as always,sawubona futhi ngiyabonga ngombiko wakho wokuqala onolwazi kakhulu njengoba kwenzeka njalo
93,_lesley very informative thank you,_kesley efundisayo kakhulu ngiyabonga
94,_lapreety informative,_lapreetyy efundisayo
95,breakfast are very informative and therapeutic,ibhulakufesi inolwazi olufundisayo nolufanelekile
96,i have been reading quite a bit about the gut brain relationship the past few i will write about it sometime but for now this video that i found quite informative,bengilokhu ngifunda kancane ngobudlelwano bengqondo yamathumbu abambalwa edlule ngizokubhala ngakho ngesinye isikhathi kodwa okwamanje le video engiyitholile iyafundisa
97,i made the jump a couple of ago while i do not really pay attention to the sports talk on there it is generally much more positive and informative a lot less stupid people or the very least a lot less vocal stupid people,ngenze ukugxuma okumbalwa edlule ngenkathi nginganaki ngempela inkulumo yezemidlalo lapho kungcono kakhulu futhi ifundise abantu abayiziphukuphuku kakhulu noma okungenani abantu abayiziphukuphuku.
98,when i turned it in my professor tsk would me and handed me a very informative handout my first act from page to somewhere north of,lapho ngiyivula kuprofessor tssk
99,most informative thread,intambo efundisayo efundisayo
100,correction while stone is are informative their awful grammar that stone is now blocked,ukulungiswa ngenkathi itshe lifundisa uhlelo lwazo lolimi olubi ngalelo tshe manje seluvinjiwe
101,i do not know what i just watched but that was funny and informative,angazi ukuthi ngibuke yini kodwa lokho bekuhlekisa futhi kuyafundisa
102,_ great read i also found it super productive to branch out from my inner circle and start exploring other within the space photography remains at the core of what i do for sure but it is been informative and educational to build across other,_ ukufundwa okuhle ngibuye ngakuthola kukhiqiza kakhulu i-super egatsheni kusuka kumbuthano wami wangaphakathi bese ngiqala ukuhlola okunye ngaphakathi kwesithombe esisesimweni esiqinisekile kodwa kufundisa ukwakha ngaphesheya kwezinye
103,that is one more excellent informative thread from,leyo ngenye imicu emihle efundisayo evela
104,if it is something everyone is doing then by definition it is not perverse these are in high school not children is they are far more tasteful and informative then the stuff they browse on their,uma kuyinto eyenziwa yiwo wonke umuntu ngaleso sikhathi ngencazelo ayiphambukeli lezi zisesikoleni esiphakeme hhayi izingane zinambitheka kakhulu futhi zinolwazi lapho-ke izinto ababhekabheka kuzo
105,i get so at non hot and incorrect language to talk about animation without knowing how the industry medium works but at the same time i do not know what stuff would make an informative video or thread,ngithola kanjalo ngolimi olungashisi futhi olungalungile ukukhuluma nge-animation ngaphandle kokwazi ukuthi i-homeri ephakathi nendawo kodwa ngasikhathi sinye angazi ukuthi yiziphi izinto ezifunwayo
106,san supercharger right next to airport and next to target world market i love giving informative on the,san supercharger eduze kwesikhumulo sezindiza futhi eduze kokuhlose imakethe yezwe ngithanda ukunikeza okufundisayo ku-
107,informative still holding a big bag but very informative thank you,ukwazisa kusabamba isikhwama esikhulu kepha kuyafundisa kakhulu ukuthi ngiyabonga
108,yea is cute i also love to watching his channel i like how informative his video and it me to understand basic,yebo muhle ngiyathanda ukubuka isiteshi sakhe ngithanda indlela efundisa ngayo ividiyo yakhe kanye nami ukuqonda okuyisisekelo
109,a complete guide to start an rental business get a degree view of the rental market in this highly informative learn how rental technology is transforming this segment,igayidi ephelele yokuqalisa ibhizinisi lokuqasha thola ukubukwa kwesiqu kwemakethe yokuqasha kulokhu kufundisa kakhulu funda ukuthi ubuchwepheshe bokuqasha buguqula le ngxenye
110,content that is both informative and interesting can be a challenge however by understanding your audience and what they are looking for you can create content that is sure to engage them,okuqukethwe okufundisayo futhi okuthakazelisa kungaba inselelo noma ngabe kunjalo ngokuqonda izilaleli zakho nokuthi yini abafuna ukuthi ungadala okuqukethwe okuqinisekile
111,the most effective content marketing for is educational and informative providing value to the reader while the company is product,ukuthengiswa okunempilo okusebenzayo kakhulu kwezemfundo nokufundisa okuhlinzeka ngenani kumfundi ngenkathi inkampani ingumkhiqizo
112,i still enjoy following your informative impassioned commentary,ngisakujabulela ukulandela ukuphawula kwakho okufundisayo
113,because you re a talking to of course not just being informative,ngoba ukhuluma ngokukhuluma nje hhayi nje efundisayo
114,thank you all for the great support by taking time to stop by and a conservation with me at the poster session tonight hope it was informative thank you for making my first in person meeting a memorable one,ngiyabonga nonke ngokusekelwa okukhulu ngokuzinika isikhathi sokuma kanye nokulondolozwa nami esimweni seseshini yepaster kusihlwa ngiyabonga ngokwenza okokuqala
115,today live was awesome informative intelligent from very big time well spent please do take care of yourself as you were not feeling today tomorrow you will feel better,namuhla bukhole ubuhlakani obuhle obunolwazi obuqondayo kusukela ngesikhathi esikhulu kakhulu esisetshenziswe kahle ngicela uzinakekele njengoba wawungazizwa namuhla uzozizwa ungcono
116,thank you for this very informative ted talk it was very inspirational i agree with everything you said,ngiyabonga ngale nkulumo efundisayo kakhulu ye-ted kwakugqugquzela kakhulu ngiyavumelana nakho konke okushilo
117,_client hi graduate here that is my forte can also provide of my philosophical argumentative analysis informative persuasive and many more willing to help you forte here,_cuclient hi grouate lapha lapha lami lami lingani kanye nokufakaza ngokuqhawula kwami okufanele kwamandla okufanelekile kanye futhi abaningi bazimisele ukukusiza u-forte lapha
118,why i am bullish for _ well the it is very informative the art is cool the whole concept of the franchise and and seed raise and not to mention the team behind it check the,kungani nginekhono nge-_ kahle kufundisa kakhulu ubuciko bupholile wonke umqondo we-franchise kanye nembuso yembewu futhi ungasasho ukuthi iqembu ngemuva kwalo lihlola
119,_secession it would be informative to see the of people in who get the most federal,_sececession kungaba ngumfundisayo ukubona abantu abathola i-federal ebaluleke kakhulu
120,the article is very good very informative the subject matter and are discouraging i really thought we had already turned a corner and this type of thing was the exception instead of the rule,le ndatshana ilungele kakhulu izindaba zesifundo futhi iyadumaza ukuthi ngacabanga ukuthi sesivele siphenduke ekhoneni futhi lolu hlobo lwento luhlukile kunomthetho
121,thanks i just finished reading your thread about his scummy pal with the in his back yard it was very informative blood boiling that should be reading for all even the literate trump well done,ngiyabonga ngisanda kuqeda ukufunda intambo yakho nge-scummy pal yakhe egcekeni lakhe emuva kwakuwukufundisa kakhulu ukubilisa okufunwa yibo bonke ngisho ne-trump efundelwa kahle
122,thank you so much you are always informative and giving us right direction i also love your assertive approach to reply,ngiyabonga kakhulu uhlala unolwazi futhi usinikeza inkomba efanele futhi ngiyayithanda indlela yakho yokuqiniseka yokuphendula
123,this is going to be so informative looking forward to this,lokhu kuzoba okufundisayo okungcono kakhulu kulokhu
124,thank you for your incredibly intelligent and informative reply,ngiyabonga ngempendulo yakho ehlakaniphile futhi efundisayo
125,_cool mashallah so much informative thread may bless you the one who does not believe as his master cannot be a true,_cool mashallah intambo engafundiso engaka ingakubusisa lona ongakholelwa ukuthi inkosi yakhe ayinakuba yiqiniso
126,text are more informative than the,umbhalo unolwazi kakhulu kune
127,jazz give this thread a read very informative and telling,i-jazz inika le ntambo ifundwe efundisayo futhi etshela kakhulu
128,bravo superbly informative,i-bravo ifundiseka kakhulu
